Article Title,Article Link,Article Text,Article Summary,Article Image
"‘He wanted dignified exit’: Firhad Hakim resigns as Kolkata mayor, TMC says Mamata Banerjee 'permitted' him to step aside",https://timesofindia.indiatimes.com/india/he-wanted-dignified-exit-firhad-hakim-resigns-as-kolkata-mayor-tmc-says-mamata-banerjee-permitted-him-to-step-aside/articleshow/131484612.cms,"Firhad Hakim (File photo)





NEW DELHI: In another major setback to the Trinamool Congress (TMC), its senior leader Firhad Hakim on Wednesday resigned as mayor of the Kolkata Municipal Corporation (KMC), a post he had held since November 2018.The announcement was made by party spokesperson Kunal Ghosh.“Firhad Hakim requested our supremo Mamata Banerjee that he wants to resign. He wants a dignified exit as the state government is rendering the corporation defunct,” he told reporters in Kolkata.“Until now, Mamata Banerjee had not granted permission. However, after today’s administrative meeting at Nabanna, it became clear that the corporation has effectively been made defunct. In view of this situation, and to ensure that his dignity and stature are maintained, Mamata Banerjee has today permitted him to resign,” Ghosh added.Hakim, also known as “Bobby,” is a close aide of Mamata Banerjee. He is a four-time MLA from the Kolkata Port assembly constituency in the West Bengal capital.The development came on a day when the Trinamool inched closer to a split after the assembly Speaker recognised TMC rebel faction Ritabrata Banerjee as the leader of the opposition.After its defeat in the recent assembly elections, in which the party lost power after 15 years, it had appointed veteran leader Sovandeb Chattopadhyay as the leader of opposition. However, the move was opposed by the rebel faction, which alleged that their signatures were forged on documents submitted in support of Chattopadhyay’s appointment.The rebel faction reportedly comprises 59 of TMC’s 80 MLAs.In the West Bengal assembly elections, held on April 23 and 29, the BJP won 207 seats in the 294-member House to form its first government in the state.","Firhad Hakim resigns as mayor of the Kolkata Municipal Corporation. Hakim, also known as ‘Bobby,’ is a close aide of Mamata Banerjee. The development came on a day when the Trinamool inched closer to a split. The assembly Speaker recognised TMC rebel faction RitabrataBanerjee as the leader of the opposition.","https://static.toiimg.com/thumb/msid-131485101,imgsize-19952,width-400,height-225,resizemode-4/firhad-hakim.jpg"
"Congress to cadre: Ignore CJP, focus on NEET-CBSE stir",https://timesofindia.indiatimes.com/india/cong-to-cadre-ignore-cjp-focus-on-neet-cbse-stir/articleshow/131494153.cms,"



NEW DELHI: Congress plans to intensify its agitation on NEET-CBSE controversies over the next fortnight, amid a directive to party members that they should stay focused on issues pertaining to students and youth, without being distracted by plans of Cockroach Janta Party.The announcement of a physical protest by CJP in Delhi on June 6 has raised the antennae in Congress that it could be another “India Against Corruption” strategy of political rivals. Congress strategists and youth organisations have found CJP’s link to a rival, and Congress has told its members the outfit’s actions should be treated with caution. A strategist said, “We are watchful, not worried. The country has been misled once, and it cannot be misled again. ”With Rahul Gandhi leading the opposition charge on NEET-CBSE controversies, Youth Congress has hit the streets across cities that are believed to have a resonance on the twin issues.YC chief Uday Bhanu Chib kicked off a nationwide protest in Goa on May 29, and it would cover Maharashtra, Telangana, Assam, Haryana, MP, Jharkhand, Rajasthan, Chhattisgarh, Gujarat, Chandigarh, Punjab, and end with Tamil Nadu on June 20.The party’s students’ outfit NSUI too is holding protests across cities. On June 6, when CJP holds the protest, YC would hit the road in Haryana.Congress is still scarred by memories of the Anna Hazare agitation during UPA that led to creation of AAP. “The idea of others is to hype up the ‘Gen Z movement’, and then to project them as aligned with their political party. NEET is just incidental for them,” a Congress member said, adding, “But for us, NEET and demand for the education minister’s resignation are the prime issues. Ours is not a political agenda with NEET-CBSE as cover. ”",Congress plans to intensify its agitation on NEET-CBSE controversies over the next fortnight. Announcement of a physical protest by CJP in Delhi on June 6 has raised the antennae in Congress that it could be another “India Against Corruption’ strategy of political rivals.,"https://static.toiimg.com/thumb/msid-131494156,imgsize-27918,width-400,height-225,resizemode-4/131494156.jpg"
"Winds of change in West Bengal, Tamil Nadu may steady NDA's ship in Parliament",https://timesofindia.indiatimes.com/india/winds-of-change-in-west-bengal-tamil-nadu-may-steady-ndas-ship-in-parliament/articleshow/131492264.cms,"



NEW DELHI: Just when it appeared that a united opposition can derail govt's ambitious legislative age nda and disturb its narrative - drilled home by the defeat of its bill to amend women's reservation law in LS in last session - a smoother road appears to have opened up for BJP-led NDA in and outside Parliament as two of its strongest regional rivals grapple with political challenges.While former Bengal CM Mamata Banerjee-led TMC is staring at an existential threat as a rebel faction of 58 of its total 80 MLAs elected Ritabrata Banerjee as the leader of opposition against her choice, marking the first split in the party she founded it in 1998, DMK is weighing its options after Congress dumped it for Vijay-led TVK in Tamil Nadu .It was the coming together of three regional parties, Samajwadi Party besides TMC and DMK, with Congress which had sealed the fate of govt's constitution amendment bill in Lok Sabha, as they together at 185 MPs made up for over one-third of total House strength, the required number to block such a legislative measure.With TMC in disarray and DMK unlikely to be as warm to a Congress-led alliance it was so far, BJP is in a better position than ever in the House since the 2024 polls to exploit faultlines in the opposition to its advantage. There have already been murmurs that some of opposition MPs from Maharashtra are open to changing allegiance.A TMC MP told TOI that he does not see an immediate formation of a rebel group of two-third MPs, required to pass the muster under the anti-defection law, but added that it cannot be ruled out.""Nobody could have conceived such a split among TMC MLAs. So you cannot rule out anything,"" he said.The dissent, which is ostensibly directed at Mamata's perceived heir apparent and nephew Abhishek Banerjee's sway in the party, is unlikely to leave TMC's 28 MPs in LS and 13 in RS entirely unaffected, he added.In TN, DMK's main rivalry is now with TVK, a Congress ally, and the view within BJP is that it will trade its reflexive hostility to the Centre with a more pragmatic approach.The changed equation within the opposition and the recent assembly polls underlining BJP's dominant position, govt now hopes to push its ambitious legislative agenda, which includes a simultaneous elections, with renewed vigour.",Mamata Banerjee-led TMC is staring at an existential threat. DMK is weighing its options after Congress dumped it for Vijay-led TVK in Tamil Nadu. With TMC in disarray and DMK unlikely to be as warm to a Congress-led alliance.,"https://static.toiimg.com/thumb/msid-131492266,imgsize-38190,width-400,height-225,resizemode-4/131492266.jpg"
'Will work closely with Karnataka government': PM Modi congratulates DK Shivakumar for taking oath as CM,https://timesofindia.indiatimes.com/india/will-work-closely-with-karnataka-government-pm-modi-congratulates-dk-shivakumar-for-taking-oath-as-cm/articleshow/131484694.cms,"



NEW DELHI: Prime Minister Narendra Modi congratulated DK Shivakumar for taking oath as the chief minister of Karnataka on Wednesday. He assured that the Centre would work closely with the state government for people's welfare.""Congratulations to Shri DK Shivakumar for taking the oath as the Chief Minister of Karnataka. Best wishes for his tenure. The Centre will work closely with the Karnataka government for the welfare of the people,"" PM Modi said in a post on X.Congress leader DK Shivakumar was sworn in as Karnataka's 34th chief minister at a ceremony held at Lok Bhavan, ushering in a new chapter in the state's leadership. Senior Congress leader G Parameshwara also took oath as deputy chief minister.Shivakumar took the oath of office holding a copy of the Constitution of India, highlighting the importance of the occasion. The event drew a large gathering of senior Congress leaders, religious figures and dignitaries from across the country.Among those in attendance were Congress president Mallikarjun Kharge, Lok Sabha leader of opposition Rahul Gandhi and Congress general secretary (organisation) KC Venugopal, signalling the party's backing for the new government in Karnataka.",PM Narendra Modi congratulated DK Shivakumar for taking oath as the chief minister of Karnataka. He assured that the Centre would work closely with the state government for people's welfare. Senior Congress leader G Parameshwara also took oath as deputy chief minister.,"https://static.toiimg.com/thumb/msid-131484810,imgsize-1062371,width-400,height-225,resizemode-4/-.jpg"
TVK-led alliance allots Tamil Nadu Rajya Sabha seat to Congress,https://timesofindia.indiatimes.com/india/tvk-led-alliance-allots-tamil-nadu-rajya-sabha-seat-to-congress/articleshow/131483633.cms,"



NEW DELHI: The Tamilaga Vettri Kazhagam (TVK)-led alliance has allotted a Rajya Sabha seat from Tamil Nadu to its alliance partner, the Indian National Congress, ahead of the biennial elections scheduled for June 18. AICC functionary Praveen Chakravarty is likely to file nomination papers for the seat on Friday or Monday, according to Congress sources.In a statement, the alliance announced that the seat falling vacant from Tamil Nadu and set to be filled through the upcoming Rajya Sabha election has been allocated to the Congress as part of the seat-sharing arrangement within the TVK-led front. The election to Rajya Sabha seat is being held due to AIADMK leader C Ve Shanmugam's resignation.Congress Tamil Nadu, election in-charge, Girish, Chodankar, had met CM Vijay earlier in the day. ""I have just met the chief minister, and I have urged him, requested him that this seat should be allocated to us by them and then it will also help us in the Parliament in Rajya Sabha,"" he said.""I think CM should be considering our request, it looks like. Candidates' names are finalised only by the central election authority of the Congress party. The moment this seat is announced as a Congress seat, then we will request our central election committee to decide on our candidate,"" he added.The Rajya Sabha election for the seat is scheduled to be held on June 18.","AICC functionary Praveen Chakravarty is likely to file nomination papers for the seat on Friday or Monday. The election to Rajya Sabha seat is being held due to AIADMK leader C Ve Shanmugam's resignation. Congress Tamil Nadu, election in- charge, Girish, Chodankar, met CM Vijay earlier in the day.","https://static.toiimg.com/thumb/msid-131483741,imgsize-1241566,width-400,height-225,resizemode-4/-.jpg"
'Do ghaz ki doori': Adhir Ranjan Choudhary invokes PM Modi's Covid-era slogan on BJP keeping distance from rebel Trinamool MLAs,https://timesofindia.indiatimes.com/india/do-ghaz-ki-doori-adhir-ranjan-choudhary-invokes-pm-modis-covid-era-slogan-on-bjp-keeping-distance-from-rebel-trinamool-mlas/articleshow/131480675.cms,"Adhir Ranjan Choudhary (ANI)





NEW DELHI: Former West Bengal Congress president Adhir Ranjan Choudhary on Wednesday alleged that corruption allegations against some of the rebel Trinamool Congress (TMC) MLAs is forcing the Bharatiya Janata Party (BJP), which recently came to power in the state for the first time, to keep its distance from them.However, he alleged that the BJP is encouraging these legislators to form a separate group , as this would allow the saffron party to have its way in the state assembly.Choudhary's remarks come at a time when TMC supremo Mamata Banerjee , who was voted out as chief minister after 15 years in office, is facing a rebellion within the party over her choice for the leader of opposition in the assembly. Two rebel Trinamool legislators have claimed the support of 58 of the party's 80 MLAs and staked their claim to the post.""They (the TMC MLAs) are surrendering before the BJP out of fear. All these elected representatives who are now trying to form a new party face one corruption allegation or another. They want to escape these charges because earlier it was the ED and the CBI along with the BJP, and now even the CID has joined in. The Bengal Police are also involved. So they are trying to save themselves out of fear,"" he told news agency ANI.The Congress leader then invoked Prime Minister Narendra Modi's Covid-era slogan of ""do ghaz ki doori"" (a distance of two yards) to explain why the BJP is keeping its distance from the Trinamool rebels.""The BJP does not want to take them in because it knows that doing so would be like getting infected with Covid. Remember Prime Minister Modi's call, 'Maintain a distance of two yards'? So, while keeping that distance, the message is: form a separate outfit of your own. What will happen then? It will become impossible for Mamata Banerjee to have a leader of the opposition of her choice,"" he added.Banerjee has appointed veteran TMC MLA Sovandeb Chattopadhyay as the leader of opposition. However, the rebel legislators have alleged that their signatures were forged on documents submitted to the Speaker in support of Chattopadhyay's appointment.In the West Bengal assembly elections, held on April 23 and 29, the BJP won 207 seats in the 294-member House. The Trinamool Congress (TMC) was reduced to 80 seats, while the Congress managed to win only two.Banerjee was defeated by her former aide Suvendu Adhikari in her Bhawanipore bastion . Adhikari has since succeeded her as chief minister, the BJP's first in the state.",Former West Bengal Congress president Adhir Ranjan Choudhary says corruption allegations against some of the rebel Trinamool Congress (TMC) MLAs is forcing the BJP to keep its distance from them. He alleged that the BJP is encouraging these legislators to form a separate group as this would allow the saffron party to have its way in the state assembly.,"https://static.toiimg.com/thumb/msid-131480739,imgsize-48556,width-400,height-225,resizemode-4/congress39-adhir-ranjan-chowdhury-suspects-implementation-of-quoteknath-shindequot-model-in-west-bengal-amidst-tmc39s-political-crisis.jpg"
"CBSE controversy: Govt action an eyewash, sack Dharmendra Pradhan, says Cong",https://timesofindia.indiatimes.com/india/cbse-controversy-govt-action-an-eyewash-sack-dharmendra-pradhan-says-cong/articleshow/131473723.cms,"Dharmendra Pradhan

Poll Do you feel that political actions regarding education decisions affect students' lives? Yes, significantly No, not at all





NEW DELHI: Rejecting the action against the CBSE brass for the OSM controversy as an attempt to avoid fixing accountability, Congress on Tuesday reiterated its demand that education minister Dharmendra Pradhan be sacked.While Congress president Mallikarjun Kharge and Rahul Gandhi dubbed the govt action as a “cover-up” and an “eyewash”, Congress general secretary KC Venugopal called it “admission of guilt without punishing the culprit”.Congress spokesperson Jairam Ramesh lauded Gen Z for exposing Modi govt, even as he argued that “justice requires that the ‘Mantri Pradhan’ be sacked... He has been presiding over a monumentally corrupt, inept, and incompetent ecosystem that has played havoc with the lives of lakhs of youth.”",Congress rejects the action against the CBSE brass for the OSM controversy as an attempt to avoid fixing accountability. Congress reiterated its demand that education minister Dharmendra Pradhan be sacked. Congress president Mallikarjun Kharge and Rahul Gandhi dubbed the govt action as a “cover-up” and an “eyewash”,"https://static.toiimg.com/thumb/msid-131473722,imgsize-20792,width-400,height-225,resizemode-4/dharmendra-pradhan.jpg"
"After CID, ED summons Abhishek Benerjee in teachers’ recruitment case, Shantiniketan security removed",https://timesofindia.indiatimes.com/city/kolkata/troubles-mount-for-tmc-mp-abhishek-banerjee-after-cid-ed-summons-him-in-teachers-recruitment-case/articleshow/131496476.cms,"



KOLKATA: Hours after Trinamool MP Abhishek Banerjee on Wednesday moved the Calcutta High Court, seeking protection from any coercive action in the CID case of Trinamool MLA signature forgery case, the Enforcement Directorate issued summons to him in the primary teachers’ recruitment irregularity case.Banerjee was asked to appear before ED’s Kolkata zonal office on June 15.The development took place a little after the Calcutta HC allowed Banerjee to file a case, challenging the CID summons and seeking protection from any coercive action in the MLA signature forgery case.The ED launched a probe in the primary teachers’ recruitment case, based on an FIR registered by the CBI against alleged irregularities in teachers’ appointments.The same day, officers from the Kalighat Police Station removed the police kiosks, barricades, scanner machines and other surveillance equipment kept outside Shantiniketan, Banerjee’s house on Harish Mukherjee Road. The security convoy and guard rail in front of Banerjee’s house were removed earlier.On verbal prayer by Banerjee’s lawyers, a vacation bench of Justice Apurba Sinha Ray granted permission to file a petition, challenging the FIR in the signature forgery case and seeking interim protection from any coercive action by the CID.The case is likely to be heard on Friday.The CID sent the summons to Banerjee following the submission of a letter, submitted by the Trinamool to the Assembly secretariat on May 19, choosing party MLA Shobhandeb Chattopadhyay as their leader of opposition. Signed by 70-odd newly elected Trinamool MLAs, it was alleged that MLAs’ signatures were forged. A complaint was registered at the Hare Street PS.Banerjee skipped his summons to Bhawani Bhawan on Monday, citing health reasons. He reportedly sought a couple of weeks’ time to attend the summons after recovering.CID officers on Saturday personally handed the summons at his Kalighat home on Saturday afternoon. In the evening, during his visit to Sonarpur to meet the family of a Trinamool worker, who was allegedly killed in post-poll violence, he was attacked with stones and eggs.","Banerjee was asked to appear before ED’s Kolkata zonal office on June 15. Calcutta HC allowed Banerjee to file a case, challenging the CID summons and seeking protection from any coercive action in the MLA signature forgery case.","https://static.toiimg.com/thumb/msid-131496585,imgsize-37866,width-400,height-225,resizemode-72/tmc-mp-abhishek-banerjee.jpg"
