Article Title,Article Link,Article Text,Article Summary,Article Image
Will Travis Kelce and Taylor Swift attend Selena Gomez and Benny Blanco's wedding or dodge the spotlight?,https://timesofindia.indiatimes.com/sports/nfl/news/will-travis-kelce-and-taylor-swift-attend-selena-gomez-and-benny-blancos-wedding-or-dodge-the-spotlight/articleshow/122507052.cms,"Selena Gomez and Benny Blanco's upcoming wedding has everyone anticipating Taylor Swift and Travis Kelce's attendance (Getty Images)

Taylor Swift and Selena Gomez’s bond runs deep—and wedding invites are no exception

Travis Kelce becomes the unexpected plus-one fans can’t stop talking about

Travis Kelce’s wedding preferences give insight into the timing

As Selena Gomez gears up to tie the knot with music producer Benny Blanco, all eyes are on the guest list—and one couple in particular is drawing more attention than the bride’s gown. Taylor Swift , Gomez’s longtime best friend, is expected to attend the high-profile wedding. But whether she’ll show up with NFL superstar Travis Kelce remains a hot topic of speculation.Selena Gomez and Taylor Swift have shared a famously close friendship for over 15 years. From red carpet moments to heartfelt social media tributes, their relationship has weathered breakups, career shifts, and industry drama. Naturally, Swift is rumored to play a major role in Selena’s wedding day. In fact, back in 2023, she jokingly volunteered for flower girl duties, saying she’d “do anything for her.”While fans are anticipating Swift’s attendance, her jam-packed schedule may complicate things. With recent moves like reclaiming her master recordings and keeping up with the Eras Tour, Taylor’s calendar is more stacked than ever. Still, insiders insist she’s doing everything she can to be there for Gomez’s big day.Enter Travis Kelce—Super Bowl champion, podcast host, and Swift’s high-profile boyfriend. The Kansas City Chiefs tight end has been by Swift’s side at major public events, from football games to star-studded dinners, including one in New York where the couple joined Gomez.Now, speculation is mounting that Kelce could accompany Swift to Selena’s wedding, making them the ultimate power couple on the guest list. A recently circulated wedding seating card reading “Taylor and Travis Kelce” briefly sent the internet into a frenzy, with rumors of a secret wedding swirling. But celebrity planner Ellie Nottoli quickly shut it down, noting it was simply a misinterpreted moment from another event.On his popular “New Heights” podcast, Kelce has previously weighed in on wedding dates, saying, “I actually don't know people who've gotten married in the fall. My friends always do it in the summer... I’m not sure if the fall is a good wedding season.” That sentiment bodes well for Gomez’s rumored summer wedding and adds fuel to the fire that Kelce may attend.This isn’t just a celebrity wedding—it’s a convergence of pop and sports royalty. Selena Gomez is embracing a new chapter with Blanco, while Taylor Swift and Travis Kelce’s evolving relationship continues to dominate headlines. Whether Swift and Kelce arrive hand-in-hand or send their regrets, their presence—or absence—will undoubtedly shape the narrative around what’s poised to be one of Hollywood’s most talked-about nuptials of the year.Also Read: Will Blake Lively ever cheer for Travis Kelce again? Taylor Swift’s NFL game days may no longer include her former best friend","Selena Gomez and Benny Blanco's upcoming wedding has everyone anticipating Taylor Swift and Travis Kelce's attendance. Swift is rumored to play a major role in Selena’s wedding day. Kelce has previously weighed in on wedding dates, saying, “I actually don't know people who've gotten married in the fall.”","https://static.toiimg.com/thumb/msid-122513456,imgsize-58566,width-400,resizemode-4/122513456.jpg"
Who is Azealia Banks? Viral rapper making headlines with Conor McGregor in 2025,https://timesofindia.indiatimes.com/sports/international-sports/who-is-azealia-banks-viral-rapper-making-headlines-with-conor-mcgregor-in-2025/articleshow/122509547.cms,"Who is Azealia Banks? Viral rapper making headlines with Conor McGregor in 2025 (Image via IG)

Azealia Banks began her music journey after growing up in Harlem

, ""Gimme a Chance,""

Azealia Banks accuses Conor McGregor of sending explicit images



Azealia Banks is once again trending online, and it’s not just because of her music. Renowned for her controversial opinions and sudden scandals, the American rapper is under investigation following a serious charge against a former UFC champion. Though many know her name, not many are totally familiar with her life narrative, career path, and the causes she often finds herself at the heart of social media storms.Born on May 31, 1991, in Harlem, New York City, Azealia Banks was reared with two sisters. Her mother reared her following her father's death from cancer when she was still rather young. Her early years were tough; she left home at just fourteen to live with her sister. Initially considering herself as an actress, she took part in theater performances.But her love of music ultimately prevailed. Under the name Miss Banks, Azealia Banks released her first songon Myspace in 2008. XL Recordings signed with her that year. Her breakthrough came in 2011 when her song ""212"" went viral all around.Also Read: UFC Legend Conor McGregor Scandal Erupts After Azealia Banks Posts Shocking Nudes With Claims For Sexual Harassment Her mixtapes showcasing her unique combination of rap, house, and electronic music came after her debut album, Broke with Expensive Taste.A major player in the music business, Azealia Amanda Banks has repeatedly garnered praise throughout the years for her unique voice and strong words.Azealia Amanda Banks caused controversy on July 14, 2025 by leveling harsh allegations against Conor McGregor, a retired Irish MMA warrior. She reported that Conor McGregor threatened her later on social media and sent her unasked nude images.Both supporters and opponents of Azealia Banks's openly shared pictures reacted differently. Her most recent argument has put her at the front and centre once more and sparked discussions on cyber safety, celebrity behaviour, and bullying.Azealia Banks has never shied to express her opinions and has always been open about her issues even when she was well-known. In both music and social media, she remains a forceful, unashamed figure in the entertainment business.","Azealia Amanda Banks caused controversy on July 14, 2025 by leveling harsh allegations against Conor McGregor. She reported that Conor McGregor threatened her later on social media and sent her unasked nude images. Her most recent argument has put her at the front and centre once more and sparked discussions on cyber safety, celebrity behaviour, and bullying.","https://static.toiimg.com/thumb/msid-122509464,imgsize-596733,width-400,resizemode-4/122509464.jpg"
"""Onlyfans leaks would be fire"": Joy Taylor gets axed by Fox Sports and fans already know her future career move",https://timesofindia.indiatimes.com/sports/nfl/news/onlyfans-leaks-would-be-fire-joy-taylor-gets-axed-by-fox-sports-and-fans-already-know-her-future-career-move/articleshow/122518887.cms,"Fox Sports cuts ties with Joy Taylor (Instagram)

A sudden exit amid legal turmoil and programming shakeup



Fans think her next career is already known



Joy Taylor becomes the center of internet discussion (Image via X)

In a stunning development that’s shaking up FS1’s on-air lineup, Joy Taylor has officially parted ways with Fox Sports. The move comes as the network embarks on a widespread reshuffle, axing multiple shows—including Speak, which Taylor co-hosted. Her exit also closely follows a months-long legal controversy involving allegations made against a former Fox Sports executive and Taylor’s name surfacing in the lawsuit. While Taylor’s departure was reportedly tied to the expiration of her contract, the timing has raised eyebrows across the industry.Taylor had been a key presence on Speak since 2022, sharing the desk with former NFL star Keyshawn Johnson and ex-NBA player Paul Pierce. But the show, along with Breakfast Ball and The Facility, is now being scrapped as part of Fox Sports’ latest cost-cutting and content realignment strategy. The Athletic first broke the news, revealing Taylor’s contract would not be renewed. The exit comes just months after serious allegations from a former Fox Sports hairstylist, Noushin Faraji, rocked the network.Faraji accused then-Fox Sports executive Charlie Dixon of groping her during a party held for Taylor in 2017.In a troubling twist, Faraji also claimed Taylor dismissed her accusation and was allegedly involved in an extramarital affair with Dixon—an affair Faraji claimed contributed to Taylor’s rise to her former Undisputed moderator role. Additionally, Taylor was accused of mocking Faraji’s accent and her PTSD-related behaviors.Taylor firmly rejected the claims, with a spokeswoman stating, “The claims set forth against Ms. Taylor are devoid of merit and appear to have been strategically framed to create unwarranted publicity rather than to seek legitimate redress.” Despite the public stir, Taylor kept her composure, opting for measured statements. “I know that the public has a lot of interest in this situation,” she told The Cut. “But I have to let the legal process play out. ”After a brief two-week absence from air earlier this year, Taylor returned, fueling speculation about internal deliberations over her contract. A report from Front Office Sports had earlier mentioned her deal was due to expire this summer, which now appears to have marked her quiet exit.The Internet is going crazy after her exit. Users have come up with different thoughts but a major portion of them already let others know what they think of about her future career.One user @coldcallsniper commented, ""Incoming OF."" A second one having username @Jerryjo58719446 added, ""Joy taylor onlyfans leaks would be fire."" Another named @0usports echoed the same by saying, ""She can take her career to onlyfans now.""In recent months, Taylor had become more outspoken beyond sports commentary. On her Two Personal Show, she made headlines by suggesting the legalization of sex work as a remedy for male loneliness. On The Truth After Dark podcast, she remarked that religious men were a dating red flag for her—despite identifying as a “person of faith” herself. These bold views have both intrigued and polarized her fan base, marking a noticeable shift in her public persona.As Fox Sports closes a chapter, the media landscape is now watching to see where Joy Taylor lands next—and whether the controversies surrounding her will fade or follow her forward.Also Read: Taylor Swift snubs Kamala Harris plea, but plays house entertainer for Travis Kelce’s NFL frat party","Joy Taylor has officially parted ways with Fox Sports. The move comes as the network embarks on a widespread reshuffle, axing multiple shows. Her exit also closely follows a months-long legal controversy involving allegations made against a former Fox Sports executive and Taylor's name surfacing in the lawsuit.","https://static.toiimg.com/thumb/msid-122521407,imgsize-16222,width-400,resizemode-4/122521407.jpg"
Is Tom Brady quietly backing Donald Trump? NFL legend’s Club World Cup appearance fuels speculation,https://timesofindia.indiatimes.com/sports/nfl/news/is-tom-brady-quietly-backing-donald-trump-nfl-legends-club-world-cup-appearance-fuels-speculation/articleshow/122507546.cms,"Tom Brady attended a soccer match with Donald Trump (Getty Images)

Revisiting the MAGA hat controversy and Donald Trump connection

Tom Brady’s evolving stance and clarification over the years

Antonio Brown and the 2024 campaign connection

Tom Brady’s surprise appearance at the Chelsea vs. PSG Club World Cup final on July 13 didn’t just draw attention from soccer fans—it reignited a political firestorm. The NFL icon was spotted watching the high-profile match from none other than President Donald Trump’s private suite, alongside First Lady Melania Trump, Trump’s son-in-law Jared Kushner, and FIFA president Gianni Infantino.While Tom Brady has long maintained silence on his political views, his presence in Donald Trump’s VIP box, flanked by Republican power players, has once again raised the question: is Tom Brady a Trump supporter?Brady’s alleged political leanings have stirred public curiosity since 2015, when a red “Make America Great Again” cap was seen in his locker during a media interview. At the time, he explained on WEEI radio: “He always gives me a call and different types of motivational speeches at different times. So now that he’s running for president, he sent me a hat, and he gave it to [Patriots owner Robert Kraft] a couple weeks ago. So it found its way to my locker.”Brady called Trump “a hell of a lot of fun,” but stopped short of explicitly endorsing him. Still, the moment marked the beginning of a long-running debate about where Brady stands politically.Fast-forward to 2022, Brady attempted to clarify his political image in a candid interview with Variety.“I think [the press] just mischaracterized a lot. And my personality isn’t ever one to insult anybody,” he said. “There are things that I agree with. There are things that I don’t… I’m really responsible for what I say.”Brady emphasized he hadn’t “talked to [Trump] in a lot of years,” signaling distance, if not disavowal. His nuanced response highlighted a desire to stay out of political polarization without fully severing ties.Former teammate Antonio Brown—never one to shy away from controversy—claimed on the Fearless podcast that Brady was involved in a call with Trump during the 2024 election run. Brown, who openly supports Trump, said of Brady: “Yeah, definitely,” when asked if the quarterback backed Trump.Despite these recent headlines, Tom Brady has never formally endorsed any candidate. His calculated ambiguity may be a reflection of his brand—one built on universal appeal. But with recurring proximity to Trump, questions around his political identity are unlikely to fade any time soon.Also Read: Sofía Vergara’s connection to Tom Brady deepens as reports claim she already met his daughter Vivian",Tom Brady was spotted at the Chelsea vs. PSG Club World Cup final with Donald Trump. The NFL star has long maintained silence on his political views. Former teammate Antonio Brown claimed Brady was involved in a call with Trump during the 2024 election run.,"https://static.toiimg.com/thumb/msid-122513645,imgsize-27886,width-400,resizemode-4/122513645.jpg"
Philadelphia Eagles star Lane Johnson goes viral after lifting 705 pounds like it’s no big deal,https://timesofindia.indiatimes.com/sports/nfl/news/philadelphia-eagles-star-lane-johnson-goes-viral-after-lifting-705-pounds-like-its-no-big-deal/articleshow/122541726.cms,"Philadelphia Eagles star Lane Johnson goes viral after lifting 705 pounds like it’s no big deal (Image via Getty)

Lane Johnson lifts 705 pounds like it’s nothing during Eagles workout session

“a monster” and “not human.”

Lane Johnson’s viral moment sparks wild reactions across social media

Philadelphia Eagles offensive tackle Lane Johnson has just gone viral, and it’s not for something on the football field. A new video of Johnson powering through a 705-pound lift is leaving fans completely shocked. The insane moment was shared across social media on July 15, 2025, and quickly gained traction for one simple reason, most people have never seen that kind of strength so effortlessly displayed.Philadelphia Eagles star Lane Johnson was seen executing a huge 705-pound lift during a strength exercise on Monday, July 15, 2025. Shared by several NFL insiders and sports sites including @MLFootball and Bleacher Report, the video shows the 34-year-old right tackle surprisingly easily moving a great amount of weight. No conflict. Without reservation. Simply sheer strength.In the short clip, Johnson completes the lift while his trainers and teammates look on in amazement. Some fans online were quick to label himOthers joked that NFL defenders should be afraid when Johnson lines up this fall. The Eagles’ veteran has always been known for his intense workouts, but this video gave people a closer look at just how powerful he really is.DraftKings and NFL training records show Johnson has kept consistent in the weight room even during the offseason, so preserving his image as among of the strongest linemen in football. His performance is only a few weeks before the Eagles report for training camp in late July.Lane Johnson is no stranger to fan attention, but this 705-pound lift sent his name trending across Twitter, Instagram, and TikTok on Tuesday morning. NFL fans, trainers, and even former players praised the Eagles star for his incredible physical strength and discipline.One fan posted, “That’s not even lifting anymore… that’s a superpower.” Another commented, “Lane Johnson might be stronger than your favorite superhero.”Also Read: Philadelphia Eagles' Star Lane Johnson: ""Looking Forward To Many More Years To Come"" Expected to play a significant role again in the NFL season of 2025, Lane Johnson assisted the Eagles to make their Super Bowl appearance in 2023. Fans are more eager than ever to view what he adds to the field this year as snippets like this go viral.His quiet focus, mixed with monster strength, just might be the Eagles’ secret weapon in 2025.","Philadelphia Eagles star Lane Johnson was seen executing a huge 705-pound lift during a strength exercise on Monday, July 15, 2025. The video shows the 34-year-old right tackle surprisingly easily moving a great amount of weight. Some fans online were quick to label him “a monster” and “not human”","https://static.toiimg.com/thumb/msid-122541690,imgsize-1994720,width-400,resizemode-4/122541690.jpg"
"“Stung your a**”: Channing Crowder torches Hallie Aiono, accuses her of using pregnancy to scam NFL star Puka Nacua",https://timesofindia.indiatimes.com/sports/nfl/news/stung-your-a-channing-crowder-torches-hallie-aiono-accuses-her-of-using-pregnancy-to-scam-nfl-star-puka-nacua/articleshow/122540169.cms,"Channing Crowder torches Hallie Aiono (Image via Bleacher Report)

Hallie Aiono files for full physical custody amid paternity questions

Channing Crowder doesn’t hold back, calls the situation a “spider’s web”

The Pivot talks Cam’s words on Jayden, Puka’s miss, Tyler Lockett's 30 years discipline, Naomi Osaka

Ryan Clark joins in, slams Hallie Aiono with harsh words

In a jaw-dropping segment from The Pivot Podcast, former NFL linebacker Channing Crowder tore into Hallie Aiono, the pregnant girlfriend of Los Angeles Rams star Puka Nacua, following her paternity petition filed in Los Angeles County last month. The 18-year-old wide receiver, known for his breakout rookie season, now finds himself in the middle of a growing controversy that extends far beyond the football field.Hallie Aiono, who began dating Nacua during his college days at BYU, filed a paternity suit on June 16, requesting legal confirmation of Nacua's paternity, full physical custody of their unborn son, and shared legal custody covering education, healthcare, and financial expenses.This follows her emotional Mother’s Day Instagram post, in which she wrote, “You were something we always dreamt of, but I have never been so afraid... I can’t wait to love you forever, my sweet boy.”The story took a turn after Crowder made his views clear, casting serious doubt on Aiono’s intentions and character during Saturday’s podcast episode.Crowder held nothing back as he speculated on Aiono’s behavior and what it could have meant for Nacua’s future.He even suggested that the Rams receiver was fortunate to escape long-term financial entanglement.“Congratulations, brother. You got out the spider’s web before it stung your ass,” Crowder said. “She helped him out with this... You don’t even know who was skating in you and when you got skated in.”According to Crowder, the situation saved Nacua from potentially paying child support for 18 years. “This was great for him. Think about it. 18 years. If he had paid for this baby and did all this—18 years. 18 years,” he emphasized.Crowder also brought cultural context into the conversation, highlighting Polynesian values of family loyalty and the pressure Nacua might have felt to stay with Aiono had he believed the child was his.Former Pittsburgh Steelers safety Ryan Clark echoed the criticism, questioning Aiono’s commitment during her relationship with Nacua.“If you were in it for the money, you had one job,” Clark said. “Y’all were together all over the NFL sites... The one job you had was to not have sex with somebody else... and you couldn’t wait.” He ended his remarks by saying, “I pray that’s not your baby.”Also Read: “Cracker of the day”: Aaron Rodgers slammed for mocking kid at golf event as Antonio Brown fires off racially charged insult While Nacua has remained silent publicly, the fallout from this paternity battle is escalating—and judging by the voices now weighing in, it’s only just begun.","Former NFL linebacker Channing Crowder tore into Hallie Aiono, the pregnant girlfriend of Los Angeles Rams star Puka Nacua. Crowder called the situation a “spider’s web” and suggested that Nac Hua was fortunate to escape long-term financial entanglement. Former Pittsburgh Steelers safety Ryan Clark echoed the criticism.","https://static.toiimg.com/thumb/msid-122541967,imgsize-122016,width-400,resizemode-4/122541967.jpg"
Jared Goff and wife Christen Harper celebrates birth of baby girl — Meet Romy Isabelle Goff,https://timesofindia.indiatimes.com/sports/nfl/news/jared-goff-and-wife-christen-harper-celebrates-birth-of-baby-girl-meet-romy-isabelle-goff/articleshow/122542238.cms,"Jared Goff and wife Christen Harper welcome baby girl (Getty Images)

Jared Goff’s fatherhood journey begins as wife Christen Harper delivers baby girl ahead of NFL season



A journey of love, milestones, and fatherhood dreams fulfilled



Detroit Lions quarterback Jared Goff is entering a new and more personal chapter of his life — fatherhood. Goff and his wife, Christen Harper, joyfully welcomed their first child, a daughter named Romy Isabelle Goff. The couple shared the heartwarming news on Instagram with a series of black-and-white photographs, showcasing tender family moments. Their announcement, just weeks before the start of NFL training camp, has captured the attention of both fans and fellow NFL families.In a coordinated Instagram post on Tuesday, Jared and Christen introduced baby Romy to the world. The post included intimate moments — a tiny newborn hand clutching Christen’s finger, Jared cradling his daughter, and the new family of three sharing a peaceful moment in bed. Jared proudly wore a ""Girl Dad"" hat, already embracing his new role.Christen, overcome with emotion, shared in her Instagram Story, ""Heart is bursting into a million pieces!!!!!"" The background song she chose, “Green Eyes” by Coldplay, subtly hinted at one of Romy’s features, adding an extra personal touch to the reveal.Although they kept the exact birth date under wraps, the couple’s joy was unmistakable. NFL WAGs and friends rushed to the comments with congratulatory notes.Olivia Culpo, who recently welcomed a baby with 49ers star Christian McCaffrey, wrote, “Congratulations!!!” Camille Kostek, longtime girlfriend of Rob Gronkowski, added, “My heart 🥹🫶🏼 I love you guys and baby Romy 🎀.” Anna Kupp, wife of Cooper Kupp, also shared, “The most precious gift. So happy for you both! 🤍”The couple’s love story began in 2019 after meeting through the exclusive dating app Raya. Jared proposed in 2022 during a getaway with friends, and the two tied the knot in a scenic Ojai, California wedding on June 22, 2024. Just months later, their dream of starting a family became reality.Back in February, the pair revealed to PEOPLE during the NFL Honors that they were expecting. Jared shared, “I'm looking forward to becoming a dad,” while Christen added, “We're just excited to enjoy this special time together and just soak up every second.”Goff had long envisioned himself as a father. “I've always dreamt of becoming a dad. Now that it’s real, I know it'll add a new perspective to life, and it'll be great,” he told PEOPLE.As the NFL season looms, Goff has just enough time to enjoy his first days of fatherhood before returning to the field, where he’ll once again balance the roles of leader — both on the gridiron and now, at home.Also Read: So Long, London or so long, Bill? Jordon Hudson’s Taylor Swift lyrics post fuels rumors of split from Bill Belichick","Jared Goff and wife Christen Harper welcomed their first child, a daughter named Romy Isabelle Goff. The couple shared the heartwarming news on Instagram with a series of black-and-white photographs, showcasing tender family moments. Goff had long envisioned himself as a father, saying, ""I've always dreamt of becoming a dad""","https://static.toiimg.com/thumb/msid-122542251,imgsize-24034,width-400,resizemode-4/122542251.jpg"
