Article Title,Article Link,Article Text,Article Summary,Article Image
Himachal Pradesh: Canadian paraglider dies; 2 foreign pilots rescued,https://timesofindia.indiatimes.com/india/himachal-pradesh-canadian-paraglider-dies-2-foreign-pilots-rescued/articleshow/124731172.cms,"Caught On Cam: Paraglider Hits Power Line, Crashes Into Red River In Fiery Scene

KULLU: A 27-year-old Canadian paraglider died after crash-landing into the Dhauladhar mountains in Himachal Pradesh last week, while two foreign pilots were rescued from the upper reaches of Kangra and Kullu districts on Monday. In keeping with her wishes, Megan Elizabeth from Canada was cremated in Bir as per Hindu rituals on Tuesday.All three paragliders had taken off from the 8000-ft Bir-Billing site near Dharamshala, which draws adventure-seekers from across the world. Elizabeth took off at 9.45am Saturday (Oct 18), but was forced to crash-land below a rocky cliff in the Dhauladhar mountains, around 40km away, at an altitude of 4,000m (13,120ft).A search and rescue operation was launched as soon as Kangra administration was informed of the accident. A team from Billing Paragliding Association (BPA) carried out helicopter sorties in the Dhauladhar mountains and dropped its leader, Rahul Singh, near the site where Elizabeth had crash-landed on Saturday evening, as there was no space for landing a chopper. Singh was to find Elizabeth and help her survive until a full rescue team arrived, but he couldn’t locate her and spent the night on a cliffside.On Sunday morning, four more BPA team members were air-dropped, and they managed to locate her body.“Elizabeth was forced to crash-land either due to a sudden weather change or because of a problem with her glider. She used the reserve glider while crash-landing, but I guess she was flying at a low altitude and hit the rocks while landing. She sustained serious head injuries,” said BPA founder-director Suresh Thakur.BPA members carried Elizabeth’s body down for over 1,000m (nearly 3,300ft) until a chopper could airlift it to Kangra, where an autopsy was conducted. The two paragliders rescued Monday were Russian Nikita Vasiltsov and Austrian Jakob Krammer. Nikita (38) had crash-landed near Patalsu peak in Pir Panjal range near Manali, around 70km from where he took off, at an altitude of around 4,000m.Hundreds of ‘free flyers’ (solo pilots) from around the world gather in Bir-Billing in Oct every year, which is considered the best time for cross-country flights. However, Bir-Billing has seen frequent paragliding accidents and fatalities.In the past decade, over a dozen solo paragliders — mostly foreign nationals — have died after taking off from Bir-Billing, six of them in the last three years.","Megan Elizabeth, 27, died after crash-landing into the Dhauladhar mountains in Himachal Pradesh last week. Two foreign pilots were rescued from the upper reaches of Kangra and Kullu districts on Monday. In keeping with her wishes, Elizabeth was cremated in Bir as per Hindu rituals on Tuesday.","https://static.toiimg.com/thumb/msid-124731170,imgsize-135587,width-400,resizemode-4/-.jpg"
Double delight as 2 comets captured over Indian skies,https://timesofindia.indiatimes.com/india/double-delight-as-2-comets-captured-over-indian-skies/articleshow/124731183.cms,"In the season of the festival of lights, two rare comets are illuminating the skies over India (and the rest of the world). Both comets — C/2025 R2 (SWAN) and C/2025 A6 (Lemmon) — can currently be seen through binoculars from dark sky locations and are expected to be at their brightest this week.TOI captured both these icy outer-space visitors on camera on the trekking route to Dayara bugyal near Uttarkashi in Uttarakhand last week. These are among the first wide-angle visuals of the comets clicked from India. While both have a characteristic tail, its currently more prominent in comet Lemmon.SWAN isn’t expected to return to our solar system in 20,000 years while the next chance for observers on Earth to catch a glimpse of Lemmon will be in the year 3175. This is a double delight for stargazers as it’s rare for two large comets to appear in the sky at the same time. Both comets had their closest flyby of Earth over the past two days, SWAN on Monday and Lemmon on Tuesday.There’s uncertainty over whether these dusty snowballs will get bright enough to be seen with naked eyes. Some estimates suggest that Lemmon may brighten further.Lemmon is the brighter of the two with a current visibility of magnitude 4.5, as per SpaceWeather.com, which technically puts it in visual range.In the -1 to 10 apparent magnitude scale, any celestial object of a magnitude below 6.5 should be visible to the eye. However, as per most accounts, the comet can currently be only seen through a pair of binoculars or a telescope. However, both show up in long-exposure camera shots.The best time to view the comets this week is an hour after sunset, around 7pm. Lemmon appears in the northwest horizon in the Bootes constellation, close to the ‘handle’ of Big Dipper (Saptrishi). It sets around 7.45pm. SWAN is currently a little higher up in the sky, just above the teapot-shaped Sagittarius constellation in the southern horizon.The most recent comet visible to the naked eye was C/2020 F3 (NEOWISE) that made an appearance in mid-2020. If it gets any brighter, Lemmon may be the next truly visible comet.The next few days will tell.","Both comets had their closest flyby of Earth over the past two days, SWAN on Monday and Lemmon on Tuesday. Lemmon is the brighter of the two with a current visibility of magnitude 4.5. SWAN isn’t expected to return to our solar system in 20,000 years.","https://static.toiimg.com/thumb/msid-124731181,imgsize-1469307,width-400,resizemode-4/-.jpg"
Bihar Assembly polls: 11 seats where INDIA bloc partners are fighting among themselves,https://timesofindia.indiatimes.com/india/bihar-assembly-polls-11-seats-where-india-bloc-partners-are-fighting-among-themselves/articleshow/124729296.cms,"PATNA: As the nomination window for the second and final phase of the Bihar assembly elections closed on Oct 20, Bihar CM Nitish Kumar launched the NDA’s poll campaign from Muzaffarpur, but the opposition INDIA bloc allies were embroiled in conflicts and contradictions.There are at least 11 seats where INDIA bloc partners are fighting against each other, much to the confusion of voters. RJD is likely to battle Congress nominees in four seats, and VIP candidates in three. Congress is locked in a straight fight with CPI in four other seats, much to dismay of top INDIA bloc politicians.The seats where INDIA bloc partners would face each other include Vaishali, Sikandara, Kahalgaon, Narkatiaganj, Rajapakar, Bachhwara, Biharsharif, Kargahar, Chainpur, Babubarhi, and Gaura Baura, although there are chances that some candidates may withdraw from the contest as two days are still left for the last date for withdrawal of candidature (Oct 23) for the second phase.With less than a fortnight for campaigning to close, all opposition “top guns” seem to be falling silent and are missing from the campaign scene.RJD’s and Congress’s social media accounts also appear to be largely inactive, with only old slogans being recycled and the visible aggression noticed during the Voter Adhikar Yatra missing. Lack of clarity over the official start of the opposition’s campaign has left candidates to fend for themselves and campaign at their own level.“We are preparing the campaign programme, it will be out very soon,” senior RJD politician Chitranjan Gagan said, but didn’t reveal when campaign would be launched.","Bihar CM Nitish Kumar launched the NDA’s poll campaign from Muzaffarpur. Opposition INDIA bloc allies were embroiled in conflicts and contradictions. RJD is likely to battle Congress nominees in four seats, and VIP candidates in three. Congress is locked in a straight fight with CPI in four other seats.","https://static.toiimg.com/thumb/msid-124729295,imgsize-1239954,width-400,resizemode-4/-.jpg"
Congress pulls out of J&K bypoll for ally NC,https://timesofindia.indiatimes.com/india/congress-pulls-out-of-jk-bypoll-for-ally-nc/articleshow/124728157.cms,"JAMMU: Congress has stepped aside from the Nagrota assembly bypoll in J&K on Nov 11 for governing ally National Conference (NC), citing “the larger goal” of defeating BJP.The decision was taken Monday, the last date to file nominations for the seat where the bypoll was necessitated by the death of its sitting BJP MLA Devender Singh Rana on Oct 31 last year, only three weeks after being elected.Rana’s daughter Devyani is the BJP nominee this time among 12 in the fray that includes Anil Sharma, a party rebel who will contest as an independent.Congress opted out despite being offered the seat by CM Omar Abdullah’s NC. J&K chief Congress (JKPCC) spokesperson Ravinder Sharma stressed the need to counter BJP. “The decision follows detailed deliberations over a JKPCC report and after considering various factors, including that NC had emerged second in Nagrota in the 2024 assembly elections,” Sharma said.The move comes days after strains between the allies over Oct 24 polls for four Rajya Sabha seats from J&K, with Congress claiming it was not offered a “safe” seat and NC finally fielding candidates for all slots.In Nagrota, previous BJP MLA Rana had a good standing and had won last year by over 31,000 votes. BJP has won the seat thrice in all -- in 2002, 2008 and 2024. NC came up trumps twice, in 1996 and 2014.This time, the NC has fielded Shamim Begum. She filed her nomination on Monday.Other key contestants include Joginder Thakur of AAP, Qari Zaheer Abbas Bhatti of Forward Bloc and Bodh Raj of Apni Party. BJP rebel Sharma is among five independents.The nominations will be scrutinised on Wednesday, followed by withdrawals, if any, on Friday. Votes will be counted on Nov 14.No candidate has won Nagrota a second time, barring BJP’s Jugal Kishore Sharma, now the Jammu MP. He was elected its MLA in 2002 and 2008.",Congress opt out despite being offered the seat by Omar Abdullah’s NC. The bypoll was necessitated by the death of its sitting BJP MLA Devender Singh Rana on Oct 31 last year. The move comes days after strains between the allies over Oct 24 polls for four Rajya Sabha seats from J&K.,"https://static.toiimg.com/thumb/msid-124728348,imgsize-1019561,width-400,resizemode-4/-.jpg"
Travis Kelce’s kind gesture with Taylor Swift moves little boy to tears amid ongoing 1587 Prime backlash,https://timesofindia.indiatimes.com/sports/nfl/news/travis-kelces-kind-gesture-with-taylor-swift-moves-little-boy-to-tears-amid-ongoing-1587-prime-backlash/articleshow/124731344.cms,"Travis Kelce and Taylor Swift (Getty Images)

Travis Kelce’s heartfelt moment wins the night at 1587 Prime



Inside 1587 Prime’s growing buzz and backlash



After crushing the Las Vegas Raiders 31-0, the Kansas City Chiefs proved once again why they remain one of the most feared teams in the NFL. But it wasn’t just their on-field dominance that caught attention — it was what happened afterward. Travis Kelce , along with his superstar fiancée Taylor Swift , decided to celebrate the big win at his new steakhouse, 1587 Prime, turning what could’ve been a routine dinner into a memory of a lifetime for one lucky family.Instead of dining in privacy, Kelce and Swift chose to sit among the restaurant’s patrons, soaking in the atmosphere like any other couple. For one family of five, the night turned unforgettable. Their dad, proudly sporting a Kelce jersey, caught the tight end’s attention. Moments later, Kelce walked over to greet them, thanked them for coming, and even joked about their dessert.Kelce admired their cookie order and quipped that he might have to try some himself before telling the dad, “Appreciate you rocking the 87.” The interaction was pure kindness, the kind of unscripted moment that reminds fans why they adore athletes like him.The touching video, later shared on the official Kelce Brothers Instagram page, showed the family — especially one of the young sons — overcome with emotion.The mother, Allison, shared the experience online, writing, “So a thing happened last night….which I can’t actually believe happened! Whilst in Kansas City we went for dinner and just happened to bump into Taylor Swift and Travis Kelce 🫶🏻❤️💛🤍 What a night! What an experience. My 3 boys and I feel incredibly lucky and truly blessed! All thanks to some friendship bracelets 🫶🏻🫶🏻”Whether it was the jersey or the bracelets that drew Kelce over, it didn’t matter. For that family, it was a night they’d never forget — and for Kelce, another example of his down-to-earth charm.Co-owned by Kelce, Patrick Mahomes , and the Noble 33 restaurant group, 1587 Prime has been both celebrated and criticized since opening. While some social media users have complained about steep prices — like the $345 wagyu tomahawk steak or $76 lobster tail — others say the experience is worth every penny.At the end of the day, it’s a steakhouse, and premium pricing comes with the territory. Still, the warmth Kelce showed that night may do more for the restaurant’s reputation than any five-star review could.A team sitting at 4-3 rarely inspires fear — but between the Chiefs’ dominance and their star player’s heart, Kansas City remains as intimidating off the field as on it.Also Read: George Kittle’s “backup wife hug” with Kristin Juszczyk becomes the funniest off-field moment of the 49ers game","The Kansas City Chiefs beat the Las Vegas Raiders 31-0 on Sunday. After the game, Travis Kelce and Taylor Swift went to his new steakhouse, 1587 Prime. Kelce greeted a family wearing a Kelce jersey and joked about their dessert.","https://static.toiimg.com/thumb/msid-124731353,imgsize-50838,width-400,resizemode-4/travis-kelce-and-taylor-swift.jpg"
"""It was an emotional decision"": Throwback to when Stephen Curry's wife Ayesha Curry shared how motherhood came unexpectedly",https://timesofindia.indiatimes.com/sports/nba/top-stories/it-was-an-emotional-decision-throwback-to-when-stephen-currys-wife-ayesha-curry-shared-how-motherhood-came-unexpectedly/articleshow/124709255.cms,"Ayesha Curry had opened up about becoming a mother at a young age.(Image via Getty Images)

Stephen Curry’s wife, Ayesha Curry, had spoken about becoming a mother very young in her life





Why is Ayesha Curry getting brutally trolled by fans?





Stephen Curry, the Golden State Warriors’ star player and the NBA legend, has been with his wife, Ayesha Curry , from a pretty young age. The two got married over a decade ago and are now parents to four young children. While Stephen Curry enjoys a lavish life with Ayesha Curry, their marriage has been getting brutally trolled for the last few week due to some of her controversial comments. But this was not the first time that Ayesha Curry spoke about becoming parents young.A few years ago, in 2021, Stephen Curry’s wife, Ayesha Curry opened up about motherhood on The Skimm's podcast, 9 to 5ish with The Skimm, where she said, ""It was a very emotional decision…And I did it … and found out we were having a baby, which wasn't in the plans quite yet.""Ayesha Curry added, ""What I started to realize was that I was becoming this woman at such a young age when other people would still potentially be in college…I always had this feeling of, like, I think that there's a double duty that I could be playing here.""Ayesha Curry continued: ""I was, like, 'I have hopes and dreams for myself and there's gotta be a way to do both.' ""Despite becoming a mother at a pretty young age, Stephen Curry’s wife Ayesha Curry has been able to make a name for herself and is now a popular chef and an entrepreneur.As Stephen Curry has made a name for himself in the world of the NBA, it seems Ayesha Curry has built a new identity for herself.A few weeks ago, Stephen Curry’s wife, Ayesha Curry, appeared on Call Her Daddy podcast where she said, “No. I didn’t want kids. I didn’t want to get married. I thought I was going to be a ‘career girl,’ and that’s it.”The popular mom of four continued, “After we got married, we found out we were pregnant with our daughters so quickly, I didn’t even have time to think about what I wanted anymore. It’s so interesting. I spent my entire life trying to work towards something, and then it kind of just disappeared and I didn’t think twice about it.”Ayesha Curry’s statements have sparked outrage among fans as many are furious at her for “disrespecting” Stephen Curry.However, both Stephen Curry and Ayesha Curry have kept themselves away from commenting on the drama as they focus on their four young children.Also Read: “Don’t try to do damage control”: Ayesha Curry’s romantic post with Stephen Curry sparks outrage amid controversial remarks","Stephen Curry’s wife, Ayesha Curry, had spoken about becoming a mother very young in her life. The two got married over a decade ago and are now parents to four young children. The popular mom of four has been able to make a name for herself and is now a popular chef.","https://static.toiimg.com/thumb/msid-124709333,imgsize-870519,width-400,resizemode-4/stephen-curry.jpg"
Leafs’ Morgan Rielly can’t hide jealousy as Blue Jays dominate World Series headlines,https://timesofindia.indiatimes.com/sports/nhl/news/leafs-morgan-rielly-cant-hide-jealousy-as-blue-jays-dominate-world-series-headlines/articleshow/124731751.cms,"Morgan Rielly admits he's jealous of Blue Jays’ World Series success (Getty Images)

Morgan Rielly sends candid message to Leafs fans after expressing envy for Blue Jays



Toronto’s Championship energy could fuel the Leafs’ comeback



Toronto is celebrating. The Blue Jays’ thrilling Game 7 win over the Seattle Mariners secured the city’s first World Series berth since 1993, sending fans into the streets in joyous celebration. Amid the excitement, Maple Leafs defenseman Morgan Rielly admitted he felt a twinge of jealousy watching another Toronto team reach the pinnacle of its sport. For a city still yearning for a Stanley Cup appearance since 1967, Rielly’s honesty captured the hopes and frustrations of Leafs fans everywhere.Rielly, a cornerstone of the Maple Leafs since 2013, has witnessed firsthand the heartbreaks that have defined Toronto hockey in recent decades. “There's a small part of you that you're envious of them. You're a bit jealous of what they're doing, just because of Toronto. You watch it firsthand, you're obviously happy for them, it's a great moment for the city, but we want to be able to do that and have a run like that. We felt that when the Raptors did it too. So, you look at the passion they're playing with, and that's contagious. And you want to be able to also bring that when your time comes,” Rielly said.Unlike the Blue Jays, who rode George Springer’s heroics to victory, the Leafs have struggled in decisive Game 7s, going 0-6 in recent attempts. Fans and players alike know the frustration of falling short, and Rielly’s words highlight the desire for a breakthrough moment. Teammates like Max Domi, William Nylander, and Easton Cowan celebrated the Jays’ success, but the envy is tempered with motivation.The Blue Jays’ surge should be a wake-up call for the Leafs. Seeing a city rally behind a championship run shows what’s possible when talent meets determination. Rielly’s comments reveal that the team hasn’t forgotten its past disappointments and is eager for a breakthrough.Toronto’s stars now have a real-life example of a hero like Springer, whose leadership and clutch performance galvanized an entire city. If the Maple Leafs can harness this momentum and find their own champion, the fans will rally behind them, and Toronto hockey could finally rewrite its postseason story.Morgan Rielly’s reflection is clear: Toronto deserves triumph, and with the right spark, the Maple Leafs could be next.Also Read: Panthers’ Brad Marchand breaks down in tears after heartfelt Bruins tribute during emotional Boston homecoming","Maple Leafs defenseman Morgan Rielly admits he's jealous of Blue Jays' World Series success. The Blue Jays’ thrilling Game 7 win over the Seattle Mariners secured the city’s first World Series berth since 1993. The Leafs have struggled in decisive Game 7s, going 0-6 in recent attempts. The city still yearning for a Stanley Cup appearance since 1967.","https://static.toiimg.com/thumb/msid-124731764,imgsize-41666,width-400,resizemode-4/morgan-rielly.jpg"
Panthers’ Brad Marchand breaks down in tears after heartfelt Bruins tribute during emotional Boston homecoming,https://timesofindia.indiatimes.com/sports/nhl/news/panthers-brad-marchand-breaks-down-in-tears-after-heartfelt-bruins-tribute-during-emotional-boston-homecoming/articleshow/124731508.cms,"Bruins fans show massive love to Brad Marchand (Imagn Images)

Brad Marchand and the emotional homecoming



MUST SEE: Brad Marchand's EMOTIONAL return to Boston! 🖤💛

Brad Marchand’s legacy with the Bruins



Brad Marchand, now skating for the Florida Panthers, received a heartfelt welcome from Boston fans during Tuesday night’s matchup at TD Garden. Despite wearing a different jersey, Marchand’s legacy with the Bruins remains undeniable. The veteran forward, who spent 17 unforgettable seasons in Boston, was honored with a moving video tribute that left him visibly emotional. Fans stood and cheered, reminding him that he will always hold a special place in Beantown.Brad Marchand’s trade to the Panthers last March stirred strong reactions among Bruins supporters. Many were upset that Boston allowed one of its all-time greats to leave without a contract extension, sending him to the defending Stanley Cup champions for a conditional 2027 second-round pick. Over seven months later, his return to Boston highlighted the deep connection between the player and the city. The standing ovation at TD Garden was a testament to the impact Marchand had on the franchise and its passionate fanbase.In a pregame interview with NHL Network’s Billy Jaffe, Marchand spoke warmly of his time in Boston. “It still feels like home,” he said. “I still love it here and everything—I'm just on a different journey now.It will always have a special place in my heart. I loved every second here. The great thing is I'm not moving off to a place I dislike or don't want to be in. I'm in another incredible place, another incredible organization.”Drafted in the third round in 2006, Marchand made his NHL debut in 2010 and quickly became a fan favorite for his relentless, hard-nosed style. Over 17 seasons, he etched his name into Bruins history, ranking fourth in games played, fourth in goals, sixth in assists, and fifth in total points. Beyond the numbers, Marchand’s tenacity, leadership, and memorable moments on the ice forged a lasting bond with fans that transcends a jersey change.Tuesday night’s return served as both a celebration of his achievements and a reminder of what he meant to Boston hockey. For fans, Marchand may now wear a Panthers uniform, but in the hearts of many, he will always be synonymous with the Bruins.Also Read: “Please, just…”: Brad Marchand’s wife Katrina urges Bruins fans to show love during his emotional return to Boston",Brad Marchand returned to Boston for the first time since his trade to the Panthers last March. The veteran forward was honored with a moving video tribute that left him visibly emotional. The standing ovation was a testament to the impact Marchand had on the franchise and its passionate fanbase.,"https://static.toiimg.com/thumb/msid-124731507,imgsize-47232,width-400,resizemode-4/brad-marchand.jpg"
"When and where to watch Michael Jordan NBA on NBC - Full 2025–26 schedule, studio lineup, and why nostalgia meets innovation",https://timesofindia.indiatimes.com/sports/nba/top-stories/when-and-where-to-watch-michael-jordan-nba-on-nbc-full-202526-schedule-studio-lineup-and-why-nostalgia-meets-innovation/articleshow/124729431.cms,Basketball legend Michael Jordan returns to NBA on NBC this Tuesday. He will appear on a special halftime show titled 'MJ: Insights to Excellence'. Jordan will share his basketball experiences and insights with players. The show airs at 7:30 pm ET on NBC and Peacock. This marks his first appearance on NBC in 25 years.,Basketball legend Michael Jordan returns to NBA on NBC this Tuesday. He will appear on a special halftime show titled 'MJ: Insights to Excellence' Jordan will share his basketball experiences and insights with players. The show airs at 7:30 pm ET on NBC and Peacock.,"https://static.toiimg.com/thumb/msid-124729433,imgsize-40536,width-400,resizemode-4/michael-jordan.jpg"
