Article Title,Article Link,Article Text,Article Summary,Article Image
"President Murmu confers Padma awards: Shibu Soren, Alka Yagnik, Mammootty among honourees - check list",https://timesofindia.indiatimes.com/india/president-murmu-confers-padma-awards-shibu-soren-alka-yagnik-mammootty-among-honourees-check-list/articleshow/131936337.cms,"Padma awards

Padma Bhushan awardees:

Padma Shri awardees:

NEW DELHI: President Drupadi Murmu on Tuesday conferred the Padma Awards at Rashtrapati Bhavan in the second civil investiture ceremony. A total of 65 Padma awards were conferred including two Padma Vibhushan, seven Padma Bhushan and 56 Padma Shri Awardees.The conferred awardees included actor Mammootty, singer Alka Yagnik, cricketer Rohit Sharma and R Madhavan to name a few.Here is the full list of awardeesAlka YagnikShibu SorenMammoottyPiyush PandeyUday Sureshkumar KotakKallipatti Ramasamy PalaniswamyDr Dattatreyudu NoriVellappally NatesanSKM MaeilanandhanVijay AmritrajR GaneshBhagat Singh KoshyariRohit Gurunath SharmaMadhavan RanganathanHarmanpreet Kaur BhullarSavita PuniaSatish ShahProsenjit ChatterjeeChandramouli GaddamanuguDr Rajendra PrasadGadde Babu Rajendra PrasadNuruddin AhmedThiruvaarur BakthavathsalamKrishnamurty BalasubraniamAnkegowda MBishwa BandhuBharat Singh BhartiBrij Lal BhatTarun BhattacharyaTaga Ram BheelRatilal Mohanlal BorisagarKumar BoseJanardan Bapurao BotheSwami BrahamdevJyotish DebnathJogesh DeuriBhiklya Ladakya DhindaArmida FernandezDevaki Amma GPrem Lal GautamRamchandra Godbole, Suneeta GodboleRajastapathi Kaliappa GoundarPadma GurmetAsok Kumar HaldarSuresh HanagavadiH V HandeCharan HembramShubha Venkatesha IyengarT T JagannathanNiranjan Dass JiGafaruddin Mewati JogiVeezhinathan KamakotiMangala KapoorMir Haji KasamAshok KhadeRaghuvir KhedkarLiudmila KhokhlovaLars-Christian KochR Krishnan KitnaPrabhakar Basaprabhu KoreMamidala Jagdesh KumarPraveen KumarK Vijay KumarShrirang Devba LadPokhila LekhpetiRama Reddy MamidiSaroj MandalNilesh Vinodchandra MandlewalaBuddha Rashmi ManiR V S ManiKalamandalam Vimala MenonVladimer MestvirishviliMahendra Kumar MishraMaganti Murali MohanTripti MukherjeeHarimadhab MukhopadhyayA E MuthanayagamMohan NagarPunniamurthy NatesanSatyanarayan Nandlal NuwalMohan NagarK PajanivelDharmiklal Chunilal PandyaKailash Chandra PantSimanchal PatraSarat Kumar PatraN SwaminathanSangyusang PongenerGarimella Balakrishna PrasadGadde Babu Rajendra PrasadKabindra PurkayasthaBhagwandas RaikwarK RamasamyAnil Kumar RastogiGuduru Venkat RaoGayatri, RanjaniDeepika ReddyPalkonda Vijay Anand ReddyMahendra Nath RoyVempaty Kutumba SastryHaricharan SaikiaPrateek SharmaShafi ShauqYumnam Jatra SinghBaldev SinghInderjit Singh SidhuAshok Kumar SinghRaghupat SinghSivasankariKhem Raj SundriyalShyam SundarR SreedherS G SusheelammaBudhri TatiKewal Krishan ThakralRabilal TuduGopal Ji TrivediKumarasamy ThangarajArvind VaidyaNaresh Chandra Dev VarmaJuzer VasiHally WarNarayan VyasShashi Shekhar VempatiChiranji Lal YadavGambir Singh YonzoneSpeaking to ANI, Padma Shri awardee and Director of the National Institute of Sowa-Rigpa, Dr Padma Gurmet, expressed his happiness for receiving the award for the preservation and promotion of the Himalayan medical tradition.""It feels wonderful. This year, I have been honoured with the Padma Award for the preservation and promotion of the Himalayan medical tradition. Conferring this recognition on a person like me, who is from such a remote area in Ladakh, is a great achievement not only for me but also for the Sowa-Rigpa community,"" he said.The first Civil Investiture Ceremony was held on May 26, during which the President Murmu conferred 66 Padma Awards.","President Drupadi Murmu on Tuesday conferred the Padma Awards at Rashtrapati Bhavan in the second civil investiture ceremony. A total of 65 Padma awards were conferred including two Padma Vibhushan, seven Padma Bhushan and 56 Padma Shri Awardees.","https://static.toiimg.com/thumb/msid-131936616,imgsize-1030765,width-400,height-225,resizemode-4/file-picture.jpg"
Proverb of the day from Jataka tales: ‘The monkey who reaches for every fruit rarely enjoys one’ - A proverb on focus and contentment,https://timesofindia.indiatimes.com/india/proverb-of-the-day-from-jataka-tales-the-monkey-who-reaches-for-every-fruit-rarely-enjoys-one-a-proverb-on-focus-and-contentment/articleshow/131933756.cms,"​‘The monkey who reaches for every fruit rarely enjoys one’ - A proverb on focus and contentment

The image behind this saying is simple: a monkey moving from branch to branch, trying to grab every fruit it sees, may end up enjoying none fully. In chasing every possibility, it loses the chance to value what is already within reach.The saying is often attributed to the moral storytelling tradition of the Jataka tales, the Buddhist collection of stories about the previous lives of the Buddha, where animals frequently reflect human behaviour and ethical lessons. The proverb’s message reflects the same wisdom found in these stories: desire without restraint can lead to dissatisfaction. The idea also appears in different cultures through similar sayings: the English proverb “A bird in the hand is worth two in the bush” highlights the value of appreciating what is already secured, while the Japanese saying “Hana yori dango” (“dumplings rather than flowers”) suggests choosing real value over appearances. Across these traditions, the lesson remains the same: constantly reaching for more can make people overlook the value of what they already have.The meaning of the proverb goes beyond the monkey and the fruit. The monkey represents a restless mind that is constantly searching, comparing and reaching for the next opportunity. The fruits represent the many choices, desires and distractions people encounter. The lesson is that wanting everything at once can prevent us from truly experiencing anything.The philosophy behind the saying is rooted in the value of focus and mindful choice. Having many opportunities is not always the same as having fulfillment. A person who spreads their energy in too many directions may struggle to develop depth, while someone who chooses carefully can fully appreciate and master what they pursue.In today’s day and age, the proverb has a strong connection with the way people approach success. A professional trying to chase every trend, every skill and every opportunity may end up without a clear direction. A business that constantly changes priorities may lose sight of its main purpose. Even personally, constantly searching for something better can make people overlook the value of what they already have.The saying also reflects a part of human nature: the tendency to confuse more with better. Humans are naturally drawn towards new possibilities, but endless pursuit can create dissatisfaction. Like the monkey reaching for another fruit, people can become so focused on what they lack that they fail to enjoy what they have already gained.Yet the proverb does not argue against ambition or curiosity. Growth often requires exploration. Its lesson is about balance and knowing when to seek new opportunities, and when to commit to the path already chosen.Distraction is a timeless human struggle. The number of choices may change with each generation, but the challenge remains the same: deciding what deserves our attention. Whether in ancient stories or modern life, focus remains one of the foundations of achievement and fulfilment.",The saying is often attributed to the moral storytelling tradition of the Jataka tales. It reflects the same wisdom found in these stories: desire without restraint can lead to dissatisfaction. The philosophy behind the saying is rooted in the value of focus and mindful choice. Having many opportunities is not always the same as having fulfillment.,"https://static.toiimg.com/thumb/msid-131933885,imgsize-198784,width-400,height-225,resizemode-4/the-monkey-who-reaches-for-every-fruit-rarely-enjoys-one-a-proverb-on-focus-and-contentment.jpg"
"No JEE ranks, GATE scores in resumes, IIT students told",https://timesofindia.indiatimes.com/india/no-jee-ranks-gate-scores-in-resumes-iit-students-told/articleshow/131899283.cms,"Representative image

MUMBAI: In a set of decisions that could reshape campus recruitment across the country’s premier engineering institutions, the All IITs Placement Committee (AIPC) has directed students across all 23 IITs to remove JEE ranks, GATE scores, percentiles and similar entrance examination credentials from their resumes. At the same time, the IITs have decided to take a tougher stance against companies that issue job offers and later withdraw them, potentially restricting future engagement with such recruiters for up to two years if their explanations are found unsatisfactory.Taken together, the measures reflect a growing concern within the IIT system that fairness in recruitment depends not only on how students are evaluated, but also on how they are treated once selected.The decisions were taken unanimously at a recent meeting of the AIPC, the official body of 23 IITs that coordinates and issues common guidelines on internship and placement drives across all IITs. According to AIPC convenor John Jose, the move to remove entrance examination rankings from resumes arose from concerns that recruiters could sometimes infer whether a student belonged to the general or reserved category by comparing a candidate’s rank with the opening and closing ranks of a particular IIT programme.“The distinction is an important one. An entrance examination captures a moment in time. A degree reflects years of work that follow. The objective is that students should be evaluated on their competence, skills and achievements at IIT. What will disappear is the score that opened the gate,” said prof Jose, also a senior faculty of computer science engineering at IIT Guwahati.For generations of IIT students, a rank was more than a number. It was a badge of honour earned through years of preparation, sacrifice and competition. Now, in a move that reflects a changing understanding of merit itself, IITs have decided that those ranks should no longer accompany students into the job market.Under the revised guidelines, students may continue to highlight their Cumulative Performance Index (CPI), projects, internships, research work and other accomplishments earned during their years at IIT, explained Jose. Entrance examination scores may only be shared if a recruiter specifically requests them, but they will no longer be part of the standard resume circulated through placement channels.The committee also addressed a growing concern among placement offices: companies extending job offers to students only to revoke them months later. “Because students who accept an offer are typically removed from the placement process, such reversals can leave them stranded after missing other opportunities,” said prof Jose. To discourage the practice, IITs have begun documenting instances of offer withdrawals and seeking explanations from recruiters. Companies found reneging on commitments may face restrictions on participation for the next two years in IIT recruitment drives.Another decision seeks to change how placement success is measured. Rather than publicising the highest salary packages secured by a handful of graduates, IITs will report median salaries, which officials believe provide a more accurate picture of outcomes across an entire programme.","All IITs Placement Committee directs students to remove JEE ranks, GATE scores, percentiles and similar entrance examination credentials from their resumes. The decisions were taken unanimously at a recent meeting of the AIPC. The committee addressed a growing concern among placement offices: companies extending job offers to students only to revoke them months later.","https://static.toiimg.com/thumb/msid-131899289,imgsize-66850,width-400,height-225,resizemode-4/131899289.jpg"
Delhi Capitals cricketer accused of sexual relationship under false promise of marriage,https://timesofindia.indiatimes.com/sports/cricket/news/delhi-capitals-cricketer-accused-of-sexual-relationship-under-false-promise-of-marriage/articleshow/131943666.cms,"Delhi Capitals' Abhishek Porel (AP Photo)

Bengal and Delhi Capitals wicketkeeper-batter Abishek Porel has found himself at the centre of a controversy after a woman lodged a police complaint accusing him of maintaining a physical relationship with her on the promise of marriage and later refusing to fulfil that commitment. The complaint also contains allegations of assault and criminal intimidation.The complaint was submitted jointly by the woman and her mother at Mogra Police Station in West Bengal's Hooghly district on Tuesday. Police have confirmed that an investigation has been initiated following the allegations.According to the complaint, the woman claimed that she and Porel had been in a relationship for the last three years. She alleged that problems began emerging between them last year, after which the cricketer gradually started distancing himself from her.The complainant further alleged that Porel had assured her that he would marry her but has now backed away from that promise. She also accused the 23-year-old cricketer of engaging in sexual relations with her under the assurance of marriage.In addition to those allegations, the woman claimed that she was subjected to assault and criminal intimidation.""We have received a complaint and started an investigation,"" a police official told PTI.Porel has strongly denied the allegations. The wicketkeeper-batter, who is currently in Bengaluru, described the accusations as baseless and suggested that the timing of the complaint was linked to his recent success on the cricket field.""I am playing well now, so various things are coming up,"" Porel was quoted as saying in the media.The Bengal cricketer also stated that he would provide a detailed response once the authorities complete the preliminary stages of their inquiry.""I will talk about this when the police investigate. I have not spoken to the police yet,"" he said.Porel has been part of the Delhi Capitals setup in the Indian Premier League since 2023. During the most recent IPL season, the left-handed batter scored 108 runs from four innings for the franchise.He made his first-class debut for Bengal during the 2021-22 domestic season and has since featured in 32 first-class matches and 23 List A games. Porel has also previously travelled with India A squads on tours to the United Kingdom and Australia.The investigation into the allegations remains ongoing.",Bengal and Delhi Capitals wicketkeeper-batter Abishek Porel at centre of a controversy. Woman lodges police complaint accusing him of maintaining a physical relationship with her on the promise of marriage. Complaint also contains allegations of assault and criminal intimidation. Police have confirmed that an investigation has been initiated.,"https://static.toiimg.com/thumb/msid-131943674,imgsize-230232,width-400,height-225,resizemode-4/india-ipl-cricket.jpg"
Cristiano Ronaldo’s fiancée Georgina Rodriguez shows off trouser-free celebration as Portugal secures its first victory,https://timesofindia.indiatimes.com/sports/international-sports/cristiano-ronaldos-fiance-georgina-rodriguez-shows-off-trouser-free-celebration-as-portugal-secures-its-first-victory/articleshow/131952562.cms,Cristiano Ronaldo’s fiancée Georgina Rodriguez shows off trouser-free celebration as Portugal secures its first victory,Cristiano Ronaldo’s fiancée Georgina Rodriguez shows off trouser-free celebration as Portugal secures its first victory. Portugal beat Spain 1-0 in their Euro 2016 qualifier. Ronaldo and Rodriguez are set to marry in the summer.,"https://static.toiimg.com/thumb/msid-131952569,imgsize-82780,width-400,height-225,resizemode-4/cristiano-ronaldo-and-georgina-rodriguez.jpg"
'I didn't deserve it': Jude Bellingham after being named MOTM in England-Ghana draw,https://timesofindia.indiatimes.com/sports/football/fifa-world-cup/i-didnt-deserve-it-jude-bellingham-after-being-named-motm-in-england-ghana-draw/articleshow/131952645.cms,"England midfielder Jude Bellingham made headlines with his honest reaction after being named Man of the Match in England's goalless draw against Ghana at the FIFA World Cup While the official award went to the Real Madrid star, Bellingham felt one of Ghana's defenders deserved the honour more after a disciplined display that frustrated England throughout the match.England dominated possession and outshot Ghana 19-1 in Boston on Tuesday, but Thomas Tuchel's side failed to find a breakthrough as Ghana executed their defensive game plan to perfection.Despite being named Player of the Match, Bellingham admitted he was surprised by the decision.""I didn't deserve it, to be honest,"" Bellingham told FIFA's in-house media after the match.""It should have gone to one of their lads who defended so well. I had a couple of moments, it was hard to get into the game and I'm grateful for whoever voted, but it should've gone to one of their lads.""The draw was a setback for England after their entertaining 4-2 victory over Croatia in the opening Group L match. Bellingham also pointed to what he described as a familiar trend for England at major tournaments.""Like always, it's second-game fever with England. Win the first one, do well and draw the second.It's OK though, they played for a draw that would've seen them go through and fair play to them,"" he added.The result marked the fourth straight major tournament in which England have drawn their second group-stage match.England controlled the ball for long periods but struggled to break down a compact Ghana side coached by Carlos Queiroz. The Portuguese tactician was delighted with how his team carried out the plan.""Our plan was to block and frustrate them from the first minute,"" Queiroz said. ""We did it.""Bellingham acknowledged England's frustration after the match.""Frustrated a little bit with how they defended, how they set up,"" he said. ""They got exactly out of the game what they played for. Couldn't quite break them down, even with all corners, all the possession, all the shots on goal from distance.""England came closest to scoring in the 86th minute when Nico O'Reilly's header hit the crossbar. Harry Kane reacted quickest to the rebound but could not keep his effort down.Declan Rice also praised Ghana's defensive organisation while urging England supporters not to overreact to the result.""You have to give credit to Ghana,"" Rice told the BBC. ""They were 5-4-1 off the ball, very compact, tight spaces to play through. Maybe we can do a little bit more with the ball and create a bit more, but it's tough as they're good players and it was never going to be an easy game.""The Arsenal midfielder remained confident about England's chances of finishing top of the group.""Loads of top nations drew their first game, so there's no need to be negative. We need to stay positive, keep going and recover before the next match against Panama.""""It's always difficult when you play against 11 behind the ball as deep as they were. You've got to find solutions, and in the last 10 minutes we probably found more than we did in the rest of the game. We were unlucky not to score, but we still have a great chance to top the group.""England manager Thomas Tuchel admitted his side found it difficult to deal with Ghana's shape and physical approach.""They defended with a lot of determination. A lot of discipline,"" Tuchel said.The German coach also defended captain Harry Kane, who had a quiet evening.""He was not involved as much as we would like to, but it was so narrow,"" Tuchel said. ""It was difficult to find space. The little moments that he had were just so unlucky.""The draw leaves both England and Ghana in a strong position to qualify for the knockout stage. England will face Panama in their final group match, while Ghana will take on Croatia as the race for qualification in Group L heads into the final round.",Jude Bellingham was named Man of the Match in England's goalless draw against Ghana. Bellingham felt one of Ghana's defenders deserved the honour more after a disciplined display. England came closest to scoring in the 86th minute when Nico O'Reilly hit the crossbar.,"https://static.toiimg.com/thumb/msid-131952676,imgsize-71064,width-400,height-225,resizemode-4/bellingham-2406-s.jpg"
FIFA World Cup 2026: Argentina unveils 26-metre-tall Lionel Messi statue,https://timesofindia.indiatimes.com/sports/football/fifa-world-cup/fifa-world-cup-2026-argentina-unveils-26-metre-tall-lionel-messi-statue/articleshow/131958010.cms,"Argentina's love for Lionel Messi has reached new heights during the FIFA World Cup 2026, with a giant 26-metre statue of the football icon unveiled in Patagonia and a fan-made mural attracting attention across the country.The massive statue stands on the outskirts of Cutral Co, a town in southern Argentina. Made from 70 tonnes of steel and iron, it shows Messi kneeling with the World Cup trophy between his legs and one arm raised in celebration.The monument was inaugurated on June 16, the day Argentina began their World Cup campaign. According to local authorities and the artist behind the project, it is the largest monument ever dedicated to the Argentine captain, who turns 39 on Wednesday.The statue was created by sculptor Aldo Beroisa and took 18 months to complete.""He is Argentina's natural ambassador. For me, it was very important, not only as an artist but as an Argentine,"" Beroisa told The Associated Press.The artwork recreates one of the most memorable moments of Messi's career — his emotional celebration after Argentina won the 2022 World Cup final in Qatar. It also features the captain holding Argentina's jersey and pointing towards the sky, a gesture he often makes in memory of his late grandmother.The tribute has already started drawing visitors to Cutral Co, a town better known for oil production than tourism.Along with the giant statue, Messi is also being celebrated through a unique mural in Berazategui, a suburb of Buenos Aires.Unlike most murals, this one includes the names of more than 1,300 fans who helped create it. The artwork features a smiling Messi and has become a popular attraction for supporters.The mural even caught the attention of the Argentine superstar himself.""Crazy ... thank you very much to all of you, to the people who supported it, who came by, and who keep coming by,"" Messi said in a video message sent to the creators.Artist Leonel García, who led the project, said the mural was a community effort.""This is a mural that I didn't make by myself. Beyond the fact that I painted it, it was made by more than 1,300 people,"" García said.The mural took 18 days to complete and was painted with the help of fans who travelled from different parts of the country to add their names.For García, the project is about more than football.""Messi brings joy to the country. The times we're living through in Argentina may not be very good for some people, but Messi unites everyone ... and the mural does that too, because people from everywhere come together here, from every social class and every political sector,"" he said.As Argentina continue their World Cup campaign, the giant statue and fan-created mural serve as reminders of Messi's lasting impact on the country. Even at 39, the captain remains a symbol of unity, pride and inspiration for millions of Argentines.","Giant 26-metre statue of Lionel Messi unveiled in Patagonia. Statue made from 70 tonnes of steel and iron and took 18 months to complete. A fan-made mural in Berazategui features the names of more than 1,300 fans.","https://static.toiimg.com/thumb/msid-131958056,imgsize-28495,width-400,height-225,resizemode-4/messi-statue-2406-s.jpg"
