Article Title,Article Link,Article Text,Article Summary,Article Image
"MLB All-Star Game 2025: Where to watch, streaming platforms, match timing and lineups",https://timesofindia.indiatimes.com/sports/mlb/news/mlb-all-star-game-2025-where-to-watch-streaming-platforms-match-timing-and-lineups/articleshow/122526343.cms,"MLB All-Star Game 2025: Where to watch, streaming platforms, match timing and lineups (Image Via X)

Paul Skenes vs Tarik Skubal pitching battle set for 8 PM ET at Truist Park in 2025 MLB All-Star Game

what time is the all star game and streaming info





Cal Raleigh (C) – Seattle Mariners

Vladimir Guerrero Jr. (1B) – Toronto Blue Jays

Gleyber Torres (2B) – Detroit Tigers

Junior Caminero (3B) – Tampa Bay Rays

Jacob Wilson (SS) – Oakland Athletics

Aaron Judge (OF) – New York Yankees

Riley Greene (OF) – Detroit Tigers

Ryan O’Hearn (DH) – Baltimore Orioles

Will Smith (C) – Los Angeles Dodgers

Freddie Freeman (1B) – Los Angeles Dodgers

Ketel Marte (2B) – Arizona Diamondbacks

Manny Machado (3B) – San Diego Padres

Francisco Lindor (SS) – New York Mets

Ronald Acuña Jr. (OF) – Atlanta Braves

Pete Crow-Armstrong (OF) – Chicago Cubs

Kyle Tucker (OF) – Chicago Cubs

Shohei Ohtani (DH) – Los Angeles Dodgers

Venue: Truist Park, Atlanta, Georgia

Time: 8PM ET

TV: FOX

Live stream: DirecTV, Fubo, Hulu + Live TV, Sling TV

A historic baseball night is just around the corner, and fans across the country are gearing up for one of the most awaited matchups of the season. The 95th Major League Baseball All-Star Game is finally happening, and the lineups are stacked with some of the game’s biggest stars. But there’s something even more special about this year’s game that has fans even more excited.The 2025 MLB All-Star Game will be played on Tuesday, July 15, at 8PM ET at Truist Park in Atlanta, Georgia. The National League team will be led by manager Dave Roberts, while the American League team will be guided by manager Aaron Boone.On the mound, Paul Skenes of the Pittsburgh Pirates will start for the National League. Tarik Skubal from the Detroit Tigers will start for the American League. Both pitchers have had incredible seasons so far and are expected to shine on the biggest stage.The American League team is captained by New York Yankees outfielder Aaron Judge . The National League lineup features Shohei Ohtani , who now plays for the Los Angeles Dodgers, as the designated hitter and leadoff batter.The event promises a thrilling face-off between these star-studded teams. Another big highlight will be a tribute to Hank Aaron, honoring the anniversary of his 715th career home run, a moment that changed baseball history.Also Read: MLB All Star Game 2025: Shohei Ohtani And Aaron Judge Headline Star-Packed Lineups Revealed For Truist Park Showdown Here are the starting players for both sides:American League:National League:How to watch:The 2025 All-Star Game is set to bring unforgettable action and a true celebration of baseball’s biggest talents.","The 2025 MLB All-Star Game will be played on Tuesday, July 15, at 8PM ET at Truist Park in Atlanta, Georgia. The American League team is captained by New York Yankees outfielder Aaron Judge. The National League lineup features Shohei Ohtani as the designated hitter and leadoff batter.","https://static.toiimg.com/thumb/msid-122526331,imgsize-95178,width-400,resizemode-4/122526331.jpg"
Antonio Brown reacts to Klay Thompson–Megan Thee Stallion dating rumors with viral Tory Lanez post,https://timesofindia.indiatimes.com/sports/nba/top-stories/antonio-brown-reacts-to-klay-thompsonmegan-thee-stallion-dating-rumors-with-viral-tory-lanez-post/articleshow/122522677.cms,"Klay Thompson and Megan Thee Stallion are reportedly dating (Image via Getty Images)

Antonio Brown stirs controversy over Klay Thompson and Megan Thee Stallion romance rumors with cryptic post

Klay Thompson playing for the Golden State Warriors (Image via Getty Images)

Popular NFL player Antonio Brown has recently expressed his sentiments regarding NBA player Klay Thompson's decision to make his relationship with Megan Thee Stallion public. The NBA player was recently criticized by the former athlete for his alleged relationship with the singer. The football player posted several photos on his social media account on July 14 targeting the reported couple. The post came after a photo of the singer and the Dallas Mavericks player chilling by the pool went viral. This started the rumors of a possible romantic relationship.The former NFL player posted a photo of Klay Thompson and rapper Tory Lanez on his official X account. The rapper was charged with shooting Meg in July 2020 following a home party. On Sunday, Antonio Brown posted an image on his X account along with a widely shared photo of the NBA player with Tory Lanez. He captioned:""It be your own friends.""As per Prime Times, in 2022, Tory Lanez and Klay Thompson met briefly at Story, a nightclub in Miami, Florida, where the photo was taken. Antonio Brown referred to the rivalry between Tory Lanez and Megan Thee Stallion in his post. The latter shot Meg in the foot back in 2020 and is currently serving a 10-year prison sentence.The five-time NBA All-Star was spotted in the background of Megan Thee Stallion 's most recent Instagram post on Wednesday, which sparked a flurry of rumors on social media.Even though Klay Thompson wasn't in the picture properly, he was visible in the corner, and now there are suspicions that the two might be dating.It seems like he had no intention of being in this photo. Also, he was not named in the text or tagged in the photo. Now, a potential romance between a Grammy-winning artist and a leading NBA athlete is very thrilling to music and sports fans. However, as of right now, there is no evidence that Megan Thee Stallion and Klay Thompson are an actual couple.Also read: Klay Thompson seen poolside with Megan Thee Stallion, sparks dating rumors and dad’s two-word reaction",NBA player Klay Thompson and singer Megan Thee Stallion are reportedly dating. NFL player Antonio Brown has expressed his sentiments over the reported relationship. The football player posted several photos on his social media account on July 14 targeting the reported couple. Brown referred to the rivalry between Tory Lanez and Meg. The rapper was charged with shooting Meg in 2020 following a home party.,"https://static.toiimg.com/thumb/msid-122522594,imgsize-48832,width-400,resizemode-4/122522594.jpg"
NHL Trade Rumor: Connor McDavid's loyalty tested as he reportedly chooses between Oilers loyalty and free agency freedom,https://timesofindia.indiatimes.com/sports/nhl/news/nhl-trade-rumor-connor-mcdavids-loyalty-tested-as-he-reportedly-chooses-between-oilers-loyalty-and-free-agency-freedom/articleshow/122426324.cms,"Elliotte Friedman suggests Connor McDavid is likely to sign a contract extension with the Edmonton Oilers, securing his future with the team beyond the 2025-26 season. Despite recent playoff heartbreaks and speculation about McDavid exploring free agency, the Oilers' captain seems committed to chasing a Stanley Cup in Edmonton. Negotiations for a lucrative contract extension are expected.","Elliotte Friedman says Connor McDavid is likely to sign a contract extension with the Edmonton Oilers. Despite recent playoff heartbreaks and speculation about McDavid exploring free agency, the Oilers' captain seems committed to chasing a Stanley Cup. Negotiations for a lucrative contract extension are expected.","https://static.toiimg.com/thumb/msid-122426336,imgsize-53408,width-400,resizemode-4/122426336.jpg"
Did ex-MLB star Daniel Serafini murder his father-in-law over his wealth despite earning over $14 million?,https://timesofindia.indiatimes.com/sports/mlb/news/did-ex-mlb-star-daniel-serafini-murder-his-father-in-law-over-his-wealth-despite-earning-over-14-million/articleshow/122528223.cms,"Daniel Serafini has been convicted for murdering his father in law in 2021.(Image via Alamy)

Daniel Serafini has been convicted of killing his wealthy in laws and the motive has been speculated to be their wealth



MLB Vet Daniel Serafini Convicted in Grisly Family Shooting: $1.3M Motive Exposed

Daniel Serafini also had an accomplice along with him



Did Daniel Serafini murder his father in law because of money?



Daniel Serafini, once considered to be one of the most talented and popular players in the MLB, has now found himself in a huge scandal related to the deaths of his in laws. Now, the criminal case against him has taken a turn and Daniel Serafini has been convicted of first degree murder and attempted murder related to the deaths of his wife’s parents.In 2021, Daniel Serafini’s father in law, Robert Gary Spohr, died when he was shot and his mother in law, Wendy Louise Wood, was severely injured in the shooting. The elderly couple were at their luxurious house near Lake Tahoe in California when the tragedy struck.While initially it was believed to be an intruder, further investigations into the case made authorities suspicious of the former MLB star player, Daniel Serafini.While Daniel Serafini’s father in law, Robert Gary Spohr, died within seconds of being shot, his mother in law, Wendy Louise Wood, did survive the shooting but was critically injured.A year later, in an unfortunate turn of events, Daniel Serafini’s mother in law, Wendy Louise Wood, committed suicide and passed away.In 2023, Daniel Serafini was finally charged with child enDanielgerment, burglary, first degree murder and attempted murder.The authorities had also found an accomplice, Samantha Scott, with Daniel Serafini, who turned out to be a close associate of his and his wife.Apparently, the motive has found to be related to money. According to the Sacramento Bee, Daniel Serafini’s in laws, Robert Gary Spohr died and Wendy Louise Wood were pretty wealthy and lead a luxurious lifestyle; something that did not sit well with the former MLB player.The prosecutor of the case, Assistant Chief Deputy District Attorney Richard Miller, has revealed that Daniel Serafini “hated” his in-laws and wanted them to be killed for $20,000.At one point in his successful career in the MLB, Daniel Serafini had earned more than $14 million, but due to poor decisions, he ended up losing most of it and was $300,000 in debt.Once considered to be a star player in the MLB, Daniel Serafini is all set to be behind bars for the majority of his life now.Also Read: What happened to Trevor Bauer? The Dodgers fired him over sexual assault claims but his accuser was later charged with fraud","Daniel Serafini has been convicted of killing his wealthy in laws and the motive has been speculated to be their wealth. The former MLB star player was once considered to be one of the most talented and popular players in the MLB. In 2021, his father in law, Robert Gary Spohr, died when he was shot and his mother inlaw, Wendy Louise Wood, was severely injured in the shooting. A year later, in an unfortunate turn of events, Daniel Serafino’s mother in law committed suicide and passed away.","https://static.toiimg.com/thumb/msid-122528445,imgsize-601755,width-400,resizemode-4/122528445.jpg"
NHL Trade News: Buffalo Sabres sign defenseman Radim Mrtka to a three-year entry-level contract,https://timesofindia.indiatimes.com/sports/nhl/news/nhl-trade-news-buffalo-sabres-sign-defenseman-radim-mrtka-to-a-three-year-entry-level-contract/articleshow/122518418.cms,"(Image via Getty Images: Radim Mrtka)

Buffalo Sabres rookie defenseman Radim Mrtka is known for his defensive stickwork and skating ability

NHL Central Scouting describes Radim Mrtka in the following ways

A huge 6-foot-6, right-handed, two-way defenseman

Prototype of an NHL player

Mobile, strong skater

Good acceleration and speed

Plays with confidence

Handles the puck well

Likes to use his big frame in battles

Fine understanding of the game

Likes to join the rush

Makes smart passes

Fine work ethic

Good at jumping down from the point to finish off a scoring chance

Sticks up for and comes to the aid of teammates

Very good with the puck under checking pressure

Good reach

Effective on the penalty kill

Tough to play against close to the net

Fans react to Buffalo Sabres signing Radim Mrtka

Also Read:

On July 15, the Buffalo Sabres X account posted, “It’s official! ⚔️We have signed defenseman Radim Mrtka to a three-year, entry-level contract.” The Sabres picked him as their first-round 9th overall pick in the 2025 NHL Draft. One user instantly commented, “Sabres signing everyone this offseason 🔥💪 they need it.” Maybe because the Sabres had only 39 wins and a total of 37 losses in the 2024-2025 NHL season.Another user wrote, “Big body, big potential. Buffalo just got meaner on the blue line 🧊💪” Czech ice hockey defenseman Radim Mrtka weighs 218 pounds and is 6-foot-6 tall! When many were pleased with the deal, some users responded in unison, saying, “Three years until he’s traded!” Why not give a rookie defenseman a chance to prove himself? What were his past laurels? Let’s find out!The 18-year-old rookie defenseman played for the Seattle Thunderbirds of the Western Hockey League(WHL). He accumulated 35 points and a 10+ rating in 43 games. He represented Czechia in the Under-18 World Junior Championship. He won a silver medal in the 2024 Hlinka Gretzky Cup. Justin Alphert of NHL Network wrote, Radim Mrtka has been lauded for his defensive stickwork, reach and skating ability, plus a knack for jumping into the play and generating offense. Corey Pronman of The Athletic wrote, Mrtka has the potential to be a long-time top-four defenseman who plays reliable, steady minutes in all situations.One user welcomed the 18-year-old rookie defenseman by saying, “Welcome to the national.” Another imagined his future trade, “Can’t wait to see this guy traded away in his prime for nothing 🤪” A third user was shocked to know the contract details, “THREE YEARS for a guy with ZERO nhl experience????? 😭” A fourth user thought Radim Mrtka would go back to the Seattle Thunderbirds, “I’m assuming he goes back to Seattle right?” A fifth user wondered, “Great, can he play on the top line?”",Czech ice hockey defenseman Radim Mrtka weighs 218 pounds and is 6-foot-6 tall. The 18-year-old rookie defenseman played for the Seattle Thunderbirds of the Western Hockey League(WHL) He represented Czechia in the Under-18 World Junior Championship.,"https://static.toiimg.com/thumb/msid-122518570,imgsize-514864,width-400,resizemode-4/122518570.jpg"
Shemar Stewart’s NFL future in turmoil as Cincinnati Bengals contract dispute fuels Texas A&M comeback rumors,https://timesofindia.indiatimes.com/sports/nfl/news/shemar-stewarts-nfl-future-in-turmoil-as-cincinnati-bengals-contract-dispute-fuels-texas-am-comeback-rumors/articleshow/122531070.cms,"Photo by Logan Bowles/Getty Images

Why Shemar Stewart’s Texas A&M workouts could derail his Cincinnati Bengals NFL rookie deal

The legal battle that could define Shemar Stewart’s Cincinnati Bengals and Texas A&M football future

What’s next for Shemar Stewart as Cincinnati Bengals contract talks stall and Texas A&M return looms

Shemar Stewart was supposed to be the Cincinnati Bengals’ prized rookie this fall. Instead, he’s back in College Station, sweating it out at Texas A&M workouts while his NFL future hangs by a thread. Selected 17th overall in April’s NFL Draft, the defensive lineman now faces a high-stakes contract dispute that has left him with two risky options: negotiate with a team that currently holds all the power or fight for the legal right to play college football again. With millions in earnings and an entire year of development on the line, Stewart’s next move could shape the rest of his career—and everyone’s watching to see what happens next.While Shemar Stewart has yet to sign with the Bengals, this summer he’s been spotted working out with the Texas A&M football team. His presence in College Station has surprised many in the NFL and college football worlds, raising questions about NCAA eligibility rules and the leverage he actually has.Cover 3 podcast host Bud Elliott shared details about where and when these workouts have been happening, and who tipped him off about Stewart’s involvement.“He’s been at College Station. He’s been fully involved in workouts,” Elliott said on the show. He added, “A guy who has had some good (Texas) A&M stuff in the past, he hit me, he's like, 'Hey, Shemar might end up back here.'”Stewart’s contract standoff with the Bengals centers on default language in his rookie deal, a typical but often contentious part of NFL Draft negotiations. The Bengals selected him 17th overall in April, but no deal has been finalized, leaving him in limbo as training camps approach. Despite the tension, neither Stewart’s camp nor the Bengals have issued any new public statements updating the situation, deepening the uncertainty around when—or even if—a resolution will come.Even if Stewart hopes to suit up again for Texas A&M, that path is anything but simple. NCAA rules don’t currently allow him to play this season unless he wins a legal fight to restore his eligibility—a move that could trigger a lengthy court battle.Elliott underlined that uncertainty when he said on the podcast, “It may not be legal yet, but everything in the NCAA ecosphere is subject to litigation.”But there’s another catch: even if he did get a waiver to play for Texas A&M, the Bengals would still hold his NFL Draft rights. The only way Stewart can force his way back into next year’s draft and break from Cincinnati’s control would be to sit out football entirely this fall. That means missing an entire season of development—and risking millions in future earnings.For now, Stewart remains caught in a contractual maze that few rookies navigate successfully. He’s kept himself in top shape with his old team in College Station, but whether he’ll actually see the field for the Aggies—or the Bengals—any time soon is anyone’s guess.Shemar Stewart’s rookie journey is shaping up to be one of the NFL Draft’s most dramatic stories. Instead of preparing for his first pro training camp, he’s back at Texas A&M, clashing with Cincinnati over a contract stalemate that threatens to derail his career. With legal hurdles, NCAA eligibility rules, and his draft rights all in play, Stewart faces a defining choice: fight in court for a college return, compromise with the Bengals, or sit out and re-enter the draft next spring.What do you think? Should Stewart push for Texas A&M, hold out for the NFL, or find a way to settle with Cincinnati? Share your take below and join the debate.Also Read: Kansas City Chiefs show out as Patrick Mahomes leads star-studded support for unbeaten current",Shemar Stewart has been spotted working out with the Texas A&M football team this summer. His presence in College Station has surprised many in the NFL and college football worlds. The defensive lineman now faces a high-stakes contract dispute that has left him with two risky options.,"https://static.toiimg.com/thumb/msid-122531064,imgsize-872489,width-400,resizemode-4/122531064.jpg"
Paul Skenes wins hearts with sweet gesture as Olivia Dunne stuns in blue dress at All-Star carpet event,https://timesofindia.indiatimes.com/sports/mlb/news/paul-skenes-wins-hearts-with-sweet-gesture-as-olivia-dunne-stuns-in-blue-dress-at-all-star-carpet-event/articleshow/122530887.cms,"Paul Skenes wins hearts with sweet gesture as Olivia Dunne stuns in blue dress at All-Star carpet event (Image via Getty)

Paul Skenes helps Olivia Dunne with sandal at MLB All-Star red carpet

Olivia Dunne and Paul Skenes steal spotlight with chemistry and kindness

During the MLB All-Star red carpet event in 2025, fans were grinning. As cameras flashed and cheers erupted, Paul Skenes, the rising Pittsburgh Pirates star, was seen bending to help tie his girlfriend Olivia Dunne's sandal. Displaying a softer side of the powerful pitcher, the adorable gesture quickly became famous and made the pair a favorite at the party.Ahead of the Major League Baseball All-Star game at Truist Park in Atlanta, Georgia on Monday, July 14, 2025, the red carpet event took place. Set to start for the National League in the 95th MLB All-Star Game, Paul Skenes came with his girlfriend, well-known gymnast and social media influencer Olivia Dunne. Olivia Dunne wore an amazing royal blue gown and heels for the night.A tender moment was caught in a clip posted by the official MLB account on X (previously Twitter). Olivia Dunne stopped to straighten her sandals, then Paul Skenes dropped down right away to tie the cord. Shared on July 14, the video got thousands of likes and comments in few hours. While others admired how at ease and supportive the pair appeared on the red carpet, fans applauded Paul Skenes for being a ""true gentleman.Already this week, 22-year-old Paul Skenes made news for being the youngest pitcher to open two straight All-Star Games. His courteous and laid-back demeanor outside the pitch is capturing hearts as much as his talents there.Known for her gymnastics representing Louisiana State University as well as for her rising internet profile, Olivia Dunne Including outfit selections and travel tales with Paul Skenes, she shared behind-the-scenes images from the All-Star week that made their trip even more understandable for followers.Also Read: Paul Skenes And Olivia Dunne Dazzle Fans With Private Jet Arrival For MLB All-Star Game 2025 In Atlanta This red carpet appearance isn’t their first public moment, but the way Paul Skenes helped Olivia Dunne with her shoe showed fans a genuine bond. The sweet clip shows why Olivia Dunne and Paul Skenes continue to be one of the most talked-about sports couples in 2025.From athletic success to viral moments of kindness, Paul Skenes and Olivia Dunne proved that sometimes, small gestures leave the biggest impact.","Paul Skenes helps Olivia Dunne with sandal at MLB All-Star red carpet event in 2025. Adorable gesture quickly became famous and made the pair a favorite at the party. Pittsburgh Pirates pitcher, 22, is the youngest pitcher to open two straight All-Stars.","https://static.toiimg.com/thumb/msid-122530832,imgsize-1132639,width-400,resizemode-4/122530832.jpg"
Dylan Nolan goes to the Waterloo Black Hawks in a trade for Connor Brown,https://timesofindia.indiatimes.com/sports/nhl/news/dylan-nolan-goes-to-the-waterloo-black-hawks-in-a-trade-for-connor-brown/articleshow/122531625.cms,"Dylan Nolan goes to the Waterloo Black Hawks in a trade for Connor Brown (Image via Getty)

The growth path of Dylan Nolan: From Junior Kings to USHL stardom

Profile of Connor Brown : A skilled acquisition for the Tri-City Storm

A high-profile trade has resulted in Dylan Nolan, son of ex-NHL player Owen Nolan, entering a new environment by joining the Waterloo Black Hawks. After an exciting rookie campaign followed with some positive exploits in junior hockey, the young forward will now attempt to fit switching gears and aggressive styles of play while adding his scoring touch to a different system. Having been an instrumental move in his burgeoning USHL career, the ripples expanded to encompass both franchises.Dylan Nolan's local roots barely existed in junior hockey before he made the leap into the USHL. While with the San Jose Jr. Sharks, he made a great impact by scoring 50 points in his final season there. His transition to the LA Junior Kings only seemed to further Moe's cause, as back-to-back playoff appearances set the tone for his leadership on the ice. It's in his final year in LA that Nolan exploded onto the scene, delivering a jaw-dropping 80-point offensive season, netting 34 goals and assists to 46, firmly establishing his offensive presence.The breakout season produced an opportunity for a USHL career with the Tri-City Storm. Though his rookie campaign saw modest results, just two goals in 55 games, his playoff presence was notable. Ironically, one of his goals came against the very team he now joins: the Waterloo Black Hawks.Tri-City Storm receives Connor Brown, a calculated attempt at balancing youthful potential with proven college experience. Hailing from Florida, Brown was drafted by Waterloo in 2021 and proved to be a consistent playmaker with 21 goals and 42 assists during his stint. Although last season was sidelined due to injury, Brown spent time with Western Michigan University, which speaks to his versatility and future potential at the NCAA level.His inclusion in the deal gives Tri-City a forward who has technical skills complemented by solid playmaking instincts that would suit well in the Storm system as they try to bounce back from last year's early playoff outage.Also Read: Jordan Binnington and Cris Prosperi celebrate son Johnny’s first birthday with a sporty twist Dylan Nolan moving to Waterloo opens a plethora of opportunities for him as well as the Black Hawks, who are now eager to make the best of his energy and potential. Simultaneously, Tri-City is hoping Connor Brown can inject some life into their forward lines with collegiate smarts and offensive clout. As the new USHL season is upon us, this is a trade to keep an eye on.","Dylan Nolan goes to the Waterloo Black Hawks in a trade for Connor Brown. Tri- City Storm receives Connor Brown, a calculated attempt at balancing youthful potential with proven college experience. Connor Brown was drafted by Waterloo in 2021 and proved to be a consistent playmaker with 21 goals and 42 assists during his stint.","https://static.toiimg.com/thumb/msid-122531604,imgsize-979337,width-400,resizemode-4/122531604.jpg"
