Article Title,Article Link,Article Text,Article Summary,Article Image
"'Shame on you': Navjot Singh Sidhu slams 'BCCI should remove Ajit Agarkar, Gautam Gambhir' post",https://timesofindia.indiatimes.com/sports/cricket/news/shame-on-you-navjot-singh-sidhu-slams-bcci-should-remove-ajit-agarkar-gautam-gambhir-post/articleshow/124703920.cms,"India's head coach Gautam Gambhir, left, and Ajit Agarkar, chairperson of the Senior Men's Selection Committee, talk during a practice session (AP Photo/Ajit Solanki)

'Jay Shah Deserves Credit for How He Ran BCCI' | Arun Dhumal on BCCI’s Commitment & Leadership

Poll What is more important in cricket selection for the World Cup? Consistency & experience Emerging talent & team chemistry

Social media platforms often circulate fake quotes attributed to celebrities. Former Indian cricket star Navjot Singh Sidhu recently faced a similar situation with a fabricated quote circulating online.The fake post appeared before the India vs Australia series. It falsely claimed Sidhu had commented about removing Ajit Agarkar and Gautam Gambhir from their positions and reinstating Rohit Sharma as captain for India to win the 2027 World Cup.Sidhu quickly responded to the false attribution on platform X: ""Never said it, don't spread fake news, never imagined it. Shame on you.""The Indian cricket team is currently undergoing changes under BCCI chairman of selectors Ajit Agarkar and head coach Gautam Gambhir. Shubman Gill has been appointed as the new captain for ODIs and Tests.Questions have emerged about the future of veteran players Rohit Sharma and Virat Kohli , with the 2027 ODI World Cup approaching in two years.Agarkar recently addressed questions about Kohli and Sharma's participation in the 2027 World Cup.""They are part of the squad at the moment in Australia. They are incredible players, but this is not the forum to harp on individual performances.Two years from now, it's difficult to predict the situation. Who knows, younger players may emerge and claim those spots. Both are great players, and they will not be judged in every match. Once they start playing, we will assess the situation. It's about winning trophies, not just scoring runs. It's not like if they score three hundreds in the Australia series, they will automatically play the 2027 World Cup. We have to take the overall situation into account,"" Agarkar said.The Indian cricket management is focused on evaluating players' performances and making decisions based on team requirements. The future composition of the team remains uncertain as new talent emerges and veterans continue to perform.",Former Indian cricket star Navjot Singh Sidhu recently faced a similar situation with a fabricated quote circulating online. The Indian cricket team is currently undergoing changes under BCCI chairman of selectors Ajit Agarkar and head coach Gautam Gambhir. Shubman Gill has been appointed as the new captain for ODIs and Tests.,"https://static.toiimg.com/thumb/msid-124704110,imgsize-121356,width-400,resizemode-4/india-west-indies-cricket.jpg"
Pat McAfee calls out NFL referees after controversial catch call hands Detroit Lions a game-changing interception against Buccaneers,https://timesofindia.indiatimes.com/sports/nfl/news/pat-mcafee-calls-out-nfl-referees-after-controversial-catch-call-hands-detroit-lions-a-game-changing-interception-against-buccaneers/articleshow/124722804.cms,"Pat McAfee slams NFL over controversial call in Lions vs. Bucs game.

Pat McAfee calls out the refs as offense stalls and mistakes pile up

Both offenses struggled, but Detroit’s rookies stepped up when it mattered

Lions keep rolling, but officiating takes center stage once again



Also read

The Detroit Lions kept their hot streak alive with a 24-9 win over the Tampa Bay Buccaneers on Monday night, but the final score wasn’t what had people fired up after the game. A second-quarter call from the officials — one that took a potential catch away from Tampa Bay — quickly turned the spotlight away from Detroit’s defense and onto the referees. What looked like a solid play for the Bucs turned into a momentum swing for the Lions, and fans didn’t hold back.The biggest moment of controversy came when Buccaneers tight end Cade Otton went up for a contested catch. He seemed to hang on long enough before Lions DB Arthur Maulet stripped the ball away. Most viewers thought it was a completed catch followed by a fumble. But the refs ruled it an interception — giving the ball to Detroit — and even after review, the call stood. The decision immediately blew up online. Former NFL punter and ESPN analyst Pat McAfee summed up how a lot of fans were feeling when he posted this on X: ""The NFL (is) looking out for Detroit. . LOVE TO SEE IT,"" he wrote.The refs got most of the attention, but the game itself was rough on both sides. Detroit started strong with a touchdown catch from Amon-Ra St. Brown, but after that, both teams struggled to do much. There were a lot of punts and messy drives in the first half.Rookie running back Jahmyr Gibbs gave the Lions a bit of a spark in the second quarter. He fought through a tough drive and scored, giving Detroit a bigger lead. The rest of the night wasn’t much better. There were missed chances, fumbles, and two straight interceptions. Sterling Shepard lost a fumble for the Lions, but Tampa couldn’t take advantage — they missed the field goal. Tampa Bay’s only first-half points came from a Chase McLaughlin field goal just before the break. It didn’t do much to change the game.The Lions now sit at 5-1 and are looking like one of the most well-rounded teams in the NFC. They’ve found success on both sides of the ball, even in games like this where the offense wasn’t clicking on every drive. But even with the win, it’s the officiating that everyone’s still talking about. That second-quarter interception call won’t be forgotten anytime soon, especially by Buccaneers fans who felt the game slipped away unfairly.Tampa Bay drops to 3-3 and leaves Detroit with more questions than answers — and one frustrating highlight they’ll probably be watching for the rest of the week.","The Detroit Lions beat the Tampa Bay Buccaneers 24-9 on Monday night. The game was overshadowed by a controversial call in the second quarter. Former NFL punter Pat McAfee called out the refs on Twitter. The Lions now sit at 5-1, while Tampa Bay drops to 3-3.","https://static.toiimg.com/thumb/msid-124723069,imgsize-64720,width-400,resizemode-4/detroit-lions-vs-tampa-bay-buccaneers.jpg"
Jack Nicklaus wins $50 million in defamation case against former business partners,https://timesofindia.indiatimes.com/sports/international-sports/jack-nicklaus-wins-50-million-in-defamation-case-against-former-business-partners/articleshow/124722164.cms,"Jack Nicklaus (Image Source: Getty)

The story behind the lawsuit

Jury verdict and what it means for Jack Nicklaus

In a major victory for golf legend Jack Nicklaus, a Florida jury ruled in favor of the golfer in a $50 million defamation lawsuit against his past holding firm. The golfer, who is currently 85 years old, had been suing ex-business partners for allegedly making false statements that defamed him. The decision is a significant victory for Nicklaus, whose standing in the golf and business worlds had been questioned during the dispute.The lawsuit arose from a lengthy feud involving Jack Nicklaus and the Nicklaus Companies, which oversees his golf design and copyright holdings. Nicklaus sold the rights to his name, image and golf design work in 2007 for about $145 million. In 2017 he resigned from an executive position, and when he did, a five-year non-compete began which temporarily blocked him from independent work.At the heart of the suit were alleged defamatory statements against Nicklaus from the company’s leadership. The most prominent allegation was the report that he had taken or considered a $750 million contract to join the Saudi-backed LIV Golf League. Those statements were ""entirely false"" and ""defamatory,"" Nicklaus said.His attorneys claimed these accusations were leaked to the press and created a public relations nightmare.Then there were also some about his mental conditioning, which Nicklaus was not going to abide by. His attorneys also told the court that a 2021 meeting with officials from Golf Saudi was strictly for golf-course design, not about signing up for LIV Golf. Nicklaus said he quickly turned down any talk of LIV because of his loyalty to the PGA Tour and his values.However, the jury in Florida ruled in favour of Jack Nicklaus finding that false statements had been made which damaged the sporting icon's reputation. He was ordered $50 million in damages, the verdict also stated. The jury imposed personal liability on the Nicklaus Companies but not on two individuals, including billionaire Howard Milstein.Also Read: Tiger Woods vs Jack Nicklaus vs Rory McIlroy: PGA Tour wins, majors, and stats compared Nicklaus's attorney acknowledged that it was a difficult case due to the high bar to show injury to a public figure's reputation. But there was enough merit to convince the jury that Nicklaus had been the victim of some foul play. The ruling closes the book on a lengthy and contentious saga between the golf icon and his erstwhile business partners, providing Nicklaus a solid legal and personal win as he continues to preserve his status in the game he basically created.","Jack Nicklaus wins $50 million defamation lawsuit against ex-business partners. Florida jury rules in favor of golf legend. Nicklaus sold the rights to his name, image and golf design work in 2007 for about $145 million. The lawsuit arose from a lengthy feud involving Nicklaus and the Nicklaus Companies, which oversees golf design and copyright holdings.","https://static.toiimg.com/thumb/msid-124722140,imgsize-429432,width-400,resizemode-4/jack-nicklaus.jpg"
Who are Auston Matthews’ parents? Inside the life of Maple Leafs Captain and his family,https://timesofindia.indiatimes.com/sports/nhl/news/who-are-auston-matthews-parents-inside-the-life-of-maple-leafs-captain-and-his-family/articleshow/124632301.cms,"Auston Matthews with his parents, Ema and Brian Matthews (Image via: Instagram)

Meet Auston Matthews’ mother: Ema Matthews





Meet Auston Matthews’ father: Brian Matthews

The family’s role in shaping Auston Matthews’ rise







Auston Matthews, the captain of the Toronto Maple Leafs, is one of the most dominant forces in the NHL today. Known for his incredible scoring touch and calm leadership, his rise to hockey stardom didn’t happen overnight. Behind his success stands a strong and supportive family, especially his parents, Brian and Ema Matthews, whose influence shaped his journey to becoming one of the NHL’s biggest stars.Auston’s mother, Ema Matthews, was born and raised in Mexico and later moved to California. She dreamed of becoming a pilot, but due to high training costs and gender limitations at the time, she pursued a career as a flight attendant instead. While working for Aero California, she often flew routes to Los Angeles — a decision that would change her life forever. In addition to her aviation career, Ema also worked for Starbucks, balancing her job with her ambitions and showing her strong work ethic from an early age.On one of those flights, she met Brian Matthews, who was working part-time for an airline while playing baseball at Loyola Marymount University.Their connection was instant, and that spark eventually led to the foundation of a close-knit and loving family. Ema has always been a major emotional anchor in Auston’s life. Her cultural roots and nurturing personality gave Auston a deep sense of discipline and humility that reflects in how he carries himself on and off the ice.Auston’s father, Brian Matthews, is a former baseball pitcher from Loyola Marymount University. A dedicated athlete himself, Brian originally hoped Auston would follow in his footsteps and play baseball. However, when he noticed his son’s growing fascination with hockey, he gave his full support. Brian was instrumental in helping Auston train, practice, and stay focused through his early years in Scottsdale, Arizona. His understanding of athletic discipline and competitive mindset became key influences on Auston’s development.Brian Matthews’ guidance helped Auston Matthews become one of the top NHL stars, showcasing the impact of parental support in shaping elite athletes. Growing up in Scottsdale, Arizona, Auston Matthews trained at local hockey programs that are now recognized as top youth hockey development centers, cementing his path to NHL stardom.When Auston was just two months old, the Matthews family moved to Scottsdale, Arizona — a place not exactly known for hockey. Yet, his parents made every effort to nurture his interest. From taking him to early morning practices to supporting his time with the USA Hockey National Team Development Program and later in Switzerland with ZSC Lions, Brian and Ema stood by every decision.Their constant encouragement and belief shaped Auston into the player he is today — a record-breaking Maple Leafs captain, a multiple Rocket Richard Trophy winner, and one of the most admired figures in the NHL. Auston Matthews continues to lead the Toronto Maple Leafs with unmatched skill and leadership, drawing millions of fans and setting new benchmarks for American-born NHL players.Behind Auston Matthews’ incredible achievements is a story of family, sacrifice, and unwavering support. Brian and Ema Matthews’ influence didn’t just help shape a world-class athlete — they helped raise a leader whose talent and humility continue to inspire fans around the world.Also Read: Auston Matthews got the goal, but these Leafs players stole Thursday night in 2-1 OT win over Rangers","Auston Matthews, captain of the Toronto Maple Leafs, is one of the most dominant forces in the NHL today. Behind his success stands a strong and supportive family, especially his parents, Brian and Ema Matthews. Brian Matthews was instrumental in helping Auston train, practice, and stay focused through his early years.","https://static.toiimg.com/thumb/msid-124632736,imgsize-94728,width-400,resizemode-4/auston-matthews.jpg"
Lamar Jackson injury update: Baltimore Ravens QB misses practice again – will he play must-win game this Sunday against Chicago Bears?,https://timesofindia.indiatimes.com/sports/nfl/news/lamar-jackson-injury-update-baltimore-ravens-qb-misses-practice-again-will-he-play-must-win-game-this-sunday-against-chicago-bears/articleshow/124723397.cms,"Lamar Jackson misses practice again.

Lamar Jackson’s hamstring still a concern as Ravens approach must-win game

Ravens’ Lamar Jackson Pushes Fan Who Slapped Him During Touchdown Celebration at Bills Game

Ravens face pressure to win as backup QB Cooper Rush looks to continue starting streak

Also read

Baltimore Ravens quarterback Lamar Jackson has been sidelined with a hamstring injury since Week 5, missing the past two games. While it was widely expected that Jackson would return after the team's Week 7 bye, his absence from Monday’s first practice back has cast doubt on his availability for Sunday’s important game against the Chicago Bears. With the Ravens sitting at 1-5, Jackson’s presence is critical as Baltimore looks to turn around a disappointing start to the 2025 NFL season.Jackson’s hamstring injury, sustained in the September 28 loss to the Kansas City Chiefs, has kept him off the field since. The two-time NFL MVP did not participate in Monday’s practice — the Ravens’ first since their bye week — raising questions about whether he will be ready to start against the Bears in Week 8. While early-week practices are often light sessions focused on rest and recovery following a bye, Jackson’s absence is still notable given the urgency of the upcoming matchup.Jamison Hensley of ESPN reported, “QB Lamar Jackson remains sidelined with a hamstring injury. The 2-time NFL MVP did not participate in Monday’s practice, which was the Ravens’ first one since coming off the bye. Jackson hasn’t suited up since injuring his hamstring in Kansas City on Sept.28.”As the week progresses, the Ravens’ injury report on Wednesday will be crucial in determining Jackson’s playing status. Even a limited practice could signal that Jackson is on track to return after missing two games. Should he remain sidelined, backup quarterback Cooper Rush would be tasked with starting a third consecutive game, a scenario that could shift betting lines significantly.Baltimore’s 1-5 record has put the team in a must-win situation, especially with losses coming in Jackson’s absence. The Ravens fell to both the Houston Texans and Los Angeles Rams without their star quarterback, showing just how vital Jackson’s return would be for their playoff hopes. Despite the slow start to the season, Jackson showed strong play in the games he started, throwing for 869 yards, 10 touchdowns, and only one interception, while rushing for 166 yards and scoring once himself.If Jackson can return and play at his best, he could spark the Ravens’ season and potentially make a case for MVP consideration as Baltimore fights to reach the postseason.","Baltimore Ravens quarterback Lamar Jackson has been sidelined with a hamstring injury since Week 5. The two-time NFL MVP did not participate in Monday’s practice, raising questions about whether he will be ready to start against the Chicago Bears in Week 8. The Ravens’ 1-5 record has put the team in a must-win situation, especially with losses coming in Jackson's absence.","https://static.toiimg.com/thumb/msid-124723402,imgsize-45654,width-400,resizemode-4/lamar-jackson.jpg"
"Patrick Mahomes and wife Brittany rally support for kids at star-studded gala, raise $1.5M for more than 20 charities in one night",https://timesofindia.indiatimes.com/sports/nfl/news/patrick-mahomes-and-wife-brittany-rally-support-for-kids-at-star-studded-gala-raise-1-5m-for-more-than-20-charities-in-one-night/articleshow/124726277.cms,"Patrick Mahomes and wife Brittany raise millions for children’s charities.

Patrick Mahomes and Brittany raise over $1.5 million for kids’ charities at foundation gala

Mahomes is heating up on the field with MVP numbers and a healthy group of receivers

Mahomes inspired over 2,000 kids to serve their communities around the world

Also read:","Patrick Mahomes and wife Brittany raise over $1.5 million for kids’ charities at foundation gala. Mahomes inspired over 2,000 kids to serve their communities around the world. The Chiefs quarterback is heating up on the field with MVP numbers and a healthy group of receivers.","https://static.toiimg.com/thumb/msid-124726934,imgsize-35766,width-400,resizemode-4/patrick-brittany.jpg"
Pakistan's Mohsin Naqvi to India: 'Bring your captain and players and receive Asia Cup trophy from me',https://timesofindia.indiatimes.com/sports/cricket/asia-cup/pakistans-mohsin-naqvi-to-india-bring-your-captain-and-players-and-receive-asia-cup-trophy-from-me/articleshow/124723807.cms,"Mohsin Naqvi (AP Photo/Altaf Qadri)

Inside details of how PCB chief Mohsin Naqvi ran away with the Asia Cup trophy!

The Asian Cricket Council (ACC) chairman and Pakistan Cricket Board president Mohsin Naqvi has proposed organising an event in Dubai to present the Asia Cup trophy to the Indian men's cricket team. The event is planned for November 10 following correspondence between the ACC and the Board of Control for Cricket in India BCCI ).""There was a series of letters exchanged with the BCCI, and the ACC has conveyed to them that we are ready to host Indian skipper Suryakumar Yadav and his players with BCCI official Rajiv Shukla to take the trophy in a ceremony on November 10 in Dubai,"" Naqvi told the media in Karachi.The Indian team did not accept the trophy from Naqvi after winning the final against Pakistan on September 28. After nearly an hour of standoff, Naqvi instructed the trophy to be removed from the stadium.The Indian captain Suryakumar later mimicked receiving the trophy with his teammates. The team departed without the actual trophy.The Indian players' refusal to accept the trophy from Naqvi was linked to his position as Pakistan's Interior Minister and alleged support for terrorism in India.Indian media reports indicated that the BCCI might address this issue at upcoming International Cricket Council (ICC) and ACC meetings.The ICC Board meeting is scheduled in Dubai from November 4-7.""The ACC has written to the BCCI that a ceremony can be held in Dubai on November 10. Bring your captain and players and receive the trophy from me,"" said Naqvi.India maintained a perfect record against Pakistan in the Asia Cup, winning all three encounters. The Indian players chose not to shake hands with their Pakistani counterparts in these matches.Suryakumar received a 30 percent match fee fine from the ICC for dedicating the first match victory to the Pahalgam terror attack victims in Jammu and Kashmir.Pakistani fast bowler Haris Rauf also faced a 30 percent match fee penalty for displaying political slogans in the second match on September 21. However, opener Sahibzada Farhan was not penalized for his bat-wielding celebration after scoring fifty runs in the same game.",Mohsin Naqvi proposes to present the Asia Cup trophy to the Indian men's cricket team in Dubai. The event is planned for November 10 following correspondence between the ACC and the Board of Control for Cricket in India BCCI. The Indian team did not accept the trophy after winning the final against Pakistan on September 28.,"https://static.toiimg.com/thumb/msid-124724044,imgsize-74294,width-400,resizemode-4/mohsin-naqvi-says-india-is-still-39welcome39-to-receive-asia-cup-from-him.jpg"
'This is tech city': Bengaluru techie reunited with lost backpack in minutes; how airport staff tracked it using UPI,https://timesofindia.indiatimes.com/city/bengaluru/this-is-tech-city-bengaluru-techie-reunited-with-lost-backpack-in-minutes-how-airport-staff-tracked-it-using-upi/articleshow/124732085.cms,"Image Credit: X

BENGALURU: A techie travelling to Bengaluru’s Kempegowda International Airport was reunited with his forgotten backpack within minutes, thanks to the quick action of airport staff and a digital payment trail.Jaskaran Singh said he left his bag on a BMTC KIA shuttle bus while heading to the airport, only realising the oversight just before check-in.“Forgot my backpack on a KIA shuttle bus to Bangalore airport and realised just before check-in,” Singh wrote in a post on X (formerly Twitter).Unable to locate the bag himself, Singh approached airport personnel.Using the details of his UPI transaction for the shuttle fare, staff were able to trace the bus number and recover the backpack promptly.“Staff traced the bus number using my UPI transaction and got my bag back. Love how this tech city solves everything. Huge thanks to Ravi for the help,” he added.The post quickly went viral, with social media users praising both the efficiency of the airport team and the use of technology to resolve the issue.",Jaskaran Singh said he left his bag on a BMTC KIA shuttle bus while heading to the airport. He only realised the oversight just before check-in. Staff traced the bus number using his UPI transaction and got his bag back.,"https://static.toiimg.com/thumb/msid-124732122,imgsize-91648,width-400,height-225,resizemode-72/-.jpg"
