Article Title,Article Link,Article Text,Article Summary,Article Image
"Vegas Golden Knights star Mitch Marner drops confident comment after first goals, shaking up team dynamics",https://timesofindia.indiatimes.com/sports/nhl/news/vegas-golden-knights-star-mitch-marner-drops-confident-comment-after-first-goals-shaking-up-team-dynamics/articleshow/124698804.cms,"Mitch Marner (Getty Images)

Mitch Marner’s comeback sparks Golden Knights’ momentum





Cameras Catch NHL Reporter’s EMBARRASSING Fall Before Rangers Game | WATCH

Power play perfection highlights Marner’s impact





Mitch Marner finally broke through with a stunning two-goal performance against the Calgary Flames, silencing any doubts surrounding his scoring this season. Fans had grown concerned after the first five games of the 2025-26 NHL season, but Marner’s showing reminded everyone why he’s one of the league’s most dynamic forwards. His efforts helped the Vegas Golden Knights secure a 6-2 win and climb to the top of the Pacific Division.Mitch Marner spoke openly about his approach after snapping his scoring drought. “I knew I was going to get looks and opportunities,” he said. “I knew they would fall eventually. I was just trying to make sure I do everything else right to get the opportunities to put myself in that spot to get those looks.”This marked Marner’s first multi-goal game since March 8, 2024, when he scored twice for the Toronto Maple Leafs in a 7-4 loss to the Colorado Avalanche. Scoring in his new team colors seems to have revitalized him, giving Vegas a boost in both confidence and performance.Mitch Marner’s contributions extended beyond his goals. Vegas operated at 100% on the power play, converting all three man-advantage opportunities against Calgary. “It’s pretty fun,” Marner commented on the team’s power play. “There’s so many different threats out there that make plays. They’ve done a great job down low of really making teams play in different areas there and it’s been a lot of fun to watch.”The Golden Knights now boast the NHL’s second-best power play, converting at a 37.5% clip this season, just behind the Minnesota Wild (38.5%). Marner’s arrival and immediate impact could be the key to keeping Vegas at the top of the standings while energizing fans eager for consistent performances.With his scoring touch back and the team firing on all cylinders, Mitch Marner’s debut season in Las Vegas is starting to look like a perfect fit, offering a glimpse of the excitement that lies ahead.Also Read: Sidney Crosby’s Penguins exit? Insider spills the single scenario that could change everything","Mitch Marner broke his scoring drought with a stunning two-goal performance against the Calgary Flames. Marner’s efforts helped the Vegas Golden Knights secure a 6-2 win and climb to the top of the Pacific Division. Vegas operated at 100% on the power play, converting all three man-advantage opportunities against Calgary.","https://static.toiimg.com/thumb/msid-124698820,imgsize-32958,width-400,resizemode-4/mitch-marner.jpg"
Conor McGregor and Dee Devlin combined net worth in 2025: How love and business built an Irish empire,https://timesofindia.indiatimes.com/sports/international-sports/conor-mcgregor-and-dee-devlin-combined-net-worth-in-2025-how-love-and-business-built-an-irish-empire/articleshow/124694954.cms,"Conor McGregor and Dee Devlin (Image Source: Getty)

Conor McGregor and his financial empire

Conor McGregor’s Presidential Run Official: But Can He Overcome THESE Massive Political Roadblocks?

Dee Devlin: The power behind the success

The Irish power couple built on passion and hustle

Conor McGregor is one of the most famous fighters in UFC history. His journey from working as a plumber’s apprentice in Dublin to becoming one of the most successful fighters grew exponentially. He is known for his charismatic personality and knockout power. He holds two titles simultaneously, which are the featherweight and lightweight. He is one of the first UFC fighters to hold titles simultaneously.Conor McGregor’s UFC career and his pay-per-view earnings helped him earn millions for himself and helped in his financial growth. His biggest financial earning was from the sale of his whiskey brand, Proper No. Twelve, which, as per the reports, earned him over $150 million.He also owns a clothing line named August McGregor, McGregor Sports and Entertainment brand, and a fitness business, which helps him grow financially, even though lately he is not involved in his fighting career much. He has used his fighting platform to create this legacy.Conor McGregor’s manager, Dee Devlin, who used to manage his schedules and finances during his early fighting days, later became a crucial part of his business and empire and is now his long-time partner.Dee Devlin currently oversees his company's operations, attends brand events, and manages everything behind the scenes.Apart from her talents and managing businesses, she is loved for her personality and grounded nature. The family has 5 members in total, including the power couple and their 3 children, and can work a very strong bond despite all the luxuries and lavishness that they have.Also Read: Conor McGregor accepts 18-month ban for UFC anti-doping violations Conor McGregor and Dee Devlin are all about their ambition, teamwork, and loyalty towards each other. They have together converted Conor McGregor’s fame and influential personality into a long-term business legacy, investing smartly and giving back to Irish communities.Their life’s journey is an inspiration for many people out there in terms of love and business. Their story proves that with shared vision and relentless dedication, success becomes a family achievement rather than an individual one. Together, they embody the true spirit of partnership, turning passion into purpose and dreams into lasting impact.","Conor McGregor is one of the most famous fighters in UFC history. His biggest financial earning was from the sale of his whiskey brand, Proper No. Twelve, which, as per the reports, earned him over $150 million. He also owns a clothing line named August McGregor, McGregor Sports and Entertainment brand, and a fitness business.","https://static.toiimg.com/thumb/msid-124694953,imgsize-1009879,width-400,resizemode-4/conor-mcgregor-and-dee-devlin.jpg"
"Adelaide ODI shock: Virat Kohli safe, but Rohit Sharma in big trouble",https://timesofindia.indiatimes.com/sports/cricket/india-vs-australia/adelaide-odi-shock-virat-kohli-safe-but-rohit-sharma-in-big-trouble/articleshow/124732572.cms,"Rohit Sharma was dismissed for 8 runs, while Virat Kohli lasted just eight balls before being sent back to the pavilion for a duck. (Image credit: Agencies)

Go Beyond The Boundary with our YouTube channel. SUBSCRIBE NOW!

Virat Kohli, Rohit Sharma, Shubman Gill struggle as India falter in first ODI vs Australia

NEW DELHI: Virat Kohli and Rohit Sharma ’s much-anticipated return to India colours didn’t go as planned in Perth, but a strong comeback in the second ODI against Australia at Adelaide on Thursday, October 23, could reignite excitement among fans.Adelaide Oval has historically been a fortress for Kohli.In ODIs at this venue, he has scored 244 runs in four matches at an impressive average of 61, including two centuries.His Test record at the ground is even more remarkable, with 537 runs in five matches at an average of 53.70, featuring three centuries.Combined across formats—including ODIs, Tests, and T20Is—Kohli has played 12 matches at Adelaide, scoring 975 runs at an average of 65, with five centuries and a highest score of 141, along with 10 catches.Rohit, on the other hand, has had a modest record at Adelaide.Across six ODIs, he has scored 131 runs at an average of 21.83, with a highest score of 43. Despite this, his experience and match-winning potential make him a key figure in India’s batting line-up.Returning to international cricket after seven months, both stalwarts struggled in the series opener at Perth.Rohit was dismissed for 8 runs, while Kohli lasted just eight balls before being sent back to the pavilion for a duck.India cricket legend Sunil Gavaskar believes the Perth flop should not be overemphasised.“They were playing on probably the bounciest pitch in Australia. It wasn’t going to be easy, especially for players who haven’t played international cricket for a couple of months. It was challenging for Shubman Gill and Shreyas Iyer, who usually play regularly,” Gavaskar said.He added, “India are still a very, very good team. They’ve won the Champions Trophy. Don’t be surprised if Rohit and Kohli score big in the next two games. The more they play, the more time they spend in the nets, the more throwdowns they get — maybe even from reserve bowlers bowling from 20 yards instead of 22 — the quicker they’ll find their rhythm. Once they’re back among the runs, India’s total will be 300, 300-plus.”","Adelaide Oval has historically been a fortress for Virat Kohli. Kohli has scored 244 runs in four matches at this venue at an impressive average of 61. Rohit, on the other hand, has had a modest record at Adelaide. India legend Sunil Gavaskar believes the Perth flop should not be overemphasised.","https://static.toiimg.com/thumb/msid-124732621,imgsize-91892,width-400,resizemode-4/virat-rohit-2210-pti.jpg"
"After kick-off protests, La Liga cancels Villarreal vs Barcelona in Miami",https://timesofindia.indiatimes.com/sports/football/top-stories/after-kick-off-protests-la-liga-cancels-villarreal-vs-barcelona-in-miami/articleshow/124732430.cms,"A general view as players of Villarreal CF and Real Betis stand still for the first fifteen seconds of the match, as they protest against the upcoming Barcelona and Villarreal LaLiga match. (Getty Images)

La Liga has canceled plans to host a historic Barcelona versus Villarreal match in Miami this December due to mounting uncertainty within Spain, marking the end of what would have been the first European league fixture played abroad.The match, originally scheduled for December 20 at the Hard Rock Stadium, will now take place at Villarreal's home ground, Estadio de la Ceramica.La Liga's promoter decided to cancel the event, with the organisation expressing deep regret that the project could not proceed, viewing it as a missed opportunity to showcase Spanish football internationally.Barcelona issued a statement accepting the decision, noting they had also accepted the initial decision to play in Miami.""Barcelona respect and accept the decision to cancel the match against Villarreal in Miami... just as we respected and accepted the decision to play when it was made at the time,"" the club stated.The Catalans also expressed disappointment about missing the chance to expand in a strategic market and that US fans would miss seeing the game in person.The timing of La Liga's announcement drew criticism from Villarreal coach Marcelino Garcia Toral, as it came during his team's Champions League match against Manchester City.""It seems to me an absolute lack of respect to put out a statement at half-time of a game about something that was planned but will not happen. It's a lack of respect to the directors of the club, the club itself, the professionals and the fans,"" Marcelino stated.The proposal faced significant opposition within Spain. The Spanish Footballers' Association organised protests, with players remaining stationary for 15 seconds at the start of each league match last weekend.Real Madrid opposed the plan institutionally, with their captain Dani Carvajal telling La Liga president Javier Tebas that playing games abroad would be ""a stain"" on the competition.Real Madrid goalkeeper Thibaut Courtois argued it would adulterate the competition.La Liga has attempted to organise overseas matches for several years. This attempt came closest to fruition after receiving permission from UEFA , European football's governing body.UEFA maintained its general opposition to overseas games but agreed to allow this match as an exception, along with an upcoming Serie A match between AC Milan and Como planned for Australia in February.The ticket presale, scheduled to begin on Tuesday, was initially delayed before the entire plan was abandoned.","La Liga cancels plans to host a historic Barcelona versus Villarreal match in Miami this December. The match would have been the first European league fixture played abroad. La Liga's promoter expressed deep regret that the project could not proceed. Barcelona issued a statement accepting the decision, noting they had also accepted the initial decision to play in Miami.","https://static.toiimg.com/thumb/msid-124732428,imgsize-247738,width-400,resizemode-4/villarreal-cf-v-real-betis-balompie-laliga-ea-sports.jpg"
Why Kevin Durant ditched 35 and embraced No. 7 as the Houston Rockets star embarks on a new chapter,https://timesofindia.indiatimes.com/sports/nba/top-stories/why-kevin-durant-ditched-35-and-embraced-no-7-as-the-houston-rockets-star-embarks-on-a-new-chapter/articleshow/124729357.cms,"Kevin Durant. Image via: Getty Images

Why did Kevin Durant choose no.7 over no.35 this season?

What could the change of jersey numbers mean for Kevin Durant and his fans?

Houston Rockets star Kevin Durant is all set to play in the 2025-26 season that starts on Tuesday with his jersey no.7. The 2x NBA champion and Finals MVP has given up no.35 and embraced no.7, and that could be a game-changer. For most of his career, no.35 was acknowledged as his signature number, and he played almost all the matches wearing this number. Why did Kevin Durant opt for this change just before the season started, and what could be the real reason behind this change of numbers? Here is a detailed look at why the Houston Rockets star wants the change:There are no clear and valid reasons as to why the Rockets' star, Kevin Durant, has chosen this number. Probably because his signature jersey was available during his trade to the Houston Rockets. Kevin Durant has played for the Seattle Supersonics, Oklahoma City Thunder, Golden State Warriors, and Phoenix Suns while wearing the no.35.Houston Rockets star Kevin Durant has worn the no.35 jersey almost his whole life. However, this season, the Slip Reaper has decided to wear the no.7 jersey, and he does look extra slim and sleek while wearing it.Fans and media might think that this would be Durant’s first time wearing no.7. However, things are quite the opposite. Previously, Durant has rocked with this number while playing for the Brooklyn Nets.There is a hint of nostalgia when it comes to wearing the jersey no.35, and his fans know it well. This number honors his first coach, Charles Craig, who was murdered at the age of 35. However, he is no longer wearing this current number, which might seem a bit outdated for his current team. Also, fans are used to seeing him wearing this number, and while they don’t want a change, they might have to adapt to this.Currently, Kevin Durant is wearing jersey no.7 for the upcoming season 2025-26, which is a fresh beginning and a new start for the Houston Rockets, as well as for Durant, who once rocked in this number. However, for fans, no.7 might be less significant as compared to no.35, which used to be his signature number.Also read: What are Kevin Durant’s off-court interests? Exploring hobbies that keep NBA star focused and grounded","Houston Rockets star Kevin Durant has worn the no.35 jersey almost his whole life. However, this season, the Slip Reaper has decided to wear no.7. Durant has played for the Seattle Supersonics, Oklahoma City Thunder, Golden State Warriors, and Phoenix Suns while wearing this number.","https://static.toiimg.com/thumb/msid-124729358,imgsize-28540,width-400,resizemode-4/kevin-durant.jpg"
Chess GM Daniel Naroditsky Death: Vladimir Kramnik raises concerns about 'substance abuse',https://timesofindia.indiatimes.com/world/rest-of-world/chess-gm-daniel-naroditsky-death-vladimir-kramnik-raises-concerns-about-substance-abuse-decoding-the-story/articleshow/124711725.cms,"Chess World Shocked: Daniel Naroditsky’s Final Stream Sparks Questions

'Hope properly investigated': Kramnik suggests substance abuse



How Kramnik and Naroditsky’s relationship evolved — from public glasses







American chess Grandmaster Daniel Naroditsky took his last breath on Sunday, at the age of 29, his family confirmed on Monday.Naroditsky, known as “Danya” in the chess community, was among the world’s top-ranked blitz players and a well-known chess commentator, author, and content creator.Till now there has no news on the reason behind the death, however, former World Chess Champion Vladimir Kramnik has alleged a foul play, hinting at possible drug use and alleging that signs of distress were ignored by those close to Naroditsky.Vladimir Kramnik, who previously accused Naroditsky of cheating in 2024, shared screenshots on social media from a private message sent by a viewer who had watched Naroditsky’s final stream.The message expressed concern over Naroditsky’s condition and questioned whether he was under the influence of drugs.Sharing the screenshot, Kramnik tweeted, ""What exactly happened? Because I received this two days ago from a friend of mine, chess fan, and at least did what I could to warn people to do something urgently in my posts. To those who prefer blaming and shaming instead of helping. Awful tragedy, hope properly investigated.""Before Naroditsky’s death was confirmed, Kramnik had posted several tweets suggesting the streamer was “on something else than sleeping pills.”After the news broke, he continued to criticize those close to Naroditsky, alleging they ignored signs of serious problems.In another tweet, he wrote, ""Too high price paid, but if I was the only person shouting about obvious long-term problems of Danya becoming alarming, requiring urgent measures from people around, while 'friends' only cared about hiding it and erase evidence, it’s rotten to the core.""The controversy that cast a long shadow over Daniel Naroditsky's final year commenced when Vladimir Kramnik publicly accused him of cheating through a series of online posts in early 2024.Kramnik alleged that Naroditsky used a second screen to consult chess engines, a serious accusation undermining the integrity of a professional player. Naroditsky, ranked among the world's top 75 in Rapid and top 25 in Blitz, had to defend himself in the court of public opinion.He strongly denied the allegations, stating that his streaming setup had been misinterpreted by Kramnik. In a raw and emotional response, Naroditsky described the former world champion as 'worse than dirt' for making such damaging claims without concrete evidence.The allegations compelled Naroditsky to release detailed videos defending his setup and playing style, an ordeal that visibly affected the popular streamer, International Business Times UK reported.","Daniel Naroditsky, 29, died on Sunday, his family confirmed on Monday. Former World Chess Champion Vladimir Kramnik has alleged foul play, hinting at possible drug use. He also alleged that signs of distress were ignored by those close to Naroditsy.","https://static.toiimg.com/thumb/msid-124711938,imgsize-65476,width-400,resizemode-4/daniel-naroditsky-left-and-vladimir-kramnik-right.jpg"
"Is Luka Doncic playimg tonight vs Golden State Warriors? Latest update on the Los Angeles Lakers star's injury report (October 21, 2025)",https://timesofindia.indiatimes.com/sports/nba/top-stories/is-luka-doncic-playimg-tonight-vs-golden-state-warriors-latest-update-on-the-los-angeles-lakers-stars-injury-report-october-21-2025/articleshow/124726268.cms,"Luka Doncic of the Los Angeles Lakers (Image via Getty Images)

Los Angeles Lakers

Luka Doncic

How Luka Doncic’s Presence Impacts the Los Angeles Lakers

Luka Doncic’s Injury Report vs Golden State Warriors (October 21, 2025)

Luka Doncic is now in the Los Angeles Lakers (Image via Instagram / @lukadoncic)

The Curry-Doncic Showdown

What to Expect from tonight's Lakers vs Warriors Matchup

Theare opening their 2025–26 NBA campaign with a mix of anticipation and anxiety as they face off against the Golden State Warriors tonight at Crypto.com Arena. While LeBron James remains sidelined due to a sciatica injury, all eyes are now on- the team’s new cornerstone - as he prepares to make his official season debut in purple and gold.This game isn’t just another season opener; it’s the dawn of a new era for the Los Angeles Lakers . Luka Doncic, acquired in a blockbuster trade from the Dallas Mavericks last February, is entering his first full season with the franchise. After a full offseason of recovery and training, the Slovenian superstar looks ready to carry the Lakers’ offense - and their championship hopes - on his shoulders.Doncic expressed fierce determination during pregame interviews, telling reporters, “I aim to win every match… we’re going all in.” That confidence echoes throughout the Lakers locker room, where belief in the team’s potential runs high despite the absence of their long-time leader. LeBron James ’ continued battle with sciatica has forced the Los Angeles Lakers to adjust early. The 40-year-old legend is expected to miss several weeks, leaving a significant void both on and off the court. Meanwhile, veteran forward Maxi Kleber remains sidelined with an abdominal strain and will be re-evaluated in a couple of weeks, according to Silver Screen and Roll.The silver lining? Doncic is fully healthy after last season’s calf injury, and Lakers fans are eager to see how he meshes with offseason additions Deandre Ayton and Marcus Smart.Of course, any Lakers-Warriors clash means one thing: Stephen Curry. The two-time MVP will lead Golden State into hostile territory, setting up a marquee duel between two of the game’s most creative offensive minds.Analysts expect fireworks. NBC Sports projects high-scoring potential given both teams’ revamped lineups and perimeter threats. While LeBron’s absence removes one superstar from the mix, Doncic’s presence more than compensates, ensuring fans still get the heavyweight spectacle they crave.For Luka Doncic , tonight isn’t just about stats - it’s about sending a message. After years of playoff frustration in Dallas, he now has a fresh start in one of the league’s most storied franchises. With a sold-out crowd, national television spotlight, and the Warriors on the other side, Doncic has every opportunity to make an early-season statement.If he delivers - and early signs suggest he will - the Los Angeles Lakers could quickly shift from uncertainty to legitimate title contenders.• Tip-off: 10:30 PM ET at Crypto.com Arena• Broadcast: ESPN & NBA League Pass• Key Absences: LeBron James (sciatica), Maxi Kleber (abdominal strain)• Watch For: Doncic–Curry duel, Ayton’s Lakers debut, JJ Redick’s offensive schemesAlso read: Los Angeles Lakers vs Golden State Warriors (October 21, 2025) prediction, odds, best NBA prop bets, moneyline, spread, and more Even without LeBron James, tonight’s Los Angeles Lakers vs Warriors opener feels electric. Luka Doncic is healthy, motivated, and ready to take command of Los Angeles basketball. Whether he can deliver on his MVP-level promise remains to be seen, but one thing’s certain - the NBA spotlight shines brightest on Hollywood, and Luka looks ready for his close-up.",The Los Angeles Lakers open their 2025–26 NBA campaign against the Golden State Warriors tonight at Crypto.com Arena. LeBron James remains sidelined due to a sciatica injury. Luka Doncic is set to make his official season debut in purple and gold. The Slovenian superstar looks ready to carry the Lakers’ offense.,"https://static.toiimg.com/thumb/msid-124727036,imgsize-52000,width-400,resizemode-4/luka-doncic-of-the-los-angeles-lakers.jpg"
