Article Title,Article Link,Article Text,Article Summary,Article Image
"WWE NXT Results & Highlights (7/15/25): TNA's Masha Slamovich stands tall over Jacy Jayne, Family Business match and more",https://timesofindia.indiatimes.com/sports/wwe/top-stories/wwe-nxt-results-highlights-7/15/25-tnas-masha-slamovich-stands-tall-over-jacy-jayne-family-business-match-and-more/articleshow/122551930.cms,"Image via WWE

Opening segment with Fatal Influence



Joe Hendry, Mike Santana & Trick Williams vs. Dion Lennox, Osiris Griffin and Saquon Shugars

Kali Armstrong vs. Karmen Petrovic

Tony D’Angelo vs. Stacks vs. Luca Crusifino

Masha Slamovich, Sol Ruca, and Zaria vs. Jacy Jayne, Fallon Henley, and Jazmyn Nyx

WWE NXT aired its July 15 episode from Capitol Wrestling Center in Orlando, Florida. The episode presented the fallout of last weekend's Great American Bash and Evolution PLE and major developments surrounding the NXT landscape moving forward.Jacy Jayne, Fallon Henley, and Jazmyn Nyx opened the show. Jayne stated that while they dropped the ball at the Great American Bash, their actions redeemed them at Evolution. She then addressed TNA Knockouts Champion Masha Slamovich, who came out. The duo will face each other at Slammiversary in a ‘Title vs Title’ match. Sol Ruca and Zaria joined the fray too, and a brawl broke out between all of the,m with Ruca and Zaria standing tall.The opening match of the night was a six-man tag team showdown. The match was exciting to witness, although it ended in a Disqualification when the System members ( Bryan Myers, JDC, and Eddie Edwards) caused outside interference.Kali Armstrong offered to defend her WWE EVOLVE championship against Karmen Petrovic. Both competitors displayed an excellent title showdown, which had the fans invested. However, the match ended in a Disqualification when Jordynne Grace pulled the referee outside the ring and attacked Petrovic.She called out Blake Monroe for her betrayal at Evolution. Stevie Turner and Mr. Stone instead come out, and a video of Monroe starts playing, inviting Grace to watch her NXT in-ring debut next week. In anger, she attacked Turner and Stone until the officials stopped her.This match was called the 'Family Business' triple threat match between the former D'Angelo Family members. It was a heated yet captivating battle between cohorts turned enemies amidst their growing tensions. The final moments saw Tony D'Angelo delivering a chokeslam to Luca Crusifino on the announcer's desk and hitting the spinebuster on Stacks in the ring to pick up the win.The match was made following the altercation between the two sides earlier in the night. Tensions were evident, and the fans inside the Capitol Wrestling Center were treated with a delight factor with this fast-paced and action-packed thriller from the women's division of both NXT and TNA. Towards the end, chaos erupted at the ringside as The Culling, Hank and Tank, and Shawn Spears & Niko Vance all came down and engaged in respective brawls. This led to Masha Slamovich hitting her finisher, Slow Plow, on Jacy Jayne to pick up the win for her team.Also read: Roman Reigns' WWE return draws millions as WWE pulls off a startling Raw edition","WWE NXT aired its July 15 episode from Capitol Wrestling Center in Orlando, Florida. The episode presented the fallout of last weekend's Great American Bash and Evolution PLE and major developments surrounding the NXT landscape moving forward. Jacy Jayne, Fallon Henley, and Jazmyn Nyx opened the show.","https://static.toiimg.com/thumb/msid-122552635,imgsize-1012042,width-400,resizemode-4/122552635.jpg"
Who is Cooper Maas? Dallas Cowboys rookie cheerleader becomes unexpected fan favorite ahead of 2025 NFL season,https://timesofindia.indiatimes.com/sports/nfl/news/who-is-cooper-maas-dallas-cowboys-rookie-cheerleader-becomes-unexpected-fan-favorite-ahead-of-2025-nfl-season/articleshow/122425257.cms,"Cooper Maas, known for her role in 'Reacher,' is now captivating fans as a Dallas Cowboys Cheerleader (Image via IG)

From acting to dancing: Cooper Maas brings Hollywood flair to the Cowboys Cheerleaders

A powerful message of resilience after unexpected result



As the Dallas Cowboys gear up for a season full of pressure and high expectations, attention isn't just focused on the gridiron. One unexpected rookie has been generating major buzz—but not in a helmet and pads. Meet Cooper Maas, a breakout star on the Dallas Cowboys Cheerleaders squad whose rising fame is turning heads even before the NFL action kicks off.Cooper Maas isn’t your average rookie cheerleader. Already known to some TV fans for portraying Young Jack Reacher in the Amazon Prime Video series Reacher, Maas has made a seamless transition from acting to the high-pressure world of NFL cheerleading. A graduate of the University of Arizona, Maas entered the grueling selection process for the most iconic cheerleading team in sports—and emerged as a social media standout.With over 7,000 followers on Instagram, Maas has quickly built a devoted online following. Her blend of style, charisma, and authenticity has helped her connect with fans across the country, especially younger viewers who relate to her vulnerability and perseverance.Although she didn’t achieve the specific result she had hoped for during tryouts, Cooper Maas captured hearts by sharing an emotional, deeply personal message on Instagram. The quote, which has since gone viral, reads:""I don't think there are enough words to describe how much this opportunity has meant to me.It really taught me so much about myself and I can honestly say that I left a better person, dancer and friend.""Maas followed that with another heartfelt post: “Although the result was not what I had prayed for, the people I had the privilege of learning from and the memories I made exceeded any expectations… This opportunity gave me the most supportive, loving and genuine group that I am lucky enough to call friends and sisters for life.”These posts reveal more than just a cheerleader’s journey—they reflect a powerful story of growth, gratitude, and sisterhood. Maas' genuine tone and self-reflection have struck a chord with many, especially as the NFL increasingly embraces narratives beyond just touchdowns and tackles.While Cooper Maas continues to win over fans, the Cowboys have also announced their official cheer squad leaders for the upcoming season, including familiar faces like Kleine Powell, Anna Kate Sundvold, and Karley Swindell.Also Read: “I could prove them wrong”: Victoria Kalina exposes Dallas Cowboys Cheerleaders’ politics after shock exit reflects on life after As the Cowboys seek to reclaim play-off glory, Cooper Maas’ emergence as a fan-favorite cheerleader offers a refreshing reminder that sometimes, the most inspiring stories come from the sidelines.","Cooper Maas, known for her role in 'Reacher,' is now captivating fans as a Dallas Cowboys Cheerleader. A graduate of the University of Arizona, Maas entered the grueling selection process for the most iconic cheerleading team in sports and emerged as a social media standout.","https://static.toiimg.com/thumb/msid-122425688,imgsize-44170,width-400,resizemode-4/122425688.jpg"
Chilling 911 call details emerge as Cleveland Browns rookie Quinshon Judkins faces domestic violence charge,https://timesofindia.indiatimes.com/sports/nfl/news/chilling-911-call-details-emerge-as-cleveland-browns-rookie-quinshon-judkins-faces-domestic-violence-charge/articleshow/122532795.cms,"Photo by Nick Cammett/Getty Images

Police report and 911 audio allege Cleveland Browns rookie Quinshon Judkins punched girlfriend, leaving bruises and lasting pain

What the domestic violence allegations mean for Quinshon Judkins’ NFL future

“I still have visible bruises and evidence on my body of the event.” Those chilling words were spoken by the girlfriend of Cleveland Browns rookie running back Quinshon Judkins to a police dispatcher during a 911 call made on July 12 in Fort Lauderdale, Florida. The newly released audio paints a grim picture of pain and fear in the days following what authorities describe as a violent encounter. As the Browns’ second-round pick in the 2025 NFL Draft faces a misdemeanor battery charge over the alleged domestic violence incident, questions swirl about his future in the NFL, the team’s response, and the broader issue of player conduct in professional sports.The incident that led to Quinshon Judkins’ arrest reportedly took place in the early hours of July 8, 2025, in Broward County, Florida, but it wasn’t until July 12 that police took him into custody. According to the police report, it all began at Fort Lauderdale International Airport, where Judkins, 21 years old and fresh off his second-round draft selection, allegedly lost his temper after reading text exchanges between his girlfriend and her family members.Police say Judkins confronted her, telling her, “Oh, wow, I can’t believe you” and “I’m so done with you,” before the situation escalated after they left the airport in a vehicle.The report alleges that while the woman tried to explain herself, Judkins “punched” her in the “mouth/chin area with a closed fist.” She later moved to the back seat of the car, but Judkins allegedly “turned around while he was driving and struck her additional times in the left arm and thigh. ”Their history added context for authorities: the couple had “resided together as if a family” from May through December 2024, separated in late 2024, and only rekindled their relationship in June 2025.The most striking details come from the woman’s own words in the 911 call, recorded on July 12 at the Fort Lauderdale Police Department’s temporary headquarters and released by TMZ. “I had a high-profile male that I was in a relationship with put his hands on me,” she told the dispatcher. “I still have visible bruises and evidence on my body of the event. … I am still in pain and I have a lot more of my story to tell.”Judkins had his first court appearance on Sunday morning, following his Saturday arrest. When asked for comment on the allegations, the Cleveland Browns issued a brief statement saying they are “aware and gathering information” on the matter, leaving his standing with the team uncertain as the legal process unfolds.As Quinshon Judkins faces these serious allegations, the spotlight is now on the Browns’ response and the NFL’s ongoing challenge in addressing domestic violence among its players. The detailed police report and haunting 911 audio highlight the woman’s continued pain and the gravity of the charges he now faces. Fans, team officials, and the league itself will be watching closely to see whether accountability and transparency guide the next steps in this disturbing case.Also Read: Kansas City Chiefs show out as Patrick Mahomes leads star-studded support for unbeaten current","Cleveland Browns rookie Quinshon Judkins faces a misdemeanor battery charge over the alleged domestic violence incident. Police report and 911 audio allege Judkins punched girlfriend, leaving bruises and lasting pain. Questions swirl about his future in the NFL, the team's response, and the broader issue of player conduct in professional sports.","https://static.toiimg.com/thumb/msid-122532777,imgsize-727018,width-400,resizemode-4/122532777.jpg"
Dustin Wolf gets shoutout from Shania Twain after Calgary Stampede appearance,https://timesofindia.indiatimes.com/sports/nhl/news/dustin-wolf-gets-shoutout-from-shania-twain-after-calgary-stampede-appearance/articleshow/122533218.cms,"Photo credit: Sergei Belski-Imagn Images

“Let’s Go Girls,”

Shania Twain calls Calgary Flames’ Dustin Wolf “the cutest”

“Let’s Go Girls”

“Man! I Feel Like a Woman”

“He’s the cutest!”

“The most athletic non-athletic looking person that exists,”

Dustin Wolf’s off-season presence in Calgary draws more attention

Twain and Wolf headline a uniquely Calgary moment

Calgary Flames goaltender Dustin Wolf is earning more than just praise on the ice, he’s now getting attention from country music royalty. After a fan posted a photo of Wolf at the Calgary Stampede wearing a shirt with the iconic phraseglobal superstar Shania Twain took notice. Her playful reaction on social media has gone viral, adding to Wolf’s rising popularity in Calgary and beyond.Country-pop legend Shania Twain gave Dustin Wolf a heartwarming shoutout on social media after spotting a photo of the goalie enjoying the Calgary Stampede. In the photo, Wolf was seen wearing aT-shirt, a nod to Twain’s hit single, while attending the chuckwagon races.Twain, who served as this year’s Calgary Stampede parade marshal, replied to the post with:, adding a heart-eyes emoji. The post quickly gained traction online, with fans chiming in to praise both Wolf’s fashion choice and his on-ice performance.One fan commented,capturing the internet’s growing affection for Wolf’s laid-back personality and surprising athletic dominance between the pipes.The 24-year-old netminder has stayed in Calgary for most of the off-season and has been spotted at several Stampede events, including the rodeo and chuckwagon races. His local appearances have helped endear him further to Flames fans, who already admire his breakout NHL season.Wolf finished the 2024–25 season as the runner-up for the Calder Trophy, awarded to the NHL’s rookie of the year. He played 53 games, posted a .910 save percentage, and helped the Flames remain in playoff contention until the final weeks of the season. His performances earned him a spot on the NHL All-Rookie Team.Shania Twain, a Canadian music icon, also performed at the Scotiabank Saddledome during the Stampede, sharing the same stage, metaphorically, where Wolf shines during hockey season. Her public appreciation of Wolf adds a fun, cultural layer to what was already a successful year for the Flames’ young star.With fans and celebrities alike taking notice, Dustin Wolf’s star continues to rise, in Calgary and across the NHL.Also Read: Joe Thornton officially joins San Jose Sharks as Player Development Coach","Calgary Flames goalie Dustin Wolf has been spotted at the Calgary Stampede. A fan posted a photo of Wolf wearing a shirt with the iconic phrase ""Let's Go Girls"" Shania Twain replied to the post with a heart-eyes emoji.","https://static.toiimg.com/thumb/msid-122533224,imgsize-299953,width-400,resizemode-4/122533224.jpg"
Taylor Swift and Travis Kelce ditch Blake Lively and grow closer to Selena Gomez ahead of her wedding amid Justin Baldoni drama,https://timesofindia.indiatimes.com/sports/nfl/news/taylor-swift-and-travis-kelce-ditch-blake-lively-and-grow-closer-to-selena-gomez-ahead-of-her-wedding-amid-justin-baldoni-drama/articleshow/122533115.cms,"Travis Kelce and Taylor Swift are all set to attend Selena Gomez's wedding.(Image via Getty Images)

Taylor Swift and Travis Kelce are all set to attend Selena Gomez and Benny Blanco’s wedding in September



Has Taylor Swift gotten closer to Selena Gomez after her friendship with Blake Lively ended because of the Justin Baldoni legal mess?

",Taylor Swift and Travis Kelce are all set to attend Selena Gomez and Benny Blanco’s wedding in September. Has Taylor Swift gotten closer to Selena after her friendship with Blake Lively ended because of the Justin Baldoni legal mess?,"https://static.toiimg.com/thumb/msid-122533193,imgsize-963097,width-400,resizemode-4/122533193.jpg"
Darren Watkins Jr leaves Robert Griffin III stunned after double race defeat in Estonia,https://timesofindia.indiatimes.com/sports/nfl/news/darren-watkins-jr-leaves-robert-griffin-iii-stunned-after-double-race-defeat-in-estonia/articleshow/122533537.cms,"Darren Watkins Jr leaves Robert Griffin III stunned after double race defeat in Estonia (Image Via X)

Darren “IShowSpeed” Watkins Jr. beats Robert Griffin III in back-to-back races



“My knees are crying right now. But Speed’s got juice!”

Robert Griffin III praises IShowSpeed and calls him “special” after Estonia race

“Speed is special. I think he could run a 4.3 in the 40-yard dash.”

A wild thing just happened in Estonia. Darren Watkins Jr., aka IShowSpeed, is known for his loud livestreams and silly reactions, not for sports. But on July 15, 2025, in Tallinn, there was a gathering to watch something much different, or rather, unexpected. Darren Watkins Jr. faced off against Robert Griffin III, a former NFL quarterback, who is also known for having a lot of speed. No one believed Speed could beat a real pro. Fans pulled out phones, ready to record. The crowd got quiet. Everyone waited for the signal. What happened next shocked viewers and even made headlines around the world.On July 15, 2025, IShowSpeed raced Robert Griffin III twice and IShadowspeed won both races. They were involved in the YouTube Creator Games event in Tallinn, Estonia, but the race quickly stole the show.Robert Griffin III, who is 35, is a former NFL quarterback and track guy, and IShowSpeed is a 20-year-old online celebrity. Online videos pop up that show both laughing prior to the races. But once the races started, things got serious. IShowSpeed ran hard and shocked everyone by finishing first both times.In one video shared on Twitter by Robert Griffin III himself, the former NFL player laughed and said,Also Read: Ryan Clark Calls Out Robert Griffin III As Fans Erupt Over Racist Image Of Angel Reese After the race, Robert Griffin III praised IShowSpeed in front of fans and media. He said,Robert Griffin III even mentioned that if IShowSpeed had developed properly, he could compete and beat big-name athletes like Noah Lyles and Tyreek Hill in a short distance. This was huge praise coming from Robert Griffin III, who domesticated a 4.41 at the 2012 NFL Combine and was a Heisman Trophy winner in college.Fans were so taken aback with IShowSpeed's performance but they could not stop talking about how he astonished everyone. Some even started comparing him to real athletes online. Clips from the race quickly went viral on social media. The races happened during a fan meet in Tallinn, Estonia, and were part of the Creator Games lineup.","Darren Watkins Jr., aka IShowSpeed, is known for his loud livestreams and silly reactions, not for sports. On July 15, 2025, in Tallinn, Estonia, there was a gathering to watch something much different, or rather, unexpected. Darren Watkins Jr. faced off against Robert Griffin III, a former NFL quarterback, who is also known for having a lot of speed. No one believed Speed could beat a real pro.","https://static.toiimg.com/thumb/msid-122533479,imgsize-58860,width-400,resizemode-4/122533479.jpg"
"Inside Olivia Culpo and Christian McCaffrey’s baby name choice — and the story it tells of love, legacy, and grace",https://timesofindia.indiatimes.com/sports/nfl/news/inside-olivia-culpo-and-christian-mccaffreys-baby-name-choice-and-the-story-it-tells-of-love-legacy-and-grace/articleshow/122435894.cms,"Olivia Culpo and Christian McCaffrey welcome baby Colette Annalise in a moment filled with grace and meaning (Image credit: Instagram)

Colette Annalise: A name that reflects victory and divine grace

Poll Do you believe the couple's choice to keep their pregnancy private was a good decision? Yes, it's their personal journey No, they should share more

A private pregnancy journey ends in a beautiful beginning

Celebrity power couple Olivia Culpo and NFL star Christian McCaffrey have officially become parents. The former Miss Universe and San Francisco 49ers running back welcomed their first child, a baby girl, on Sunday, July 13. The birth announcement was shared via a touching Instagram reveal, immediately grabbing headlines. The newborn’s name, Colette Annalise McCaffrey, is already a trending baby name across social media.The name Colette has French roots and means “victorious” or “people of victory.” Her middle name, Annalise, comes from German and Latin origins, meaning “graced with God’s bounty.” The name blends strength, femininity, and spiritual meaning — an elegant, symbolic choice. Parenting forums and baby-naming experts quickly praised the name’s vintage charm and lyrical flow.The couple’s Instagram post kept the caption minimal yet powerful: “Colette Annalise McCaffrey.” The elegant name, revealed through soft monochrome images, captured hearts instantly. Featured were emotional black-and-white images from the hospital, showing Olivia holding her newborn. Christian stood by her side, gently embracing the moment as a new father.The post captured hearts online and quickly went viral across celebrity news platforms.Culpo first announced her pregnancy in February 2025, debuting her baby bump in an ethereal white maternity gown. Her caption read, “Our biggest blessing yet,” signaling the joyful milestone to fans. Later, she wrote, “Motherhood is the role I dreamed of more than any other,” a line that resonated deeply. The maternity reveal sparked widespread celebration on Instagram.As months passed, Olivia kept the experience mostly private, sharing only meaningful updates. “Carrying this life inside me is the most surreal and sacred experience I’ve ever had,” she wrote. Her calm, grounded reflections earned her praise from fans and fellow moms. Many appreciated her choice to keep the journey intimate and authentic.Christian McCaffrey, known for his athletic intensity on the field, showed a softer side during her pregnancy. “I can’t wait to meet her,” he said in a May press appearance while preparing for the NFL season. Despite a packed training schedule, he remained fully present as a partner. His emotional presence was clear in the birth photos.The couple, who wed in July 2023 in Rhode Island, have become a favorite among sports-celebrity couples. Known for their low-key love and strong family values, their parenting chapter now begins. With Colette’s arrival, they’re embracing a life beyond fame — one rooted in love, legacy, and faith.Colette Annalise McCaffrey enters the world with a name that echoes strength and grace. Her name speaks of legacy, and her arrival turns love into legacy — beginning a new chapter in the Culpo-McCaffrey story. With this meaningful name and heartfelt debut, the couple's journey into parenthood feels nothing short of divine.Also read: Sheriff rules death of John Elway’s longtime agent Jeff Sperbeck a ‘tragic accident’; no charges filed","Olivia Culpo and Christian McCaffrey welcomed their first child, a baby girl, on Sunday, July 13. The birth announcement was shared via a touching Instagram reveal. The newborn’s name, Colette Annalise, is already a trending baby name across social media.","https://static.toiimg.com/thumb/msid-122436105,imgsize-15134,width-400,resizemode-4/122436105.jpg"
