Article Title,Article Link,Article Text,Article Summary,Article Image
Chiefs heiress Gracie Hunt reveals emotional turmoil after team's Super Bowl LIX loss in candid reflection,https://timesofindia.indiatimes.com/sports/nfl/news/chiefs-heiress-gracie-hunt-reveals-emotional-turmoil-after-teams-super-bowl-lix-loss-in-candid-reflection/articleshow/118607486.cms,"Credit: Instagram/Gracie Hunt

Gracie Hunt Reflects on a Memorable Month Amid Kansas City Chiefs’ Heartbreaking Super Bowl Loss



Gracie Hunt , daughter of Kansas City Chiefs ' owner and CEO Clark Hunt , recently took a moment to reflect on a whirlwind month that was filled with anticipation, excitement, and ultimately, heartbreak. Sharing her journey on Instagram on February 27, Hunt posted a heartfelt recap titled ""The February Files,"" capturing moments from her eventful month leading up to the highly anticipated 2025 Super Bowl. Despite the Kansas City Chiefs' dreams of a historic ""three-peat"" being shattered by a decisive 40-22 loss to the Philadelphia Eagles , Hunt's gratitude and resilience shone through her emotional reflections.The Kansas City Chiefs entered the 2025 Super Bowl with sky-high hopes, aiming for a historic third consecutive championship. Finishing the regular season with an impressive 15-2 record, the Chiefs were poised to etch their names in NFL history. However, the Super Bowl did not unfold as planned. The Philadelphia Eagles delivered a crushing blow, leaving the Chiefs scoreless in the first half while quarterback Patrick Mahomes struggled, throwing two critical interceptions. Although the Chiefs made a valiant effort in the second half, the deficit proved insurmountable, and the Eagles secured a dominant 40-22 victory.Reflecting on all thos that happened, Hunt wrote,""feeling thankful for every moment that shapes life’s beautiful mosaic,"" including ""the tough, the painful, the joyful, and everything in between.""""Most of all, I’m grateful for the incredible people who make it all worthwhile,” she added in the caption.In the wake of this heartbreaking loss, Gracie Hunt showed remarkable grace and perspective. Reflecting on the defeat, she shared, “Praise Him when you win. Praise Him when you lose. It wasn’t the result we were hoping for, but so proud of this team’s heart and the incredible season we had.” Despite the disappointment, Hunt's words revealed her unwavering faith and gratitude for the journey. She expressed her appreciation for ""every moment that shapes life’s beautiful mosaic,"" embracing both the highs and lows that come with the sport. Her post also conveyed her deep admiration for the Chiefs’ loyal fanbase, calling them the “best fans in the NFL” and promising that the reigning AFC champions will “be back.”Beyond the field, Gracie Hunt’s influence extends into the Kansas City Chiefs community. In an exclusive interview with PEOPLE on January 16, Hunt spoke about her passion for the team and her commitment to making a positive impact. Describing herself as the Chiefs’ “No. 1 fan,” she emphasized the importance of faith, family, football, and philanthropy in her life. Reflecting on her upbringing, she shared, ""I've always been raised with the mantra that, 'To whom much is given, much is expected'.""Also Read: “I owe it to my teammates”: Travis Kelce announces he’s not retiring yet, ensuring more game-day support from Taylor Swift Hunt’s involvement in the Chiefs’ organization goes beyond mere fandom. Her dedication to community service and her role in shaping the team’s culture demonstrate her commitment to something greater than herself. She highlighted the inclusive nature of the family-owned organization, saying, “When it comes to the Chiefs, there's no 'I' in 'team.' I'd say the beauty about our family organization is that there's a place for everyone.”","Gracie Hunt is the daughter of Kansas City Chiefs owner and CEO Clark Hunt. On February 27, she shared a heartfelt recap of the month leading up to the 2025 Super Bowl. Hunt's gratitude and resilience shone through her emotional reflections.","https://static.toiimg.com/thumb/msid-118615494,imgsize-42180,width-400,resizemode-4/118615494.jpg"
Afghanistan Vs Australia: Champions Trophy Digest: Afghanistan face Australia with an eye on semi-finals; hosts Pakistan exit in disappointment,https://timesofindia.indiatimes.com/sports/cricket/icc-champions-trophy-2025/champions-trophy-digest-afghanistan-face-australia-with-an-eye-on-semi-finals-hosts-pakistan-exit-in-disappointment/articleshow/118614368.cms,"Afghanistan cricket team. (AP Photo)

Go Beyond The Boundary with our YouTube channel.

Champions Trophy: How good is Virat Kohli in football? | Rishabh Pant recovers from viral

Pakistan's title defence ends in disappointment



Champions Trophy: Morne Morkel back as Team India practices at ICC Academy in Dubai

Afghanistan will look to continue their fairy-tale run in the Champions Trophy as they gear up for a crucial clash against Australia in Lahore on Friday, knowing that a win would secure them a historic semi-final berth. Fresh from eliminating England with a thrilling eight-run victory, Afghanistan's confidence is soaring as they prepare to face the reigning world champions.Skipper Hashmatullah Shahidi has urged his team to stay focused, emphasising that they will not burden themselves with thoughts of qualification but instead play positive cricket. ""A win like this boosts confidence,"" said Shahidi. ""We hope to beat Australia as well.""Australia, meanwhile, remain well-placed for a semi-final spot after defeating England and having their game against South Africa washed out. Even if Friday's match is rained out, the Australians will progress, while Afghanistan will have to rely on net run rate or other results.Star batter Ibrahim Zadran will be key to Afghanistan's hopes after his record-breaking 177-run innings against England. The 23-year-old, returning from injury, played a pivotal role in posting 325/7, which ultimately proved just enough to send England packing. Marnus Labuschagne , speaking on Australia's preparations, acknowledged Afghanistan's growing reputation but remained confident that his side is ""ready to go,"" despite limited outdoor training due to rain. ""We'd love to win and silence the crowd,"" he added.While Afghanistan chase history, hosts Pakistan's campaign ended in heartbreak as their final group match against Bangladesh in Rawalpindi was washed out without a ball being bowled. Their title defence ended with a whimper, finishing last in Group A without a single win.Pakistan, who won the 2017 Champions Trophy, lost to New Zealand and India before the rain placed them at the bottom of the group points table. Captain Mohammad Rizwan admitted the team had fallen short of expectations. ""We are upset and accepting that we didn't perform well,"" he said. ""Hopefully, we will work harder and come back stronger.""For Bangladesh, who also exited the tournament, captain Najmul Hossain Shanto expressed frustration at not being able to play their final match. ""We really wanted to play this match, but we can't do anything about the weather,"" he said.India and New Zealand have already booked their semi-final spots from Group A, while South Africa, Australia and Afghanistan are vying for the remaining two spots in Group B. England have been knocked out.With Afghanistan and Australia set for a high-stakes battle in Lahore, all eyes are on whether Afghanistan can pull off another giant-killing act and cement their place in the final four.","Afghanistan face Australia in Champions Trophy semi-final on Friday. Hosts Pakistan's campaign ends in heartbreak as final group match is washed out. India and New Zealand have already booked their places in the final four. South Africa, Australia and Afghanistan are vying for the remaining two spots in Group B.","https://static.toiimg.com/thumb/msid-118614371,imgsize-50310,width-400,resizemode-4/118614371.jpg"
"“I owe it to my teammates”: Travis Kelce announces he’s not retiring yet, ensuring more game-day support from Taylor Swift",https://timesofindia.indiatimes.com/sports/nfl/news/i-owe-it-to-my-teammates-travis-kelce-announces-hes-not-retiring-yet-ensuring-more-game-day-support-from-taylor-swift/articleshow/118614541.cms,"Image via Getty Images

Taylor Swift will be cheering Travis Kelce from the stands again next NFL season

The Athletic’s Dianna Russini Talks Rodgers, Kelce, Darnold & More with Rich Eisen | Full Interview

Taylor Swift will get to cheer on from the stands again next NFL season, as Travis Kelce has announced that he is not retiring yet. After all the rumors surrounding his league future, Kelce settled it with a text message that was read out on The Pat McAfee Show during Thursday's show. Host Pat McAfee posted Kelce's reply, saying the Chiefs' tight end is ""coming back for sure,"" so fans can look forward to more of Swift's trademark game-day visits.Taylor Swift will be cheering from the stands again next NFL season, as Travis Kelce has assured that he is not retiring yet. Following much speculation regarding his league future, Kelce put an end to rumors with a text message read on The Pat McAfee Show during Thursday's show. Host Pat McAfee read Kelce's reply, indicating the Chiefs' tight end is ""coming back for sure,"" meaning fans can look forward to more of Swift's signature game-day visits.""Gonna try and get to the best shape I've been this offseason and get back to the mountaintop,"" McAfee read from Kelce's message. ""Got a real bad taste in my mouth with how I played in that last game and how I got the guys ready for battle. I can’t go out like that!!!!”Kelce addressed rumors about the Kansas City Chiefs ' loss at Super Bowl LIX on his ""New Heights"" podcast, but did not provide a final verdict. ""I know everybody wants to know whether or not I'm playing next year, and right now, I'm just kicking everything down the road. I'm not making any crazy decisions. I'm gonna take some time to figure it out,"" he said at the time.He further added, ""And, I think I owe it to my teammates that if I do come back, it's a wholehearted decision. I'm not half-assing it, and I'm fully here for them.”Kelce inked a two-year deal last season, with speculation suggesting he would receive an $11.5 million bonus should he agree to play in the 2025 season by March 14. Kansas City Chiefs General Manager Brett Veach has since clarified there was no such deadline for Kelce's announcement. In spite of continued rumblings regarding Kelce's NFL future, the Chiefs seem to be allowing their franchise tight end the leeway to make a decision on his own terms.“How we left it at the end of the season is that he was fired up,” he said during an episode of The Rich Eisen Show. “He has one more year under contract. I still think he has that fire and desire to play.” He added, ""As far as I’m concerned, there is no deadline,” he said. “I think we left it as he’d be back, and we’re excited to get him back and get him going.”Jason Kelce, Travis’s older brother and co-host of their podcast, shared his thoughts on Travis’s upcoming decision during a previous appearance on The Steam Room. Having retired from the NFL himself last year, Jason weighed in on the uncertainty surrounding his brother’s future in the league. “I think Travis, I think he probably, in his heart, already knows what he wants to do,"" Jason had said. ""That’s the reality of it.”Also Read: “He's getting hair transplant”: Fans react to Travis Kelce's change in appearance, speculates Taylor Swift is behind it Travis Kelce has made it clear that he is not retiring from the NFL anytime soon. Despite ongoing speculation, the Kansas City Chiefs’ star tight end has confirmed his plans to continue playing. His decision means fans can expect to see him back on the field next season, with Taylor Swift likely showing her support from the stands once again.","Taylor Swift will be cheering from the stands again next NFL season, as Travis Kelce has assured that he is not retiring yet. After all the rumors surrounding his league future, Kelce settled it with a text message that was read out on The Pat McAfee Show during Thursday's show. The Kansas City Chiefs' star tight end has confirmed his plans to continue playing.","https://static.toiimg.com/thumb/msid-118614540,imgsize-94312,width-400,resizemode-4/118614540.jpg"
How Virat Kohli tweaked technique after Australia tour,https://timesofindia.indiatimes.com/sports/cricket/icc-champions-trophy-2025/how-virat-kohli-tweaked-technique-after-australia-tour/articleshow/118615926.cms,"BACK TO BANGAR

INCREASED BACK FOOT PLAY

He (Kohli) waited for the ball to come to him. He really wasn't on the front foot all the time. He was willing to cover the infield as well. Against spin, what was good to see in the first half of his innings was that he was playing a lot off the back foot. Then once he got that confidence, he started coming forward. So, starting off the back foot and then gradually going on to the front foot was the plan. Sanjay Bangar

ALTERED BAT POSITIONING

When Kohli was in form, his bat used to come from the second or third slip area, allowing him to play more controlled shots. He is a guy who leaves no stone unturned as far as preparation is concerned. He knew that he had to step up (after the Australia tour). He brought that intensity to his game, and one could see it in his body language. Sanjay Bangar

ADJUSTMENT IN STANCE

What he did well was to watch the ball till the end, till it made contact with his bat. That's something we discussed - to watch the ball like a hawk and give more than 100% to each delivery. He is hungry for runs and going by the innings he played (against Pakistan), he can easily play for another 3-4 years in international cricket. Sanjay Bangar

A look at what the master batter has changed since his return from Australia...After Virat Kohli 's travails in Australia, he went back to a trusted aide - former India batting coach Sanjay Bangar . Bangar's time with the Indian team from 2014 to 2019 coincided with Kohli 's peak, a period in which he scored 19 of his 30 Test hundreds.In Australia, Kohli managed to score only 190 runs at 23.75 from the 5 Tests, getting out in the same fashion poking outside off-stump.Visuals showed Bangar giving throwdowns to Kohli from about 16-17 yards, pitching the ball on a cement slab. As Kohli was scoring his 51st ODI ton to power India to victory over Pakistan in the Champions Trophy , Bangar, during his commentary stint, threw more light on what transpired at the training facility in Mumbai...During his 111-ball 100 against Pakistan, it was evident Kohli was playing more on the back foot to back-of-a-length deliveries. Kohli's footwork saw significant improvement against both pacers and spinners, especially his back foot play. Playing off the back foot allowed Kohli to read spinners better and adjust shots accordingly. Once he gained confidence, he started coming forward more often, effectively mixing his approach.In Australia, Kohli's bat was coming down from closer to the wicketkeeper or first slip. Bangar and Kohli worked on ensuring that his bat came down from the second or third slip region.Kohli also slightly opened his stance, allowing for better judgment against pace and spin. This adjustment facilitated more fluid shot execution, particularly through the offside. Additionally, a marginally lower back lift helped in reducing excessive back-and-across movement, leading to more stability and control over his shots.","Virat Kohli scored his 51st ODI ton to power India to victory over Pakistan in the Champions Trophy. Kohli's footwork saw significant improvement against both pacers and spinners, especially his back foot play. Sanjay Bangar and Kohli worked on ensuring that his bat came down from the second or third slip region.","https://static.toiimg.com/thumb/msid-118615884,imgsize-41974,width-400,resizemode-4/118615884.jpg"
Texans wide receiver Stefon Diggs files lawsuit against reality TV star alleging assault & extortion,https://timesofindia.indiatimes.com/sports/nfl/news/texans-wide-receiver-stefon-diggs-files-lawsuit-against-reality-tv-star-alleging-assault-extortion/articleshow/118616305.cms,"Credit: Getty Images

Stefon Diggs Sues Reality TV Star Mulan Hernandez for Extortion and Assault



NFL wide receiver Stefon Diggs has filed a lawsuit against reality TV star Mulan Hernandez, whose real name is Mia Jones, along with Brianna ""Brii"" Mack. The lawsuit accuses the two women of extortion, assault, and destruction of property. According to the legal documents, Diggs claims that he was punched in the chest by Jones and ""threatened with a deadly weapon,"" leading to severe emotional distress. The four-time Pro Bowler is now seeking damages for the alleged misconduct and damage to his property.According to court documents obtained by the Houston Chronicle, Diggs alleges that he was a victim of “a tale of abuse to extort millions of dollars.” The wide receiver claims that Jones and Mack attempted to blackmail him by threatening to expose information that could damage his career unless he paid them a substantial amount. Diggs’ attorney, Kent Schaffer, stated, “There were threats coming from [Jones] that he had to pay her money or she was going to go public and ruin his career. We’re kind of at the point where the threats have to stop. That’s why the decision was made to go ahead and file. At some point it just has to end.”The trouble reportedly began after Diggs and Jones were involved in what Schaffer described as a “casual relationship.” Diggs claims that during this period, Jones damaged his personal property, including a wristwatch and a PC gaming system. The lawsuit also states that Jones ""refused to leave"" Diggs' apartment on multiple occasions, causing him emotional distress. Additionally, the lawsuit claims that both Jones and Mack engaged in trespassing and extortion attempts, which led to severe emotional anguish for Diggs.The legal complaint further mentions an incident on June 7, where Diggs alleges that he was punched in the chest by Jones, who also attempted to hit him in the head. It is claimed that Jones destroyed Diggs’ wristwatch and gaming system during this confrontation. The documents state that in the months following the incident, Jones and Mack continued to demand money from Diggs, leading to the current lawsuit.Jones has claimed that she sought medical attention in June, a week after the alleged altercation, reporting that she was “punched in the back of the head with a closed fist.” Schaffer responded by saying, “My understanding is that [Jones] and [Mack] on [June 14] went to the hospital together making complaints. She was treated and released the same day. She didn’t see [Diggs] that day.”Amidst the ongoing legal battle, Diggs’ professional future is also under speculation. Houston Texans General Manager Nick Caserio recently discussed Diggs’ status with the team, stating, “Glad he was on our team last year. He helped us win some games. Unfortunately, he got injured. So we’ll kind of work through the process with him. We have an open door policy. We don’t rule anything out, so we’ll have an open mind. We’ll figure out what makes the most sense and if there is a fit.”Also Read: Chiefs heiress Gracie Hunt reveals emotional turmoil after team's Super Bowl 2025 loss in candid reflection Stefon Diggs, a four-time Pro Bowler, played eight games for the Texans in 2024 before suffering a season-ending ACL tear. Currently a free agent, Diggs is seeking justice and damages for the alleged misconduct, emotional distress, and property destruction caused by Jones and Mack.","NFL wide receiver Stefon Diggs has filed a lawsuit against reality TV star Mulan Hernandez, whose real name is Mia Jones, along with Brianna ""Brii"" Mack. The lawsuit accuses the two women of extortion, assault, and destruction of property. Diggs claims that he was punched in the chest by Jones and ""threatened with a deadly weapon,"" leading to severe emotional distress.","https://static.toiimg.com/thumb/msid-118616303,imgsize-30388,width-400,resizemode-4/118616303.jpg"
Tristan Thompson's ex-Khloe Kardashian Spills Kris Jenner's R-Rated Dating Advice to Win Over NBA Stars,https://timesofindia.indiatimes.com/sports/nba/top-stories/tristan-thompsons-ex-khloe-kardashian-spills-kris-jenners-r-rated-dating-advice-to-win-over-nba-stars/articleshow/118616312.cms,"Khloe Kardashian shared on her podcast that after dating an NBA player and getting no replies, her mom Kris Jenner suggested it was because she didn't perform a particular act. Khloe's dating history, including relationships with Lamar Odom and Tristan Thompson, showcases the drama and Kris's blunt advice adds to it.","Khloe's dating history, including relationships with Lamar Odom and Tristan Thompson, showcases the drama and Kris's blunt advice adds to it. Khloe shared on her podcast that after dating an NBA player and getting no replies, her mom Kris Jenner suggested it was because she didn't perform a particular act.","https://static.toiimg.com/thumb/msid-118616458,imgsize-54516,width-400,resizemode-4/118616458.jpg"
"“He takes too much criticism”: Oilers general manager defended Evan Bouchard from harsh criticism, arguing that much of it is unfair",https://timesofindia.indiatimes.com/sports/nhl/news/he-takes-too-much-criticism-oilers-general-manager-defended-evan-bouchard-from-harsh-criticism-arguing-that-much-of-it-is-unfair/articleshow/118604338.cms,"Image vi aImagn Images

Stan Bowman defended defenseman Evan Bouchard from criticism



Evan Bouchard , the Edmonton Oilers ' top defenceman, has been under scrutiny for several glaring defensive mistakes , including a failed play on Brandon Hagel's wraparound goal. Despite criticism of his lack of urgency and adaisical play, Oilers general manager Stan Bowman has defended Bouchard's criticism, speaking out on Wednesday's episode of Frankly Speaking with Frank Seravalli.Edmonton Oilers general manager Stan Bowman defended defenseman Evan Bouchard from criticism from fans and analysts, arguing that much of it is unfair. Bowman acknowledged the criticism but defended his player, suggesting that Bouchard's mistakes might be magnified due to the spotlight he receives. Many have pointed fingers at Bouchard for his turnovers and defensive mistakes this season.'“Bouch does get a lot of criticism — I think a lot unfairly so,” said Bowman. “He’s a great player, he really is a big part of our team. He’s very effective, and I think sometimes when… your mistakes get spotlighted, for whatever reason, then maybe there’s more attention given to it.“But he’s played well. He’s very good at complimenting our best players. That’s an important role when you got really creative offensive players who are forwards, you need to have someone who can help them score.”Bouchard has been instrumental in helping the Oilers' top players generate offense, with 60% of his ice time spent with Connor McDavid . This has increased the team's shot attempt share, expected goal share, and scoring chance share by about four percent. McDavid's goal share is 36.11 percent away from Bouchard, but when they're together, it rises to 58.33 percent. However, Bowman noted a slow start to the season for both Bouchard and the team.“He started slow, like a lot of our guys didn’t start great in October, and whether that was residual from playing a long time last year or getting going when you know how long the season is and you know the grind it is, I don’t know,” said Bowman. “But I think once really from November on, Bouch has done a good job for us. He’s an important player and I think sometimes he takes too much criticism.”Also Read: “Detroit is cooking”: The Detroit Red Wings fans are fueling their excitement over the recent NHL trade, saving $3.5 billion Bouchard, despite some mistakes this season, remains one of the top blue-liners in the game. His ability to drive offence is second to none, helping the Oilers generate 59.4 expected goals, the most of any defencemen in the league. He has a +12 goal-to-goal ratio at five-on-five.","Edmonton Oilers general manager Stan Bowman defended defenseman Evan Bouchard from criticism from fans and analysts, arguing that much of it is unfair. Bowman acknowledged the criticism but defended his player, suggesting that his mistakes might be magnified due to the spotlight he receives. Bowman noted a slow start to the season for both Bouchards and the team.","https://static.toiimg.com/thumb/msid-118604335,imgsize-112416,width-400,resizemode-4/118604335.jpg"
Legacy or Business: Fans Find Vanessa Bryant and Nike Guilty of Milking Kobe Bryant's Name for Monetary Gains,https://timesofindia.indiatimes.com/sports/nba/top-stories/legacy-or-business-fans-find-vanessa-bryant-and-nike-guilty-of-milking-kobe-bryants-name-for-monetary-gains/articleshow/118587078.cms,"Kobe Bryant's love for the Los Angeles Dodgers gets new life



“Nike will be dropping baseball gear to match the upcoming “Dodgers” Nike Kobe 6 colorway dropping April 13 🐍⚾ (via @eldenmonitors) The equipment includes catcher gear and sliding mitts featuring Kobe’s signature sheath logo 🔥”

Fans are not happy with Nike and Vanessa Bryant trying to milk the Mamba legacy

",Nike will be dropping baseball gear to match the upcoming “Dodgers” Nike Kobe 6 colorway dropping April 13. The equipment includes catcher gear and sliding mitts featuring Kobe’s signature sheath logo.Fans are not happy with Nike and Vanessa Bryant trying to milk the Mamba legacy.,"https://static.toiimg.com/thumb/msid-118587091,imgsize-45558,width-400,resizemode-4/118587091.jpg"
