Article Title,Article Link,Article Text,Article Summary,Article Image
"Afghanistan vs Australia Live Streaming, Lahore weather report: When and where to watch AFG vs AUS in Champions Trophy 2025",https://timesofindia.indiatimes.com/sports/cricket/icc-champions-trophy-2025/afghanistan-vs-australia-live-streaming-lahore-weather-report-when-and-where-to-watch-afg-vs-aus-in-champions-trophy-2025/articleshow/118614587.cms,"Afghanistan and Australia cricket teams.

Go Beyond The Boundary with our YouTube channel.

Will rain affect Afghanistan vs Australia in Lahore?

Lahore weather:

Afghanistan vs Australia

LIVE STREAMING

Where will AFG vs AUS in the

Champions Trophy 2025

take place?

What time will

Afghanistan vs Australia

start?

Where to watch AFG vs AUS live on TV in India?

Where to live stream AFG vs AUS Champions Trophy 2025 match in India?

Squads:

Australia: Steve Smith (captain), Sean Abbott, Alex Carey, Ben Dwarshuis, Nathan Ellis, Jake Fraser-McGurk, Aaron Hardie, Travis Head, Josh Inglis, Spencer Johnson, Marnus Labuschagne, Glenn Maxwell, Tanveer Sangha, Matthew Short, Adam Zampa.

(captain), Sean Abbott, Alex Carey, Ben Dwarshuis, Nathan Ellis, Jake Fraser-McGurk, Aaron Hardie, Travis Head, Josh Inglis, Spencer Johnson, Marnus Labuschagne, Glenn Maxwell, Tanveer Sangha, Matthew Short, Adam Zampa. Afghanistan: Hashmatullah Shahidi (captain), Ibrahim Zadran, Rahmanullah Gurbaz, Sediqullah Atal, Rahmat Shah, Ikram Alikhil, Gulbadin Naib, Azmatullah Omarzai, Mohammad Nabi, Rashid Khan, Nangyal Kharoti, Noor Ahmad, Fazalhaq Farooqi, Farid Malik, Naveed Zadran. Reserves: Darwish Rasooli, Bilal Sami.

After a dramatic eight-run victory against England, Afghanistan captain Hashmatullah Shahidi has set his sights on defeating Australia to secure a semi-final spot at the ongoing ICC Champions Trophy The tournament newcomers, who previously defeated England at the 2023 World Cup in India, continued their impressive form by eliminating the English side from the 50-over competition on Wednesday.Afghanistan's crucial match against world champions Australia is scheduled for Friday at Gaddafi Stadium, Lahore.A victory is essential for Afghanistan to advance to the semi-finals of this eight-nation tournament. Afghanistan remain in contention for the semi-finals even with a washout, though their progression would then depend on other match outcomes or net run-rate calculations.Australia, who defeated England by five wickets in their opening fixture, experienced a complete washout in their match against South Africa. Another cancelled match would automatically qualify Australia for the next round.In their previous four ODI encounters, Australia have maintained a perfect record against Afghanistan, who have emerged as a formidable team in limited-overs cricket.Afghanistan's recent success includes defeating Australia in the previous year's T20 World Cup, where they achieved a historic semi-final appearance.The weather forecast for Lahore for Friday is a couple of soaking showers in the morning, followed by cool weather with variable cloudiness for the entire day. Temperature is likely to hover below 20s degrees Celsius.Afghanistan vs Australia in the Champions Trophy 2025 will take place at the Gaddafi Stadium in Lahore.The Champions Trophy 2025 match between Pakistan and Bangladesh will start at 2:30pm IST. The toss will take place at 2pm IST.The Champions Trophy 2025 match between Pakistan and Bangladesh will be on TV on the Star Sports and Sports18 TV channels in India.The Champions Trophy 2025 match between Pakistan and Bangladesh will be live streamed on the JioHotstar app and website in India.","Afghanistan face Australia in the Champions Trophy 2025. The match will take place at the Gaddafi Stadium, Lahore. Afghanistan defeated England by eight wickets on Wednesday. Australia defeated South Africa by five wickets in their opening match. A victory is essential for Afghanistan to advance to the semi- finals.","https://static.toiimg.com/thumb/msid-118614705,imgsize-72738,width-400,resizemode-4/118614705.jpg"
Why Kevin Durant Said NO: The Real Reason He Killed Potential Golden State Warriors Trade,https://timesofindia.indiatimes.com/sports/nba/top-stories/why-kevin-durant-said-no-the-real-reason-he-killed-potential-golden-state-warriors-trade/articleshow/118614816.cms,"Credits: Getty Images

The Trade That Never Was: Kevin Durant's Relatable Choice That Changed the Golden State Warriors' Fate

Kevin Durant on Warriors-Suns trade veto, Steph Curry & BEST NBA era | Draymond Green & Baron Davis

Kevin Durant , the NBA's resident enigma wrapped in a 7-foot frame, recently dropped a truth bomb that sent ripples through the basketball universe. Forget cryptic tweets and vague Instagram stories; he went straight to the source, The Draymond Green Show , to explain why a potential Golden State Warriors reunion was a hard ""no."" It wasn't about burning bridges or holding grudges, it was about something far more relatable: the sheer, soul-crushing exhaustion of mid-season upheaval.Durant's dedication to the Phoenix Suns was indeed a factor, but the core of his decision was rooted in the simple, human desire for stability. ""I didn't want to move,"" he declared, echoing the sentiments of anyone who's ever dreaded packing boxes. He'd been through the whirlwind of team changes before, and the prospect of another mid-season shakeup, especially with the trade deadline looming, was simply too much. ""It’s just such a big change, and I’ve been through it before,"" he explained, painting a picture of a player weary of constant transitions.Think of it like this: imagine moving apartments, not just once, but multiple times, always in the middle of a work project. The stress of packing, unpacking, and adjusting to a new environment while trying to perform at peak levels is immense. Durant, a player who costs ""a lot,"" recognized the disruptive impact a mid-season trade would have on any team. ""Me just getting up and moving in the middle of the season, it’s going to be a big blow to any team I’m going to,"" he stated, highlighting the logistical and emotional toll of such a move.Beyond the personal disruption, Durant also expressed a commitment to the Suns' journey. He wanted to see what the team could achieve, especially after the departure of key players like Cam Johnson and Mikal Bridges . ""I’m trying to see this through to the end and see what we can really do with it,"" he emphasized, underscoring his loyalty to his coaches and teammates. He wanted to give the Phoenix experiment a fair shot, to see if they could forge something special together.ALSO READ: Why Did Los Angeles Lakers Tribute Video Hit Anthony Davis So Hard? His Reaction Says It All Adding a touch of nostalgia, Durant reflected on his time playing with NBA legends LeBron James and Stephen Curry . He spoke of a unique connection with Curry, a silent understanding honed through years of shared experience. ""I felt like I was the only one on the court who knew what he was thinking,"" he recalled, referencing their time together during the 2024 Summer Olympics. This glimpse into their unspoken chemistry highlighted the deep bonds formed in the crucible of elite competition, reminding us that even in the high-stakes world of professional sports, human connections remain paramount.",Kevin Durant said he didn't want to move to the Phoenix Suns. He said he was tired of the stress of mid-season upheaval. He also said he wanted to give the Suns a fair shot to make it to the next level. Durant also spoke of his bond with Stephen Curry.,"https://static.toiimg.com/thumb/msid-118614862,imgsize-76190,width-400,resizemode-4/118614862.jpg"
NBA Offseason Rumors: Golden State Warriors might bag $186 million Milwaukee Bucks superstar to form Big 3 with Stephen Curry and Jimmy Butler,https://timesofindia.indiatimes.com/sports/nba/top-stories/nba-offseason-rumors-golden-state-warriors-might-bag-186-million-milwaukee-bucks-superstar-to-form-big-3-with-stephen-curry-and-jimmy-butler/articleshow/118614112.cms,"Golden State Warriors forward Jimmy Butler, left, and guard Stephen Curry, right, warm up before an NBA basketball game against the Chicago Bulls, Saturday, Feb. 8, 2025, in Chicago. (Image via AP Photo/Erin Hooley)

Golden State Warriors

""Antetokounmpo has fascinated this franchise for years, and he might have reasons to look around if Milwaukee, which has one series win to show for the past three seasons, can't reverse its playoff misfortunes,""

Giannis posing for the camera (Image via Getty).

Thehave been prominent in the NBA this season, and their recent acquisition of Jimmy Butler has significantly boosted their playoff prospects. After hovering around the Play-In Tournament zone earlier in the season, the Warriors now look poised to secure a solid playoff berth. But if they fall short this year, a blockbuster move could be on the horizon to elevate them back into championship contention.According to Bleacher Report, the Golden State Warriors are predicted to pursue Milwaukee Bucks superstar Giannis Antetokounmpo in the offseason. The two-time MVP, who is currently averaging 31 points, 12 rebounds, and 5.8 assists on 60.9% shooting, could be the missing piece to complete a new Big Three alongside Stephen Curry and Jimmy Butler .wrote B/R's Zach Buckley. The Bucks' recent playoff struggles could make Giannis open to exploring new opportunities, and the vWarriors' dynamic system might be the perfect fit for his skill set.Golden State's emphasis on ball movement and three-point shooting would create endless opportunities for Giannis Antetokounmpo to dominate. With Curry's unparalleled shooting range and Butler's two-way versatility, the Warriors could space the floor like never before, giving Giannis ample room to attack the rim and wreak havoc on opposing defenses.However, pulling off such a trade won’t be easy. The Golden State Warriors would likely need to include Draymond Green’s salary in any deal to match Giannis Antetokounmpo’s $175 million contract. While it’s a steep price, the potential payoff could be enormous. Adding Giannis to the roster would instantly make the Warriors the team to beat next season, positioning them as overwhelming title favorites.As the season progresses, all eyes will be on the Warriors and their pursuit of another championship. Whether they make a deep playoff run this year or pivot to a blockbuster trade in the offseason, Golden State is determined to remain a dominant force in the NBA.Also read: NBA Offseason Rumors: Los Angeles Lakers might want to sign $22 million 2x NBA Champion to bolster their championship run Let us know in the comments down below if you feel Giannis Antetokounmpo is a fitting pick for the boys in Golden and Purple. Also, do not forget to follow us on TOI NBA for the latest updates on everything taking place in the world of basketball.","The Golden State Warriors are predicted to pursue Milwaukee Bucks superstar Giannis Antetokounmpo in the offseason. The Bucks' recent playoff struggles could make Giannis open to exploring new opportunities, and the vWarriors' dynamic system might be the perfect fit for his skill set. Adding Giannis to the roster would instantly make the Warriors the team to beat next season.","https://static.toiimg.com/thumb/msid-118614065,imgsize-82424,width-400,resizemode-4/118614065.jpg"
Did the Super Bowl loss strain Taylor Swift and Travis Kelce’s relationship? The couple enters ‘darker period’ of their love story,https://timesofindia.indiatimes.com/sports/nfl/news/did-the-super-bowl-loss-strain-taylor-swift-and-travis-kelces-relationship-the-couple-enters-darker-period-of-their-love-story/articleshow/118614533.cms,"Image via GC

Taylor Swift and Travis Kelce are still going strong in their relationship



Taylor Swift and Travis Kelce are still going strong in their relationship, holding hands through tough times. Following the Kansas City Chiefs' devastating Super Bowl LIX defeat to the Philadelphia Eagles, Kelce has taken solace in Swift's songs. Addressing persistent rumors of his future in the NFL and his relationship, he posted on his New Heights podcast that her songs speak so deeply to him, evoking a broad spectrum of emotions-even the agony of losing such a high-stakes game.Taylor Swift and Travis Kelce continue to stand by each other through every challenge. Following the Kansas City Chiefs' tough Super Bowl LIX loss to the Philadelphia Eagles, Kelce has been leaning on Swift for support. Amid speculation about his potential retirement and the future of their relationship, he opened up about how her music has helped him cope.On his New Heights podcast, Kelce shared that he has been listening to many of Swift’s songs since the game, telling his brother Jason, “She has something for everything,” including “how the Eagles broke my heart.”Taylor Swift and Travis Kelce are currently in a challenging phase in their careers, with the Super Bowl potentially causing further challenges in their relationship. “Taylor isn’t a quitter, but experiencing so much vitriol from the American public has left her feeling really shaken,” a source told Heatworld.com. “Friends and family are worried, and they’re hoping the couple can manage this darker period of their love story.”Taylor's booing at the Super Bowl caused her to feel visibly shocked and ultimately lower her morale. “Taylor has been left devastated by the boos. It was a really shocking moment – especially after she was riding so high following the Eras Tour. She sees herself as a good person who strives to make the best decisions, so to receive a public bashing was quite traumatising.”“Up until now, Taylor and Travis seemed to really complement each other’s public image, but there’s always a fear of over exposure – which is what her team think has happened,” the source continued. “It’s been a blow to them both, and it’s put pressure on them to split things up, work-wise. Travis has been criticised for not giving the team his full attention amid his high-publicity romance with Taylor. It suddenly feels like the tide is turning, and both will be advised to protect their own individual brands – at whatever cost.”A source to Page Six reports that the couple, despite initial concerns, appears to be doing well after returning from a secret vacation. “Taylor and Travis had a really nice time reconnecting after a very busy year,” the source revealed. They’re also enjoying time out of the spotlight. The source said, “Taylor and Travis have stepped out for a date night since returning to the US but went unnoticed when they did so. They weren’t photographed or anything, and enjoyed a low-key night out on the town together.”Also Read: “Enjoyed a quiet night”: Travis Kelce and Taylor Swift return to the spotlight following international getaway after Chiefs' Super Bowl loss","Taylor Swift and Travis Kelce are still going strong in their relationship. Following the Chiefs' Super Bowl LIX loss, Kelce has taken solace in Swift's songs. The couple, despite initial concerns, appears to be doing well after returning from a secret vacation.","https://static.toiimg.com/thumb/msid-118614531,imgsize-38714,width-400,resizemode-4/118614531.jpg"
“Wasted at the bar with pals”: Taylor Swift reportedly has a few non-negotiable rules for Travis Kelce to follow strictly,https://timesofindia.indiatimes.com/sports/nfl/news/wasted-at-the-bar-with-pals-taylor-swift-reportedly-has-a-few-non-negotiable-rules-for-travis-kelce-to-follow-strictly/articleshow/118614523.cms,"Image via Getty Images

Travis Kelce has three hard-and-fast rules in his relationship with Taylor Swift

Travis Kelce, the 35-year-old Kansas City Chiefs player, allegedly has three hard-and-fast rules in his relationship with Taylor Swift, also 35. The two, who started dating over the summer of 2023, are frequently spotted together and have both attained tremendous success in their careers—Swift as one of the world's largest music icons and Kelce as a vital member of the Chiefs. Even with their great push, the Chiefs failed to reach the Super Bowl following a 40-22 defeat to the Philadelphia Eagles on February 9.Kansas City Chiefs superstar Travis Kelce has three hard and fast rules when it comes to his relationship with singer Taylor Swift. Dating since summer 2023, the two are regularly spotted together and are a hot topic for fans and the media. Swift is among the world's leading musicians, and Kelce is an integral part of the Chiefs, who came up short of the Super Bowl after a 40-22 loss to the Philadelphia Eagles on February 9.According to the Life and Style Magazine, through MSN, Swift apparently has some 'rules' about how Kelce can stay in contact with her and whom the football player can socialize with during his free time.“They’ll be doing lots of texting and calling, too, but Taylor likes to see Travis in real time,” a source said. “She likes to know where he is and who he’s with. It’s not that she doesn’t trust him; she just wants to feel connected. Taylor loves Travis’ energy and spontaneity, but she doesn’t want him wasted at the bar with pals. He can celebrate his wins in style with her and their friends.”Being a high-level athlete, Travis Kelce probably does not have much of his free time spent in bars, considering the strenuous nature of his profession. Otherwise, when he is not training or on the field, he co-hosts the extremely popular New Heights podcast with his brother Jason Kelce, a retired NFL great. The podcast has attracted an enormous following and gives fans an inside look at football and the brothers' personal lives.The third rule in the relationship of Kelce and Taylor Swift is one that is most argued about. The couple has reportedly agreed to not be seen with others of the opposite gender to avoid gossip and speculation. This ruling, though questionable, is probably a move to preserve their privacy and keep away from extra reinforcement from their respective professions.“Taylor’s been in this biz long enough to know what comes with being in the spotlight,” they added.The Chiefs star recently disclosed his relationship during an appearance on the Stephen A. Smith Show. “I’m enjoying all aspects of life,"" said Kelce. ""Me and Taylor are happy and I couldn’t be happier to enjoy that confidence off the field and all the support I could ever ask for at the stadium.""He added, “I think personally, the beauty of being in a very strong relationship is that you get that support to be able to come in and focus on your craft, focus on being the best version of you. I think I’m as focused as I’ve ever been on my job and being the best player that I could possibly be week in, week out for this team.""Also Read: “Enjoyed a quiet night”: Travis Kelce and Taylor Swift return to the spotlight following international getaway after Chiefs' Super Bowl loss","Travis Kelce, 35, and Taylor Swift, also 35, started dating over the summer of 2023. The two are frequently spotted together and are a hot topic for fans and the media. Swift apparently has some 'rules' about how Kelce can stay in contact with her and whom he can socialize with.","https://static.toiimg.com/thumb/msid-118614515,imgsize-62432,width-400,resizemode-4/118614515.jpg"
“Take his ball skills and quickness”: ESPN's Mel Kiper Jr. believes Travis Hunter would best fit for the Giants,https://timesofindia.indiatimes.com/sports/nfl/news/take-his-ball-skills-and-quickness-espns-mel-kiper-jr-believes-travis-hunter-would-best-fit-for-the-giants/articleshow/118606391.cms,"Image via Getty Images

Mel Kiper Jr. Wants the New York Giants to select Travis Hunter

The NFL Combine is now underway, with teams assessing potential prospects to shape their franchises. Heisman Trophy winner Travis Hunter is a top prospect in the draft, likely to be a top-three selection. Hunter's impressive career at Jackson State and Colorado has led the Big 12 in receptions, touchdowns, interceptions, tackles, and passes broken up.Travis Hunter, a Colorado cornerback and wide receiver, is gaining attention for his versatility in the NFL. ESPN's Mel Kiper Jr. projects him as the third overall pick, potentially joining the New York Giants, sparked by his exceptional skills.""Hunter is my top-ranked prospect in the class, and though I currently see him as a receiver in the pros, he could also play cornerback for New York,"" Kiper wrote. ""He can make a massive impact on either side of the ball, and he'll likely see at least some time on both sides.”""Perhaps the Giants take his ball skills and quickness and drop him at receiver opposite Malik Nabers to form a solid supporting cast around whomever is under center. Perhaps they look at his elite instincts and finally land a true CB1. Either way, this pick would be clutch for a struggling Giants team.”Hunter's dual capabilities could be beneficial for the Giants, as NFL analyst Sam Monson suggests he could serve as the team's top cornerback and wide receiver, complementing current standout Malik Nabers.The concept of an NFL two-way player is rare, but Hunter's talents have generated discussion among league executives and coaches. Tennessee Titans coach Brian Callahan views it as ""very realistic,"" with the possibility of Hunter starting as a cornerback before gradually assuming offensive responsibilities.Nevertheless, there are questions regarding the physical cost and the challenge of learning both positions. In spite of these issues, Hunter's unusual combination of ability and adaptability makes him a commodity, with the potential to redefine conventional positional roles in the league.With the draft approaching, the Giants' strategy is again the subject of debate. Instability at quarterback and potential desire for veterans Matthew Stafford or Sam Darnold create space for a utility-type addition like Hunter, who could serve in various capacities.Also Read: “An exceptional talent”: Travis Hunter already winning over NFL coaches and executives as a viable two-way player In short, Travis Hunter’s rare two-way skill set makes him one of the most intriguing prospects in the upcoming NFL Draft . His ability to contribute on both defense and offense presents a unique chance for teams like the Giants to strengthen their roster and overall effectiveness.","Travis Hunter, a Colorado cornerback and wide receiver, is gaining attention for his versatility. ESPN's Mel Kiper Jr. projects him as the third overall pick, potentially joining the New York Giants. The concept of an NFL two-way player is rare, but Hunter's talents have generated discussion among league executives and coaches.","https://static.toiimg.com/thumb/msid-118606493,imgsize-38528,width-400,resizemode-4/118606493.jpg"
Boris Spassky Soviet chess grandmaster dies at 88,https://timesofindia.indiatimes.com/sports/chess/soviet-chess-grandmaster-boris-spassky-dies-at-88/articleshow/118615123.cms,"File Pic: Boris Spassky, left and Bobby Fischer analyse their match in Sveti Stefan, Yugoslavia in 1992. (AP Photo)

Go Beyond The Boundary with our YouTube channel.

The Russian Chess Federation announced on Thursday that Boris Spassky , the Soviet chess grandmaster, has passed away at 88 years old. He gained global recognition for his historic 1972 match against American Bobby Fischer during the Cold War.""The tenth world champion Boris Spassky has died at 88,"" stated the federation, describing it as a ""great loss for the country.""Spassky's legacy centres on the 1972 World Chess Championship against Fischer, a contest that reflected the political tensions between the United States and Soviet Union.After becoming world champion in 1969, Spassky faced significant pressure to uphold Soviet chess supremacy, which had persisted since 1948. Although he initially led the match, Fischer staged a remarkable recovery, defeating him and ending Soviet control of the world title.Following the match, Spassky revealed that losing brought unexpected relief, as it released him from what he termed a ""colossal responsibility.""Born in Leningrad (present-day Saint Petersburg) in 1937, Spassky displayed exceptional chess talent early, claiming the World Junior Championship and becoming the youngest grandmaster at age 18.His famous contest with Fischer has inspired numerous creative works, including books, documentaries and films. The match also influenced Walter Tevis's novel The Queen's Gambit , later adapted into a successful Netflix series in 2020.","Boris Spassky, the Soviet chess grandmaster, has passed away at 88 years old. He gained global recognition for his historic 1972 match against American Bobby Fischer during the Cold War. His famous contest with Fischer has inspired numerous creative works, including books, documentaries and films.","https://static.toiimg.com/thumb/msid-118615189,imgsize-719454,width-400,resizemode-4/118615189.jpg"
