Article Title,Article Link,Article Text,Article Summary,Article Image
“Three-against-one situation”: El Rubius opens up on being “targeted” in MrBeast’s viral $1M challenge,https://timesofindia.indiatimes.com/world/us-streamers/three-against-one-situation-el-rubius-opens-up-on-being-targeted-in-mrbeasts-viral-1m-challenge/articleshow/130054402.cms,"El Rubius reacted honestly after his elimination from MrBeast’s $1 million challenge, calling it “unfair” and claiming he was targeted in a three-against-one situation. Despite his frustration, he thanked fans and gave away his $50,000 winnings. His response felt real and balanced, especially after MrBeast’s team later sent him a cake, softening the moment.

El Rubius reflects on a tough and “unfair” exit







El Rubius did not just walk away from MrBeast’s $1 million streamer challenge. He opened up. Soon after his elimination, the Spanish creator shared a raw reaction with fans, giving them a closer look at what the experience felt like from inside the game. It was not polished or carefully framed. It felt real, and that is exactly why it caught attention so quickly.The clip and his response have since fueled conversations across the streaming space. Some viewers believe intense competitions like this naturally lead to uneven situations. Others feel Rubius may have had a point about being singled out. Either way, his words have added a human layer to a challenge that many only saw as entertainment.Speaking through an Instagram Story, Rubius did not hide his frustration, but he also made sure to thank his supporters. He said, ""Guys, I just got knocked out of the game. It was a bit of an unfair elimination, but hey, at least I managed to walk away with $50,000 for you all, which I’ve already distributed. It went to the mods, the subs, and the non-subs alike.""He further added, ""I’m happy, of course, though admittedly, it was incredibly tough.I wasn't really a fan of the challenge itself, either. But then again... it was basically a three-against-one situation the entire time. I mean, they were targeting me specifically the whole way through. I kept trying to go after RaKai, but, well, he actually just got eliminated in the end. So, at least justice was served for Abraham. Abraham, if you’re watching this, we were all rooting for you, and standing right there with you.""His message carried mixed emotions. There was disappointment, yes, but also pride in how he handled things. Giving away his $50,000 winnings to his community stood out as a gesture that meant more than the result itself.He continued with another honest note, saying, ""And in the end, karma finally caught up with that little punk. Sorry, I’m being a bit toxic right now, but let's just hope the MrBeast team doesn't see this! Guys, thank you all so much. Seriously, thank you for all the support and for just being there.""He added, ""Every time I asked for something in the chat or whatever it was, you guys were right there. You’re incredible. I’m a little disappointed in myself, personally, mostly for not performing better, but hey, I gave it my all, and we still walked away with $50,000, so we’ve got to look on the bright side. All right, guys, big hugs to all my brothers out there!""Interestingly, the story did not end with frustration. Later that day, Rubius revealed that MrBeast’s team had sent him a cake after his exit. It was a small gesture, but it shifted the mood. It showed that even in a high-pressure challenge, there is still room for respect.In the end, Rubius’ reaction felt honest and grounded. That is what stayed with people.","El Rubius was eliminated from MrBeast's $1 million streamer challenge. He called it ""unfair"" and said he was targeted in a three-against-one situation. Despite his frustration, he thanked fans and gave away his $50,000 winnings.","https://static.toiimg.com/thumb/msid-130054402,imgsize-47272,width-400,height-225,resizemode-4/130054402.jpg"
Ipl Ticket Scam: IPL craze costs techie Rs 1.46 lakh in fake RCB vs CSK ticket scam,https://timesofindia.indiatimes.com/sports/cricket/ipl/top-stories/ipl-craze-costs-techie-rs-1-46-lakh-in-fake-rcb-vs-csk-ticket-scam/articleshow/130059549.cms,"Image credit: AI generated pic

Watch Devdutt Padikkal press conference: Chinnaswamy pitch, Tim David’s power & RCB’s batting strategy Devdutt Padikkal press conference: Chinnaswamy pitch, Tim David’s power & RCB’s batting strategy

RCB register their second win

Poll Do you think the demand for IPL tickets is too high every season? Yes, it's excessive. No, it's just right.

NEW DELHI: IPL comes and the demand for tickets and passes go soaring up by the fans. The desperation to get inside the stadium to watch their favourite teams in action in the IPL go high and high. When the tickets get sold out, the demand gets too hig, and the cricket fans even ask for tickets in black. But for a 25-year-old techie the craze for IPL tickets for RCB vs CSK turned too costly and he was duped for a massive Rs. 1.46 lakh.The techie, a resident of B Narayanapura, fell into a trap by a post posted by a fraudster who posed himself as a ticket seller on Instagram.As per a report in Deccan Herald, the techie alleged in a complaint to Mahadevapura Police that an individual claiming to be Sumit Biswal promised he could arrange IPL tickets along with food coupons.As per the techie, Biswal was introduced him as a senior supervisor for ticket counter at M Chinnaswamy Stadium""He asked me to come near the stadium gate number 10, saying someone would deliver the tickets within minutes, and even sent an email confirmation to gain my trust,"" the complainant told Deccan Herald.""Initially, I agreed to buy two tickets for Rs 3,700 each,but he kept asking for more money under various pretexts such as refundable security deposits, additional ID cards and food coupons.Trusting him, I made multiple payments - even using my mother’s bank account after exhausting my own limits—and ended up transferring around Rs 1.46 lakh,"" he added.Bhuvneshwar Kumar’s incisive spell of 3-41, coming after a marauding batting show from Tim David, Rajat Patidar and Devdutt Padikkal, propelled Royal Challengers Bengaluru (RCB) to a commanding 43-run victory over Chennai Super Kings (CSK) in their IPL 2026 encounter at the M Chinnaswamy Stadium on Sunday.The contest saw RCB’s batting unit dismantle CSK’s attack with relentless hitting, as David’s 70 not out off just 25 balls and Patidar’s unbeaten 48 off only 19 balls provided for the late fireworks after Padikkal’s fluent 50 off 29 balls had set the tone for the daunting total.Their combined effort lifted RCB to a daunting 250/3, thus setting a new record for highest total in IPL 2026. In reply, CSK faltered under scoreboard pressure, with Sarfaraz Khan’s 50 off 24 balls and Prashant Veer’s 43 the lone acts of resistance amid a string of failures from the top order.Bhuvneshwar was at his disciplined best and even crossed the 200-mark in terms of wickets in IPL, with others also chipping in as CSK were bowled out for 207 in 19.4 overs. The comprehensive win also meant RCB have registered four consecutive triumphs over CSK for the first time in the IPL’s history.","Royal Challengers Bengaluru (RCB) beat Chennai Super Kings (CSK) in their IPL 2026 encounter at the M Chinnaswamy Stadium on Sunday. Tim David, Rajat Patidar and Devdutt Padikkal put on a marauding batting show to lift RCB to a daunting 250/3. RCB have registered four consecutive triumphs over CSK for the first time in the IPL's history.","https://static.toiimg.com/thumb/msid-130059719,imgsize-95752,width-400,height-225,resizemode-4/ipl-fraud-0604-s.jpg"
"Clavicular Viral Controversy: ""Trans women are....."": Clavicular’s viral moment with trans women sparks fresh conversation on internet culture",https://timesofindia.indiatimes.com/world/us-streamers/trans-women-are-claviculars-viral-moment-with-trans-women-sparks-fresh-conversation-on-internet-culture/articleshow/130053479.cms,"A viral clip featuring Clavicular and trans women is gaining attention for its calm and honest tone. The conversation explores how online language and trends move across communities. Instead of conflict, the exchange highlights shared influence and mutual awareness. Viewers are engaging with its thoughtful nature, as it reflects how internet culture evolves through collaboration rather than ownership.

Clavicular and trans women share a surprising realization about online trends







The video of Clavicular, a short-video producer, is going around the Internet, yet not the reason why. There is no yelling or over-the-top drama. It is a mere, everyday talk that seems almost novel nowadays, in the age of internet, which is overflowing with content. The scene is easy-going, the tone of the narrative is straightforward, and the characters appear more concerned with conversation than combat.The message that is being addressed is the flow of the conversation. It discusses internet culture, the way people communicate with one another and the place of trends. Rather than bringing out a debate, the encounter towards curiosity. It quietly brings attention to something that a lot of people who use the internet notice but don't often say out loud. People in different communities often have a bigger impact on each other than they think.The conversation begins with a confident and lighthearted comment from one of the trans women present. She says, ""You know that trans women are like the OG lip masters, right? We are very talented in the program. Like, I do the peptides, I'm on Zeta."" Her tone carries a mix of pride and humor, setting a relaxed vibe at the table.Clavicular responds in a way that keeps the mood steady but adds a different angle.He says, ""That is funny because you guys were using a lot of the words in like the South Korean subreddits in like 2014."" It’s not confrontational. If anything, it feels like an observation. He points to how certain words and ideas may have traveled across different online spaces over time.Another voice joins in and brings the moment full circle. ""Guys, we're like the OGs. I saw a couple of posts about that. We're like copying each other."" That line hits in a simple but honest way. It reflects something familiar. Online culture is rarely created in isolation. It grows through sharing, borrowing, and sometimes even unknowingly repeating.That's what makes the clip so powerful. It doesn't want to make a point or win an argument. It only shows a group of people talking, listening, and figuring something out together.This moment feels different in a space where viral content often leads to fights. It reminds people that conversations can be calm, thoughtful, and still important. And sometimes, that honest silence is what makes it work.","A viral clip featuring Clavicular and trans women is gaining attention for its calm and honest tone. The conversation explores how online language and trends move across communities. Viewers are engaging with its thoughtful nature, as it reflects how internet culture evolves through collaboration.","https://static.toiimg.com/thumb/msid-130053479,imgsize-26410,width-400,height-225,resizemode-4/130053479.jpg"
"As Messi chased history, Delhi found its FIFA fan zone",https://timesofindia.indiatimes.com/city/delhi/as-messi-chased-history-delhi-found-its-fifa-fan-zone/articleshow/131937895.cms,"Popcorn, sausages and soft drinks kept guests fuelled as they cheered and celebrated through the evening

Austrian Ambassador Robert Zischg (L) and Deputy Head of Mission, Austrian Embassy, Gisela Kristoferitsch (R )

‘The sport is bringing people together’

The evening was a roller coaster of cheers, sighs and nervous glances (L), Kaspar Meyer (R ), Spokesperson, German Embassy, wore a T-shirt featuring football legend Diego Maradona

My heart beats for our team, Austria: Austrian Ambassador

(L-R) Serbian Ambassador Siniša Pavić and Paraguayan Ambassador Fleming Raul Duarte, Bosnian Ambassador Haris Hrle

In a world that is torn by conflict, sportsmanship is very important. Seeing the response today from fans of both teams, this sport is uniting people Austrian Ambassador Robert Zischg

A face-paint and glitter station helped supporters wear their allegiance on their sleeves – and faces

Football fans sported the colours of their favourite teams at the screening





Late on Monday night, Austrian Ambassador Robert Zischg’s residence turned into a screening hall for the FIFA match against Argentina, drawing a full house. With every chair occupied, fans lining the stairs, and the buttery aroma of popcorn filling the room, Austria supporters geared up to celebrate the country’s qualification after 28 years, while Argentina fans waited to watch Lionel Messi chase history.And deliver he did. With two goals, he became the top scorer in World Cup history, leading Argentina to another victory. The win comes just days after he scored a hat-trick against Algeria in their opening match.Attendees dressed in Austrian red, Argentinian blue and white, and even the occasional yellow for Brazil came together to witness an unforgettable game. Supporters cheered every attacking move near the goal and waved their flags, while fouls from either team sparked reactions across the room. Thaisleem, an attendee, shared, “This is my first time attending a football screening in Delhi, and the energy is great. I’m from Kerala, where football screenings are very popular during the World Cup. It’s lovely to see supporters of both teams, so it’s bringing people together.”Speaking to us at half-time, Austrian Ambassador Robert Zischg said, “We really wanted to use this beautiful residence to stream the World Cup, especially since Austria has qualified after 28 years. I must admit I’m a little biased, as I have also served as ambassador to Argentina (laughs). But of course, tonight my heart beats for our team, Austria. It’s a really difficult match because Argentina, and in particular Messi, is excellent. ”","Austrian Ambassador Robert Zischg’s residence turned into a screening hall for the FIFA match against Argentina. With every chair occupied, fans lining the stairs, and the buttery aroma of popcorn filling the room, Austria supporters geared up to celebrate their qualification after 28 years. Argentina fans waited to watch Lionel Messi chase history.","https://static.toiimg.com/thumb/msid-131937470,imgsize-254716,width-400,height-225,resizemode-72/popcorn-sausages-and-soft-drinks-kept-guests-fuelled-as-they-cheered-and-celebrated-through-the-evening.jpg"
Inside job: Bizman’s eEmployee leaked vital info to help gang pull off Rs 1.5-crore heist,https://timesofindia.indiatimes.com/city/delhi/inside-job-bizmans-eemployee-leaked-vital-info-to-help-gang-pull-off-rs-1-5-crore-heist/articleshow/131948605.cms,"New Delhi:





Police have arrested six men and apprehended two juveniles in connection with the Rs 1.5-crore heist reported from Chandni Chowk two weeks ago. Over Rs 1 crore has been recovered. Among those arrested is a 26-year-old employee of the businessman who had shared the movement, route and live location of the cash with a gang, helping its members steal the cash at gunpoint.“The accused travelled across multiple states in an attempt to evade arrest, but sustained police pursuit ensured that there was no safe haven for them,” joint CP Madhur Verma said.The robbery took place on June 10 when Nitin and his colleague Karan were transporting approximately Rs 1.5 crore in cash on a scooter. As they reached near Zakhira Flyover in Sarai Rohilla, two men riding a red Pulsar motorcycle intercepted them. One of the assailants brandished a pistol and the duo fled with two bags containing the cash.DCP (north) Raja Banthia said, “A police team scanned footage from nearly 500 CCTV cameras, mapped the suspects’ route and developed technical and human intelligence inputs. The CCTV trail revealed that the accused had started following the cash consignment from Paschim Vihar itself.”Investigators found that the gang had used not only the motorcycle but also a scooty and a car. The first breakthrough came when police identified the scooty used in the crime. The vehicle was registered in the name of a juvenile, leading investigators to two juveniles who were apprehended on June 19. Their questioning led police to Viresh, who was riding the scooty during the operation, and property dealer Manpreet.Their interrogation uncovered the role of Karan, who worked for the victim’s company and was one of the persons transporting the cash. Investigators said Karan was passing on real-time updates about the cash movement, route and location to the gang. Armed with this information, the accused conducted reconnaissance, monitored the movement of the cash and followed the two men from Paschim Vihar to Inderlok before striking.Police said the accused regrouped in Tilak Nagar after the robbery, where the stolen cash was divided among them before they dispersed to different locations.Further investigation revealed the involvement of 56-year-old Charanjeet Singh, who works in event management and is Manpreet’s father. Police subsequently arrested him and recovered a part of the looted money.Investigators also identified 41-year-old Vicky, a resident of Tilak Nagar with involvement in nine previous criminal cases, and 43-year-old Dhir Singh of Chander Vihar, who has been involved in 18 previous criminal cases. Police said both men were recently released from jail.Following the crime, Vicky and Dhir travelled through Delhi, Haryana, Rajasthan, Uttar Pradesh, Madhya Pradesh, Uttarakhand, Punjab and Jammu & Kashmir in an attempt to evade arrest. Police teams pursued them continuously for 11 days before finally catching them on their return to Delhi on June 22.","Police have arrested six men and apprehended two juveniles in connection with the Rs 1.5-crore heist reported from Chandni Chowk two weeks ago. Among those arrested is a 26-year-old employee of the businessman who had shared the movement, route and live location of the cash with a gang.","https://static.toiimg.com/thumb/msid-47529300,imgsize-110164,width-400,height-225,resizemode-72/47529300.jpg"
​​ Osmanabad-Latur-Beed MLC polls: Cross-voting hands BJP candidate record win,https://timesofindia.indiatimes.com/city/aurangabad/-osmanabad-latur-beed-mlc-polls-cross-voting-hands-bjp-candidate-record-win/articleshow/131917253.cms,Tired of too many ads?,summarize: Tired of too many ads? Try this quiz to see if you can guess which ads are the most annoying. Try to guess which of these ads is the most irritating to you. Then try to guess the one that's the least annoying to watch.,"https://static.toiimg.com/thumb/msid-131917252,imgsize-87929,width-400,height-225,resizemode-72/basavraj-patiljpeg.jpg"
4 youngsters trapped in elevator of Navi Mumbai high-rise for 90 minutes; rescued safely by firemen,https://timesofindia.indiatimes.com/city/navi-mumbai/4-youngsters-trapped-in-elevator-of-navi-mumbai-high-rise-for-90-minutes-rescued-safely-by-firemen/articleshow/131681629.cms,"



NAVI MUMBAI: Four youngsters were trapped inside an elevator between the third and fourth floors of Tulip CHS in Sector 34B, Kharghar, for about 90 minutes from 3 am on Friday due to a power outage in the residential area.The Kharghar fire brigade received the emergency call at 4.25 am and reached the society at 4.35 am.Firefighters rescued the trapped individuals — two men and two women, all aged between 20 and 22 — by forcing open the elevator door from outside using a crowbar and a battery-operated spreader tool.Prashant Darekar, a leading fireman at Kharghar, said,""It took us less than 5 minutes to rescue the trapped youngsters. While, one woman was a tenant in the building, the other three were her friends who had come to drop her home after they returned from a night out.""","Four youngsters were trapped inside an elevator between the third and fourth floors of Tulip CHS in Sector 34B, Kharghar, for about 90 minutes from 3 am on Friday due to a power outage. Firefighters rescued the trapped individuals — two men and two women, all aged between 20 and 22 — by forcing open the elevator door from outside.","https://static.toiimg.com/thumb/msid-131681711,imgsize-510830,width-400,height-225,resizemode-72/4-youngsters-trapped-in-elevator-of-navi-mumbai-high-rise-for-90-minutes.jpg"
"Maha cracks down on dummy admissions, errant FYJC divisions may face derecognition",https://timesofindia.indiatimes.com/city/pune/maha-cracks-down-on-dummy-admissions-errant-fyjc-divisions-may-face-derecognition/articleshow/131949443.cms,"Integrated coaching is not recognised by Maharashtra govt and schools and colleges which operate them will face action

Pune





: Once FYJC classes begin this year, education department authorities will conduct regular inspections to ensure that a school or a college’s premises are not used for coaching classes and that students enrolled in them do not remain absent to attend coaching institutes.Ganpat More, deputy director of education, said that if students are found to be regularly absent during two or three inspections, a proposal to derecognise the division would be sent to govt. The move is aimed at curbing the integrated coaching culture, which has been under scrutiny for some time but came into sharper focus following the NEET paper leak controversy.“There is ‘integrated college’ recognized by the education department. It is up to the parents where they want to admit their children. If they don’t want them to study in Std XI, that is their choice. They can take admission in a coaching class, fill up form no. 17, and take the examination. But if you are taking admission in a college, then you are bound to follow the rules and regulations laid down by the education department,” More said.He added that many colleges avail different concessions as a teaching institute.“From salary to non-salary grants and other benefits, if you are registered as a college, you have to follow govt norms and impart education. You cannot have teachers on rolls doing nothing while students are taught by coaching classes,” he said.From cluster head to state-level officers, inspections are expected at least once a week. “If we find that students are repeatedly absent or that teachers on the roster are not the ones teaching or if practicals or other aspects of the teaching schedule are not followed repeatedly in 2-3 inspections, we will send a report to govt recommending de-recognition of the division,” More said.While welcoming the move to inspect schools and colleges, Mahendra Ganpule, spokesperson for Maharashtra School Principals’ Federation, pointed out that if regular colleges were to prepare students for exams like NEET and CET effectively, parents would not feel the need to turn to private coaching classes.Ganpule said colleges may not be willing to undertake such preparations and it was not enough to simply call for a ban on private coaching classes. Without a viable alternative, the students’ future cannot be left to chance.He said the prevailing perception is that the prescribed syllabus for Std XI and XII board examinations is merely a chore to be completed out of sheer necessity.“Enrolling in a college and submitting the board exam application through that institution is the standard and mandatory procedure. However, the current trend suggests that a majority of parents find this system undesirable as times change. This is because the moment mandatory college attendance is enforced, the question about how a student is to prepare for NEET and JEE crops up,” Ganpule added.","Integrated coaching is not recognised by Maharashtra govt and schools and colleges which operate them will face action. If students are found to be regularly absent during two or three inspections, a proposal to derecognise the division would be sent to govt.","https://static.toiimg.com/thumb/msid-131949442,imgsize-217327,width-400,height-225,resizemode-72/24_12_2022_006_006_008_toibgcjpg.jpg"
