Article Title,Article Link,Article Text,Article Summary,Article Image
NBA Fab Five Member Chris Webber and Coach Prime Get Into a Heated Discussion About the Best Fisherman Title,https://timesofindia.indiatimes.com/sports/nba/top-stories/nba-fab-five-member-chris-webber-and-coach-prime-get-into-a-heated-discussion-about-the-best-fisherman-title/articleshow/118585348.cms,"Images via Getty Images

Coach Prime takes fishing very seriously, no matter the opponent

""Things got heated when he heard I’m one of the best fishermen known to man!""

Coach Prime is not one to sit quietly when his fishing expertise is being questioned



""I know it's your man. I know it's your boo, know it's your baby daddy, all that. I'm telling you, he should have never came onto my show, he's gonna talk about he's gonna outfish Prime. What's wrong with him? He don't even understand. I got my own rods. My rods say Prime. My lures say Prime. Everything I do say Prime.""

NFL legend turned NCAA coach Deion Sanders , best known as Coach Prime or Prime Time, played in the National Football League (NFL) for 14 years. He also played nine seasons in Major League Baseball (MLB). But looks like the NFL and MLB are not the only arenas he is interested in, as recently, he expressed his prowess in fishing as well. He got into a heated discussion with NBA legend Chris Webber , famous for being part of the Fab Five, about who is better at fishing. Let's find out!Coach Prime has won two Super Bowl titles and made one World Series appearance, making him the only athlete to play in a Super Bowl as well as the World Series. After his playing career, Sanders became a coach, turning his attention towards college football. But all that does not mean he is ever leaving his fishing days behind.In his podcast, ""We Got Time Today,"" a recent episode saw Fab Five member Chris Webber making an appearance. And apparently, things got a little heated between the two, all because they could not decide on who was better at fishing among them. Webber took to his socials to share a video of Coach Prime talking smack about Webber and his fishing, all in good fun, writing at the end:Fishing might help him clear his mind, but looks like if someone poses a challenge to his fishing caliber, all bets are off.In the video posted by Webber in collaboration with Prime Time, which seems to have been recorded by Webber's wife, the latter is in full roast mode. He can be heard saying:Coach Prime enjoys his fishing as much as the next person. But do not come to him and say you're better at it than him; he has a problem with it. Unless you can prove it to him somehow! After his fishing expedition with Travis Hunter, maybe he can take Chris Webber to go with himAlso Read: 10 NBA legends whose careers were cut short by injury: Larry Bird, Chris Webber, and more","NFL legend Deion Sanders got into a heated discussion with NBA legend Chris Webber about who is better at fishing. Coach Prime has won two Super Bowl titles and made one World Series appearance, making him the only athlete to play in a Super Bowl as well as the World Series.","https://static.toiimg.com/thumb/msid-118585523,imgsize-63324,width-400,resizemode-4/118585523.jpg"
NBA Buyout Rumors: Los Angeles Lakers could potentially want to bag $160 million Oklahoma City Thunder point guard to support LeBron James and Luka Doncic in stellar championship run,https://timesofindia.indiatimes.com/sports/nba/top-stories/nba-buyout-rumors-los-angeles-lakers-could-potentially-want-to-bag-160-million-oklahoma-city-thunder-point-guard-to-support-lebron-james-and-luka-doncic-in-stellar-championship-run/articleshow/118587126.cms,"LeBron James and Luka Doncic (Image via Getty)

Los Angeles Lakers

Oklahoma City Thunder

star

Chris Paul

""The Spurs suddenly find themselves in an awkward position—too talented to tank naturally but not competitive enough to make a real playoff push without their franchise star,""

""It took over a decade, but Chris Paul might finally get his shot to wear the purple and gold.""

Chris Paul (Image via Getty)

How would Chris Paul benefit the Los Angeles Lakers if the deal goes through?

Theare making waves in the Western Conference, solidifying their status as genuine contenders after a dominant 23-point victory over the 2023 NBA champions, the Denver Nuggets . With LeBron James and Luka Doncic still fine-tuning their chemistry, the Lakers are reportedly exploring ways to add a seasoned veteran to their roster. One name that has emerged as a potential target is former, who could become available via the buyout market.Paul, currently with the San Antonio Spurs, finds himself in a unique situation. The Spurs recently acquired guard De'Aaron Fox in a blockbuster trade, and with franchise cornerstone Victor Wembanyama sidelined for the rest of the season, the team is in a transitional phase. This has sparked speculation that Paul and the Spurs could mutually agree to part ways, giving the 12-time All-Star a chance to chase his first NBA championship .Fadeaway World has already predicted the Los Angeles Lakers as a likely destination for Paul if he hits the buyout market.wrote Eddie Bitar of Fadeaway World.Paul, now 39, has had a storied career, from his early days with the New Orleans to his impactful stints with the Thunder and Phoenix Suns. His leadership and adaptability have been widely praised, earning him a four-year, $159 million contract well into his 30s. Despite his age, Paul remains a valuable asset, known for his ability to elevate teams and make those around him better.For the Los Angeles Lakers, adding Paul could be a masterstroke. His friendship with LeBron James and his reputation as one of the league's most adaptable players make him an ideal fit. Paul's playmaking and veteran savvy could provide the Lakers with the stability and leadership needed to make a deep playoff run.Also read: NBA Offseason Rumors: Milwaukee Bucks might benefit from signing $195 million Utah Jazz center to support Giannis Antetokounmpo Everyone will be watching Chris Paul as the buyout market heats up to see if he will finally don the purple and gold and possibly team up with LeBron James to win an NBA championship.",Chris Paul could become available via the buyout market. The 39-year-old is currently with the San Antonio Spurs. Fadeaway World has predicted the Los Angeles Lakers as a likely destination for Paul. Paul's playmaking and veteran savvy could provide the Lakers with the stability and leadership needed to make a deep playoff run.,"https://static.toiimg.com/thumb/msid-118587127,imgsize-60986,width-400,resizemode-4/118587127.jpg"
"Will LaMelo Ball play tonight against the Dallas Mavericks? Latest update on the Charlotte Hornets star's injury report (February 27, 2025)",https://timesofindia.indiatimes.com/sports/nba/top-stories/will-lamelo-ball-play-tonight-against-the-dallas-mavericks-latest-update-on-the-charlotte-hornets-stars-injury-report-february-27-2025/articleshow/118611721.cms,"LaMelo Ball's ankle injury leaves his status uncertain for the Charlotte Hornets' game against the Dallas Mavericks. With eight key players, including Ball, on the injury report, the Hornets face a tough challenge. The Mavericks also have their share of injuries. The game will be crucial for both teams adapting to their depleted rosters.","LaMelo Ball's ankle injury leaves his status uncertain for the Charlotte Hornets' game against the Dallas Mavericks. The Hornets have eight key players, including Ball, on the injury report. The Mavericks also have their share of injuries. The game will be crucial for both teams adapting to their depleted rosters.","https://static.toiimg.com/thumb/msid-118611761,imgsize-108708,width-400,resizemode-4/118611761.jpg"
Taylor Swift’s dinner conversation with Brittany Mahomes fuels baby rumors: Is motherhood on the horizon?,https://timesofindia.indiatimes.com/sports/nfl/news/taylor-swifts-dinner-conversation-with-brittany-mahomes-fuels-baby-rumors-is-motherhood-on-the-horizon/articleshow/118569640.cms,"Taylor Swift and Travis Kelce had dinner with Patrick Mahomes and his wife before the Super Bowl, focusing on discussions about parenthood. Swift may be taking a year off to concentrate on her relationship with Kelce, including the possibility of marriage and starting a family.

Are Taylor Swift and Travis Kelce planning for a baby?

As Taylor Swift and Travis Kelce were getting ready for the Super Bowl last month, their pre-game convo allegedly was about something other than football. The night prior to the big game, the couple was dining at Lilette, an upscale French restaurant in New Orleans.They were not alone, along with them were Travis Kelce's Kansas City Chiefs team player Patrick Mahomes and his wife, Brittany Mahomes. Although the Super Bowl was certainly on their minds, sources indicate that the night's chatter turned to more intimate issues, creating a memorable evening prior to the championship battle.Taylor Swift and Travis Kelce had dinner prior to the Super Bowl at French restaurant Lilette in New Orleans with Patrick Mahomes and Brittany Mahomes. As the crowd enjoyed their supper, sources hinted that the discourse turned to one personal issue -children, particularly because the couple Mahomes welcomed their second little one.“There was lots of baby talk,” the insider revealed, mentioning that Brittany was sharing pictures while the group enthusiastically discussed parenthood. This insight comes as speculation grows about Swift’s future, especially now that her record-breaking Eras Tour has officially concluded.Taylor Swift, known for her work ethic and creative projects, may be taking a ""gap year"" to focus on her personal life, particularly her relationship with Kelce, according to close sources. “For the first time in years, Taylor has no definitive plan,” an insider shared. “She is taking a year off. That means no tours or shows. She and Travis are in it for the long haul, and they both want the same things: a forever romance and a family.”Swift is open to marriage and children, according to close friends. “Taylor's friends believe now is the perfect time in her life to marry and have children,” a source said. “They’ve expressed this to her, and she is not against it at all. Taylor has never felt love like this. It’s unconditional.”Taylor Swift and Travis Kelce's romance began in 2023 when Swift attended Kelce's game against the Chicago Bears. Since then, the couple has made headlines with high-profile outings, including Kelce's surprise onstage appearance at Swift's London ""Eras Tour"" and Swift playfully tweaking her lyrics to acknowledge her NFL star boyfriend in the crowd.The timing is perfect, especially considering the rumors surrounding Travis Kelce's retirement. “I know everybody wants to know whether or not I’m playing next year,” he admitted, speaking to Jason, who retired from football in March 2024. “Right now, I’m just kicking everything down the road. I’m not making any crazy decisions, but right now, the biggest thing is just being there for my teammates and being there for my coaches, understanding that there’s a lot goes into this thing.”Travis Kelce's football career is winding down, and Swift is at a natural crossroads following her record-breaking tour, suggesting the couple may be at the perfect moment to turn their love story into something bigger. “Travis and Taylor have both achieved everything they ever wanted, massive success and enough money for ten lifetimes,” one insider said. “The only thing they don’t have yet is a family of their own.”Also Read: “Such a likable guy”: Hollywood producer is all praises for Travis Kelce, reveals the Chiefs TE is destined for Hollywood success","Taylor Swift and Travis Kelce had dinner with Patrick Mahomes and his wife before the Super Bowl, focusing on discussions about parenthood. Swift may be taking a year off to concentrate on her relationship with Kelce, including the possibility of marriage and starting a family.","https://static.toiimg.com/thumb/msid-118569640,imgsize-63102,width-400,resizemode-4/118569640.jpg"
“Look at Aaron Judge”: Sean Casey lashes out at Elly De La Cruz for lack of athleticism,https://timesofindia.indiatimes.com/sports/mlb/news/look-at-aaron-judge-sean-casey-lashes-out-at-elly-de-la-cruz-for-lack-of-athleticism/articleshow/118603632.cms,"GOODYEAR, ARIZONA - FEBRUARY 18: Elly De La Cruz #44 of the Cincinnati Reds poses for a portrait during photo day at the Cincinnati Reds Player Development Complex on February 18, 2025 in Goodyear, Arizona. (Photo by Emilee Chinn/Getty Images)

Sean Casey suggests Elly De La Cruz to follow Aaron Judge's hitting technique

""You're 6'5"", 6'7""—you’ve got to get your arms extended. You're not using your height, your length, or your athleticism. Go look at Aaron Judge’s heat map—he does so much damage middle-away,""

Elly De La Cruz breakdown, Terry Francona love & Sean Casey gives AMAZING hitting tips.

""When a boxer throws a punch fully extended and catches you on the chin, it rattles you, but it doesn’t knock you out. But if I can get you close, like Tyson used to get in on guys, and I make contact, then go through you—I’m gonna knock you out. It’s the same thing with baseball. You’ve got to be able to get the ball on you and then get through it.""

""When a boxer throws a punch fully extended and catches you on the chin, it rattles you, but it doesn’t knock you out. But if I can get you close, like Tyson used to get in on guys, and I make contact, then go through you—I’m gonna knock you out. It’s the same thing with baseball. You’ve got to be able to get the ball on you and then get through it.""

After having an impressive 2024 MLB season , Elly De La Cruz will be heading into the new season with a mission to improve his performance all while helping the Cincinnati Reds qualify for the playoffs and win a World Series Championship. While Cruz has often been praised for his skills, ex-Yankees head coach Sean Casey recently lashed out at the shortstop for his techniques.In an episode of ""The Mayor's Office"" podcast, the former head coach of New York Yankees Sean Casey lashed out at Elly De La Cruz for his low ""athleticism"". Casey suggested Cruz follow the ""heat map"" of Yankees' captain Aaron Judge, considering how it has worked wonders for the team.Casey said.Moving forward in the podcast episode, Sean Casey asked Elly De La Cruz to take inspiration from boxing legend Mike Tyson's special knockout style. Talking about how the special style can be implemented in Cruz's techniques, Casey further added:Elly De La Cruz made headlines previously when he talked about his major goals for the 2025 MLB season to help the Reds win a World Series Championship.","Sean Casey suggests Elly De La Cruz to follow Aaron Judge's hitting technique. Casey suggested Cruz follow the ""heat map"" of Yankees' captain Aaron Judge, considering how it has worked wonders for the team. Cruz has often been praised for his skills, but Casey recently lashed out at the shortstop for his techniques.","https://static.toiimg.com/thumb/msid-118603611,imgsize-24066,width-400,resizemode-4/118603611.jpg"
"Michael Jordan’s letter to high-school sweetheart leaked: ""You are my whole life next to Basketball""",https://timesofindia.indiatimes.com/sports/nba/top-stories/michael-jordans-letter-to-high-school-sweetheart-leaked-you-are-my-whole-life-next-to-basketball/articleshow/118596695.cms,"Michael Jorda. Image via: NBA.com

Laquetta Robinson

Michael Jordan penned a letter for Laquetta Robinson in 1981 which got auctioned for $10,000



Michael Jordan. Image via: Aurelien Meunier/ Getty Images

Back in 1981, Michael Jordan and his high school sweetheartwere deeply involved in their romantic relationship. Proof lies in a letter that he wrote to his girlfriend before becoming the star that he is today. The letter recently leaked after it was put up for auction at LeLands DotCom. The content of the letter shows how he deeply loved Robinson while also prioritizing basketball as a career.The letter was written when Michael Jordan was playing at the University of North Carolina under the mentorship of coach Dean Smith. He was 18 years old at the time and had big dreams that he wanted to achieve. In the handwritten note, he shared with his high school sweetheart, ""Laquetta, you are my whole life next to basketball.” He continued, ""Please don't get mad about that statement. You are my whole life. But you can't have basketball.""The next part of the letter really shows the faith that he had in himself to succeed. He wrote, ""Next year I will show you things you can't believe. Some of these things will amaze you.” Conveying his love for Laquetta, he also wrote, “Laquetta, I will go out of my way just to speak to you. This shows you how much I really care.” The letter also showed that he deeply cared about her family and was looking forward to their approval.The promise that he made to Laquetta was delivered upon the exact next year. In 1982, he hit a legendary game-winning shot in the NCAA Championship that marked the beginning of his groundbreaking career.While his relationship held a lot of significance in his teenage years, the bond did not last long. He was married to Juanita Vanoy briefly before announcing their divorce in 2006. In 2008, he met Yvette Prieto, a Cuban-American model. What followed was an engagement in 2011 and a grand wedding in Palm Beach, Florida in 2013. They also welcomed their twin daughters in 2014. While the duo prefer to keep their relationship private, they have made multiple red carpet appearances together. They also attended many basketball matches, boxing matches and NASCAR races together.Also Read: LeBron James Vs. Michael Jordan Debate Rages On As Bill Simmons Suggests Banning Obsessive Fans On Elon Musk’s X Despite his successful marriage, his fandom is deeply involved with his high school years. The letter was auctioned at $10,000 along with a picture of him with Laquetta Robinson at prom.","Michael Jordan penned a letter for Laquetta Robinson in 1981 which got auctioned for $10,000. The letter was written when Michael Jordan was playing at the University of North Carolina under the mentorship of coach Dean Smith. In the handwritten note, he shared with his high school sweetheart, ""Laquetta, you are my whole life next to basketball""","https://static.toiimg.com/thumb/msid-118596831,imgsize-816566,width-400,resizemode-4/118596831.jpg"
Alex Ovechkin May Retire After Breaking Wayne Gretzky's Record,https://timesofindia.indiatimes.com/sports/nhl/news/alex-ovechkin-may-retire-after-breaking-wayne-gretzkys-record/articleshow/118604902.cms,"(Image via Getty)

""It'll be nice. I'm not gonna lie, but you know it's still a long way to go. I don't know how many pucks are behind them, but you know, before Gretzky, it's a great name out there.""

""You're probably never going to see me on the ice again.""

""Instant retirement.""

""I don't like the word 'if'. We live today, we play, we move on."" says Alex Ovechkin about retiring after breaking Wayne Gretzky's record

""Do you follow the KHL? Your long-time teammate Ilya Kovalchuk, who returned to hockey at the age of 40?""

""I check the score periodically. Ilya is great. We talked to him recently. Getting ready for playoffs. I think this man, with his health and approach to business, can play until he is 50 years old. The most important thing is that he himself wants it.""

""Can you reach 50?""

""No!""

""Will you finish out your current contract in NHL, and that's it?""

""I think, yes.""

""And, if you don't manage to break Gretzky's goal record, won't you re-sign for the season?""

""I don't like the word 'if'. We live today, we play, we move on.""



""I don't want to play just for that record,"" says Alex Ovechkin about breaking The Great One's career NHL goals record of 894

""Of course, it (breaking Wayne Gretzky's record) matters. But, like I said, I'm not going to score 300 goals in two years. It's going to take five or six years. I have to be healthy enough to do that. I don't want to play just for that record. I want to be healthy, I want to have fun, I want to enjoy the moment when I'm on the ice.""

ALEX OVECHKIN REVEALS HIS RETIREMENT (Washington Capitals News)

Alex Ovechkin's current contract details with the Washington Capitals

""Alex Ovechkin has indicated that he plans to retire after fulfilling his current contract with the Washington Capitals. Although he announced the possibility of retiring in two years, he left open the chance to continue if he feels good.""

Also Read:

Washington Capitals ice hockey left winger and captain Alexander Ovechkin is 11 career NHL goals away from The Great One, Wayne Gretzky's career NHL goals of 894. Would Alex Ovechkin retire after breaking The Great One's record?Talking to ESPN's Linda Cohn in 2019 about breaking Wayne Gretzky's record, Alex Ovechkin replied,About retiring thereafter, Alex Ovechkin shared,Linda responded,and chuckled.An excerpt from Russian Journalist Igor Rabiner's interview with Alex Ovechkin in February 2024:Rabiner asked,Alex replied,Rabiner asked,Ovechkin said,Rabiner questioned,Ovechkin responded,Rabiner quizzed,Ovechkin retorted,In September 2019, Washington Capitals ice hockey left winger Alex Ovechkin was interviewed by Sportsnet's Elliotte Freidman. Alex Ovechkin shared in the interview,According to Bolavip, In 2021, Alex Ovechkin signed a 5-year contract extension of $47.5 million. Alex Ovechkin receives an average annual salary of $9.5 million. He's one of the highest-paid NHL players. The contract also mentioned a $34 million signing bonus and an annual salary of $5 million for the 2024-2025 NHL season. Ovechkin's current contract will take him through the 2025-2026 NHL season.Bolavip also shared about Alex's will to retire,","Alex Ovechkin is 11 goals away from Wayne Gretzky's career NHL goals record of 894. In an interview with ESPN in 2019, Alex said, ""I'm not going to score 300 goals in two years. It's going to take five or six years. I don't want to play just for that record. I want to be healthy"" In a February 2024 interview with Russian journalist Igor Rabiner, Alex told him, ""Can you reach 50?""","https://static.toiimg.com/thumb/msid-118605138,imgsize-511367,width-400,resizemode-4/118605138.jpg"
"Will Anthony Davis play tonight against the Charlotte Hornets? Latest update on the Dallas Mavericks star's injury report (February 27, 2025)",https://timesofindia.indiatimes.com/sports/nba/top-stories/will-anthony-davis-play-tonight-against-the-charlotte-hornets-latest-update-on-the-dallas-mavericks-stars-injury-report-february-27-2025/articleshow/118610720.cms,"Is Anthony Davis playing tonight? (Image via Getty)

Is Anthony Davis playing tonight? Dallas Mavericks injury report for tonight’s game against the Charlotte Hornets (February 27, 2025)

Charlotte Hornets injury report for tonight’s game against the Dallas Mavericks (February 27, 2025)

Anthony Davis will miss the Dallas Mavericks’ upcoming game against the Charlotte Hornets due to a groin injury, adding to the team’s growing list of absences. The Mavericks, already dealing with multiple injuries, will face the Hornets at the American Airlines Center on Thursday, February 27, at 8:30 PM ET.Anthony Davis, a key player for the Dallas Mavericks , has been ruled out alongside teammates Caleb Martin (hip), Daniel Gafford (knee), and Dereck Lively (ankle). Dante Exum (face) and Dwight Powell (hip) are listed as day-to-day and questionable, respectively, leaving the team shorthanded as they aim to maintain their playoff push.The Mavericks, currently 31-28, are outscoring opponents by 1.7 points per game, averaging 115.1 points (11th in the NBA). However, Davis’ absence could significantly impact their performance, particularly on the defensive end, where his presence is crucial. Kyrie Irving, the team’s leading scorer with 24.9 points per game, will need to step up alongside P.J. Washington, who is averaging 8.2 rebounds.On the other side, the Hornets are also dealing with a lengthy injury report, including LaMelo Ball, who is day-to-day with an ankle issue. Ball, the Hornets’ leading scorer at 26.3 points per game, could be a game-time decision. Charlotte, sitting at 14-43, has struggled offensively, ranking 28th in the league with 105.4 points per game.The matchup will test both teams’ depth, with the Mavericks looking to capitalize on their home-court advantage despite their injury woes. Fans can catch the game on KFAA and FDSSE or stream it live on Fubo, though regional restrictions may apply.As the Mavericks navigate this challenging stretch, Anthony Davis ’ recovery timeline remains a focal point. His absence underscores the team’s reliance on his versatility and defensive prowess, making his return critical for their postseason aspirations.Also read: Will LaMelo Ball play tonight against the Dallas Mavericks? Latest update on the Charlotte Hornets star's injury report (February 27, 2025) For now, Dallas will rely on its remaining core to keep their playoff hopes alive, while the Hornets aim to exploit their opponent’s vulnerabilities in what promises to be a tightly contested game.","Anthony Davis will miss the Dallas Mavericks’ upcoming game against the Charlotte Hornets due to a groin injury. The Mavericks, already dealing with multiple injuries, will face the Hornets at the American Airlines Center on Thursday, February 27, at 8:30 PM ET. The Hornets are also dealing with a lengthy injury report, including LaMelo Ball, who is day-to-day with an ankle issue.","https://static.toiimg.com/thumb/msid-118610740,imgsize-18936,width-400,resizemode-4/118610740.jpg"
