Article Title,Article Link,Article Text,Article Summary,Article Image
NBA Summer League gets Kelly Bowman Flagg’s mom-approved moment as Cooper Flagg reconnects with Kon Knueppel,https://timesofindia.indiatimes.com/sports/nba/top-stories/nba-summer-league-gets-kelly-bowman-flaggs-mom-approved-moment-as-cooper-flagg-reconnects-with-kon-knueppel/articleshow/122512078.cms,"Cooper Flagg. Image via: David Becker/AP

Cooper Flagg’s mom, Kelly Bowman Flagg, sends a two-word reaction as her son reconnects with Kon Knueppel



Kon Knueppel shines as the Charlotte Hornets dominated the Dallas Mavericks



Duke celebrates the unbreakable bond between Cooper Flagg and Kon Knueppel at the Summer League



In a league full of competition and bright lights, one of the most heartwarming moments from the NBA Summer League came from a simple courtside interaction. When Cooper Flagg, the No. 1 overall pick of the Dallas Mavericks, reunited with his former Duke teammate and roommate Kon Knueppel before their teams clashed in Las Vegas, it was a brief but emotional exchange that left fans talking and Flagg’s mother, Kelly Bowman Flagg, smiling.Though Cooper Flagg was sidelined in street clothes, he still made his presence felt with a short, sincere moment before the Dallas Mavericks vs Charlotte Hornets tipoff. He approached Knueppel, now with the Hornets after being selected fourth overall, and the two shared a quick dap and a smile. The embrace was a callback to their days at Duke and a preview of the respect they’ll carry into their NBA careers.It was the first time the two had met in person since draft night, nearly three weeks prior. Kelly Bowman Flagg, Cooper’s mother, was quick to react on social media after seeing the clip.“Brothers forever,” she reacted.The bond between Flagg and Knueppel has always been evident, but seeing it continue to shine under the NBA spotlight brought a touching layer of humanity to the Summer League showdown.While Flagg didn’t suit up for the game, Dallas had decided to shut him down for the remainder of the Summer League, Knueppel made sure the moment still belonged to Duke. The Hornets’ rookie delivered his best performance of the summer, posting 16 points, 10 rebounds, and 4 assists in Charlotte’s dominant 87-69 victory. His hustle on both ends helped improve the Hornets to a 3-0 Summer League record.Despite being off the court, Flagg remained his former teammate’s biggest fan. Back on draft night, when Knueppel was selected fourth overall during Flagg’s live interview, the Dallas forward couldn’t hold back his excitement. “K Dot!! Let’s go! Oh my God! Let’s go!” Flagg shouted.“It’s surreal. Kon was my roommate last year, so just to see him have that moment with his family—it’s insane. That really just gave me chills. That was amazing.”The connection between Flagg and Knueppel was born during their standout freshman year at Duke, where both were pivotal in pushing the Blue Devils to the NCAA Final Four and winning the ACC Championship. Flagg led the team with 19.2 points per game and brought home a slew of national awards, while Knueppel added 14.4 points per game and was named ACC Tournament MVP.Now, on different teams, their paths will only cross twice during the regular NBA season— but if Summer League was any indication, their bond is just as strong as ever. The Duke basketball program even celebrated the postgame handshake by sharing the clip with the caption: ""Kon 🤝 Coop @NBASummerLeague.""Also Read: LeBron James embraces Victor Wembanyama after San Antonio Spurs star gets medical clearance to return to basketball action","Cooper Flagg, the No. 1 overall pick of the Dallas Mavericks, reunited with his former Duke teammate and roommate Kon Knueppel before their teams clashed in Las Vegas. It was the first time the two had met in person since draft night, nearly three weeks prior. The Duke basketball program even celebrated the postgame handshake by sharing the clip with the caption: ""Kon 🤝 Coop @NBASummerLeague""","https://static.toiimg.com/thumb/msid-122512252,imgsize-45738,width-400,resizemode-4/122512252.jpg"
Baltimore Ravens believe Malaki Starks can be the perfect safety partner for Kyle Hamilton,https://timesofindia.indiatimes.com/sports/nfl/news/baltimore-ravens-believe-malaki-starks-can-be-the-perfect-safety-partner-for-kyle-hamilton/articleshow/122506670.cms,"(Photo by Getty Images) Baltimore Ravens expect first-rounder Malaki Starks to shine next to Kyle Hamilton

The Baltimore Ravens’ challenges at the safety position end with Malaki Starks?

All that we know about Malaki Starks’ Georgia football stats

Malaki Starks Full College Football Highlights | Georgia Star Safety | NFL Draft Film

Pittsburgh Steelers eyed Malaki Starks before drafting defensive tackle Derrick Harmon?

What can Malaki Starks do for the Baltimore Ravens?

Also Read:

The Baltimore Ravens are wasting no time getting safety Malaki Starks involved — and early signs suggest they made the right call drafting him in the first round, because based on just how things are going, he just might deliver. According to Jeff Zrebiec of The Athletic, the rookie out of Georgia has already earned a lot of praise from the coaching staff and looks like a perfect fit next to star safety Kyle Hamilton. The team believes that together, they could form one of the best safety tandems in the NFL.“Starks has wowed team officials with his leadership qualities, work ethic and intelligence. They believe he’ll be an impact player immediately”, Zrebiec wrote in a piece examining the Ravens’ offseason upgrades and concerns.The Baltimore Ravens have struggled to find a long-term partner for Kyle Hamilton in the secondary. Geno Stone showed promise last season but left in free agency. Marcus Williams didn’t work out as planned. So now, all eyes are on Malaki Starks to step in and solidify the position.Depth is also a concern after veteran Ar’Darius Washington tore his Achilles. He’s expected to miss most of the season. Zrebiec notes there’s hope in backup Sanoussi Kane stepping up if needed.But ideally, the Ravens won't have to rely too heavily on backups if the Hamilton-Starks duo stays healthy.Kyle Hamilton is already a two-time All-Pro in just three seasons. While he didn’t have as many highlight-reel plays last year, he still posted over 100 tackles, one interception, nine passes defended and forced two fumbles. With a reliable partner beside him, his impact could grow even more now.Malaki Starks, meanwhile, showed plenty of playmaking potential at Georgia, racking up six interceptions and six tackles for loss over three seasons. Lining up alongside elite talent like Kyle Hamilton and cornerback Marlon Humphrey could give him the freedom to make even more plays.There’s also an interesting backstory involving the Pittsburgh Steelers. Before the draft, they looked into several safeties — including spending time with Malaki Starks at Georgia’s Pro Day. That may have hinted at their decision to later trade Minkah Fitzpatrick, though the move didn’t come until months later. Instead of grabbing Starks, the Pittsburgh Steelers opted to draft defensive tackle Derrick Harmon, leaving the Ravens to grab one of the draft’s top defensive safeties.“If Starks is as good as the Ravens think he is, they’ll have significantly improved at this position”, Zrebiec further wrote. “It won’t take much to improve the safety play from the first half of last season,” he added.Statistically, the Ravens have room to grow. Last season, they ranked 31st in passing yards allowed, 19th in passing touchdowns given up, and 17th in interceptions. They were also 30th in pass attempts faced — meaning teams didn’t throw often but were still successful when they did.Baltimore believes Malaki Starks can help turn that around — and sooner rather than later.",Malaki Starks was drafted by the Baltimore Ravens in the first round of the NFL draft. The Georgia safety is expected to form one of the best safety tandems in the NFL with Kyle Hamilton. Pittsburgh Steelers looked into several safeties before drafting defensive tackle Derrick Harmon.,"https://static.toiimg.com/thumb/msid-122506818,imgsize-56524,width-400,resizemode-4/122506818.jpg"
Who is WNBA star Candace Parker's wife Anna Petrakova? Meet their sons she hopes will join NBA,https://timesofindia.indiatimes.com/sports/nba/top-stories/who-is-wnba-star-candace-parkers-wife-anna-petrakova-meet-their-sons-she-hopes-will-join-nba/articleshow/122505598.cms,"Image credit: Candace Parker/Instagram

Who is Candace Parker’s wife?

Image credit: Instagram

Candace Parker wants her sons to join the NBA

Candace Parker’s WNBA career



WNBA star Candace Parker retired from professional basketball in 2023, but she still lives and breathes the game, and hopes her sons will one day play in the NBA. Currently, her sons are just three and one years old. Parker is married to Russian basketball player Anna Petrakova, and together the two moms are happily raising their children, including Parker’s 15-year-old daughter, Lailaa Nicole, from her previous marriage to NBA player Shelden Williams.Candace Parker had an ugly divorce with NBA player Shelden Williams, and in an unconventional turn of events, she ended up paying him a hefty alimony. She later went on to tie the knot with a woman, Russian basketball player Anna Petrakova.Petrakova, now Anna Parker, graduated from Louisiana State University and played for several teams in Russia. She was named the Russian Premier League Player of the Year in 2014. She retired in 2017 and has been living as a devoted partner to Candace since 2019. The couple are parents to two sons, Airr and Hartt, both born to Petrakova.In an anniversary post in 2022, Petrakova shared a heartfelt message to Parker, “Life with you is full of joy… love… fun… events, surprises, snuggles, dancing, singing, playing (dominoes and spades mostly), parenting, eating good food, drinking good drinks, good communication, good chaos, and sunshine.You make tough days seem easy, you calm my worries, and always carry the load.”“I appreciate you more than you can imagine. All the hard work you put in — the weekly plane rides, the planning and thoughtfulness, the tough decisions — you make it all look effortless. You're the more romantic one in our relationship, and I’m trying to speak your language better. Love you, Mommy!! Happy Anniversary,” the post further read.In June, Candace Parker shared a candid Instagram post expressing her dreams of seeing her sons play in the NBA one day. The post featured a photo of her sitting with Airr and Hartt on her lap in front of the television. Pretending to watch their future draft announcements, she had superimposed text on the screen: “With the 1st pick in the 2040 NBA Draft, the Chicago Bulls select Airr Parker” and “With the 1st pick in the 2042 NBA Draft, the Los Angeles Lakers select Hartt Parker. ”The post continued with a video of Parker playing with Airr, who suddenly hit his younger brother with a basketball, much to her amusement.She captioned the post: “Draft profile: Strengths — Airr Parker is long, athletic, a knock-down shooter with deep range. Weakness — HOT HEAD. Hartt Parker: Strengths — Point forward who can create for himself and others. Weakness — Too unselfish at times. Swipe for proof that Airr is a hothead.”Also Read: “One and Done” – Candace Parker Shares Hilarious Reason for Skipping Shaquille O'Neal's $27 million Private Luxe Jet Candace Parker was the first overall pick in the 2008 WNBA Draft and played 13 seasons with the Los Angeles Sparks. She also spent two seasons with the Chicago Sky and one season with the Las Vegas Aces, winning a championship with each of them during her remarkable WNBA career.","Candace Parker is married to Russian basketball player Anna Petrakova. The couple have two sons, Airr and Hartt, who are just three and one years old. Parker retired from professional basketball in 2023, but she still lives and breathes the game.","https://static.toiimg.com/thumb/msid-122505817,width-400,resizemode-4/122505817.jpg"
NHL Trade Buzz: Will Nazem Kadri team up with Auston Matthews again? Flames star responds to Maple Leafs reunion rumors,https://timesofindia.indiatimes.com/sports/nhl/news/nhl-trade-buzz-will-nazem-kadri-team-up-with-auston-matthews-again-flames-star-responds-to-maple-leafs-reunion-rumors/articleshow/122544374.cms,"Could Nazem Kadri Return to Toronto? Leafs Fans Stir Rumors as Flames Star Responds (Imagn Images)

Leafs fans crave reunion, Nazem Kadri keeps his cool amid buzz



Kadri praises Calgary but leaves door ajar



With the Toronto Maple Leafs still quiet about their plans following Mitch Marner's trade, fans have started speculating about the possibility of another reunion — one that would bring Nazem Kadri back to where it all began. As the Maple Leafs assess their core, including franchise centerpiece Auston Matthews, the idea of rekindling their connection with Kadri has quickly caught fire in the hockey world, even if it's fueled more by nostalgia than negotiations.Nazem Kadri’s departure from Toronto in 2020 came during a turbulent time — the Maple Leafs had just faced yet another playoff heartbreak, and cap space pressures combined with his postseason suspension sealed his fate. It wasn’t the smoothest goodbye. But time has a strange way of softening sharp edges. While management has changed and faces have shuffled, Toronto’s hunger for playoff redemption remains the same. Kadri, known for his edge and energy, is now being seen by some as a piece that could help tilt the balance.Naturally, the rumors have only grown louder. The veteran center is still tied to a hefty $7 million contract in Calgary, and he holds a full no-movement clause — a powerful tool that puts the next move entirely in his hands.But despite no official word from either club, fans are doing what they do best — imagining what could be.Kadri, aware of the speculation, recently addressed the noise during an offseason interview, showing poise and even a hint of amusement.“Unless I live in a box, I think I would hear it. I’ve certainly heard lots of speculation for sure,” Kadri said via The Knight Shift. “Obviously, the rumor mill is pretty strong, especially around these parts. And a lot of the time, the rumors can catch some fire and that fire turns into bigger fires.”Kadri didn’t dismiss the talk outright, but neither did he stoke the flames. Instead, he embraced the chatter as part of the NHL offseason culture.“You know what? And why not? I mean, there’s not a whole lot in terms of sports going on right now,” Kadri continued. “I think it’s definitely a topic to talk about, and hey, why not talk about it?”Despite the buzz around Ontario, Kadri made sure to show his appreciation for Calgary, calling it an ideal place for his family and praising the Flames organization.“It’s been excellent. Calgary is such a great city, especially for the family and myself,” he said. “Very scenic and beautiful, and got some good players along the way. So I appreciate the C of Red for sure.”Still, his future remains an open question. For now, the ball is in Kadri’s court — and if there’s even a flicker of interest in a return to Toronto, the Maple Leafs will be watching closely.Also Read: Connor McDavid needs saving — and Oilers may look to Sidney Crosby's Penguins to rescue his NHL legacy",Nazem Kadri has been linked to a return to the Toronto Maple Leafs. The veteran center left the club in 2020. Kadri is still tied to a $7 million contract with the Calgary Flames. He has a no-movement clause that puts the next move entirely in his hands.,"https://static.toiimg.com/thumb/msid-122544370,imgsize-25354,width-400,resizemode-4/122544370.jpg"
“I’m not picking…” – Paul George will not sign with LaMelo Ball’s team for a reason that could end his career,https://timesofindia.indiatimes.com/sports/nba/top-stories/im-not-picking-paul-george-will-not-sign-with-lamelo-balls-team-for-a-reason-that-could-end-his-career/articleshow/122546332.cms,"Paul George. Image via: Luke Hales/ Getty Images

Paul George revealed why he would not join LaMelo Ball’s team Charlotte Hornets



Paul George had a brutal season with the Philadelphia 76ers



Paul George’s injury setbacks continue as training camp looms



Paul George’s recent comments on why he won’t sign with the Charlotte Hornets left no room for speculation. The Philadelphia 76ers forward made it clear that a move to LaMelo Ball’s team is off the table— because, in his own words, it could be the final nail in the coffin of his NBA career. With his future already clouded by health concerns and an underwhelming season in Philadelphia, George's blunt honesty shows how critical every decision is at this point in his career.Would Paul George ever consider teaming up with LaMelo Ball and signing with the Hornets? George responded without hesitation.“I’m not picking Charlotte just because there’s no winning culture there. My career is over with if I go there,” George said.That harsh take isn’t just about the standings, but from his perspective, it is about self-preservation. At 35 and with his body clearly wearing down, George knows his next few years in the league are not about rebuilding. Mostly, it will be about survival. Charlotte, despite its exciting young core, has been stuck in a cycle of mediocrity and has yet to show real promise as a competitive franchise. For a player trying to revive his form and reputation, the Hornets simply don’t offer the right environment for him, at least in his own image of the franchise.George’s current situation with the 76ers hasn’t been smooth, either. After signing a massive four-year, $212 million deal in the summer of 2024, George was expected to be the final piece of Philadelphia’s championship puzzle. Instead, his first season was marred by injuries, inconsistency, and ultimately, disappointment.He played only 41 games, averaging 16.2 points, 5.3 rebounds, and 4.3 assists— his lowest scoring average since 2014-15, a season in which he played just six games following a major leg injury. His shooting numbers also dipped, hitting just 43% from the field and 35.8% from three.In March, the Sixers shut him down for the season following injections to treat a left knee issue and a groin injury. At one point, George even stepped away from his “Podcast P with Paul George” show to focus on healing.If the Sixers had hoped for a fresh start this offseason, those hopes were quickly dashed. According to Shams Charania of ESPN, George recently suffered another setback during a summer workout and underwent arthroscopic surgery on his left knee.“I’m told Paul George suffered the injury during an on-court workout last week, and it led to him visiting a doctor on Friday, and the decision was made to undergo arthroscopic surgery,” Charania reported. “The doctors felt like this would be an injury that would linger… now he starts rehab for this knee injury and he will be re-evaluated at the start of this upcoming training camp.”That cautious approach is necessary. The Sixers have too much invested in the nine-time All-Star, and they need him to be in peak form if they want to bounce back from a disastrous 24-58 season that ended with both George and Joel Embiid sidelined.Also Read: Paul George's successful knee surgery adds new challenge to Philadelphia 76ers' 2025 training camp plans","Philadelphia 76ers forward Paul George says he won't join LaMelo Ball's team Charlotte Hornets. George says the Hornets don't offer the right environment for him, at least in his own image of the franchise. George's future is already clouded by health concerns and an underwhelming season in Philadelphia.","https://static.toiimg.com/thumb/msid-122546458,imgsize-21750,width-400,resizemode-4/122546458.jpg"
"MLB All Star Red Carpet 2025 lights up Atlanta with star appearances from Ronald Acuna Jr, Shohei Ohtani and more fan-favorite stars",https://timesofindia.indiatimes.com/sports/mlb/news/mlb-all-star-red-carpet-2025-lights-up-atlanta-with-star-appearances-from-ronald-acuna-jr-shohei-ohtani-and-more-fan-favorite-stars/articleshow/122539424.cms,"MLB All Star Red Carpet 2025 lights up Atlanta with star appearances from Ronald Acuna Jr, Shohei Ohtani and more fan-favorite stars (Image Via X)

Paul Skenes and Aaron Judge lead the spotlight at MLB All-Star Red Carpet 2025



Shohei Ohtani (Los Angeles Dodgers) walked with his wife, Mamiko Ohtani

Ronald Acuna Jr ., Matt Olson, and Chris Sale ( Atlanta Braves ) received standing ovations

Freddie Freeman (Los Angeles Dodgers), back in Atlanta, was greeted warmly by Braves fans

Francisco Lindor, Pete Alonso, Edwin Díaz (New York Mets)

Elly De La Cruz, Andrew Abbott (Cincinnati Reds)



Kyle Schwarber (Philadelphia Phillies)

Vladimir Guerrero Jr. (Toronto Blue Jays)

Fernando Tatis Jr. (San Diego Padres)



Max Fried, Jazz Chisholm Jr. (New York Yankees)

Tarik Skubal (Detroit Tigers)

Yoshinobu Yamamoto (Los Angeles Dodgers)

Blooper (Braves)



Phillie Phanatic (Phillies)



Mr. Redlegs (Reds)



Captain (Rangers)



Matt Olson’s baby and fan moments make All-Star Red Carpet 2025 special

Seattle Mariners showing off a video of pitcher Andres Munoz’s cat Matilda walking her own mini red carpet

Reds pitcher Andrew Abbott wearing a jacket lined with his childhood photos



Just hours before the 2025 MLB All-Star Game began at Truist Park in Atlanta, the stars of Major League Baseball walked the red carpet and it wasn’t just about baseball. With designer outfits, heartwarming family moments, and loud fan cheers, players like Paul Skenes, Aaron Judge , and Shohei Ohtani made the All-Star Red Carpet Show a spectacle to remember. One Braves baby even grabbed a mic and stole the spotlight.On Tuesday, July 15, 2025, fans gathered at The Battery Atlanta to witness their favorite MLB stars walk the 700-foot red carpet outside Truist Park.Paul Skenes, the starting pitcher for the National League, greeted fans with Livvy Dunne by his side. Aaron Judge, representing the New York Yankees, also drew massive cheers.Several other superstars followed, each bringing their own charm:Other top names spotted included:Players weren’t the only ones enjoying the spotlight, many brought their families, and even mascots joined in:Also Read: MLB All-Star Game 2025: Predictions Odds, Expert Picks And Full AL Vs NL Preview While players stunned in custom suits, the most unexpected moment came from Braves first baseman Matt Olson’s baby, who reached out and grabbed a live TV mic.The crowd laughed and clapped, making it a standout moment from the day.Other fun scenes included:With stars, surprises, and smiling fans, the 2025 MLB All-Star Red Carpet Show set the perfect tone before the big game.","The 2025 MLB All-Star Red Carpet Show set the perfect tone before the big game. With designer outfits, heartwarming family moments, and loud fan cheers, players like Paul Skenes, Aaron Judge, and Shohei Ohtani made the day a spectacle to remember. One Braves baby even grabbed a mic and stole the spotlight.","https://static.toiimg.com/thumb/msid-122539696,imgsize-55962,width-400,resizemode-4/122539696.jpg"
