Article Title,Article Link,Article Text,Article Summary,Article Image
Top 5 Christmas markets across the UAE you can visit this season,https://timesofindia.indiatimes.com/world/middle-east/top-5-christmas-markets-across-the-uae-you-can-visit-this-season/articleshow/126115037.cms,"UAE lights up with festive Christmas markets / AI Generated Image

Madinat Jumeirah festive market

Dates: Running until December 31, 2025.

Timings: Monday to Thursday from 3:00 PM; Friday to Sunday from 12:00 PM until late.

Entry: Free (Activities like the carousel and train are extra).

Special Highlight: You can take a festive abra ride with Santa or let the kids hop on the North Pole mini-train. Pro-tip: Parking is legendary for being difficult here, save yourself the headache and take a taxi to the Jumeirah Mina A’Salam entrance.

Winter city at Expo City Dubai

Dates: Until December 31, 2025.

Timings: Daily from 4:00 PM to 10:00 PM.

Entry: AED 50 for adults; children under 3 and People of Determination are free.

Special Highlight: Snowfall happens every Saturday! Watching snow drift inside the massive Al Wasl dome is a core 2025 memory waiting to happen. There’s also Santa’s House, where kids can see how he ""recycles"" old toys to make new magic.

Winter garden at Habtoor Palace

Dates: Running through January 31, 2026.

Timings: Weekdays 4:00 PM to 12:00 AM; Weekends until 1:00 AM.

Entry: Access is via the Loyal App with a minimum spend of AED 25 (fully redeemable on food and drinks).

Special Highlight: The food truck selection is top-tier, offering everything from gourmet sliders to festive churros. It’s the best spot for a relaxed evening with friends under the ""snow-dusted"" trees of the palace garden.

Global Village 2025

Dates: Festive celebrations run until December 28, 2025.

Timings: Sunday to Wednesday 4:00 PM to 12:00 AM; Thursday to Saturday until 1:00 AM.

Entry: AED 25 to AED 30.

Special Highlight: Don't miss the 21-meter-tall Christmas tree and the nightly festive drone shows that paint holiday symbols across the desert sky. If you're looking for winter gear, the Thailand and Afghan pavilions are currently the best spots for trendy winter jackets.

The Galleria Al Maryah Island

Dates: Until December 26, 2025.

Timings: Daily 10:00 AM to 10:00 PM.

Entry: Free (Santa visits require pre-registration).

Special Highlight: Meet Elva, the UAE’s first AI elf influencer, who helps guide kids through Santa’s Winter Fair. There are also snowball toss games and a letter-writing station for those last-minute requests to the North Pole.





The desert heat has officially taken a backseat to the twinkling lights and ""snowy"" lanes of the UAE’s festive season. If you are looking to soak up the holiday spirit, 2025 has brought some of the most elaborate Christmas markets the region has ever seen. From giant trees to AI-powered elves, the magic is spread across Dubai and Abu Dhabi.Whether you are a resident or just visiting for the holidays, these five spots are the absolute ""must-sees"" for a cup of mulled grape and a photo with the big man in red.If you only visit one market this year, let it be this one. Nestled among the waterways of Souk Madinat Jumeirah, this 1,750-square-meter wonderland is the gold standard for festive vibes. The centerpiece is a massive 36-foot Christmas tree, and the view of the Burj Al Arab behind it is simply unbeatable.Expo City has transformed Al Wasl Plaza into a futuristic North Pole toy factory. This year’s theme, ""The Candy Cane Comet,"" features a guiding light that only shines with the help of visiting children. It is immersive, grand, and arguably the most high-tech Christmas experience in the country.Located on Sheikh Zayed Road, the Winter Garden at Habtoor Palace is where the ""cool"" crowd gathers. It’s less about the rides and more about the atmosphere, think cozy food trucks, live musicians, and a pet-friendly policy that means your furry friends don't have to miss out on the fun.For those who want their Christmas with a side of international culture, Global Village is celebrating its landmark 30th season in style. Their festive village is packed with 3,500 shopping outlets across 30 pavilions, making it the ultimate destination for unique holiday gifts.Abu Dhabi’s capital isn't trailing behind. The Galleria has turned its North Atrium into a Winter Wonderland that blends tradition with technology. It’s perfect for families who want a polished, indoor festive experience without the sand.Whether you are hunting for the perfect handmade gift, craving a cup of spice-infused hot chocolate, or simply want to feel a bit of “snow” on your face in the middle of the desert, the UAE’s 2025 festive season has something for everyone. From the high-tech lights of Expo City to the traditional charm of Madinat Jumeirah, these markets are about more than just shopping, they are about making memories in a city that truly knows how to celebrate.Live music, street performances and festive food stalls add to the atmosphere, turning each visit into a full evening experience rather than a quick stop. Many venues also offer family-friendly activities, making them ideal for visitors of all ages.Top Tip for 2025: Most of these venues get extremely busy on weekend evenings. If you can, try visiting on a weekday right when they open (around 4:00 PM) to catch the sunset views and beat the largest crowds. Don't forget to keep your camera charged, you’re going to need it.","The UAE has some of the most elaborate Christmas markets the region has ever seen. From giant trees to AI-powered elves, the magic is spread across Dubai and Abu Dhabi. If you are a resident or just visiting for the holidays, these five spots are the absolute ""must-sees""","https://static.toiimg.com/thumb/msid-126115117,imgsize-90590,width-400,resizemode-4/uae-christmas.jpg"
"Despite crackdown on activism, US techies go on picking fights",https://timesofindia.indiatimes.com/world/us/despite-crackdown-on-activism-us-techies-go-on-picking-fights/articleshow/126211254.cms,"Representative image (Picture credit: NYT)





Five weeks into a strike at the crowdfunding site Kickstarter this fall, employees were getting anxious. Their union's strike fund was dwindling, making it harder for some to cover living expenses, and they were unsure if the firm would make more concessions. But the next week, Kickstarter made offers the union would accept, creating a new minimum-salary formula and helping to preserve a four-day workweek.Over the past few years, US tech firms have laid off thousands of employees in a retreat from a pandemic-era hiring spree and an effort to free up cash to invest in artificial intelligence. Even tech companies once thought of as relatively progressive, like Google and Microsoft, have fired employees who have protested over political causes. The firms said the protests were disruptive and potentially unsafe.But tech worker activism has continued amid the crackdown, albeit cautiously. ""It's driving the organising underground, but people are organising,"" said Emily Mazo, a doctoral student at Columbia University who studies tech work and worker activism.Google offered thousands of voluntary exit packages this year after the Alphabet Workers Union, named for Google's parent company, launched a campaign calling for improvements in job security, like a shift away from involuntary layoffs.A Google spokesperson said that the campaign had not influenced the company. After Amazon laid off 14,000 workers this fall, hundreds of employees signed an open letter to management seeking a bigger say in how to carry out layoffs that may result from AI.Over the past two years, a wave of unionising in the video game industry that began with low-paid testers spread to designers and engineers, who joined unions at the Microsoft-owned studios that make games such as Fallout, Doom and World of Warcraft.This persistent activism has to do with a longer-term shift in how engineers and other tech workers see themselves. For decades, they identified as high-skilled professionals who stood apart from the usual management-labour divide. They were well compensated, could change jobs easily and had the freedom to allocate their time as they saw fit. Because of generous stock grants, many thought of themselves as co-owners.The Kickstarter employees didn't start off wanting a union, but ended up there when the management tried to pull a satirical comic book called ""Always Punch Nazis,"" which the rightwing wanted to be taken down. Kickstarter always attracted idealistic workers who liked its mission of helping creative people get projects off the ground. The employees got their way, but it was one of a handful of incidents that prompted them to organise a union.Prominent tech executives and investors reacted differently to instances of activism. A few, including Microsoft's president, Brad Smith, decided their companies had more to gain than to lose by staying neutral when employees tried to unionise. Others regarded it as evidence of left-wing radicalism. ""The kids turned on capitalism in a very fundamental way,"" tech investor Marc Andreessen had told NYT.Beginning in late 2022, tech and video game companies reinforced a 'worker identity' as they began to lay off thousands of employees. Among the exceptions are artificial intelligence researchers, who have been the beneficiaries of billions of dollars of investment and spending by tech companies. JS Tan, a former Microsoft engineer who is now a doctoral student at the Massachusetts Institute of Technology and wrote the paper with Mazo, said that those researchers had effectively displaced app and web developers as some of the most sought-after tech workers, and that many software developers increasingly feared downward mobility.Meghan Day, a Google engineer who was recently elected treasurer of the Alphabet Workers Union, said workers were demoralised by layoffs at the company in 2023 and 2024. Google declined to comment.Two Amazon engineers who requested anonymity said they felt Amazon was laying off workers so it could free up money for AI infrastructure, the value of which they questioned. They also said Amazon pushed the remaining employees to pick up the tasks of ousted co-workers.","US tech firms have laid off thousands of employees in a retreat from a pandemic- era hiring spree. Even tech companies once thought of as relatively progressive, like Google and Microsoft, have fired employees who have protested over political causes. ""It's driving the organising underground, but people are organising,"" said Emily Mazo, a doctoral student at Columbia University.","https://static.toiimg.com/thumb/msid-126211262,imgsize-1016303,width-400,resizemode-4/untitled-design-25.jpg"
"In San Francisco, a class where 'screenagers' train to navigate social media, AI",https://timesofindia.indiatimes.com/world/us/in-san-francisco-a-class-where-screenagers-train-to-navigate-social-media-ai/articleshow/126198653.cms,"Valerie Ziegler takes digital literacy lesson at a school in San Francisco





Most teenagers know that baseless conspiracy theories, partisan propaganda and artificially generated deepfakes lurk on social media. Valerie Ziegler's students know how to spot them.At Abraham Lincoln High School in San Francisco, she trains her govt, economy and history students to consult a variety of sources, recognise rage-baiting content and consider influencers' motivations. They brainstorm ways to distinguish deepfakes from real footage.Ziegler, 50, is part of a vanguard of California educators racing to prepare students in a rapidly changing online world.Content moderation policies have withered at many social media platforms, making it easier to lie and harder to trust. AI is evolving so quickly, and generating such persuasive content, that even professionals are being stumped.California is ahead of many other states in pushing schools to teach digital literacy, but even there, education officials are not expected to set specific standards until later in 2026. So Ziegler and a growing group of her peers are forging ahead, cobbling together lesson plans from nonprofit groups and updating older coursework to address new technologies, such as AI that powers video apps like Sora.Their methods are hands-on, including classroom exercises that fact-check posts about history on TikTok and explore how badges that appear to signal verification on social media can often be bought rather than earned.Ziegler's efforts showcase the difficulties of keeping pace with new platforms, apps and advances in AI. ""We're sending these kids out into the world, and we're supposed to have provided them skills,"" said the former California teacher of the year. ""The tricky part is that we adults are learning this skill at the same time the kids are.""Social media literacy is a tough subject for schools to try to teach, especially now. Federal funding for education is precarious, and the Trump administration has politicised and penalised the study of disinformation and misinformation.The News Literacy Project, a media education nonprofit, surveyed 1,110 teenagers in May last year and found that 4 in 10 said they had any media literacy instruction in class that year. Eight in 10 said they had come across a conspiracy theory on social media, and many said they were inclined to believe at least one of the narratives.Ziegler teaches the self-described ""screenagers"" that their social media feeds are populated using highly responsive algorithms, and that large followings do not make accounts trustworthy. In one case, students learned to distinguish between a reputable historians group on Instagram and a historical satire account with a similar name. Now, they default to double-checking information that interests them online. ""That's the starting point,"" said Xavier Malizia, 17. Elisha Tuerk-Levy, 18, said it was ""jarring"" to watch a realistic AI video of someone falling off Mt Everest, but added that the visuals in such videos were often too smooth - a useful ""tell"" that helps identify them as fake.Policymakers are paying more attention to the issue. Dr Vivek Murthy, the surgeon general under former President Joe Biden, urged schools in 2023 to set up digital literacy instruction. At least 25 states have approved related legislation, according to an upcoming report from Media Literacy Now, a nonprofit group. Many of the new rules, however, are voluntary, toothless or slow to take effect or do not acknowledge the growing presence of AI.""I absolutely wish we could make things happen faster,"" said California Assembly member Marc Berman, a Democrat who wrote two media literacy bills passed in 2023 and 2024.""It's about really strengthening those foundational skills so that no matter what tech pops up between now and then, young people have the ability to handle it,"" Berman said.","Valerie Ziegler is part of a vanguard of California educators racing to prepare students in a rapidly changing online world. Content moderation policies have withered at many social media platforms, making it easier to lie and harder to trust. California is ahead of many other states in pushing schools to teach digital literacy.","https://static.toiimg.com/thumb/msid-126198671,imgsize-831514,width-400,resizemode-4/untitled-design-20.jpg"
Income Tax Return Filing: How new AIS correction status update feature will help taxpayers - explained,https://timesofindia.indiatimes.com/business/financial-literacy/taxation/income-tax-return-filing-how-new-ais-correction-status-update-feature-will-help-taxpayers-explained/articleshow/110152813.cms,"What does the new feature do in AIS?



ALSO READ |

Here's how the new AIS feature works



How does the new AIS feature benefit you?



ALSO READ |

What happened in the previous AIS feedback system?

",summarize: What does the new feature do in AIS? The new AIS feedback system is designed to help people make better decisions. The feedback system was designed to replace the previous feedback system. The new feedback system will be rolled out over the next few months.,"https://static.toiimg.com/thumb/msid-110152827,imgsize-27984,width-400,resizemode-4/110152827.jpg"
Ask Dhirendra: 'How do I decide how much to save and invest when my income is just about enough?',https://timesofindia.indiatimes.com/business/mutual-funds/ask-dhirendra-how-do-i-decide-how-much-to-save-and-invest-when-my-income-is-just-about-enough/articleshow/126072787.cms,"The problem is not which fund to choose. It’s how much they can realistically save. (AI image)

“How do I decide how much to save and invest when my income is just about enough?”

What can you save today without breaking your life? How can you make that number grow every year?

Where does a typical salary go?

Some expenses are non-negotiable (rent, basic food, fees).

Some are negotiable but important (a modest phone, occasional eating out).

Some are pure leakage (unused subscriptions, impulsive orders, “I don’t even remember what this was”).

From spare change to serious money

Step up your SIP before you step up your lifestyle

First, add up your genuine essentials: rent/EMI, groceries, utilities, fees, basic transport.

Next, be realistic and add a modest amount for discretionary spending that you know you’ll do anyway – because you are human, not a robot.

See what is left. From that leftover, commit to a percentage – even 10% of your take-home income – as a non-negotiable saving and investing amount. Set up automatic transfers and SIPs for that right after your salary date.

If you have any queries for Dhirendra Kumar you can drop us an email at: toi.business@timesinternet.in

(Dhirendra Kumar is Founder and CEO of Value Research)

This is one of those questions that sounds technical, but is actually very emotional.On paper, it’s simple: income comes in, expenses go out, and whatever is left is “savings. In real life, income comes in, rent, EMIs, school fees, petrol, Swiggy, Zomato, sale on Myntra, birthday gifts, one sudden expense… and at the end of the month, you look at your balance and say, “I’ll start investing from next month. Pakka.”Next month looks surprisingly similar.So let’s start with an honest admission: for most people, the problem is not which fund to choose. It’s how much they can realistically save when it feels like the money is just about enough.At Value Research, whenever we look at this, we don’t begin with a number like “you must save 30%”. We start with a different idea: savings are not what is left after spending. Savings are what you decide first; spending adjusts after that if you flip this order, the maths – and your behaviour – changes completely.A good rule of thumb for many middle-class households is to allocate 20–30% of their take-home income to savings and investments. However, I also know that for many people today, 30% sounds like a bad joke. So instead of fighting over the “ideal” number, let’s work with two simpler questions:To answer the first question, you need to know where your money is actually going, not where you think it is going.For one or two months, track your expenses honestly – not for Instagram, for yourself. You don’t need an app; even a simple notebook or spreadsheet works.Once you see your own pie chart, three things usually stand out:Your first “investment” might simply be plugging two or three leaks. Even if that frees up only ₹2,000–₹3,000 a month, that is your starting SIP.Now let’s look at how “small” that really is.When we run these numbers at Value Research in our retirement and goal calculators, the results are always the same: the gap between zero and small is far bigger than the gap between small and perfect.But what if your income truly is at the survival stage? There are people for whom even ₹2,000 is a luxury some months. If that’s your reality, you have two parallel jobs. One is to create a tiny habit – even ₹500 or ₹1,000 a month into a recurring deposit or a conservative fund. The absolute amount is less important than the mental switch from “I’ll save if anything is left” to “I will save something, and then I will live on the rest. ”The second job is to make sure that as your income grows, your lifestyle doesn’t expand at the same speed. This is where a lot of middle-class Indians quietly sabotage themselves. Every salary increase automatically becomes a better phone, nicer meals out, upgraded gadgets, and bigger car loans. The percentage saved stays the same, or sometimes even falls.A very powerful habit – one we often build into plans at Value Research – is the “step-up”. Each year, when your salary goes up, you increase your SIPs and savings before you upgrade anything else.In many examples we’ve run, the step-up strategy leads to a dramatically higher corpus at the end, without you ever feeling an acute “sacrifice” in any single year. You just avoid letting every pay hike leak out into lifestyle.Now, how do you decide your own number?Here’s a simple approach:If that number feels tight, start a little lower and promise yourself one thing: every time your income goes up, your savings rate will go up faster than your spending.At Value Research, when we build long-term plans, we don’t assume people will suddenly start saving 40% from next month. We assume they will start somewhere realistic, and then we design step-ups. The rigour is in the process, not in some magical starting number.One last point. Many people postpone investing because they are embarrassed by how small their starting amount looks. Please don’t underestimate the psychological power of seeing a small, growing pile that you started and maintained. It changes how you think about yourself: from “I can’t save” to “I am someone who always saves something.” That identity is worth more than one extra dinner out.So how much should you save and invest when your income feels just about enough? The honest answer is: start with whatever you can without lying to yourself, protect that amount like you protect your rent, and then make sure it rises every time your income increases. The “right” number is not what a formula says; it’s the number you will actually stick to for the next 20 years.The perfect percentage can wait. The first rupee cannot.","Dhirendra Kumar: For most people, the problem is not which fund to choose. It’s how much they can realistically save when it feels like the money is just about enough. A good rule of thumb for many middle-class households is to allocate 20–30% of their take-home income.","https://static.toiimg.com/thumb/msid-126072870,imgsize-47970,width-400,resizemode-4/saving-and-investing.jpg"
Nominee vs legal heir: What is the difference and who has claim on assets? All you need to know,https://timesofindia.indiatimes.com/business/financial-literacy/faq/nominee-vs-legal-heir-what-is-the-difference-and-who-has-claim-on-assets-all-you-need-to-know/articleshow/125130453.cms,"AI image

Who is a Nominee?



Who is a Legal Heir?

Difference between a Nominee and a Legal heir

Aspect Nominee Legal Heir Role Custodian Owner Transfer of Assets Can be done without any legal formalities. Requires testamentary documents for proof of ownership. Powers No power to transact, use, or transfer assets. Power to use and transact assets as an owner. Appointment Owner can appoint anyone, but some institutions specify certain conditions. Determined by succession/personal laws. Legal Right Cannot contest ownership legally. Can contest ownership in a court of law.

When individuals open bank accounts, invest in mutual funds, or buy insurance, they are often asked to name a nominee.However, many people mistakenly assume that the nominee automatically inherits the assets. In reality, the nominee is not always the final recipient — the ownership rights belong to the legal heir, reported ET.Understanding the distinction between these two is essential to ensure that your wealth is passed on to the intended beneficiaries.A nominee acts as a temporary custodian of the deceased person’s assets.The nominee’s role is limited to holding and managing the assets until they are legally transferred to the rightful heirs.According to ET, the nominee cannot sell, trade, or make any transactional decisions about the assets.The account or policy owner can appoint anyone — family, friends, or acquaintances — as a nominee, though financial institutions often prefer close family members.In some cases, the nominee and the legal heir can be the same person, which helps in ensuring a smoother transfer of assets.The legal heir or beneficiary is the rightful owner of the assets once the original holder passes away.To claim ownership, the legal heir must produce valid documents such as a will or other testamentary proof.If there is no will — a situation known as dying intestate — the heir is determined as per the country’s succession or personal laws, reported ET.While a nominee can initially access the assets, only the legal heir can claim them permanently or challenge ownership in court.Experts quoted by ET emphasise that having clarity on this difference helps avoid disputes and ensures that the savings reach the intended family members or beneficiaries.Therefore, it is advisable to regularly update both nominees and wills to align with one’s estate planning goals.","A nominee acts as a temporary custodian of the deceased person’s assets. The legal heir or beneficiary is the rightful owner of the assets once the original holder passes away. To claim ownership, the legal heir must produce valid documents such as a will.","https://static.toiimg.com/thumb/msid-125131123,imgsize-132093,width-400,resizemode-4/enigmatic-legal-inquiry.jpg"
