Article Title,Article Link,Article Text,Article Summary,Article Image
"Post-Operation Sindoor, DRDO transfers key camouflage, deception techs to Army for battle superiority",https://timesofindia.indiatimes.com/india/post-operation-sindoor-drdo-transfers-key-camouflage-deception-techs-to-army-for-battle-superiority/articleshow/126219991.cms,"Defence Laboratory, Jodhpur(DLJ), DRDO handed over Camouflage Pattern Generation Software Sigma 4.0 (CPGSS4.0) and a full-scale Multispectral Signature Tank Mock-up to CME, Pune (Picture credit: DRDO)



Pakistan FM Ishaq Dar Admits India Hit Nur Khan Air Base In Operation Sindoor Strikes

NEW DELHI: According to Sun Tzu's ‘The Art of War’, “all warfare is based on deception.”In the wake of the Pakistan conflict in May when the enemy forces attempted to target Indian military assets like air defence systems, including Russia-imported S400 Triumf missile system, with their missiles and drones, India’s elite R&D wing Defence Research and Development Organisation (DRDO) has transferred two key indigenous technologies to the Army that will help its soldiers and their military equipment evade enemy detection.Defence Laboratory, Jodhpur (DLJ), DRDO, handed over Camouflage Pattern Generation Software Sigma 4.0 (CPGSS4.0) and a full-scale Multispectral Signature Tank Mock-up to the Indian Army’s Corps of Military Engineering (CME) in Pune in the first week of December.“CPGSS4.0 was launched today (Dec 3) by Lt Gen A K Ramesh, SM, Comdt CME in the presence of V S Shenoi, Director, DLJ and will be available for use by tri-services,” DRDO recently posted on X.“A full scale multispectral signature tank mock-up will be use (sic) for training the service personnel in camouflaging and deception technology,” it stated.CPGS 4.0 is an advanced software developed to create highly effective, multi-spectral camouflage patterns for military equipment, helping soldiers blend into diverse terrains by countering detection across visible light, infrared (IR), and radar sensors, thereby significantly boosting battlefield deception and survival training for the Indian Army.Whereas a multispectral signature tank mock-up is a full-scale, realistic decoy of a battle tank, designed not just to look like a tank in visible light, but to mimic its physical and electromagnetic properties (heat, radar reflection) across various sensor spectrums, allowing soldiers to test and train with advanced camouflage materials to hide tanks from modern threats like thermal, infrared and radar detection.Developing multispectral deception capabilities is the need of the hour as traditional camouflage measures have become less effective in modern warfare.These advanced systems are designed to enhance the Army’s capabilities in camouflage and deception, which are key for survival on modern battlefields where surveillance and sensor technologies are fast advancing.The integration of sophisticated software with a realistic mock-up helps tackle challenges posed by modern detection systems, including thermal imaging, UAV reconnaissance and radar technologies.With the introduction of these technologies, the Army now has the capacity to indulge in concealment methods more effectively, thereby enhancing operational survivability.",India's elite R&D wing Defence Research and Development Organisation (DRDO) has transferred two key indigenous technologies to the Army. Camouflage Pattern Generation Software Sigma 4.0 (CPGSS4.0) and a full-scale Multispectral Signature Tank Mock-up.,"https://static.toiimg.com/thumb/msid-126219997,imgsize-978940,width-400,resizemode-4/untitled-design-50.jpg"
NYT Connections today’s hints and answers (#929) for 26 December 2025,https://timesofindia.indiatimes.com/technology/gaming/nyt-connections-todays-hints-and-answers-929-for-26-december-2025/articleshow/126188731.cms,"What is NYT Connections





NYT Connections: Hints for today’s puzzle



Yellow group hint: Think the West Coast

Green group hint: Think types of funny movies

Blue group hint: Think classic rockers

Purple group hint: Think two-word phrases that begin with a certain dark color

NYT Connections categories for December 26, 2025



Yellow group category: California-based character tropes

Green group category: Comedy subgenres

Blue group category: ’70s rock bands

Purple group category: Black _____

NYT Connections answers for December 26, 2025

Yellow words: California-based character tropes: Movie exec, surfer, tech bro, Valley girl

Green words: Comedy subgenres: Buddy, cringe, screwball, stoner

Blue words:’70s rock bands: America, Chicago, Foreigner, Journey

Purple words: Black _____: Forest, Friday, Panther, widow

NYT Connections: Common FAQs



How to play NYT Connections?

Are hints available?

Can I play the NYT Connections game for free?

What skills does the game enhance?





The New York Times’ Connections has quickly risen to a favourites list for word game enthusiasts, fusing the addictive elegance of word games such as Wordle with more complex puzzles in the realms of logic and pattern recognition. Daily, players are offered a collection of 16 apparently random words, placed in a 4x4 matrix, which must be grouped into four different thematically consistent sets, requiring a solution that relies on the discovery of often subtle connections, ties, and wordplay. Puzzle enthusiasts seeking a challenging and informative solution will find the December 26, 2025 issue, game number 929, to offer a perfect balance of knowledge and intellect. Connections remains a continuing source of fascination for an international following, a daily challenge for intellectual acuity and mental dexterity.NYT Connections is a very engaging word association game aimed at evaluating the ability to use analytical thinking and logic when problem-solving. In contrast to a normal word game, playing this game requires the ability to distinguish very subtle connections between the words associated with the game, ranging from very straightforward connections to very abstract ones.The game can be played for free through desktop or mobile operating systems on any device at the convenience of the players. Due to the easy-to-grasp game mechanics and the very challenging puzzles required in the game, many people actually make the game a daily routine for themselves.To help players without revealing the solution, here are some strategies for December 26, 2025:These hints guide players toward recognising patterns, encouraging logical deduction and strategic grouping without removing the challenge entirely.Here are the connection categories available today in the NYT Connections puzzle:Below are the four correct groups for today’s puzzle:The word choices are arranged in a 4x4 matrix. Find connections between the words to categorize them into four appropriate groups.Yes, the game offers subtle clues so as not to pamper the players.It is also free to download for mobile and computer usage.It improves pattern recognition, logical thinking, lateral thinking, and problem-solving abilities.","NYT Connections is a word association game aimed at evaluating the ability to use analytical thinking and logic when problem-solving. Daily, players are offered a collection of 16 apparently random words, placed in a 4x4 matrix, which must be grouped into four different thematically consistent sets. To help players without revealing the solution, here are some strategies.","https://static.toiimg.com/thumb/msid-126188724,imgsize-10546,width-400,resizemode-4/nyt-connections.jpg"
Zoho founder Sridhar Vembu responds to user asking about Arattai app: ‘We will market it …’,https://timesofindia.indiatimes.com/technology/tech-news/zoho-founder-sridhar-vembu-responds-to-user-asking-about-arattai-app-we-will-market-it-/articleshow/126114022.cms,"Arattai app: Features and challenges

One-to-one and group chats with text, voice notes, and media sharing

Audio and video calls with end-to-end encryption

Multi-device support, including desktop and Android TV apps

Stories and channels for broadcasting updates



Arattai app gets end-to-end encryption







Zoho founder Sridhar Vembu was recently asked by an X (formerly Twitter) user why there is no talk about Arattai now? The user quoted a post stating that Telegram is worth $30 billion with only 30 employees working from home, no office. Responding to the user’s question, Vembu shared that the company is doing “updates weekly” and is working on “some very important features”. “We will market it more once we feel we are satisfied with the feature set!,” Vembu posted, adding “This is a marathon. We are geared for it.”To recall, the Arattai app debuted in 2021 as a rival to Meta’s WhatsApp. Years after its launch, the app recently gained momentum after senior government ministers like Piyush Goyal joined the platform. In September this year, Arattai (meaning chat in Tamil) topped App Store ranking, registering 3,50,000 signs in just three days.Arattai offers familiar features such as:However, the app is still ironing out issues. Users have reported OTP delays, slower contact sync, and call glitches due to server overload.Last month, the company rolled out system-wide end-to-end encryption on the Arattai app. Announcing the release in an X post, Vembu then said that it is a “forced upgrade on all because it is a drastic change”.“We had to do some redesign around it and we wanted extensive testing because it is a drastic change. It is now being tested by about 6,000 people in the company. We identified some issues and have fixed them. We are doing one more round of testing on a new build that has fixed the issues identified,” he then said.","Zoho founder Sridhar Vembu was recently asked by an X (formerly Twitter) user why there is no talk about Arattai now. The user quoted a post stating that Telegram is worth $30 billion with only 30 employees working from home, no office. “We will market it more once we feel we are satisfied with the feature set!,” Vem Bu posted, adding “This is a marathon. We are geared for it”","https://static.toiimg.com/thumb/msid-126114020,imgsize-19686,width-400,resizemode-4/zoho-founder-sridhar-vembu-responds-to-user-asking-about-arattai-app.jpg"
"iPhone 16 Pro Max, AirPods Pro 2, iPad 10 and 22 other products Apple discontinued this year",https://timesofindia.indiatimes.com/technology/tech-news/iphone-16-pro-max-airpods-pro-2-ipad-10-and-22-other-products-apple-discontinued-this-year/articleshow/126185555.cms,"iOS26 now available: Things to know

Apple iPhones discontinued in 2025

iPhone 16 Pro Max (succeeded by iPhone 17 Pro Max)

iPhone 16 Pro (succeeded by iPhone 17 Pro)

iPhone 15 Plus

iPhone 15

iPhone 14 Plus

iPhone 14

iPhone SE (succeeded by iPhone 16e)

Apple iPads discontinued in 2025

iPad Pro with M4 chip (updated with M5 chip)

iPad Air with M2 chip (updated with M3 chip)

iPad 10 (updated with A16 chip)

Apple Watches discontinued in 2025

Apple Watch Ultra 2 (succeeded by Apple Watch Ultra 3)

Apple Watch Series 10 (succeeded by Apple Watch Series 11)

Apple Watch SE 2 (succeeded by Apple Watch SE 3)

Macs discounted in 2025

Mac Studio with M2 Max and M2 Ultra chips (updated with M4 Max and M3 Ultra chips)

14-inch MacBook Pro with M4 chip (updated with M5 chip)

13-inch and 15-inch MacBook Air with M3 chip (updated with M4 chip)

13-inch MacBook Air with M2 chip

AirPods and other Apple accessories discontinued in 2025



AirPods Pro 2 (succeeded by AirPods Pro 3)

Apple Vision Pro with M2 chip (updated with M5 chip)

MagSafe Charger with Qi 2 (succeeded by MagSafe Charger with Qi 2.2 support)

30W USB-C Power Adapter (succeeded by 40W Dynamic Power Adapter with 60W Max)

Lightning to 3.5mm Audio Cable (succeeded by USB-C to 3.5mm Audio Cable)

MagSafe to MagSafe 2 Converter





Apple discontinued more than 20 products in 2025, per a MacRumours report. Most of these products were replaced by newer and faster models, others were simply discontinued because they had been outdated for a long time. For example, 2024's flagship iPhone 16 Pro Max has been discontinued to be replaced with this year’s iPhone 17 Pro Max. Similarly, Apple AirPods Pro 2 have been replaced by Apple AirPods Pro 3. This year, Apple also phased out the Plus lineup, discontinuing both iPhone 14 Plus and iPhone 15 Plus. The affordable iPhone SE (3rd generation) has also been discontinued, only to be replaced by iPhone 16e. With this, Apple no longer sells any iPhone models with a Home button, Touch ID, LCD screen, a sub-6-inch screen size, or Lightning.The Cupertino-based company also replaced its MagSafe Charger with Qi 2 with the all-new MagSafe Charger with Qi 2.2 support. The 30W USB-C Power Adapter, on the other hand, has been succeeded by 40W Dynamic Power Adapter with 60W Max. Additionally, Apple has updated its 14-inch MacBook Pro with M4 chip to M5 chip. Similarly, the 13-inch and 15-inch MacBook Air models with M3 chip have been upgraded to M4 chip models.Here, we have compiled a list of Apple products in different categories that the company discontinued in 2025.","Apple discontinued more than 20 products in 2025, per a MacRumours report. Most of these products were replaced by newer and faster models, others were simply discontinued because they had been outdated for a long time. For example, 2024's flagship iPhone 16 Pro Max has been discontinued to be replaced with this year’s iPhone 17 Pro Max. This year, Apple also phased out the Plus lineup, discontinuing both iPhone 14 Plus and iPhone 15 Plus. With this, Apple no longer sells any iPhone models with a Home button, Touch ID, LCD screen or a sub-6-inch screen size.","https://static.toiimg.com/thumb/msid-126185649,imgsize-32096,width-400,resizemode-4/products-apple-discontinued-in-2025.jpg"
"Xiaomi 17 Ultra launches on December 25 in China: Design, specs, camera and more",https://timesofindia.indiatimes.com/technology/mobiles-tabs/xiaomi-17-ultra-launches-on-december-25-in-china-design-specs-camera-and-more/articleshow/126157206.cms,"Xiaomi 17 Ultra launches on December 25 in China: Design, specs, camera and more",Xiaomi 17 Ultra launches on December 25 in China. It will be the company's first smartphone with a high-end camera. The 17 Ultra will go on sale for $99.99 in China and $199.99 elsewhere in the world.,"https://static.toiimg.com/thumb/msid-126157243,imgsize-462816,width-400,resizemode-4/xiaomi-17-ultra-launches-on-december-25-in-china-design-specs-camera-and-more.jpg"
"Meta CEO Mark Zuckerberg's 'highest-paid' employee is reportedly unhappy with his Boss, feels he ...",https://timesofindia.indiatimes.com/technology/tech-news/meta-ceo-mark-zuckerbergs-highest-paid-employee-is-reportedly-unhappy-with-his-boss-feels-he-/articleshow/126064468.cms,"Mark Zuckerberg (File Image)

Alexandr Wang is reportedly clashing with Meta’s old guard

Meta’s Secret AI Army: Top Talent Hired from OpenAI, Google & More

Alexandr Wang memo on Meta's massive AI restructure





In June this year, Facebook-parent Meta Platforms agreed to take a 49% stake in artificial intelligence (AI) startup Scale AI for $14.8 billion. As part of the deal, Scale AI CEO Alexandr Wang took top position inside Meta, leading the company's new “superintelligence” lab, , Meta Superintelligence Labs, or MSL. The 28-year-old founder of Scale AI, Wang has been installed as the public face of Zuckerberg’s AI reboot. Mark Zuckerberg reportedly paid billions to bring billionaire AI prodigy Alexandr Wang on board. However, it reportedly seems that all is not well between the AI wunderkind and his Boss, Mark Zuckerberg. The 41-year-old Zuckerberg is said to have backed his new hires with nine-figure compensation packages to lure top researchers from rivals, igniting a Silicon Valley poaching war.According to a report in Financial Times, Wang privately believes that CEO Mark Zuckerberg’s micromanagement of the company’s AI push is ""suffocating"". Wang is said to have complained to associates that Zuckerberg’s tight grip on the effort is stifling progress, the report said, citing multiple people familiar with the situation. Report adds that cracks have begun to emerge at an executive level and that tensions have been bubbling between Wang and Zuckerberg for sometime now.As per the report, internally, some staff question whether Wang is out of his depth, given his lack of experience managing teams in a large corporation but also his expertise in AI data services rather than as an AI researcher pushing technical breakthroughs.Incidentally, Alexander Wang’s arrival at Meta has created friction over the company's fundamental approach to AI development, with his superintelligence team pushing to make the company’s next model “closed” — keeping its technology secret. This is said to mark a major departure from Meta’s longtime philosophy of open-sourcing its models for other developers to build upon, causing some old guard members to chafe at the change, the Times reported.The new leadership has chosen to abandon Meta’s previous frontier model called Behemoth, which saw its release delayed last spring after disappointing performance tests. Meta’s AI division faces a dramatic four-way split as Meta reorganizes into groups focused on research, superintelligence development, products, and infrastructure, according to the report.As the new vision and leadership have crystallised, some top names have left. Among them, in recent weeks, Meta’s longtime chief legal officer Jennifer Newstead was poached by arch-rival Apple, while chief revenue officer John Hegeman announced he too was leaving to launch a start-up.Similarly, chief AI scientist and Turing Award winner Yann LeCun is departing Meta to launch a new AI initiative. He had reportedly taken exception at having to report to Wang. Another reason cited for his resignation is that his longer-term research was reportedly hit hard by the recent cuts announced at Meta.Meta reorganized its AI teams in June this year. The memo said that most team leaders will report directly to 28-year-old Wang. This included investor and former GitHub CEO Nat Friedman, who heads MSL's product team and was announced as an MSL leader alongside Wang in June. In the email sent to employees, Wang wrote that ""superintelligence is coming,"" and to ""take it seriously,"" Meta needs to make major changes. This includes establishing four distinct teams that focus on research, training, products, and infrastructure.The reorganisation is the latest in a series of AI reorgs for Meta. Incidentally, Meta had already dissolved two major AI teams in the past six months.","Mark Zuckerberg reportedly paid billions to bring billionaire AI prodigy Alexandr Wang on board. Wang is said to have complained to associates that Zuckerberg’s tight grip on the effort is stifling progress, the report said, citing multiple people familiar with the situation.","https://static.toiimg.com/thumb/msid-126064464,imgsize-16686,width-400,resizemode-4/mark-zuckerberg.jpg"
Apple foldable iPhone design leaked online; resembles Google Pixel Fold,https://timesofindia.indiatimes.com/technology/mobiles-tabs/apple-foldable-iphone-design-leaked-online-resembles-google-pixel-fold/articleshow/126183805.cms,"Image courtesy: Ice Universe (X)

Apple's Secret 3-Year Plan: A New iPhone Era is Coming!

iPhone Fold expected design and features



iPhone Fold expected price







Apple is expected to launch its first foldable smartphone next year. Now, the long-rumoured foldable iPhone from Apple has appeared in newly leaked renders offering a clear look at the design of first foldable iPhone. As per the YouTube channel Front Page Tech and popular tipper Ice Universe, the design of Apple’s first foldable iPhone may resemble to Google’s Pixel Fold. As per the images leaked online, the yet-to-launch foldable iPhone is said to feature a book-style foldable design.As per the leaks, the upcoming foldable iPhone is said to feature a large internal display and a smaller cover screen. The renders also highlight a minimal crease along with fold area where rival devices like Samsung’s Galaxy Z Fold have often drawn criticism. The design appears to prioritize durability and a seamless viewing experience, aligning with Apple’s reputation for premium hardware aesthetics.“The comparison of the design of the Samsung Galaxy Wide Fold and the Apple iPhone Fold is almost identical, with the only difference being the R-angle. Samsung is more square, while Apple is more rounded. Do you prefer the square one or the rounder one?,” wrote Ice Universe.Early leaks suggest that the first foldable iPhone may look and function differently from the current iPhone lineup. It is expected that the foldable iPhone may ditch the Face ID in order to accommodate the thinner foldable design. It is also said that the company may include a 24MP under-display selfie camera which will offer a cleaner and uninterrupted look to the display. The is also tipped that the foldable iPhone may feature another 24MP camera on the cover display making it easier for the users to take selfies or answer video calls.On the back, the foldable iPhone may feature a dual-lens setup with two 48MP sensors — one standard and one ultrawide — but no telephoto lens. This simplified camera system seems to be a design trade-off to maintain the slim build that a foldable phone requires. While the camera specs may sound modest compared to Apple’s Pro models, the focus for this device appears to be on delivering a sleek design, new display technology, and the flexibility of a foldable form factor.Multiple online rumours suggest that the upcoming Foldable iPhone may be priced around $2,399.","The long-rumoured foldable iPhone from Apple has appeared in newly leaked renders. As per the images leaked online, the yet-to-launch foldable phone is said to feature a book-style foldable design. The design appears to prioritize durability and a seamless viewing experience, aligning with Apple's reputation for premium hardware aesthetics.","https://static.toiimg.com/thumb/msid-126183797,imgsize-29546,width-400,resizemode-4/foldable-iphone.jpg"
