Article Title,Article Link,Article Text,Article Summary,Article Image
Life Certificate 2025: Step-by-step guide to generate and submit Jeevan Pramaan online and offline,https://timesofindia.indiatimes.com/business/financial-literacy/faq/life-certificate-2025-step-by-step-guide-to-generate-and-submit-jeevan-pramaan-online-and-offline/articleshow/125101681.cms,"What is a Life Certificate and why does it matter



Annual submission deadline for pensioners in 2025



1 November and 30 November.

How to generate Jeevan Pramaan online: Step-by-step process



Step 1: Biometric device registration

Step 2: Authentication and certificate generation

Electronic delivery and access of Digital Life Certificate



How can you submit a Life Certificate in 2025



Offline submission at a bank branch or CSC centre

Online submission via Jeevan Pramaan Portal

Submission through the UMANG App

Who needs to submit the Life Certificate



Central and State Government pensioners

Defence pensioners

Family pensioners in the event of the pensioner’s death

Pensioners from public sector undertakings

Key details required before submitting the Life Certificate



Aadhaar Number

Registered Mobile Number linked with Aadhaar

Pension Payment Order (PPO) Number

Bank Account Number where the pension is credited

Name of the Pension Sanctioning Authority

Is Aadhaar mandatory for a digital Life Certificate



Legal validity of Jeevan Pramaan



How Jeevan Pramaan simplifies pensioner verification



Every year, lakhs of pensioners across India must prove that they are still alive to continue receiving their pension. This verification, known as the Life Certificate or Digital Life Certificate (DLC), is a crucial and mandatory step in ensuring that pension payments are made only to eligible recipients, preventing fraud and misuse.Traditionally, this process involved visiting the bank or pension office in person, standing in long queues, and submitting a signed paper certificate. However, with the government’s focus on digitisation and technological advancement, this process has become much simpler, faster, and more convenient. Pensioners can now submit their certificates digitally from the comfort of their homes using Jeevan Pramaan, a secure, user-friendly, and Aadhaar-based platform.A Life Certificate is an official document that confirms a pensioner is alive. Without it, pension payments are automatically paused by the pension disbursing agency. This verification is essential for preventing fraudulent claims and ensuring that pensions reach the rightful beneficiaries.The Digital Life Certificate (DLC), also known as Jeevan Pramaan, is an advanced biometric-enabled version of the traditional paper certificate.Introduced by the Government of India, it uses Aadhaar-based biometric authentication using either fingerprint or iris scan to verify a pensioner’s identity. Once verified, a digital certificate is automatically generated and shared with authorised pension disbursing agencies.This online process eliminates the need for physical verification, providing elderly pensioners with a simpler and more accessible way to maintain their pension benefits.According to PIB, The submission of the Life Certificate is mandatory for all pensioners who wish to continue receiving their pension without interruption. For the year 2025, the standard submission period is betweenTo make the process more comfortable for the elderly, the government allows pensioners aged 80 years and above to begin the submission process earlier, from 1 October 2025. This extended window gives senior citizens more time and flexibility to complete the procedure without facing last-minute difficulties.The Jeevan Pramaan process involves two main steps: registering the biometric device and generating the digital certificate.Before using the service, pensioners or operators must register their biometric device such as a fingerprint or iris scanner. During registration, the user provides their Aadhaar number and mobile number, after which an OTP (One-Time Password) is sent to their mobile. After entering the OTP, they must provide their name and email ID before scanning their fingerprint or iris.Once authentication is complete, the system confirms that device registration was successful, allowing the user to move to the next step.In this step, the pensioner enters personal details such as Aadhaar number, mobile number, name, PPO number, pension type, sanctioning authority, disbursing agency, and bank account details. The system also asks whether the pensioner has remarried or is re-employed.After entering all details, the pensioner scans their fingerprint or iris using the registered biometric device. Upon successful authentication, the Digital Life Certificate is generated, and an SMS acknowledgment with the Jeevan Pramaan Certificate ID is sent to the registered mobile number.This certificate is automatically stored in the Life Certificate Repository, accessible anytime to both pensioners and pension agencies.Once the Digital Life Certificate is created, it can be electronically delivered to the concerned Pension Disbursing Agency (PDA). PDAs can log in to the Jeevan Pramaan portal to view, verify, or download the certificate directly.Pensioners can also download a PDF copy of their certificate by visiting the Jeevan Pramaan website and entering their Pramaan ID or Aadhaar number. This ensures transparency and easy access for future reference.The government provides several options to submit the Life Certificate, allowing pensioners to choose the method that suits them best.Pensioners who prefer traditional methods can visit their bank branch or a Citizen Service Centre (CSC) to submit their Life Certificate physically. Trained staff at these centres assist pensioners in verifying their details and completing the process.For those unable to travel due to age or health issues, India Post Payments Bank (IPPB) offers a doorstep banking service. Pensioners can schedule an appointment, and an IPPB representative will visit their home to complete the submission using biometric authentication. This service is available for both IPPB and non-IPPB account holders.For pensioners comfortable with technology, the Jeevan Pramaan portal provides a completely online process. By visiting https://jeevanpramaan.gov.in, pensioners can submit their Digital Life Certificate using a computer, laptop, or smartphone equipped with a fingerprint or iris scanner.The system uses the Aadhaar platform to authenticate biometric details. Once verification is successful, a Digital Life Certificate is generated and stored in a secure online repository. Pension disbursing agencies can then directly access the certificate, removing the need for physical paperwork.The UMANG (Unified Mobile Application for New-age Governance) app offers another easy option. Pensioners can download the app from the Google Play Store, search for “Jeevan Pramaan,” and select “Generate Life Certificate.”After entering the necessary details such as Aadhaar number, PPO number, and type of pension, pensioners must authenticate themselves using biometric verification. The app then generates a Digital Life Certificate (DLC), which is automatically shared with the pension disbursing authority.All pensioners who receive government, defence, or private sector pensions through authorised disbursing agencies are required to submit their Life Certificate every year. This includes:Failure to submit the certificate within the stipulated period may result in temporary suspension of pension payments until verification is completed.To ensure a smooth submission process, pensioners should keep certain details and documents ready. These include:Having these details ready helps to avoid delays or errors during authentication, whether submitting online or offline.Yes, an Aadhaar number or Virtual ID (VID) is mandatory to generate a Digital Life Certificate. The entire Jeevan Pramaan system is based on Aadhaar authentication, which ensures accuracy and prevents fraud. Pensioners must make sure their Aadhaar is linked with their mobile number and bank account before attempting to generate the certificate.The Digital Life Certificate is fully valid and legally recognised under the Information Technology Act. Pension disbursing authorities across India accept it as an official document, equivalent to the traditional paper-based life certificate.Its biometric verification system makes it secure and tamper-proof, reducing the chances of wrongful pension disbursal or misuse of pension funds.Before the introduction of Jeevan Pramaan, pensioners often faced difficulties in submitting their certificates, especially those with health problems or limited mobility. The digital system has removed these challenges, allowing pensioners to submit their verification anytime and anywhere.By integrating biometric technology and Aadhaar authentication, Jeevan Pramaan has streamlined pension management, improving efficiency for both pensioners and government departments. It also enhances transparency and ensures that genuine beneficiaries receive payments on time.","A Life Certificate is an official document that confirms a pensioner is alive. Without it, pension payments are automatically paused by the pension disbursing agency. This verification is essential for preventing fraudulent claims and ensuring that pensions reach the rightful beneficiaries. The Digital Life Certificate (DLC), also known as Jeevan Pramaan, is an advanced biometric- enabled version of the traditional paper certificate.","https://static.toiimg.com/thumb/msid-125101750,imgsize-47068,width-400,resizemode-4/life-certificate-2025-step-by-step-guide-to-generate-and-submit-jeevan-pramaan-online-and-offline.jpg"
"What are gold, silver hallmarking charges? Check details and importance",https://timesofindia.indiatimes.com/business/financial-literacy/faq/what-are-gold-silver-hallmarking-charges-check-details-and-importance/articleshow/110183026.cms,"What is gold, silver hallmarking?



Hallmarking charges



ALSO READ |

Testing for purity



The importance of hallmarking



Old hallmarking signs



ALSO READ |

Hallmark symbols



HUID in the hallmarked gold jewellery



Key components of hallmark on gold jewellery



Gold, silver hallmarking : Gold and silver jewllery have long been treasured for their beauty and value. However, ensuring their purity and authenticity is important, especially in a market prone to fraudulent practices. This is where the hallmarking scheme comes into play. Here’s what you need to know about hallmarking charges and its procedures:Hallmarking is the process of accurately determining and officially recording the proportionate content of precious metals in articles, such as gold and silver.It serves as a guarantee of their purity or fineness. In India, hallmarking is governed by stringent standards outlined in IS 15820, according to an ET report.Hallmarking charges are applied per article, regardless of its weight. For gold articles, the charge is Rs 45 per article, with a minimum charge of Rs 200 for a consignment. Similarly, for silver articles, the charge is Rs 35 per article, with a minimum charge of Rs 150 for a consignment. It's important to note that additional taxes and levies may apply.A consignment refers to a collection of articles with the same fineness, from which a sample is drawn and assayed for compliance. Different lots may exist within a consignment.Anyone can have their hallmarked jewellery tested for purity at an A&H centre by paying a testing fee of Rs. 200 (for testing using the fire assay method as per IS 1418). These centres must be recognized by the BIS. The list of recognized A&H centres is available on the BIS website under the hallmarking section.The primary objective of hallmarking is to safeguard consumers from counterfeit products. To achieve this, the Indian government made hallmarking mandatory for gold jewellery from June 16, 2021. Since April 1, 2023, jewellers are prohibited from selling any gold jewellery without a 6-digit Hallmark Unique Identification ( HUID ) number.If you bought gold jewellery on or before June 30, 2021, it may have old hallmarking signs. These signs include the purity/fineness mark and the BIS emblem, along with two additional indications: the jeweller's identification number and the assay centre's mark/number.However, starting July 1, 2021, these two indications were replaced with a unique alphanumeric HUID code. The hallmark remains valid for the lifetime of the jewellery, and consumers can sell old jewellery, whether hallmarked or un-hallmarked, to jewellers.The HUID, or hallmark Unique Identification number, is a key component of hallmarking in gold jewellery. It's a unique six-digit alphanumeric code assigned to each hallmarked item, allowing for traceability. Customers can verify the HUID number using the 'Verify HUID' feature in the BIS Care App.Since the introduction of the HUID on July 1, 2021, the hallmark on gold jewellery consists of three marks: the BIS logo, the purity of the article in caratage and fineness, and a unique six-digit alphanumeric HUID number.","Hallmarking is the process of accurately determining and officially recording the proportionate content of precious metals in articles, such as gold and silver. In India, hallmarking is governed by stringent standards outlined in IS 15820. Since April 1, 2023, jewellers are prohibited from selling any gold jewellery without a 6-digit Hallmark Unique Identification number.","https://static.toiimg.com/thumb/msid-110182999,imgsize-66608,width-400,resizemode-4/110182999.jpg"
Want to create a will? You can create it online as well - Here’s how,https://timesofindia.indiatimes.com/business/financial-literacy/faq/want-to-create-a-will-you-can-create-it-online-as-well-heres-how/articleshow/109527973.cms,"If you are planning to create a will, many online platforms offer easy-to-use tools and resources, allowing you to draft and finalise a will without leaving your home. (AI image)

1. Choose a reputable platform

2. Register with the platform

3. List your assets

4. Name your beneficiaries

ALSO READ |

5. Draft your will

6. Review and finalise

Points to keep in mind

Update your will regularly: You can keep your will up-to-date by regularly updating it on the platform to reflect any changes in your life or financial situation.

Communicate with family: It's also important to store your will safely and let your family know where to find it when needed.

Creating a will online: If you are planning to create a will, many online platforms offer easy-to-use tools and resources, allowing you to draft and finalise a will without leaving your home. Here's how to make an online will.Begin by choosing a reliable online service. Look for a platform that has a simple interface, comprehensive templates, and secure storage for your documents.To register, enter your personal information like your full name, date of birth, address, and contact details. Then create a secure username and password to access the online service.Next, make a list of all your assets. Include property, investments, bank accounts, insurance policies, and any valuable items you own.Decide who will inherit your assets by choosing your beneficiaries. You can assign specific items to each beneficiary and select backup beneficiaries in case your first choices can't inherit. Then, choose an executor, the person who will carry out your will.Use one of the customizable templates available on the platform. Follow the instructions to fill in the details, specifying how you want your assets distributed and including any special conditions or terms.You can review the drafted will to ensure it's accurate and make changes if needed. If you have complicated issues, it's best to get legal advice. Once you're satisfied, you can legally execute the will according to the platform's rules, usually by electronically signing it with witnesses. The completed will is then stored securely online, with encryption for added security.With inputs from Centre for Investment Education and Learning content which appeared in Economic Times","If you are planning to create a will, many online platforms offer easy-to-use tools and resources, allowing you to draft and finalise a will without leaving your home. To register, enter your personal information like your full name, date of birth, address, and contact details. Then create a secure username and password to access the online service.","https://static.toiimg.com/thumb/msid-109528287,imgsize-46000,width-400,resizemode-4/want-to-create-a-will-you-can-create-it-online-as-well-heres-how.jpg"
How to get your CIBIL credit score without a PAN card,https://timesofindia.indiatimes.com/business/financial-literacy/faq/how-to-get-your-cibil-credit-score-without-a-pan-card/articleshow/109261520.cms,"Your credit score is a three-digit number that reflects your creditworthiness and repayment capacity.

What is a CIBIL score?

How to get your CIBIL Credit score without a PAN Card

Factors affecting your CIBIL score

CIBIL credit score : Understanding your creditworthiness is pivotal in today's financial landscape, especially when seeking loans or credit cards. The Credit Information Bureau (India) Limited, commonly known as CIBIL, plays an important role in this regard by providing credit scores to borrowers.According to ET, credit score helps banks make informed decisions about extending credit cards and loans. Your credit history influences your CIBIL score , which is calculated using a special method.Your CIBIL score is a three-digit number that reflects your creditworthiness and repayment capacity. Ranging from 300 to 900, a higher score indicates a stronger likelihood of loan approval. Banks and financial institutions use this score to assess the risk associated with lending money.1. Go to the official CIBIL website and click on 'Personal CIBIL score,' then 'Get Your Free CIBIL score.' Follow the link provided and fill in all the required details.2. If you don’t have a PAN Card, you can use an alternative identification such as Passport, Voter ID, Driver’s License, or Ration Card. Enter the number of the chosen ID.3. Provide your date of birth, PIN code, and select your state. Finally, enter your mobile number and click on ‘Accept and Continue’.4. Authenticate your identity by entering the OTP (One-Time Password) delivered to your mobile device on the next screen. Click 'Continue' to proceed.5. Choose whether you want to link the device with your account. Select 'Yes' or 'No' based on your preference.6. Upon successful registration, you will see a page confirming that 'You have successfully registered!'7. Click on ‘Go to Dashboard’ to access and view your CIBIL score.The factors influencing the new CIBIL score, as stated on the CIBIL website, include:1. Depth of credit: This refers to the duration of your existing credit history, calculated from the opening date of your oldest credit account.2. Long-term trend of outstanding balances: The overall trend of outstanding balances over time affects your score.3. Transaction history on credit cards: How you manage transactions on your credit cards impacts your score.4. Ratio of actual repayment amount to total amount due: This ratio indicates your repayment behavior and influences your score accordingly.5. Number of new accounts opened and number of accounts closed: Opening or closing accounts can affect your score, so managing these actions wisely is important.","Your CIBIL score is a three-digit number that reflects your creditworthiness and repayment capacity. Ranging from 300 to 900, a higher score indicates a stronger likelihood of loan approval. Banks and financial institutions use this score to assess the risk associated with lending money.","https://static.toiimg.com/thumb/msid-109261549,imgsize-35230,width-400,resizemode-4/109261549.jpg"
