Article Title,Article Link,Article Text,Article Summary,Article Image
Dubai new e-scooter safety rules: What riders must know,https://timesofindia.indiatimes.com/world/middle-east/dubai-new-e-scooter-safety-rules-what-riders-must-know/articleshow/126184645.cms,"Dubai tightens e-scooter safety rules across public roads / Image: File

Saudi Fighter Jets 'Bombard' UAE-Backed Separatist Fighters In Yemen In Huge Escalation Over South

RTA ’s key e-scooter safety rules

Riders must follow posted speed limits and stay in designated scooter or shared lanes.

Wearing helmets and bright or reflective clothing is strongly advised to stay visible.

Scooters should maintain a safe distance from pedestrians, bicycles, and other riders.

Clear new guidelines

E-scooters must be clean, dry, and folded before boarding public transport vehicles.

They can only be stored in designated areas and must be securely immobilized during travel.

A maximum of two scooters per journey is allowed to avoid crowding and obstruction.

Certain modes, like intercity buses, prohibit e-scooters altogether.



Penalties





Dubai is moving faster toward a greener future, and e-scooters have become the star of the show. Whether you’re zipping through Dubai Marina or using a scooter to bridge the gap between your home and the office, these nimble vehicles are everywhere. However, as their popularity has surged, so has the need for clear, common-sense rules.The aim of the new rules is simple: protect riders, pedestrians, and commuters while keeping Dubai’s transport network running smoothly. Officials say the changes reflect the city’s commitment to safe, orderly mobility, whether you’re riding a scooter, hopping on a metro, or walking down a busy street.The RTA has been actively reminding residents and visitors about essential safety guidelines as e-scooter use grows. These rules help reduce accidents and ensure everyone shares the roads and paths responsibly:The RTA has stressed that safe riding is a shared responsibility between riders and all road users. Taking personal precautions, obeying traffic rules, and being aware of surroundings help prevent incidents as e-scooter trips become part of daily life.One of the most practical changes affects how scooters interact with Dubai’s mass transit system. The RTA has outlined eight safety requirements for carrying e-scooters on public transport such as buses, designed to protect passengers and streamline boarding:These rules reinforce that while scooters are a flexible transport mode, they must be carried responsibly when combined with buses or other services to ensure safety for everyone on board.Dubai isn’t just reminding riders of rules; authorities are backing them with clear penalties to reinforce compliance. According to official summaries of RTA and Dubai Police enforcement, Riding without a permit or outside designated zones can lead to fines of about Dhs200–Dhs300.Not wearing a helmet, riding on jog or pedestrian paths, or ignoring speed limits carries fines. Riding dangerously, like against traffic, or parking scooters in unsafe spots can be penalized as well.These fines are part of a broader effort to keep micro-mobility safe without limiting access. Authorities note that proper permits, gear, and adherence to rules help riders enjoy scooters while minimising risks to others.E-scooters have become a visible symbol of micro-mobility in Dubai, popular for short journeys, last-mile connectivity, and easy travel between public transport stops. Yet, as their numbers rise, so do safety conversations.Recent community actions, such as e-scooter bans in some park areas and restrictions in crowded urban plazas, reflect the city’s careful balancing act between freedom of movement and public safety.As the RTA continues refining regulations and promoting awareness campaigns, officials emphasise that courtesy, caution, and compliance will make Dubai’s shared roads safer for riders, pedestrians, and commuters alike.","The aim of the new rules is simple: protect riders, pedestrians, and commuters while keeping Dubai’s transport network running smoothly. The RTA has outlined eight safety requirements for carrying e-scooters on public transport such as buses, designed to protect passengers and streamline boarding.","https://static.toiimg.com/thumb/msid-126184762,imgsize-140774,width-400,resizemode-4/e-scooter.jpg"
Kuwait: Energy drinks banned at offices and schools — what the new rules mean,https://timesofindia.indiatimes.com/world/middle-east/kuwait-energy-drinks-banned-at-offices-and-schools-what-the-new-rules-mean/articleshow/126170694.cms,"Kuwait bans energy drinks at offices and schools / AI Generated Image

Kuwait’s new energy drink rules

Age Restriction: You must be 18 or older to purchase an energy drink.

Daily Limit: Sales are capped at a maximum of two cans per person per day.

Caffeine Ceiling: Each can (250ml) is now legally restricted to a maximum of 80mg of caffeine, a move to prevent ""ultra-potent"" versions from hitting the market.

Warning Labels: Producers and importers must now feature clear, prominent health warnings on every single can.

Where you can and cannot buy?

All public and private schools, universities, and institutes.

All government offices and agencies.

Restaurants, cafes, grocery stores, food trucks, and even sports clubs.

Delivery platforms and online ordering apps are now barred from bringing these drinks to your doorstep.



Final take





As the world gears up for New Year celebrations, Kuwait is making a resolute resolution of its own: prioritizing the heart health of its citizens. In a sweeping move that has sent ripples through the local food and beverage industry, Minister of Health Dr. Ahmad Al-Awadhi has issued a ministerial decree that fundamentally changes how energy drinks are sold, advertised, and consumed across the nation.This isn’t just a minor adjustment; it is a comprehensive regulatory overhaul designed to curb the health risks, like heart palpitations and sleep disorders, that have been increasingly linked to high-caffeine lifestyles among the youth.Kuwait’s Minister of Health, Dr. Ahmad Al-Awadhi, signed a ministerial decree with key rules on energy drinks:These rules are designed to discourage excessive consumption, particularly among adolescents and young adults who are seen as more vulnerable to the stimulant effects of caffeine-heavy drinks.The most striking part of the decree is the list of ""No-Go Zones."" Effective immediately, the sale and distribution of energy drinks are strictly prohibited in:By removing these drinks from everyday social spots, the government aims to decouple the ""fun"" of dining out or hanging with friends from the consumption of high-stimulant beverages.If you’re looking to stock up, your options are now limited to Cooperative Societies (Co-ops) and parallel markets.However, don't expect to find them next to the bread and milk. The decree mandates that these outlets must create ""designated areas"" for energy drinks, where sales will be under strict supervision to ensure age and quantity limits are followed to the letter.Kuwait’s energy drink rules are not a ban on the drinks themselves, but they are among the most comprehensive controls seen in the Gulf. By restricting sales to adults, limiting consumption, banning ads, and removing availability in common public places, the government is clearly prioritizing health, particularly that of younger residents.For consumers and businesses alike, this means adapting to new buying habits and greater awareness around what and how much they drink. Whether you’re a regular energy drink fan or a health-conscious reader curious about world policies, Kuwait’s decision offers a clear example of how governments can use regulation to shape everyday lifestyles for public benefit.","Kuwait’s Minister of Health, Dr. Ahmad Al-Awadhi, signed a ministerial decree with key rules on energy drinks. Each can (250ml) is now legally restricted to a maximum of 80mg of caffeine. Producers and importers must feature clear, prominent health warnings on every single can.","https://static.toiimg.com/thumb/msid-126170817,imgsize-37828,width-400,resizemode-4/kuwait.jpg"
"UAE weather forecast: Humid mornings, fog, and light rain expected from 23rd to 27th December",https://timesofindia.indiatimes.com/world/middle-east/uae-weather-forecast-humid-mornings-fog-and-light-rain-expected-from-23rd-to-27th-december/articleshow/126140838.cms,"From Tuesday to Saturday, UAE mornings will be humid, with fog, light rain, and moderate winds/Representative Image





The National Centre of Meteorology has issued a forecast signaling humid mornings across the UAE over the next five days. Residents can expect occasional fog or mist in internal areas, shifting skies, and light winds that may freshen at times, with the possibility of light rain later in the week.From Tuesday, 23rd December, the UAE will see generally humid conditions, particularly during the early hours. According to the NCM, mornings are likely to feature mist over internal areas, especially in western regions, while daytime skies will turn fair to partly cloudy. Low clouds may form over islands and along western coasts. Winds are expected to be light to moderate, occasionally reaching speeds of up to 35 kmph. Sea conditions will range from slight to moderate in the Arabian Gulf, and slight in the Oman Sea.Wednesday is expected to follow a similar pattern, with humid mornings and a possibility of mist in internal areas. Skies will generally be fair to partly cloudy during the day, with low clouds over islands and coastal areas. Winds will remain light to moderate, freshening occasionally, and seas will stay slight to moderate in the Arabian Gulf and slight in the Oman Sea.On Thursday morning, humidity will continue, accompanied by chances of fog or mist in internal regions. Weather conditions will be fair to partly cloudy, with clouds forming over islands and some northern and coastal areas. There is a likelihood of light rain. Northwesterly winds may freshen at times, reaching speeds of up to 40 kilometers per hour. The Arabian Gulf may experience rougher seas at times, while the Oman Sea will remain slight to moderate.Friday will bring another humid morning with the possibility of fog or mist over internal areas. The day will be fair to partly cloudy, with cloud formation over islands and some northern and eastern regions. Light rain remains a possibility. Winds will continue to be light to moderate, freshening occasionally with speeds up to 35 kilometers per hour. Sea conditions will remain slight to moderate in the Arabian Gulf and slight in the Oman Sea.Humidity will persist on Saturday morning, with fog or mist likely in some internal areas. Conditions during the day will be fair to partly cloudy, turning cloudy at night over islands and western sea areas. Winds are expected to be light to moderate, reaching speeds of up to 30 kilometers per hour. The sea will remain slight to moderate in the Arabian Gulf and slight in the Oman Sea.","From Tuesday to Saturday, UAE mornings will be humid, with fog, light rain, and moderate winds. The National Centre of Meteorology has issued a forecast signaling humid mornings across the UAE over the next five days. Residents can expect occasional fog or mist in internal areas, shifting skies, and light winds.","https://static.toiimg.com/thumb/msid-126141126,imgsize-618214,width-400,resizemode-4/uae.jpg"
UAE: Sharjah introduces special licence plates for classic vehicles and motorcycles,https://timesofindia.indiatimes.com/world/middle-east/uae-sharjah-introduces-special-licence-plates-for-classic-vehicles-and-motorcycles/articleshow/126138659.cms,"Sharjah Police launched heritage-inspired licence plates for classic vehicles and motorcycles, available via Emirates Auction/Image: X

Heritage meets Standards

Accessible through Auction



Traffic services upgrade







Today, Sharjah Police officially launched a new category of licence plates specifically designed for classic vehicles and motorcycles across the emirate. The initiative aims to provide vehicle owners with distinctive, high-quality registration options that reflect both the emirate’s identity and the heritage of these vehicles.The new plates feature the approved design in line with Sharjah’s visual identity. They include the First Category and private plates for classic vehicles, along with the First Category plates for motorcycles. While these plates adhere to contemporary registration standards, they are crafted to preserve the heritage character of classic cars and motorbikes, allowing owners to display a piece of automotive history on the road.These new registration numbers will be offered for sale through Emirates Auction, ensuring multiple options for buyers. The auction system is designed to provide plates that combine quality, variety, and distinctiveness, in line with Sharjah’s broader strategy to enhance and modernize the traffic services system.The launch of this category forms part of Sharjah’s ongoing efforts to provide high-quality and unique services to vehicle owners. By introducing these special plates, the authorities aim to not only celebrate classic vehicles and motorcycles but also strengthen institutional efforts to develop traffic services, offering a smoother and more organized registration experience.","Sharjah Police launched a new category of licence plates specifically designed for classic vehicles and motorcycles. The initiative aims to provide vehicle owners with distinctive, high-quality registration options that reflect both the emirate’s identity and the heritage of these vehicles. These new registration numbers will be offered for sale through Emirates Auction.","https://static.toiimg.com/thumb/msid-126139381,imgsize-318134,width-400,resizemode-4/sharjah.jpg"
Saudi Arabia permits private schools to build on campus student residential facilities,https://timesofindia.indiatimes.com/world/middle-east/saudi-arabia-permits-private-schools-to-build-on-campus-student-residential-facilities/articleshow/126120268.cms,"Saudi Arabia allows private schools to build separate on-campus student residential facilities/Representative Image

Clear guidelines for private education buildings





Planning, architecture, and site requirements





Buildings must be accessible from two streets, with at least one being 25 meters wide.

The number of floors must comply with the approved building code, with mandatory setbacks observed.

Nurseries can be located on a single street that is at least 15 metres wide, but only if they occupy a standalone building.

Minimum land area per student





Kindergartens must allocate at least four square metres per student.

The area gradually increases for higher educational stages, reaching five square metres per student in larger educational complexes.





Saudi Arabia has taken significant steps to improve the infrastructure of private educational institutions. The Ministry of Municipalities and Housing has unveiled new regulations that set clear standards for schools, nurseries, and learning complexes. Among the most notable changes is the allowance for residential facilities for students within school campuses, provided they are built separately from the main educational building.The move reflects a broader push to enhance safety, urban planning, and the overall learning environment in private schools and educational facilities.The ministry’s updated municipal requirements apply to a wide range of private educational institutions. This includes nurseries, kindergartens, schools, and large educational complexes. The rules are designed to regulate not just the building structures but also the surrounding environment to ensure safe, well-planned, and functional educational spaces.The regulations cover buildings on land specifically designated for education, government-leased land, and even commercial land used for private schooling.By setting these standards, the ministry aims to optimise land use while creating a secure and integrated environment for students.According to the ministry, private educational buildings include facilities catering to general, international, and community, respectively. Some buildings may host more than one stage of learning, as long as they align with the approved classification system.The new requirements are detailed and specific. Schools must follow architectural and planning standards, including:These measures ensure that educational institutions are not only well-designed but also integrated safely into the urban layout, providing ease of access and proper spacing around buildings.To create a comfortable learning environment, the ministry has defined minimum land area requirements per student, adjusted according to the region. These include:This carefully ensures that schools can accommodate the expected number of students while maintaining a safe and conducive environment for learning.","The Ministry of Municipalities and Housing has unveiled new regulations that set clear standards for schools, nurseries, and learning complexes. Among the most notable changes is the allowance for residential facilities for students within school campuses. The move reflects a broader push to enhance safety, urban planning, and the overall learning environment in private schools.","https://static.toiimg.com/thumb/msid-126120805,imgsize-906709,width-400,resizemode-4/saudi.jpg"
"Oman launches first polymer one-rial banknote, circulation starts from January 2026",https://timesofindia.indiatimes.com/world/middle-east/oman-launches-first-polymer-one-rial-banknote-circulation-starts-from-january-2026/articleshow/126117275.cms,"Oman’s first polymer one-rial banknote, featuring national landmarks, begins circulation on January 11, 2026/Image: ONA

'India-Oman FTA To Open Major Opportunities Across Key Sectors': Commerce Minister Piyush Goyal





Oman has introduced its first polymer one-rial banknote, designed to last longer and stay more secure than previous ones. The new banknote, which will start circulating from January 11, 2026, also highlights the country’s cultural and economic achievements.The Central Bank of Oman has released the one-rial polymer banknote, the country has first time issued currency in this material. Unlike the traditional cotton based notes, polymer is durable and comes with advanced security features to help prevent counterfeiting.The note measures 145 by 76 millimetres combining design, heritage, and national pride. The front side features the Oman Botanic Garden, representing the nation’s commitment to preserving its natural heritage. On the rear side, the Sayyid Tariq bin Taimur Cultural Complex appears alongside the Duqm Port and Refinery, showing Oman’s cultural landmarks and economic progress. Together, these images offer a clear picture of the country’s identity and achievements.Security features have been given special attention. A large transparent window, inspired by the arched windows of the Oman Botanic Garden, adds both visual appeal and protection.The front includes a colour-shifting foil showing the frankincense tree, while the Central Bank’s logo appears on the back in iridescent, colour-shifting ink. These features make the note both distinctive and secure.The Central Bank confirmed that the new polymer note will circulate alongside existing one- rial banknotes and will remain fully legal for transactions. Additionally, collectors and the public can buy limited editions, including 1,000 uncut sheets and 10,000 specially packaged notes. These will be available from January 11, 2026, at Central Bank counters in Ruwi, Salalah, and Sohar, as well as through Oman Post’s sales outlet at the Opera Galleria.By combining modern materials with innovative designs that celebrate Oman’s cultural and economic milestones, the new polymer one-rial banknote offers enhanced durability, security, and a clear reflection of the nation’s remarkable achievements.","The Central Bank of Oman has released the one-rial polymer banknote. Unlike the traditional cotton based notes, polymer is durable and comes with advanced security features to help prevent counterfeiting. The note measures 145 by 76 millimetres combining design, heritage, and national pride.","https://static.toiimg.com/thumb/msid-126117433,imgsize-1544005,width-400,resizemode-4/one-rial.jpg"
"UAE students launch SmartPocket mobile app, offering student savings of up to 20% monthly",https://timesofindia.indiatimes.com/world/middle-east/uae-students-launch-smartpocket-mobile-app-offering-student-savings-of-up-to-20-monthly/articleshow/126115751.cms,"UAE students cut costs with SmartPocket app / AI Generated Image

Why was SmartPocket created?

How does the app work?

Food and cafés

Fashion and lifestyle

Electronics and gadgets

Subscriptions and services

Meet the inventor

Is SmartPocket trustworthy?





For many students in the UAE, the gap between a monthly allowance and the cost of living can feel like a mountain to climb. Recognizing this, two young visionaries, Najib Mikati, a senior at the American School of Dubai, and Naji Faqihinejad, a freshman at George Washington University, spent 18 months developing SmartPocket.This mobile platform is more than just a discount tool; it is a financial companion designed specifically for the 12-to-25 demographic, helping them stretch their dirhams while learning the ""why"" behind their spending.Nineteen-year-old Emirati student Naji Faqihi Al Awadhi came up with the idea for SmartPocket while he was in his final year at the American School of Dubai. Like many students, his monthly allowance stayed the same, but costs for essentials such as food, fashion and fitness kept climbing due to inflation.“While our monthly allowances from our parents stayed the same, our spending needs naturally evolved,” Al Awadhi told Khaleej Times, explaining the spark behind the idea. What began as a personal challenge became the seed of a platform designed to make student life more affordable.Two years later, SmartPocket launched publicly in October 2025, giving students a dedicated place to access discounts from more than 20 brands across multiple categories.SmartPocket isn’t open to everyone, users must first verify their student status before accessing deals. Verification happens through official channels like university email addresses or documents such as Emirates IDs, ensuring that only real students can benefit from the discounts.Once verified, students can browse and redeem offers from partner brands in categories such as:Al Awadhi estimates that, on average, users end up reducing their monthly spending by around 20%, though the platform is still new and collecting data to confirm long-term saving trends.This concept is similar in spirit to global student discount networks, like UNiDAYS, which offers exclusive student deals on hundreds of brands worldwide, but SmartPocket is tailored specifically to the UAE market with its own verification and brand partnerships.At the heart of SmartPocket is 19-year-old Emirati student Naji Faqihi Al Awadhi, while studying at the American School of Dubai, Al Awadhi noticed a familiar problem: his monthly allowance didn’t stretch as far as he wanted, especially as prices for food, fashion and leisure kept rising. Rather than simply accept it, he began thinking about a way to help students keep more of their money without cutting out the things they enjoy.The idea for SmartPocket grew from that simple challenge. After two years of refining the concept and building the platform, SmartPocket officially launched in October 2025, offering students a verified way to access deals and discounts from a growing list of local brands.Al Awadhi’s entrepreneurial journey began even earlier. At just 15 years old, he started helping his brother resell sneakers and streetwear, an early lesson in understanding markets and customer demand. That experience gave him a foundation in business that he applied to SmartPocket’s developmentOne common question about new discount platforms is whether they are legitimate and safe to use. With SmartPocket, there are a few signs that help answer this clearly.First, SmartPocket requires real student verification before anyone can access discounts. Students must verify their status using university email addresses or official documents like Emirates ID, which helps ensure the platform isn’t being misused by non-students. This verification step is a basic trust and security measure, similar to how other student discount services operate globally.Second, the app is listed on major app distribution sites like the Apple App Store, where it is presented as a genuine UAE-focused student discount app with clear offer details and secure sign-in features. This listing shows that the platform is intended for legitimate use and meets basic app store standards for security and functionality.","Naji Faqihi Al Awadhi, 19, came up with the idea for SmartPocket in his final year at the American School of Dubai. After two years of refining the concept and building the platform, SmartPocket officially launched in October 2025. Users must first verify their student status before accessing deals.","https://static.toiimg.com/thumb/msid-126115849,imgsize-48670,width-400,resizemode-4/smartpocket.jpg"
