Article Title,Article Link,Article Text,Article Summary,Article Image
Omar’s party goes unrepresented as party MP opts out of outreach trip,https://timesofindia.indiatimes.com/india/omars-party-goes-unrepresented-as-party-mp-opts-out-of-outreach-trip/articleshow/121400097.cms,"SRINAGAR: J&K’s National Conference (NC) has no plans to nominate another representative for the all-party delegations briefing foreign nations and UN members about India’s anti-terrorism position and Operation Sindoor after party MP Mian Altaf Ahmad declined to join the team currently visiting key countries. NC will not have political representation in any of the seven delegations.Centre had nominated the Anantnag–Rajouri MP for the delegation led by DMK MP Kanimozhi in his capacity as NC’s parliamentary head, party sources said Sunday. The team includes Rajiv Rai (SP), Capt Brijesh Chowta (BJP), Prem Chand Gupta (RJD), and ambassador Jawed Ashraf. It was in Russia Saturday.Three politicians from J&K — Ghulam Nabi Azad (Democratic Progressive Azad Party), Mian Altaf (NC), and Ghulam Ali Khatana (BJP) — had been named for these outreach efforts.Altaf opted out as he is engaged with the annual religious ceremony of Hazrat Mian Nizamuddin Kiyanvi, popularly known as Baba Nagri, held in early June at Wangath in Kangan of Ganderbal district. The event draws thousands of devotees across J&K.A senior NC functionary said while the party was consulted and Altaf’s consent was sought, the nomination was Centre’s decision. “Centre didn’t ask us for his replacement after he declined,” the functionary said.“Since he was nominated as parliamentary head, I don’t think anyone else can represent NC now.”Tensions within NC also surfaced Sunday, as MP Aga Ruhullah Mehdi accused party brass of yielding to Centre on Article 370 . On X, Mehdi wrote: “Oh leader! Either rise and speak up for your people, or step down, wear bangles, and remain confined to a palanquin.”The post appeared to target CM Omar Abdullah , who had earlier posted: “Sunday musing. There are doers & there are talkers. That’s why I don’t talk as much as some people I know.”The internal rift became public during NC’s working committee meeting on May 21, where Mehdi voiced frustration over lack of progress on restoring Article 370.",NC will not have political representation in any of the seven delegations. Centre had nominated the Anantnag–Rajouri MP for the delegation led by DMK MP Kanimozhi. Altaf opted out as he is engaged with the annual religious ceremony of Hazrat Mian Nizamuddin Kiyanvi.,"https://static.toiimg.com/thumb/msid-121400094,imgsize-910342,width-400,resizemode-4/121400094.jpg"
J&K LG Sinha warns ‘terrorist state’ Pakistan against misadventure,https://timesofindia.indiatimes.com/india/jk-lg-sinha-warns-terrorist-state-pakistan-against-misadventure/articleshow/121400046.cms,"JAMMU: Pakistan is on notice and any misadventure by it in future will lead Indian armed forces to destroy “the terrorist state”, J&K lieutenant governor Manoj Sinha warned on Sunday.Addressing a function organised by All J&K Jat Sabha in Jammu, Sinha highlighted the valour of Indian armed forces during “Operation Sindoor” in the wake of the Pahalgam terror attack that killed 26 people, mostly tourists. Sinha reaffirmed govt’s resolve to completely rid J&K of terrorism.“I assure people there will be no discrimination between armed terrorists and their supporters and sympathisers. Their actions will be met with similar punishment,” the LG said.Sinha underscored the need to recognise elements trying to divide society. “We must celebrate our diversity and foster unity to defeat the adversary’s nefarious designs. Our brave armed forces have scripted a new saga of valor with Operation Sindoor . It is now our sacred task to transform the vision of a United and Viksit Bharat,” Sinha said.The LG paid homage to the victims of the Pahalgam attack and those killed in unprovoked shelling by Pakistan in the aftermath of Operation Sindoor. Sinha reiterated govt’s commitment to proper rehabilitation of families displaced by the shelling.Sinha expressed gratitude to PM Narendra Modi and Union home minister Amit Shah for “ushering in an era of equality in J&K and empowering marginalised communities”.The LG appealed to the brave “Jats” and others to fight divisive forces. “Jats have a rich legacy of valour, courage, and sacrifice. Many from the community reside near our borders, making them the country’s first line of defence. Your devotion to the motherland has deepened nationalism in society,” Sinha said.","J&K lieutenant governor Manoj Sinha said Pakistan is on notice and any misadventure by it in future will lead Indian armed forces to destroy ""the terrorist state"" Sinha underscored the need to recognise elements trying to divide society. Sinha reaffirmed govt’s resolve to completely rid J&K of terrorism.","https://static.toiimg.com/thumb/msid-121400043,imgsize-789207,width-400,resizemode-4/121400043.jpg"
Akali councillor Harjinder Singh Bahman shot dead in Amritsar,https://timesofindia.indiatimes.com/india/akali-councillor-harjinder-singh-bahman-shot-dead-in-amritsar/articleshow/121394258.cms,"Beating Retreat Resumes At Wagah-Attari Border After 12-Days | India-Pak | Op Sindoor

NEW DELHI: Akali councillor Harjinder Singh Bahman was shot dead by unidentified assailants in Amritsar’s Chehertha area on Sunday.The Shiromani Akali Dal (SAD) leader represented Ward No. 2 under the Jandiala Assembly constituency.According to ADCP Harpal Singh Randhawa, the attackers, three to four individuals, tried to intercept Harjinder Singh while he was on his motorcycle before firing multiple rounds.""While Harjinder Singh was on his way, a motorcycle carrying three to four individuals approached him and opened fire. He succumbed to his injuries on the way to the hospital,"" Punjab Police ADCP Harpal Singh Randhawa said.""According to his brother and brother-in-law, the attackers were the same individuals who had previously opened fire at his residence and issued threats to him,"" he added.The police have identified three suspects—Gopi, Amit, and Karan Kira, all residents of Jandiala Guru—and said arrests will be made soon. The vehicle used in the crime has also been traced.SAD president Sukhbir Singh Badal slammed the AAP government over the “collapse” of law and order in Punjab.He claimed police failed to act even after shots were fired at the councillor’s house days earlier.SAD leader Bikram Singh Majithia also alleged that Harjinder had received threat calls, which he had reported to the authorities.Punjab Congress chief Amrinder Singh Raja Warring condemned the killing, calling it a “brutal broad daylight murder” that reflects the “deteriorating law and order situation in Punjab.” He accused the AAP government of pushing the state towards “complete lawlessness and anarchy.”",Akali councillor Harjinder Singh Bahman was shot dead by unidentified assailants in Amritsar’s Chehertha area on Sunday. The Shiromani Akali Dal (SAD) leader represented Ward No. 2 under the Jandiala Assembly constituency.,"https://static.toiimg.com/thumb/msid-121394269,imgsize-372867,width-400,resizemode-4/121394269.jpg"
"Gang-raped & tortured, 45-year-old tribal woman bleeds to death in MP",https://timesofindia.indiatimes.com/india/gang-raped-tortured-45-year-old-tribal-woman-bleeds-to-death-in-mp/articleshow/121399232.cms,"INDORE: A 45-year-old tribal mother of two died after being allegedly gangraped and brutalised in a village of Madhya Pradesh's Khandwa, leaving her so badly injured that her intestines were protruding when she was found Saturday afternoon bleeding and unconscious. Two men last seen with the victim have been arrested, DIG Siddharth Bahuguna said.The savage assault, reminiscent of 2012 Nirbhaya gangrape and murder, took place in a village around 170km from Indore after the woman returned from a wedding late Friday with one of the suspects, identified as Hari Palvi.""After the wedding, she and Hari escorted a woman relative till her village. When she didn't return home that night, her family assumed she had stayed back. We suspect the woman went to Hari's house, where they had some drinks with another suspect, Sunil Korku,"" said ASP Rajesh Raghuwanshi.Investigators quoted Hari's mother as saying she woke up to sounds of someone whimpering in the courtyard and stepped out to find the victim bleeding and in pain. She then collapsed, briefly regaining consciousness once before passing out again.A neighbour called the woman's family and they took her home, barely half a kilometre away, instead of a doctor.She died between 1.30pm and 2pm, after which police were informed, Raghuwanshi said.Postmortem revealed that the victim had been brutalised with a sharp, hard object that caused fatal internal injuries. ""The preliminary postmortem report confirms grievous trauma that ripped internal organs. Based on this, a case of gangrape and murder was registered against Hari (40) and Sunil (30), both labourers from the same village,"" the ASP said.According to the family, the woman was carrying Rs 20,000 - savings handed to her by her younger son and daughter, who had recently returned from Goa after a working stint with a road construction company there. The family suspects she may have been robbed before being sexually assaulted and tortured.Sources said scratches and signs of the woman being dragged through the ground were found on the body. ""Something terrible has happened to me, I will not survive. Sunil and Hari did this,"" the woman was quoted as telling her family when she regained consciousness for a bit.","The 45-year-old tribal mother of two died after being allegedly gangraped and brutalised. The savage assault, reminiscent of 2012 Nirbhaya gangrape and murder, took place in a village around 170km from Indore. Two men last seen with the victim have been arrested.","https://static.toiimg.com/thumb/msid-121399233,imgsize-541252,width-400,resizemode-4/121399233.jpg"
Two accused in 2003 Kolkata gang-rape case acquitted 20 years later,https://timesofindia.indiatimes.com/india/two-accused-in-2003-kolkata-gang-rape-case-acquitted-20-years-later/articleshow/121399014.cms,"KOLKATA: A gang-rape case, reported in Amherst Street in the city in May 2003, that came up for trial 20 years later -- in Jan 2025 - has led to the acquittal of two persons implicated by police. The complainant, who appeared before a Kolkata trial judge on April 24, said that two decades later, she was unable to recollect ""what happened"" that day and who tortured her.The trial court, in its May 23 order, while acquitting the two accused, also criticised the police for shoddy investigation where none of the witnesses or evidence produced helped unravel the crime.Additional district and sessions Judge Rohan Sinha, in his judgment, said, ""Not a single witness examined by the prosecution could throw any light on the incident alleged. Unfortunately, even the victim has turned turtle from her earlier statement.""The judge also pointed out three key lapses by the investigating officer (IO) which led to the acquittal. The judge said, ""The victim could not identify the wrongdoers, but, curiously, the IO did not try to get the accused persons to face any Test Identification Parade for their identification.""The judge also noted that despite the survivor having given an in-camera testimony to a judicial magistrate, her statement under 164 CrPC was not produced in court.Also, the Amherst Street officer-in-charge did not bother to ""sign or endorse"" the survivor's statement saying that she was gang-raped, which led to the FIR.The trial court also could not rely solely on the survivor's testimony because she filed a formal application not to proceed with the same.The judge, in his order, recorded that the survivor ""firmly deposed that due to the passage of time of more than 20 years, she could not recollect exactly what happened to her on the fateful day. She also failed to disclose the identity of the accused, nor could she identify the accused persons"".According to the case details, the survivor was engaged as a casual labourer to work in an under-construction house in Rajarhat by one of the accused. According to the FIR, which was also corroborated in the police charge sheet filed in 2004, on May 13, 2003, she was working when she was gang-raped by two persons, including the one who engaged her for work. Police, 20 years ago, got the victim medically examined, recorded her statement before a magistrate, and charge-sheeted four persons. Two among those named in the charge sheet were arrested, while the remaining two are still absconding.","A gang-rape case, reported in Kolkata in May 2003, came up for trial 20 years later. The complainant said that two decades later, she was unable to recollect ""what happened"" The trial court, in its May 23 order, while acquitting the two accused, also criticised the police for shoddy investigation.","https://static.toiimg.com/thumb/msid-121399015,imgsize-832070,width-400,resizemode-4/121399015.jpg"
"Tej Pratap: Rebel without cause, felled by poll cause",https://timesofindia.indiatimes.com/india/tej-pratap-rebel-without-cause-felled-by-poll-cause/articleshow/121398999.cms,"PATNA: In Bihar's complex political theatre, few figures are as erratic, unpredictable and, at times, bewildering as Tej Pratap Yadav , elder son of RJD chief Lalu Prasad . Once introduced as a rising heir to his father's legacy, Tej Pratap has evolved into a political liability, a family outcast, and, most curiously, a man whose personal whims have routinely overshadowed the party's agenda.This election year in Bihar, Tej Pratap has become the proverbial thorn in Lalu's side, a distraction the veteran socialist could no longer ignore. On Saturday, Tej Pratap again seized headlines, not for strategy or statesmanship, but for posting on social media about a new ""relation"" with a woman. The announcement was casual, dramatic and ambiguous, a pattern now familiar to those who have followed his journey over the past decade.While dynastic politics in the country often comes with high expectations, Tej Pratap never seemed to settle into the role. His early appearances as state health minister in 2015 - more notable for clumsy media interactions than policy achievements - left many wondering whether he was suited for public life at all. Reports of him consulting astrologers for state matters and allegedly bringing a cow into his ministerial bungalow for ""positive energy"" became tabloid fodder and marked the beginning of a reputation built more on eccentricity than governance.Tej Pratap's dramatic personal life has also been central to his public persona. His 2018 marriage to Aishwarya Rai, granddaughter of former CM Daroga Rai, was supposed to cement a powerful political alliance. Instead, it turned into a scandal. Within months, he filed for divorce, alleging domestic discord, while Aishwarya accused him of abuse and erratic behaviour.Family tensions spilled into public view as Lalu and Rabri Devi struggled to contain the fallout. In one infamous episode, Tej Pratap declared he was going on a pilgrimage to escape ""toxic atmosphere"" of home. His tantrums did not stop there. He often skipped key party events, launched public tirades against younger brother Tejashwi Prasad Yadav , now firmly established as Lalu's political heir, and floated vague threats of forming his own political outfit.Saturday's post, just months before assembly elections, appears to be another in a long line of personal dramas staged in public view.In a rare but decisive step, Lalu Prasad finally acted. Tej Pratap was formally expelled from RJD and disowned by family. The message was clear - political survival trumps paternal indulgence.","Tej Pratap Yadav has evolved into a political liability, a family outcast, and a man whose personal whims have routinely overshadowed the party's agenda. His early appearances as state health minister in 2015 left many wondering whether he was suited for public life at all. His 2018 marriage to Aishwarya Rai, granddaughter of former CM Daroga Rai, turned into a scandal.","https://static.toiimg.com/thumb/msid-121399003,imgsize-1044686,width-400,resizemode-4/121399003.jpg"
"Brett Favre claims Netflix is smearing him over Donald Trump support, not scandals",https://timesofindia.indiatimes.com/sports/nfl/news/brett-favre-claims-netflix-is-smearing-him-over-donald-trump-support-not-scandals/articleshow/121393942.cms,"Brett Favre implies he's being targeted by Netflix (Image via AP)

Brett Favre implies he's being targeted because of his conservative politics

Documentary revisits scandals that reshaped Favre's post-NFL image

Critics question his legacy, but Favre doubles down

NFL Hall of Famer Brett Favre is once again at the center of controversy—not for his past on-field glory, but for how he believes he’s being portrayed in the new Netflix documentary Untold: The Fall of Favre. The former Green Bay Packers quarterback has implied that the documentary’s critical tone is less about justice and more about politics, suggesting he's being singled out for his outspoken support of Donald Trump.While Favre hasn’t issued a direct statement about the documentary, his actions on social media are telling. He recently reposted two messages on X (formerly Twitter) that accuse Netflix of political bias, insinuating that the streaming giant is punishing him for backing Trump. Though Favre didn’t write the tweets himself, his amplification of them speaks volumes and aligns with a narrative that he is a victim of political targeting.The Fall of Favre explores two major controversies linked to the legendary quarterback: his alleged involvement in the $77 million Mississippi welfare fraud scandal, and sexual harassment claims from his brief tenure with the New York Jets. The documentary paints a sharp contrast between the public's image of Favre as the “everyman” quarterback and the less flattering reality of his legal and ethical troubles.One particularly damning detail is the $5 million that allegedly went toward constructing a volleyball stadium at the University of Southern Mississippi—Favre’s alma mater and the school where his daughter played. Text messages released in 2022 show Favre asking if the funding could be kept under wraps, fueling public suspicion. Though he hasn't been criminally charged, he remains involved in ongoing civil litigation.The documentary also revisits the sexting allegations brought by former sideline reporter Jenn Sterger, who accused Favre of sending unsolicited explicit content. The NFL fined him $50,000 for not cooperating with their investigation, though no formal action was taken on the allegations themselves.As The Fall of Favre garners attention, so does the political undertone of its reception. “Never meet your heroes,” one interviewee quips, capturing the disillusionment felt by many.Also Read: Tom Cruise leaves Pat McAfee stunned after comparing death-defying stunts to NFL quarterbacks' pressure and precision Favre, however, sees this as more than a reputation crisis—he sees it as political persecution. As the legal drama unfolds and the public reevaluates one of the NFL’s most iconic figures, the question remains: is this accountability, or a politically charged takedown?","Brett Favre implies he's being targeted because of his conservative politics. The former Green Bay Packers quarterback has implied that the documentary’s critical tone is less about justice and more about politics. Favre hasn’t issued a direct statement about the documentary, but his actions on social media are telling.","https://static.toiimg.com/thumb/msid-121396944,imgsize-55466,width-400,resizemode-4/121396944.jpg"
‘They lost Annabelle?’ Internet meltdown over haunted doll,https://timesofindia.indiatimes.com/world/us/they-lost-annabelle-internet-meltdown-over-haunted-doll-heres-what-really-happened/articleshow/121392274.cms,"Annabelle doll (Screengrab from FB video posted by Ryan D. Buell.)

The haunted doll that terrifies millions

From horror icon to internet meme





The infamous Annabelle doll, known as one of the most feared haunted objects in the world, became the center of an internet firestorm in the past few days after social media users claimed it had mysteriously vanished during a paranormal tour in the US. The doll, currently touring the country as part of the “Devils on the Run” exhibit, reportedly wasn’t visible to visitors at a recent stop, sparking fears, conspiracy theories, and viral panic online.The speculation intensified after a fire broke out at the historic Nottoway Resort in White Castle, Louisiana- just days after Annabelle had been displayed in the state. While officials confirmed that no injuries occurred and dismissed any supernatural link to the blaze, social media users quickly pointed to the doll’s presence as a chilling coincidence.“So the streets are saying after they moved the Annabelle doll out of the Warren museum (when they explicitly said never to move it) she's now gone missing.” one user posted on X (formerly Twitter), echoing the sentiments of thousands who feared the worst. Another exclaimed, “WHAT THE HELL DO YOU MEAN THEY LOST THE ANNABELLE DOLL??? ONE OF THE MOST HAUNTED POSSESSIONS?? THAT ANNABELLE?""Despite the viral meltdown, the panic was short-lived.Dan Rivera of the New England Society for Psychic Research (NESPR), which oversees the Warren Occult Museum’s collection, released a video showing the doll safe and sound in its protective glass case back in Connecticut.“Some wild and crazy internet rumours this morning claiming that we lost Annabelle. She/it is NOT lost,” read the caption alongside the video, posted by Ryan D. Buell.The Annabelle doll’s legend dates back to the 1970s, when it was reportedly given as a gift to a nurse in Hartford, Connecticut. What appeared to be a harmless Raggedy Ann doll soon exhibited disturbing behavior- moving on its own, leaving handwritten notes, and allegedly attacking one of the occupants.The case caught the attention of famed paranormal investigators Ed and Lorraine Warren, who concluded that the doll wasn’t possessed by a child’s spirit, but manipulated by a demonic entity. The Warrens took the doll into their care and placed it inside a sealed glass case in their Occult Museum, where it has remained under lock and key- until recently.Though the museum in Monroe, Connecticut, remains closed to the public, Annabelle is currently on a national tour, part of the “Devils on the Run” exhibit. The event showcases haunted artifacts from the Warrens' collection and has drawn massive interest across the country. In May, the doll made headlines after appearing at the former Moundsville State Penitentiary in West Virginia- a notoriously haunted site. A video of the doll being moved into the penitentiary racked up over 9 million views on TikTok, reigniting public fascination with the paranormal.Annabelle’s legend exploded into the mainstream with the 2014 release of Annabelle, the horror film that spun off from The Conjuring franchise. The series has since grossed more than $800 million globally, turning the doll into a pop culture icon—and a consistent source of real-world fear.Following its West Virginia appearance, Annabelle’s tour has included stops in New Orleans and is scheduled to continue in San Antonio, Texas, and other cities, including locations in Illinois, Pennsylvania, and Kentucky.In the meantime, whether the doll ever left the museum or whether the sightings were part of a promotional stunt remains unclear. What is certain, however, is that Annabelle continues to captivate and terrify the public imagination.(This is a top Google Trends topic)","The Annabelle doll is currently touring the country as part of the “Devils on the Run’ exhibit. The doll's legend dates back to the 1970s, when it was reportedly given as a gift to a nurse in Hartford, Connecticut.","https://static.toiimg.com/thumb/msid-121392614,imgsize-482102,width-400,resizemode-4/121392614.jpg"
