Article Title,Article Link,Article Text,Article Summary,Article Image
7 kids of a Bihar family out for a bath drown in Sone,https://timesofindia.indiatimes.com/india/7-kids-of-a-bihar-family-out-for-a-bath-drown-in-sone/articleshow/113993747.cms,"SASARAM/PATNA: Eleven youths, including seven from a family, drowned while bathing in two incidents in Bihar's Rohtas and Katihar districts on Sunday.Seven children from a family, including four siblings, drowned in the swollen Sone River in Rohtas' Tumba village. The bodies of Nibha Kumari (14), Nidhi Kumari (12), Gunugun Kumari (8), and Pawan Kumar (6), all siblings, along with their cousins Abhay Kumar (10), Vivek Kumar (12) and Raju Kumar (12), were recovered by divers deployed by local administration.Nand Kishor Gond, an autorickshaw driver from Ranchi's Doranda, had taken his four children and four others from his family for a bath.He managed to rescue one, the young son of his brother-in-law Kedar Gond.""Despite warnings about the rising water level, locals continued to bathe in the river, resulting in several drowning cases,"" police said.In Katihar, four youths drowned while bathing in floodwaters near Sameli halt in Chakla Maula Nagar panchayat area around 2pm. Their cries for help initially went unheard, and by the time locals reached them, it was too late. The bodies of Deepak Kumar (18), Himanshu Kumar (18), Abhijeet Kumar (18), and Saurabh Kumar (15) were later recovered.","Seven children from a family, including four siblings, drowned in the swollen Sone River in Rohtas' Tumba village. Four youths drowned while bathing in floodwaters near Sameli halt in Chakla Maula Nagar panchayat area in Katihar.","https://static.toiimg.com/thumb/msid-113993754,imgsize-32156,width-400,resizemode-4/113993754.jpg"
"Goa police expand search for relics row accused, stir subsides",https://timesofindia.indiatimes.com/india/goa-police-expand-search-for-relics-row-accused-stir-subsides/articleshow/113993703.cms,"PANAJI: Protests in Goa ignited by former RSS state chief Subhash Velingkar 's controversial remarks about St Francis Xavier eased Sunday as police expanded their search across the state and neighbouring Maharashtra to catch the accused, who has remained untraceable since Friday.Velingkar allegedly called for a ""DNA test"" of the relics of St Francis Xavier, revered as the patron saint of Goa and affectionately known as Goencho Saib.North Goa SP Akshat Kaushal said Velingkar ignored a second police notice issued Sunday to join the probe. Velingkar had applied for anticipatory bail Saturday, with the matter expected to be heard Monday.The FIR against Velingkar was filed Friday by Velim MLA Cruz Silva of AAP, alleging Velingkar's speech at a Bicholim event on Oct 1 insulted St Francis Xavier and hurt religious sentiments. Complaints against Velingkar continued to be filed at police stations in Goa.Protesters demanded Velingkar be externed from Goa until after the decennial exposition of St Francis Xavier, which will be held from Nov to Jan next year. Born in Spain in 1506, the Christian missionary arrived in Goa in 1542 and travelled extensively across India and Southeast Asia until his death in 1552. His remarkably preserved body is enshrined at the Basilica of Bom Jesus in Old Goa.A memorandum from Old Goa residents called for Velingkar to be barred from entering the area until the Exposition concludes in Jan. Authorities have yet to respond to the memorandum's demands as tensions remain, with the police investigation continuing.CM Pramod Sawant has assured that action will be taken against Velingkar and urged the public to maintain peace, emphasising that ""no one should attempt to create communal tension"". Church leaders called on the faithful to remain peaceful and not allow religious harmony to be disrupted. Fr Henry Falcao, convener of the Exposition committee, said: ""Our sentiments are hurt, but we must not get agitated.""Peaceful protests were seen Sunday in Old Goa, with priests, nuns, and other community members participating. Protest organisers, including Glen Cabral, suggested that Velingkar's remarks were an attempt to divert attention from real estate projects in the state.""This is an attempt to divide us because if we are united against all these projects, govt will never be successful. We are Goans first. Let us live together, Hindus-Christians-Muslims. It is OK to protest, but keep it peaceful and don't block the roads,"" Cabral said. People from different religious backgrounds gathered at Santa Cruz after Sunday Mass to file a police complaint against Velingkar, demanding his arrest while urging everyone to maintain focus on Goa's larger interests.","Velingkar allegedly called for a ""DNA test"" of the relics of St Francis Xavier, revered as the patron saint of Goa. Police expanded their search across the state and neighbouring Maharashtra to catch the accused. Velingkar had applied for anticipatory bail Saturday, with the matter expected to be heard Monday.","https://static.toiimg.com/thumb/msid-113993720,imgsize-4574,width-400,resizemode-4/113993720.jpg"
"Overcome differences for the sake of security, RSS chief tells Hindus",https://timesofindia.indiatimes.com/india/overcome-differences-for-the-sake-of-security-rss-chief-tells-hindus/articleshow/113993702.cms,"NEW DELHI: RSS chief Mohan Bhagwat called upon Hindus to overcome internal divisions and disputes rooted in language, caste and regional identities in order to ensure their security ."" Unity among Hindus is important for the sake of the security of the community. Hindus should overcome differences of language, caste and states,"" Bhagwat told an RSS gathering in Baran in Rajasthan on Saturday.He said the Hindu community needed to take initiatives towards that end instead of thinking that God would take care of them.""God assists people only when they have initiated action,"" he said, adding that Lord Krishna did not come to the assistance of the Pandavas until the five brothers had entered the battlefield. ""If the Lord wanted, he would have finished the war in the Pandavas' favour only by willing such an outcome, but he did not,"" the RSS chief said to buttress his contention.He repeated that the term Hindu has been used for all sects residing in India. ""Hindus consider everyone their own and accept everyone. A Hindu says, 'we are right, and you are also right in your place'. We should live with goodwill, engaging in continuous dialogue,"" he said.Bhagwat's call for unity among Hindus came a day after PM Narendra Modi cautioned against efforts to divide the country. Early on, UP CM Yogi Adityanath had referred to the targeting of Hindus in Bangladesh to warn that Hindus could afford disunity only at their own peril.Bhagwat said safety of a strong nation's expatriates was ensured only when their nation was strong; otherwise, expatriates from a weak nation were ordered to leave. The event, attended by nearly 4,000 volunteers and senior RSS leaders, emphasised the organisation's commitment to fostering social cohesion through small, everyday practices.",Mohan Bhagwat: Unity among Hindus is important for the sake of the security of the community. He said the Hindu community needed to take initiatives towards that end instead of thinking that God would take care of them. He repeated that the term Hindu has been used for all sects residing in India.,"https://static.toiimg.com/thumb/msid-113993712,imgsize-1764170,width-400,resizemode-4/113993712.jpg"
7 of family die in Mumbai house blaze,https://timesofindia.indiatimes.com/india/7-of-family-die-in-mumbai-house-blaze/articleshow/113993405.cms,"A fire in Siddharth Colony , a slum in Chembur (E), early Sunday killed 7 members of a family, including 3 minors, while 2 others sustained minor injuries. It erupted at 5am, tearing through their ground-plus-two home, sparing only family head Chedilal Gupta and one of his two sons, Dharamdev. The fire was extinguished hours later, at 9.15am.Chedilal's wife Gitadevi was sleeping on the ground floor, which houses a grocery shop with kerosene and other items.Locals believe a lit diya on the floor may have sparked the fire, with kerosene fuelling it. Mumbai frequently witnesses blazes in informal housing settlements and narrow lanes which make entry for fire brigade difficult.","A fire in Siddharth Colony, a slum in Chembur (E), early Sunday killed 7 members of a family, including 3 minors. It erupted at 5am, tearing through their ground-plus-two home, sparing only family head Chedilal Gupta and one of his two sons, Dharamdev.","https://static.toiimg.com/thumb/msid-113993433,imgsize-18970,width-400,resizemode-4/113993433.jpg"
RG Kar case: Protesting doctors begin hunger strike against Mamata govt,https://timesofindia.indiatimes.com/india/rg-kar-case-protesting-doctors-begin-hunger-strike-against-mamata-govt/articleshow/113969348.cms,"ANI photo / File

NEW DELHI: Protesting junior doctors in Kolkata began fast unto death on Saturday as they said that their demands were not fulfilled by the Mamata Bengree-led West Bengal government .The doctors had called off their ""total cease work"" on Friday with a 24-hour ultimatum to the state government to fulfill their demands.""Like we said yesterday, we have called off our 'total cease work' (at state-run medical colleges and hospitals), but we are launching a hunger strike from today (as West Bengal government has failed to fulfill our demands),"" an agitating junior doctor told news agency PTI at a press conference in Kolkata.""The state government has failed the deadline and hence we are starting the fast unto death till our demands are fulfilled. To maintain transparency, we have installed CCTV cameras at the dais where our colleagues will be holding the fast,"" another junior doctor said.""We will join duty as promised but will not eat anything,"" he told PTI.The doctors' protest was triggered by the rape and murder of a trainee woman doctor at Kolkata's RG Kar Medical College and Hospital on August 9.The doctors had reverted to total cease-work on October 1, citing an attack on their colleagues at the College of Medicine and Sagore Dutta Medical College but withdrew it on Friday after a 24-hour ultimatum to the Mamata government.The junior doctors have set a 10-point charter of demands revolving around the security at hospitals, threat culture and patient care services. They have also demanded the removal of the health secretary, an investigation into corruption in West Bengal Medical Council and West Bengal Health Recruitment Board, as well as student council elections in all medical colleges.The Bengal Junior Doctors' Front has raised several demands, including the installation of CCTV cameras on hospital premises, round-the-clock security for healthcare workers, and stricter protocols to prevent incidents of violence against medical professionals.The doctors have also highlighted the culture of fear and intimidation within state-run hospitals, alleging that the administration has not provided a safe working environment.Later, they said unless they saw demonstrable intent on the part of the government to address these issues with clear action on the ground, they would be compelled to carry on with the protest.","The doctors' protest was triggered by the rape and murder of a trainee woman doctor at Kolkata's RG Kar Medical College and Hospital on August 9. The doctors had reverted to total cease-work on October 1, citing an attack on their colleagues. They withdrew it on Friday after a 24-hour ultimatum to the Mamata government.","https://static.toiimg.com/thumb/msid-113969984,imgsize-1668126,width-400,resizemode-4/113969984.jpg"
Meghan's 'vanished' ring worries Prince William back home: 'It has set off alarm bells',https://timesofindia.indiatimes.com/world/uk/meghans-vanished-ring-worries-prince-william-back-home-it-has-set-off-alarm-bells-diana-legacy-prince-harry/articleshow/113931159.cms,"Prince William is reportedly concerned about the whereabouts of valuable pieces from his late mother Princess Diana ’s jewelry collection, that were once in Meghan Markle ’s possession, The Mirror reported.Among these jewels is Meghan’s engagement ring , a piece steeped in personal history and sentiment, which appears to have ""vanished"" in recent months.In 2017, Prince Harry proposed to Meghan Markle with a custom-made engagement ring that held deep symbolic meaning.The ring featured two diamonds from Princess Diana's personal collection, carefully set next to a larger stone sourced from Botswana, a country significant to the couple’s relationship. The ring was seen as a tribute to his late mother and a way of keeping her legacy close to him and Meghan.However, less than two years after the engagement, the ring underwent a subtle but notable transformation. It was reportedly updated with a slimmer band, a modification that Meghan, 42, first showcased in 2019 during the Trooping the Colour event. The revamped engagement ring was displayed alongside a new ring, and together they became iconic symbols of the Duchess of Sussex .But this year, Meghan has been seen without her engagement ring at multiple public events. In May, she attended a gala without the sentimental piece on her finger, which sparked questions and rumors. Initially, it was reported that the ring was simply ""being fixed,"" yet as time has passed, its absence has only deepened the mystery.A source close to the royal family said that Meghan’s missing ring has raised eyebrows, particularly back in the UK, where Prince William, is known to be deeply protective of his mother’s legacy. The insider expressed confusion over why Meghan would not be “proudly” wearing the ring at significant public events. The source hinted that this development might have caused concern for William, as it touches on the sensitive subject of preserving Princess Diana’s memory. “It's safe to say it has set off alarm bells at the Palace,” a source told The MirrorAccording to Sky news, Diana’s personal jewelry collection which is estimated to be worth around $20 million comprises heirlooms passed down through generations, as well as pieces gifted by foreign royals, her former husband Prince Charles, and her last boyfriend, Dodi Fayed. After Diana’s tragic death in 1997, the collection was split between her two sons, William and Harry, who have since shared parts of it with their wives.","Prince William is reportedly concerned about the whereabouts of valuable pieces from his late mother Princess Diana's jewelry collection. Among these jewels is Meghan's engagement ring, which appears to have ""vanished"" in recent months. In May, she attended a gala without the sentimental piece on her finger, which sparked questions and rumors.","https://static.toiimg.com/thumb/msid-113931337,imgsize-1073978,width-400,resizemode-4/113931337.jpg"
Amethi murder case: Prime accused Chandan Verma shot in encounter,https://timesofindia.indiatimes.com/city/lucknow/amethi-murder-case-prime-accused-chandan-verma-shot-in-encounter/articleshow/113956331.cms,"LUCKNOW: Chandan Verma, 26, accused of murdering a Dalit teacher and his family in Amethi , was shot in an encounter with the police in the early hours of Saturday.The encounter occurred while he was being taken to recover the pistol used in the crime, the police said.Read more: Amethi murder case: 'Killer who murdered family of four was in relationship with teacher's wife' Additional SP, Amethi, Harendra Kumar, stated that Chandan is out of danger and undergoing treatment at the local CHC.""During the operation, Chandan attempted to grab a pistol from Sub-Inspector Madan Kumar Singh and opened fire on him. In response, the police fired in self-defence, hitting Chandan in the right leg. Following the incident, Chandan was admitted to Tiloi CHC (Community Health Centre) for treatment,"" said Kumar.The gruesome murder of a Dalit schoolteacher, his wife, and two daughters in Amethi on Thursday was carried out by Chandan, who was in love with Poonam Bharti, the wife of the teacher.Sunil Kumar, 34, a teacher in a govt school, came to know about his wife's affair on 18th August, after which he made Poonam lodge an FIR against Chandan under the SC/ST Act in Rae Bareli, accusing him of threatening her family. She also stated in her complaint that if any of her family members were harmed, Chandan should be held responsible for it.On Thursday, Chandan barged into the house of the victim and not only eliminated Sunil and Poonam but also their daughters, Shrishti, 5, and Samiksha, 1.5 years.ASP Kumar said that Chandan Verma was the prime suspect, and he was in love with Poonam, and the two were constantly in touch with each other through video chats.Verma was arrested late Friday evening from Noida when he was trying to cross over to the national capital.He was arrested by a team of STF Noida unit from near Jewar toll plaza.During interrogation, Chandan confessed to the crime and added that after shooting the victims, he attempted to take his own life but the gun misfired. Failing in his suicide attempt, he fled the scene on his motorcycle, the police said.","Chandan Verma, 26, is accused of murdering a Dalit teacher and his family in Amethi. The encounter occurred while he was being taken to recover the pistol used in the crime. Chandan is out of danger and undergoing treatment at the local CHC.","https://static.toiimg.com/thumb/msid-113956352,imgsize-479815,width-400,height-225,resizemode-72/113956352.jpg"
Sean Diddy List: Names of celebrities connected to Sean Combs viral,https://timesofindia.indiatimes.com/world/us/diddy-list-names-of-celebrities-connected-to-sean-combs-viral/articleshow/113609942.cms,"No Hollywood A-lister has been implicated in the Sean Diddy trafficking case but several 'Diddy lists' are viral.

Like Epstein list, a list of names, all celebrities, with links to P Diddy and his Freak off sessions, are doing the rounds on social media. The alleged list contains names of Leonardo Dicaprio , Jay-Z, Beyoncé, Ashton Kutcher, Paris Hilton, Howard Stern, Russell Brand, Mariah Carey, Jennifer Lopez, Russell Simmons, Usher, Meghan Fox. The list goes viral as Usher, Pink deleted their X posts and theories that Justin Bieber might have been a victim of Diddy float around.Nobody has been implicated in the Sean Combs case so far.P Diddy is facing serious charges of sex trafficking and racketeering where he forced women to have sex with male prostitutes that continued for days as the entire action was caught on camera. Huge stocks of baby oil, drugs were found at Diddy's sex den while Diddy did not plead guilty to the charges.Usher who once stayed with Diddy said his X account got hacked and that's why all his past posts disappeared. This happened as his old statement in which said he witnessed wild things when he stayed with Diddy resurfaced.Apart from Usher and Pink, Megan Fox deleted all her posts on Instagram and X triggering speculations over how she was linked to Diddy.An old snipped of Khloe Kardashian claiming that she attended one of Diddy's naked parties emerged. ""I got on a plane at 5:30 am. Well this party...I think half the people there were butt naked,"" this is exactly what Khloe said about Diddy's party.Diddy was Justin Bieber's mentor but Bieber's spokesperson said he is trying not to focus on the charges and accusation of Diddy. Justin is in a happy bubble since he became a father.As the list of the Hollywood A-listers becomes long, they are maintaining absolute silence over Diddy's arrest.An officer involved in the raid on Diddy's home compared him to Jeffrey Epstein, stating that Diddy was part of the same social circle as Epstein and Harvey Weinstein. The officer claimed there were 15 years of wild parties, suggesting that while not everyone who attended was complicit in trafficking, they witnessed inappropriate behavior. He emphasized that many people knew what went on, especially as things became more explicit late at night.Also read on the Diddy case:","No Hollywood A-lister has been implicated in the Sean Diddy trafficking case but several 'Diddy lists' are viral. Usher, Pink deleted their X posts and theories that Justin Bieber might have been a victim of Diddy float around. P Diddy is facing serious charges of sex trafficking and racketeering where he forced women to have sex with male prostitutes.","https://static.toiimg.com/thumb/msid-113609937,imgsize-807324,width-400,resizemode-4/113609937.jpg"
"Seized vehicles, weapons used by Hamas in October 7 attack on display in Israel",https://timesofindia.indiatimes.com/world/middle-east/seized-vehicles-weapons-used-by-hamas-in-october-7-attack-on-display-in-israel/articleshow/113997244.cms,"Photo: X @IDF

IDF photo

The Israeli Defence Forces (IDF) organised an exhibition displaying items seized from the group on the first anniversary of the October 7 attacks by Hamas. The exhibit featured vehicles and equipment used by the thousands of Hamas-led militants who invaded southern Israel, according to an IDF statement.The display includes pickup trucks, motorcycles, tractors, uniforms, and intelligence materials seized during the operation.According to the IDF, approximately 70,000 pieces of enemy equipment have been confiscated since the start of the war, including around 1,250 anti-tank missiles, RPGs, and 4,500 explosive devices.In a post shared on X, the IDF commemorated the somber milestone, saying, “Marking one year since the deadly October 7 Massacre, the IDF has established an exhibition displaying the items seized from Hamas terrorists who invaded Israel on October 7, as well as during the combat in Gaza, to showcase them to the world.”The attacks on October 7, 2023, saw hundreds of Hamas militants infiltrate Israeli borders, resulting in over 1,200 deaths and more than 250 hostages taken.As of now, approximately 100 hostages remain in captivity. In response, Israel launched a major counteroffensive in Gaza, aiming to dismantle Hamas' military infrastructure.However, the rising civilian death toll in Gaza, especially among women and children, has sparked global humanitarian concerns about the conflict’s escalation.The Gaza health ministry reports that more than 35,000 Palestinians have been killed since the war began. The conflict has also expanded regionally, with Yemen’s Houthi rebels targeting Israel and other nations in the Red Sea, while Israel continues strikes against Hezbollah in Lebanon to counter further threats.As violence escalates, calls for a ceasefire and a hostages deal have intensified, with international leaders urging for a two-state solution as a path to lasting peace in the region.","The Israeli Defence Forces (IDF) organised an exhibition displaying items seized from the group on the first anniversary of the October 7 attacks by Hamas. The exhibit featured vehicles and equipment used by the thousands of Hamas-led militants who invaded southern Israel, according to an IDF statement.","https://static.toiimg.com/thumb/msid-113997612,imgsize-1650455,width-400,resizemode-4/113997612.jpg"
