Article Title,Article Link,Article Text,Article Summary,Article Image
Israeli strikes on Rafah claim 13 lives including 9 children as US advances aid package,https://timesofindia.indiatimes.com/world/middle-east/israeli-strikes-on-rafah-claim-13-lives-including-9-children-as-us-advances-aid-package/articleshow/109475562.cms,"NEW DELHI: Israeli airstrikes in Rafah, southern Gaza, claimed lives of 13 people, including nine children , according to health officials on Sunday.The airstrikes came as the United States is set to approve billions of dollars in additional military aid to Israel , its close ally, despite the ongoing conflict Israel has carried out air raids on Rafah almost daily, where more than half of Gaza's 2.3 million residents have sought refuge from the fighting elsewhere.It has also vowed to expand its ground offensive to the city on the border with Egypt despite international calls for restraint, including from the US.The first airstrike killed a man, his pregnant wife, and their 3-year-old child, according to the nearby Kuwaiti Hospital, which received the bodies. The doctors managed to save the baby. The second strike killed eight children and two women, all from the same family, according to hospital records. An airstrike in Rafah the night before killed nine people, including six children.Meanwhile, United States' House of Representatives approved a $26 billion aid package on Saturday that includes around $9 billion in humanitarian assistance for Gaza.The Israel-Hamas war has claimed the lives of over 34,000 Palestinians , according to local health officials, and has devastated Gaza's two largest cities, leaving a swath of destruction across the territory. Approximately 80% of the population have fled their homes to other parts of the besieged coastal enclave, which experts say is on the brink of famine.The conflict, now in its seventh month, has triggered regional unrest, pitting Israel and the US against Iran and allied militant groups across the Middle East. Earlier this month, Israel and Iran exchanged fire directly, heightening concerns of an all-out war between the long-time adversaries.According to the Palestinian Health Ministry, at least 469 Palestinians have been killed by Israeli soldiers and settlers in the West Bank since the start of the war in Gaza. Most have been killed during Israeli military arrest raids, which often trigger gunbattles, or in violent protests.The war in Gaza was triggered by an unprecedented Oct. 7 raid into southern Israel, in which Hamas and other militants killed around 1,200 people, mostly civilians, and abducted around 250 hostages. Israel claims that militants are still holding around 100 hostages and the remains of more than 30 others.According to the Gaza Health Ministry, the war has killed at least 34,049 Palestinians and wounded another 76,901. The ministry does not differentiate between combatants and civilians in its count but says at least two-thirds have been children and women. It also says the real toll is likely higher as many bodies are stuck beneath the rubble left by airstrikes or are in areas that are unreachable for medics.","The first airstrike killed a man, his pregnant wife, and their 3-year-old child. The second strike killed eight children and two women, all from the same family. An airstrike in Rafah the night before killed nine people, including six children.","https://static.toiimg.com/thumb/msid-109475738,imgsize-1173154,width-400,resizemode-4/109475738.jpg"
'Our tax dollars': Elon Musk on irony of US and Israel-Iran conflict,https://timesofindia.indiatimes.com/world/us/our-tax-dollars-elon-musk-on-irony-of-us-and-israel-iran-conflict/articleshow/109461598.cms,"History of F-14 Tomcats in Iran

Impact of the 1979 Islamic Revolution

NEW DELHI: Elon Musk , CEO of Tesla and SpaceX, has commented on Israel 's strike on an Iranian airbase, critiquing the irony of US funds being used to attack American-made aircraft in Iran. These aircraft, F-14 Tomcats , were sold to Iran during the Shah's regime before the 1979 Islamic Revolution.Last Friday's strike targeted Isfahan Airbase, home to the F-14 fleet, amidst escalating tensions between Israel and Iran.This military action follows a week after Iran's extensive assault on Israel using drones and missiles, a retaliation for what Tehran claims was an Israeli attack on its consulate in Damascus.The F-14s, discontinued in the US in 2006, have been a significant part of Iran's military history , notably during the Iran-Iraq War of the 1980s. Despite their age, these jets have struggled with maintenance issues due to the unavailability of spare parts.Musk highlighted the paradox of the situation on social media, saying, ""our tax dollars somehow also blowing up our tax dollars."" He also expressed a broader concern about global conflicts, suggesting a more peaceful and exploratory use of technology: ""we should send rockets not at each other, but rather to the stars.""Israel, a major recipient of US military aid, continues to be a pivotal American ally in the Middle East. This relationship includes significant financial assistance and collaborative defense projects like the Iron Dome and the F-35 fighter program. The US Congress is currently deliberating a foreign aid package that includes substantial aid for Israel, alongside aid for Ukraine and humanitarian efforts in Gaza.The F-14 Tomcat, a supersonic, twin-engine, two-seat, variable-sweep wing fighter aircraft, was introduced by the US Navy in the 1970s and became one of the most iconic jet fighters due to its advanced technology and unique capabilities. Iran's acquisition and use of the F-14 Tomcats is a unique chapter in military aviation history.Iran purchased F-14 Tomcats from the United States during the 1970s when the Shah of Iran, Mohammad Reza Pahlavi, was seeking to modernize the country's armed forces. The deal was part of the Shah's broader military expansion strategy, supported by the US, aimed at making Iran the dominant military power in the Gulf region. Iran received its first F-14s in 1976 and became the only country other than the United States to operate them.The 1979 Islamic Revolution marked a significant turning point for Iran's F-14 fleet. The overthrow of the Shah led to a new Islamic Republic government that was immediately subjected to international sanctions and embargoes. These restrictions severely impacted the maintenance and operational capability of the F-14s, as the US cut off military support and spare parts.Despite these challenges, Iran used its F-14s extensively during the Iran-Iraq War from 1980 to 1988. The aircraft were crucial in defending Iranian airspace against Iraqi air strikes and in conducting reconnaissance missions. The Tomcats achieved a number of aerial victories during the war. However, the lack of spare parts and maintenance support gradually eroded the operational effectiveness of the fleet.After the war, Iran faced ongoing challenges in keeping its F-14s airworthy due to the embargo on military parts. Ingeniously, Iran resorted to reverse engineering and domestic production of parts to maintain its fleet. Over the years, there have been reports of various upgrades to their avionics and armaments, integrating domestic and possibly foreign technology not originally part of the F-14s.Today, the F-14 remains a symbol of Iran's resilience in maintaining a complex weapons system under sanctions. Although their numbers have dwindled and their original capabilities might be degraded, the F-14s continue to be a significant part of Iran's air defense strategy.","Musk highlighted the paradox of the situation on social media, saying, ""our tax dollars somehow also blowing up our tax dollars."" He also expressed a broader concern about global conflicts, suggesting a more peaceful and exploratory use of technology. Iran's acquisition and use of the F-14 Tomcats is a unique chapter in military aviation history.","https://static.toiimg.com/thumb/msid-109461711,imgsize-15680,width-400,resizemode-4/109461711.jpg"
Chinese military drone spotted flying close to the Philippines ahead of BrahMos delivery from India,https://timesofindia.indiatimes.com/world/china/chinese-military-drone-spotted-flying-close-to-the-philippines-ahead-of-brahmos-delivery-from-india/articleshow/109461199.cms,"(With inputs from agencies)

NEW DELHI: A WZ-7 Soaring Dragon drone belonging to the Chinese People's Liberation Army was spotted flying in close proximity to the Philippines, ahead of preparations by the Southeast Asian country to receive the delivery of Indian BrahMos supersonic cruise missiles, The Eurasian Times reported.The drone's distinctive joined-wing shape caught the attention of Raffy Tima , a correspondent for Philippine news organization GMA News, as it traversed the skies over the West Philippine Sea.This sighting comes amidst escalating tensions between China and the Philippines over territorial disputes in the South China Sea , notably at the Second Thomas Shoal and Scarborough Shoal. The timing is particularly significant as the Philippines prepares to receive the delivery of Indian BrahMos supersonic cruise missiles, perceived as a strategic move to bolster defensive capabilities against China's assertiveness in the region.Procured under the 'Horizon 2' Priority Projects aimed at modernizing the Philippine armed forces, the BrahMos missile system arrived in Manila on April 19. The delivery, facilitated through a government-to-government (G2G) deal, includes three missile batteries, operator and maintainer training, and an Integrated Logistics Support (ILS) package.The coincidence of the WZ-7 drone sighting with the arrival of Indian transport planes carrying the BrahMos missiles raises eyebrows. This occurrence precedes the commencement of the 'Balikatan 2024' drills between the Philippines and the US.The WZ-7, operated by the People's Liberation Army Air Force (PLAAF) and People's Liberation Army Navy (PLAN), boasts a service ceiling of over 60,000 feet and a range of about 4,350 miles. Its sighting near the Philippines echoes previous instances of its presence near Taiwan amid tensions between China and the island.As military exercises loom, with activities including target ship sinking and island reclamation, the deployment of the new Typhon ground-based missile system by the US on the northern Philippine island of Luzon raises concerns for China.",A WZ-7 Soaring Dragon drone belonging to the Chinese People's Liberation Army was spotted flying in close proximity to the Philippines. The sighting comes amidst escalating tensions between China and the Philippines over territorial disputes in the South China Sea. The timing is particularly significant as the Philippines prepares to receive the delivery of Indian BrahMos supersonic cruise missiles.,"https://static.toiimg.com/thumb/msid-109461514,imgsize-715855,width-400,resizemode-4/109461514.jpg"
"China's US envoy urges cooperation, cites 'severe' challenges",https://timesofindia.indiatimes.com/world/us/chinas-us-envoy-urges-cooperation-cites-severe-challenges/articleshow/109476606.cms,"BEIJING: China's ambassador to the United States urged the two superpowers to cooperate on improving relations even as they ""face severe challenges"" on a range of issues.Beijing hopes to work with Washington so that relations can move forward on a stable, healthy and sustainable track, but the two must jointly establish a correct understanding, Xie Feng told a Harvard University forum, according to a statement released by the Chinese Embassy in Washington on Sunday.Secretary of State Antony Blinken will visit China from Wednesday for wide-ranging talks, including on the Middle East crisis , the Russia-Ukraine war and tensions in the South China Sea .""China does not gamble on the United States to lose, interfere in its internal affairs, or interfere in the U.S. election, and is willing to be a partner and friend with the United States,"" Xie told the conference.""If the United States continues to interfere in China's internal affairs and harm China's interests on issues related to Taiwan, Hong Kong, Xinjiang, Tibet, and the South China Sea, how can we maintain the bottom line of bilateral relations no matter how many 'guardrails' are set up?""Bilateral relations have been vexed in recent months over issues including trade, allegations of national security threats, confrontations in the South China Sea and Washington ramping up ties with Japan and Philippines, which Beijing labelled ""bloc politics"" and ""exclusive circles"".","Beijing hopes to work with Washington so that relations can move forward on a stable, healthy and sustainable track. Secretary of State Antony Blinken will visit China from Wednesday for wide-ranging talks. Bilateral relations have been vexed in recent months over issues including trade, allegations of national security threats.","https://static.toiimg.com/thumb/msid-109476582,imgsize-805315,width-400,resizemode-4/109476582.jpg"
"Two killed, 14 injured in Memphis block party shooting: Police",https://timesofindia.indiatimes.com/world/us/two-killed-14-injured-in-memphis-block-party-shooting-police/articleshow/109470807.cms,"(With inputs from agencies)

NEW DELHI: At least two were killed, with fourteen more sustaining injuries when gunfire erupted at an unauthorized block party in Memphis, on Saturday.Memphis police released a statement on X , stating, ""We learned during the follow-up investigation that there were 8 total victims, with two of those being deceased on the scene.""Law enforcement officers discovered five individuals suffering from bullet wounds.According to chief Cerelyn Davis, two male victims were declared died at the location, while three others were taken to nearby medical facilities in serious condition.At least two people are being sought, CBS News reported quoting Davis.""We believe there are at least two individuals that fired weapons during this incident,"" Davis stated to CBS News.Davis stated, ""In light of recent events, we stand together to denounce these senseless acts of violence.""Eleven more victims made their way to hospitals from the gathering in Orange Mound Park on their own. Davis mentioned that the event, which lacked an official city permit, had an estimated attendance of 200 to 300 people.""This was a block party that was occurring without a permit"", police said.","At least two were killed, with fourteen more sustaining injuries when gunfire erupted at an unauthorized block party in Memphis, on Saturday. The event lacked an official city permit, had an estimated attendance of 200 to 300 people. At least two people are being sought, police said.","https://static.toiimg.com/thumb/msid-109470850,imgsize-31480,width-400,resizemode-4/109470850.jpg"
"Siblings killed, multiple injured, as vehicle crashes into Michigan birthday party",https://timesofindia.indiatimes.com/world/us/siblings-killed-multiple-injured-as-vehicle-crashes-into-michigan-birthday-party/articleshow/109470507.cms,"(With inputs from agencies)

NEW DELHI: An 8-year-old girl and her 5-year-old brother were killed and several others were injured when a car crashed into a birthday party at the Swan Creek Boat Club in Michigan on Saturday.According to Monroe County Sheriff Troy Goodnough, a 66-year-old woman, suspected of driving under the influence, crashed her vehicle into a children's birthday party at the boat club, located approximately 30 miles south of Detroit.""The scene was described by the first responders as extremely chaotic, with high level of emotions of those directly involved and those who witnessed this horrific incident,"" Sheriff Goodnough stated.Two helicopters and ambulances transported three children and six adults to nearby hospitals with life-threatening injuries. Additional injured individuals received first aid at the scene, while some were taken to hospitals by private vehicles.The woman driving the vehicle, whose identity has not been disclosed, was taken into custody and is being held at the Monroe County Jail on suspicion of operating a motor vehicle while intoxicated causing death. She is cooperating with authorities, and additional charges are likely to be filed as the investigation progresses.Authorities were informed that the woman may have been at a nearby tavern prior to the incident, prompting them to close the establishment and plan to execute a search warrant as part of the ongoing investigation.",A 66-year-old woman is suspected of driving under the influence. She crashed her vehicle into a children's birthday party at the Swan Creek Boat Club. Three children and six adults were taken to hospitals with life-threatening injuries. The woman driving the vehicle was taken into custody.,"https://static.toiimg.com/thumb/msid-109470546,imgsize-1190264,width-400,resizemode-4/109470546.jpg"
"Trump cancels rally because of weather, proving the difficulty of balancing a trial and campaign",https://timesofindia.indiatimes.com/world/us/trump-cancels-rally-because-of-weather-proving-the-difficulty-of-balancing-a-trial-and-campaign/articleshow/109469080.cms,"WILMINGTON, NC: Donald Trump had to cancel his first planned rally since the start of his criminal hush money trial because of a storm Saturday evening in North Carolina , an added complication that highlights the difficulty the former president faces in juggling his legal troubles with his rematch against President Joe Biden.Trump called into the rally site near the Wilmington airport less than an hour before he was scheduled to take the stage and apologized to a few thousand supporters who had gathered throughout the afternoon under initially sunny skies that later darkened with storm clouds.Speaking from his private plane, Trump cited lightning and the incoming storm in explaining that he would not be landing. He pledged to reschedule a ""bigger and better"" event at the same location ""as quick as possible.""The planned rally in the critical battleground of North Carolina was to cap a week in which Trump spent four days in a Manhattan courtroom sitting silent during jury selection while Biden was able to hold multiple campaign events in Pennsylvania, another key state in the November election.The cancellation denied Trump a fresh chance to amplify claims that his multiple pending indictments are an establishment conspiracy to take him down - and, by extension, squelch the voters who first elected him eight years ago.Now, instead of commanding attention on his own terms at one of his signature mass rallies, his next public appearance is almost certainly going to be Monday, back at the defendant's table for opening arguments in the first felony trial ever for an American president. And his campaign is left to decide when he next can be Trump the candidate instead of Trump the defendant.""I'm devastated that this could happen but we want to keep everybody safe,"" Trump said.The assembled voters expressed frustrations with the turn of events but made clear they understood. Many of them had spent hours ahead of the rally holding prime seats, patronizing food trucks and perusing a row of tents selling Trump memorabilia, including T-shirts featuring the former president's mug shot taken in Atlanta after his indictment on charges that he led a criminal conspiracy to overturn Biden's 2020 victory.""I've been with Donald Trump and I'm still with Donald Trump, but I'm disappointed he didn't show up,"" said Cheryl Lynn Johnson, who drove about two hours from Myrtle Beach, South Carolina, to attend what would have been her fourth Trump rally. ""I'm mad at Mother Nature, but I stand behind Trump.""Indeed, the audience was primed to validate Trump's strategy to use his mandated court time to his advantage by folding the proceedings into the same populist, anti-establishment arguments that first fueled his rise eight years ago.""It's political persecution, and if it were anybody else he wouldn't have to be dealing with it,"" said Christian Armstrong, a 28-year-old firefighter who lives in Wilmington and was attending his first Trump rally.LeeAnn Coleman, a 42-year-old who is in a family restaurant business, said, ""It's ludicrous that he's having to do this at all,"" rather than spend time focusing on ""all the problems he wants to fix.""Those arguments could have come from Trump himself.""They want to keep me off the campaign trail,"" the candidate-turned-defendant insisted earlier this week in Harlem, where he visited a neighborhood convenience store and addressed a throng of media outside after spending the day at his own jury selection. Rather than pursue violent criminals, he alleged, ""They go after Trump.""It is not clear when Trump's next campaign appearance will be. His New York trial could last more than a month, severely curtailing his freedom to see voters, fundraise and make calls, and additional court proceedings could follow later in the year. Trump aides have promised weekend rallies and events on Wednesdays, the one weekday that Trump's hush money trial is expected to be in recess. The former president's campaign also has promised additional weeknight appearances around New York, like his trip to Harlem.But there is no accounting for weather . The closest Trump came to assigning responsibility for the cancellation was to mention ""weather officials,"" but he did not question the decision during his brief remarks.Even with the cancellation, Trump's choice of venue underscored the importance of North Carolina as a presidential battleground. Trump won here by less than 1.5 percentage points over Biden in 2020, the closest margin of any state Trump won. Saturday would have been the second time in as many months that Trump visited the state. Biden has traveled to North Carolina twice this year; Vice President Kamala Harris has been four times.""The presidential race is going to run through North Carolina,"" said Gov. Roy Cooper, a Democrat, in a recent interview.North Carolina is one of seven states that both the Trump and Biden campaigns have said they will dedicate significant campaign resources to winning. Trump has insisted he will widen the map, even into his native New York, which is heavily Democratic. Most Republicans, though, agree that Trump will have a difficult path to an Electoral College majority if Biden were to win North Carolina's 16 electoral votes. Trump tacitly acknowledged North Carolina's status by tapping then-state Republican Chairman Michael Whatley to lead his effective takeover of the Republican National Committee.Biden's campaign has hired statewide North Carolina leadership and field organizers for offices across the state. That's on top of state party staff that began an organizing program last year ahead of municipal races and looking to this year's statewide contests, which include an open governor's race. Cooper is legally barred from seeking a third term.""We needed to build energy on the ground early,"" said state Democratic Chairwoman Anderson Clayton, noting that the last Democratic presidential nominee to win North Carolina - Barack Obama in 2008 - had organized the state in a hotly contested primary campaign that ramped up the previous year.Matt Mercer, spokesman for the North Carolina Republican Party, countered that Republicans have had veteran staffers on the ground since 2020, and now have a ticket with Trump and Mark Robinson, the Republican nominee for governor, that excites the GOP base. Trump has endorsed Robinson, the state's first Black lieutenant governor, calling him ""Martin Luther King on steroids.""Robinson was set to be on stage with Trump in Wilmington.Ahead of the scheduled rally, Democrats hammered the pairing for their opposition to abortion rights, calling them too extreme for North Carolina.Cooper predicted Biden's record - low unemployment, rising wages, stabilized inflation, infrastructure and green energy investments - and his support for abortion rights will resonate with a geographically and demographically diverse state.""Joe Biden did more in his first two years than most presidents hope to do in two terms,"" Cooper argued.Mercer said Republicans will answer with a family-first message around the economy and public safety.""Whether it's with sky-high inflation, the open southern border or the migrant crime crisis,"" he said, voters are ""fed up"" with Biden.Trump lost an opportunity Saturday to make that case himself. But for voters like Matt Mazak, a 32-year-old who described himself as an independent, the verdict already is in.""I want someone who is not going to go with the flow of D.C.,"" Mazak said. ""I'm not even saying Trump is the right answer. But he's the best we've got.""","Donald Trump cancels his first planned rally since the start of his criminal hush money trial. Trump called into the rally site near the Wilmington airport less than an hour before he was scheduled to take the stage. Trump pledged to reschedule a ""bigger and better"" event at the same location ""as quick as possible""","https://static.toiimg.com/thumb/msid-109469102,imgsize-148516,width-400,resizemode-4/109469102.jpg"
