Article Title,Article Link,Article Text,Article Summary,Article Image
"Ensure peaceful Durga Puja, eminent Bangla citizens write to govt",https://timesofindia.indiatimes.com/india/ensure-peaceful-durga-puja-eminent-bangla-citizens-write-to-govt/articleshow/113996385.cms,"DHAKA: Amid concerns over security during Durga Puja, 40 eminent citizens of Bangladesh have urged the govt to take steps to ensure the Hindu community can celebrate its biggest festival peacefully. This year, Durga Puja is likely to be celebrated at 32,460 mandaps across Bangladesh.""We want to believe that the govt will take measures as per its commitment,"" they said in a statement issued on Saturday, and stressed that legal action should be taken against people attempting to create communal tension .They also urged citizens, irrespective of their caste and creed, to unitedly stand against miscreants trying to create communal tension. ""Some groups with vested interest often try to create disharmony during the festival, carrying out subversive activities. They are trying to create communal tensions by spreading anti-minority speeches on social media,"" the statement said.The Bangladesh army has made comprehensive preparations to ensure the safety of all during Durga Puja, said chief of army staff General Waker-Uz-Zaman during his visit to the Dhakeshwari National Temple, where he reviewed security measures . The interim govt has issued a set of instructions for the local administration and law enforcement agencies to maintain law and order during the festival. A monitoring committee will be formed, including students, to ensure security at puja mandaps.Meanwhile, the Sammilito Bhikkhu Sangha of the Chittagong Hill Tracts has announced not to celebrate the 'kothin chibor dan' - the main religious festival of the Buddhist community - this year citing ""lack of security and uncertainty."" Parbatya Bhikkhu Sangha president Shraddhalankar Mahathera said Sunday that the festival will not be organised at any monasteries in the CHT.","This year, Durga Puja is likely to be celebrated at 32,460 mandaps across Bangladesh. 40 eminent citizens of Bangladesh have urged the govt to take steps to ensure the Hindu community can celebrate its biggest festival peacefully. They urged citizens, irrespective of their caste and creed, to unitedly stand against miscreants trying to create communal tension.","https://static.toiimg.com/thumb/msid-113996391,imgsize-87451,width-400,resizemode-4/113996391.jpg"
"Man accused of stripping, killing woman lynched",https://timesofindia.indiatimes.com/india/man-accused-of-stripping-killing-woman-lynched/articleshow/113994186.cms,"EAST MIDNAPORE: A man in his late 50s was lynched in East Midnapore 's Patashpur on Sunday morning after villagers accused him of stripping a local woman and killing her by forcing her to ingest poison.Sukhchand Maity was dragged out of his home and beaten with sticks and bamboo poles. Police rescued him from the mob and took him to Egra Super Speciality Hospital, where he died.Maity's body was sent to Contai Sub-Divisional Hospital for an autopsy.No arrests have been made in either case.The woman's relatives claimed that she had gone to graze cattle in a field behind her house on Oct 4, when she was abducted by miscreants. The accused allegedly stripped her, forced poison into her mouth and fled.The woman was found naked and frothing from the mouth. She was taken to a local hospital in critical condition and later transferred to a private nursing home in Tamluk, where she died early on Sunday.A family member of the victim said Maity was a distant relative who lived nearby. The victim allegedly learnt of his illicit relationship with a neighbouring woman, and was threatened multiple times over this.ASP (Rural) of Contai, Shubhendra Kumar, said: ""According to the written complaint from the deceased woman's family, she was beaten and forced to consume poison after discovering the accused's illicit relationship. However, no allegation of rape has been made. A complaint has also been filed by the family of the accused who died from the beating by the mob. Both are being investigated separately.""Later in the day, the family of the woman refused to accept the body, stating that they were dissatisfied with the results of the postmortem. They plan to move Calcutta High Court on Monday, seeking a second autopsy.","Sukhchand Maity was dragged out of his home and beaten with sticks and bamboo poles. Police rescued him from the mob and took him to Egra Super Speciality Hospital, where he died. The woman's relatives claimed that she had gone to graze cattle in a field behind her house on Oct 4.","https://static.toiimg.com/thumb/msid-113994203,imgsize-906517,width-400,resizemode-4/113994203.jpg"
Four spectators dead after Chennai air show,https://timesofindia.indiatimes.com/india/four-spectators-dead-after-chennai-air-show/articleshow/113994152.cms,"CHENNAI: Four people died and over 90 were hospitalised for fainting and dehydration at an IAF airshow on Sunday at Chennai's Marina Beach, which was filled to capacity. About 15 lakh spectators turned up for the event, according to estimates, marking a record for an airshow.After the airshow ended, a large crowd attempted to leave all at once, creating a stampede-like situation.Exit points became congested, with people stuck for more than 40 minutes under the scorching sun. Desperate to escape, some attendees broke through barricades, and children suffered minor injuries in the chaos.Ambulances were trapped in the crowd for over 30 minutes, delaying the transport of the affected people to Rajiv Gandhi Government General Hospital (RGGGH) and Omandurar Government Hospital. Although around 50 ambulances were deployed, with 20 stationed along the beach road, navigating through the dense crowd proved challenging.Among the deceased was D John, 56, from Korukkupet, who attended the event with his wife, Elisamma, and brother-in-law, Shamkumar. After watching the show near Parthasarathy Temple Arch on Kamarajar Road, he collapsed around 3pm. An ambulance struggled to reach him through the crowd, but he was declared dead on arrival at Omandurar Hospital.Karthikeyan, 34, from Thiruvottiyur, experienced chest pain while riding his bike after leaving the event. He collapsed near INS Adyar and was rushed to RGGGH, where he was declared dead.""The cause of death can be determined after a postmortem. Heat stroke cannot be ruled out,"" RGGGH dead Dr E Theranirajan said. The other two victims were Srinivasan from Chromepet, who died while retrieving his bike from a parking lot after attending the show with his daughter, and Dinesh from Tambaram, who suffered a heart attack.Over 230 people were treated for fainting and dehydration, with 93 hospitalised at Omandurar and RGGGH. The intense heat and chaotic exit left many seeking relief.""It was suffocating; I had been stuck for over 40 minutes trying to get my mother, who uses a wheelchair, out,"" said S Sukshma. Mobile signal jammers hindered the coordination of rescue and medical efforts.","About 15 lakh spectators turned up for the event, according to estimates, marking a record for an airshow. After the airshow ended, a large crowd attempted to leave all at once, creating a stampede-like situation.Exit points became congested, with people stuck for more than 40 minutes.","https://static.toiimg.com/thumb/msid-113994202,imgsize-1999104,width-400,resizemode-4/113994202.jpg"
US presidential elections: Elon Musk’s mother Maye under fire for suggesting Republicans make '10 fake names' to vote,https://timesofindia.indiatimes.com/world/us/us-presidential-elections-elon-musks-mother-maye-under-fire-for-suggesting-republicans-make-10-fake-names-to-vote/articleshow/113986094.cms,"Elon Musk's mother, Maye Musk, faced backlash after suggesting people vote with fake names in the US elections, a statement that was widely criticised as promoting voter fraud. Her post, viewed over 2.5 million times, was condemned for being illegal, prompting users to alert the FBI and federal authorities.","Maye Musk suggested people vote with fake names in the US elections. Her post, viewed over 2.5 million times, was condemned for being illegal. It prompted users to alert the FBI and federal authorities. The statement was widely criticised as promoting voter fraud.","https://static.toiimg.com/thumb/msid-113986388,imgsize-781391,width-400,resizemode-4/113986388.jpg"
3 dead in Chennai after Indian Air Force air show,https://timesofindia.indiatimes.com/india/3-dead-in-chennai-after-indian-air-force-air-show/articleshow/113990828.cms,"(with inputs from agencies)

At least three spectators who went to watch the Indian Air Force 's air show in Chennai died on Sunday after the event. They were admitted to hospitals due to dehydration and other issues, but doctors said that the actual cause of death can only be determined after postmortem test results are available.Though the air show on the sandy Marina Beach was a big draw, several thousand of people who converged on the idyllic shore found it extremely arduous to return home after the event.At least three persons took ill and died, police said.The Lighthouse metro station nearby and the Chennai MRTS railway station at Velachery, which serves as the closest junction connecting Chintadripet near the Marina, were swarmed by several hundreds of people and many found it difficult to even get a foothold to stand on the platform.The bus stop at Anna Square, in close proximity to the aerial display venue, overflowed with people. ""Nearly a dozen people swooned on the Marina due to a near stampede-like situation and also because of the hot weather, and they were treated at a government facility,"" a senior police official said.According to media reports, a 56-year-old man named John was brought dead to Omandurar government hospital after attending the event in the afternoon.Omandurar Hospital dean Arvind said that the exact reason for the death, whether it was due to the heat, can only be determined after the post-mortem report is available. Around 30 people were admitted to the hospital in the evening following the air force show due to the impact of the heat.Most of them were discharged and sent back to their homes.Several other hospitals also reported numerous dehydration cases.Massive crowd had gathered at Marina Beach to witness the aerobatics but faced severe difficulties after the event concluded at 1 pm.The spectators attempted to exit simultaneously, resulting in chaos on roads and at metro and suburban stations. Trains at railway stations were overcrowded, with passengers crammed up to the gates of the boggies.Traffic near the Marina beach was restored nearly three hours after the air show by IAF aircraft concluded at 1 pm, a police official said.",At least three spectators who went to watch the Indian Air Force's air show in Chennai died on Sunday after the event. They were admitted to hospitals due to dehydration and other issues. Doctors said that the actual cause of death can only be determined after postmortem test results are available.,"https://static.toiimg.com/thumb/msid-113990826,imgsize-2252895,width-400,resizemode-4/113990826.jpg"
Dozens booked for pelting stones at police post in Saharanpur over remarks against Prophet Muhammad,https://timesofindia.indiatimes.com/india/dozens-booked-for-pelting-stones-at-police-post-in-saharanpur-over-remarks-against-prophet-muhammad/articleshow/113989444.cms,"Representative AI image (Pic credit: Canva)

SAHARANPUR : Police were put on alert on Sunday after some people who gathered to protest against priest Narsinghanand Saraswati 's remarks on Prophet Muhammad pelted stones at the Sheikhpura police post , officials said. A case has been registered against 21 named and 40-50 unknown individuals under various sections of the law for pelting stones, they said.A group of people took to the streets outside the police poist in Sheikhpura on Sunday to protest against Narasinghanand's remarks.Superintendent of Police (City) Abhimanyu Manglik said, ""The incident occurred when members of the Muslim community gathered at the Sheikhpura Qadeem post to submit a memorandum. Amid the crowd, some unruly elements began throwing stones at the police post, creating a tense situation in the area.""Police responded promptly, dispersing those involved in pelting stones and deployed additional police personnel to maintain order, he said.Manglik confirmed that no one was injured in the incident and that approximately a dozen individuals have been taken into custody.Police are now identifying the perpetrators through videos of the incident and have issued a high alert in the district.Two FIRs have already been registered against him -- one in Ghaziabad and another in Amravati, Maharashtra.His aides have claimed that Narsinghanand has been detained over allegations of making objectionable remarks against Prophet Muhammad during a programme held at Hindi Bhavan of Ghaziabad on September 29 and his whereabouts are not known.Police has not confirmed his detention yet.Heavy police deployment has been made outside the Dasna Devi temple in Ghaziabad where he resides to avoid any untoward incident.","A group of people took to the streets outside the police poist in Sheikhpura on Sunday to protest against Narasinghanand's remarks. Police responded promptly, dispersing those involved in pelting stones and deployed additional police personnel to maintain order. No one was injured in the incident and approximately a dozen individuals have been taken into custody.","https://static.toiimg.com/thumb/msid-113989453,imgsize-646100,width-400,resizemode-4/113989453.jpg"
Dinner with Kim Jong Un or George Soros? Jaishankar's 'navratri' reply goes viral,https://timesofindia.indiatimes.com/india/dinner-with-kim-jong-un-or-george-soros-jaishankars-navratri-reply-goes-viral/articleshow/113982903.cms,"(File photo)

Kim Jong Un या George Soros के साथ डिनर? विदेश मंत्री Jaishankar ने Navratri में व्रत का विकल्प चुना

NEW DELHI: External Affairs Minister Dr S Jaishankar , known for his sharp responses, once again displayed his sharp humour during a recent interaction.A reporter presented him with a choice, saying, ""I'll give you two options. You have to choose either of them. And you have to choose. There are no prizes for winning. So, the first question is: one person you wish to have dinner with—Kim Jong Un or George Soros ?""Jaishankar responded with a light-hearted quip: ""I think this is Navratri, and I'm fasting.""This exchange mirrors Jaishankar's past interactions, where he masterfully handled challenging questions.In one instance, when asked if the India-US relationship was ""volatile at best and bullying at worst,"" Jaishankar replied with humour, “So, you’re accusing me of bullying the US?” before offering a thoughtful explanation of the evolving relationship between the two nations, which drew applause from the audience.In another case, during a press briefing, a BBC reporter expressed concern over Prime Minister Narendra Modi’s warm interactions with Russian President Vladimir Putin. Jaishankar addressed the criticism calmly, highlighting cultural differences, saying, “In our part of the world, when people meet, they embrace. It may not be part of your culture, but I assure you it’s part of ours.”In 2023, The EAM had Jaishankar responded sharply to George Soros, who questioned India's democracy and Prime Minister Modi 's leadership. Jaishankar noted, “There are still people who believe their views must override everything else.”. He dismissed Soros's previous claims of citizenship stripping as “absurd” and labelled his comments as “scaremongering” that harms societal fabric. Jaishankar further described Soros as a “dangerous” outsider, likening his interference in Indian politics to colonialism.Jaishankar is set to visit Pakistan for the Shanghai Cooperation Organisation (SCO) meeting, which is scheduled for October 15 and 16."," External Affairs Minister Dr S Jaishankar once again displayed his sharp humour during a recent interaction. A reporter presented him with a choice, saying, ""I'll give you two options. You have to choose either of them. There are no prizes for winning"" He responded with light-hearted quip: ""I think this is Navratri, and I'm fasting.""","https://static.toiimg.com/thumb/msid-113982862,imgsize-1592176,width-400,resizemode-4/113982862.jpg"
"Mangaluru businessman sends distress message, goes missing; his BMW found abandoned",https://timesofindia.indiatimes.com/india/mangaluru-businessman-sends-distress-message-goes-missing-his-bmw-found-abandoned/articleshow/113993780.cms,"Karnataka: Businessman goes missing, damaged car found near Mangaluru's Kulur bridge

MANGALURU: A prominent Mangaluru businessman , BM Mumtaz Ali (52), who also helms an education group was reported missing, after he sent out a distress voice message on a family WhatsApp group. His partially damaged car was found on Kulur bridge early Sunday.Mangaluru city police, SDRF, Coast Guard and fire and emergency services personnel, have launched a search operation in the Phalguni river and other areas.His whereabouts are not known yet. A voice message from Ali landed in the family WhatsApp group at 3.30am Sunday. Ali allegedly held someone responsible for his predicament. His daughter saw the message around 4.40am and rushed to look for her father.On Kulur bridge on Kochi-Panvel NH 66, she found her father's BMW, with its bonnet damaged. Since her father was not in the car, a missing complaint was filed at the Kavoor police station. Mangaluru police commissioner Anupam Agrawal said they received information that a vehicle was found near Kulur bridge and that the person, reportedly missing, might have jumped from the bridge into the Phalguni river. Police are looking at all angles, including business rivalry and personal conflicts.","BM Mumtaz Ali (52), who also helms an education group was reported missing. His partially damaged car was found on Kulur bridge early Sunday. Ali allegedly held someone responsible for his predicament. Police are looking at all angles, including business rivalry and personal conflicts.","https://static.toiimg.com/thumb/msid-113993814,imgsize-45226,width-400,resizemode-4/113993814.jpg"
We don't have a magic wand to deliver instant justice: HC,https://timesofindia.indiatimes.com/india/we-dont-have-a-magic-wand-to-deliver-instant-justice-hc/articleshow/113993779.cms,"KOLKATA: Courts do not have a magic wand to provide instant justice , Calcutta HC observed Sunday while hearing a case related to murder and alleged rape of a nine-year-old in Bengal's Joynagar two days ago that sparked violent protests.Justice Tirthankar Ghosh made the observations during an emergency Sunday hearing, pointing out that the bigger problem faced by HCs and SC is that people want these institutions to punish those they believed are guilty.Ordering a magistrate-monitored postmortem at a central hospital as the Joynagar deceased's family had sought, Justice Ghosh stressed that justice is ""a step-by-step process"".""Courts work based on records before it; they have no personal links with the petitioner and defendants,"" the judge said. On Saturday, villagers of Mahismari in South 24 Parganas' Joynagar had clashed with cops and gone on a rampage after the girl's battered body was found in a ditch near her home. Cops arrested Mostakin Sardar, 19, of the village, on charges of murdering the Class 4 student. The girl had been missing since Friday when she left home for tuition.Justice Ghosh questioned the police's contention that it could not add sections of Pocso Act before postmortem report was ready, saying inquest findings were enough for it.He directed the cops to add Pocso sections and produce the accused before a Pocso court, not regular courts. The cops had moved HC for an urgent hearing to remove legal roadblocks to the postmortem.Acceding to demands of the victim's kin, police had moved a lower court, seeking presence of a magistrate during postmortem, but the plea was turned down. The parents also wanted the postmortem in a central facility. The state told the HC that it had no problem.He then ordered the postmortem at AIIMS Kalyani and asked police to hand over the body by 11.45am Monday.The judge said if AIIMS had the infrastructure, it could conduct the postmortem within its premises; otherwise, it could do so at the nearby state-run JNM Hospital Kalyani. If the procedure is carried out at the latter hospital, only AIIMs doctors would perform it, the judge directed. HC also asked ACJM of Baruipur, South 24 Parganas, to ""monitor"" the autopsy.(With inputs from Tamaghna Banerjee in Kolkata)","Justice Tirthankar Ghosh made the observations during an emergency Sunday hearing. On Saturday, villagers of Mahismari in South 24 Parganas' Joynagar had clashed with cops and gone on a rampage after the girl's battered body was found in a ditch. Cops arrested Mostakin Sardar, 19, on charges of murdering the Class 4 student.","https://static.toiimg.com/thumb/msid-113993791,imgsize-203632,width-400,resizemode-4/113993791.jpg"
Dhankhar warns against judiciary or legislature exercising executive authority,https://timesofindia.indiatimes.com/india/dhankhar-warns-against-judiciary-or-legislature-exercising-executive-authority/articleshow/113993776.cms,"NEW DELHI: Vice-President Jagdeep Dhankhar on Sunday said exercise of executive authority by either judiciary or legislature was not in consonance with democracy and constitutional prescriptions .He also said executive governance by the judiciary was ""jurisprudentially and jurisdictionally beyond constitutional sanctification"".Dhankhar appealed to intelligentsia and academia to catalyse a national discourse to ensure deference to constitutional essence by the three wings - executive, legislature and judiciary.""Undoubtedly, executive governance is exclusive to the executive, as are legislation to legislatures and verdicts to courts. Exercise of executive authority by either judiciary or legislature is not in consonance with democracy and constitutional prescriptions,"" Dhankhar said.He was speaking at a felicitation ceremony for veteran Congress member and former Jammu and Kashmir governor Karan Singh on the latter's completion of 75 years in public life.",Vice-President Jagdeep Dhankhar appealed to intelligentsia and academia to catalyse a national discourse. He was speaking at a felicitation ceremony for veteran Congress member and former Jammu and Kashmir governor Karan Singh on the latter's completion of 75 years in public life.,"https://static.toiimg.com/thumb/msid-113993830,imgsize-46792,width-400,resizemode-4/113993830.jpg"
3 minors among 7 of family killed in early morning Mumbai slum fire,https://timesofindia.indiatimes.com/india/3-minors-among-7-of-family-killed-in-early-morning-mumbai-slum-fire/articleshow/113993749.cms,"MUMBAI: A fire in Siddharth Colony , a slum in Chembur (E), early Sunday killed 7 members of a family, including 3 minors, while 2 others sustained minor injuries. It erupted at 5am, tearing through their ground-plus-two home, sparing only family head Chedilal Gupta and one of his two sons, Dharamdev. The fire was extinguished hours later, at 9.15am.Chedilal's wife Gitadevi was sleeping on the ground floor, which houses a grocery shop with kerosene and other items.Locals believe a lit diya on the floor may have sparked the fire, with kerosene fuelling it.Mumbai frequently witnesses blazes in informal housing settlements and narrow lanes which make entry for fire brigade difficult.In the first 7 months of this year, the city has had 3,197 fire incidents - with fire brigade data showing that 70% incidents occurred due to an electrical fault - resulting in 8 deaths and 112 injuries.The smell of kerosene lingered at the site. Assistant municipal commissioner for M-West ward Vishwas Mote said the ""exact cause"" of the blaze is under investigation. ""There was a stock of palm oil in the house as well, that rescue teams came across.""The fire brigade said three people were rescued from the first floor with a ladder and taken to Zen Hospital in an ambulance, before being shifted to Rajawadi Hospital. Four persons were rescued from the second floor after a forced entry from an adjacent building.","A fire in Siddharth Colony, a slum in Chembur (E), early Sunday killed 7 members of a family, including 3 minors. Locals believe a lit diya on the floor may have sparked the fire, with kerosene fuelling it. The fire was extinguished hours later, at 9.15am.","https://static.toiimg.com/thumb/msid-113993756,imgsize-27086,width-400,resizemode-4/113993756.jpg"
