Article Title,Article Link,Article Text,Article Summary,Article Image
Blinken will be the latest top US official to visit China in a bid to keep ties on an even keel,https://timesofindia.indiatimes.com/world/us/blinken-will-be-the-latest-top-us-official-to-visit-china-in-a-bid-to-keep-ties-on-an-even-keel/articleshow/109468949.cms,"WASHINGTON: Secretary of State Antony Blinken will travel to China this coming week as Washington and Beijing try to keep ties on an even keel despite major differences on issues from the path to peace in the Middle East to the supply of synthetic opioids that have heightened fears over global stability.The rivals are at odds on numerous fronts, including Russia's war in Ukraine, Taiwan and the South China Sea, North Korea, Hong Kong, human rights and the detention of American citizens.The United States and China also are battling over trade and commerce issues , with President Joe Biden announcing new tariffs on imports of Chinese steel this past week.The State Department said Saturday that Blinken, on his second visit to China in less than a year, will travel to Shanghai and Beijing starting Wednesday for three days of meetings with senior Chinese officials, including Foreign Minister Wang Yi. Talks between Blinken and Chinese President Xi Jinping are expected, although neither side will confirm such a meeting is happening until shortly before it takes place.The department said in a statement that Blinken would ""discuss a range of bilateral, regional, and global issues,"" including the Middle East, the war in Ukraine, the South China Sea and the Taiwan Strait.He will also talk about progress made in ""resuming counternarcotics cooperation, military-to-military communication, artificial intelligence, and strengthening people-to-people ties"" and will reaffirm how important it is for the US and China to be ""responsibly managing competition, even in areas where our two countries disagree,"" State Department spokesman Matthew Miller said.The trip follows a phone call this month between Biden and Xi in which they pledged to keep high-level contacts open, something they had agreed to last year at a face-to-face summit in California. Since that call, Treasury Secretary Janet Yellen has visited China and Defense Secretary Lloyd Austin has spoken by phone with his Chinese counterpart. Meetings at lower levels also have taken place.Despite those encounters, relations are rocky. The US has recently become more vocal in its calls for China to stop supporting Russia's military-industrial sector, which Washington says has allowed Moscow to boost weapons production to support the war against Ukraine.""We see China sharing machine tools, semiconductors, other dual-use items that have helped Russia rebuild the defense industrial base that sanctions and export controls had done so much to degrade,"" Blinken said Friday. ""Now, if China purports on the one hand to want good relations with Europe and other countries, it can't on the other hand be fueling what is the biggest threat to European security since the end of the Cold War.""Blinken also has pushed for China to take a more active stance in pressing Iran not to escalate tensions in the Middle East. He has spoken to his Chinese counterpart several times since the Israel-Hamas war began six months ago as he has sought China's help in getting Iran to restrain proxy groups it has supported, armed and funded in the region.That topic has taken on new urgency since direct back-and-forth attacks by Iran and Israel on each other's soil in the past week.Also high on the agenda for Blinken will be Taiwan and the South China Sea.The US has strongly condemned Chinese military exercises threatening Taiwan, which Beijing regards as a renegade province and vowed to reunify with the mainland by force if necessary. Successive US administrations have steadily ramped up military support and sales for Taipei, much to the anger of Chinese officials.In the South China Sea, the US and others have become increasingly concerned by provocative Chinese actions in and around disputed areas. In particular, the US has voiced objections to what it says are Chinese attempts to thwart legitimate activities by others in the waterway, notably the Philippines and Vietnam.That was a major topic of concern earlier this month when Biden held a three-way summit with the prime minister of Japan and the president of the Philippines.","Secretary of State Antony Blinken will travel to Shanghai and Beijing starting Wednesday. Talks between Blinken and Chinese President Xi Jinping are expected. The rivals are at odds on numerous fronts, including Russia's war in Ukraine, Taiwan and the South China Sea. The United States and China are battling over trade and commerce issues.","https://static.toiimg.com/thumb/msid-109468958,imgsize-989633,width-400,resizemode-4/109468958.jpg"
Senate passes reauthorization of key US surveillance program just after midnight deadline,https://timesofindia.indiatimes.com/world/us/senate-passes-reauthorization-of-key-us-surveillance-program-just-after-a-midnight-deadline/articleshow/109468862.cms,"WASHINGTON: Barely missing its midnight deadline , the Senate voted early Saturday to reauthorize a key US surveillance law after divisions over whether the FBI should be restricted from using the program to search for Americans' data nearly forced the statute to lapse.The legislation approved 60-34 with bipartisan support would extend for two years the program known as Section 702 of the Foreign Intelligence Surveillance Act.It now goes to President Joe Biden's desk to become law. White House national security adviser Jake Sullivan said Biden ""will swiftly sign the bill.""""In the nick of time, we are reauthorizing FISA right before it expires at midnight,"" Senate Majority Leader Chuck Schumer said when voting on final passage began 15 minutes before the deadline. ""All day long, we persisted and we persisted in trying to reach a breakthrough and in the end, we have succeeded.""US officials have said the surveillance tool, first authorized in 2008 and renewed several times since then, is crucial in disrupting terror attacks, cyber intrusions, and foreign espionage and has also produced intelligence that the US has relied on for specific operations, such as the 2022 killing of al-Qaida leader Ayman al-Zawahri.""If you miss a key piece of intelligence, you may miss some event overseas or put troops in harm's way,"" Sen. Marco Rubio, the top Republican on the Senate Intelligence Committee, said. ""You may miss a plot to harm the country here, domestically, or somewhere else. So in this particular case, there's real-life implications.""The proposal would renew the program, which permits the US government to collect without a warrant the communications of non-Americans located outside the country to gather foreign intelligence. The reauthorization faced a long and bumpy road to final passage Friday after months of clashes between privacy advocates and national security hawks pushed consideration of the legislation to the brink of expiration.Though the spy program was technically set to expire at midnight, the Biden administration had said it expected its authority to collect intelligence to remain operational for at least another year, thanks to an opinion earlier this month from the Foreign Intelligence Surveillance Court, which receives surveillance applications.Still, officials had said that court approval shouldn't be a substitute for congressional authorization, especially since communications companies could cease cooperation with the government if the program is allowed to lapse.Hours before the law was set to expire, US officials were already scrambling after two major US communication providers said they would stop complying with orders through the surveillance program, according to a person familiar with the matter, who spoke on the condition of anonymity to discuss private negotiations.Attorney General Merrick Garland praised the reauthorization and reiterated how ""indispensable"" the tool is to the Justice Department.""This reauthorization of Section 702 gives the United States the authority to continue to collect foreign intelligence information about non-US persons located outside the United States, while at the same time codifying important reforms the Justice Department has adopted to ensure the protection of Americans' privacy and civil liberties,"" Garland said in a statement Saturday.But despite the Biden administration's urging and classified briefings to senators this week on the crucial role they say the spy program plays in protecting national security, a group of progressive and conservative lawmakers who were agitating for further changes had refused to accept the version of the bill the House sent over last week.The lawmakers had demanded that Majority Leader Chuck Schumer allow votes on amendments to the legislation that would seek to address what they see as civil liberty loopholes in the bill. In the end, Schumer was able to cut a deal that would allow critics to receive floor votes on their amendments in exchange for speeding up the process for passage.The six amendments ultimately failed to garner the necessary support on the floor to be included in the final passage.One of the major changes detractors had proposed centered around restricting the FBI's access to information about Americans through the program. Though the surveillance tool only targets non-Americans in other countries, it also collects communications of Americans when they are in contact with those targeted foreigners. Senator Dick Durbin, the No. 2 Democrat in the chamber, had been pushing a proposal that would require US officials to get a warrant before accessing American communications.""If the government wants to spy on my private communications or the private communications of any American, they should be required to get approval from a judge, just as our Founding Fathers intended in writing the Constitution,"" Durbin said.In the past year, US officials have revealed a series of abuses and mistakes by FBI analysts in improperly querying the intelligence repository for information about Americans or others in the US, including a member of Congress and participants in the racial justice protests of 2020 and the January 6, 2021, riot at the US Capitol.But members on both the House and Senate intelligence committees as well as the Justice Department warned requiring a warrant would severely handicap officials from quickly responding to imminent national security threats.""I think that is a risk that we cannot afford to take with the vast array of challenges our nation faces around the world,"" Democratic Senator Mark Warner, chair of the Senate Intelligence Committee, said Friday.","White House national security adviser Jake Sullivan says Biden ""will swiftly sign the bill"" The legislation approved 60-34 with bipartisan support would extend for two years the program. It now goes to President Joe Biden's desk to become law. US officials have said the surveillance tool is crucial in disrupting terror attacks, cyber intrusions.","https://static.toiimg.com/thumb/msid-109468891,imgsize-1024073,width-400,resizemode-4/109468891.jpg"
Man who set himself on fire outside Trump trial in New York dies,https://timesofindia.indiatimes.com/world/us/man-who-set-himself-on-fire-outside-trump-trial-in-new-york-dies/articleshow/109468847.cms,"NEW YORK: A man has died after setting himself on fire on Friday outside the New York courthouse where Donald Trump 's historic hush-money trial was taking place as jury selection wrapped up, but officials said he did not appear to have been targeting Trump.The man burned for several minutes in full view of television cameras that were set up outside the courthouse, where the first-ever criminal trial of a former US president is being held.An NYPD spokesperson said the man was declared dead overnight at a hospital. Officials had previously said he was in critical condition.Witnesses said the man, who was in his 30s, pulled pamphlets from a backpack and threw them in the air before he doused himself with a liquid and set himself on fire. One of those pamphlets included references to ""evil billionaires"". The NYPD said the man, who they identified as Max Azzarello of St. Augustine, Florida, did not appear to be targeting Trump or others involved in the trial.In an online manifesto, a man using that name said he set himself on fire and apologized to friends, witnesses and first responders. The post warns of ""an apocalyptic fascist coup"" and criticizes cryptocurrency and U.S. politicians, but does not single out Trump in particular.","The man burned for several minutes in full view of television cameras that were set up outside the courthouse. The NYPD said the man, who they identified as Max Azzarello of St. Augustine, Florida, did not appear to be targeting Trump.","https://static.toiimg.com/thumb/msid-109468858,imgsize-1044984,width-400,resizemode-4/109468858.jpg"
"Ukraine, Israel, TikTok: The massive aid package before US Congress",https://timesofindia.indiatimes.com/world/us/ukraine-israel-tiktok-the-massive-aid-package-before-us-congress/articleshow/109468842.cms,"Ukraine

Israel

Taiwan, TikTok

WASHINGTON: The US House of Representatives on Saturday approved a giant aid package for Ukraine , Israel and Taiwan and a bill threatening to ban TikTok.Here is a breakdown of the $95 billion package, which now moves to the Senate, where it could be taken up as early as Tuesday.The majority of funds in the package, nearly $61 billion, are earmarked for Ukraine's war effort against the Russian invasion.President Volodymyr Zelensky has been pleading for this money for months, warning that ""if Congress does not help Ukraine, Ukraine will lose the war.""Washington is Kyiv's main military supporter, but Congress has not passed a major aid package for its ally since December 2022 due to partisan squabbling.The bill passed Saturday would provide nearly $14 billion to train, equip and finance the needs of the Ukrainian army.Ukraine would also receive $10 billion in ""forgivable loans"" for vital economic and budgetary support, including for the energy and infrastructure sectors.The idea of a loan, rather than a grant, was suggested by former president Donald Trump, who believes the United States should stop handing out money without any payback. A ""forgivable loan"" can be partly or fully forgiven or deferred under certain conditions.A large chunk of this money will also go to replenishing US military stockpiles.The bill also authorizes the US president to confiscate and sell Russian assets in order to finance the reconstruction of Ukraine, an idea that is also gaining traction with other G7 countries.The United States' historic ally Israel will receive $13 billion in military assistance as it fights Hamas militants in the Gaza Strip.These funds will be used in particular to strengthen Israel's Iron Dome air defense system.More than $9 billion will be spent to address ""the dire need for humanitarian assistance for Gaza as well as other vulnerable populations around the world.""The measure, however, would prohibit any direct US funding of the UN crisis-hit Palestinian refugee agency (UNRWA). Israel has accused some of the agency employees in Gaza of involvement in the shocking October 7 attack on southern Israel by Hamas, which triggered the war.The bill would provide some $8 billion to counter China through investment in submarine infrastructure and boosting competition with Chinese projects in developing countries.The bill also earmarks several billion dollars in weapons funding for Taiwan, a self-ruled island that is claimed by China.Another bill passed Saturday would force TikTok to divest from its Chinese parent company ByteDance or face a nationwide ban in the United States.American officials have voiced alarm over the popularity of TikTok with young people, alleging that it is subservient to Beijing and a conduit to spread propaganda, claims denied by the company and Beijing.","US House approves $95 billion aid package for Ukraine, Israel and Taiwan. Majority of funds earmarked for Ukraine's war effort against the Russian invasion. Israel will receive $13 billion in military assistance as it fights Hamas militants in the Gaza Strip.","https://static.toiimg.com/thumb/msid-109468853,imgsize-1030958,width-400,resizemode-4/109468853.jpg"
"US House passes bill that could ban TikTok, approves aid to Israel, Ukraine, bolster Taiwan",https://timesofindia.indiatimes.com/world/us/us-house-passes-bill-that-could-ban-tiktok-approves-aid-to-israel-ukraine-bolster-taiwan/articleshow/109464964.cms,"(With inputs from agencies)

NEW DELHI: The House of Representatives has approved legislation that would ban TikTok in the United States unless its Chinese owner sells its stake in the company within a year. The inclusion of TikTok in a broader foreign aid package by House Republicans, which is a priority for President Joe Biden and has widespread congressional support for countries like Ukraine and Israel, accelerated the process of the ban.The initial version of the bill had faced a roadblock in the Senate before this move.Earlier, a standalone bill with a six-month deadline for selling TikTok had received overwhelming bipartisan support in the House back in March. Both Democrats and Republicans had expressed concerns about national security due to the app's ownership by the Chinese tech company ByteDance Ltd. The revised legislation will now head to the Senate.Even if the bill is enacted into law, ByteDance would still have up to a year to find a buyer and is likely to challenge the law in court, arguing that it infringes on the First Amendment rights of its millions of users.ByteDance has vehemently opposed the legislation and urged its 170 million US users, many of whom are young, to contact Congress and voice their opposition. However, this pushback has not been well-received by lawmakers on Capitol Hill, who are deeply concerned about Chinese threats to the United States and have limited presence on the platform themselves.The House also passed provisions to support Ukraine, strengthen Taiwan, and approved a significant amount of military aid to Israel. These bills received strong bipartisan backing during a rare Saturday session, although they have raised questions about the future of House Speaker Mike Johnson as he faces challenges from right-wing critics.The aid for Israel comes as the country is engaged in a conflict with Hamas despite international concerns for civilian well-being in Gaza. The bill, set to be taken up by the Senate soon, primarily focuses on bolstering Israel's Iron Dome air defense system.Ukraine's President Volodymyr Zelenskyy expressed gratitude for the long-awaited aid package, emphasizing the lifesaving impact it would have. The bills are the result of contentious negotiations, pressure from US allies, and repeated appeals for assistance from Zelenskyy. The funding for Ukraine has been a point of contention in Congress, with disagreements between parties delaying approval for over a year.President Biden and Democratic lawmakers have been advocating for substantial military support for Ukraine, while Republicans, influenced by former President Donald Trump, have been hesitant to allocate funds for the conflict. The recent $61 billion package for Ukraine, which includes economic aid and weapons support, has finally garnered support from Speaker Johnson after much deliberation.The bill also enables the confiscation and sale of Russian assets to provide further financial assistance to Ukraine for reconstruction, a move endorsed by other G7 nations. Senate Democratic Leader Chuck Schumer indicated that the bill could be taken up for consideration as early as Tuesday.",The House of Representatives has approved legislation that would ban TikTok in the United States unless its Chinese owner sells its stake in the company within a year. Both Democrats and Republicans had expressed concerns about national security due to the app's ownership by the Chinese tech company ByteDance Ltd. The revised legislation will now head to the Senate.,"https://static.toiimg.com/thumb/msid-109464981,imgsize-587702,width-400,resizemode-4/109464981.jpg"
US sanctions on Chinese firms for Pakistan missile inputs,https://timesofindia.indiatimes.com/world/us/us-sanctions-on-chinese-firms-for-pakistan-missile-inputs/articleshow/109464744.cms,"ISLAMABAD: US has imposed sanctions on three Chinese and one Belarus company over alleged supply of inputs for Pakistan’s ballistic missile programme. The move, Washington stressed, is intended not to punish but to bring about a “positive change in behaviour”.According to a US State Department announcement on Friday, the four firms are Belarus’s Minsk Wheel Tractor Plant, and China’s Xi’an Longde Technology Development Company Ltd, Tianjin Creative Source International Trade Co Ltd, and Granpect Company Ltd.“All property of the designated entities in the US or under the control of US persons are now blocked. Furthermore, any individuals or entities with ownership, directly or indirectly, of 50% or more by the designated persons are also subject to these sanctions,” read a statement by the State Department, adding these entities supplied items even for Pakistan’s long-range missiles.Islamabad appeared to shrug off the action, saying such “listings of commercial entities have taken place in the past as well on allegations of links to its missile programme without sharing any evidence whatsoever”.“While we are not aware of the specifics of the latest measures by the US, in the past we have come across many instances where listings have been made on mere suspicion or even when the involved items were not on any control lists but were deemed sensitive under catch-all provisions,” read a statement issued by Pakistan’s foreign office.The US State Department statement detailed the alleged inputs from the four firms. Belarus’s Minsk plant supplied special vehicle chassis. Such chassis, the US claimed, are used as launch-support equipment by Pakistan’s National Development Complex (NDC), which develops Missile Technology Control Regime Category (MTCR) I ballistic missiles.China’s Xi’an Longde Technology allegedly supplied a filament-winding machine, adding these can be used to produce rocket motor cases, the US said. Tianjin Creative Trade Co. Ltd. shipped stir-welding equipment. The supplies were likely destined for Pakistan’s Space and Upper Atmosphere Research Commission (SUPARCO), which develops and produces Pakistan’s MTCR Category I ballistic missiles, the US said.Granpect Company worked with SUPARCO to supply equipment for the testing of large-diameter rocket motors to NDC, the State Department added.Islamabad defended such procurements. “Such items have legitimate civil commercial uses. Pakistan has always been ready to discuss end-use and end-user verification mechanisms so that legitimate commercial users are not hurt by discriminatory application of export controls,” the foreign office said in its statement.Pakistan also insinuated double standards in such sanctions. “The same jurisdictions, which claim to exercise strict non-proliferation controls, have waived licensing requirements for advanced military technologies for some countries... leading to arms build-up,” the statement added.","US imposes sanctions on three Chinese and one Belarus company over alleged supply of inputs for Pakistan’s ballistic missile programme. Islamabad shrugs off action, saying such “listings of commercial entities have taken place in the past as well on allegations of links to its missile programme without sharing any evidence whatsoever”","https://static.toiimg.com/thumb/msid-109464806,imgsize-189131,width-400,resizemode-4/109464806.jpg"
"Landmine explosion in Pakistan's Khyber Pakhtunkhwa province kills one minor, injures two",https://timesofindia.indiatimes.com/world/pakistan/landmine-explosion-in-pakistans-khyber-pakhtunkhwa-province-kills-one-minor-injures-two/articleshow/109474145.cms,"with input from agencies)

NEW DELHI: A landmine explosion in Pakistan 's restive Khyber Pakhtunkhwa province bordering Afghanistan on Sunday left at least two minors and one injured. One of the boys stepped on the landmine inadvertently while searching for wild mushrooms in the nearby Tirah Valley mountains in the tribal Khyber district, according to media reports quoting police sources.One minor was found deceased while another succumbed to his injuries and is treated in the hospital.Another 16-year-old boy, who sustained critical injuries in the blast, is also receiving treatment at the hospital.An investigation has been launched into the incident.Scenic Tirah Valley is heavily mined due to its proximity to the Afghan border.The movement of tribesmen on both sides of the Afghan border continues unabated daily.The lush green valley remained a hotbed of Taliban since the emergence of the group and the local administration usually remained ineffective in maintaining law and order in Tirah.The valley administration usually seeks local tribesmen's support in resolving matters.",A landmine explosion in Pakistan's restive Khyber Pakhtunkhwa province bordering Afghanistan on Sunday left at least two minors and one injured. One of the boys stepped on the landmine inadvertently while searching for wild mushrooms in the nearby Tirah Valley mountains.,"https://static.toiimg.com/thumb/msid-109474409,imgsize-24302,width-400,resizemode-4/109474409.jpg"
