Article Title,Article Link,Article Text,Article Summary,Article Image
"One frontier corps soldier, two government officials killed in separate terror incidents in Pakistan's KPK",https://timesofindia.indiatimes.com/world/pakistan/one-frontier-corps-soldier-two-government-officials-killed-in-separate-terror-incidents-in-pakistans-kpk/articleshow/109471719.cms,"PESHAWAR: At least one Frontier Corps soldier and two government officials were killed by unknown men riding on motorbikes in two different terror-related incidents in the restive Khyber Pakhtunkhwa province of northwestern Pakistan on Sunday, the police said. Both incidents occurred in Dera Ismail Khan District of the province, the police said.The attacks on security personnel in southern districts of the province have increased manifold in the last couple of months.In the other incident, gunmen ambushed a government vehicle killed two officials and injured two other Custom Intelligence Department officials at Yarak Toll Plaza in the district.The killers in both cases managed to flee from the scene, a police official said.No group claimed responsibility for any of the attacks, the official said, adding that the police have registered two separate cases and began investigating the incidents.This was the second attack on a customs intelligence vehicle in the last four days.In an earlier attack, five customs officials were gunned down by unknown gunmen in the district.","At least one Frontier Corps soldier and two government officials were killed by unknown men riding on motorbikes in two different terror-related incidents. Both incidents occurred in Dera Ismail Khan District of the province, the police said. The attacks on security personnel in southern districts have increased manifold in the last couple of months.","https://static.toiimg.com/thumb/msid-109471834,imgsize-811335,width-400,resizemode-4/109471834.jpg"
13 new deaths in Pakistan's Khyber Pakhtunkhwa due to heavy rain; toll rises to 59,https://timesofindia.indiatimes.com/world/pakistan/13-new-deaths-in-pakistans-khyber-pakhtunkhwa-due-to-heavy-rain-toll-rises-to-59/articleshow/109470652.cms,"NEW DELHI: At least 13 people died on Saturday from a second spell of heavy rain in Pakistan 's Khyber Pakhtunkhwa (KP) taking the death toll to 59, Dawn reported citing Provincial Disaster Management Authority ( PDMA ) report.KP has been witnessing heavy rains since April 12 leading to landslides and house collapses across the region.According to a KP PDMA report issued on Saturday, 33 children, 14 adults, and 12 women have died in rain-related incidents since April 12, with 72 persons injured.Furthermore, 2,883 houses and 68 schools have been damaged, and 309 animals have died, as per the report.Rs 110 million had been provided to districts for emergency aid, while Rs 90 million was distributed to tribal areas to continue relief efforts, a PDMA official informed.The Pakistan Meteorological Department (PMD) on Tuesday predicted further rain across the country, which would last until April 22, as ""another strong westerly wave"" is expected to approach western Pakistan.It has further predicted ""rain-windstorm/thunderstorm (few heavy, with isolated very heavy falls) with snowfall over high mountains"" in places such as Shangla, Buner, Bajaur, Khyber, and Peshawar from Wednesday night to April 21.Meanwhile, normal weather conditions have been reported in Balochistan, PDMA informed in a post on X.","KP has been witnessing heavy rains since April 12 leading to landslides and house collapses. 33 children, 14 adults, and 12 women have died in rain-related incidents. 72 persons injured. 2,883 houses and 68 schools have been damaged, and 309 animals have died.","https://static.toiimg.com/thumb/msid-109470873,imgsize-1144125,width-400,resizemode-4/109470873.jpg"
"Pakistan: No evidence of Bushra Bibi being poisoned, say doctors",https://timesofindia.indiatimes.com/world/pakistan/pakistan-no-evidence-of-bushra-bibi-being-poisoned-say-doctors/articleshow/109470782.cms,"ISLAMABAD: Following Pakistan PM Imran Khan allegations that his wife, Bushra Bibi who is serving time in jail was given food mixed with ""toilet cleaner,"" the Islamabad accountability court ordered a medical examination , in which doctors have given Bushra Bibi a clean chit of health, Geo News reported.The medical examination was done in the presence of Pakistan Tehreek-e-Insaf's (PTI) founder's trusted family physician.During her examination, the former first lady stayed at a private hospital in Islamabad for six hours for diagnostic tests, including endoscopy.Further, the hospital sources stated that Bushra Bibi underwent, ultrasound, ECHO, and ECG tests, while during the check-up, Imran Khan's physician, Dr Asim Yousuf, was also present, as per Geo News.As per the sources, the doctors cleared all the medical reports of the former first lady.The hospital sources said that Bushra Bibi only had a minor gastric issue.""The former first lady refused to undergo a blood test and did not provide a blood sample,"" the sources said, adding her denial to provide a blood sample would be mentioned in the final report, and the reports provided to Dr Asim, the jail superintendent, and the Pakistan Institute of Medical Sciences (PIMS), Geo News reportedOn April 15, Bushra Bibi moved the Islamabad High Court (IHC), urging the court to arrange for her medical examination and tests at Shaukat Khanum Hospital or another private hospital of her preference to investigate whether she was served poisoned/tainted food.Following this, the Islamabad accountability court accepted her requests for a medical examination on Saturday and directed Bushra Bibi's endoscopy in a private hospital within two days.Bushra Bibi claimed in her petition that she was suffering from heartburn, that her throat and mouth hurt and that she believed it was caused by the poisonous meals served to her.She claimed that she was subjected to psychological torture at the Banigala sub-jail.While speaking to Judge Nasir Javed Rana during the April 20 hearing of the £190 million corruption case at Rawalpindi's Adiala Jail, former PakistPrime Minister Imran Khan highlighted that extra walls had been installed in the courtroom, creating an atmosphere resembling a closed court, where he previously raised the issue that his wife Bushra Bibi is given poisonous food.Responding to this, the judge instructed the jail administration to promptly remove the additional barriers.Following the directive, the jail administration swiftly complied, removing the barriers without delay. As a result, the hearing was adjourned for an hour to ensure an appropriate courtroom setting.","Imran Khan's wife, Bushra Bibi, was given food mixed with ""toilet cleaner,"" he claimed. The Islamabad accountability court ordered a medical examination of the former first lady. The medical examination was done in the presence of Imran Khan's trusted family physician, Dr Asim Yousuf.","https://static.toiimg.com/thumb/msid-109470876,imgsize-929909,width-400,resizemode-4/109470876.jpg"
"Pakistani province issues flood alert due to glacial melting, possibility of heavy loss of life",https://timesofindia.indiatimes.com/world/pakistan/pakistani-province-issues-flood-alert-due-to-glacial-melting-possibility-of-heavy-loss-of-life/articleshow/109460616.cms,"NEW DELHI: A flood alert has been issued in a Pakistani province due to glacial melting , with officials warning of potential heavy casualties. The region has been struck by days of severe weather, resulting in numerous fatalities and extensive damage to property and agricultural land. Climate experts attribute the heightened rainfall in April to the effects of climate change.In the mountainous province of Khyber Pakhtunkhwa , which has been particularly affected by the torrential downpours, authorities have issued a flood warning due to glacier melt in various districts.They have urged residents to evacuate to safer areas as a precautionary measure against the escalating flood threat.Muhammad Qaiser Khan, representing the local disaster management authority, emphasized the urgent need for preventive actions to avert significant loss of life and property in the face of the impending flood situation.Recent reports from the province indicate that 46 individuals, including 25 children, have lost their lives in rain-related incidents over the past five days. Additionally, thousands of homes and several schools have either collapsed or sustained damage.The southwestern province of Baluchistan has also been severely affected by rainfall. Despite its limited resources to manage the crisis, it may seek assistance from the central government if the rains persist.The devastating floods of 2022, which submerged a significant portion of Pakistan and resulted in substantial casualties and economic losses, serve as a reminder of the country's vulnerability to extreme weather events. With the monsoon season set to commence in June, the authorities are bracing themselves for further challenges ahead.","A flood alert has been issued in a Pakistani province due to glacial melting. Officials warn of potential heavy casualties. The region has been struck by days of severe weather, resulting in numerous fatalities. Climate experts attribute the heightened rainfall in April to the effects of climate change.","https://static.toiimg.com/thumb/msid-109460819,imgsize-1488626,width-400,resizemode-4/109460819.jpg"
Pakistan: Imran Khan claims his wife was given food laced with 'toilet cleaner',https://timesofindia.indiatimes.com/world/pakistan/pakistan-imran-khan-claims-his-wife-was-given-food-laced-with-toilet-cleaner/articleshow/109452255.cms,"NEW DELHI: Former Prime Minister of Pakistan , Imran Khan on Friday accused the jail authorities of mixing ' toilet cleaner ' into his wife's food at her Banigala residence.During the hearing of the £190 million corruption case in Rawalpindi 's Adiala jail on Friday, PTI founder Imran Khan said that toilet cleaner had been mixed into Bushra Bibi 's food which is causing health to deteriorate with daily stomach irritation.He further said that Shaukat Khanum Hospital Chief Medical Officer Dr Asim Yousaf had suggested carrying out Bushra Bibi's tests at Shifa International Hospital. However, he added that the jail administration was adamant about carrying out the test at the Pakistan Institute of Medical Sciences (PIMS) Hospital.According to a report in Dawn, Bushra Bibi, filed a petition before the Islamabad High Court (IHC) on April 15 and requested the court to conduct her check-up and medical tests from Shaukat Khanum Hospital or any other private hospital of her choice to examine if she was poisoned through contaminated food.In her petition, Bushra Bibi said that she is suffering from heartburn, aches in throat and mouth and that she believes that it is the result of eating poisonous meals.Imran Khan's wife said that she was poisoned and subjected to psychological torture at her Banigala residence, which has been declared a sub-jail.Moreover, she also alleged that spy cameras are installed at different places in the room where she has been confined. She said that there is only one lady deputed in the sub-jail while the rest of the staff is male and she feels discomfort in such an environment.Meanwhile, The court advised Imran Khan to refrain from holding 'press conferences' during the hearings and suggested addressing the media after the hearing.In his response, Khan said that the jail administration removes the media from the courtroom after the hearing and he only spoke to reporters to clarify his statements which were misquoted.The PTI founder also urged the court to permit him a 10-minute interaction with reporters after the hearing.",Imran Khan accused the jail authorities of mixing'toilet cleaner'into his wife's food at her Banigala residence. Bushra Bibi filed a petition before the Islamabad High Court (IHC) on April 15. The court advised Imran Khan to refrain from holding 'press conferences' during the hearings.,"https://static.toiimg.com/thumb/msid-109452248,imgsize-918511,width-400,resizemode-4/109452248.jpg"
"Pakistan: Court orders medical checkup of Imran Khan, his wife",https://timesofindia.indiatimes.com/world/pakistan/pakistan-court-orders-medical-checkup-of-imran-khan-his-wife/articleshow/109451599.cms,"""

ISLAMABAD: The Islamabad accountability court has accepted the requests for the medical examination of Pakistan Tehreek-e-Insaf (PTI) founder and former prime minister Imran Khan and his wife, Bushra Bibi, and directed Bushra Bibi 's endoscopy in a private hospital within two days, The Express Tribune reported.The decision was made during a hearing presided by Accountability Court Judge Nasir Javed Rana at Adiala Jail regarding the 190 million-pound scam reference.Further, in an official post on X, PTI said,The jail authorities, under the control of the illegitimate regime, have repeatedly overruled court orders.""In addition to the statement, PTI stated, ""What remains to be seen is whether they will comply with the court orders this time or not.""Moreover, during the hearing, Judge Rana ordered an endoscopy for Bushra Bibi, to be supervised by Dr Asim Younus of Shaukat Khanum Memorial Hospital along with a government doctor, as per The Express Tribune.Additionally, the judge instructed the presentation of six witnesses related to the reference at the next hearing.During the proceedings, Judge Nasir Javed Rana ordered the removal of wooden barriers from the courtroom.Following an hour-long break, the jail authorities removed all additional sheets.According to The Express Tribune, concerns were also raised during the proceedings by defence lawyers regarding the difficulties faced by journalists in reporting the case. The judge addressed these concerns by inviting media representatives and Imran Khan to the rostrum, subsequently instructing the jail administration to take necessary steps.During the proceedings, Imran Khan said that toilet cleaner had been mixed into Bushra Bibi's food, causing daily stomach irritation, as reported by The Express Tribune.The court advised Imran Khan to refrain from holding ""press conferences"" during the hearings.In response, the PTI founder stated his statements were misquoted and he spoke to reporters to clarify them, The Express Tribune reported.The court stressed the importance of decorum, suggesting addressing the media after the hearing, to which Khan stated that the jail administration removes the media from the courtroom after the hearing.He also requested that the court allow him a 10-minute interaction with the media after the hearings.Earlier on April 15, Bushra Bibi, filed a petition before the Islamabad High Court (IHC) and requested the court conduct her check-up and medical tests at Shaukat Khanum Hospital or any other private hospital of her choice to examine if she was poisoned through contaminated food, Pakistan-based Dawn reported.In her petition, Bushra Bibi said that she is suffering from heartburn, and aches in her throat and mouth and that she believes that it is the result of eating poisonous meals.Imran Khan's wife said that she was poisoned and subjected to psychological torture at her Banigala residence, which has been declared a sub-jail, as per the Dawn report.","Pakistan Tehreek-e-Insaf (PTI) founder and former prime minister Imran Khan and his wife, Bushra Bibi, have been ordered to undergo medical tests. The decision was made during a hearing presided by Accountability Court Judge Nasir Javed Rana at Adiala Jail regarding the 190 million-pound scam reference.","https://static.toiimg.com/thumb/msid-109451680,imgsize-579662,width-400,resizemode-4/109451680.jpg"
Pakistan: Two lawmakers suspend for using 'abusive language' during President Zardari's address,https://timesofindia.indiatimes.com/world/pakistan/pakistan-two-lawmakers-suspend-for-using-abusive-language-during-president-zardaris-address/articleshow/109447396.cms,"ISLAMABAD: Pakistan's National Assembly (NA) Speaker Ayaz Sadiq on Friday suspended the membership of two Pakistan Tehreek-e-Insaf (PTI)-backed Sunni Ittehad Council (SIC) lawmakers, Jamshed Ahmad Khan Dasti and Muhammad Iqbal Khan for the current session over the use of abusive language during Pakistan President Asif Ali Zardari's address in a joint session of parliament, Pakistan-based Geo News reported.On Thursday, the PTI-SIC lawmakers held a protest and created a ruckus during the maiden joint sitting of parliament after the elections held on February 8. The lower house of parliament adopted a motion introduced by Pakistan's National Assembly speaker regarding suspending the two members on Friday.Sadiq read the motion, which stated that both MNAs used ""abusive language"" and approached the dais of the speaker in a ""threatening manner,"" which was termed an ""unacceptable"" action, according to Geo News report.The motion further described their disruptive behaviour, including blowing whistles and trumpets, displaying banners and placards and chanting objectionable slogans. All these actions violated the sanctity of the house and the rules mentioned in the Rules of Procedure of Conduct of Business International 2007.Citing Rule 21 of the Rules of Procedure and Conduct of Business in the National Assembly read with Rule 33 of the Parliament Joint Sitting Rules 1973, Sadiq named the two lawmakers and ordered the withdrawal of their membership from the assembly for today's session.An official statement stated that the decision was taken in accordance with the established rules and regulations to maintain the decorum and integrity of parliamentary proceedings.Speaking to Geo News, the suspended member of the National Assembly, Muhammad Iqbal Khan, defended the opposition's protest during the joint parliament session . He warned that it was just beginning, as they ""will teach them [rulers] more lessons about what the rule of the Constitution is.""He said that PTI leaders and workers were arrested and they would do anything for the supremacy of the Constitution and the law in Pakistan, which is being ruled by ""thieves and dacoits.""The PTI leader stated that the legislators from the Khyber Pakhtunkhwa Assembly did not participate in the presidential elections, which resulted in Zardari securing second term as Pakistan's President. Muhammad Iqbal Khan said that the opposition will not step back from its stance and protests will continue in the future.On Thursday, PTI Chairman Barrister Gohar Ali Khan called the opposition's protest and ruckus in the joint session of parliament a ""21-cannon salute"" to Pakistan President Zardari , Geo News reported.Gohar Ali Khan said, ""We do not recognise this president [Zardari]. [Not only] this president but Prime Minister Shehbaz Sharif and the entire cabinet are also illegal."" He further said that they ""compelled"" Zardari to leave his speech in the middle.Meanwhile, Pakistan Peoples Party (PPP) Chairman Bilawal Bhutto-Zardari called the opposition's behaviour and use of abusive language in the joint session ""unparliamentary"" behaviour, according to a Geo News report. He made the remarks in a press conference on Friday.He said that they are not afraid of ""jungle's monkeys"" and added that the PPP has a history of fighting dictators. He further said, ""Unfortunately, the opposition made its own history."" Bilawal Bhutto-Zardari said that the PPP would welcome the opposition's criticism in the parliamentary sphere.","Pakistan's National Assembly (NA) Speaker Ayaz Sadiq on Friday suspended the membership of two Pakistan Tehreek-e-Insaf (PTI)-backed Sunni Ittehad Council (SIC) lawmakers. Jamshed Ahmad Khan Dasti and Muhammad Iqbal Khan used ""abusive language"" during Pakistan President Asif Ali Zardari's address.","https://static.toiimg.com/thumb/msid-109447406,imgsize-36314,width-400,resizemode-4/109447406.jpg"
5 Japan nationals escape unhurt as latest Pak attack targets foreigners,https://timesofindia.indiatimes.com/world/pakistan/5-japan-nationals-escape-unhurt-as-latest-pak-attack-targets-foreigners/articleshow/109444378.cms,"KARACHI : Five Japanese nationals working for Suzuki Motors had a lucky escape when their van was targeted by a suicide bomber and a gunman in a suicide attack in Pakistan 's port city on Friday, police said, in the latest terrorist attack on foreign nationals in the country.DIG East Azfar Mahesar said the terrorists tried to hit the vehicle carrying Japanese nationals working with Pakistan Suzuki Motors.""All five Japanese remained safe,"" he said. ""The Japanese nationals were on the way to the Export Processing Zone from their residence in Zamzama, Clifton,"" he said.Jinnah Hospital officials said three people were brought to the facility in critical conditions. One of the injured, a 45-year-old security guard, succumbed to his injuries while another injured was shifted to the ventilator, Geo News quoted the hospital administration as saying.","Five Japanese nationals working for Suzuki Motors had a lucky escape when their van was targeted by a suicide bomber and a gunman. One of the injured, a 45-year-old security guard, succumbed to his injuries while another injured was shifted to the ventilator.","https://static.toiimg.com/thumb/msid-109444405,imgsize-45074,width-400,resizemode-4/109444405.jpg"
Pakistan: Imran Khan's interim bail extended in three cases,https://timesofindia.indiatimes.com/world/pakistan/pakistan-imran-khans-interim-bail-extended-in-three-cases/articleshow/109428634.cms,"ISLAMABAD: Pakistan Tehreek-e-Insaf (PTI) founder and former prime minister Imran Khan 's interim bail has been extended in three cases by the anti-terrorism court ( ATC ) on Friday, ARY News reported.The anti-terrorism court judge Arshad Javed conducted hearing of interim bail pleas of PTI founder in Jinnah House, Askari Tower attacks and torching of Shadman police station cases.According to ARY News, the court extended the interim bail of the former prime minister for one day in all three cases.The ATC judge also ordered authorities concerned to ensure video link attendance of the accused from Adiala Jail.It is noteworthy to mention that the Lahore High Court (LHC) was previously informed that the Punjab government has allocated seven cells for the convicted PTI founder Imran Khan in Adiala Jail, adding that a total of 14 security personnel have been assigned to ensure his safety and security, as per ARY News.""An accommodation of six cells had been made for Imran Khan in addition to his cell to ensure proper security for him,"" AGP Punjab Khalid Ishaq told the court.""One personnel is deployed for security of 10 inmates in Adiala jail, however, 14 police personnel have been deployed for Imran Khan's security in Adiala Jail, the report added.On May 9, violent clashes erupted throughout Pakistan following the arrest of Imran Khan, at the Islamabad High Court (IHC).Protests unfolded in both remote and major cities as party supporters expressed their outrage over their leader's detention.Balochistan, Punjab, Khyber Pakhtunkhwa, and Islamabad have called upon the armed forces to maintain law and order amid the escalating tensions.Army installations and Corps Commander's house in Lahore, also known as Jinnah House, came under attack during a protest by 'PTI workers'.","Pakistan Tehreek-e-Insaf (PTI) founder and former prime minister Imran Khan's interim bail has been extended in three cases. The anti-terrorism court judge Arshad Javed conducted hearing of interim bail pleas of PTI founder in Jinnah House, Askari Tower attacks and torching of Shadman police station cases.","https://static.toiimg.com/thumb/msid-109428764,imgsize-521190,width-400,resizemode-4/109428764.jpg"
