Article Title,Article Link,Article Text,Article Summary,Article Image
"‘No longer the hunters, you’re the hunted’: US indicts Sinaloa Cartel leaders on narco-terrorism charges",https://timesofindia.indiatimes.com/world/us/no-longer-the-hunters-youre-the-hunted-us-indicts-sinaloa-cartel-leaders-on-narco-terrorism-charges/articleshow/121176279.cms,"Representative image (Picture credit: ICE)

Father-son duo charged with narco-terrorism, connected to Sinaloa cartel





Two top leaders of a violent faction within Mexico’s Sinaloa Cartel have been indicted on unprecedented narco-terrorism charges after allegedly trafficking massive amounts of fentanyl into the United States. Pedro Inzunza Noriega and his son, Pedro Inzunza Coronel, are now facing terrorism-related offences in a federal case unsealed on Tuesday, as announced by US attorney Adam Gordon for the Southern District of California.The pair are accused of leading “one of the largest and most sophisticated fentanyl production networks in the world,” said Gordon, who warned cartel leaders during a press briefing, “You are no longer the hunters. You are the hunted.”The indictment is the first by the department of justice’s newly formed Narco-Terrorism Unit and follows the Trump administration’s designation of the Sinaloa Cartel as a Foreign Terrorist Organization (FTO) in February, under Executive Order 14157.According to the news agency Associated Press, this is a rare move as such labels are typically reserved for politically motivated terrorist groups.The father-son duo, along with five other leaders of the Beltrán Leyva Organization (BLO), a powerful offshoot of the Sinaloa Cartel, have been charged with narco-terrorism, providing material support to terrorism, drug trafficking , and money laundering.The BLO has long been known for its brutal tactics including kidnappings, torture and murders, and operates with violent impunity across Mexico and Central America, including Tijuana.Federal officials, citing court documents, allege the Inzunzas trafficked “tens of thousands of kilograms of fentanyl” into the US.On December 3, 2024, Mexican law enforcement seized more than 1.65 tons of fentanyl from locations in Sinaloa tied to the duo, reportedly the largest fentanyl seizure globally, according to ICE.“These charges highlight the unwavering efforts of transnational criminal organizations like the Sinaloa Cartel to flood our communities with deadly drugs,” said Shawn Gibson, ICE HSI ’s San Diego special agent in charge.The case stems from “Operation Take Back America,” a nationwide DOJ initiative to dismantle cartels and transnational crime US attorney general Pamela Bondi declared, “Their days of brutalizing the American people without consequence are over, we will seek life in prison for these terrorists.”FBI San Diego’s acting special agent in charge Houtan Moshrefi added that the cartel’s activities “not only destroy lives and communities, but also threaten our national security.”Other indicted cartel leaders include Fausto Isidro Meza Flores (“Chapo Isidro”), Oscar Manuel Gastelum Iribe (“El Musico”), and Ivan Archivaldo Guzman Salazar (“El Chapito”). All remain fugitives.Pedro Inzunza Noriega, also known as “Sagitario,” reportedly operates from Los Mochis, Sinaloa, and is paralysed following a past attack by rival cartel members, as per AP.The charges carry penalties ranging from 20 years to life imprisonment, including multimillion-dollar fines. The case is being prosecuted by assistant US attorneys Joshua Mellor and Matthew Sutton.","Father-son duo charged with narco-terrorism, connected to Sinaloa cartel. Pair are accused of leading “one of the largest and most sophisticated fentanyl production networks in the world’ The charges carry penalties ranging from 20 years to life imprisonment, including multimillion-dollar fines. Other indicted cartel leaders include Fausto Isidro Meza Flores, Oscar Manuel Gastelum Iribe, and Ivan Archivaldo Guzman Salazar.","https://static.toiimg.com/thumb/msid-121176312,imgsize-1437222,width-400,resizemode-4/121176312.jpg"
Trump appeals for Qatar's help in persuading Iran to give up its nuclear programme,https://timesofindia.indiatimes.com/world/us/trump-appeals-for-qatars-help-in-persuading-iran-to-give-up-its-nuclear-programme/articleshow/121176191.cms,"Trump appeals for Qatar's help in persuading Iran to give up its nuclear programme

Poll Do you believe that Qatar can effectively mediate between the US and Iran regarding the nuclear deal? Yes, Qatar has a strong history of mediation. No, Iran is unlikely to cooperate.





DOHA: President Donald Trump urged Qatar on Wednesday to use its influence over Iran to persuade the country's leadership to reach an agreement with the US to dial back its rapidly advancing nuclear programme. Trump, who is visiting the Gulf nation as part of a three-country Mideast swing, made the appeal during a state dinner held in his honour by Qatar's emir, Sheikh Tamim bin Hamad Al Thani.Qatar, over the years, has played the role of intermediary between the US and Iran and its proxies, including during talks with Tehran-backed Hamas as its 19-month war with Israel grinds on.""I hope you can help me with the Iran situation,"" Trump said during remarks at the formal dinner. ""It's a perilous situation, and we want to do the right thing.""Trump wants Iran to stop backing militant proxy groupsThe appeal to Qatar came after Trump told leaders at a Gulf Cooperation Council meeting earlier Wednesday in Riyadh, Saudi Arabia, that he wants ""to make a deal,"" but Tehran must end its support of proxy groups throughout the Mideast as part of any potential agreement.The US and Iran brokered a nuclear deal in 2015, during Democrat Barack Obama's administration, in which Iran agreed to drastically reduce its stockpile of uranium and only enrich up to 3.67 per cent.But that deal was scrapped during the first Trump administration.Today, Iran enriches up to 60 per cent, a short, technical step from weapons-grade levels, and has enough stockpiled for multiple nuclear bombs should it choose to build them.The Qatari emir told Fox News Channel on Wednesday night that ""we agree that we want a nuclear-free region, and we cannot afford a nuclear race in that region.""But, Al Thani said, ""Iran has its right to have a nuclear - a civilian nuclear power, while not also representing any challenge or any threat for anyone in the region."" He said the issue needs to be resolved diplomatically.The US and Iran have engaged in four rounds of talks since early last month about the country's nuclear programme. Trump has said that he believes brokering a nuclear deal is possible but that the window is closing.At the state dinner, he called on Iran's leadership to ""get moving"" or risk the situation spiralling into a head-on conflict.""Because things like that get started and they get out of control,"" Trump said. ""I've seen it over and over again. They go to war and things get out of control, and we're not going to let that happen.""Trump, in his appearance at the Gulf Cooperation Council meeting in Riyadh, also said that Tehran ""must stop sponsoring terror, halt its bloody proxy wars and permanently and verifiably cease pursuit of nuclear weapons"" as conditions for any deal.The call for Iran to cease support of Hamas in Gaza, Hezbollah in Lebanon and the Houthis in Yemen comes as that proxy network has faced significant setbacks in the 19 months since Hamas launched its October 7, 2023, attack on Israel.In Iran, Foreign Minister Abbas Araghchi called Trump's remarks ""deceitful"" but did not directly address his demands.Trump said that he also believed the moment was ripe ""for a future free from the grip of Hezbollah terrorists."" Hezbollah is severely weakened after its war last year with Israel, in which much of its top leadership was killed and after losing a key ally with the fall of former Syrian President Bashar Assad, a conduit for Iran to send arms.While in Riyadh, Trump also met with Syrian President Ahmad al-Sharaa, a face-to-face engagement with the onetime insurgent leader who spent years imprisoned by US forces after being captured in Iraq.Al-Sharaa was named president of Syria in January, a month after a stunning offensive by insurgent groups led by al-Sharaa's Hayat Tahrir al-Sham stormed Damascus and ended the 54-year rule of the Assad family.Trump said he decided to meet with al-Sharaa after being encouraged to do so by Saudi Crown Prince Mohammed bin Salman and Turkish President Recep Tayyip Erdogan. He also pledged to lift yearslong sanctions on Syria.The White House billed the al-Sharaa meeting as a brief ""pull aside"" that ended up lasting 33 minutes.Trump told reporters that the meeting went ""great"" and described him as a ""young, attractive guy"" with a ""very strong past.""""He's got a real shot at holding it together,"" Trump said.Formerly known by the nom de guerre Abu Mohammed al-Golani, al-Sharaa joined the ranks of al-Qaida insurgents battling US forces in Iraq after the US -led invasion. He still faces a warrant for his arrest on terrorism charges in Iraq. The US once offered $10 million for information about his whereabouts because of his links to al-Qaida.Al-Sharaa returned to his home country of Syria after the conflict began in 2011 and led al-Qaida's branch called the Nusra Front. He changed the name of his group to Hayat Tahrir al-Sham and cut links with al-Qaida.The sanctions go back to the rule of Bashar Assad, who was ousted in December, and were intended to inflict major pain on his economy.In Qatar, Trump was greeted at the airport by Al Thani. Air Force One was escorted by Qatari F-15 jets as it neared Doha, the capital city.The emir said he had high hopes for Trump's efforts with Iran and at ending the war in Gaza.""I know that you are a man of peace,"" he said. ""I know that you want to bring peace to this region.""","Qatar has played the role of intermediary between the US and Iran and its proxies. Trump made the appeal during a state dinner held in his honour by Qatar's emir. Trump also met with Syrian President Ahmad al-Sharaa, a face-to- face engagement.","https://static.toiimg.com/thumb/msid-121176174,width-400,resizemode-4/121176174.jpg"
What would lifting US sanctions on Syria mean to the war-torn country?,https://timesofindia.indiatimes.com/world/us/what-would-lifting-us-sanctions-on-syria-mean-to-the-war-torn-country/articleshow/121174890.cms,"



US President Donald Trump’s move to ease sanctions on Syria could mark a turning point for the war-scarred country, potentially opening the door to long-awaited reconstruction and economic revival. The announcement came after Trump met interim Syrian President Ahmed al-Sharaa in Riyadh, marking the first meeting between a US leader and a Syrian head of state in 25 years. Trump praised Sharaa as a “tough guy” with a “very strong past”, a striking remark given the Syrian leader's former ties to jihadist groups and his inclusion on a US terrorism list as recently as 2013.CNN reported that Sharaa, once known as Abu Mohammed al-Jolani and leader of al-Qaeda’s affiliate in Syria, had a $10 million US bounty on his head before seizing power and expelling Iran-backed militias from Syria. His rapid rise to leadership and rebranding as a national figurehead has prompted mixed reactions globally, with some Arab nations embracing his legitimacy and others, like Israel, remaining deeply sceptical.While in Riyadh, Trump sat down with Sharaa and Saudi Crown Prince Mohammed bin Salman, joined by Turkish President Recep Tayyip Erdogan via video link. Trump told reporters that he had encouraged Syria to join the Abraham Accords and normalise ties with Israel.Although no formal commitment was made, he said Sharaa had responded positively.Trump also said he had urged Sharaa to expel foreign militants and assume control over detention camps holding Islamic State fighters — a task currently managed by Kurdish forces backed by the US but opposed by Turkey. “They have a lot of work to do,” Trump added, noting that sanctions had left Syria in dire straits. He called the punitive measures “crippling” and said lifting them would give Syria a “strong chance” at rebuilding.The response in Syria was immediate. Celebrations broke out in major cities, with residents hoping the end of sanctions would reverse years of economic devastation. A soap factory owner in Aleppo told reporters the decision would “boost the economy and encourage people to return”.According to CNN and other experts cited, US sanctions have been in place for decades, with three main regimes: the 1979 designation of Syria as a state sponsor of terrorism, the 2003 Syria Accountability Act, and the 2019 Caesar Act. These measures have severely restricted financial transactions, humanitarian operations, and everyday commerce, pushing 90% of Syrians below the poverty line.Syrian economist Karam Shaar told CNN that the effects of lifting sanctions wouldn’t be immediate. “Sanctions aren’t a switch,” he said, cautioning that only a full rollback of overlapping restrictions would make a difference. However, even the symbolic gesture has already caused Syria’s currency to rise by 60%, signalling market optimism.Humanitarian organisations say the announcement could be transformative. “It marks a potentially transformative moment for millions of Syrians who have endured more than 13 years of economic hardship, conflict, and displacement,” said Mathieu Rouquette, Syria country director for Mercy Corps.","US President Donald Trump announced the lifting of sanctions on Syria. The move could open the door to long-awaited reconstruction and economic revival. The announcement came after Trump met interim Syrian President Ahmed al-Sharaa. It was the first meeting between a US leader and a Syrian head of state in 25 years. Trump praised Sharaa as a ""tough guy"" with a ""very strong past""","https://static.toiimg.com/thumb/msid-121174889,imgsize-825661,width-400,resizemode-4/121174889.jpg"
"'Stress, depression': Migrants bear brunt of Trump border policy",https://timesofindia.indiatimes.com/world/us/stress-depression-migrants-bear-brunt-of-trump-border-policy/articleshow/121174494.cms,"AP File Photo

Poll Should local authorities in sanctuary cities cooperate with ICE? Yes, they should No, they shouldn't

Totally traumatizing'





NEW YORK: Colombian Sindy Estrada and her family try to stay off the streets of New York as they battle her deportation order for fear they could be detained by the authorities.Estrada and her family received a deportation order from the US government telling them to leave the country by April 30.""It has caused a nervous breakdown -- we have suffered stress, depression, anxiety, panic,"" said the businesswoman, 36, who fled Colombia three years ago after her husband's business was targeted by extortionists.N ow, US immigration officials have fitted her husband with an electronic ankle bracelet to track his whereabouts and her 16-year-old son has begun therapy amid the emotional toll of their situation.Her son ""started biting his nails and couldn't sleep, his grades dropped a lot,"" Estrada said. ""At his school they ask him what's going on -- whether he will stay or go.""""(Despite) my desire to pack a suitcase and go... I think about what would await me there. I'm afraid to return to Colombia.""Estrada and her family, who live in New Jersey, are among the millions of undocumented migrants in the United States fearful of President Donald Trump 's onslaught against non-citizens.Experts say his crackdown has exerted a psychological toll akin to the September 11, 2001 attacks that claimed almost 3,000 lives.Trump has vowed to undertake the largest mass deportation of undocumented migrants, who number around 11 million, in US history.He denounces people who entered the country illegally, visa overstayers, or those with legal temporary residence permits while they pursue options like asylum, describing them as ""criminals"" who must be returned at all costs.Trump has been accused of unlawful deportations without due process to a maximum security counterterrorism prison in El Salvador while also scrapping the longstanding policy of US citizenship through birth and seeking to block migrants challenging their detention.In the past week the Republican offered a $1,000 payout to undocumented migrants who leave voluntarily.Although the shock troops of Trump's crackdown, the Immigration and Customs Enforcement agency, insist they target undocumented criminals, US media reports few arrestees fall into that category.The presence of ICE agents in migrant neighborhoods or on subway routes used by immigrants, particularly Hispanics, has sown fear.The ""uncertainty, fear, anguish"" experienced by migrants ""is similar to what was endured during the September 11 attacks"" of 2001, said New York City Department of Health Services mental health consultant Juan Carlos Dumas.The mental health crisis has led to increased alcohol and drug abuse, as well as family conflict, the Argentine psychotherapist, 68, told AFP.""The anguish has to go somewhere,"" he said.Self-harming among young people has increased, just as it did after 9/11, he said.Youths ""exorcise their feelings through aggression,"" Dumas said at the gate of a school in Harlem where he works to detect such issues among pupils.""They each try to deal with the fear in their own way,"" he said. ""We haven't seen anything like this for years.""Migrants who have been in the country for many years and built a life are affected the most.The prospect of having to leave it is ""totally traumatizing,"" he said, recommending that no one should feel the need to stay indoors.Dumas said that New York, a sanctuary city where local police do not cooperate with ICE to deport people, has a range of mental health services including social workers, psychologists and therapists for those in need.""Not everyone has it in for migrants,"" he said.","Sindy Estrada and her family received a deportation order from the US government. They are among the millions of undocumented migrants in the United States fearful of President Donald Trump's onslaught against non-citizens. Experts say his crackdown has exerted a psychological toll akin to the September 11, 2001 attacks.","https://static.toiimg.com/thumb/msid-121174556,imgsize-1046535,width-400,resizemode-4/121174556.jpg"
'I wish she’d do her job': Border czar Tom Homan fires back at AOC over ICE protest clash,https://timesofindia.indiatimes.com/world/us/i-wish-shed-do-her-job-border-czar-tom-homan-fires-back-at-aoc-over-ice-protest-clash/articleshow/121174206.cms,"Representative Alexandria Ocasio-Cortez and border official Tom Homan

Poll Do you think Alexandria Ocasio-Cortez should face consequences for her actions regarding the ICE webinar? Yes, she should be held accountable No, she has the right to advise immigrants





Trump-era ""border czar"" Tom Homan has lashed out at Democratic Congresswoman Alexandria Ocasio-Cortez , saying he wishes she would “do her job” after she downplayed questions about a potential Justice Department probe into her role in a controversial webinar advising migrants on dealing with ICE agents.“She’s a legislator, right? Why doesn’t she pass some legislation and actually improve this country like President Donald Trump is already doing?” Homan told Fox News Digital. “I’m doing my job: the border is secure. We arrested three times more criminals than Biden did. She should try doing her job.”His comments followed AOC’s claim that she hadn’t heard from the DOJ and wasn’t sure whether she was under investigation for hosting an online session guiding undocumented immigrants on their rights. Homan previously suggested that her actions particularly advising people not to open their doors to ICE could constitute obstruction.Homan appeared on Capitol Hill this week at the invitation of Rep. August Pfluger, R-Texas, to brief House Republicans on border security . When asked whether Democrats who recently joined protests outside a Newark ICE facility including Reps. Bonnie Watson Coleman, Robert Menendez, and LaMonica McIver should face consequences, he replied, “Yes,” supporting the idea of censure or removal from committee assignments.Ocasio-Cortez responded to Homan in a fiery Instagram post, saying, “You lay a finger on any of the representatives that were there – and we’re going to have a problem.” When told of this warning, Homan reportedly laughed and said sarcastically, “I’m extremely intimidated.”Their war of words escalated earlier this week after Homan called AOC “the dumbest congresswoman ever elected to Congress” during a Newsmax interview. She fired back on X: “This is why you fight these cowards. The moment you stand up to them, they crumble.”","“She’s a legislator, right? Why doesn’t she pass some legislation and actually improve this country like President Donald Trump is already doing?” Homan told Fox News Digital. “I’m doing my job: the border is secure. We arrested three times more criminals than Biden did. She should try doing her job.”","https://static.toiimg.com/thumb/msid-121174191,imgsize-24928,width-400,resizemode-4/121174191.jpg"
