Article Title,Article Link,Article Text,Article Summary,Article Image
"In a 1st, CRPF does cave interventions in ‘biggest’ anti-Maoist op",https://timesofindia.indiatimes.com/india/in-a-1st-crpf-does-cave-interventions-in-biggest-anti-maoist-op/articleshow/121174474.cms,"File photo

BIJAPUR: CRPF DG G P Singh on Wednesday said Operation Blackforest — which demolished a Maoist ‘bastion’ in Karregutalu Hills (KGH) on Chhattisgarh-Telangana border — saw the force try out cave interventions for the first time, for the hills housed a network of 250 cave formations used by the Maoists as convenient hideouts, arms manufacturing units and to dump explosives and rations.“CRPF has generally been doing house or vehicle interventions. For the first time, we tried cave interventions. We had use a technique and make sure that we do not suffer casualties but neutralise the Maoists who may be there,” he told a press conference here.Singh said the forces also learnt that Naxals are now using beer bottles to make IEDs, which involve the minimum use of metal. “This now requires ingenuity in detecting IEDs and we will be revising our SOPs accordingly,” he said.Around 450 IEDs were detected and deactivated, though 15 IEDs that went off caused some injuries to force personnel. Singh said the force has been upgrading its IED detection equipment and technology to whatever is the latest available in the world.The CRPF chief said the recovery of a whopping 818 barrel grande launcher shells (BGLs) and 450 IEDs during the operation is significant as most of the Maoist attacks on security camps so far were done using BGLs. “Also, most of our personnel out on operations are killed or injured by IEDs,” said Singh.",Operation Blackforest demolished a Maoist ‘bastion’ in Karregutalu Hills (KGH) on Chhattisgarh-Telangana border. The hills housed a network of 250 cave formations used by the Maoists as convenient hideouts.,"https://static.toiimg.com/thumb/msid-121174467,imgsize-2374906,width-400,resizemode-4/A-major-anti-Maoist-operation-Operation-Sankalp-launched-on-April-21-in-the-Bijapur-district-of-Chhattisgarh.jpg"
'New normal' for Congress? Shashi Tharoor's praise for PM Modi's policies,https://timesofindia.indiatimes.com/india/new-normal-for-congress-shashi-tharoors-praise-for-pm-modis-policies/articleshow/121167193.cms,"Poll Do you believe that India's approach to conflict with Pakistan has changed under Modi's government? No, it's consistent with previous policies. Yes, it's more aggressive.

NEW DELHI: Has Shashi Tharoor set a ""new normal"" for the Congress post India's "" Operation Sindoor ""? Well, it seems so. The Thiruvananthapuram MP has been unequivocal and unwavering in his praise of the steps taken by the Narendra Modi government against Pakistan after the Pahalgam terror attack . So much so, the BJP leaders have cited Tharoor's strong defence of the government to school and shame the opposition, including the Congress.While the Congress has heaped praise on the armed forces over the success of ""Operation Sindoor"", it has questioned the Modi government's decision to announce sudden ceasefire, which, ironically, was first announced by US President Donald Trump . While making the ceasefire announcement, Trump also claimed that India and Pakistan had agreed to talks at a neutral venue. Later, Trump went on to claim, not once but twice, that he used trade deal as a leverage to force India and Pakistan to agree to the ceasefire. While India did not react to Trump's claim publically, the external affairs ministry made it clear that trade was never a part of any discussions with the US. India also categorically declared that it was Islamabad that had approached us for ceasefire after the May 10 strike by our armed forces which destroyed many air bases in Pakistan.The Congress raised tough questions for Prime Minister Modi in the light of these US claims. Senior Congress leader Jairam Ramesh said: ""The Prime Minister did not speak one word on the claims made by President Trump minutes before his address to the nation. Has India accepted America's mediation? Has India agreed to hold talks with Pakistan at a neutral venue? Will India now accept US demand for opening of markets in automobile, agriculture and other sectors?"" Other opposition leaders also targeted the government over US claims of playing the mediator.However, Shashi Tharoor strongly defended the Modi government and called the US President ""a politician wanting to take credit for something."" Tharoor also justified India's decision to agree to a ceasefire.""Peace is essential. I am very glad, India never wanted a long-term war. India wanted to teach terrorists a lesson, I believe that lesson has been taught. The other details are awaited,"" Tharoor said in his first recation on ceasefire.For US President Trump's claims, Tharoor had a sharp retort.""I see it as a particular politician wanting to take credit for something and I can see that the government of India probably said 'let them take the credit if they want to', but from our point of view we have made it clear that the peace followed a request from the DGMO of Pakistan who called his Indian counterpart at 3:35 pm (Saturday) and we did not take very long to say yes because we had never wanted a long war,"" Tharoor said.Clarifying that he was speaking as an individual MP, Tharoor said he did not like Trump's social media posts on the issue.""You are making equivalent the victim and the perpetrator, which is really shocking. It is completely wrong to imply that as a result of this India is going to give some sort of negotiation to Pakistan. We will never negotiate to the point of a gun, we are never going to give the satisfaction to Pakistan of feeling that by unleashing a terrorist attack in Pahalgam they have somehow earned the right to negotiate with India,"" he said.""I don't think that Mr Trump should have in any way, shape or form implied that the Kashmiri dispute has been internationalised by the American involvement. We don't even accept that there is a dispute of that nature, Kashmir is an integral part of India ... we are not interested at all in internationalising the dispute,"" he added.Earlier also Tharoor was effusive in his praise for ""Operation Sindoor"" and had said: ""The operation was well-calibrated, well-calculated, and effectively executed. I am very impressed, from the naming of the operation to how it was presented to the world. We had to respond. We could not allow Pakistani terrorists to believe that they can walk into our country, kill civilians, and get away with it. They had to be punished. At the same time, an indiscriminate action on our part could have needlessly provoked an escalation and cost us the sympathy of the world.""The Congress MP also praised the government's messaging on the issue: ""We are doing all the right things so far. The nature of Operation Sindoor was right. The messaging of the press conference in which the foreign secretary, a Kashmiri Pandit, was flanked on both sides by women officers, one of whom was a Muslim, demonstrates a narrative against the one of Hindu-Muslim hostility being spread by the Pakistanis like silly general Munir. It sends a very good message.""And when some Congress leaders spoke of 1971 war and the role of then Prime Minister Indira Gandhi, Tharoor had this message for his party leaders.""Today's Pakistan is a different situation. Their military equipment and the damage they can do are different. Bangladesh was fighting a moral cause to actually bring people to freedom and liberation. That was a completely different story. This is a different story. We would have ended up with much longer, protracted conflicts with a lot of loss of lives on both sides. Is this the biggest priority for India today? No, it is not.""While Tharoor heaped praised on Modi government's actions against Pakistan, he did not hesitate to slam the BJP when the safrron party put out a social media post criticising the previous UPA government and said the ""petty attempt to divide us politically is deplorable"".Tagging the BJP's post on X, Tharoor said, ""At a time when the nation stands united as Indians, this petty attempt to divide us politically is deplorable. Our government has learned the futility of past approaches the hard way -- after inviting Pakistan to participate in the investigation of the Pathankot blasts in 2016. It is only then that it took to the path of military action, carefully calibrated and maturely conducted. This advertisement is neither appropriate nor mature. Delete it, please, @BJP4India. Jai Hind.""Tharoor, a leading opposition leader, gave the BJP enough ammunition to target the critics of the government and accuse the Congress of playing politics.""I am really surprised that Congress is not listening to what Shashi Tharoor is saying. He is a senior Congress leader and is very clear that let anybody take the credit, but India decided to have this understanding with Pakistan. We didn't want a war. It was an understanding based on our terms and conditions. But you (Congress) want to politicise everything,"" Tamil Nadu BJP vice president Narayanan Thirupathy said slamming the grand-old-party.Tharoor has been at loggerheads with the Congress over his repeated praise for PM Modi and his policies.When Tharoor had first praised Prime Minister Modi for his US visit and then lauded India's role under the PM in the Russia-Ukraine war, the Congress had reacted very sharply to his remarks.Congress president Mallikarjun Kharge had then laid stress on discipline and had given a stern warning to the state leaders that strong action will be taken against those making comments that go against the party's interests.The Congress has officially not reacted to Tharoor's statements but Jairam Ramesh has made it clear that ""When Mr. Tharoor speaks, it does not reflect the views of the party."" Party sources say that Tharoor has crossed the 'lakshman rekha' with his repeated comments on the India-Pakistan conflict.(With inputs from agencies)","The Congress has heaped praise on the armed forces over the success of ""Operation Sindoor"" It has questioned the Modi government's decision to announce sudden ceasefire, which, ironically, was first announced by US President Donald Trump. While making the ceasefire announcement, Trump also claimed that India and Pakistan had agreed to talks at a neutral venue.","https://static.toiimg.com/thumb/msid-121167784,imgsize-1177033,width-400,resizemode-4/IANS-photo-.jpg"
IAEA says no report of radiation leak from any Pak facility,https://timesofindia.indiatimes.com/india/iaea-says-no-report-of-radiation-leak-from-any-pak-facility/articleshow/121171115.cms,"Representative photo

DEHRADUN: There was no radiation leak or release from any nuclear facility in Pakistan, the International Atomic Energy Agency (IAEA) said on Wednesday (IST), rejecting widespread reports that claimed Indian missiles struck Kirana Hills in Pakistan’s Sargodha during Operation Sindoor , triggering a radioactive incident.The clarification followed social media speculation and foreign media theories suggesting a nuclear stockpile in Pakistan had been hit during the airstrikes. Fredrik Dahl from IAEA’s press department in an email response to TOI’s query stated, “We are aware of the reports. Based on information available to the IAEA, there was no radiation leak or release from any nuclear facility in Pakistan.”The development came two days after Indian Air Force’s director general air operations, Air Marshal A K Bharti, denied that India had targeted Kirana Hills or any nuclear installation in Pakistan. When asked by the media, Bharti said, “Thank you for telling us that Kirana Hills houses nuclear installations. We didn’t know about it. We have not hit Kirana Hills and whatever is there.”The ministry of external affairs also rejected reports of a radiation leak. Spokesperson Randhir Jaiswal, during a press briefing on Tuesday, said, “Our military action was entirely within the conventional domain. Some reports were suggesting that Pakistan’s National Command Authority would convene a meeting, but those were later denied. In fact, Pakistan’s govt representatives have officially denied this on record.”IAEA’s statement sought to dispel speculation that a radiation leak led to the ceasefire between India and Pakistan. Some foreign experts on global media platforms had amplified the theories, claiming the reports were accurate. The rumours intensified after some flight tracking platforms allegedly spotted a US department of energy aircraft—used in nuclear emergencies like Fukushima—near Pakistan.Another claim that an Egyptian military aircraft landed in Pakistan carrying boron, a chemical used to contain radioactive emissions, also circulated. Both these claims were unverified and dismissed by former military officials as baseless.",IAEA rejects widespread reports that claimed Indian missiles struck Kirana Hills in Pakistan’s Sargodha during Operation Sindoor. The clarification followed social media speculation and foreign media theories suggesting a nuclear stockpile in Pakistan had been hit during the airstrikes. Some foreign experts on global media platforms had amplified the theories.,"https://static.toiimg.com/thumb/msid-121171142,imgsize-18126,width-400,resizemode-4/Stories-50.jpg"
US defence strategist hails India’s ‘decisive victory’,https://timesofindia.indiatimes.com/india/us-defence-strategist-hails-indias-decisive-victory/articleshow/121171502.cms,"US def strategist hails India’s ‘decisive victory’, says response showed clarity

NEW DELHI: John Spencer , a military strategist who is also an urban warfare expert, has weighed in the debate on the extent of the success of ‘Operation Sindoor’, asserting that India scored a decisive victory .“After just four days of calibrated military action, it is objectively conclusive: India achieved a massive victory. Operation Sindoor met and exceeded its strategic aims — destroying terrorist infrastructure, demonstrating military superiority, restoring deterrence, and unveiling a new national security doctrine . This was not a symbolic force. It was decisive power, clearly applied,” Spencer wrote in his latest blog.Spencer currently serves as the chair of the Urban Warfare Studies at the Modern War Institute at West Point (US Military Academy), New York, and has been a part of the strategic research group at Pentagon.“India has not declared Operation Sindoor completely over. What exists now is a sensitive halt in operations — some may call it a ceasefire, but military leaders have deliberately avoided that word. From a war-fighting perspective, this is not merely a pause; it is a strategic hold following a rare and unambiguous military victory,” he says.Spencer said Operation Sindoor was “more than a retaliation, this was the unveiling of a strategic doctrine”, quoting PM Narendra Modi as saying, “terror and talks can’t go together. Water and blood can’t flow together”.He said that India’s military response to terror attacks is “overwhelming yet controlled — precise, decisive, and without hesitation. That kind of clarity is rare in modern war. In an era defined by ‘forever wars’ and cycles of violence without strategic direction, Operation Sindoor stands apart. It offers a model of limited war with clearly defined ends, matched ways and means, and a state that never relinquished the initiative”.“In an age where many modern wars spiral into open-ended occupations or political confusion, Operation Sindoor stands apart. This was a demonstration of disciplined military strategy: clear goals, aligned ways and means, and adaptive execution in the face of unpredictable escalation. India absorbed a blow, defined its objective, and achieved it — all within a contained timeframe,” he added.The controlled escalation, he said, sent a clear deterrent signal: India will respond, and it controls the pace. “India’s restraint is not weakness — it is maturity. It imposed costs, redefined thresholds, and retained escalation dominance. India didn’t just respond to an attack. It changed the strategic equation,” he adds.Spencer noted the fact that India handled this crisis without seeking international mediation, enforced its doctrine on sovereign terms, using sovereign means.","US military strategist hails India’s ‘decisive victory’, says response showed clarity. John Spencer is chair of the Urban Warfare Studies at the Modern War Institute at West Point (US Military Academy), New York. Spencer: “More than a retaliation, this was the unveiling of a strategic doctrine”","https://static.toiimg.com/thumb/msid-121171504,imgsize-35002,width-400,resizemode-4/US-def-strategist-hails-Indias-decisive-victory-says-response-showed-clarity.jpg"
"Tech glitches disrupt CUET-UG day-2 in conflict-hit J&K, Delhi",https://timesofindia.indiatimes.com/india/tech-glitches-disrupt-cuet-ug-day-2-in-conflict-hit-jk-delhi/articleshow/121171656.cms,"NTA likely to postpone CUET-UG 2025 examination: Sources

NEW DELHI: The second day of CUET-UG, 2025 witnessed continued disruptions, as technical failures at exam centres affected more than 350 students across J&K and Delhi. The repeated setbacks have sparked serious concerns about the readiness of infrastructure supporting this critical national-level test. In J&K, the situation was further exacerbated by logistical failures. National Testing Agency (NTA), which conducts CUET-UG, confirmed cancellation of exam on May 14 at Kite Polytechnic centre in Srinagar, citing technical malfunctions. The test was also cancelled at the centre on May 13, the first day of the exam. While 76 students were unable to take the test on May 13, dozens more were affected on Wednesday. NTA said fresh dates will be announced and new admit cards will be issued to the affected candidates. However, the agency’s response has done little to address the growing frustration among students and their families in the region.Allocation of CUET-UG exam centres has also sparked widespread concern in Meghalaya, with the state govt accusing NTA of failing to communicate in advance about a shortage of centres within state. This oversight resulted in many students being assigned centres outside Meghalaya — some as far as Jorhat and Dibrugarh in Assam, Mizoram, and Bengal’s Kolkata — causing undue financial and logistical stress. Education minister Rakkam A Sangma urged NTA to defer the exams until additional centres, over 200 of which have already been identified and submitted to TCS for vetting, are made ready.J&K Students Association president Nasir Khuehami said he had received numerous distress calls from students unable to attend the exam. “Many had to flee homes due to the (India-Pakistan) conflict. Some are in different states and have no way to return. Their academic future is at risk,” he said. Several students assigned centres outside the UT described the situation as unmanageable. A resident of Jammu was allotted a centre in Himachal Pradesh. “Travelling during this period was not just unsafe—it was impossible. My whole year’s effort feels wasted,” he lamented.Delhi students faced a different set of obstacles. Candidates at centres such as the one in Rohini reported prolonged delays, power outages, and mismanagement. A students, who reached her centre at 6:30 am, said the gates remained closed well past reporting time, and the exam began nearly 90 minutes late. “There was no electricity, backup failed, and students were left waiting outside in the heat,” she said.Inside the examination centre, students experienced rushed verification, poor ventilation, and inadequate seating arrangements. “One AC for 40 students — barely working,” Panghal recalled.Similar reports came from centres in Ambala in Haryana, where candidates complained of extreme heat, lack of fans, and tight security that forced many to discard personal items due to the absence of lockers."," CUET-UG, 2025 witnessed continued disruptions, as technical failures at exam centres affected more than 350 students across J&K and Delhi. The repeated setbacks have sparked serious concerns about the readiness of infrastructure supporting this critical national-level test. NTA said fresh dates will be announced and new admit cards will be issued to the affected candidates.","https://static.toiimg.com/thumb/msid-121171705,imgsize-49804,width-400,resizemode-4/NTA-likely-to-postpone-CUET-UG-2025-examination-Sources.jpg"
"Retired armyman, 2 sons choke to death in bid to clear domestic drain",https://timesofindia.indiatimes.com/india/retired-armyman-2-sons-choke-to-death-in-bid-to-clear-domestic-drain/articleshow/121171486.cms,"Representative photo

ROHTAK: A routine attempt to unblock a domestic drain at Majra village in Haryana's Rohtak district turned tragic Wednesday when a retired Army man and two of his sons died inside a clogged sewer manhole. The deceased were Mahabir Singh and his sons Lakshman and Deepak.According to Mahabir's wife, Santosh Devi, a household drain had been backing up for days. Lakshman, who worked at a motorcycle-repair shop, lifted the manhole cover outside the house to investigate and slipped in. Mahabir immediately descended to rescue him but failed to re-emerge. Deepak, employed at a private firm in Rohtak, then entered the sewer in a final effort to save both, but all three succumbed, apparently to toxic gases.DSP Ravi Khundia called the accident ""deeply unfortunate"" & confirmed that postmortems were underway even as no formal complaint had been filed yet.","A routine attempt to unblock a domestic drain at Majra village in Haryana's Rohtak district turned tragic Wednesday. The deceased were Mahabir Singh and his sons Lakshman and Deepak. DSP Ravi Khundia called the accident ""deeply unfortunate"" & confirmed that postmortems were underway.","https://static.toiimg.com/thumb/msid-121171498,imgsize-317422,width-400,resizemode-4/arreste-cuff.jpg"
