Article Title,Article Link,Article Text,Article Summary,Article Image
"Evening news wrap: Russia launches biggest airstrikes on Ukraine since war began; Japan PM Shigeru Ishiba quits, and more",https://timesofindia.indiatimes.com/india/evening-newswrap-russia-mounts-biggest-airstrikes-on-ukraine-since-war-japan-pm-shigeru-ishiba-quits-and-more/articleshow/123746899.cms,"Vladimir Putin, Volodymyr Zelenskyy, Shigeru Ishiba (file photo)

Here are your top-five stories of the evening



Russia’s largest aerial attack on Ukraine since the war began



Japan PM Shigeru Ishiba steps down to avoid split in party



PM Modi sits in last row during NDA workshop



US raid on Hyundai plant, over 400 arrested



US Vice- President JD Vance defends US strike on Venezuela



Russia on Sunday, carried out its largest airstrike on Kyiv since the war began, causing casualties and damaging a key government building. Ukraine responded by targeting Russia’s Druzhba oil pipeline. Peace talks remain stalled, while international calls for stricter sanctions continue. In Japan, Prime Minister Shigeru Ishiba resigned following pressure from the LDP after an upper house election loss, avoiding a no-confidence vote. A separate immigration raid at a Hyundai plant in Georgia led to the arrest of 475 workers, mostly Korean nationals, prompting a response from South Korea.In India, Prime Minister Narendra Modi attended a BJP workshop at the Parliament complex, where he sat in the last row and spoke on the importance of party workers. The two-day session focused on party history and improving efficiency among parliamentarians. While the US, Vice President JD Vance defended a strike on a Venezuelan drug cartel boat that killed 11, with questions raised about its legality.Russia has carried out its most extensive airstrike on Kyiv since the start of the war, causing casualties and damaging a major government facility. In response, Ukraine struck Russia’s Druzhba oil pipeline.As peace negotiations remain at a standstill, global pressure for stricter sanctions on Russia is growing, while President Zelenskyy has signaled openness to meeting with President Putin. Read full story Japan’s Prime Minister Shigeru Ishiba has announced his resignation, facing growing pressure from the LDP after a major loss in the upper house elections. After resisting demands to step down for over a month, his decision helps avert a possible no-confidence vote. Ishiba's brief time in office was plagued by falling approval ratings and economic difficulties, such as soaring rice prices, ultimately contributing to his rapid political decline. Read full story Prime Minister Narendra Modi took part in a Bharatiya Janata Party workshop held at the Parliament complex, where he highlighted the significance of each party worker. The two-day program featured sessions on the BJP’s history and strategies to enhance the effectiveness of its parliamentarians. During the session he was seen seated on the last row. Read full story A large-scale immigration raid at a Hyundai facility in Georgia resulted in the arrest of 475 workers, mostly Korean nationals, prompting diplomatic action from South Korea. Federal agents carried out the operation after a lengthy investigation into illegal employment practices. Involving several agencies, the raid underscored a broader effort to combat labor exploitation and enforce federal laws, according to the Department of Homeland Security. Read full story US Vice President JD Vance defended a recent American strike on a Venezuelan drug cartel vessel, downplaying concerns over its legality. The operation, which resulted in 11 deaths, targeted a boat suspected of transporting narcotics, with President Trump confirming the mission. The US military identified the crew as members of the Venezuelan gang Tren de Aragua, though the incident has sparked questions about adherence to international law. Read full story","Russia carried out its largest airstrike on Kyiv since the war began. Ukraine responded by targeting Russia’s Druzhba oil pipeline. In Japan, Prime Minister Shigeru Ishiba resigned following pressure from the LDP. A separate immigration raid at a Hyundai plant in Georgia led to the arrest of 475 workers.","https://static.toiimg.com/thumb/msid-123747168,imgsize-922635,width-400,resizemode-4/vladimir-putin-volodymyr-zelenskyy-shigeru-ishiba-file-photo.jpg"
"Pro-Khalistan outfits getting funds from Canada, its govt says",https://timesofindia.indiatimes.com/india/pro-khalistan-outfits-getting-funds-from-canada-its-govt-says/articleshow/123740696.cms,"From Charities To Crypto: Canadian Funds Fuel Khalistani Terror, Explosive Report Reveals Truth

Pro-Khalistan terror outfits like Babbar Khalsa International and International Sikh Youth Federation are receiving financial support within Canada, according to the Canadian govt's official report 'Assessment of Money Laundering and Terrorist Financing Risks', which acknowledges that the extremist groups are resorting to ""violent means to establish an independent state within Punjab, India"".The report, however, said that the monetary support for the pro-Khalistan groups has now shrunk and is confined to small pockets of supporters. ""These groups previously had an extensive fundraising network in Canada but now appear to consist of smaller pockets of individuals with allegiance to the cause,"" it noted.Khalistani violent extremist groups have also been known to use networks to solicit donations from diaspora communities to raise and move funds, including through non-profit organisations,"" the Canadian govt's report noted. The acknowledgment of the use of violent means is in contrast to the description of their activities as ""democratic freedoms"" earlier.The report lists BKI and ISYF, along with Hamas and Hezbollah, in the ""politically motivated violent extremism"" category who have been able to generate funds in Canada.These groups, it said, used diverse funding methods to sustain their operations, including the abuse of the money services businesses and banking sectors; use of cryptocurrencies; state financing; abuse of the charitable and NPO sector; and criminal activity.The report covers all violent groups on how they were able to sustain themselves by finding resources within Canada. Self-financing methods were observed in two prominent terrorist attacks in Canada conducted by lone actors radicalised by ideologically motivated violent extremism.It cited the 2020 incident of a 17-year-old male radicalised by the incel (involuntary celibacy) movement who killed a woman and injured another at a massage parlour in Toronto, using only a sword to conduct the attack. Another case cited was from 2021, in which four members of a Muslim family were killed when an individual drove a pickup truck onto a pedestrian crosswalk in London, Ontario. In 2024, the individual was sentenced to life imprisonment for first-degree murder and attempted murder amounting to terrorism.The report also mentions Canada's financial sector may be exposed to risks emanating from correspondent banking relationships with institutions known or suspected of servicing Hezbollah or Hamas.Cross-border networks and organised IMVE groups differ from lone actors in their financing, it noted. ""Organised groups often rely on online communities and cross-border networks to raise funds and have been observed to rely on a host of financing methods, including commercial activities, such as merchandise sales; hosting paid events, such as talks and concerts; crowdfunding; charging membership fees; and accepting donations,"" it said. ""Some groups have also been known to engage in drug trafficking, weapons trafficking, and theft to fund their operations,"" the report added.","Pro-Khalistan terror outfits like Babbar Khalsa International and International Sikh Youth Federation are receiving financial support within Canada. The Canadian govt's official report 'Assessment of Money Laundering and Terrorist Financing Risks' acknowledges that the extremist groups are resorting to ""violent means to establish an independent state""","https://static.toiimg.com/thumb/msid-123741607,imgsize-86584,width-400,resizemode-4/representative-image.jpg"
Mumbai: Fire breaks out on 7th floor of high-rise in Dahisar; rescue under way,https://timesofindia.indiatimes.com/india/mumbai-fire-breaks-out-on-7th-floor-of-high-rise-in-dahisar-rescue-under-way/articleshow/123746494.cms,"Fire breaks out on 7th floor of high-rise in Dahisar, Mumbai (Representative AI Image)

MUMBAI: A fire broke out in a 24-storey residential tower in Dahisar East on Sunday afternoon, civic officials said.The blaze was reported around 3 pm on the seventh floor of New Janakalyan Society at Shanti Nagar.One woman has died and 18 are injured in the deadly fire accident, officials confirmed.The high-rise was heavily smoke-logged, posing challenges for firefighters engaged in rescue and containment operations. At least seven fire engines, along with other emergency response vehicles, were rushed to the spot.Officials said that the fire has been brought under control. The exact cause of the blaze is yet to be ascertained.","The blaze was reported around 3 pm on the seventh floor of New Janakalyan Society at Shanti Nagar. The high-rise was heavily smoke-logged, posing challenges for firefighters. At least seven fire engines, along with other emergency response vehicles, were rushed to the spot.","https://static.toiimg.com/thumb/msid-123748811,imgsize-43032,width-400,resizemode-4/fire-breaks-out-on-7th-floor-of-high-rise-in-dahisar-mumbai.jpg"
4 arrested after 22-year-old killed in Meerut clash:,https://timesofindia.indiatimes.com/india/4-arrested-after-22-year-old-killed-in-meerut-clash/articleshow/123754738.cms,22-year-old man was stabbed to death after a violent clash broke out between two groups during a Ganesh immersion procession in Meerut on Saturday night. Police said four persons have been arrested so far and three special teams formed to investigate the matter.,A 22-year-old man was stabbed to death after a violent clash broke out between two groups during a Ganesh immersion procession in Meerut on Saturday night. Police said four persons have been arrested so far and three special teams formed to investigate the matter.,"https://static.toiimg.com/thumb/msid-123754743,imgsize-26370,width-400,resizemode-4/file-image.jpg"
Gas leak at MP fertiliser plant kills 3 workers,https://timesofindia.indiatimes.com/india/gas-leak-at-mp-fertiliser-plant-kills-3-workers/articleshow/123754702.cms,"INDORE: Three workers died while another was hospitalised after a suspected gas leak at a lubricant-manufacturing factory in Madhya Pradesh's Dhar district Sunday.The accident occurred around 8.30pm when employees of Sagarshri Lubricants Pvt Ltd in Pithampur's Bagdun area entered a chamber for routine maintenance and were exposed to toxic fumes.DIG Nimesh Agrawal identified the deceased as Manawar residents Sushil Karma (35) and Jagdish Ninama (30), and Deepak Jamod from Indore. The hospitalised worker was stable, he said.Company manager Lokesh Gupta said one of the workers lost consciousness, prompting two colleagues to rush to his aid. All three were soon overwhelmed by the fumes. The trio was taken to a hospital and later referred to Indore's MY Hospital, where they were declared dead. An inquiry has been ordered.",The accident occurred at Sagarshri Lubricants Pvt Ltd in Pithampur's Bagdun area. DIG Nimesh Agrawal identified the deceased as Manawar residents Sushil Karma (35) and Jagdish Ninama (30) The hospitalised worker was stable.,"https://static.toiimg.com/thumb/msid-123754734,imgsize-15574,width-400,resizemode-4/representative-image.jpg"
Lobbyist hired by India meets Trump,https://timesofindia.indiatimes.com/india/lobbyist-hired-by-india-meets-trump/articleshow/123752970.cms,"Jason Miller, head of lobbying firm SHW Partners hired by India, has met US President Trump and a few officials against the backdrop of tensions over Washington's policy on trade and tariffs. Miller did not mention the purpose of his meeting with Trump and others, but posted several photos including one with the President on social media. PTI","Jason Miller, head of lobbying firm SHW Partners hired by India, has met US President Trump and a few officials. Miller did not mention the purpose of his meeting with Trump and others, but posted several photos including one with the President on social media.","https://static.toiimg.com/thumb/msid-47529300,imgsize-110164,width-400,resizemode-4/47529300.jpg"
"Mushroom murders: Erin Patterson, who served death to family at lunch, jailed for life; 3 died, but mystery is still alive",https://timesofindia.indiatimes.com/world/rest-of-world/mushroom-murders-erin-patterson-who-served-death-to-family-at-lunch-jailed-for-life-3-died-but-mystery-is-still-alive/articleshow/123755460.cms,"Erin Patterson, who killed 3 during lunch sentenced to life

A global spectacle in a quiet town



A family shattered



The mystery of the meal







Erin Patterson, the woman at the centre of the notorious ""mushroom murders"" case, was sentenced to life in prison by an Australian judge on Monday, with the possibility of parole after 33 years.The latest development in the mushroom murders case ended a saga that gripped audiences around the world.Patterson, 50, was convicted in July of murdering her estranged husband's parents, Don and Gail Patterson, and his aunt Heather Wilkinson, during a family lunch in 2023. She served them a beef Wellington laced with deadly death cap mushrooms, the world's most lethal fungus, at her home in rural Victoria.Heather’s husband, Pastor Ian Wilkinson, is the sole survivor in the case.The case caught the global attention. The trial held in Morwell transformed the courthouse into a media circus. Podcasters, documentary crews, and true-crime fanatics crowded the courtroom, while news outlets from different parts of the world covered each revelation. The crime became so infamous that it was simply branded the ""mushroom murders.""The motive for the killings remains elusive. Justice Christopher Beale, in handing down the sentence in Melbourne, said Patterson had shown no remorse for the deaths.""Your failure to exhibit any remorse pours salt into all the victims' wounds,"" he told the court. ""The gravity of your offending warrants the imposition of the maximum penalties for your crimes.""Patterson, wearing a paisley shirt with her hair tied back, remained impassive as the sentence was read. She will be 83 years old before becoming eligible for parole. Her lawyers had pleaded for a chance at release after 30 years, arguing her notoriety means she will spend much of her sentence in isolation. She has 28 days to appeal.The July jury verdict found Patterson guilty of three counts of murder and one count of attempted murder. Her estranged husband, Simon Patterson, who was invited to the fatal meal but pulled out at the last minute, later told the court he felt ""uncomfortable"" attending. The couple had been locked in a bitter dispute over child support at the time.The court heard harrowing victim impact statements. Pastor Wilkinson, the only survivor, said he now feels ""half alive"" without his wife.""The silence in our home is a daily reminder,"" he said. ""I continue to carry a heavy burden of grief over her untimely death.""Outside the courtroom on Monday, he thanked the community for its support. ""I'd like to encourage everybody to be kind to each other,"" he said. ""Please respect our privacy as we continue to grieve and heal.""Throughout the two-month trial, Patterson maintained the poisoning was accidental, claiming the mushrooms were mistakenly used in the dish. Death caps — which grow wild in parts of Victoria — are often confused with edible varieties and are said to have a sweet taste that masks their lethality.But for many observers, what remains most chilling is not the science of the poison, but the silence of the motive. More than a year after the beef Wellington lunch, the question of why still lingers.","Erin Patterson, 50, was convicted in July of murdering her estranged husband's parents. She served them a beef Wellington laced with deadly death cap mushrooms, the world's most lethal fungus. Justice Christopher Beale, in handing down the sentence, said Patterson had shown no remorse.","https://static.toiimg.com/thumb/msid-123755524,imgsize-1344862,width-400,resizemode-4/erin-patterson-who-killed-3-during-lunch-sentenced-to-life.jpg"
'Hottest place to be': Trump unveils renovated Rose Garden Club; new White House venue for power dinners,https://timesofindia.indiatimes.com/world/us/hottest-place-to-be-trump-unveils-renovated-rose-garden-club-new-white-house-venue-for-power-dinners/articleshow/123737764.cms,"Members of Congress at a dinner in the Rose Garden of the White House (AP)





US President Donald Trump unveiled the newly-renovated Rose Garden on Friday and introduced the Rose Garden Club, calling it the “hottest” place to be in Washington.“We have worked very hard to bring it to fruition and not an easy situation, but it’s something that I think we’re all going to enjoy for many, many years to come. It’s a tremendous place,” Trump said to the gathering invited to the dinner.The White House had not officially announced the new club before the event. Guests were served Rose Garden salad as a first course, followed by a choice of New York Strip steak, thyme roasted chicken, or a vegetarian pasta dish. Dessert was a fudge-filled cake.White House spokesman Davis Ingle said, as quoted by The New York Post, “The Rose Garden Club at the White House is the hottest place to be in Washington, or perhaps the world. The president looks forward to welcoming top business, political, and tech leaders for this dinner and the many dinners to come on the new, beautiful Rose Garden patio.”Trump said renovations to the garden were long overdue. “Every time we’d have a press conference, women in particular were sinking deep into the mud and at some point I said, you know, it’s time to make the change. We picked a great stone and we have a great speaker system.”The Rose Garden project, which began in April, is one of several renovations under Trump. He has redecorated the Oval Office and Cabinet Room with golden decor, erected two 100-foot flag poles on the North and South lawns, and is planning a self-funded $200 million ballroom by the East Wing.The new look, with its yellow umbrellas, recalled Trump’s private club at Mar-a-Lago, where he often hosts VIPs. In recent weeks, songs such as “Whiter Shade of Pale” by Procol Harum and “Are You Lonesome Tonight?” by Elvis have been heard outside the White House as the president tested the sound system.","US President Donald Trump unveiled the newly-renovated Rose Garden on Friday. Trump introduced the Rose Garden Club, calling it the “hottest’ place to be in Washington. Guests were served Rose Garden salad as a first course, followed by a choice of New York Strip steak, thyme roasted chicken, or a vegetarian pasta dish.","https://static.toiimg.com/thumb/msid-123737778,imgsize-1414106,width-400,resizemode-4/1-63.jpg"
Ukrainian stabbed in US subway: Donald Trump asked for reaction; watch video,https://timesofindia.indiatimes.com/world/us/ukrainian-stabbed-in-us-subway-donald-trump-asked-for-reaction-watch-video/articleshow/123756156.cms,"Ukrainian stabbed in US subway: Donald Trump asked for reaction; watch video





US President Donald Trump on Sunday condemned the stabbing of Iryna Zarutska, who escaped the Russia-Ukraine war to have a peaceful life in America.A reporter asked Trump, ""Iryna Zarutska was stabbed multiple times on a Charlotte subway. Have you seen this video, and do you have a reaction to it?""Trump, who was unaware of the incident, asked where the incident took place. The reporter briefed him on the matter, to which Trump said, ""Horrible.""""No, I haven't heard. When did this happen?"" Trump questioned the reporter.The reporter told him that the incident took place in August, and the chilling video had emerged now.Trump then promised to look into the incident by tomorrow morning.""I'll know all about it by tomorrow morning,"" he said.A haunting video of the incident is doing rounds on social media, where the 23-year-old Ukrainian woman, Iryna Zarutska, was seen travelling in a light rail in Charlotte. Zarutka was fiddling with her phone when Decarlos Brown Jr, 35, pulled out a pocket knife and stabbed her multiple times, footage shared by police shows.After brutally attacking her, Decarlos was seen wandering on the Lynx Blue train. Blood was spattering across the floor as he was carrying the weapon with him.A few of the passengers noticed the blood on the floor. The suspect took off his hoodie and waited to exit the train.","Ukrainian woman, Iryna Zarutska, was stabbed multiple times on a Charlotte subway. The 23-year-old escaped the Russia-Ukraine war to have a peaceful life in America. A haunting video of the incident is doing rounds on social media.","https://static.toiimg.com/thumb/msid-123756635,imgsize-1223152,width-400,resizemode-4/iryna-zarutska.jpg"
'Respect laws': Trump’s call to foreign firms after Hyundai plant raid; asks them to train Americans,https://timesofindia.indiatimes.com/world/us/bring-very-smart-people-legally-trumps-warning-to-foreign-companies-after-hyundai-plant-raid-asks-them-to-respect-laws/articleshow/123755160.cms,"Trump's warning to foreign companies after Hyundai plant raid

Screams, Chains, Panic: Inside ICE’s Biggest Worksite Raid; Hyundai Georgia Plant Turns 'War Zone'





In a stern warning, US President Donald Trump on Sunday called upon the foreign countries investing in America to abide by immigration laws.Trump's statement came after around 475 illegal workers were arrested after federal immigration authorities raided the Hyundai plant in Georgia. Many of the detained workers were South Korean citizens.In a lengthy post on his Truth Social platform, the US president welcomed foreign investments but insisted compliance with American immigration law is non-negotiable.""Following the Immigration Enforcement Operation on the Hyundai Battery Plant in Georgia, I am hereby calling on all Foreign Companies investing in the United States to please respect our Nation’s Immigration Laws,"" he wrote.Trump further said that investments in US are welcome, urging companies to bring their people ""LEGALLY.""""Your Investments are welcome, and we encourage you to LEGALLY bring your very smart people, with great technical talent, to build World Class products, and we will make it quickly and legally possible for you to do so. What we ask in return is that you hire and train American Workers,"" he added in the post.""Together, we will all work hard to make our Nation not only productive, but closer in unity than ever before.Thank you for your attention to this matter!"" he said.Following the arrest of South Korean workers, law enforcement officials said that the raid was conducted after a months-long investigation into suspicions of unlawful employment practices at the plant. The HL-GA Battery Co plant, is a joint venture of LG Energy Solution and Hyundai Motor Group.The South Korean government on Sunday reached an agreement with US following diplomatic talks to free the Korean workers and fly them back.However, many details of the raid, including what the investigation found, are unclear.",US President Donald Trump on Sunday called upon foreign countries investing in America to abide by immigration laws. Trump's statement came after around 475 illegal workers were arrested after federal immigration authorities raided the Hyundai plant in Georgia. Many of the detained workers were South Korean citizens.,"https://static.toiimg.com/thumb/msid-123755225,imgsize-970667,width-400,resizemode-4/trump39s-warning-to-foreign-companies-after-hyundai-plant-raid.jpg"
