Article Title,Article Link,Article Text,Article Summary,Article Image
A promotion after defeat: What's behind Asim Munir's Field Marshal gambit,https://timesofindia.indiatimes.com/world/pakistan/field-marshal-asim-munir-pakistan-army-chief-operation-sindoor-india-and-pakistan/articleshow/121319156.cms,"Asim Munir’s grip on power may look firm, but it’s anything but secure.

Promotion or protection?

Officially, the move is being framed as a recognition of ""strategic brilliance."" PM Sharif praised Munir’s ""decisive defeat of the enemy,"" asserting that under his leadership, the military ""staunchly defended Pakistan’s sovereignty."" Munir himself called the promotion ""an honour for the armed forces and the nation.""

But few outside Pakistan’s tightly controlled media landscape are buying it.

""Field Marshal rank is usually conferred after a military victory,"" Tilak Devasher, a seasoned Pakistan watcher, told the Economic Times. ""This may be the first time it has been awarded after a defeat-it seems intended to mask that defeat.""

The timing is hard to ignore. Pakistan’s public is still reeling from the fallout of the India strikes, and internal dissent within the army is reportedly rising.

A widely circulated letter from a group calling itself ""The Guardians of Honour"" accused Munir of corruption and military incompetence. The letter reflects what some analysts say is quiet but growing discontent within senior ranks.

A shield against scrutiny

All ceremony, no strategy

The big picture: The war at home

Munir’s rise comes at a fragile moment for Pakistan. The ceasefire with India has held for now. But underneath the diplomatic calm lies a volatile domestic landscape:

Security turmoil: Over 3,700 terror incidents have claimed nearly 3,900 lives in the past 17 months, according to ISPR figures-pointing to a deteriorating internal security climate, especially in Balochistan and Khyber Pakhtunkhwa.

Over 3,700 terror incidents have claimed nearly 3,900 lives in the past 17 months, according to ISPR figures-pointing to a deteriorating internal security climate, especially in Balochistan and Khyber Pakhtunkhwa. Political unrest: The jailing of former PM Imran Khan and suppression of PTI supporters has fueled an undercurrent of defiance. Critics accuse Munir of leveraging the Pahalgam terror incident to consolidate power.

The jailing of former PM Imran Khan and suppression of PTI supporters has fueled an undercurrent of defiance. Critics accuse Munir of leveraging the Pahalgam terror incident to consolidate power. Economic fragility: With rising inflation, IMF-dependency, and India's suspension of the Indus Waters Treaty, Pakistan's economy teeters on the edge. The military’s growing political role is being scrutinized for exacerbating the instability.

With rising inflation, IMF-dependency, and India's suspension of the Indus Waters Treaty, Pakistan's economy teeters on the edge. The military’s growing political role is being scrutinized for exacerbating the instability. Observers note that Munir is not merely defending national borders-he is navigating a labyrinth of domestic vulnerabilities that could unravel his authority.

His use of the two-nation theory and religious rhetoric to frame the India conflict was seen by critics as an attempt to rally the nation behind him. But the strategy may have backfired. ""Instead of unifying the nation, the gambit drew attention to Pakistan’s widening fractures,"" write analysts Ashok Behuria and Uttam Sinha in a joint commentary in the TOI.

The ghost of Imran Khan

What’s next

Munir’s elevation to Field Marshal is not about military strategy-it’s about political survival. It’s about shoring up a fractured command structure, muffling dissent, and projecting strength in the face of growing weakness.

Though the promotion may temporarily strengthen Munir’s position, it doesn’t erase the challenges ahead:

Internal threats persist, from Baloch separatists to the resurgent Tehreek-e-Taliban Pakistan.

PTI's political comeback looms, with Khan’s moral leverage growing even from prison.

Civil-military tension could intensify, especially if the rank is seen as an attempt to silence dissent or circumvent institutional checks.

There’s also talk of Munir eventually transitioning into a political role-possibly even as president. Ayub Khan set the precedent. In Pakistan’s fragile democracy, few would be surprised if history rhymed again.





In a move steeped more in symbolism than substance, Pakistan’s powerful army chief General Asim Munir has been elevated to the rarefied rank of Field Marshal . The announcement, made on Tuesday by Prime Minister Shehbaz Sharif’s cabinet, marks the first such promotion in over six decades. Only one other man-military dictator Ayub Khan in 1959-has held the title.But unlike Ayub, who awarded himself the rank amid consolidating his political power, Munir’s elevation comes on the heels of a military debacle. A bruising exchange with India, following a deadly attack in Pahalgam, resulted in India striking at least nine Pakistani air bases. The damage, while officially downplayed in Pakistan, left Munir politically exposed.So why the promotion? And why now?In a country where generals often enjoy impunity, the Field Marshal title may serve more as legal and political armor than as a mark of distinction. Some analysts see the promotion as a pre-emptive move to insulate Munir from possible court martial or early retirement, the ET report said.Legal experts point out that the Pakistani constitution makes no mention of the rank.Nor does the Pakistan Army Act. Instead, the promotion was reportedly made under Rule 199A of the Army Regulations (1998), which states that a general may be promoted to Field Marshal ""without regard to seniority or any specific appointment.""In essence, the move raises Munir above the military’s existing command structure-and, potentially, above accountability.Though technically ceremonial, the rank carries potent political meaning. In Pakistan’s civil-military power dynamic, optics often matter more than operational command.""Munir is now very much in the driving seat as the pivot of the power structure,"" said Senator Mushahid Hussain Syed, former chair of the Senate defense committee. ""Given the weakness and divisions amongst the civilian politicians... all the mainstream political forces were convinced that the road to Islamabad lies through Rawalpindi.""That reality is reflected in the government’s simultaneous decision to extend the term of air chief marshal Zaheer Ahmed Babar Sidhu-his second extension. Sidhu was credited with executing Operation Bunyanun Marsoos, Pakistan’s retaliatory air campaign against India's Operation Sindoor Still, in a tightly managed information environment, the military’s version of events prevails. State media declared a historic victory. Social media was flooded with hashtags like #PakistanStandsUnited. Meanwhile, dissenting voices-journalists, analysts, even former officers-vanished from screens.Munir’s political calculus also includes a rising challenge from behind bars: Former Prime Minister Imran Khan. His PTI party has labeled Munir a ""warmonger and coward,"" accusing him of dragging Pakistan into war to consolidate power. Khan’s moral authority, paradoxically strengthened by his imprisonment, continues to mobilize his base.Sharif’s civilian government, already seen as beholden to the military, risks further erosion of legitimacy. As one viral meme put it: ""War fought by Airforce. Army Chief promoted. Army’s only contribution-taking videos of tanks and hiding in bunkers.""(With inputs from agencies)","Pakistan's powerful army chief Asim Munir has been elevated to the rank of Field Marshal. The move is being framed as a recognition of ""strategic brilliance"" But critics accuse Munir of leveraging the Pahalgam terror incident to consolidate power.","https://static.toiimg.com/thumb/msid-121319353,imgsize-38182,width-400,resizemode-4/121319353.jpg"
Pakistan Supreme Court upholds death penalty in beheading case,https://timesofindia.indiatimes.com/world/pakistan/pakistan-supreme-court-upholds-death-penalty-in-beheading-case/articleshow/121300483.cms,"



ISLAMABAD: In a landmark judgment, the Supreme Court of Pakistan on Tuesday upheld the death sentence of Zahir Jaffer , convicted of the gruesome 2021 murder of Noor Mukadam, the 27-year-old daughter of a former Pakistani diplomat.The decision, delivered by a three-member bench led by Justice Hashim Kakar, reaffirmed the judiciary’s stance on a case that has gripped the nation and exposed deep-seated issues of gender violence and privilege in Pakistan’s elite circles. The ruling, however, also raises questions about the consistency of justice in a country where systemic inequalities often shield the powerful.The case, one of the most high-profile in Pakistan’s recent history, stems from the horrific events of July 20, 2021, when Noor Mukadam was found tortured and beheaded at Jaffer’s residence in Islamabad’s upscale Sector F-7/4.Jaffer, a Pakistani-American and son of a wealthy industrialist, was arrested at the scene, covered in blood. Investigations revealed that Mukadam, a childhood acquaintance, was held hostage for two days, tortured with a knuckleduster, raped, and ultimately decapitated after allegedly rejecting Jaffer’s marriage proposal. The brutality of the crime, coupled with the elite status of both the victim and the perpetrator, sparked nationwide outrage and reignited debates over violence against women in Pakistan.The apex court’s verdict dismissed Jaffer’s appeal, which claimed “erroneous appreciation” of evidence and questioned the fairness of the trial due to media influence. The court upheld the death penalty for murder but converted Jaffer’s second death sentence for rape to life imprisonment, citing legal considerations.“This is not just my daughter’s case; it is a case for all the daughters of Pakistan,” said Shaukat Mukadam, Noor’s father. The ruling has been hailed by many as a victory for accountability, with social media posts on X reflecting public relief: “I hope Noor’s parents will sleep a little better tonight,” wrote one user, while another called it a “win for humanity.” Yet, the decision also exposes uncomfortable truths about Pakistan’s legal and social landscape.Critics argue that the case’s prominence owes much to the victim’s elite background, highlighting a stark disparity in how justice is pursued. “Mukadam’s status as a diplomat’s daughter shone a spotlight on her murder,” said women’s rights activist Tahira Abdullah, noting that countless similar cases involving less privileged women rarely garner such attention or swift judicial action. Pakistan ranks 153 out of 156 countries in the World Economic Forum’s 2021 gender gap index, and domestic violence remains a pervasive issue, with 28% of women aged 15-49 reporting physical violence, according to the ministry of human rights.","The Supreme Court of Pakistan upheld the death sentence of Zahir Jaffer. Jaffer was convicted of the gruesome 2021 murder of Noor Mukadam, the 27-year-old daughter of a former Pakistani diplomat. The ruling raises questions about the consistency of justice in a country where systemic inequalities often shield the powerful.","https://static.toiimg.com/thumb/msid-121300499,imgsize-124322,width-400,resizemode-4/121300499.jpg"
Pakistan promotes army chief Munir to 5-star rank of Field Marshal for ‘crushing enemy’,https://timesofindia.indiatimes.com/world/pakistan/pakistan-promotes-army-chief-munir-to-5-star-rank-of-field-marshal-for-crushing-enemy/articleshow/121300334.cms,"



ISLAMABAD: The Shehbaz Sharif govt in Pakistan promoted Tuesday army chief Syed Asim Munir from general to the five-star rank of Field Marshal in recognition of what it described as “exemplary leadership” while responding to India’s Operation Sindoor and bringing “great honour to our motherland”.For a country that has had four military rulers at different periods in its history, Field Marshal Munir is only the second Army chief to have been elevated to the apex rank, modelled on the British army’s structure. The first one, Field Marshal Ayub Khan, assumed the rank in 1959 while he was President, citing “requests” from Pakistani civil society.PM Shehbaz’s office announced that the cabinet unanimously decided to also continue the services of Air Chief Marshal Zahar Ahmed Babar Sidhu after his term ends.The statement also claimed that Pakistan downed five Indian jets and thwarted “further incursions”, leading to a US-mediated pause in military operations from May 10. Inter-Services Public Relations (ISPR), the army’s media affairs wing, quoted Field Marshal Munir as dedicating the honour to “the nation, armed forces, and martyrs”.In a congratulatory statement on X, Shehbaz credited Field Marshal Munir with orchestrating a “high strategy” during the conflict with India, which escalated with the latter’s May 6-7 airstrikes targeting nine terrorist sites.Operation Sindoor was India’s response to 26 deaths in the April 22 terrorist attack on tourists in J&K’s Pahalgam.Without naming India, Shehbaz said that under Field Marshal Munir, the army “crushed the enemy’s nefarious designs”.With Pakistan’s history of military coups looming large, newly coronated Field Marshal Munir is widely seen as the kingmaker behind Shehbaz’s premiership. Critics of the move within Pakistan argue the promotion strengthens the military’s grip over civilian governance, especially amid domestic challenges like the Baloch insurgency and economic woes.The timing of the promotion, coinciding with Pakistan seeking US and EU’s support to counter “India’s terrorism narrative”, suggests a bid to project strength.While the PM's office and ISPR frame Field Marshal Munir’s elevation as a tribute to national resilience, its political undertones and opaque military claims raise concerns about democratic backsliding and regional instability.","Shehbaz Sharif govt in Pakistan promoted Tuesday army chief Syed Asim Munir from general to the five-star rank of Field Marshal. Field Marshal Munir is only the second Army chief to have been elevated to the apex rank, modelled on the British army's structure.","https://static.toiimg.com/thumb/msid-121300326,imgsize-12008,width-400,resizemode-4/121300326.jpg"
Yunus believes B'desh crisis product of 'conspiracy' to re-establish Indian hegemony: Nagorik Oikya chief,https://timesofindia.indiatimes.com/world/south-asia/yunus-believes-bdesh-crisis-product-of-conspiracy-to-re-establish-indian-hegemony-nagorik-oikya-chief/articleshow/121401370.cms,"



DHAKA: Chief adviser Mohammad Yunus has said the current crisis in Bangladesh is the product of a ""conspiracy"" to re-establish Indian hegemony in his country, according to Nagorik Oikya president Mahmudur Rahman Manna. Manna, after a meeting with Yunus on Sunday, which was attended by other political parties as well, also claimed that ""for this, Yunus believes that the entire nation needs to be united"".""He (Yunus) started the discussion by saying that we are in a big crisis. By this crisis, he spoke about the conspiracy of Indian hegemony. Indian hegemony does not want to accept this change in us at all. If possible, they want to destroy us in one day and for that, they are doing everything they need to do. These were his words,"" Manna told reporters.During the meeting on the pending national election, Yunus said efforts are underway to destabilise the country after the ban imposed on activities of the Awami League, according to press secretary Shafiqul Alam.Yunus has clearly said he would feel guilty if a fair election cannot be arranged, stressing that they are now going through a ""war-like situation"", he said, adding that the chief adviser assured political leaders that he would not allow anything that can harm the country's interest till he is on this post.","Chief adviser Mohammad Yunus has said the current crisis in Bangladesh is the product of a ""conspiracy"" to re-establish Indian hegemony in his country. Nagorik Oikya president Mahmudur Rahman Manna also claimed that ""for this, Yunus believes that the entire nation needs to be united""","https://static.toiimg.com/thumb/msid-121401377,imgsize-36786,width-400,resizemode-4/121401377.jpg"
"Bangladesh warns of action if govt's autonomy, reform efforts obstructed",https://timesofindia.indiatimes.com/world/south-asia/bangladesh-warns-of-action-if-govts-autonomy-reform-efforts-obstructed/articleshow/121401359.cms,"Md Yunus (File Photo AP)





DHAKA: The Bangladesh interim govt has said necessary steps will be taken together with the people if under ""instigation of defeated forces or as part of a foreign conspiracy"", the govt's performance of responsibilities becomes impossible.This came amid a growing rift between Bangladesh chief adviser Muhammad Yunus and the military leadership over a controversial proposal to facilitate a ""humanitarian corridor"" to Myanmar and days after the govt refuted a key ally's claim that Yunus had mulled resignation. ""The interim govt will take necessary decisions together with the people of the country if the govt's autonomy, reform efforts, justice process, fair election plan, and normal operations are obstructed to the point of making its duties unmanageable,"" the council of advisers said in a statement after an unscheduled meeting on Saturday.It said that if ""under the instigation of defeated forces or as part of a foreign conspiracy, the performance of these responsibilities becomes impossible, the govt will present all reasons to the public and then take the necessary steps with the people"".During a series of meetings on Saturday and Sunday, Yunus also rejected demands by major national parties, including BNP, to hold the national election by Dec this year, reiterating that the poll will be held in 2026 but not after June.""Muhammad Yunus is a man of his word. He gave a cut-off time. He won't go beyond that,"" chief adviser's press secretary Shafiqul Alam told reporters referring to the election likely to be held between Dec 2025 and June next year.Leaders of BNP, Jamaat-e-Islami, National Citizen Party and other political parties, except Awami League, held separate meetings with Yunus. NCP members said local govt polls should be held ahead of the national election - a demand being seen as the party's bid to have a chance at making its position stronger at the grassroots-level before the Bangladesh poll.","Bangladesh interim govt says necessary steps will be taken together with the people if under ""instigation of defeated forces or as part of a foreign conspiracy"" This came amid a growing rift between Bangladesh chief adviser Muhammad Yunus and the military leadership. Yunus rejected demands by major national parties, including BNP, to hold the national election by Dec this year.","https://static.toiimg.com/thumb/msid-121401365,imgsize-1175454,width-400,resizemode-4/121401365.jpg"
Bangladesh court begins first trial of Sheikh Hasina-era officials,https://timesofindia.indiatimes.com/world/south-asia/bangladesh-court-begins-first-trial-of-sheikh-hasina-era-officials/articleshow/121393098.cms,"Bangladesh court begins first trial of Hasina-era officials

'Command responsibility'





DHAKA: Bangladesh began the first trial on Sunday at a special court prosecuting former senior figures connected to the ousted government of Sheikh Hasina, the chief prosecutor said.The court in the capital Dhaka accepted a formal charge against eight police officials in connection to the killing of six protesters on August 5 last year, the day Hasina fled the country as the protesters stormed her palace.The eight men are charged with crimes against humanity. Four are in custody and four are being tried in absentia.""The formal trial has begun,"" Tajul Islam, chief prosecutor of Bangladesh's domestic International Crimes Tribunal (ICT), told reporters.""The prosecution believes that this prosecution will be able to prove the crimes done by the accused,"" he said.It is the first formal charge in any case related to the killings during last year's student-led uprising, which ended Hasina's iron-fisted rule of 15 years.Up to 1,400 people were killed between July and August 2024 when Hasina's government launched a brutal campaign to silence the protesters, according to the United Nations.The list of those facing trial includes Dhaka's former police commissioner, Habibur Rahman, who is among those being tried in absentia.Hasina also fled by helicopter to India, her old ally.She remains in self-imposed exile, defying Dhaka's extradition request to face charges of crimes against humanity.The launch of the trials of senior figures from Hasina's government is a key demand of several of the political parties now jostling for power as the South Asian nation awaits elections that the interim government has vowed will take place before June 2026.Islam said the eight men were accused of ""different responsibilities"", including the most senior for ""superior command responsibility, some for direct orders.. (and) some for participation"".He said he was confident of a successful prosecution.""We have submitted as much evidence as required to prove crimes against humanity, both at a national and an international standard,"" he said.Among that evidence, he said, was video footage of the violence, as well as voice recordings of Hasina in ""conversations with different people where she ordered the killing of the protesters using force and lethal weapons"".The ICT was set up by Hasina in 2009 to investigate crimes committed by the Pakistani army during Bangladesh's war for independence in 1971.It sentenced numerous prominent political opponents to death over the following years and became widely seen as a means for Hasina to eliminate rivals.",Court in Dhaka accepts formal charge against eight police officials in connection to the killing of six protesters. Four are in custody and four are being tried in absentia. It is the first formal charge in any case related to the killings during last year's student-led uprising.,"https://static.toiimg.com/thumb/msid-121393156,imgsize-934008,width-400,resizemode-4/121393156.jpg"
"Afghanistan hit by 4.2 magnitude earthquake, fifth in nine days",https://timesofindia.indiatimes.com/world/south-asia/afghanistan-hit-by-4-2-magnitude-earthquake-fifth-in-nine-days/articleshow/121388780.cms,"Representative image

Poll Do you believe that Afghanistan is adequately prepared for natural disasters? Yes No





An earthquake of magnitude 4.2 struck Afghanistan in the early hours of Sunday, marking the fifth tremor to jolt the country in just over a week. According to the National Center for Seismology (NCS), the latest earthquake occurred at 6.33am IST at a depth of 135 kms.So far, there have been no confirmed reports of injuries or structural damage, though assessments are still underway.The region experienced four previous earthquakes between May 16 and May 20. On Monday, May 19, a 4.2 magnitude quake was recorded. A day earlier, on May 18, a slightly stronger 4.5 magnitude earthquake struck at a depth of 150 kms. Prior to that, quakes of magnitudes 4.2 and 4.0 were reported on May 17 and 16, respectively.The recent spike in seismic activity has raised concerns among experts and residents alike. Afghanistan, particularly the Hindu Kush region, is recognised as a seismically active zone due to its location along the collision boundary between the Indian and Eurasian tectonic plates. A major fault line also runs through the western province of Herat, further amplifying the region’s vulnerability.The International Red Cross and the United Nations Office for the Coordination of Humanitarian Affairs (UNOCHA) have frequently highlighted Afghanistan’s susceptibility to natural disasters, including earthquakes, landslides, and seasonal flooding.More information is awaited as monitoring agencies continue to assess the impact.","The latest earthquake occurred at 6.33am IST at a depth of 135 kms. The region experienced four previous earthquakes between May 16 and May 20. Afghanistan, particularly the Hindu Kush region, is recognised as a seismically active zone due to its location along the collision boundary between the Indian and Eurasian tectonic plates.","https://static.toiimg.com/thumb/msid-121388790,imgsize-865786,width-400,resizemode-4/121388790.jpg"
