Article Title,Article Link,Article Text,Article Summary,Article Image
'Putin is testing the world': Zelenskyy calls for Russia sanctions after massive attack on Ukraine; European leaders to meet in US this week,https://timesofindia.indiatimes.com/world/europe/putin-is-testing-the-world-zelenskyy-calls-for-russia-sanctions-after-massive-attack-on-ukraine-european-leaders-to-meet-in-us-this-week/articleshow/123755639.cms,"Zelenskyy

‘Shocked’ Zelensky Quietly Watches As NATO Nation Leader Beckons Russia With Praise





Ukraine’s President Volodymyr Zelenskyy called for tougher sanctions on Russia after Moscow launched its largest aerial assault since the start of the war, striking government buildings and residential areas across the country.In a series of posts on X, Zelenskyy said international condemnation must be matched by concrete steps. ""It is important that today we saw a broad response from our partners to this strike. Clearly, Russia is trying to inflict pain on Ukraine with even more brazen attacks. This is a clear sign that Putin is testing the world – whether they will accept or tolerate this,"" he said.“That is why statements by state leaders and institutions must be backed by strong actions – sanctions against Russia and individuals connected with Russia, tough tariffs and other restrictions on trade with Russia. Their losses must be felt. That is what is truly convincing,” further added Zelenskyy.Further accusing Putin of not wanting an end to the war, he added, ""Equally important – our long-range capabilities. Putin does not want negotiations, he is clearly hiding from them, so Russia’s fuel shortages and other economic troubles are the logical response to its refusal to agree to a ceasefire or a meeting at the leaders’ level.""Zelenskyy's remarks came after the overnight assault that led into Sunday, involved more than 800 drones and 13 missiles, including four ballistic, according to Ukrainian officials. For the first time, the Cabinet of Ministers building in Kyiv was directly hit, with a fire breaking out on its upper floors. Prime Minister Yulia Svyrydenko confirmed the damage, saying: “For the first time, the Government building, its roof, and upper floors were damaged by the enemy attacks. Rescuers are extinguishing the fire. I thank them for their work.”Air raid sirens rang out in Kyiv for 11 hours. An infant was among at least two people killed when residential buildings were struck, with dozens more injured. “In one of them, the floors between the 4th and 8th stories have collapsed. As of now, two people have been reported killed, including one child,” Zelenskyy said.Other regions were also hit. “More than 20 houses and a kindergarten were damaged in Zaporizhzhia. Warehouses were destroyed in Kryvyi Rih, one person was killed in Safonivka, Sumy region, and another one in the Chernihiv region. A residential high-rise was hit in Odesa. Many regions have been affected over the past day,” Zelenskyy added.He condemned the strikes as “vile,” calling them a “deliberate crime and a prolongation of the war.” He urged allies to deliver on previous commitments made in Paris and Washington to strengthen Ukraine’s air defences. “Every additional system saves civilians from these vile strikes,” he said.The Ukrainian President's call for sanctions followed US President Donald Trump , who said, that he was prepared to impose additional sanctions on Moscow. Asked if he was ready to move to a “second phase” of measures against Russian President Vladimir Putin, Trump replied: “Yes, I am.”Trump also said European leaders would visit the White House on September 8 or 9, adding that he expects to speak “soon” with Russian President Vladimir Putin as part of efforts to end the war in Ukraine.The attack, which surpassed a massive bombardment in July, comes amid renewed Western efforts to broker a peace deal. Russian President Vladimir Putin warned last week that any Western troops deployed in Ukraine would be considered “legitimate targets for defeat.” “The world can force the Kremlin criminals to stop the killings – all that is needed is political will,” Zelenskyy said.","Ukraine’s President Volodymyr Zelenskyy called for tougher sanctions on Russia. Moscow launched its largest aerial assault since the start of the war, striking government buildings and residential areas across the country. For the first time, the Cabinet of Ministers building in Kyiv was directly hit, with a fire breaking out on its upper floors.","https://static.toiimg.com/thumb/msid-123756286,imgsize-1055451,width-400,resizemode-4/article.jpg"
'People decide the narrative': Elon Musk defends X fact-checking Peter Navarro's anti-India claims; Trump aide called it 'crap note',https://timesofindia.indiatimes.com/world/us/people-decide-the-narrative-elon-musk-defends-x-fact-checking-peter-navarros-anti-india-claims-trump-aide-called-it-crap-note/articleshow/123755454.cms,"Elon Musk attends a news conference with President Donald Trump in the Oval Office of the White House (AP)





NEW DELHI: Elon Musk on Sunday defended X's fact-checking system after Peter Navarro, an aide to former US President Donald Trump, criticised the platform for fact-checking his anti-India post. Musk said the platform is committed to community-driven narrative without directly addressing Navarro.Musk wrote on X, ""On this platform, the people decide the narrative. You hear all sides of an argument. Community Notes corrects everyone, no exceptions. Notes, data, and code is public source. Grok provides further fact-checking.""Navarro posted anti-India content, criticising New Delhi's Russian oil imports, but received fact-checking corrections on X that challenged his claims as hypocritical.His post read: ""FACTS: India highest tariffs costs US jobs. India buys Russian oil purely to profit/Revenues feed Russia war machine. Ukrainians/Russians die. US taxpayers shell out more. India can't handle truth/spins.""X's fact-checking system highlighted that India's oil purchases serve energy security needs and comply with sanctions. It noted the US-India trade surplus in services and pointed out America's continued Russian imports.Additional fact-checking noted the legitimacy of India's sovereign oil purchases and their compliance with international law.The platform highlighted the inconsistency in US criticism of India's oil trade whilst maintaining its own Russian imports, including uranium.Navarro reacted negatively to the fact-checks, criticising Musk for allowing what he termed ""propaganda"" in posts.He wrote: ""Wow. @elonmusk is letting propaganda into people's posts. That crap note below is just that. Crap. India buys Russian oil solely to profiteer. It didn't buy any before Russia invaded Ukraine. Indian govt spin machine moving high tilt. Stop killing Ukrainians. Stop taking American jobs.""Navarro has consistently criticised India, particularly following Trump's implementation of secondary tariffs exceeding 50 per cent on Indian exports. He termed the Russia-Ukraine conflict as ""Modi's war"", suggesting India's Russian oil purchases support Moscow's military actions. He also described India as a ""laundromat for the Kremlin"" and made discriminatory remarks about caste.","X's fact-checking system highlighted that India's oil purchases serve energy security needs and comply with sanctions. It noted the US-India trade surplus in services and pointed out America's continued Russian imports. Peter Navarro reacted negatively to the fact-checks, criticising Musk for allowing what he termed ""propaganda""","https://static.toiimg.com/thumb/msid-123755589,imgsize-1424621,width-400,resizemode-4/september-8.jpg"
'A little bit of lead': Donald Trump says Zohran Mamdani likely to be next mayor; denies meddling,https://timesofindia.indiatimes.com/world/us/a-little-bit-of-lead-donald-trump-says-zohran-mamdani-likely-to-be-next-mayor-denies-meddling/articleshow/123709530.cms,"'Trump A Threat To New York': Zohran Mamdani Challenges U.S. President On Takeover By National Guard





US President Donald Trump on Thursday said that Democrat Zohran Mamdani is likely to become New York City's next mayor unless two of his three major rivals drop out. However, the Republican leader declined to name which candidates he thought should quit.Speaking at a White House dinner with tech executives, Trump denied urging anyone to exit the race but suggested the crowded field benefits Mamdani. ""I don't think you can win unless you have one-on-one, and somehow he's gotten a little bit of a lead,"" Trump said. ""I would like to see two people drop out and have it be one-on-one, and I think that's a race that could be won.""Mamdani, a 33-year-old democratic socialist, became the presumptive frontrunner after defeating former governor Andrew Cuomo in June's Democratic primary. But both Cuomo and incumbent Mayor Eric Adams remain on the ballot as independents, joined by Republican Curtis Sliwa, founder of the Guardian Angels.Behind the scenes, Trump allies have floated scenarios for narrowing the race. Intermediaries recently reached out to Adams' circle about the possibility of him dropping his campaign for a federal role, according to people familiar with the talks, AP reported. Adams, indicted last year on corruption charges before prosecutors dropped the case, has said he will not leave the race.""No pressure, no diamonds,"" Adams said Thursday.Cuomo has openly called for Adams to quit, arguing that Mamdani poses ""an existential threat"" to Democrats. Sliwa, meanwhile, rejected speculation that Adams' voters would automatically migrate to Cuomo and insisted he is staying in the race. ""I can assure you for the 9,852th time: I'm not dropping out. I'm in it until November 4,"" Sliwa said.Meanwhile, Mamdani threw down a challenge to Trump, daring him to face off in a televised debate. This came after Cuomo urged him to take part in five debates, one in each borough.""Let's cut out the middle man,"" Mamdani told The New York Post. ""Why should I debate Donald Trump's puppet when I could debate Donald Trump himself?""""If Donald Trump is serious about intervening in the mayoral race, he should come to New York City and debate me directly about why he's cutting SNAP benefits for hungry New Yorkers to give tax breaks to his wealthy donors,"" Mamdani told New York Post.","US President Donald Trump says Democrat Zohran Mamdani is likely to become New York City's next mayor unless two of his three major rivals drop out. However, the Republican leader declined to name which candidates he thought should quit. Both Cuomo and incumbent Mayor Eric Adams remain on the ballot as independents.","https://static.toiimg.com/thumb/msid-123710707,imgsize-1455608,width-400,resizemode-4/39a-little-bit-of-lead39-donald-trump-says-zohran-mamdani-likely-to-be-next-mayor-denies-meddling.jpg"
White House pushes 'warrior ethos': Donald Trump revives 'department of war'; Pete Hegseth gets a new title,https://timesofindia.indiatimes.com/world/us/white-house-pushes-warrior-ethos-donald-trump-revives-department-of-war-pete-hegseth-to-be-styled-secretary-of-war/articleshow/123709172.cms,"Donald Trump is renaming the defence department the department of war

Trump Rebrands ‘Woke’ Pentagon, Announces ‘Department Of War’ | ‘Just Sounds Better…’





The White House on Thursday announced that US President Donald Trump is renaming the department of defence to ""department of war,"" fulfilling his long-standing wish of rebranding it to project a more powerful image.White House, in an official statement, said that Trump will sign an executive order permitting use of the ""department of war"" as a ""secondary title"" for the sprawling department, as Congress establishes its official title.According to Fox News, the move to formally restore the Pentagon's historic name, directing the department of Defence to be once again called the department of war is part of the administration's ""warrior ethos"" campaign.It will make ""department of war"" a secondary title for the agency, with defence secretary Pete Hegseth adopting the title ""secretary of war."" A White House fact sheet says the order also instructs Hegseth to propose legislative and executive steps to make the change permanent.The rebranding will extend beyond titles. A White House official said Pentagon websites and signage will be updated, including renaming the public affairs briefing room the ""Pentagon War Annex.""Longer-term changes are being planned.Trump has teased the shift in recent days, telling reporters on August 25, ""Everybody likes that we had an unbelievable history of victory when it was department of war. Then we changed it to department of defense.""Hegseth, who has already been introduced by Trump as ""secretary of war,"" echoed the president's reasoning, calling the new name symbolic of a cultural shift. ""We won WWI and WWII not with the department of defense, but with a war department,"" he said Wednesday on Fox & Friends. ""We're not just defence, we're offence. Words and names and titles matter.""The department of war served as the nation's primary military authority until 1949, when Congress renamed it the department of defence under the National Security Act of 1947 as part of sweeping postwar reforms.","US President Donald Trump is renaming the department of defence to ""department of war"" The move is part of the administration's ""warrior ethos"" campaign. The department of war served as the nation's primary military authority until 1949.","https://static.toiimg.com/thumb/msid-123709184,imgsize-1143280,width-400,resizemode-4/donald-trump-is-renaming-the-defence-department-the-department-of-war.jpg"
'Mutilating our kids': JD Vance curses after heated Senate grilling of Robert F Kennedy Jr; other officials come to defence,https://timesofindia.indiatimes.com/world/us/mutilating-our-kids-jd-vance-curses-after-heated-senate-grilling-of-robert-f-kennedy-jr-other-officials-come-to-defence/articleshow/123709073.cms,"VP Vance unloads on Senate critics after Kennedy clash

Is Trump Worthy Of Nobel Prize? RFK Jr Makes Startling Statement In US Senate | Watch





Vice President JD Vance came to the defence of health and human services secretary Robert F Kennedy Jr after a tense Senate Finance Committee hearing on Thursday, blasting senators who clashed with him as ""full of s---. ""During the hearing, senator Ron Wyden (D-Ore.) accused Kennedy of pushing conspiracy theories, raising health costs, and endangering children through ""reckless decisions."" Kennedy pushed back, noting Wyden's long time in office while chronic disease rates have risen sharply.Vance later posted on X, accusing Democrats of supporting ""irreversible hormonal therapies for children"" while enriching pharmaceutical companies. Kennedy reposted Vance's message, thanking him for his support.""When I see all these senators trying to lecture and 'gotcha' Bobby Kennedy today all I can think is: You all support off-label, untested, and irreversible hormonal 'therapies' for children, mutilating our kids and enriching big pharma,"" Vance wrote in an X post. ""You're full of s--- and everyone knows it.""Other White House officials also defended Kennedy, with press secretary Karoline Leavitt saying he was ""taking flak because he's over the target"" and deputy chief of staff Taylor Budowich calling Democrats ""parrots of a failed medical orthodoxy.""The clash came just a day after more than 1,000 current and former HHS employees called for Kennedy's resignation.Kennedy defended his record, saying his department had been the ""most proactive in history,"" citing progress on drug prices, food safety, environmental crises, and medical reforms.","Vice President JD Vance came to the defence of health and human services secretary Robert F Kennedy Jr after a tense Senate Finance Committee hearing on Thursday. Vance accused Democrats of supporting ""irreversible hormonal therapies for children"" while enriching pharmaceutical companies. Kennedy reposted Vance's message, thanking him for his support.","https://static.toiimg.com/thumb/msid-123709360,imgsize-964558,width-400,resizemode-4/vp-vance-unloads-on-senate-critics-after-kennedy-clash.jpg"
First in US: Michigan's police department uniform patch features Arabic; reflects diversity,https://timesofindia.indiatimes.com/world/us/first-in-us-michigans-police-department-uniform-patch-features-arabic-reflects-diversity/articleshow/123710790.cms,".

.





Dearborn Heights Police Department has introduced a new officer-designed uniform patch that features Arabic alongside English, the first of its kind in the United States.The patch, which includes the Michigan state seal, carries the words Dearborn Heights Police written in both languages. It was designed by officer Ermily Murdoc to better reflect the city’s diverse population, the department said.Nearly 39% of Dearborn Heights residents are of Middle Eastern or North African background, while neighbouring Dearborn has around 55%.In a Facebook post, the department said it was proud of officer Murdoc’s effort to represent the community’s diversity. ""We are proud of Officer Murdoch's creativity and dedication in helping our department better represent the people we serve,"" the department wrote on Facebook. ""Our officers proudly serve all members of our community, and this new design is another way we continue to celebrate the rich cultures that make our city unique. ""The move comes at a time when Donald Trump’s administration has been doubling down on strict immigration policies, including mass deportations and tighter border controls.",The patch was designed by officer Ermily Murdoc to better reflect the city's diverse population. Nearly 39% of Dearborn Heights residents are of Middle Eastern or North African background. The move comes at a time when Donald Trump’s administration has been doubling down on strict immigration policies.,"https://static.toiimg.com/thumb/msid-123710894,imgsize-33998,width-400,resizemode-4/untitled-design-2025-09-05t092139441.jpg"
'Nobody was tougher than me': Trump isn't happy with Russia & Ukraine as bloodshed mounts; calls it 'horrible waste',https://timesofindia.indiatimes.com/world/us/nobody-was-tougher-than-me-trump-isnt-happy-with-russia-ukraine-as-bloodshed-mounts-calls-it-horrible-waste/articleshow/123755013.cms,"Donald Trump expressed his dissatisfaction with the ongoing war in Ukraine, labeling it a ""horrible waste of humanity."" He claimed that the conflict, which he estimates is costing both sides 7,000 soldiers weekly, doesn't directly affect the United States. Trump asserted his ability to resolve the situation and confirmed the US is prepared to impose further sanctions against Russia.","Donald Trump called the ongoing war in Ukraine a ""horrible waste of humanity"" He claimed that the conflict doesn't directly affect the United States. Trump asserted his ability to resolve the situation and confirmed the US is prepared to impose further sanctions against Russia.","https://static.toiimg.com/thumb/msid-123755035,imgsize-40204,width-400,resizemode-4/us-president-donald-trump.jpg"
"‘Darling, that’s fake news’: Trump snaps at reporter over question on going to war with Chicago; watch",https://timesofindia.indiatimes.com/world/us/darling-thats-fake-news-trump-snaps-at-reporter-over-question-on-going-to-war-with-chicago-watch/articleshow/123754915.cms,"AP photo





US president Donald Trump on Sunday snapped at a reporter after she pressed him on whether he was preparing to “go to war” with Chicago. The question came a day after Trump shared a meme warning that the city would soon learn about the newly renamed “Department of War. ”Trump, speaking to reporters before heading to New York for the US Open, dismissed the question with, “When you say that, darling, that’s fake news.”When she tried to continue, he cut her off sharply. “Be quiet, listen! You don’t listen! You never listen. That’s why you’re second-rate,” Trump told the NNC reporter. “We’re not going to war, we’re gonna clean up our cities. We’re gonna clean them up, so they don’t kill five people every weekend. That’s not war, that’s common sense.”Pressed on why Chicago was being singled out, Trump pointed to its recent homicide figures. “Do you know how many people were killed in Chicago last weekend? Eight. The week before? Seven. Do you know how many were wounded? Seventy-four people,” he said.Trump’s Truth Social post on Saturday featured an Apocalypse Now-style meme that read, “I love the smell of deportations in the morning.Chicago is about to find out why it’s called the Department of WAR.”Just a day earlier, Trump had signed an executive order to restore the Pentagon’s old name, Department of War, from the pre-World War II era. He has also floated sending the National Guard into Chicago, Baltimore, and New Orleans to tackle violent crime. Last month, he deployed troops in Washington, DC, and even took control of the city’s police department.But legal challenges are mounting. A federal judge recently ruled that Trump broke the law by sending the Guard into Los Angeles without state approval.","The president was speaking to reporters before heading to New York for the US Open. The question came a day after Trump shared a meme warning that the city would soon learn about the newly renamed “Department of War. ” Trump dismissed the question with, “When you say that, darling, that’s fake news”","https://static.toiimg.com/thumb/msid-123754924,imgsize-23138,width-400,resizemode-4/untitled-design-2025-09-08t051841058.jpg"
'This is my last warning': Trump warns Hamas to accept Gaza truce plan; group responds,https://timesofindia.indiatimes.com/world/us/this-is-my-last-warning-trump-claims-israel-accepted-his-gaza-truce-plan-warns-hamas-to-comply/articleshow/123754759.cms,"Hamas ‘Silences’ Trump With New Ultimatum To Israel On Hostage Deal | ‘War Will End When…’

'Ready to immediately sit at the negotiating table': Hamas







US President Donald Trump on Sunday claimed that Israel has finally accepted his proposal for a ceasefire and hostage release framework and gave Hamas “last warning” to accept his terms for ending the Gaza war.In a post on Truth Social, Trump said, ""Everyone wants the Hostages HOME. Everyone wants this War to end! The Israelis have accepted my Terms. It is time for Hamas to accept as well. I have warned Hamas about the consequences of not accepting. This is my last warning, there will not be another one! Thank you for your attention to this matter.""Although, Trump’s social media post did not detail the conditions, but Israel’s Channel 12 reported the plan envisions all hostages being freed on the first day of a truce, with broader talks to follow. In exchange, Israel would release Palestinian prisoners and halt its advance into Gaza City. Negotiations would take place under Trump’s direct oversight, with the ceasefire holding as long as talks continued, Times of Israel reported.Israel has not confirmed its acceptance, but a source close to Prime Minister Benjamin Netanyahu said the government is “very seriously considering” the proposal. The Hostages and Missing Families Forum urged Israel to back the deal, calling it a potential “breakthrough.”After the “last warning,” Hamas responded with a guarded statement, saying it “is ready to immediately sit at the negotiating table to discuss the release of all prisoners in exchange for a clear declaration to end the war, a total withdrawal from the Gaza Strip, and creation of a committee of independent Palestinians to run the Gaza Strip.”“Hamas welcomes any move that helps the efforts to stop the aggression against our people,” Times of Israel quotes statement, affirming that it received “some ideas from the American side aimed at reaching a ceasefire.”Hamas says it is in “constant contact with the mediators to turn these ideas into a comprehensive agreement that meets our demands.”Opposition leader Yair Lapid accused Netanyahu’s government of stalling negotiations despite mediators’ efforts, warning, “There is a hostage deal on the table. It can be done, it must be done.”The reported framework comes as international pressure mounts against Israel’s Gaza City offensive, with critics warning it imperils both hostages and soldiers.The war, which began on October 7, 2023, has killed more than 64,000 people in Gaza, according to Hamas-run authorities, and over 460 Israeli soldiers.","US President Donald Trump claims Israel has finally accepted his proposal for a ceasefire and hostage release framework. Trump gave Hamas ""last warning"" to accept his terms for ending the Gaza war. Israel has not confirmed its acceptance, but a source close to Prime Minister Benjamin Netanyahu said the government is ""very seriously considering"" the proposal.","https://static.toiimg.com/thumb/msid-123754767,imgsize-44420,width-400,resizemode-4/us-president-donald-trump.jpg"
