Article Title,Article Link,Article Text,Article Summary,Article Image
Wild elephants kill Assam duo out for a walk,https://timesofindia.indiatimes.com/india/wild-elephants-kill-assam-duo-out-for-a-walk/articleshow/123755427.cms,"GUWAHATI: Morning walk turned tragic for two villagers on Sunday as the duo was trampled to death by two wild elephants in Goalbil area in Assam's Baksa district, along the Assam-Bhutan border, reports Kangkan Kalita.Locals said the deceased Babita Das, 52, and Lohit Das, 65 had gone out for a walk and were roaming near their homes when the elephants attacked. ""Perhaps, the two elephants, separated from a herd, arrived in the village on Saturday night and encountered the two villagers in the morning,"" a forest officer said. Villagers alleged that electric fencing, erected by the forest department, failed to prevent wild elephants from entering villages close to the Pagladia river.""There is no security. Elephants come, destroy paddy and kill people,"" Alakananda Das, a villager, said.","Locals say the deceased Babita Das, 52, and Lohit Das, 65 had gone out for a walk and were roaming near their homes. Villagers alleged that electric fencing, erected by the forest department, failed to prevent wild elephants from entering villages.","https://static.toiimg.com/thumb/msid-47529300,imgsize-110164,width-400,resizemode-4/47529300.jpg"
Roads shut in Uttarakhand: Students take Rs 10k chopper ride to exam hall; cover 280 km in 30 mins,https://timesofindia.indiatimes.com/city/dehradun/roads-shut-rajasthan-students-pay-over-rs-10k-each-for-heli-ride-to-exam-centre-in-munsyari/articleshow/123724016.cms,"



PITHORAGARH: With road links to Munsyari in Pithoragarh district of Uttarakhand blocked due to landslides, four students from Rajasthan decided to hire a charter helicopter from Haldwani to appear for their BEd examination on Wednesday. Omaram Jat, Magaram Jat, Prakash Godara Jat, and Lucky Chaudhari booked the charter, shelling out Rs 10,400 each, to make it to their exam centre in time.The students, enrolled at Uttarakhand Open University in Haldwani, had arrived in the city on Monday for their exam scheduled on Wednesday at the Govt Degree College in Munsyari. When they tried to hire a car to get there, every taxi driver they approached refused the trip as the Haldwani–Pithoragarh and Tanakpur–Pithoragarh roads were blocked.""We started losing hope and thought we might miss the exam and lose an entire year. That is when someone told us that a chopper company, Heritage Aviation, offers helicopter rides to Munsyari,"" said Omaram. The trip from Haldwani to Munsyari, which is around 280 km by road and usually takes around 10 hours, was completed in around 25–30 minutes.""We reached Munsyari on time for the exam and returned by the same chopper the next day,"" said Narpat. ""It was expensive, but we're relieved we could sit for the exam,"" he added.","Road links to Munsyari in Pithoragarh district of Uttarakhand blocked due to landslides. Four students from Rajasthan decided to hire a charter helicopter from Haldwani. They paid Rs 10,400 each to make it to their exam centre in time.","https://static.toiimg.com/thumb/msid-123730206,imgsize-61920,width-400,height-225,resizemode-72/l-to-r-omaram-jat-magaram-jat-lucky-chaudhari-and-prakash-godara-jat.jpg"
"Biggest drug haul of year: MBVV police seize MD worth Rs 12,000 crore from Telangana factory; 12 arrested",https://timesofindia.indiatimes.com/city/mumbai/biggest-drug-haul-of-year-mbvv-police-seize-md-worth-rs-12000-crore-from-telangana-factory-12-arrested/articleshow/123729616.cms,"Representative Image

Poll What do you think is the most effective measure to combat drug trafficking? Stronger law enforcement Public awareness & education





MUMBAI: In one of the biggest drug seizures in the country this year, the Anti-Narcotics Cell and Crime Branch of the Mira-Bhayandar, Vasai-Virar police have busted a massive cartel operating through a chemical manufacturing factory in Telangana, seizing mephedrone (MD) worth an estimated Rs 12,000 crore.Mephedrone, also called “meow meow,” “meph,” “m-cat,” and “miaow,” is a synthetic stimulant belonging to the amphetamine group of drugs, which includes speed and ecstasy. According to sources, this is among the largest narcotics seizures in recent years.The probe began with the arrest of a 12 person including a foreign national and seizure of 100 grams of MD along with Rs 25 lakh in cash. Further interrogation revealed links to an interstate network engaged in large-scale production and supply of mephedrone. The investigation eventually led officers to Telangana, where the cartel was using a chemical factory as a cover for drug manufacturing.“In a bid to get to the roots of the factory, we infiltrated our men in the gang. After weeks of risky efforts, we were able to bust the cartel,” a senior officer said.The factory, located in the Cherlapally industrial area near Hyderabad and operating under the name Waghdevi Labs, appeared legitimate from the outside but was allegedly producing narcotics on a large scale.During the raid, police seized sophisticated chemical equipment, drug production units, and a massive cache of raw materials, including nearly 32,000 litres of precursor chemicals.The factory’s owner and chemical expert, Srinivas Valotty, along with associate Tanaji Pate, were taken into custody. In total, 12 persons have been arrested so far, including the foreign national caught in the initial operation.Police described the bust as a major blow to the narcotics supply chain across Maharashtra and other states. The factory has been sealed, and further raids are being conducted to trace the cartel’s wider distribution network.Commissioner of MBVV Niket Kaushik confirmed the drug seizure and said their investigation has led them to drug cartel to other states.","Mephedrone is a synthetic stimulant belonging to the amphetamine group of drugs, which includes speed and ecstasy. The factory’s owner and chemical expert, Srinivas Valotty, along with associate Tanaji Pate, were taken into custody. In total, 12 persons have been arrested.","https://static.toiimg.com/thumb/msid-123729704,imgsize-23508,width-400,height-225,resizemode-72/crime-scene.jpg"
"Mumbai scare: Man who sent 'human bombs, RDX' terror threat arrested; cops traced sim",https://timesofindia.indiatimes.com/city/noida/mumbai-bomb-scare-crime-branch-arrests-50-year-old-man-from-noida-security-tightened/articleshow/123729248.cms,"Mumbai Bomb Threat: Bihar Man Arrested In Noida For 'Human Bombs, RDX' Terror Threat

Poll Should authorities increase security measures during large public events like the Ganesh festival? Yes, absolutely No, it's excessive





MUMBAI: The Mumbai Crime Branch has arrested the man who allegedly issued a bomb threat to the city’s traffic department. The accused, identified as Ashwin Kumar Supra (50), was traced and detained from Noida.Officials said Supra, originally a resident of Bihar, had sent the threat message using a mobile phone and SIM card, both of which have been seized by investigators.The accused is being brought to Mumbai for further questioning. Crime Branch officers said they are probing the motive behind the threat and whether others were involved in the incident.The arrest came after the Mumbai Traffic Police’s WhatsApp helpline received a threatening message on Thursday, claiming that 14 terrorists had entered the city with 400 kg of RDX planted in 34 vehicles. The message arrived on Thursday while police were preparing security arrangements for Anant Chaturdashi , the final day of the Ganesh festival, scheduled for Saturday.Also read: 'Lashkar-e-Jihadi' warns Mumbai police, 14 Pakistani terrorists cited The sender identified their organization as 'Lashkar-e-Jihadi' in the threatening message. The Crime Branch has initiated an investigation, with the Anti-Terrorism Squad and other agencies being informed of the situation.""This is the same traffic police WhatsApp helpline on which police had received threat messages in the past, which later turned out to be hoaxes. The Crime Branch has launched an investigation, and Anti-Terrorism Squad (ATS) and other agencies have also been informed,"" a police official stated.A case has been registered at Worli police station against an unidentified person under section 351 of Bharatiya Nyaya Sanhita and sub-sections 2,3, and 4.""Traffic police have received such bomb threat messages in the past. There is no need to panic. Security has been beefed up at key locations, and combing operations are underway. Mumbaikars are urged not to believe in rumours and report any suspicious activity,"" another official said.While authorities believe the threat may be a hoax, they are conducting technical analysis to trace the message source. The police are taking maximum precautions due to the expected high footfall during the festival.More than 21,000 police personnel will be deployed across Mumbai to maintain law and order during the idol immersions. Lakhs of people are expected to participate in the immersion of Lord Ganesh idols in the sea, other water bodies, and artificial ponds on Saturday.The police are particularly vigilant as the threat coincides with Anant Chaturdashi, the 10th day of the Ganesh festival, when large crowds gather for the final immersion ceremonies.","Ashwin Kumar Supra, 50, was traced and detained from Noida. The Mumbai Traffic Police’s WhatsApp helpline received a threatening message on Thursday. The message claimed that 14 terrorists had entered the city with 400 kg of RDX planted in 34 vehicles.","https://static.toiimg.com/thumb/msid-123730426,imgsize-1392886,width-400,height-225,resizemode-72/man-who-sent-400-kg-rdx-threat-message-arrested-from-noida.jpg"
"Health emergency: 'Mysterious illness' kills 20 in Andhra village; spread via water, air suspected",https://timesofindia.indiatimes.com/city/vijayawada/declare-health-emergency-in-turakapalem-village-naidu-directs-officials/articleshow/123724190.cms,"



VIJAYAWADA: Chief minister N Chandrababu Naidu on Friday directed that health officials take a serious note on continuous deaths in Turakapalem of Guntur district and declare a health emergency in the village. He ordered that all the people suffering with unexplained illness should be admitted to hospital.Naidu conducted a review meeting on death of around 20 people in Turakapalem village in the past two months with unknown disease. He said health camps should be conducted in the village on Saturday and Sunday and medical tests should be conducted to all and prepare health profile of everyone.He advised the health officials to take the assistance of AIIMS Mangalagiri and if necessary international medical experts. He directed the officials to supply protected drinking water in the village. He made it clear no new case should be reported hereafter.""Officials should be vigilant 24X7 as there is a high possibility for the spread of the suspected bacterial disease through drinking water, food items, and through air.Meanwhile, the state govt constituted a high-level committee, led by Director of Secondary Health (DSH) Dr A Siri, to identify the officials responsible for failing to apprise higher authorities in time about the sudden spike in deaths in Turakapalem village.The committee will also make recommendations on measures to ensure that health department officials are immediately informed in case of a large number of deaths due to any illness in any region of the state in the future. This was announced by Health Minister Y Satya Kumar Yadav on Friday during his visit to Turakapalem village.Stating that stern action would be taken against all those officials for their inaction in reporting the deaths to the health authorities, Satya Kumar Yadav warned that no official will be spared and appropriate action will be taken against all the officials once the probe report is submitted by the high-level committee, which was ordered to complete in a week's time.Speaking to reporters, Satya Kumar Yadav said it is unfortunate on the part of the healthcare personnel working at the field level that they did not apprise the higher officials despite 23 people dying in the past two months. He said that the mean age of the deceased is 55, while around seven deceased were aged above 70 years.Dismissing media reports linking Melioidosis as the reason behind the deaths, the health minister said that the blood test reports have not confirmed the Melioidosis bacteria and that chemical and biological tests are also being done to determine the exact cause.The minister toured Turakapalem village, visiting the victims' households, enquiring about their health condition, and consoling the bereaved family members, besides taking a first-hand review of the medical services being provided to the villagers at the special medical camp set up in the village.Meanwhile, Guntur DMHO Dr Vijaya Lakshmi informed that the blood culture test results of the blood samples collected from individuals showing fever symptoms will arrive on Saturday.",Chief minister N Chandrababu Naidu on Friday directed that health officials take a serious note on continuous deaths in Turakapalem of Guntur district. He ordered that all the people suffering with unexplained illness should be admitted to hospital. The state govt constituted a high-level committee to identify the officials responsible for failing to apprise higher authorities in time.,"https://static.toiimg.com/thumb/msid-123729323,imgsize-74322,width-400,height-225,resizemode-72/health-minister-satya-kumar-yadav-interacts-with-a-health-worker-at-turakapalem-village-in-guntur-on-friday.jpg"
'India has nothing to apologise for': Tharoor hits back at Lutnick; flags EU money in Russia kitty,https://timesofindia.indiatimes.com/india/india-has-nothing-to-apologise-for-tharoor-hits-back-at-lutnick-flags-eu-money-in-russia-kitty/articleshow/123749387.cms,"NEW DELHI: Congress MP Shashi Tharoor on Sunday said that India has ""nothing to say sorry about"" as it has acted with ""a great deal of maturity,"" while criticising the US for unfairly singling out New Delhi and pointing out that ""Europe is putting more billions of dollars into Russia's kitty than we do. """"I don't think we have anything to say sorry about at all. India has behaved with a great deal of maturity on all of this,"" Tharoor told ANI, noting that even past US administrations had ""encouraged"" New Delhi to buy Russian oil in order to ""stabilise global prices.""Tharoor's remarks came in response to US Commerce Secretary Howard Lutnick, who claimed that ""India is going to be at the table, and they're gonna say they're sorry and eventually strike a deal with US President Donald Trump.""Countering Lutnick's claim, Tharoor pointed out that larger economies were more deeply tied to Moscow than India.""China buys more Russian oil and gas than we do. Turkey buys more Russian oil and gas than we do. Europe doesn't buy oil and gas, but they buy other Russian items, so they're putting more billions of dollars into Russia's kitty than we do. It seems bizarre that we are alone being singled out for allegedly financing the Russian war effort when others are doing far more than we are,"" he said.Calling it a ""mistake in American policy,"" the Thiruvananthapuram MP said such criticism of India was ""not warranted or justified.""""I think Mr Lutnick has to understand that we are a sovereign nation, just as they are. They can take their own sovereign decisions, we will take our own sovereign decisions,"" he added.Lutnick on Friday took a cue from Trump’s hardline tariff stance warning India to ""stop buying Russian oil, stop being a part of BRICS, and support the United States and the dollar or face a 50% tariff"" even likening India’s position to Canada’s retreat after economic pressure.""In a month or two months, I think India is going to be at the table, and they're gonna say they're sorry, and they're going to try to make a deal with Donald Trump and it will be on Donald Trump's desk how he wants to deal with Modi, and we leave that to him. That's why he's the president,"" Lutnick said.He also labelled India as ""the vowel between Russia and China"" in BRICS, saying, ""If that's who you want to be, go, be it... ....and let's see how long this lasts.""Lutnick's remarks came after Trump himself softened his tone on his social media post, calling India-US ties ""very special"" and affirming his friendship with Prime Minister Narendra Modi, after the SCO summit in Tianjin.Trump said, ""I always will. I'll always be friends with (PM) Modi. He's a great Prime Minister. I'll always be friends, but I just don't like what he is doing at this particular moment.""""But India and the United States have a very special relationship. There is nothing to worry about. We just have moments on occasion,"" he added.Following Trump’s statement, PM Modi responded warmly on Saturday, saying he ""deeply appreciates and fully reciprocates President Trump's sentiments and positive assessment of our ties.""Tharoor also urged caution over PM Modi’s warm response to Trump’s remarks on India-US ties saying, ""The Prime Minister was very quick to respond, and the foreign minister has also underscored the importance of the basic relationship that is a comprehensive global strategic partnership, which is still there. And that message is an important message for us to give. I don't think we can just completely forget either the 50% tariffs or the insults that have accompanied it from both the President and his staff. ""The Congress MP further warned that Trump's ""mercurial temperament"" and the ""real consequences"" of punitive tariffs demanded caution.""One can't just forget and forgive so quickly because there are real consequences that Indians are facing on the ground and those consequences need to be overcome,"" he added.","Congress MP Shashi Tharoor said that India has ""nothing to say sorry about"" as it has acted with ""a great deal of maturity"" He also criticised the US for unfairly singling out New Delhi and pointing out that ""Europe is putting more billions of dollars into Russia's kitty than we do""","https://static.toiimg.com/thumb/msid-123749861,imgsize-39250,width-400,resizemode-4/.jpg"
50 held over Hazratbal shrine emblem row,https://timesofindia.indiatimes.com/india/50-held-over-hazratbal-shrine-emblem-row/articleshow/123751213.cms,"SRINAGAR: Nearly 50 people have been detained for questioning over the defacing of a plaque bearing the national emblem inside Hazratbal shrine in Srinagar, PTI said Sunday, while National Conference (NC) put the figure at 30 and BJP’s Altaf Thakur said 26. J&K police have not confirmed any numbers since the vandalism Friday afternoon.“No one has been formally arrested so far, but some people are being questioned,” PTI quoted a senior police officer as saying, adding that women allegedly involved will face legal action but minors will not be proceeded against.Authorities tightened security around the shrine, which houses a relic of Prophet Muhammad, after the plaque was vandalised and removed following Friday prayers. Police had checked phone videos and CCTV footage before picking up dozens. No fresh disturbances have been reported.NC said an open FIR was registered and accused the LG-led administration of heavy-handedness. “I’m deeply anguished to learn that nearly 30 people have been detained by police,” NC MP Aga Ruhullah Mehdi said, calling the detentions “operational retribution” and warning against misrepresenting “an expression of collective hurt as anti-national”.He urged release of detainees and said the idea of India rests on respect for religious sentiment.NC president Farooq Abdullah called the installation of the Ashoka emblem a mistake. “There was no need to install the plaque. They put it up and people did not like it. When the Hazratbal shrine was constructed no board was placed there because it was dedicated to Allah and His Prophet,” he said. “We are peace-loving people and this shouldn’t have been done.”CM Omar Abdullah said Waqf Board should apologise, contending that the national emblem is for govt offices, not mosques.PDP, CPM and Peoples Conference demanded action against Waqf Board chairperson Darakhshan Andrabi, a BJP appointee, who had overseen the plaque’s placement Thursday as part of what she described as remodelling on Turkish lines.Opposition politicians called the plaque “provocative” and “blasphemous”, saying symbols are forbidden inside mosques. BJP said the defacement was an attempt to revive terrorism and separatism in J&K.BJP defended Andrabi’s role and alleged NC was exploiting the controversy. “This is an act of terrorism. Andrabi had every right to place the emblem. NC doesn’t like her and is using the emblem to create unrest in Kashmir Valley,” party spokesperson Altaf Thakur said.Andrabi demanded those who vandalised the plaque be booked under Public Safety Act.",National Conference (NC) put the figure at 30 and BJP’s Altaf Thakur said 26. J&K police have not confirmed any numbers since the vandalism Friday afternoon. Women allegedly involved will face legal action but minors will not be proceeded against.,"https://static.toiimg.com/thumb/msid-123751470,imgsize-26370,width-400,resizemode-4/representative-image.jpg"
'So this is your respect for farmers': JD(S) slams Kharge for his 'I planted 40 acres' rebuke,https://timesofindia.indiatimes.com/india/so-this-is-your-respect-for-farmers-jds-slams-kharge-for-his-i-planted-40-acres-rebuke/articleshow/123749062.cms,"Mallikarjun Kharge was seen dismissing a farmer who came to his Kalaburagi house with his crop loss grievances.

NEW DELHI: The JDS slammed Congress president Mallikarjun Kharge for his interaction with a farmer, where he drove him away, dismissing his grievances, saying that he suffered more crop damage than the farmer. JDS accused Kharge of mocking the farmer and claimed that for the Congress, farmers are only a matter of speeches and manifestos.""Mr Kharge, after decades in politics, holding powerful posts, becoming @INCIndia’s national president, having your son@PriyankKharge as a minister, and your party ruling the state, you still don’t have the patience to listen to farmers in your own district? Compensation for the distressed is too much to expect, I suppose,"" the JDS handle posted on X.""For Congress, farmers seem to matter only in speeches and manifestos. In reality, your arrogance says it all,"" it said.Kharge was seen accusing the farmer of seeking publicity by coming to his house in Kalaburagi with his crop problem. ""How many acres did you plant?"" Kharge was seen saying in the clip.""4 acres? I planted in 40 acres and mine has been damaged worse than this,"" Kharge said. ""This is like the saying that one who has delivered three kids comes to a person who has delivered 6 and talks about the struggle,"" Kharge said adding that he was aware of the crop loss issue.""Don't come here just for the sake of publicity, I am aware of this issue, I am aware of the crop losses this year. You may be able to sustain, but it is difficult for us. It is difficult to sustain with the size of our plantation,"" he said.Karnataka deputy chief minister DK Shivakumar has recently been accused of threatening farmers protesting in Ramanagara against the Greater Bengaluru Governance Authority Project. The farmers are protesting as they fear loss of their agricultural lands under the RMG project. DK issued a stern warning to the farmers and said he had also given 12 acres of land in the past. ""You can't do anything except shout slogans. Farmers should fight but don't do politics,"" DKS said.","Mallikarjun Kharge was seen dismissing a farmer who came to his Kalaburagi house with his crop loss grievances. JDS accused Kharge of mocking the farmer and claimed that for the Congress, farmers are only a matter of speeches and manifestos.","https://static.toiimg.com/thumb/msid-123749053,imgsize-1628220,width-400,resizemode-4/mallikarjun-kharge-was-seen-dismissing-a-farmer-who-came-to-his-kalaburagi-house-with-his-crop-loss-grievances.jpg"
