Article Title,Article Link,Article Text,Article Summary,Article Image
Israeli reservists answer the call despite challenges,https://timesofindia.indiatimes.com/world/middle-east/israeli-reservists-answer-the-call-despite-challenges/articleshow/121403518.cms,"AP file photo

Support fund

Anti-war group







RAMAT GAN: Reservist Haim Halevi had to quit his job and leave his young son behind to fight in Gaza, but still felt ""proud"" to serve after his third call-up in 18 months.Israel's military is activating tens of thousands of reservists for its expanded offensive in Gaza, which it says is aimed at defeating Hamas militants in the Palestinian territory.Despite professional, mental and family challenges, most reservists continue to turn up to fight in a war now in its 20th month.""No one is forcing me... I'm proud to defend my country,"" said Halevi, a 35-year-old father of two and non-commissioned officer in a combat unit.He has served more than 200 days since the war began.Reservists serve on a voluntary basis in Israel, and 75 percent have responded positively to the call, according to a report presented to parliament.The army says approximately 295,000 soldiers have been called up since the war began on October 7, 2023 with Hamas's unprecedented attack on Israel.Overall, the reservists have served an average of 61 days a year, compared with just eight pre-war. Combat units like Halevi's often serve longer stints.Halevi described himself as a ""patriot"", but also spoke of the difficulties of returning to the front.Like many reservists, on the morning of October 7 he rushed to the area around Gaza to help repel the Hamas attack, even before receiving a call-up.He was then deployed to the Gaza Strip when Israeli ground operations started, and spent almost five months fighting there.Halevi had to leave his job in IT and regrets not seeing his son, now two, grow up.""I left when he was six months old, and when I came back he already had teeth and hair,"" he said.His upcoming redeployment is also complicating major life events like a move and plans to start a business, but ""there's nothing you can do about it"", he said.""If everyone says it's not the right time for them, who will serve in the reserves?""Every one of his deployments is an ordeal for his wife Michal, 29, who said she dreads his next departure in mid-July.""I'll be alone with two small children -- everything will fall on me,"" she said.She ""got used to the lack of sleep"" caring for their son on her own. ""But being alone in the evenings, it was hard. It was really hard.""Halevi's last tour ended six months ago, with the birth of the couple's daughter.The government recently voted to create a fund of three billion shekels (more than $840 million) to support reservists.""Those who give everything to the state, we must give everything to them,"" Prime Minister Benjamin Netanyahu said.But some reservists say the support does not address the roots of the financial hardship they face.A recent Direct Polls survey found that 68 percent of respondents felt the government was not doing enough to support reservists.And while most, like Halevi, have continued to respond positively to call-ups, increasing numbers are refusing.Last week, in a rare case, a reservist who had reportedly already served more than 200 days was given 20 days in military prison for refusing to return over his moral objection to the Gaza war.While the army does not provide details about such refusals, reservists online have called for an end to the war, or at least for the army to stop tapping the same troops for repeated stints.A member of an anti-war reservist group, who gave his name as Stav, told AFP at an event in support of the jailed man that ""more and more soldiers are joining us"".He called refusal a ""patriotic act as an Israeli who believes in the future of this country"".A study by Polly Labs, in conjunction with NGOs, showed that the difficulties reservists and their families face are only getting worse.Based on surveys of more than 2,300 reservist spouses, it found 45 percent of reservists and 68 percent of their spouses reported experiencing emotional distress since the war started.Money problems also affect many, with 47 percent citing daily difficulties and 72 percent of the self-employed reporting direct financial losses.""I am aware of the weight of the mission, the responsibility and the burden we are placing on you and your families,"" army chief Eyal Zamir told reservists at a base in mid-May.Halevi, meanwhile, has created an internet platform, Milnik, which aims to connect donors with reservists in need.""I am proud of him and I support him, but it's difficult,"" his wife said.","Israel's military is activating tens of thousands of reservists for its expanded offensive in Gaza. Despite professional, mental and family challenges, most reservists continue to turn up to fight. Government recently voted to create a fund of three billion shekels (more than $840 million)","https://static.toiimg.com/thumb/msid-121403607,imgsize-1134901,width-400,resizemode-4/121403607.jpg"
11 people injured in shooting in South Carolina beach town,https://timesofindia.indiatimes.com/world/us/south-carolina-beach-town-little-river-shooting-people-killed-injured-police-investigation-suspect-news/articleshow/121402896.cms,"This is a representative image





At least 11 people were hospitalised following a shooting in the beach town of Little River on Sunday night, according to local authorities.The incident unfolded around 9.30 pm, Horry County Police said in a statement posted to social media.Police did not immediately disclose the conditions of the injured or the nature of their wounds.Horry County Police responded swiftly but have yet to release details on what sparked the violence or who was behind it.In a social media update, police said they were continuing to receive reports of victims arriving at local hospitals in private vehicles, suggesting the number of injured may climb.About 90 minutes after the shooting, authorities described the incident as ""isolated"" and emphasised there was no ongoing threat to the community. However, they have not announced any arrests or identified any suspects.Dramatic video footage from the scene showed dozens of police cruisers and ambulances converging on the area, sirens piercing the night as emergency responders worked to secure the scene and assist the wounded.","At least 11 people were hospitalised following a shooting in the beach town of Little River on Sunday night, according to local authorities. The incident unfolded around 9.30 pm, Horry County Police said in a statement posted to social media. Police did not immediately disclose the conditions of the injured or the nature of their wounds.","https://static.toiimg.com/thumb/msid-121403041,imgsize-627950,width-400,resizemode-4/121403041.jpg"
Canada silent on Trump's Harvard fight as PM Carney's daughter just finished 1st year,https://timesofindia.indiatimes.com/world/us/canada-silent-on-trumps-harvard-fight-as-pm-carneys-daughter-just-finished-1st-year/articleshow/121384443.cms,"Cleo Carney just finished her first year at Harvard.

Trump Goes Off Tangent With 'Trophy Wives' Rant, Confuses West Point Graduates | WATCH

Who is Cleo Carney?



What Belgian royal family say about Harvard row







Belgium's future queen Princess Elisabeth is not the only VIP foreign student caught in Donald Trump's legal battle with Harvard. Canadian Prime Minister Mark Carney's daughter Cleo Carney is a first-year student at Harvard. While speculations are rife about whether these VIP international students will have to take admission elsewhere if the Trump administration wins the legal battle, Canada has another issue to worry about. Canada is one of the highest contributors to Harvard's international students after China. And for undergraduate studies, the highest number of international students comes from Canada.Canada has not issued any statement after the Trump administrated barred the university from enrolling foreign students for non-compliance. The administration sought extensive records on nonimmigrant students involved in any crime, violence or illegal activities in the last five years. Harvard did not comply even after the ultimatum and went to the court to get a temporary stay on the order. If Trump wins the legal battle, the existing students will have to transfer to other universities.China, which sends the highest number of students to Harvard, said the ban will tarnish the US's image.“China has consistently opposed the politicization of educational collaboration,” a spokesperson for China’s Foreign Ministry said Friday, adding that the US move “will only tarnish its own image and reputation in the world.”The eldest daughter of Carney and economist Diana Fox Carnet, Cleao Carney, is studying social studies with a minor in energy and the environment. Cleo gained public attention in March 2025 when she introduced her father at the Liberal Party leadership event in Ottawa, where he was announced as Canada’s 24th Prime Minister. Ahead of the election, she advocated for her father as a first-time voter. ""My dad may not be the loudest candidate, but he will always be a principled one. He listens when he could perform. He believes in honesty, not spectacle. That’s what quiet leadership is: work without the ego. And that’s what my dad brings to the table. He’s not running for the spotlight. He’s running so this country can work for all of us,"" she wrote.23-year-old Princess Elisabeth has just finished her first year at Harvard, where she is doing a two-year master's degree in public policy. “The impact of [the Trump administration’s] decision will only become clearer in the coming days/weeks,” Belgian royal palace spokesperson Lore Vandoorne told Reuters. “We are currently investigating the situation.”The palace’s communications director, Xavier Baert, added, “We are analyzing this at the moment and will let things settle. A lot can still happen in the coming days and weeks.”",Canadian Prime Minister Mark Carney's daughter Cleo Carney is a first-year student at Harvard. Canada is one of the highest contributors to Harvard's international students after China. Canada has not issued any statement after the Trump administration barred the university from enrolling foreign students for non-compliance.,"https://static.toiimg.com/thumb/msid-121384428,imgsize-489177,width-400,resizemode-4/121384428.jpg"
'Privileged to do so': Donald Trump delays 50% tariff on EU goods to make room for talks,https://timesofindia.indiatimes.com/world/us/privileged-to-do-so-donald-trump-delays-50-tariff-on-eu-goods-to-make-room-for-talks/articleshow/121400929.cms,"US President Donald Trump (Pic credit: AP)





US President Donald Trump on Sunday announced a delay in implementing a proposed 50 per cent tariff on goods from the European Union, pushing the deadline from June 1 to July 9 in a bid to give trade negotiations with the bloc more time.The decision followed a phone conversation with European Commission president Ursula von der Leyen earlier in the day. According to Trump, von der Leyen expressed a strong willingness to engage in ""serious negotiations,"" prompting him to grant the extension.""I told anybody that would listen, they have to do that,"" Trump told reporters in Morristown, New Jersey, before departing for Washington. Von der Leyen, he said, had promised to ""rapidly get together and see if we can work something out.""Tensions had escalated last week after Trump threatened steep tariffs in a social media post on Friday, criticising the EU as ""very difficult to deal with"" and claiming that trade talks were ""going nowhere."" The tariffs were originally scheduled to go into effect on June 1.But Sunday's call appeared to ease hostilities, at least for now. ""I agreed to the extension, July 9, 2025. It was my privilege to do so,"" Trump said on Truth Social shortly after his media appearance.Von der Leyen welcomed the move, saying the EU was committed to reaching a meaningful agreement. ""Europe is ready to advance talks swiftly and decisively,"" she said in a statement. ""To reach a good deal, we would need the time until July 9.""",US President Donald Trump announces delay in implementing a proposed 50 per cent tariff on goods from the European Union. Trump pushes the deadline from June 1 to July 9 in a bid to give trade negotiations with the bloc more time. The decision followed a phone conversation with European Commission president Ursula von der Leyen.,"https://static.toiimg.com/thumb/msid-121400905,imgsize-788073,width-400,resizemode-4/121400905.jpg"
Who is Joseph Neumeyer? US Embassy firebomb suspect who shouted ‘death to America’ and threatened Donald Trump,https://timesofindia.indiatimes.com/world/us/who-is-joseph-neumeyer-us-embassy-firebomb-suspect-who-shouted-death-to-america-and-threatened-donald-trump/articleshow/121399009.cms,"Joseph Neumeyer allegedly plotted to burn down US embassy in Israel (Photo: X)





A dual citizen of the United States and Germany has been charged with attempting to burn down the US Embassy in Tel Aviv using Molotov cocktails and making online threats to kill US President Donald Trump, according to US department of justice.Joseph Neumeyer, a 28-year-old who claimed online to be the founder and CEO of a mysterious company called Atlas Light Company, was deported from Israel and arrested on arrival in New York on Sunday. He made his first appearance at the federal courthouse in Brooklyn, where he was ordered to remain in custody until trial.According to the US Justice Department, Neumeyer travelled to Israel in April 2025. Last week, he turned up outside the US Embassy in Tel Aviv with a backpack and allegedly tried to launch a firebomb attack.He approached a security guard, spat on him, and tried to flee the scene, leaving his bag behind. When Israeli authorities searched the backpack, they found several Molotov cocktails, incendiary devices containing flammable liquid. He was later tracked to a nearby hotel and arrested.Also read: US arrests man accused of firebomb plot against Embassy in Israel Before the attempted attack, Neumeyer had posted disturbing content on his Facebook page, including: “Join me as I burn down the embassy in Tel Aviv.Death to America. Death to Americans and f--- the west.” Officials also say he posted calls for the assassination of President Trump.He was charged with attempting to destroy the US Embassy by fire or explosive, and if convicted, faces a minimum of five years and up to 20 years in prison.The case is being handled by the Eastern District of New York’s National Security and Cybercrime Section, with support from FBI offices, the Department of State’s Diplomatic Security Service, and Israeli authorities. Neumeyer remains in custody pending further legal proceedings.","Joseph Neumeyer, 28, was deported from Israel and arrested on arrival in New York on Sunday. Last week, he turned up outside the US Embassy in Tel Aviv with a backpack and allegedly tried to launch a firebomb attack. When Israeli authorities searched the backpack, they found several Molotov cocktails, incendiary devices containing flammable liquid.","https://static.toiimg.com/thumb/msid-121399038,imgsize-1218796,width-400,resizemode-4/121399038.jpg"
US arrests man accused of firebomb plot against Embassy in Israel,https://timesofindia.indiatimes.com/world/us/us-arrests-man-accused-of-firebomb-plot-against-embassy-in-israel/articleshow/121399005.cms,"Explosives found in abandoned backpack

'Tame Ultras Or…': Putin’s BIG Revenge Pledge After Russian Embassy Attack in NATO Nation

Facing up to 20 years in prison

Arrest follows embassy staff killings in DC





A man accused of attempting to burn down the US Embassy in Tel Aviv was arrested in New York on Sunday after being deported by Israeli authorities, according to the US Justice Department.Joseph Neumeyer, a 28-year-old dual citizen of the United States and Germany, was taken into custody at John F. Kennedy Airport. The US Justice Department said Neumeyer had attempted to carry out a firebomb attack using Molotov cocktails and made violent threats online, including against Americans and US President Donald Trump.Neumeyer had arrived in Israel last month and went to the US Embassy in Tel Aviv last week. According to officials quoted by the justice department, he confronted a security guard outside the building, spitting on him before trying to flee. He dropped his backpack during the altercation and managed to escape.A search of the bag revealed three improvised explosive devices commonly known as Molotov cocktails, which are designed to start fires when thrown. Neumeyer was later tracked down to his hotel and arrested by Israeli police.The Justice Department said he had posted on social media: “Join me as I burn down the embassy in Tel Aviv. Death to America, death to Americans, and f--- the west.” He also allegedly threatened to assassinate Donald Trump in a separate post.Neumeyer claims on his social media that he is the founder and CEO of a company called Atlas Light Company, although it remains unclear what the company does. His recent posts also expressed anger towards the United States and Western governments.Neumeyer appeared in a New York court on Sunday and remains in custody. If convicted, he could face up to 20 years in prison.“This defendant is charged with planning a devastating attack targeting our embassy in Israel, threatening death to Americans, and President Trump's life,” said Attorney General Pamela Bondi.FBI Director Kash Patel added, “This despicable and violent behaviour will not be tolerated at home or abroad, and the FBI, working with our partners, will bring him to face justice for his dangerous actions.”The arrest comes just days after two staffers from the Israeli Embassy in Washington were killed outside the Capital Jewish Museum. The victims, Yaron Lischinsky and Sarah Lynn Milgrim, were attending an event when they were shot.The suspect, Elias Rodriguez, from Chicago, was arrested and charged with two counts of first-degree murder. Witnesses say he shouted “Free, free Palestine” as he was taken into custody.Israeli Prime Minister Benjamin Netanyahu condemned the shooting as a “horrifying antisemitic murder” in a call with Trump the next day.","Joseph Neumeyer, a 28-year-old dual citizen of the United States and Germany, was taken into custody at John F. Kennedy Airport on Sunday. The US Justice Department said he had attempted to carry out a firebomb attack using Molotov cocktails and made violent threats online, including against Americans and US President Donald Trump. If convicted, he could face up to 20 years in prison.","https://static.toiimg.com/thumb/msid-121399007,imgsize-1298555,width-400,resizemode-4/121399007.jpg"
‘He should be alive today’: Ilhan Omar marks 5 years since George Floyd’s murder with call to 'dismantle systemic racism',https://timesofindia.indiatimes.com/world/us/he-should-be-alive-today-ilhan-omar-marks-5-years-since-george-floyds-murder-with-call-to-dismantle-systemic-racism/articleshow/121398981.cms,"Ilhan Omar condemns the brutal murder of George Floyd





On the fifth anniversary of George Floyd’s death, US Congresswoman Ilhan Omar said his murder should never be forgotten and neither should the urgent need to reform America’s criminal justice system.In a series of posts on social media, Omar, who represents Minnesota’s 5th congressional district, said, “It’s been five years since George Floyd’s murder. He should be alive today. No amount of grandstanding or rewriting history will change that fact.” She added, “On this day—and every day—we must commit ourselves to the pursuit of justice. That must include dismantling systemic racism and radically transforming our approach to criminal justice. ”George Floyd was a 46-year-old Black man and was killed in Minneapolis in 2020 when white police officer Derek Chauvin knelt on his neck for more than nine minutes. The killing, captured on a bystander’s phone, sparked worldwide protests against racial injustice and police brutality. Chauvin was later convicted of murder and sentenced to 22 years in prison.Omar’s message came as people across the country marked five years since George Floyd’s death. In Houston , where Floyd grew up, his family gathered near his gravesite.In Minneapolis, where he was killed, locals held a church service, a candlelight vigil, and a gospel concert at George Floyd Square, the street corner now named after him.In another post, Omar reflected on the wider impact of Floyd’s death. “His murder ignited urgent conversations about the state of our nation, the state of policing, and the state of our justice system — as well as who is entitled to justice,” she wrote. “And unfortunately, as we have seen every time there is a movement for the liberation of Black people, for equality, for justice, we see a backslide — a backlash — where things not only stop progressing, but where people are emboldened to express their racism publicly. ”That backlash, she suggested, could be seen in recent efforts to undo police reforms and diversity programmes introduced in the wake of Floyd’s killing. In Minneapolis, reforms introduced after a federal investigation into police misconduct are under threat, as US President Donald Trump ’s administration has questioned their legitimacy, calling the data used “flawed” and the agreements “handcuffing” local police. However, Minneapolis mayor Jacob Frey insisted the city would fully comply with the new consent decree.Nationally, Trump has rolled back Diversity, Equity and Inclusion (DEI) policies across federal agencies and the military. In Washington DC, the Black Lives Matter Plaza has been removed. In Houston, a famous mural of Floyd was recently demolished as part of a building teardown.Omar also condemned those calling for Chauvin to be pardoned. “We are seeing unjust calls for Chauvin to be pardoned,” she wrote. “Regardless of any federal pardon, he still faces the state murder conviction and will remain in jail. He will always be known to the people of this country and the world as a murderer.”Her posts come as surveys show a drop in public belief that Floyd’s death led to lasting change. According to a recent Pew Research Center poll, 72% of Americans say little or no improvement has been made in the lives of Black people. Support for the Black Lives Matter movement has also declined by 15% since its peak in 2020.Floyd’s family and supporters have continued to honour his memory and push for lasting reform. “We still have a lot of work before we see true justice and liberation,” Omar said. “But today I’m thinking of George Floyd’s family as they continue to grieve his loss. May he forever rest in power.”",US Congresswoman Ilhan Omar said his murder should never be forgotten and neither should the urgent need to reform America’s criminal justice system. George Floyd was a 46-year-old Black man and was killed in Minneapolis in 2020 when white police officer Derek Chauvin knelt on his neck for more than nine minutes.,"https://static.toiimg.com/thumb/msid-121398985,imgsize-874255,width-400,resizemode-4/121398985.jpg"
