Article Title,Article Link,Article Text,Article Summary,Article Image
21-day ‘biggest-ever op’ leaves 31 Maoists dead,https://timesofindia.indiatimes.com/india/21-day-biggest-ever-op-leaves-31-maoists-dead/articleshow/121171477.cms,"Security forces concluded a 21-day anti-Maoist operation in Karreguttalu Hills. Thirty-one Maoist bodies were recovered. The operation scattered the Maoist command. Amit Shah called it the biggest assault on Maoists. Forces faced difficult terrain. They cleared caves housing arms manufacturing units. The operation busted a major Maoist stronghold. Disjointed Maoist formations are taking shelter in different places.

BIJAPUR: A 21-day anti-Maoist operation in Karreguttalu Hills (KGH) on the Chhattisgarh-Telangana border — headquarters of the most lethal of CPI(Maoist) wings, the PLGA Battalion No 1 , and housing its arms manufacturing units in the natural cave formations within — culminated on May 11, leaving scores of senior Maoists dead , with 31 bodies recovered, and segregated the Centrally-located Maoist command into 8-10 smaller, dislocated units with a massively depleted arsenal and armed capabilities.Hailing ‘ Operation Blackforest ’ — conducted from April 21 to May 11 by the Chhattisgarh Police’s special task force (STF) and district reserve guard (DRG) as well as CRPF — as “the biggest ever operation against Naxalism”, home minister Amit Shah in a post on X on Wednesday shared that the tricolour now flies proudly “on the hill where red terror once reigned”.“KGH was the unified headquarters of big Naxal organisations like PLGA Battalion 1, DKSZC, TSC & CRC, where along with Naxal training, strategies and weapons were also developed. Our security forces completed this biggest anti-Naxal operation in just 21 days and I am extremely happy that there was not a single casualty among the security forces,” Shah said as he congratulated CRPF, STF and DRG soldiers for facing the Naxalites “with exemplary courage even in adverse weather and treacherous terrain”.Eighteen security personnel injured in the operation are out of danger and recovering. The 28 neutralised Naxalites identified so far include 2 divisional committee members and 11 PLGA battalion fighters; they together carried a reward of Rs 1.72 crore.“Under the leadership of Prime Minister Shri @narendramodi ji, we are determined to root out Naxalism. I once again assure the countrymen that India is sure to be Naxal-free by 31 March 2026,” said Shah.Addressing a joint press conference here Wednesday, Chhattisgarh DGP Arun Dev Gautam said the forces defied challenging terrain, extreme temperatures and rainstorms, threats from wild animals and a web of landmines laid by the nearly 350 Maoists operating in the area, to reclaim KGH after killing at least 31 Maoists, including 16 women cadres. Around 250 caves running through the hills — which housed 4 arms manufacturing units with leth machines and weapon dumps holding 818 barrel grenade launchers; 35 automatic and semi-automatic weapons, 303 and INSAS rifles; 450 IEDs; cordex wires; besides 216 hideouts and bunkers; and 12,000 kg of food supplies and medicines — were cleared.DG CRPF G P Singh said the operation has busted yet another major Maoist stronghold after Chakrabanda in Bihar and Burapahar in Jharkhand. “The Maoist leadership and senior cadres who were congregated in the KGH hideout have been dislocated and segregated into smaller groups. The disjointed military formations have been forced to take shelter in different places,” he said. A source said this affects the CPI (Maoist) command structure and operational capabilities as the scattered groups cannot congregate for a big operation at short notice; also, it would be easier for the forces to go after them.Though the main objective of the operation was to neutralise top Maoist leaders like Hidma, the difficult topography of the hills made it difficult for the forces to assess the fatalities inflicted. But senior police and paramilitary official agreed that “the Maoists’ weaponry, arms and explosives emptied during the operation will significantly reduce their armed capabilities”.“Their technical units were busted and any attempt now by the scattered groups of Maoists, to reestablish contact will be detected through technical surveillance. Maoists are now possibly taking shelter in disjointed groups across national park area, West Bastar, south Bastar and parts of Telangana. Also, there seems to be some mistrust between the CPI Maoist leadership in Telangana and Chattisgarh. All this has put the Maoists on the backfoot,” said a senior officer.The CRPF DG said the once heavily-mined KGH hills have undergone several rounds of sanitisation, and the residual IEDs will also be de-mined soon. “Once this is done, the hills will be opened up for access by the locals,” he said adding that CRPF will be holding the area by setting up forward operating bases there.Gautam said Operation Blackforest — which displayed excellent coordination between the intelligence agencies, CRPF, Chhattisgarh Police, with Indian Air Force and BSF providing their choppers for airdropping rations and supplies and airlifting personnel and Telangana assisting CRPF on its side of KGH — has busted the Maoists’ belief that the area is their “impregnable” fortress.",Home minister Amit Shah called it the biggest assault on Maoists. Forces faced difficult terrain. They cleared caves housing arms manufacturing units. The operation busted a major Maoist stronghold. Disjointed Maoist formations are taking shelter in different places.,"https://static.toiimg.com/thumb/msid-121171477,imgsize-85910,width-400,resizemode-4/121171477.jpg"
BJP in damage-control mode after Colonel row,https://timesofindia.indiatimes.com/india/bjp-in-damage-control-mode-after-colonel-row/articleshow/121171478.cms,"Following outrage over tribal welfare minister Vijay Shah's remarks on Col Sofiya Qureshi, Madhya Pradesh BJP initiated damage control. A delegation visited Col Qureshi's family, and BJP national president JP Nadda sought a report. Shah, after being summoned by party leaders, expressed regret, claiming his words were twisted and offered multiple apologies if he hurt anyone's sentiments.

BHOPAL: Madhya Pradesh BJP is in damage control mode after tribal welfare minister Vijay Shah’s outrageous remarks on Col Sofiya Qureshi, who had briefed the media on Operation Sindoor with Wing Commander Vyomika Singh and foreign secretary Vikram Misri.Late Tuesday, state BJP scrambled a delegation, headed by former MLA Manvendra Singh, to Col Qureshi’s ancestral home in Naugaon in Chhatarpur district to meet family members. News of the row reached New Delhi, and BJP national president JP Nadda asked for a full report on the issue.As the party’s central leadership took cognisance of the issue, state BJP organisational general secretary Hitanand Sharma summoned Shah to the party office in Bhopal late Tuesday. In a tearing hurry, the minister reached BJP state HQ in his slippers. After meeting Sharma, he was told to meet state party chief VD Sharma close to midnight.Shah on Wednesday indicated that his words were “twisted” and said he was prepared to apologise 10 times “if he has hurt the sentiments of any person or community”. “Our sister Sofiya has brought triumph to India... She is more respected than my own sister... I salute her for her service to the nation. I cannot even think of humiliating her in my dreams,” he said.","Madhya Pradesh BJP is in damage control mode after tribal welfare minister Vijay Shah’s outrageous remarks on Col Sofiya Qureshi. Shah, after being summoned by party leaders, expressed regret, claiming his words were twisted and offered multiple apologies if he hurt anyone's sentiments. News of the row reached New Delhi and BJP national president JP Nadda asked for a full report on the issue.","https://static.toiimg.com/thumb/msid-121171478,imgsize-409326,width-400,resizemode-4/121171478.jpg"
Operation Sindoor: Congress demands answers from Modi govt,https://timesofindia.indiatimes.com/india/operation-sindoor-cong-demands-answers-from-modi-govt/articleshow/121171406.cms,"Rahul Gandhi (File photo)

NEW DELHI: Congress leader Rahul Gandhi will hold a press conference on Friday to address the issues arising after the ceasefire between India and Pakistan, as the party said the govt needs to answer the questions triggered by US President’s Donald Trump’s announcements on ceasefire that have led to internationalisation of Kashmir and a hyphenation of India and Pakistan. Congress will take out Jai Hind Yatras in cities to counter the BJP’s attempt to “politicise the operation against Pakistan”. The party reiterated the need for accountability on “intelligence failure” in Pahalgam, lamenting that it had not yet been fixed yet.A meeting of the CWC, chaired by Rahul Gandhi, expressed concerns that Prime Minister has chosen to remain silent on the crucial issue of comments from US leaders, which have resulted in hyphenation between India and Pakistan and led to belief that it has a leverage over the country. It said the PM should clarify the issues raised by Trump’s remarks.The gathering decided that Modi govt needed to be put on the mat for its “poorly devised” conclusion of hostilities without any guarantees on terror from Pakistan. Congress reiterated its demand for an all-party meeting chaired by the PM and a special session of Parliament. The party also demanded the resignation of MP minister Vijay Shah for his “appalling” comments on Col Sophiya Qureshi.Rahul Gandhi is learnt to have said that Congress fully backs the actions of the armed forces, but the US seems to have taken India for granted and it is not clear who rushed to America seeking intervention. Priyanka Gandhi Vadra said that tough questions should be asked of the govt. Crucially, Sachin Pilot is learnt to have noted that Trump and US secretary of state Marco Rubio have not mentioned the word “terror” even once in their tweets and comments, while Kashmir has figured prominently there. The development was dubbed as alarming by many in the meeting which included P Chidambaram, K C Venugopal, Ajay Maken, Shashi Tharoor, Randeep Surjewala, Pawan Khera and Jairam Ramesh among others.According to sources, the leaders felt BJP’s “politicisation of war” should be countered, with Randeep Surjewala suggesting that Congress take out Jai Hind Yatras in cities to challenge the BJP’s Tiranga Yatras. However, there appeared not much worry about BJP seeking to play the war card, with many opining that the ruling party’s rallies are a “face saver” because people were asking questions about the ceasefire brokered by the US, which has given Pakistan an advantage.Jairam Ramesh told reporters that PM calling an exclusive meeting of NDA chief ministers on May 25th, excluding other CMs, is a blatant attempt at politicisation of the operation against Pakistan. He said the PM should have called all the CMs.Interestingly, Shashi Tharoor, who has emerged as a vocal face in media defending India’s actions while also backing the govt, is learnt to have suggested that foreign secretary should be grilled on strategy when he briefs the parliamentary standing committee. Foreign secretaryVikram Misri will meet the panel chaired by Tharoor next week.Some leaders including Pilot are said to have underlined that China has come out openly in support of Pakistan but international support has been missing for India, with even Russia staying mum.The very durability of ceasefire was questioned as Pakistan govt is unstable and the army is calling the shots, sources said.In a resolution, the CWC said the abrupt end to action against Pakistan has raised questions as US President Donald Trump announced the ceasefire first and said he used the threat of trade to pressure India. It termed the govt’s silence “inexplicable and unacceptable”. “This represents a dangerous and unprecedented hyphenation of India with Pakistan, which compromises our national position and prestige,” the resolution said.","Congress will take out Jai Hind Yatras in cities to counter the BJP’s attempt to “politicise the operation against Pakistan” The party reiterated the need for accountability on “intelligence failure” in Pahalgam, lamenting that it had not yet been fixed yet.","https://static.toiimg.com/thumb/msid-121171404,imgsize-914329,width-400,resizemode-4/Rahul-Gandhi-Bharat-Summit.jpg"
"Pro-Pak post sparks violence in West Bengal, cops hurt",https://timesofindia.indiatimes.com/india/pro-pak-post-sparks-violence-in-west-bengal-cops-hurt/articleshow/121171395.cms,"Representative photo

KOLKATA: At least three police personnel were injured — one of them seriously — after violent clashes broke out at Barasat in Bengal’s North 24 Parganas district late Tuesday, following a viral social media post allegedly expressing support for Pakistan and opposing India.The accused, Nazir Hossain, was arrested for allegedly uploading the post on Facebook. Thirteen others were also taken into custody for instigating violence and assaulting cops during the protest.Locals said the unrest started in Talikhola area around 11pm after residents allegedly dragged Hossain and his father out of their home and assaulted the duo. Residents also blocked the Barasat-Barrackpore Road, halting traffic and demanding arrest of the accused.Tensions escalated as cops tried to rescue Hossain from the mob and disperse the protesters. The crowd turned violent. Stones were hurled. Police retaliated with lathi-charge and tear gas shelling.","Violent clashes broke out at Barasat in Bengal’s North 24 Parganas district. Accused, Nazir Hossain, was arrested for allegedly uploading the post on Facebook. Thirteen others were also taken into custody for instigating violence and assaulting cops.","https://static.toiimg.com/thumb/msid-121171391,imgsize-811989,width-400,resizemode-4/betean.jpg"
"Rangers hand over BSF trooper, India lets Pak soldier go home",https://timesofindia.indiatimes.com/india/rangers-hand-over-bsf-trooper-india-lets-pak-soldier-go-home/articleshow/121171370.cms,"File photo

(Inputs from Rohit Khanna & Falguni Banerjee in Rishra)

AMRITSAR/NEW DELHI: A BSF constable held for 22 days in Pakistan after inadvertantly crossing the Punjab border was released Wednesday morning, drawing emotional scenes in his Bengal hometown.Purnam Kumar Shaw , 40, was handed over by Pakistan Rangers to BSF officers at Attari-Wagah border near Amritsar around 10.30am, concluding days of tense diplomatic and military manoeuvring between India and Pakistan amid Operation Sindoor Shaw’s wife Rajni, who is in advanced pregnancy, said: “Every citizen prayed for my sindoor,” thanking PM Narendra Modi and Bengal CM Mamata Banerjee.Officials said Shaw, part of BSF’s 182 Battalion, was in uniform and carrying his rifle when he crossed into Pakistani territory in Ferozepur on April 23 while on operational duty. “He was received in accordance with established protocols. He appeared safe and healthy,” said Dr Atul Fulzele, IF of BSF’s Punjab frontier. A medical check-up and debriefing followed.Shaw’s crossing came a day after the Pahalgam terrorist strike that claimed 26 men, mostly tourists, and heightened tensions across the border. India responded with precision strikes on terrorist and military targets in Pakistan under Operation Sindoor.Pakistani Rangers had released photos showing Shaw blindfolded and disoriented. BSF initially shared an image of Shaw with a beard, later issuing one where he appeared clean-shaven and in fresh clothes.Efforts to secure his release included multiple flag meetings and diplomatic outreach. Sources said a final meeting between BSF and Pakistani Rangers commandants paved the way for Wednesday’s handover. BSF attributed Shaw’s return to “consistent efforts through communication channels”.In a parallel and unacknowledged move, a Pakistani soldier who had crossed into Rajasthan on May 4 walked back across Wagah the same morning.In Rishra of Bengal’s Hooghly district, Shaw’s family broke down in joy. “We cannot even imagine what he faced, but he will serve the country again,” said his father Bholanath Shaw. His mother Devanti Devi handed out sweets.Shaw’s wife recounted the anxiety that gripped the family. “I ran from pillar to post. I feared war would break out and we’d lose him,” she said. Rajni had even visited BSF officers near the border for updates. CM Banerjee later phoned Rajni and confirmed that talks at DGMO-level had included her husband’s case.After BSF’s press release confirmed his return, Rajni received a brief call from Shaw. “Main bol raha hoon,” he said. Unsure at first, she asked, “Aap PK Sir hain?” before recognising his voice.The couple’s young son Aarav looked up at a kite kept on top of a cupboard. “We flew it during Holi when papa was home. We’ll fly it again together,” he said.","Purnam Kumar Shaw was handed over by Pakistan Rangers to BSF officers at Attari- Wagah border near Amritsar around 10.30am. Shaw’s wife Rajni, who is in advanced pregnancy, said: “Every citizen prayed for my sindoor,” thanking PM Narendra Modi and Bengal CM Mamata Banerjee.","https://static.toiimg.com/thumb/msid-121171383,imgsize-92130,width-400,resizemode-4/Rangers-hand-over-BSF-trooperIndia-lets-Pakistan-soldier-go-home.jpg"
Bird flu scare in Uttar Pradesh: All zoos shut for a week,https://timesofindia.indiatimes.com/india/bird-flu-scare-in-uttar-pradesh-all-zoos-shut-for-a-week/articleshow/121171206.cms,"All UP zoos shut for a week after bird flu scare

A day after it was confirmed that a tigress at Gorakhpur zoo had died of bird flu ( H5N1 ), the Central Zoo Authority (CZA) ordered on Wednesday the closure of all zoos in UP till May 20. The alert has been sounded for tiger reserves as well. Following CM Yogi Adityanath ’s directive to ensure the safety and well-being of all animals in state zoos and safari parks, the CZA has formed a five-member team to probe the death of the tigress.“The team… will submit a detailed report within 15 days following which further decisions on animal care will be taken,” said Anuradha Vemuri, principal chief forest conservator (wildlife).“A special monitoring system and stringent health safety protocols have been enforced in all zoos in the state, including those in Lucknow, Kanpur, and Gorakhpur, and the Etawah Safari. All divisional forest officers have been directed to conduct regular health checkups of animals and immediately report any signs of irregularities,” Vemuri said.",Central Zoo Authority (CZA) orders closure of all zoos in UP till May 20. The alert has been sounded for tiger reserves as well. CZA has formed a five-member team to probe the death of the tigress.,"https://static.toiimg.com/thumb/msid-121171242,imgsize-65736,width-400,resizemode-4/All-UP-zoos-shut-for-a-week-after-bird-flu-scare.jpg"
Govt rejects another China bid to rename places in Arunachal,https://timesofindia.indiatimes.com/india/govt-rejects-another-china-bid-to-rename-places-in-arunachal/articleshow/121171040.cms,"File photo

NEW DELHI: Govt has rejected another “preposterous” attempt by China to rename 27 places in Arunachal Pradesh, saying the state is and will always remain an integral part of India. This is the fifth time that China has renamed villages in Arunachal to reinforce its claim over the Indian state it calls ‘Zangnan’.“Consistent with our principled position, we categorically reject such vain and preposterous attempts to rename places in the Indian state. Creative naming will not alter the undeniable reality that Arunachal Pradesh was, is, and will always remain an integral and inalienable part of India,” said MEA spokesperson Randhir Jaiswal .China has in the past renamed places in Arunachal Pradesh on four occasions — 2017, 2021, 2023 and 2024 — each of which was preceded by a diplomatic spat with India. For example, the first such exercise in 2017 followed the Dalai Lama’s visit to the state. In 2023, the same attempt followed a G20 meeting that India hosted in the state.On this occasion, it followed last week’s military skirmishes between India and Pakistan after the Pahalgam terrorist attack. The renaming is seen by many as another example of coercive diplomacy that Beijing is known to practise to validate its territorial claims .The Chinese foreign ministry later doubled down saying, “The Zangnan region belongs to China. The Chinese govt’s recent effort to standardise the names of some of the places in Zangnan is fully within China’s sovereignty.”China claims not just Tawang in Arunachal but effectively the entire state saying it’s a part of south Tibet. While the Tibetan govt-in-exile says Arunachal Pradesh is a part of India, China maintains it’s in south Tibet and cites examples like the second most important Tibetan Buddhism monastery being in Tawang and the sixth Dalai Lama being born there to back its claim.","This is the fifth time that China has renamed villages in Arunachal to reinforce its claim over the Indian state it calls ‘Zangnan’ The renaming is seen by many as another example of coercive diplomacy that Beijing is known to practise to validate its territorial claims. The Chinese foreign ministry later doubled down saying, “The Zangnan region belongs to China.”","https://static.toiimg.com/thumb/msid-121171014,imgsize-48588,width-400,resizemode-4/Govt-rejects-another-China-bid-to-rename-places-in-Arunachal.jpg"
Operation Sindoor done with 100% precision; PM Narendra Modi delivered on promise: BJP,https://timesofindia.indiatimes.com/india/operation-sindoor-done-with-100-precision-pm-delivered-on-promise-bjp/articleshow/121121660.cms,"BJP spokesperson Sambit Patra

NEW DELHI: Operation Sindoor was accomplished in an unprecedented manner with 100% precision, BJP said on Monday, adding that PM Narendra Modi had delivered on his promise of punishing terrorists behind the Pahalgam terror attack The party, however, refrained from replying to questions raised by opposition parties, saying the county was united during the entire operation. BJP spokesperson Sambit Patra told a press conference that the kind of military and non-military action India had taken was unprecedented, and had sent a decisive message in its war against terrorism.He said after the Pahalgam attack, the PM promised to ""avenge"" the death of 26 people. ""He had said the revenge would be beyond the enemy's imagination, and so it was. He had also said 'mitti mein milayenge' and 'ghus ke maarenge'; that is what we did. PM Modi's decision and the bravery of our armed forces ensured that terror sites were reduced to rubble,"" he said.""Our brave pilots flying Rafale jets destroyed terrorist camps with precision, ensuring that no civilian or military installation was harmed in the process,"" Patra said, adding, ""Earlier, India used to present dossiers as evidence against terrorism but 'New India' now takes decisive action. PM Modi rightly said, 'wahan se goli chalegi, toh yahan se gola chalega'.""He said ""for the first time in history"", a country carried out a strike with precision on terrorist camps within just 23 minutes using advanced weapons. ""Never before has any nation penetrated a nuclear-armed country and destroyed 20% of its military infrastructure."" Patra said even Islamic countries such as Saudi Arabia and UAE supported India, and Pakistan stood isolated globally.",BJP: Operation Sindoor was accomplished in an unprecedented manner with 100% precision. Party refrained from replying to questions raised by opposition parties. Spokesman Sambit Patra said the kind of military and non-military action India had taken was unprecedented.,"https://static.toiimg.com/thumb/msid-121121742,imgsize-582924,width-400,resizemode-4/article-69.jpg"
