Article Title,Article Link,Article Text,Article Summary,Article Image
US Haryana Man Shot Dead: 'Entered via donkey route' Haryana man shot dead in US for objecting to public urination,https://timesofindia.indiatimes.com/city/chandigarh/26-year-old-jind-man-shot-dead-in-us-after-objecting-to-public-urination/articleshow/123752250.cms,"Image Credit: TOI

On Cam: Indian-Origin Sikh Man Shot Dead In Los Angeles; Video Released By US Police





JIND: A 26-year-old man from Haryana's Jind district was shot dead in California, US, after he objected to a man urinating in public on Saturday.The deceased, Kapil, was working as a security guard. Son of Ishwar from Barah Kalan village, Kapil was on duty when he confronted an individual for urinating outside the premises, village sarpanch Suresh Kumar Gautam told TOI. The man, in response, shot him dead on the spot, the sarpanch added.Kapil, the only son of a farming family, had travelled to the US two-and-a-half years ago. He is said to have entered the country in 2022 through the ""donkey route"", crossing the jungles of Panama and scaling the Mexico border wall, a journey that cost his family around Rs 45 lakh. After his initial arrest, he was released through legal proceedings and had since been settled in the country.The family was informed of the death by a relative living in the US. Kapil has two sisters, one of whom is married.""The entire village is standing with the family, but they are deeply broken in this time of grief,"" said sarpanch Gautam.He added that the family plans to meet with the deputy commissioner to demand that Kapil's body be brought back to India. ""We hope for the govt's full support,"" he said.","Kapil, the only son of a farming family, had travelled to the US two-and-a-half years ago. He is said to have entered the country in 2022 through the ""donkey route"", crossing the jungles of Panama and scaling the Mexico border wall.","https://static.toiimg.com/thumb/msid-123755348,imgsize-25480,width-400,height-225,resizemode-72/-.jpg"
Bengaluru Sunroof Accident: 'Sunroofs are not meant for standing' Boy pops out of moving car in Bengaluru; hits overhead barrier,https://timesofindia.indiatimes.com/city/bengaluru/boy-pops-out-of-moving-cars-sunroof-in-bengaluru-hits-overhead-barrier/articleshow/123750951.cms,"Image Credit: X





BENGALURU: A video showing a boy popping out of the sunroof of a moving car and getting hit by an overhead barrier in the city has gone viral on social media.The incident, which took place at Vidyaranyapura Saturday, has raised concerns over road safety and parental negligence. The video was shared on X where several people reacted. ""Next time when you leave your kids popping their heads out, think once again!"" said a user.Another user said: ""Please stop the stupidity of making your kids poke their heads through the sunroof"", while another posted: ""Let the sun in, not your child out. This incident is a stark reminder that sunroofs are not meant for standing or playing. Let's not wait for a lesson in pain...put safety first, always.""According to police, who have registered a suo motu case under section 281 (rash and negligent driving) of BNS, the boy, aged 6 years, has not sustained serious injuries. The vehicle was being driven by the boy's brother-in-law. There was another passenger in the car, a woman, police said.","A video showing a boy popping out of the sunroof of a moving car and getting hit by an overhead barrier in the city has gone viral on social media. The incident, which took place at Vidyaranyapura Saturday, has raised concerns over road safety and parental negligence. The video was shared on X where several people reacted.","https://static.toiimg.com/thumb/msid-123755531,imgsize-32286,width-400,height-225,resizemode-72/-.jpg"
"Kolkata Rape: 20-year-old abducted, 'gang-raped' by 2 friends; cops launch manhunt",https://timesofindia.indiatimes.com/city/kolkata/kolkata-horror-20-year-old-abducted-gang-raped-by-2-friends-cops-launch-manhunt/articleshow/123744644.cms,"The accused Chandan Mallick and Debangshu Biswas

(The victim's identity has not been revealed to protect her privacy as per Supreme Court directives on cases related to sexual assault)





NEW DELHI: A 20-year-old woman was allegedly raped by two of her friends after being abducted from her home in the Haridevpur area of south Kolkata, police said on Sunday.The incident is said to have taken place on Saturday night in the Haridevpur area.According to the police complaint, one of the men, identified as Chandan Mallick, had invited the woman to a birthday party, which she declined. Later, Mallick and his friend, Debangshu Biswas, allegedly abducted her from her home and took her to Malancha, where she was raped multiple times.The woman returned home and told her family, who then took her to the police station to file a complaint.“The two accused have fled, and we are searching for them. The victim is being medically examined, and our officers are visiting the place where the crime took place,” a police officer told news agency PTI.An investigation is under way.","A 20-year-old woman was allegedly raped by two of her friends in Kolkata. The incident is said to have taken place on Saturday night in the Haridevpur area. The two accused have fled, and we are searching for them, police said.","https://static.toiimg.com/thumb/msid-123745773,imgsize-1534584,width-400,height-225,resizemode-72/the-accused-chandan-mallick-and-debangshu-biswas.jpg"
"Karnataka: 834 dowry deaths in 5.5 years, 13 women die every month; activists cite societal pressures",https://timesofindia.indiatimes.com/city/mysuru/karnataka-834-dowry-deaths-in-5-5-years-13-women-die-every-month-activists-cite-societal-pressures/articleshow/123755739.cms,"Image credit: AI

Women seeking to be independent targeted: KSCW chief





MYSURU: In the past five and a half years, on average, 13 married women have died in a month due to dowry harassment and at least eight women a day complained of harassment by husbands in a worrying trend of increasing marital violence in the state.According to data presented by women and child welfare minister Laxmi Hebbalkar during the recently concluded legislative session in response to a question by MLC Govindaraju, the state has reported as many as 1,677 cases of harassment by husbands and 70 dowry deaths in the first seven months of this year alone.From Jan 2020 to July 2025, Karnataka has registered 14,626 cases of harassment against women by their husbands and 834 deaths due to dowry harassment.The definition of domestic violence for this dataset presented by the govt includes harassment, beating, physical and mental torture and body-shaming and excludes instances of sexual harassment.A woman's rights activist said, ""Today, the entire society is attacking women over a handful of incidents involving women. In reality, this data presents the trauma suffered by women.""According to Karnataka State Commission for Women chairperson Nagalakshmi Choudhary, many factors are leading to harassment cases and dowry deaths in the state. ""Women are harassed or targeted over objecting to partner's extramarital affairs, and also for attempting to independently earn a living. Many times, ego clashes also result in harassment,"" she said.""Even today, many families want women to remain dependent on men. Any woman who challenges this faces harassment,"" Nagalakshmi said.""Many poor families opt for early marriages for their girls. Sadly, in 99% of cases, if a woman questions husband's extramarital relationship, his parents never support her,"" she said.Komala M, professor of human development and family studies at UoM, said if husband and wife start respecting each other and opt for adjustments instead of constant bickering, most incidents could be avoided. ""The violence in the family ultimately affects the children, "" she said, adding, ""Harassment is wrong whoever commits it.""","In the past five and a half years, on average, 13 married women have died in a month due to dowry harassment. At least eight women a day complained of harassment by husbands in Karnataka. From Jan 2020 to July 2025, Karnataka has registered 14,626 cases of harassment against women by their husbands.","https://static.toiimg.com/thumb/msid-123756018,imgsize-1333114,width-400,height-225,resizemode-72/image-credit-ai.jpg"
"Mumbai don-turned neta Gawli walks free after 17 years, wants to reunite with family",https://timesofindia.indiatimes.com/city/nagpur/mumbai-don-turned-neta-gawli-walks-free-after-17-years-wants-to-reunite-with-family/articleshow/123684521.cms,"



NAGPUR: Notorious Mumbai don-turned-neta Arun Gawli also called ‘Daddy' stepped out of Nagpur Central Prison on Wednesday after Supreme Court granted him bail in the 2007 murder case of Sena corporator Kamlakar Jamsandekar. After serving over 17 years in a high-security cell, including nine-and-half years in Nagpur Central Jail, the 76-year-old gangster shared a poignant wish with a senior jailor to reconnect with his family and play with his grandchildren, a stark contrast to his fearsome reputation in Mumbai's criminal underbelly.Gawli confided to one of the senior prison officials, his voice heavy with regret, that he missed watching his children grow and now wanted to spend time grandchildren. The emotional confession revealed a softer side of a man, who once ruled Dagdi Chawl in Byculla, offering a glimpse into his longing to reclaim a life lost to incarceration.The release was steeped in drama with Nagpur Police and prison guards orchestrating a fortified security to ensure Gawli's safe exit. Anti-Terrorism Squad (ATS) personnel and various intelligence units were present to pick up concealed clues.Dodging a throng of media waiting at the jail gates, Gawli was whisked away to Nagpur airport under heavy escort, arriving three hours early for his Mumbai-bound flight.Intelligence sources cited ongoing threats from Dawood Ibrahim 's D-Company, a feud rooted in the violent gang wars of the Eighties and Nineties, as the reason for his cautious departure. Surveillance was ramped up with police videographing the scene.Gawli's conviction in 2012 for Jamsandekar's murder, under the stringent Maharashtra Control of Organised Crime Act (MCOCA), marked a significant blow to his empire. Sentenced to life, he challenged the Bombay High Court's 2019 ruling upholding his conviction. On August 28, the Supreme Court granted him bail, citing his age and the 17 years already served, pending his appeal.Inside Nagpur Central Jail, Gawli was a model prisoner, adhering to protocols and earning commendations for discipline. He was granted 14–15 paroles and furloughs without incident. ""We recalled seeing Gawli spending time with religious scriptures,"" said a senior prison official. In 2018, he grabbed headlines by taking an exam on Gandhian philosophy, scoring 74 out of 80 marks, earning a certificate and khadi clothes — a surprising twist for a man synonymous with Mumbai's underworld.Gawli's release sparked speculation about his next move. Once a formidable figure who transitioned from crime to politics, serving as an MLA from Chinchpokli (2004–2009) under his Akhil Bharatiya Sena, Gawli's legacy is a complex tapestry of power, crime, and redemption. As he returns to Mumbai, questions swirl about whether ‘Daddy' will revive his political ambitions or embrace the quiet family life he craves.With security concerns looming, particularly from D-Company, his homecoming is anything but ordinary. Mumbai watches closely as the aging don steps into an uncertain future, balancing personal dreams with a past that refuses to fade.","Arun Gawli, 76, was released from Nagpur Central Prison on Wednesday. Supreme Court granted him bail in the 2007 murder case of Sena corporator Kamlakar Jamsandekar. He served over 17 years in a high-security cell, including nine- and-half years in Nagpur.","https://static.toiimg.com/thumb/msid-123687614,imgsize-1203070,width-400,height-225,resizemode-72/file-photo.jpg"
Guwahati homestay 'murder-suicide': Cops recover two bodies,https://timesofindia.indiatimes.com/city/guwahati/guwahati-homestay-murder-suicide-cops-recover-two-bodies/articleshow/123756853.cms,"Image used for representative purpose only





GUWAHATI: An alleged case of a murder-suicide, involving a minor, was reported from Guwahati's Borbari area on Sunday morning after police recovered two bodies from a homestay.The deceased have been identified as a 15-yr-old boy and a 36-year-old man named Makibur Rahman.According to Guwahati deputy commissioner of police (DCP) Amitabh Basumatary, the boy had left his home on Saturday morning and did not return, prompting his parents to file a missing person complaint at the police station.An initial investigation revealed that the boy was acquainted with Rahman, a taxi driver.Using a GPS tracker on Rahman's rented vehicle, police were able to trace them to the homestay.Basumatary said Rahman had booked a room on Friday, claiming to be a medical patient. Upon arriving at the scene, officers saw the boy lying on the bed in a pool of blood and Rahman hanging from the ceiling.","The deceased have been identified as a 15-yr-old boy and a 36-year-old man named Makibur Rahman. The boy had left his home on Saturday morning and did not return, prompting his parents to file a missing person complaint at the police station.","https://static.toiimg.com/thumb/msid-123756905,imgsize-731353,width-400,height-225,resizemode-72/image-used-for-representative-purpose-only.jpg"
"Milwaukee accident: 2 university students killed in car crash; several injured, driver arrested",https://timesofindia.indiatimes.com/world/us/milwaukee-accident-2-univeristy-students-killed-in-car-crash-several-injured-driver-arrested/articleshow/123738007.cms,"Representative image





Two Marquette University students were killed and others injured in a crash in Milwaukee on Friday evening. Police said the 41-year-old driver involved was arrested.The crash happened around 5 pm near 27th and St. Paul. According to Milwaukee police, the man crashed into a vehicle carrying six people, reported FOX6 News.Two passenger, 20-year-old Noah Snyder of New York and 19-year-old Scott Michaud of Ohio, died at the scene from their injuries. The other passengers were treated at the scene and at hospitals for non-life-threatening injuries.Both were members of Marquette University’s men’s lacrosse team, according to the school’s website.“We grieve with the students’ families and friends, as well as faculty, staff and fellow students here on campus who were touched by these students during their time in our community. I ask that you keep the families in your prayers,” said Marquette University President Kimo Ah Yun.The university said counseling and pastoral support will be made available to students, staff, and faculty.Milwaukee police said the case has been referred to the Milwaukee county district attorney’s office for a review of charges.",Two Marquette University students were killed and others injured in a crash in Milwaukee on Friday evening. Police said the 41-year-old driver involved was arrested. The case has been referred to the Milwaukee county district attorney’s office for a review of charges.,"https://static.toiimg.com/thumb/msid-123738032,imgsize-824719,width-400,resizemode-4/1-64.jpg"
'Only MAGA voters’: San Francisco landlord restricts open house; lawyer says he can do that,https://timesofindia.indiatimes.com/world/us/only-maga-voters-san-francisco-landlord-restricts-open-house-lawyer-says-he-can-do-that/articleshow/123755680.cms,"AI image





A Sunnyside landlord has sparked controversy by listing his two-bedroom apartment with a note that only “MAGA voters and Israel supporters” were invited to the open house.The landlord, 48-year-old Alexander Baran, posted the listing on Zillow on August 5. The listing was later removed.Tenant rights lawyer Joseph Tobener, a partner at Tobener Ravenscroft, said Baran’s actions are legal. “Political orientation is not a protected class under California or federal law,” Tobener told Fox News Digital. “Protected classes include ethnicity, religion or source of income. So this isn’t a violation of the fair employment and housing Act.”Tobener further said that changing the law to protect political affiliation would require an amendment to the state’s housing act, which could face legal challenges up to the Supreme Court.San Francisco has seen three major tech booms in recent decades — the dot-com boom, the social media boom, and now the AI boom — all of which have driven up rents. According to the Zumper National Rent Report, one-bedroom rents rose 13.3% and two-bedrooms 16.3% in the past year.Tobener said landlords now hold significant power in the market, making tenants wary of potential discrimination. ""Everybody should get a fair shake regardless of their political orientation. Everyone should be able to get access to housing. Housing is a fundamental right. Everyone needs housing. Everyone needs a roof over their heads. And so are we gonna start down this road where only certain people from certain political leanings can get access to certain housing. ""","The landlord, 48-year-old Alexander Baran, posted the listing on Zillow on August 5. The listing was later removed. Tenant rights lawyer Joseph Tobener, a partner at Tobener Ravenscroft, said Baran’s actions are legal.","https://static.toiimg.com/thumb/msid-123756031,imgsize-68384,width-400,resizemode-4/untitled-design-2025-09-08t082355034.jpg"
"Noida miracle: Tea vendor’s daughter falls into 15ft water trap — Veer Singh jumps in, rescues her",https://timesofindia.indiatimes.com/city/noida/noida-miracle-tea-vendors-daughter-falls-into-15ft-water-trap-veer-singh-jumps-in-rescues-her-alive/articleshow/123756457.cms,"Veer Singh, a farmer, heroically rescued a three-year-old girl who fell into a 20-foot-deep drain in Sector 150, Noida

(with inputs from Ashni Dhaor)





NOIDA: True to his name, Veer Singh did not hesitate for a moment. When cries of ""bachao-bachao"" pierced the afternoon air outside ATS Pristine society in Sector 150, the 45-year-old farmer enjoying a cup of tea nearby became the embodiment of courage.With no thought for his own safety, Veer leapt into a 20-foot-deep drain, determined to save a three-year-old girl fighting for her life below. Thus began a tense, half-hour struggle that would grip the entire neighbourhood.Singh, according to police, lives in a village near Sector 150, though his exact address remains unclear. The drama unfolded around noon on Friday, when Bijli, a 25-year-old tea vendor, handed her daughter Anushka a toy while tending to customers. Moments later, the child tumbled into the uncovered drain as her mother looked the other way.""Veer didn't hesitate for a second. He jumped straight in after hearing the girl's cries and managed to lift her out of the water after about half an hour,"" a police officer said. Guards from the nearby society rushed to help, and together, they pulled Veer and the frightened toddler to safety.Rajesh Kumar, who stood nearby, was witness to the frantic rescue.""The drain was filled with water up to 15ft. There was a real risk of both the toddler and the man drowning. People tried to help by lowering a wooden ladder, but with wet hands and a terrified child in arms, it was almost impossible for Veer to hold on. Another ladder was brought from the other side, but even reaching it was a struggle,"" he said.For 30 agonising minutes, the scene was a blur of panic and hope. ""The mother's screams, the crowd's anxiety, and Veer's sheer determination - it was a battle against exhaustion. But through it all, the farmer did not lose courage even for a bit,"" Kumar said.The guards threw down a rope, which Veer managed to wrap around himself and the ladder. Locals joined in, pulling the rope as Veer emerged from the drain, Anushka clinging to him.The crowd broke into an applause as the two finally reached to safety, many among them recording the final moments. ""The girl was shaken, but alive,"" a witness said.By the time police arrived, Veer had quietly left, but his heroism became the talking point. ""We found out about him from people who were there and the girl's parents,"" said Chetan Chaudhary, sub-inspector for the area.The incident reignited concerns over the open drain, which residents said poses a constant danger, especially to children and the elderly. Calls for the drain to be covered, they said, had elicited little response from the authorities, they alleged.Yet, the responsibility for the drain's safety was mired in bureaucracy.Officials at Noida Authority said the road and drain fell under the jurisdiction of the irrigation department, which had built it originally.The irrigation department, however, denied responsibility. ""The main Noida drain along Pushta Road is surrounded by shrubs and is 20 metres wide. Children are unlikely to reach it,"" an official claimed.SDM (Sadar) Ashutosh Gupta, however, told TOI, ""The drain in the video is under the jurisdiction of Noida Authority, not the irrigation department.""","A three-year-old girl fell into a 20-foot-deep drain in Sector 150, Noida, India. Farmer Veer Singh, 45, leapt into the water to rescue the girl. Guards from a nearby society rushed to help and pulled Veer and the frightened toddler to safety.","https://static.toiimg.com/thumb/msid-123756494,imgsize-460573,width-400,height-225,resizemode-72/veer-singh-a-farmer-heroically-rescued-a-three-year-old-girl-who-fell-into-a-20-foot-deep-drain-in-sector-150-noida.jpg"
