Article Title,Article Link,Article Text,Article Summary,Article Image
'Regular diplomatic engagement': US on Rahul Gandhi's meeting with Donald Lu in Washington,https://timesofindia.indiatimes.com/india/regular-diplomatic-engagement-us-on-rahul-gandhis-meeting-with-donald-lu-in-washington/articleshow/113276938.cms,"NEW DELHI: The United States on Thursday called the recent interaction of leader of opposition Rahul Gandhi with its top official Donald Lu in Washington as 'part of regular diplomatic engagement.'""The US government meets with members of government and opposition parties, as well as civil society representatives and other stakeholders, as part of our regular diplomatic engagement with our partners,"" the US department of state spokesperson said.""We don't have further comment on our private diplomatic communications,"" the spokesperson added.During the last leg of his three-day-trip to US, Gandhi met Donald Lu, assistant secretary of state, bureau of South and Central Asia. The American diplomat is set to visit to India and Bangladesh, later this month.Gandhi also met American legislators at Capitol Hill. He met several members of the India Caucus during his visit.Taking to X, Gandhi said, ""It was a pleasure to meet with a delegation of US lawmakers at the Rayburn House in Washington, DC. We had a meaningful discussion about our shared commitment to building a progressive future and strengthening the Indo-US relations.""Meanwhile, the Bharatiya Janata Party launched a scathing attack on Gandhi and accused him of 'openly working' against the country after he met CongresswomanIlhan Omar in Washington.""India's Leader of Opposition Rahul Gandhi meets Ilhan Omar in the USA, a Pakistan-sponsored anti-India voice, a radical Islamist, and an advocate of independent Kashmir,"" BJP IT Cell head Amit Malviya said in a post on X.""Even Pakistani leaders would be more circumspect about being seen with such rabid elements. Congress is now openly working against India,"" he added.BJP spokesperson Shehzad Poonawalla also targeted Gandhi and said, ""After spewing venom against Sikhs & running down India on foreign soil now Rahul Gandhi meets & engages with anti India Ilhan Omar - 1) Ilhan had introduced anti India resolutions in US Congress 2) She has been against abrogation of Art 370 3) She violated India's sovereignty & visited PoK on a trip sponsored by Pakistan 4) She met Imran Khan & other such elements to discuss ""Islamophobia"" in India 5) She has been instrumental in peddling hatred against Hindus Why did Rahul Gandhi have to meet her?""""Why is he engaging with the most radical anti India elements on every foreign trip? In BJP virodh - desh virodh is ok?"" Poonawalla added.Rahul Gandhi, was on a three-day visit to the US, where he engaged with the Indian diaspora, students, and US lawmakers.His trip began with meetings at the Rayburn House Office Building, hosted by Congressman Bradley James Sherman. Among the attendees were US Congress members Jonathan Jackson, Ro Khanna, Raja Krishnamoorthi, Barbara Lee, Shri Thanedar, Jesus G ""Chuy"" Garcia, Ilhan Omar, Hank Johnson, and Jan Schakowsky.",Gandhi also met American legislators at Capitol Hill. He met several members of the India Caucus during his visit. The Bharatiya Janata Party launched a scathing attack on Gandhi and accused him of 'openly working' against the country.,"https://static.toiimg.com/thumb/msid-113276921,imgsize-1133806,width-400,resizemode-4/113276921.jpg"
Shraddananda to SC: Am I worse than Rajiv killers?,https://timesofindia.indiatimes.com/india/shraddananda-to-sc-am-i-worse-than-rajiv-killers/articleshow/113275505.cms,"Sentenced to spend entire natural life in prison for murdering his wife, who was the granddaughter of ex-Diwan of Mysore, Swamy Shraddananda on Wednesday requested the SC to reconsider his sentence by asking - ""Am I a worse offender than killers of Rajiv Gandhi and 15 others, who were released after 27 years in prison?""Shraddananda aka Murli Manohar was sentenced to entire life in prison by the SC in July 2008 after commuting the death sentence awarded to him concurrently by the trial court and the HC for murdering Shakereh in 1991.He had buried her body in the backyard of their house.",Shraddananda aka Murli Manohar was sentenced to entire life in prison by the SC in July 2008 after commuting the death sentence awarded to him concurrently by the trial court and the HC. He had buried her body in the backyard of their house.,"https://static.toiimg.com/thumb/msid-47529300,imgsize-110164,width-400,resizemode-4/47529300.jpg"
"SC sets aside HC order, asks CBI to probe Chhattisgarh ADJ wife's death",https://timesofindia.indiatimes.com/india/sc-sets-aside-hc-order-asks-cbi-to-probe-chhattisgarh-adj-wifes-death/articleshow/113275396.cms,"NEW DELHI: The Supreme Court has ordered CBI to investigate the 2016 death by suicide of the wife of an additional district and sessions judge as her kin alleged that Chhattisgarh Police , under the influence of the judicial officer, closed the case despite several ante-mortem injuries found on her body.The kin of the deceased, who was an assistant district prosecution officer at Dantewada at the time of her marriage to the judicial officer in Feb 2014, alleged that she was killed in May 2016 and the police refused to even register an FIR by terming the incident as death by suicide.Their repeated complaints to the police brass went unheeded.When her relatives approached the HC for a CBI probe, the court kept the petition pending for seven years before dismissing it. The HC said they could move the magisterial court under the provisions of the Criminal Procedure Code (CrPC) seeking registration of FIR. The mother and brother of the deceased moved SC against the HC order.Setting aside the HC order, the SC directed CBI to expeditiously carry out the probe and submit a report to the SC.","The Supreme Court has ordered CBI to investigate the 2016 death by suicide of the wife of an additional district and sessions judge. Her kin alleged that Chhattisgarh Police, under the influence of the judicial officer, closed the case despite several ante-mortem injuries found on her body.","https://static.toiimg.com/thumb/msid-113275428,imgsize-1595333,width-400,resizemode-4/113275428.jpg"
Kolkata doctor horror: How a shadowy ‘North Bengal lobby’ shapes hospital decisions,https://timesofindia.indiatimes.com/city/kolkata/kolkata-doctor-horror-how-a-shadowy-north-bengal-lobby-shapes-hospital-decisions/articleshow/113243481.cms,"Posters against the North Bengal lobby appeared on the RG Kar campus as protests intensified last month (left); Sandip Ghosh (right)

What is the North Bengal lobby?

How does it function?

What is the RG Kar link?

Two doctors linked to ‘North Bengal lobby’ suspended

KOLKATA: With the agitating junior doctors and students putting up the heat on those allegedly part of the ‘ North Bengal lobby’ across medical colleges, an FIR has been lodged against three doctors – Birupaksha Biswas , Avik De and Ranjit Saha – all linked to ‘North Bengal lobby’ and close aides of former RG Kar principal Sandip Ghosh – at Bowbazar police station.Police have compiled all complaints into one FIR and have registered a case under section 351 (assault as making a gesture or preparation that causes someone to believe that they are about to be subjected to criminal force) of BNS.➤ The ‘North Bengal lobby’ refers to a group of officials and doctors working in govt-run hospitals and medical colleges. The shadowy group has dominated newspaper headlines, social media posts and canteen conversations since Aug 9, when a young RG Kar doctor was raped and murdered at her workplace. Here, we try to make sense of what it is and who constitute it for readers not familiar with the group.➤ This is not a geographical identity. The name tries to deﬁne a group of doctors who are close associates of an orthopaedic surgeon who passed out of the North Bengal Medical College and Hospital (NBMCH). A whole lot of doctors who owe allegiance to the group and its leader may not have been students of the NBMCH. And not everyone who has passed out of this reputable medical college belongs to this lobby.➤The North Bengal lobby has, according to its critics and senior state health ofﬁcials, come to control much of the day-to-day functioning of govt hospitals and medical colleges. Its inﬂuence on health administration far outweighs its number or ofﬁcial designations of its members. The lobby, for example, has come to decide many of the transfers and ""punishment"" postings of those who refuse to fall in line as well as transfers to ""coveted"" institutes or departments for those who need to be rewarded.➤ Almost all controversial decisions of the recent past have been attributed to the North Bengal lobby by seniors in the state health department. A case in point is the posting of the now-shamed former RG Kar principal, Sandip Ghosh. He was twice transferred out of RG Kar by the state health department in the last couple of years but, each time, got back this prized posting within days or weeks. Senior health department ofﬁcials have attributed this only to his being an important part of the North Bengal lobby.➤ Many of these decisions seem devoid of any logic or rationale and bypass the usual hierarchy of the health department. The names of some of the beneﬁciaries of the North Bengal lobby's largesse have appeared in mainstream media recently; they include Avik De, Birupaksha Biswas, Susanta Roy and Suhrita Paul. The names of some of these doctors have also cropped up repeatedly in connection with the attempted cover-up of the RG Kar crime.➤ RG Kar, more than any other medical college and hospital, has been under the North Bengal lobby’s control, say health department ofﬁcials. A crosssection of the hospital staff has identiﬁed former principal Ghosh as the spearhead.➤ Many of those whose names have cropped up in connection with the crime’s coverup were also seen in the vicinity of the crime scene, say hospital ofﬁcials. They include Biswas, De and Ray. None of them had any direct link with RG Kar (one, for example, worked in Burdwan, about 110 km away) but were often seen on the campus.➤ The RG Kar campus had almost become the North Bengal lobby’s unofﬁcial headquarters for some time, say state health department seniors. “We are not surprised by the scale of corruption at this hospital and the maladministratin that gave rogues like Sanjay Roy , the key accused in the rape-murder case, so much control over the campus and its day-to-day affairs,” a senior health department ofﬁcial said.➤ Earlier, the state health department suspended two doctors Avik De and Birupaksha Biswas who are in the eye of a storm in medical colleges across the state. Names of the two appear prominently in posters of the 'health syndicate' that were found recently in medical colleges.Both are also known to be close associates of RG Kar ex-principal Sandip Ghosh. De is the man in red-T shirt in the crime scene who Kolkata Police touted as a fingerprint expert which IMA Bengal challenged. He used to work as an RMO in Burdwan Medical College who is now a first-year surgery PGT at IPGMER.➤ Birupaksha Biswas, senior resident doctor of pathology, too, has been embroiled in controversy. Junior doctors said he too was present in R G Kar on Aug 9 whereas he had no locus standi to be present. Audio clips where he is heard threatening other students and junior doctors have gone viral even as Biswas had dismissed those as AI-generated.He was transferred to Kakdwip Sub-Divisional Hospital last Aug from Burdwan Medical College but his release order was issued only on Tuesday. Protest had also erupted in the Kakdwip hospital over his transfer there.","FIR lodged against three doctors linked to ‘North Bengal lobby’ and close aides of former RG Kar principal Sandip Ghosh. The shadowy group has dominated newspaper headlines, social media posts and canteen conversations since a young RG Kar doctor was raped and murdered at her workplace.","https://static.toiimg.com/thumb/msid-113243969,imgsize-45380,width-400,height-225,resizemode-72/113243969.jpg"
Communal violence erupts in Karnataka's Nagamangala during Ganesha idol immersion,https://timesofindia.indiatimes.com/city/mysuru/communal-violence-erupts-in-nagamangala-during-ganesha-idol-immersion/articleshow/113270220.cms,"MANDYA: Nagamangala , a town situated 45 kilometers from Karnataka's Mandya district witnessed heightened tensions following a clash between two groups during a Ganesh procession around 8 pm on Wednesday.The incident occurred when devotees from Badarikoppalu were carrying two Ganesh idols for immersion.As the procession reached a place of worship, miscreants threw stones, leading to a heated altercation between the two groups.Police had to use mild force to disperse the crowd.Following the incident, the groups engaged in chanting praises to their deities, further escalating the tension in the town.Sources reported that a few individuals sustained injuries during the stone-pelting, and the police faced difficulties in controlling the crowds who were at odds with each other.Youths from Badarikoppalu later halted the procession near the police station, demanding the arrest of the miscreants responsible for throwing stones at them.Senior officers from both the police and revenue departments rushed to the scene to pacify the crowd and defuse the tension.As a precautionary measure, Thasildar G. Adarsh, who arrived at the spot, issued ban orders under CrPC 144, restricting the gathering of four or more people in groups.Additional police forces from Mandya, Bellur, and Bindiganavile were deployed to regain control of the situation. The police resorted to lobbing tear gas shells to control the mob.The Ganesha idols have been temporarily placed near a temple, and devotees are demanding the arrest of those who caused disturbance to the procession. The situation remains tense even after two hours, as confirmed by sources.","The incident occurred when devotees from Badarikoppalu were carrying two Ganesh idols for immersion. As the procession reached a place of worship, miscreants threw stones, leading to a heated altercation between the two groups. Police resorted to lobbing tear gas shells to control the mob.","https://static.toiimg.com/thumb/msid-113270240,imgsize-531755,width-400,resizemode-4/113270240.jpg"
"After Kolkata docs set new demands, Mamata govt says 'not ready to accept': Top developments",https://timesofindia.indiatimes.com/india/after-kolkata-docs-set-new-demands-mamata-govt-says-not-ready-to-accept-top-developments/articleshow/113263621.cms,"NEW DELHI: The impasse between the protesting junior doctors and West Bengal state government continued as they listed out a fresh set of demands on Wednesday for accepting the government's appeal to discuss the way forward.The response from the doctors came after West Bengal chief secretary Manoj Pant appealed to the protesting doctors to send a delegation of 12-15 representatives to state secretariat Wednesday evening for discussions.However, the junior doctors forum demanded that they want to send a delegation of at least 30 representatives to meet with CM, including one from each of the 26 medical colleges in the state, besides seeking live telecast of the meeting. According to news agency ANI, the doctors refused to attend because it was said to be a closed-door meeting.""The mail that we received yesterday was from the principal secretary and it was written that there is a meeting with senior government officials, stating it to be a closed-door meeting. We refused it because we were against the closed-door meeting,"" a protesting doctor was quoted as saying.The junior doctors' email reply read, ""We want to send a delegate team of at least 30 representatives. We want the meeting to be live telecasted for the sake of transparency among all parties. We are re-emphasising our point that we want our discussion to be in the presence of chief minister. We want the meeting to be based around our 5-point demands.""Responding to the demands, the West Bengal government said that it was not ready to accept any condition for a meeting. ""Setting conditions for talks is not a reflection of coming with an open mind to find solutions to problems which plague the doctors. The government is ready to listen to whatever they have to say. But they can't set preconditions for such a meeting,"" Statehealth minister said addressing a press conference.The minister confirmed that the state will stick to the Supreme Court's direction on rejoining duties of the agitating doctors. ""You will see what steps we take about this as and when it happens,"" Bhattacharya said.The West Bengal Junior Doctors’ Front earlier issued a five point demand, which included holding everyone responsible for the rape and murder to be punished, implement strict disciplinary action against ex Principal Sandip Ghosh , resignation of Kolkata Police Commissioner Vineet Goyal , eliminate the alleged ""threat culture"" in hospitals and colleges, ensure adequate security measures for healthcare workers.The protesting doctors have also been calling for the dismissal of key officials in the state health department, including the health secretary, the directors of health services and medical education. A similar invitation for dialogue was extended by the health secretary on Tuesday evening, but the doctors refused it, questioning the logic of engaging in talks with the very person whose suspension is one of their main demands.“One of our main demands is the suspension of health secretary Narayan Swarup Nigam . Yet, the email for a meeting on our demands came from the same Health Secretary's office, which is insulting,"" a junior doctor was quoted as saying by news agency PTI.In light of this, the appeal on Wednesday came from chief secretary Manoj Pant.""We appreciate your willingness to engage in dialogue, as constructive discussions are crucial to addressing concerns and collaboratively enhancing our healthcare system,"" the chief secretary's statement read.The Supreme Court on Monday had ordered protesting doctors in West Bengal, demonstrating over the case, to return to work by 5 pm on Tuesday or face disciplinary action from the state government.Nevertheless, despite the Supreme Court's ultimatum, the junior doctors have pledged to continue their protest for justice.( with inputs from agencies)","The West Bengal Junior Doctors’ Front earlier issued a five point demand, which included holding everyone responsible for the rape and murder to be punished. The Supreme Court on Monday had ordered protesting doctors in West Bengal, demonstrating over the case, to return to work by 5 pm on Tuesday.","https://static.toiimg.com/thumb/msid-113264705,imgsize-113994,width-400,resizemode-4/113264705.jpg"
"Biryani row: Administration moves boy to new school, to waive Rs 37k in fees",https://timesofindia.indiatimes.com/city/meerut/biryani-row-administration-moves-boy-to-new-school-to-waive-rs-37k-in-fees/articleshow/113270716.cms,"BIJNOR: A 7-year-old boy , expelled for bringing non-vegetarian biryani in his tiffin to Hilton Public School in Amroha , will be transferred to a new school along with his two siblings. The administration is facilitating the transfer after their mother decided to move her children to another institution. The education department will cover the cost of their enrolment, and Hilton Public School has agreed to waive the outstanding fees, amounting to Rs 37,000.An administrative probe into the incident on Tuesday had cleared the principal of any wrongdoing, stating that the controversial video was ""edited"". However, the school management has removed the principal pending an internal investigation, which is ongoing.The district inspector of schools (DIOS) for Amroha, Vishnu Pratap Singh , said govt is assisting the family with the transfer process. ""We have discussed the matter with both the school management and the boy's mother. Both parties have agreed to the transfer, and the education department is coordinating with other schools to enrol the children. Once the transfer certificate is issued, further proceedings will begin,"" he said.The controversy began on Thursday when the boy was expelled for allegedly bringing non-vegetarian biryani to school in his lunchbox. A heated exchange between the boy's mother and the school principal, captured on video, was widely shared on social media, sparking public outrage and communal tensions. In the video, the mother accused the school of discrimination based on her son's food preferences.","The administration is facilitating the transfer after their mother decided to move her children to another institution. The education department will cover the cost of their enrolment, and Hilton Public School has agreed to waive the outstanding fees, amounting to Rs 37,000. An administrative probe into the incident on Tuesday had cleared the principal of any wrongdoing.","https://static.toiimg.com/thumb/msid-113271125,imgsize-1106456,width-400,resizemode-4/113271125.jpg"
"Live wire snaps, boy recalls science lesson, saves lives with sister",https://timesofindia.indiatimes.com/india/live-wire-snaps-boy-recalls-science-lesson-saves-lives-with-sister/articleshow/113274963.cms,"MUMBAI: A science lesson and quick thinking by two school going Palghar siblings saved the lives of a 10-year-old boy and a delivery agent last month. The children, who raised an alarm as soon as a live wire snapped and fell onto the gate of the adjacent building, were felicitated by district collector Govind Bodke and police officials on Wednesday for their heroic action.The family of Smit Bhandare, 12, and nine-year-old sister Sanskruti was getting ready to have lunch on Aug 25. Smit was doing his homework and Sanskruti was playing in the house. Their mother Kalpana was in the kitchen and father Darshan , a science teacher, was freshening up when the siblings heard a loud sound. They ran to the balcony of their second-floor flat in Rushab Apartment and found that a high voltage electrical wire from a nearby pole had snapped during heavy rain and wind and had fallen on the gate of the adjacent Vasant Vihar building.Smit remembered a lesson on good and bad electrical conductors he had studied the previous year and immediately recognise the potential hazard the wire posed. He began shouting from the balcony warning people against entering the gate.Mohammed Ansari , 10, a resident of their building, was about to enter Vasant Vihar when the siblings screamed out to him and stopped him from touching the iron gate. Darshan promptly contacted Maharashtra State Electricity Board (MSEB).While he was on the phone with MSEB officials, a delivery agent on a scooter arrived at Vasant Vihar, unaware of the live wire. The siblings alerted him, too. They even stepped out with umbrellas to warn people until help arrived. MSEB authorities responded quickly and disconnected the power supply to ensure safety.","Smit Bhandare, 12, and sister Sanskruti, 9, raised the alarm as soon as a live wire snapped and fell onto the gate of the adjacent building. Smit remembered a lesson on good and bad electrical conductors he had studied the previous year and immediately recognised the potential hazard the wire posed.","https://static.toiimg.com/thumb/msid-113275010,imgsize-140014,width-400,resizemode-4/113275010.jpg"
"Ajit Doval calls for joint Brics action against terror, meets Wang Yi",https://timesofindia.indiatimes.com/india/ajit-doval-calls-for-joint-brics-action-against-terror-meets-wang-yi/articleshow/113274016.cms,"NEW DELHI: Participating in the Brics NSAs ' meeting in St Petersburg , NSA Ajit Doval spoke about modern security challenges, including in the digital domain, and terrorism, calling for joint efforts within the Brics framework to address these issues.Doval, who had a brief interaction with Chinese foreign minister Wang Yi on the margins, also called for reform of multilateralism saying existing structures are no longer capable of handling modern threats and sensitive issues of common concerns.Govt sources confirmed Doval will have a formal bilateral meeting with Wang on Thursday. He is expected to address the LAC situation in eastern Ladakh and seek early completion of the disengagement process, and restoration of peace and tranquillity along the border areas, to ensure the relationship can become normal.The Brics NSAs also reviewed pressing security challenges facing the globe. The three-day conclave is taking place ahead of the annual summit of the grouping in Kazan on Oct 22-24.","NSA Ajit Doval spoke about modern security challenges, including in the digital domain, and terrorism. Doval, who had a brief interaction with Chinese foreign minister Wang Yi on the margins, also called for reform of multilateralism. Govt sources confirmed Doval will have a formal bilateral meeting with Wang on Thursday.","https://static.toiimg.com/thumb/msid-113274049,imgsize-889179,width-400,resizemode-4/113274049.jpg"
