Article Title,Article Link,Article Text,Article Summary,Article Image
Ashoka University Professor Gets Notice from Haryana Women Panel Over Operation Sindoor Remarks,https://timesofindia.indiatimes.com/city/gurgaon/haryana-women-panel-issues-notice-to-ashoka-university-professor-over-remarks-on-operation-sindoor/articleshow/121158658.cms,"The Haryana State Commission for Women has issued a notice to Ashoka University's associate professor, Ali Khan Mahmudabad, regarding his remarks on Operation Sindoor

Poll Should comments regarding military actions be more strictly regulated in academic settings? Yes, to maintain respect for armed forces. No, academics should express their views freely.





NEW DELHI: The Haryana State Commission for Women has sent a notice to an associate professor of a private university over his Operation Sindoor remarks ""disparaging women in the armed forces and promoting communal disharmony"".The May 12 notice mentions that the panel has taken suo motu cognisance of the ""public statements/remarks"" made ""on or about May 7"" by Ali Khan Mahmudabad, an associate professor and the head of the political science department of the Ashoka University in Sonipat.Indian armed forces hit terror infrastructure in Pakistan and Pakistan Occupied Kashmir in the early hours of May 7 under Operation Sindoor in retaliation to the April 22 Pahalgam terror attack that killed 22 people, mostly tourists.The commission said the remarks were in connection with Operation Sindoor and summoned Mahmudabad to appear before it in the matter.Mahmudabad's remarks have been annexed to the notice, and in one of them, he said that right-wing people applauding Colonel Sofia Qureshi should demand protection for victims of mob lynchings and ""arbitrary"" bulldozing of properties.The associate professor described the media briefings by Colonel Qureshi and Wing Commander Vyomika Singh as ""optics"". ""But optics must translate to reality on the ground otherwise it's just hypocrisy,"" he had said.The commission said an initial review of Mahmudabad's remarks has raised concerns about the ""disparagement of women in uniform, including Col. Sophia Qureshi and Wing Commander Vyomika Singh and undermining their role as professional officers in the Indian Armed Forces"".Wing Commander Vyomika Singh briefed the media last week alongside Foreign Secretary Vikram Misri and Colonel Sofia Qureshi on Operation Sindoor.The commission said Mahmudabad's remarks reveal misrepresentation of facts with repeated reference to ""genocide"", ""dehumanisation"", and ""hypocrisy"", thereby attributing malicious communal intent to the government and the armed forces as well as inciting communal distress and attempting to disturb internal peace.It also saw the comments as attempts at vilifying military actions and the role of women officers in response to cross-border terrorism, potential incitement to public unrest, especially targeting communal harmony and undermining national integrity.The notice said the comments were a breach of ethical conduct expected of university faculty and the University Grants Commission (UGC) Regulations, 2018.","The Haryana State Commission for Women has issued a notice to Ashoka University's associate professor, Ali Khan Mahmudabad. The commission said the remarks were in connection with Operation Sindoor and summoned him to appear before it in the matter. The associate professor described the media briefings by Colonel Qureshi and Wing Commander Vyomika Singh as ""optics""","https://static.toiimg.com/thumb/msid-121158756,imgsize-828846,width-400,height-225,resizemode-72/121158756.jpg"
Purnam Kumar Shaw Emotional Call Home: BSF Jawan Says ‘Main Bol Raha Hoon’ to Wife,https://timesofindia.indiatimes.com/city/kolkata/main-bol-raha-hoon-bsf-jawan-purnam-kumar-shaws-first-call-home-melts-wifes-heart/articleshow/121174873.cms,"'Nothing will stop him from serving the country again'





KOLKATA: A little after noon, Rajni's phone rang. ""Main bol raha hun (It's me),"" said a heavy, hoarse voice. Unable to recognise the caller, Rajni tentatively asked, ""Aap PK Sir hain (Are you PK Sir)?""""I couldn't believe it was him. We don't take our husbands' names. I called him PK Sir to confirm it was indeed him,"" said the happy wife. It was a brief call and Purnam asked about his parents and spoke to his son Aarav.For the next few hours, an overjoyed Devanti Devi, Purnam's elderly mother, stood with boxes of sweets at the door of their house. ""Thora munh meetha kar lijiye (have some sweets),"" she urged everyone she met. Purnam and Rajni's eight-year-old son pointed to a kite and spool kept on the top of a cupboard in their bedroom and said, ""We flew the kite when papa came during Holi. We will fly it again together. I am waiting for him to come home. ""Shortly after Purnam's release, Rajni received a call from CM Banerjee. Later, the CM told reporters, ""I spoke to Rajni 3-4 times. Our DGP was in constant touch with the BSF DG. We did whatever we could. Day before yesterday I told Rajni that her husband was fine but the modalities of release were taking a little time. I requested for the matter to be taken up in the (DGMO-level) meeting between India and Pakistan, and they did talk about this.His family is happy and so is the entire nation.""Rajni said the CM had expressed her wish to meet Purnam when he returned home.Junior Union minister Sukanta Majumdar thanked PM Modi for securing Purnam's release while Bengal leader of opposition Suvendu Adhikari met senior BSF officers in Kolkata to express his gratitude.""We cannot even imagine what he faced in Pakistan, but nothing will stop him from serving the country again,"" said 62-year-old Bholanath Shaw, an e-rickshaw driver in Rishra whose youngest son Purnam re-entered India through the Attari-Wagah border on Wednesday after spending 22 days in the custody of Pakistan Rangers. On April 23, a day after the Pahalgam terror attack, the BSF jawan had inadvertently crossed over to Pakistan while on operational duty.For over three weeks, Purnam's family members here had swung between hope and despair as the tension between India and Pakistan mounted. Purnam's pregnant wife Rajni even travelled to Ferozepur to seek answers from her husband's seniors in BSF but nothing much materialised. When India launched Operation Sindoor , their hearts sank.""The day attacks on both sides intensified, I started losing hope. The (BSF) Commanding Officer at Kangra assured me of my husband's return but we couldn't be sure. What if the war escalated and continued for a long time? Fear gripped the entire family,"" recounted RajniFinally on Wednesday morning, Shaw Sadan erupted in joy and tears when the BSF, in a press note, confirmed that Purnam was back home. ""Every citizen of this country prayed for my sindoor and I can't thank them enough,"" said a tearful Rajni, thanking PM Narendra Modi and CM Mamata Banerjee for their help and support.","Purnam Shaw re-entered India through the Attari-Wagah border on Wednesday. On April 23, a day after the Pahalgam terror attack, the BSF jawan had inadvertently crossed over to Pakistan while on operational duty. For over three weeks, Purnam's family members had swung between hope and despair.","https://static.toiimg.com/thumb/msid-121174946,imgsize-44980,width-400,height-225,resizemode-72/121174946.jpg"
Bengaluru Techie Slogan Row: Man Held for Allegedly Shouting ‘Jai Pakistan’,https://timesofindia.indiatimes.com/city/bengaluru/software-engineer-held-for-jai-pakistan-slogan-in-bengaluru/articleshow/121170512.cms,"



BENGALURU: City police arrested a 25-year-old software engineer in Whitefield recently on charges of shouting ""Jai Pakistan"".The accused, Shubhanshu Shukla, is a resident of a paying guest accommodation in Prashant Layout. Hailing from Chhattisgarh and a computer science engineer, he has been residing there for more than four years, investigations have revealed.Shukla, a bachelor, who was booked under multiple sections of BNS, claimed he never intended to hail Pakistan, though police are yet to accept that argument.The incident took place on the night of May 10, when some residents of Prashant Layout called the police control room (112), saying that a youth was shouting pro-Pak slogans. Immediately, a Hoysala vehicle reached the spot and Shukla was apprehended.Residents then shared a video with the police, showing Shukla shouting ""Jai Pakistan"". He was immediately taken to Whitefield police station and arrested.In his statement to the police, Shukla claimed he had initially chanted pro-India slogans. ""Happy with the success of Operation Sindoor, I came out of my PG, shouting ‘Jai Bharat, Jai Bharat'. However, no one, including my roommates, reacted. Disappointed with the lack of response, I thought perhaps shouting a pro-Pak slogan would elicit some response. So, I shouted ‘Jai Pakistan'.""""We are not sure whether the accused raised a pro-India slogan. No one had recorded it. Though when he shouted ‘Jai Pakistan', people recorded it,"" an investigating officer said.","Shubhanshu Shukla, a 25-year-old software engineer, was arrested on charges of shouting ""Jai Pakistan"" He claimed he never intended to hail Pakistan, though police are yet to accept that argument. The incident took place on the night of May 10, when some residents of Prashant Layout called the police.","https://static.toiimg.com/thumb/msid-121174542,imgsize-12790,width-400,height-225,resizemode-72/121174542.jpg"
"Operation Keller: Huge Cache of Weapons, Ammo Seized in J&K’s Shopian After Terrorist Encounter",https://timesofindia.indiatimes.com/city/srinagar/huge-cache-of-weapons-ammo-seized-in-jks-shopian-linked-to-terrorists-killed-in-operation-keller/articleshow/121156015.cms,"Security forces in J&K's Shopian recovered a large cache of weapons after neutralizing three LeT terrorists in Operation Keller. The slain militants, linked to the banned outfit, included two locals whose homes were demolished after the Pahalgam attack.

Poll What do you believe is the most effective method to combat terrorism? Military operations Intelligence-led prevention





NEW DELHI: Security forces on Wednesday seized a massive cache of weapons and ammunition, including rifles, bullets and grenades in J&K's Shopian, a day after three Lashkar-e-Taiba (LeT) terrorists were gunned down in encounter under Operation Keller The recovered arms are believed to have belonged to the trio neutralised on Tuesday during a joint operation by the Army and paramilitary forces in the dense forests of Shoekal Keller.The slain terrorists were linked to Pakistan-backed banned outfit LeT. Two of them — Shahid Kuttay and Adnan Shafi Dar — were locals from Shopian. Their family homes had been demolished after the April 22 Pahalgam attack that killed 26 people, mostly tourists. The identity of the third terrorist is yet to be confirmed.While investigators are yet to establish a direct link between the trio and the Pahalgam massacre, police records show Kuttay had been an active terrorist since March 2023 and was involved in multiple attacks, including the April 8 shooting at Danish Resort in Shopian, which left two German tourists and their driver injured.Dar, who joined LeT in October 2024, killed a migrant labourer in Shopian’s Wachi the same day he joined the group, police said.Posters in Urdu have appeared across Shopian offering a reward of Rs 20 lakh for leads on suspects involved in the Pahalgam killings. One reads: “Those who killed innocents do not have a place in our country.”Operation Keller was launched following intelligence inputs from Rashtriya Rifles about the presence of armed terrorists in the area. The encounter marks Kashmir’s second major counterterrorism success this year, following the March 16 killing of a Pakistani terrorist in Handwara.Security forces remain on high alert amid a temporary pause in Indo-Pak hostilities that followed India’s May 7 airstrikes on nine terror launchpads in PoK under Operation Sindoor.","Security forces in J&K's Shopian recovered a large cache of weapons after neutralizing three LeT terrorists. The slain militants, linked to the banned outfit, included two locals whose homes were demolished after the Pahalgam attack. The recovered arms are believed to have belonged to the trio neutralised on Tuesday.","https://static.toiimg.com/thumb/msid-121156558,imgsize-1034223,width-400,height-225,resizemode-72/121156558.jpg"
"In apparent jibe at Shashi Tharoor, CWC members say leaders taking stand on ceasefire different from party line",https://timesofindia.indiatimes.com/india/in-apparent-jibe-at-tharoor-cwc-members-say-leaders-taking-stand-on-ceasefire-different-from-party-line/articleshow/121176764.cms,"Shashi Tharoor (File Photo)

NEW DELHI: CWC members Wednesday complained that certain leaders have repeatedly taken a position on ceasefire that is at variance with the party line, in what was seen as a jibe at Shashi Tharoor . The leadership is said to have sent out a “clear message” to leaders that they should not be airing personal views at this time and should instead stand by the party stance.Later, when asked at a press briefing about Tharoor's comments being at odds with the party's stand, AICC spokesman Jairam Ramesh said, ""That is his opinion. When Tharoor speaks, it is his view, and it is not the stand of the party.""Tharoor has been speaking regularly on the Indo-Pak war and his comments in support of the govt and making light of US President Donald Trump’s mediation have riled many in Congress as the party has been taking on the govt over the issue.","Tharoor has been speaking regularly on the Indo-Pak war and his comments in support of the govt and making light of US President Donald Trump’s mediation have riled many in Congress. AICC spokesman Jairam Ramesh said, ""That is his opinion. When Tharoor speaks, it is his view, and it is not the stand of the party.""","https://static.toiimg.com/thumb/msid-121176746,imgsize-25160,width-400,resizemode-4/-.jpg"
'They're coming': Mexican beauty influencer Valeria Márquez shot dead on TikTok live; what we know so far,https://timesofindia.indiatimes.com/world/rest-of-world/theyre-coming-mexican-beauty-influencer-valeria-mrquez-shot-dead-on-tiktok-live-what-we-know-so-far/articleshow/121176685.cms,"What happened

A troubling warning

Femicide crisis in Mexico





A 23-year-old Mexican beauty influencer Valeria Márquez , was fatally shot during a TikTok live stream on Tuesday. The chilling incident has reignited national outrage over gender-based violence.The brazen killing occurred at a beauty salon in Jalisco's Zapopan, where Márquez worked and was livestreaming to her followers. According to the Jalisco state prosecutor, the case is being investigated as a femicide, a gender-based crime that often involves degrading or sexually violent elements, ties to the perpetrator, or public exposure of the victim's body.Márquez, known for her makeup tutorials and beauty content, was livestreaming to her nearly 200,000 followers when the attack happened. Just moments before the shooting, she appeared on camera holding a stuffed toy and said, ""They're coming,"" in an anxious tone. A voice off-camera called out, ""Hey, Vale?"" to which she responded, ""Yes."" She then muted the audio.Seconds later, gunshots rang out. The stream appeared to capture the sound of the attack, and a person briefly picked up Márquez's phone, revealing part of their face before the live feed abruptly ended.The suspect, who has not been identified or apprehended, reportedly entered the salon and shot Márquez before fleeing.Earlier during the same live stream, Márquez had expressed concern over a visit from an unknown person who had come to the salon when she wasn't there, claiming to have brought her an ""expensive gift."" She told viewers she had no intention of waiting for them to return.Márquez's murder underscores Mexico's ongoing femicide crisis. The country is tied with Paraguay, Uruguay, and Bolivia for the fourth-highest femicide rates in Latin America and the Caribbean, with 1.3 such deaths per 100,000 women, according to 2023 data from the United Nations Economic Commission for Latin America and the Caribbean.The state of Jalisco, where the killing occurred, ranks sixth in the country for homicides. Since October 2024, the start of President Claudia Sheinbaum's term, 906 homicides have been recorded in the state, according to data consultancy TResearch.","Valeria Márquez, a 23-year-old beauty influencer, was fatally shot during a TikTok live stream. The brazen killing occurred at a beauty salon in Jalisco's Zapopan. The case is being investigated as a femicide, a gender-based crime.","https://static.toiimg.com/thumb/msid-121176724,imgsize-1175428,width-400,resizemode-4/121176724.jpg"
2 held in Delhi for Punjab liquor tragedy; toll 23,https://timesofindia.indiatimes.com/city/amritsar/2-held-in-delhi-for-punjab-liquor-tragedy-toll-23/articleshow/121176705.cms,"The death toll in the Majitha spurious liquor tragedy has risen to 23, with two more fatalities reported. Police have arrested two individuals from Delhi, Ravinder Jain and Rishabh Jain, suspected of supplying the spurious liquor.





AMRITSAR: The Majitha spurious liquor tragedy toll climbed to 23 on Wednesday, with two more people - Balkar Singh (45) and Sahib Singh (50) both from Bhagnwan village - succumbing.As many as eight more people are still under treatment in Amritsar's Guru Nanak Dev Hospital.DGP Gaurav Yadav said that police have arrested two people, Ravinder Jain and Rishabh Jain, from Delhi's Model Town in the case.""One of the main accused, Sahib Singh, was in contact with Rishabh, which was revealed through his WhatsApp chat history. It is suspected that Sahib received a consignment from Rishabh, which was used to manufacture spurious liquor in Punjab,"" he said.Amritsar SSP (Rural) Maninder Singh said that a court remanded them to police custody for two days.Meanwhile, the drug control department issued a press release claiming to have made significant progress in the fight against drug abuse in the Amritsar district. According to the release, drugs worth Rs 71 lakh were recovered, and licences of 38 medical stores suspended in the past two months.","Balkar Singh (45) and Sahib Singh (50) both from Bhagnwan village succumbing. As many as eight more people are still under treatment in Amritsar's Guru Nanak Dev Hospital. Police have arrested two individuals from Delhi, Ravinder Jain and Rishabh Jain.","https://static.toiimg.com/thumb/msid-121176711,imgsize-77138,width-400,height-225,resizemode-72/121176711.jpg"
Trump to close deal-making Gulf tour in UAE,https://timesofindia.indiatimes.com/world/middle-east/trump-to-close-deal-making-gulf-tour-in-uae/articleshow/121175913.cms,"Donald Trump (Photo: AP)

Poll Would you support further US involvement in Middle Eastern peace talks? Yes, it's necessary. No, we should focus on domestic issues.

Silent on rights





DOHA: US President Donald Trump on Thursday closes a Middle East tour in the United Arab Emirates as he focuses squarely on seeking deals after billions of dollars of pledges from Saudi Arabia and Qatar.The first major trip of his second term had been scheduled to end Thursday but Trump, always ready with surprises, did not rule out continuing on to Turkey if Russian President Vladimir Putin shows up for talks with Ukraine.Trump will fly to the Emirati capital Abu Dhabi after a stop in Qatar, where the president hailed what he said was a record $200 billion deal for Boeing aircraft.He started the trip in Saudi Arabia which promised its own $600 billion in investment, including one of the largest-ever purchases of US weapons.The Gulf leaders' largesse has also stirred controversy, with Qatar offering Trump a luxury aeroplane ahead of his visit for presidential and then personal use, in what Trump's Democratic rivals charged was blatant corruption.Trump, who also chose Saudi Arabia for the opening visit of his first term, has been unabashed about seeking Gulf money and hailed the effect on creating jobs at home.In a speech in Riyadh, Trump attacked not only Democrats but also the traditional wing of his own Republican Party, which had championed US military intervention in Afghanistan and Iraq.Complimenting the skyline of the Saudi desert capital, Trump said: ""The gleaming marvels of Riyadh and Abu Dhabi were not created by the so-called 'nation-builders', 'neocons' or 'liberal non-profits', like those who spent trillions failing to develop Kabul and Baghdad.""""Instead, the birth of a modern Middle East has been brought about by the people of the region themselves,"" he said.""In the end, the so-called 'nation-builders' wrecked far more nations than they built.""Trump steered clear of any hint of criticism of the Gulf monarchies on human rights.Trump's predecessor Joe Biden had initially vowed to shun Saudi Arabia's Crown Prince Mohammed bin Salman over US intelligence findings that he ordered the gruesome murder in 2018 of Jamal Khashoggi -- a Saudi dissident writer who lived in the United States.Trump instead hailed the crown prince, who is Saudi Arabia's de facto ruler, as a visionary due to the kingdom's rapid economic investments.Trump also acceded to a key request by the crown prince in announcing a lifting of sanctions on Syria following the toppling of Bashar al-Assad in December.He met in Riyadh with Ahmed al-Sharaa, a former Islamist guerrilla once on the US wanted list who dressed in a suit and was complimented by Trump as a ""young, attractive guy"".Trump was joined in the meeting by Prince Mohammed and, virtually, by Turkish President Recep Tayyip Erdogan, the key supporter of the former Syrian rebels.Trump said Wednesday he was willing to travel to Turkey if Putin accepts an offer by Ukrainian President Volodymyr Zelensky to meet on ending the war.Russia has given no indication that Putin will attend. Trump said that Secretary of State Marco Rubio would travel nonetheless to Istanbul for the potential talks.",US President Donald Trump closes a Middle East tour in the United Arab Emirates. The first major trip of his second term had been scheduled to end Thursday. Trump did not rule out continuing on to Turkey if Russian President Vladimir Putin shows up for talks with Ukraine.,"https://static.toiimg.com/thumb/msid-121176002,imgsize-31046,width-400,resizemode-4/121176002.jpg"
