Article Title,Article Link,Article Text,Article Summary,Article Image
"Chinese hackers breach US telecom networks, access sensitive data",https://timesofindia.indiatimes.com/world/us/chinese-hackers-breach-us-telecom-networks-access-sensitive-data/articleshow/113997839.cms,"Chinese hackers have reportedly infiltrated the networks of major US broadband providers, gaining access to information related to systems used for court-authorised wiretapping . This information was disclosed in a report by the Wall Street Journal on Saturday.The telecom companies affected by this breach include Verizon Communications, AT&T, and Lumen Technologies.Sources familiar with the situation indicated that the hackers may have had access to these networks for several months. This network infrastructure is critical for facilitating US requests for communications data as authorised by the courts. The hackers are also believed to have intercepted additional internet traffic.The Wall Street Journal also mentioned that US investigators have linked the attack to a Chinese hacking group known as "" Salt Typhoon ,"" which is believed to be focused on intelligence gathering. Earlier this year, US law enforcement disrupted another Chinese hacking group referred to as ""Flax Typhoon,"" following increased scrutiny of China's cyber activities under a broader campaign known as ""Volt Typhoon.""In its statement, China's foreign ministry further asserted that evidence gathered by its cybersecurity agencies showed that the Volt Typhoon campaign was orchestrated by an international ransomware organisation.In response to the report, China's foreign ministry stated on Sunday that it was unaware of any such cyber attack. The ministry accused the United States of creating a ""false narrative"" aimed at framing China, insisting that cybersecurity is a shared global challenge that requires cooperation and dialogue.This isn't the first time the US has accused China of cyber espionage. Beijing has consistently denied claims that it uses hackers to infiltrate foreign computer systems.While Lumen Technologies declined to comment, Verizon and AT&T did not respond to requests for information regarding the breach.","Chinese hackers have reportedly infiltrated the networks of major US broadband providers, gaining access to systems used for court-authorised wiretapping. The telecom companies affected by this breach include Verizon Communications, AT&T, and Lumen Technologies. This network infrastructure is critical for facilitating US requests for communications data as authorised by the courts.","https://static.toiimg.com/thumb/msid-113997835,imgsize-1564323,width-400,resizemode-4/113997835.jpg"
"Guns, transgender rights on docket for US Supreme Court fall term",https://timesofindia.indiatimes.com/world/us/guns-transgender-rights-on-docket-for-us-supreme-court-fall-term/articleshow/113997111.cms,"US Supreme Court (AP photo)

WASHINTON: The US Supreme Court returns from its summer recess on Monday with regulation of "" ghost guns "" -- firearms made from kits -- and medical care for transgender youth on a docket that risks being gate-crashed in the event of a contested presidential election.David Cole, the legal director of the American Civil Liberties Union ( ACLU ), which frequently brings cases before the highest court, said he expects ""a much quieter term than we've had in the last couple of years.""""But you know, that could change if the presidential election is close and disputed,"" Cole added in a reference to potential lawsuits stemming from the November 5 White House contest between Republican Donald Trump and Democrat Kamala Harris.In a landmark decision last term in a case filed by Trump, who is charged with conspiring to overturn the results of the 2020 election, the conservative-dominated court ruled 6-3 that a former president has broad immunity from criminal prosecution.The justices also dismissed a Colorado court ruling that would have barred Trump from the November ballot because of his role in the January 6, 2021 assault on the US Capitol by his supporters.One of the first cases the justices will hear -- on Tuesday -- involves ghost guns: firearms sold online or in stores as ""buy build shoot"" kits that can be easily assembled at home.The court will hear a challenge from gun manufacturersand owners to a rule from the federal Bureau of Alcohol, Tobacco, Firearms and Explosives (ATF) that requires ghost guns, like other firearms, to have serial numbers and for their purchasers to undergo background checks.According to ATF figures, some 20,000 ghost guns were recovered at crime scenes in the United States in 2021, a tenfold increase from 2016.Another high-profile case, described by Chase Strangio, an ACLU attorney, as one of the ""most significant LGBTQ cases"" to ever reach the Supreme Court, involves the deeply divisive issue of gender-affirming care for transgender youth.The Justice Department is challenging a Tennessee ban on treatments for transgender minors such as puberty blockers or hormone therapy. Tennessee is one of two dozen Republican-led states enforcing such restrictions.In April, the court allowed a similar ban -- in Idaho -- to take effect while legal challenges proceed. Under the Idaho law, medical professionals who provide treatments to minors can face up to 10 years in prison.Ethics, low approval, reformThe Supreme Court will also hear a challenge to a law in Texas that requires pornographic websites to verify the age of visitors in order to limit minors' access to online sexual content.The law mandating the sites to require state-issued identification from users has been challenged by a trade association representing the adult entertainment industry on the grounds it violates the free speech rights guaranteed by the First Amendment to the US Constitution.The Supreme Court has also agreed to decide whether a $10 billion lawsuit filed by Mexico, accusing American gunmakers of fueling drug trafficking and violence, can go ahead.Smith & Wesson and gun distributor Interstate Arms are seeking a dismissal of the Mexican government's suit, which has been winding its way through US courts since 2021.The politically charged rulings, ethics scandals and the decision two years ago striking down the nationwide right to abortion have contributed to near record-low approval ratings for the Supreme Court, particularly among Democrats.Fifty-two percent of the Americans surveyed in a Gallup poll in July said they disapprove of the way the court is handling its job, while 43 percent said they approve. Sixty-six percent of Republicans said they approve, but only 15 percent of Democrats.The Supreme Court adopted an ethics code last year following reports of luxury vacations received by conservative justices Clarence Thomas and Samuel Alito -- both of whom have denied any impropriety -- but it was criticized for lacking an enforcement mechanism.Thomas and Alito also both rebuffed calls to recuse themselves from cases related to the 2020 election -- Thomas because his wife supported Trump's efforts to overturn the results and Alito because flags linked to Trump's false election claims were flown outside his home.Three of the nine justices on the top court -- Neil Gorsuch, Brett Kavanaugh and Amy Coney Barrett -- were nominated by Trump, giving conservatives a 6-3 majority on the bench.Democratic President Joe Biden proposed reforms of the nation's highest court in July -- including limiting a justice's current lifetime appointment to an 18-year term -- but there is little to no chance of passage in a deeply divided Congress.","US Supreme Court returns from its summer recess on Monday. Docket includes regulation of "" ghost guns "" and medical care for transgender youth. Conservative-dominated court ruled 6-3 that a former president has broad immunity from criminal prosecution. High-profile rulings, ethics scandals and the decision two years ago striking down the nationwide right to abortion have contributed to low approval ratings.","https://static.toiimg.com/thumb/msid-113997145,imgsize-900793,width-400,resizemode-4/113997145.jpg"
Largest evacuation since 2017: Florida braces for hurricane Milton after Helene,https://timesofindia.indiatimes.com/world/us/largest-evacuation-since-2017-florida-braces-for-hurricane-milton-after-helene/articleshow/113996990.cms,"Florida braced for its second major hurricane in days, as Hurricane Milton intensified, prompting the state's largest evacuation since 2017. Coming just after the devastating Hurricane Helene , which caused significant damage across the southeastern U.S., Milton is expected to hit the already hard-hit Tampa Bay area. Officials urged residents in vulnerable areas to leave, with over 500,000 people facing mandatory evacuation orders in Pinellas County, which includes St.Petersburg.Milton strengthened from a tropical storm into a Category 1 hurricane on Sunday and is projected to make landfall on Wednesday. Florida Governor Ron DeSantis warned that the storm’s impacts could be even worse than Helene's, particularly due to lingering debris from the earlier hurricane. ""What's going to happen to that debris? It's going to increase the damage dramatically,"" he said. Schools in Pinellas County have been closed through Wednesday, and six hospitals, along with nursing homes, have been evacuated as a precaution.The storm, currently packing winds of 85 mph, is expected to become a Category 3 or 4 hurricane by the time it reaches the coast. Governor DeSantis expanded the state of emergency to 51 counties and urged residents to prepare for power outages and potential food and water shortages. ""You have time to prepare,"" he said, encouraging residents along Florida's west coast to heed evacuation orders.Hurricane Helene, which hit just days before, has already caused widespread destruction, particularly in the northern regions. The death toll from Helene has risen to at least 230 people, making it the deadliest storm to hit the U.S. mainland since Hurricane Katrina. Federal assistance is in place for the ongoing recovery, and President Biden has approved over $137 million in aid. Meanwhile, emergency services continue to work around the clock to clear debris and prepare for Milton's arrival.","Milton strengthened from a tropical storm into a Category 1 hurricane on Sunday and is projected to make landfall on Wednesday. Governor Ron DeSantis warned that the storm’s impacts could be even worse than Helene's, particularly due to lingering debris from the earlier hurricane.","https://static.toiimg.com/thumb/msid-113996983,imgsize-1307213,width-400,resizemode-4/113996983.jpg"
Chinese hackers breached US court wiretap systems: Report,https://timesofindia.indiatimes.com/world/us/chinese-hackers-breached-us-court-wiretap-systems-report/articleshow/113996367.cms,"Chinese hackers accessed the networks of US broadband providers and obtained information from systems the federal govt uses for court-authorised wiretapping, the Wall Street Journal reported on Saturday. Verizon Communications , AT&T and Lumen Technologies are among the telecoms companies whose networks were breached by the recently discovered intrusion, the newspaper said, citing people familiar with the matter.The hackers might have held access for months to network infrastructure used by the companies to cooperate with court-authorised US requests for communications data, the Journal said. It said the hackers had also accessed other tranches of internet traffic.China's foreign ministry responded on Sunday that it was not aware of the attack described in the report but said the US had ""concocted a false narrative"" to ""frame"" China in the past. ""At a time when cybersecurity has become a common challenge for all countries around the world, this erroneous approach will only hinder the efforts of the international community to jointly address the challenge through dialogue and cooperation,"" the ministry said in a statement to Reuters.Beijing has previously denied claims by the US govt and others that it has used hackers to break into foreign computer systems.Lumen Technologies declined to comment, while Verizon and AT&T did not immediately respond to requests for comment. The Journal said the attack was carried out by a Chinese hacking group with the aim of collecting intelligence. US investigators have dubbed it ""Salt Typhoon"".","Chinese hackers accessed the networks of US broadband providers and obtained information from systems the federal govt uses for court-authorised wiretapping. Verizon Communications, AT&T and Lumen Technologies are among the telecoms companies whose networks were breached by the recently discovered intrusion.","https://static.toiimg.com/thumb/msid-113996369,imgsize-254946,width-400,resizemode-4/113996369.jpg"
Donald Trump: 'Ridiculous ploy': Lara Trump slams 165-page brief in father-in-law Donald Trump's election case,https://timesofindia.indiatimes.com/world/us/ridiculous-ploy-lara-trump-slams-165-page-brief-in-father-in-law-donald-trumps-election-case/articleshow/113993943.cms,"Lara Trump is married to Eric Trump, the third child of former US President Donald Trump.

Republican National Committee co-chair Lara Trump has termed the recent filing of a 165-page brief by federal prosecutors in her father-in-law Donald Trump ’s election fraud case a ""ridiculous ploy,"" suggesting it aims to influence voters just weeks ahead of the election. During an appearance on CNN ’s Talk show 'State of the Union', she expressed concern over the timing of the brief, which seeks to convince US District Judge Tanya Chutkan that Trump's alleged actions following the 2020 election were personal, rather than official, and thus justifiable for indictment, as reported by Newsweek .The brief was partly unsealed on Wednesday, detailing accusations against Trump, who faces four felony counts in connection with efforts to overturn President Joe Biden ’s election victory, culminating in the January 6 , 2021, Capitol riot. Trump has pleaded not guilty to all charges, asserting that the prosecution is politically motivated.Lara Trump echoed that the former president will ""of course"" accept the election's results ""if he feels that this is a free, fair and transparent election.""One revelation from the filing was a conversation between Trump and an unnamed White House aide during the Capitol riot. The aide informed Trump that then-vice president Mike Pence had to be evacuated due to potential danger, to which Trump reportedly responded, ""So what?"" Lara Trump was questioned by host Dana Bash about this alleged reaction and condemned the overall narrative surrounding January 6 as exaggerated and politically charged.""The January 6 situation has been amplified to a level that I don't think is almost believable to so many people right now,"" she said, adding that the timing of the allegations suggests Democrats lack confidence in vice president Kamala Harris as a candidate.Legal experts have described the evidence presented against Trump as ""pretty damning,"" with additional allegations revealing a Trump campaign staffer allegedly encouraging unrest during the vote count in Detroit. Furthermore, Trump is accused of telling family members aboard Marine One that ""it doesn't matter if you won or lost the election. You still have to fight like hell,"" a statement reportedly overheard by a White House staff member willing to testify.Trump has dismissed the allegations as a ""hit job"" and continued to maintain that the 2020 election was stolen, insisting he would only accept the results of the 2024 election if it is ""free, fair, and transparent."" Meanwhile, his federal trial is set to proceed after the November elections, with Trump required to respond to Smith's filing by November 7.","Lara Trump has condemned the recent filing of a 165-page brief by federal prosecutors in her father-in-law Donald Trump’s election fraud case. The brief was partly unsealed on Wednesday, detailing accusations against Trump, who faces four felony counts in connection with efforts to overturn President Joe Biden's election victory. Trump has pleaded not guilty to all charges, asserting that the prosecution is politically motivated.","https://static.toiimg.com/thumb/msid-113994233,imgsize-962523,width-400,resizemode-4/113994233.jpg"
Elon Musk: The best memes of Elon Musk jumping at Trump's Butler rally,https://timesofindia.indiatimes.com/world/us/the-best-memes-of-elon-musk-jumping-at-trumps-butler-rally/articleshow/113993775.cms,"Elon Musk made headlines by appearing at Donald Trump's rally in Butler, Pennsylvania. Sporting a 'MAGA' cap and 'Occupy Mars' shirt, Musk dubbed himself 'Dark MAGA' and stressed the importance of Trump's victory in the 2024 election. He has established a super PAC to support Trump and shared a video endorsing the former president amidst an assassination attempt.","Elon Musk appeared at Donald Trump's rally in Butler, Pennsylvania. He wore a 'MAGA' cap and 'Occupy Mars' shirt. Musk has established a super PAC to support Trump and shared a video endorsing the former president amidst an assassination attempt.","https://static.toiimg.com/thumb/msid-113993821,imgsize-1061477,width-400,resizemode-4/113993821.jpg"
Joe Biden: FEMA administrator hits back at Trump’s 'ridiculous' claims on Biden's Hurricane Helene response,https://timesofindia.indiatimes.com/world/us/fema-administrator-hits-back-at-trumps-ridiculous-claims-on-bidens-hurricane-helene-response/articleshow/113993436.cms,"<p>Federal Emergency Management Agency (FEMA) administrator Deanne Criswel <span class=""redactor-invisible-space"">(Photo: Reuters) </span><br></p>

As the federal response to Hurricane Helene becomes a focal point in the final stretch of the presidential campaign, US President Joe Biden ’s administration is pushing back against former President Donald Trump ’s unfounded claims about the storm recovery efforts, as per USA Today.Federal Emergency Management Agency (FEMA) administrator Deanne Criswell , appearing on ABC’s “This Week” on Sunday, assured that FEMA has all the necessary resources to respond to Helene, which has severely impacted parts of Florida, Georgia, North Carolina, and other states.With North Carolina and Georgia being key swing states , the political implications of the recovery efforts have been increased.Criswell dismissed Trump’s claims that disaster relief funds were being redirected to support undocumented immigrants, and that aid was being withheld from Republican regions. She called these accusations as ""frankly ridiculous and just plain false.""“This kind of rhetoric is not helpful to people,” Criswell said. “It’s really a shame that we’re putting politics ahead of helping people.”Trump, who has consistently criticised the response, made a series of remarks during recent public appearances. At a rally in Michigan last week, he claimed, “Kamala spent all her FEMA money, billions of dollars, on housing for illegal immigrants,” alleging that this left FEMA with no resources for storm recovery. Trump went on to say, “They stole the FEMA money, just like they stole it from a bank, so they could give it to their illegal immigrants.”FEMA’s Shelter and Services Programme allocates $650 million for humanitarian support to noncitizens after their detention, but this is separate from disaster relief funding. “No money is being diverted from disaster response needs. None,” clarified a White House statement.Department of Homeland Security secretary Alejandro Mayorkas claimed that FEMA has adequate funds for immediate needs but may struggle if additional storms occur. “We are meeting the immediate needs with the money that we have,” Mayorkas said, adding that further funds would be required for a full recovery.Congress recently approved $20 billion for disaster relief, but Biden has indicated that additional funding will be needed to address future storms.Meanwhile, Trump stepped up his criticism during a rally in Pennsylvania, focusing on the $750 payment FEMA offers to disaster victims to cover essential items. “Remember, $750 to people whose homes have been washed away, and yet we send tens of millions of dollars to foreign countries,” Trump said.The Biden administration defended this initial payment, explaining that it is meant to cover urgent needs like food, water, and medication, with additional assistance potentially available after further assessment.","Hurricane Helene has severely impacted parts of Florida, Georgia, North Carolina, and other states. With North Carolina and Georgia being key swing states, the political implications of the recovery efforts have been increased. FEMA administrator Deanne Criswell assured that FEMA has all the necessary resources to respond.","https://static.toiimg.com/thumb/msid-113993465,imgsize-1445605,width-400,resizemode-4/113993465.jpg"
Climate Change: Laura Loomer calls Marjorie Taylor Greene a 'White trash embarrassment to MAGA',https://timesofindia.indiatimes.com/world/us/laura-loomer-calls-marjorie-taylor-greene-a-white-trash-embarrassment-to-maga/articleshow/113991244.cms,"Republican political analyst Laura Loomer and Congresswoman Marjorie Taylor GreeneGreene

Congresswoman Marjorie Taylor Greene has sparked a wave of criticism over her remarks on climate change , as shared in a recent video posted on social media platform X. In her comments, Greene suggested that human activity is not a significant factor in climate change, asking, ""You're going to tell me that back in the Ice Age, how much tax did people pay? And how many changes did the government make to melt the ice?""Laura Loomer , a Republican political activist , was quick to respond on X, questioning Greene’s intelligence and qualifications as a member of Congress.""Is there anyone dumber in Congress?"" she wrote. ""How much taxes? Who talks like that as a sitting member of Congress? Like I said, I can’t see how anyone with common sense takes this woman seriously. She’s a White trash embarrassment to MAGA . Absolute harpy.""""She deserves to be condemned for her nonstop lies and smears about President Trump ’s most loyal supporters. I truly hate her"", Laura added.In response to Laura’s criticisms, one user defended Greene, saying, ""She is a fighter though you gotta give her that."" Laura dismissed this assertion, replying, ""No she isn’t. She says one thing and does another.""Both Greene and Loomer have shown signs of tense relations. Greene once labelled Loomer’s remarks about US vice president Kamala Harris as “extremely racist” and expressed concern about Loomer’s influence on the MAGA movement, as reported by CNN .The conflict between these two figures highlights a bigger divide among Trump’s supporters about the party's message as the 2024 elections near.Loomer often attends events with Trump and stands by her comments, while Greene, who has faced criticism for her past remarks, stressed that Republicans should prioritise policy over identity politics.",Congresswoman Marjorie Taylor Greene sparked a wave of criticism over her remarks on climate change. Republican political activist Laura Loomer questioned Greene's intelligence and qualifications as a member of Congress. The conflict between these two figures highlights a bigger divide among Trump's supporters about the party's message as the 2024 elections near.,"https://static.toiimg.com/thumb/msid-113991708,imgsize-1194680,width-400,resizemode-4/113991708.jpg"
Dark MAGA: Elon Musk at Trump Butler rally: What exactly is Dark MAGA?,https://timesofindia.indiatimes.com/world/us/elon-musk-said-i-am-dark-maga-what-exactly-is-dark-maga/articleshow/113989846.cms,"Elon Musk recently attended a Donald Trump rally in Pennsylvania, identifying himself as 'Dark MAGA,' a term linked to far-right groups. Musk praised Trump while criticizing current President Biden. His support for Trump exemplifies his growing alignment with conservative politics, amplified through his social media platform, X.","Elon Musk recently attended a Donald Trump rally in Pennsylvania. He identified himself as 'Dark MAGA,' a term linked to far-right groups. Musk praised Trump while criticizing current President Biden. His support for Trump exemplifies his growing alignment with conservative politics.","https://static.toiimg.com/thumb/msid-113989904,imgsize-713676,width-400,resizemode-4/113989904.jpg"
