Article Title,Article Link,Article Text,Article Summary,Article Image
Trump's claim about sending Taliban leader Abdul his house photo fuels social media frenzy,https://timesofindia.indiatimes.com/world/us/trumps-claim-about-sending-taliban-leader-abdul-his-house-photo-fuels-social-media-frenzy/articleshow/113273071.cms,"Republican Presidential nominee Donald Trump’s assertion that he sent a photo of his own house to a Taliban leader has ignited a wave of memes and online commentary. During the debate with Democratic Vice President Kamala Harris , Trump discussed his negotiations with the Taliban before the 2021 US troop withdrawal from Afghanistan, referring to himself as President at the time.""He is still the head of the Taliban. & I told Abdul don't do it anymore, you do it anymore you're going to have problems. And he said why do you send me a picture of my house? I said you're going to have to figure that out, Abdul. & for 18 months we had nobody killed,"" Trump said during the debate.Trump's comments sent social media into a meme flurry. One X user asked, “Now that the dust has settled, can we go back to why Trump sent a guy named Abdul a picture of his house?”Another questioned, “I wonder if Trump really gonna send Abdul that picture of his house tho ??” A third user shared a video with the caption, “This what happens when Trump shows #Abdul his house,” using a dramatic movie scene for effect. Another tweet read, “Why are you sending me a picture of my house? You’ll have to figure that out Abdul ??????. I was cracking up so hard yesterday watching the debate.”Trump defended his debate performance in a Wednesday appearance on ""Fox & Friends,"" calling it “one of my better debates, maybe my best debate.” He also expressed some hesitation about participating in future debates.The debate attracted a record 57.5 million viewers across seven TV networks, exceeding previous debate viewership numbers. However, reactions from within the Republican Party have been varied. Senator Lindsey Graham labelled Trump’s performance as a “missed opportunity,” while former ally Chris Christie criticized the debate preparation.","Republican Presidential nominee Donald Trump said he sent a photo of his own house to a Taliban leader. Trump's comments ignited a wave of memes and online commentary. Trump defended his debate performance in a Wednesday appearance on ""Fox & Friends,"" calling it ""one of my better debates, maybe my best debate""","https://static.toiimg.com/thumb/msid-113273058,imgsize-1420797,width-400,resizemode-4/113273058.jpg"
'Fact checking only Trump': US Presidential debate blasted for ‘bias’ towards Harris,https://timesofindia.indiatimes.com/world/us/fact-checking-only-trump-us-presidential-debate-blasted-for-bias-towards-harris/articleshow/113275008.cms,"'Shame on you ABC': Megyn Kelly

'How ABC moderators allow Harris to lie?'

Embarrassing moderators did pure work of bias

Trump wants ABC News banned on grounds of bias

After the heated debate between the presidential candidates vice president Kamala Harris and former President Donald Trump , political analyst accused ABC News of being biased and giving soft treatment to the Democratic nominee over her flip, flop policy.Mark Halperin, a journalist and former political director at ABC News, alleged that the media was shielding Harris at all costs.He criticised the moderators' gentle handling of Harris' policy inconsistencies, calling it the ""biggest failure of the night.""During a livestream on his media platform 2WAY on Wednesday, Halperin said, ""Not only was one news organization fully on board to continue through Election Day protecting her at all costs, but we saw in the coverage of the debate, which was laughably uneven, no recognition that it was laughably uneven. In fact, mostly praise for how great a job ABC did.""He added, ""Bigger to me, was last night was the best — and if the Harris campaign continues to hide her, maybe only chance — to get her to explain her issue position changes. That to me was the biggest failure.""The perceived bias of ABC debate co-moderators David Muir and Linsey Davis drew criticism from various analysts. Megyn Kelly, a former presidential debate moderator, delivered her brutal review of ABC's 2024 presidential debate.In a post on X, she said, ""ABC's Bias, How Trump Could Have Played it, and Whether the Debate Sways Voters with @Kmele, @mcmoynihan and @MattWelch Plus, the left's over-the-top Taylor Swift Kamala endorsement reaction, Harris' 'medical misinformation' on abortion, and more.""While the debate was going on, Kelly posted a series of tweets slamming the moderators and Harris.""The absolute gall of ABC to keep “fact checking” ONLY Trump while letting her lie in every answer is infuriating,"" she said.In another post, she said, ""These moderators are a disgraceful failure and this is one of the most biased, unfair debates I have ever seen. Shame on you.""Several people on social media throughout the debate targeted Muir and Davis' for “one-sided” fact-checking.Donald Trump Jr. also hammered the moderators for only fact-checking Trump, but not Harris.“Weird how the hack moderators at @abcnews are only ‘Fact checking’ Trump and allowing Kamala to lie nonstop,” he wrote. “The Fake News is the enemy of the people!”Political commentator Noah Pollak called the moderators ""worst moderators in presidential debate history"" and their duty as ""pure work of bias.""""ABC hosts embarrassing themselves protecting Harris from having to answer whether she supports partial birth late term abortions,"" he said in a post on X.Earlier, Trump even complained the debate was rigged, with the moderators “correcting everything” he said while not challenging Kamala Harris.“I think ABC took a big hit last night. To be honest, they’re a news organization—they have to be licensed to do it. They ought to take away their license for the way they did that,"" he said.Senator Eric Schmitt (R-Mo.) voiced frustration, tweeting, “ABC’s selective ‘Fact Checking’ is why no one believes biased ‘Fact Checking.’” Other conservatives, including Hogan Gidley, a former Trump White House spokesman, criticised the moderators for failing to challenge Harris on several key issues, leaving Trump to fact-check her claims himself.","Mark Halperin, a journalist and former political director at ABC News, alleged that the media was shielding Harris at all costs. Megyn Kelly, a former presidential debate moderator, delivered her brutal review of ABC's 2024 presidential debate. Donald Trump Jr. also hammered the moderators for only fact-checking Trump, but not Harris.","https://static.toiimg.com/thumb/msid-113276212,imgsize-2160711,width-400,resizemode-4/113276212.jpg"
"​​Hurricane Francine hits Louisiana with destructive winds, causing power cuts to over 190,000 customers​​",https://timesofindia.indiatimes.com/world/us/hurricane-francine-hits-louisiana-with-destructive-winds-causing-power-cuts-to-over-190000-customers/articleshow/113274758.cms,"Risk of tornadoes and severe thunderstorms

Advisory issued

President grants emergency declaration

Flights canceled

Residents describe storm as ‘little scary’

Third hurricane in US this year

Hurricane Francine hit Louisiana on Wednesday evening as a Category 2 storm, cutting power to roughly 190,000 customers and causing severe flooding along the Gulf Coast. The storm made landfall in Terrebonne Parish , southwest of Morgan City, with winds near 100 mph.Francine's eye made landfall at 5 pm CT in Terrebonne Parish, driving hurricane-force winds inland toward southern Louisiana near Baton Rouge.According to Morgan City Fire chief Alvin Cockerham, significant damage including flooded streets, downed power lines, and broken tree limbs was reported in Louisiana. “It’s a little bit worse than what I expected, to be honest with you,” he said. “It’s too dangerous to be out there in this.”The National Hurricane Center (NHC) forecasts that Francine will gradually turn northward, moving across southeastern Louisiana and southwestern and central Mississippi on Thursday. The storm's impacts could extend hundreds of miles outward, even as its center moves inland.Francine was the sixth named storm of the Atlantic hurricane season and rapidly strengthened before landfall. The storm has increased the risk of tornadoes and severe thunderstorms, with conditions expected to last into Friday morning.The National Hurricane Center advised residents to remain indoors as Francine moved inland. The storm was expected to pass near New Orleans and weaken as it travels northeast through Mississippi, bringing heavy rain and potential flash flooding to several cities. Brad Reinhart, a senior hurricane specialist, warned that some areas could see up to 12 inches of rain.Louisiana Governor Jeff Landry said the National Guard would assist affected areas with food, water, vehicles, boats, and helicopters for search and rescue.President Joe Biden granted an emergency declaration for Louisiana, and states of emergency were declared by the governors of Louisiana and Mississippi.The Mississippi Emergency Management Agency distributed over 100,000 sandbags to the southern part of the state, and several schools were closed.Governor Landry said, ""After declaring a state of emergency, we have now determined that this storm is of such severity that an effective response is beyond the capabilities of the state and local governments. This federal assistance is needed to save lives and property.""Airlines canceled flights into and out of Louis Armstrong New Orleans International Airport through Thursday morning.Coastal communities faced high waves, flooded streets, and strong winds. Power outages were widespread in southeast Louisiana, affecting coastal parishes and neighboring areas.Laura Leftwich , sheltering at her mother’s home, saw birdhouses swept away by the wind and shared video footage of street flooding with friends. “It’s a little scary,” she said.Resident Luis Morfin sought shelter at a friend’s home, leaving his camper outside the levee. “We knew what we were expecting,” he said.Francine is the third hurricane to hit the continental US this year. Earlier in the season, Hurricane Beryl made landfall in Matagorda, Texas, on July 8 as a Category 1 storm. Hurricane Debby followed on August 5, also as a Category 1 storm, hitting near Steinhatchee, Florida.A Tornado Watch was issued for much of Louisiana and southern Mississippi through Wednesday evening as storm bands moved in from the Gulf of Mexico.","Hurricane Francine hit Louisiana on Wednesday evening as a Category 2 storm. The storm cut power to roughly 190,000 customers and caused severe flooding along the Gulf Coast. President Joe Biden granted an emergency declaration for Louisiana, and states of emergency were declared by the governors of Louisiana and Mississippi.","https://static.toiimg.com/thumb/msid-113275910,imgsize-759678,width-400,resizemode-4/113275910.jpg"
Kamala makes expressions her weapon while Trump yells into mic,https://timesofindia.indiatimes.com/world/us/kamala-makes-expressions-her-weapon-while-trump-yells-into-mic/articleshow/113275268.cms,"She turned to him with an arched brow. A quiet sigh. A hand on her chin. A laugh. A pitiful glance. A dismissive shake of her head. From the opening moments of her first debate against Donald Trump Kamala Harris craftily exploited her opponent's biggest weakness. Not his record. Not his divisive policies. Not his history of inflammatory statements. Instead, she took aim at a far more primal part of him: his ego.At his rallies, on his sycophantic social media network and surrounded by flatterers at Mar-a-Lago, Trump is unquestioned, unchallenged and never ever mocked.That changed over the course of 90 minutes in Philadelphia on Tuesday, when the woman who had never before met him succeeded, bit by bit, in puncturing his comfortable cocoon and triggering his annoyance and anger. Harris questioned the size and loyalty of the crowds at his rallies. And she claimed his fortune was built by his father, recasting a business mogul who proudly boasts of being a self-made man as just another nepotism baby.Harris warned that world leaders were ""laughing at Donald Trump"" and saw him as a ""disgrace"". And when she referred to his 2020 election loss as the moment he was ""fired by 81 million people"", he grew visibly angry. Then she stood by and watched, as Trump did himself a whole lot of damage. Trump expressed his feelings by yelling into the microphone.In answer after answer, the former prez reminded Americans of his role in so much of what many would rather forget: the deadly and devastating pandemic, his refusal to accept the results of the 2020 election, a bloody siege on the US Capitol and the fall of Roe v. Wade. He lingered on his criminal charges and praised Viktor Orban, the strongman leader of Hungary. He defended a false claim that migrants in Ohio are eating their neighbours' dogs and cats and recycled years-old anti-abortion attack lines that Democrats supported ""execution after birth"".When Harris brought up his criminal convictions, Trump accused Democrats of turning the judicial system against him: ""I probably took a bullet to the head because of the things that they say about me."" ""He is so easy to trigger,"" Governor Gavin Newsom of California, a Harris ally, said in the post-debate spin room.From the moment Harris crossed the stage to shake Trump's hand, the Democratic prez nominee made clear her intention to transform a night expected to be about her into a referendum on him. She displayed a composure and tactical restraint that was palpable through the television screen. Equally palpable was his fury, which at times seemed to make him unable to even look at his opponent. ""She's a Marxist - everybody knows she's a Marxist,"" Trump said when Harris accused him of coddling China during the pandemic. ""Her father is a Marxist professor in economics, and he taught her well."" Harris looked at him with a condescending smile, performatively leaning in to hear more. He's the former reality TV star, but she clearly understood the power of the medium. Her expression was her rebuttal.As the governors, senators, activists and political gadflies spun his performance in the post-debate spin room, a surprise guest suddenly appeared and was swarmed by more than 100 journalists. It was Trump. Prez candidates rarely - if ever - spin their own performances in the minutes after exiting the stage. But Trump couldn't let it go. ""It was,"" he said, ""my best debate ever."" NYT","From the opening moments of her first debate against Donald Trump Kamala Harris craftily exploited her opponent's biggest weakness. At his rallies, on his sycophantic social media network and surrounded by flatterers at Mar-a-Lago, Trump is unquestioned and unchallenged.","https://static.toiimg.com/thumb/msid-113275423,imgsize-44498,width-400,resizemode-4/113275423.jpg"
Biden seeks 'full accountability' after death of US national in West Bank,https://timesofindia.indiatimes.com/world/us/biden-seeks-full-accountability-after-death-of-us-natl-in-w-bank/articleshow/113275289.cms,"WASHINGTON : Prez Joe Biden said on Wednesday Israel must do more to ensure that incidents like the fatal shooting of an American protester against settlement expansion never happen again, calling her death ""totally unacceptable"".In a statement, Biden said that while Israel has taken responsibility for her death, the US govt expects continued access as the investigation continues over the circumstances of the shooting.""There must be full accountability. And Israel must do more to ensure that incidents like this never happen again,"" Biden said.Aysenur Ezgi Eygi , 26, who is also a Turkish national, was shot dead last Friday at a protest march in Beita , a village near Nablus where Palestinians have been repeatedly attacked by far-right Jewish settlers. Israel has said her death was accidental. reuters","Aysenur Ezgi Eygi, 26, was shot dead last Friday at a protest march in Beita, a village near Nablus. Biden said that while Israel has taken responsibility for her death, the US govt expects continued access as the investigation continues.","https://static.toiimg.com/thumb/msid-113275344,imgsize-33802,width-400,resizemode-4/113275344.jpg"
US aircraft carrier in the Middle East is heading home,https://timesofindia.indiatimes.com/world/us/us-aircraft-carrier-in-the-middle-east-is-heading-home/articleshow/113274985.cms,"WASHINGTON: The Pentagon's rare move to keep two Navy aircraft carriers in the Middle East over the past several weeks has now finished, as the USS Theodore Roosevelt is heading home, according to US officials.US defense secretary Lloyd Austin had ordered the Roosevelt to extend its deployment for a short time and remain in the region as the USS Abraham Lincoln was pushed to get to the area more quickly.The Biden administration beefed up the US military presence there to help defend Israel from possible attacks by Iran and its proxies and to safeguard US troops.US commanders in the Middle East have long argued that the presence of a US aircraft carrier and the warships accompanying it has been an effective deterrent in the region, particularly for Iran. Since the Israel-Hamas war in the Gaza Strip began last fall, there has been a persistent carrier presence in and around the region - and for short periods they have overlapped to have two of the carriers there at the same time.Prior to last fall, however, it had been years since the US had committed that much warship power to the region.The decision to bring the Roosevelt home comes as the war in Gaza has dragged on for 11 months, with tens of thousands of people dead, and international efforts to mediate a cease-fire between Israel and the Hamas militant group have repeatedly stalled as they accuse each other of making additional and unacceptable demands.For a number of months earlier this year the USS Dwight D. Eisenhower remained in the Red Sea, able both to respond to help Israel and to defend commercial and military ships from attacks by the Iranian-backed Houthis in Yemen. The carrier, based in Norfolk, Virginia, returned home after an over eight-month deployment in combat that the Navy said was the most intense since World War II.US officials, who spoke on condition of anonymity to discuss troop movements, said the San Diego-based Roosevelt and the USS Daniel Inouye, a destroyer, are expected to be in the Indo-Pacific Command's region on Thursday. The other destroyer in the strike group, the USS Russell, had already left the Middle East and has been operating in the South China Sea.The Lincoln, which is now in the Gulf of Oman with several other warships, arrived in the Middle East about three weeks ago, allowing it to overlap with the Roosevelt until now.There also are a number of US ships in the eastern Mediterranean Sea, and two destroyers and the guided missile submarine USS Georgia are in the Red Sea.","US commanders in the Middle East have long argued that the presence of a US aircraft carrier and the warships accompanying it has been an effective deterrent in the region. Since the Israel-Hamas war in the Gaza Strip began last fall, there has been a persistent carrier presence in and around the region - and for short periods they have overlapped.","https://static.toiimg.com/thumb/msid-113275024,imgsize-487754,width-400,resizemode-4/113275024.jpg"
