Article Title,Article Link,Article Text,Article Summary,Article Image
Amar Kishore Kashyap: BJP's Gonda unit chief engages in 'inappropriate' act with woman; clarification sought,https://timesofindia.indiatimes.com/city/lucknow/bjps-gonda-unit-chief-engages-in-inappropriate-act-party-issues-notice-to-amar-kishore-kashyap/articleshow/121401778.cms,"



GONDA: A footage has surfaced on social media platforms showing BJP's Gonda district president Amar Kishore Kashyap engaging in ""inappropriate"" conduct with a woman, leading the party's state officials to demand a written clarification within a week.The recording, reportedly captured by CCTV cameras at the BJP district office on April 12, shows Kashyap allegedly making ""inappropriate advances"" towards the woman on the staircase.The female individual visible in the video recording is reportedly a BJP party member. A fellow party associate labelled the footage as ""shameful"" and submitted an official grievance to the BJP leadership.In response to the situation, Kashyap rejected allegations of misconduct and stated that his political rivals were distorting the video's content.""The woman in the video is a party worker. She was feeling unwell on that day and had requested a place to rest. I took her to the office. While climbing the stairs, she felt dizzy, and I held her to support her. The footage is being misused to malign me,"" he said.However, BJP state general secretary Govind Narayan Shukla has served a show-cause notice to Kashyap.""The video circulated on social media has brought to light conduct that negatively impacts the party's reputation and falls under the category of indiscipline,"" the notice stated.""In accordance with the instructions of the state president, you are hereby asked to submit a written explanation to the BJP state office within seven days. Failure to provide a satisfactory response in the stipulated time will invite strict disciplinary action,"" it added.","Footage shows BJP's Gonda district president Amar Kishore Kashyap engaging in ""inappropriate"" conduct with a woman. The recording, reportedly captured by CCTV cameras at the BJP district office on April 12, shows him allegedly making 'inappropriate advances' towards the woman. A fellow party associate labelled the footage as ""shameful"" and submitted an official grievance to the BJP leadership.","https://static.toiimg.com/thumb/msid-121401905,imgsize-23180,width-400,height-225,resizemode-72/121401905.jpg"
Bengaluru School Covid Guidelines: Private schools association issues fresh SOP on health precautions,https://timesofindia.indiatimes.com/city/bengaluru/covid-concern-bengaluru-private-schools-association-issues-fresh-sop-on-health-precautions/articleshow/121398272.cms,"Representative image





BENGALURU: As schools prepare to reopen, Karnataka Associated Managements of Schools (KAMS) has issued a fresh advisory urging all private educational institutions to stay vigilant in light of alerts over emerging Covid-19 variants and other viral infections. An updated SOP by the association of private schools followed a death due to Covid-19 in the city Saturday.The circular emphasises that while there is no reason to panic, schools must act with responsibility and reinforce hygiene and safety protocols. The advisory outlines a series of updated measures to be implemented before and during school reopening to ensure the safety of students, staff and their families. A key directive is the enforcement of a health-based attendance policy. Students showing symptoms of fever, cough, cold, rashes or allergies should not be sent to school, and parents are advised to seek medical attention immediately. ""The health of all children is a priority over attendance records,"" the advisory stated.Schools are also instructed to conduct thorough sanitisation and promote awareness on hygiene. Teachers and staff are urged to educate children about hand washing, respiratory etiquette, and the importance of clean, ventilated classrooms.In case a child falls sick during school hours, schools must isolate the student in a supervised space and inform the parents without delay. The advisory further reminds stakeholders to avoid spreading panic or unverified news about Covid-19, urging reliance on official updates from health authorities.KAMS general secretary Shashi Kumar D told TOI, ""We haven't got any guidelines from the govt so far. These are guidelines we from the association have shared with all our schools as a social responsibility to take precautionary measures. Considering the rain and how kids can be vulnerable to infections, we don't want schools and parents to panic.""""As of now, these are very general measures and other measures like social distancing and masks are not really needed…in such cases, schools will be informed later on the same,"" he said in a video.","An updated SOP by the association of private schools followed a death due to Covid-19 in the city Saturday. The circular emphasises that while there is no reason to panic, schools must act with responsibility. A key directive is the enforcement of a health-based attendance policy.","https://static.toiimg.com/thumb/msid-121401779,imgsize-1523365,width-400,height-225,resizemode-72/121401779.jpg"
"Patna University struggles to fill UG seats, applications plunge to 8,000",https://timesofindia.indiatimes.com/city/patna/pu-struggles-to-fill-ug-seats-applications-plunge-to-8000/articleshow/121393414.cms,"



Patna: If the number of applications received for admission to the undergraduate courses is any indication, the Patna University (PU) colleges have very little charm for the boys and girls passing class XII examination from different boards.The premier colleges of the state, attached to the seventh oldest university of this subcontinent, no longer attract the scholars for higher studies. Figures available with the official sources reveal that the university, which used to attract a large number of admission seekers from across the state and also from some neighbouring states until a decade ago, are finding it difficult to fill up even their sanctioned seats.PU sources told this newspaper that in 2019, the university received as many as 48,000 applications for admission to its UG courses. The numbers declined to 30,000 in 2020. In the following years—2021 and 2022—the numbers further declined to a little more than 21,000. But, the number of applications received for UG admissions further slumped to only about 10,000 in 2023 and 12,000 in 2024.Welfare dean of students, Anil Kumar, said that a centralised entrance test for admission to all the undergraduate courses in PU colleges was introduced in 2012 at the instance of then vice-chancellor Shambhu Nath Singh.But this practice was dropped after the implementation of National Education Policy, 2020 in the university and it started admitting students on marks secured in class XII examination, he said.In the current session (2025-26), PU received only about 8,000 applications till the last date of the receipt of online applications (May 23) for admission to the four-year degree programme in arts, science and commerce streams under conventional courses and three-year degree programme in vocational courses. The university had invited online applications for admission to both the conventional and vocational academic programmes running in Patna College, Patna Science College, B N College, Vanijya Mahavidyalay, and Magadh Mahila College.Considering the poor response of boys and girls for admission in PU colleges and also due to somewhat delayed publication of CBSE class XII results, the university authorities have extended the last date of online submission of applications till May 31. But, it is unlikely to make much difference to the students' growing indifference to the higher education institutions under PU, said a retired teacher.Last year, more than 1,000 out of the total of 4,500 sanctioned seats in UG classes remained vacant as students were least interested in studying in these institutions. Recurring violence leading to the death of students on the campus have only been serving as a deterrent for the admission seekers. ""How can I send my ward to study in PU where students are being murdered in daylight and the hostels are allowed to be occupied by anti-social elements,"" quipped a guardian.Patna: If the number of applications received for admission to the undergraduate courses is any indication, the Patna University (PU) colleges have very little charm for the boys and girls passing class XII examination from different boards.The premier colleges of the state, attached to the seventh oldest university of this subcontinent, no longer attract the scholars for higher studies. Figures available with the official sources reveal that the university, which used to attract a large number of admission seekers from across the state and also from some neighbouring states until a decade ago, are finding it difficult to fill up even their sanctioned seats.PU sources told this newspaper that in 2019, the university received as many as 48,000 applications for admission to its UG courses. The numbers declined to 30,000 in 2020. In the following years—2021 and 2022—the numbers further declined to a little more than 21,000. But, the number of applications received for UG admissions further slumped to only about 10,000 in 2023 and 12,000 in 2024.Welfare dean of students, Anil Kumar, said that a centralised entrance test for admission to all the undergraduate courses in PU colleges was introduced in 2012 at the instance of then vice-chancellor Shambhu Nath Singh. But this practice was dropped after the implementation of National Education Policy, 2020 in the university and it started admitting students on marks secured in class XII examination, he said.In the current session (2025-26), PU received only about 8,000 applications till the last date of the receipt of online applications (May 23) for admission to the four-year degree programme in arts, science and commerce streams under conventional courses and three-year degree programme in vocational courses. The university had invited online applications for admission to both the conventional and vocational academic programmes running in Patna College, Patna Science College, B N College, Vanijya Mahavidyalay, and Magadh Mahila College.Considering the poor response of boys and girls for admission in PU colleges and also due to somewhat delayed publication of CBSE class XII results, the university authorities have extended the last date of online submission of applications till May 31. But, it is unlikely to make much difference to the students' growing indifference to the higher education institutions under PU, said a retired teacher.Last year, more than 1,000 out of the total of 4,500 sanctioned seats in UG classes remained vacant as students were least interested in studying in these institutions. Recurring violence leading to the death of students on the campus have only been serving as a deterrent for the admission seekers. ""How can I send my ward to study in PU where students are being murdered in daylight and the hostels are allowed to be occupied by anti-social elements,"" quipped a guardian.","The premier colleges of the state, attached to the seventh oldest university of this subcontinent, no longer attract the scholars for higher studies. Figures available with the official sources reveal that the university, which used to attract a large number of admission seekers from across the state and also from some neighbouring states until a decade ago, are finding it difficult to fill up even their sanctioned seats.","https://static.toiimg.com/thumb/msid-121393442,imgsize-50508,width-400,height-225,resizemode-72/121393442.jpg"
"Nirbhaya like horror returns: Tribal woman gang-raped & brutalised in Madhya Pradesh, dies",https://timesofindia.indiatimes.com/city/indore/nirbhaya-like-horror-returns-tribal-woman-gang-raped-brutalised-in-madhya-pradesh-dies/articleshow/121403335.cms,"File photo used for representational purpose.

Gang-raped tribal woman's body sent to hosp in tractor

(The victim's identity has not been revealed to protect her privacy as per Supreme Court directives on cases related to sexual assault)





INDORE: In a rerun of the Nirbhaya horror, a tribal woman was gangraped and tortured so brutally that she died on Saturday afternoon. Savaged with a wooden object or a rod, her intestines were protruding when she was found bleeding, unconscious, and taking her last breaths in a village in Khandwa on Saturday afternoon.Two men, who were the last to be seen with her, have been arrested, said DIG Siddharth Bahuguna, adding: ""The accused had tortured the woman and damaged her private parts.""The blood-curdling crime took place in a village in Khalwa region, around 50km from the district headquarters and 170km from Indore.The woman, a 45-year-old mother of two, had set out to attend a wedding in the village on Friday night.""After the wedding celebration, she set out on Friday night to drop off a female relative along with one of the accused, Hari, at a nearby field, just half a kilometre from her home. When she didn't return that night, her family assumed she had stayed back with them. The woman went to Hari's home where they consumed alcohol along with co-accused Sunil,"" said ASP Raghuwanshi.According to police, Hari's mother claimed that they were sleeping inside their home on Friday night. On Saturday morning, when she woke up, she heard someone whimpering and stepped out to see who it was. To her horror, she saw the woman in agony, bleeding and barely able to hold herself up.She said she was feeling dizzy and asked in a faint whisper if she could lie down. The next moment, she collapsed in the courtyard, unconscious. The neighbour called the woman's family members.""They took her to their home but did not take her to hospital although she was bleeding excessively. She died around 1:30-2pm after which the family members dialled 100 and informed police. The body was taken to a hospital for post-mortem examination,"" said ASP Raghuwanshi.Preliminary medical examination revealed she had been brutalised with a sharp or hard object and suffered terrible internal injuries.Additional SP Rajesh Raghuwanshi said, ""A short post-mortem report has confirmed grievous internal trauma to the private parts. Based on this, a case of gang rape and murder has been registered against Hari Palvi, 40, and Sunil Korku, 30, residents of the same village who work as labourers.""One of the doctors on the post-mortem panel told TOI on condition of anonymity, ""The woman had suffered vaginal tear in a way that her intestinal contents had come out. She had suffered heavy blood loss due to intestinal bleeding. Her uterus and bladder were intact but the pouch containing the uterus was ripped. It is suspected that a hard object like a rod or a stick was used. Marks of dragging and scratches were also found on the body. ""Family members told police that the woman briefly regained consciousness and told them, ""Something terrible has happened to me, I will not survive. Sunil and Hari did this.""Her son said they were initially unaware of the extent of her injuries. It was only when his wife checked on her that they realized she was bleeding profusely from her private parts. After some time, she gasped and died.Her body was transported to hospital on a tractor.According to the family, the woman was carrying Rs 20,000 - savings handed to her by her younger son and daughter who had recently returned from Goa, where they work with a road construction company. The family suspects that along with the brutal assault, she may have been robbed as well.","Tribal woman, 45, was gangraped and tortured so brutally that she died on Saturday afternoon. Her intestines were protruding when she was found bleeding, unconscious, and taking her last breaths. The blood-curdling crime took place in a village in Khalwa region, around 50km from the district headquarters and 170km from Indore.","https://static.toiimg.com/thumb/msid-121404418,imgsize-35946,width-400,height-225,resizemode-72/121404418.jpg"
"Morning news wrap: Russia claims Putin's chopper was 'at epicentre' of Ukraine drone attack, severe waterlogging in Mumbai, and more",https://timesofindia.indiatimes.com/india/morning-news-wrap-russia-claims-putins-chopper-was-at-epicentre-of-ukraine-drone-attack-severe-waterlogging-in-mumbai-and-more/articleshow/121403610.cms,"Vladimir Putin; Mumbai rain

Russian commander says Putin's chopper was 'at epicenter' of Ukrainian drone attack

Waterlogging reported in parts of Mumbai

Chhattisgarh cops not keen to give Maoist leader

Basavaraju's body to family

Trump loses cool over Russia’s massive drone attack in Ukraine

IPL 2025: SRH head coach breaks silence on Mohammed Shami's struggles

From Vladimir Putin's helicopter being at the epicentre of a massive drone attack by Ukraine to the waterlogging in Mumbai, the past 24 hours brought several major headlines. In Russia, a top air defence commander claimed President Vladimir Putin aircraft was flying even as Russian forces were repelling a significant drone assault by Ukraine. Mumbai, India' financial capital, woke up to severe waterlogging due to heavy overnight rainfall. Chhattisgarh Police is reportedly not keen on handing over the body of slain Maoist Nambala Keshav Rao alias Basavaraju. US President Donald Trump hinted at progress in the Iran nuclear talks. In the IPL, Sunrisers Hyderabad coach Daniel Vettori has broken silence on struggles of pacer Mohammed Shami.According to a report by Russian news agency RBC, Yury Dashkin, commander of an air defence division in the region, said that Putin’s aircraft was flying as Russian forces were repelling a significant drone assault by Ukraine. “We were simultaneously engaged in an air defence battle and ensuring airspace security for the president’s helicopter flight,” Dashkin told RBC. “The helicopter was effectively at the epicentre of the response to the massive drone attack. ” Read full story Heavy rainfall in Mumbai on Sunday night caused waterlogging in several areas, prompting the India Meteorological Department (IMD) to issue orange to red alerts for Mumbai and its suburban regions, while also affecting other parts of Maharashtra and Odisha with significant rainfall activity.The IMD posted on social media platform X that Mumbai and suburban areas would continue to experience light to moderate rainfall for the next 3-4 hours. Read full story Chhattisgarh Police is purportedly not keen on handing over the body of slain CPI (Maoist) general secretary Nambala Keshav Rao alias Basavaraju - killed in an encounter last week at Narayanpur in the state - to his ""family"" amid fears that a public funeral, left to his kin, may unnecessarily end up glorifying the top Maoist mastermind behind the brutal killing of hundreds of security personnel and innocent tribals. Read full story US President Donald Trump has called his Russian counterpart Vladimir Putin ""crazy,"" after Russia carried out a massive drone attack in Ukraine, its biggest there since the war with Kyiv began in February 2022. ""I've always had a very good relationship with Vladimir Putin of Russia, but something has happened to him! He has gone absolutely CRAZY! He's needlessly killing a lot of people, and I'm not just talking about soldiers,"" Trump posted on his Truth Social platform. Read full story Sunrisers Hyderabad (SRH) head coach Daniel Vettori has defended Mohammed Shami's poor performance in the Indian Premier League (IPL) 2025. Vettori said lack of T20 cricket (IPL games) has affected Shami in this year's IPL. The 34-year-old, who has not been picked for the upcoming Test series against England, has played nine games, picked up six wickets but leaked runs at 11.23. Shami, who was picked for Rs 10 crore in the mega auction, was dropped by the SRH management in the second leg of the tournament. Read full story",Russian commander says Putin's chopper was 'at epicenter' of Ukrainian drone attack. Mumbai woke up to severe waterlogging due to heavy overnight rainfall. Chhattisgarh Police not keen on handing over the body of slain Maoist Nambala Keshav Rao alias Basavaraju. US President Donald Trump hinted at progress in the Iran nuclear talks.,"https://static.toiimg.com/thumb/msid-121403749,imgsize-588412,width-400,resizemode-4/121403749.jpg"
'Golf can be dangerous!': Donald Trump shares bizarre image of 'attack' at Bedminster,https://timesofindia.indiatimes.com/world/us/golf-can-be-dangerous-donald-trump-shares-bizarre-image-of-attack-at-bedminster/articleshow/121403437.cms,"Donald Trump shares bizarre image of 'attack' at Bedminster





US President Donald Trump sparked laughter and online buzz Sunday after posting a photo to his Truth Social account showing a large goose attacking a friend on his Bedminster golf course.The image, clicked during an outing at the Trump National Golf Club in Bedminster, New Jersey, shows an oversized goose attacking the unnamed individual, presumably a friend or staffer. Trump’s caption read, “I always said golf can be a dangerous sport! My friend being bit at Bedminster.”The post quickly gained traction online, amassing nearly 30,000 likes and more than 3,000 comments within hours.In a previous post, he defended his move to block foreign students at Harvard University writing, ""Why isn’t Harvard saying that almost 31% of their students are from foreign lands, and yet those countries, some not at all friendly to the United States, pay nothing toward their student’s education, nor do they ever intend to.""""Nobody told us that! We want to know who those foreign students are, a reasonable request since we give Harvard billions of dollars, but Harvard isn’t exactly forthcoming. We want those names and countries. Harvard has $52,000,000, use it, and stop asking for the Federal Government to continue granting money to you!,"" he added.","The image was clicked during an outing at the Trump National Golf Club in Bedminster, New Jersey. Trump’s caption read, “I always said golf can be a dangerous sport! My friend being bit at Bedminster.”","https://static.toiimg.com/thumb/msid-121403569,imgsize-588633,width-400,resizemode-4/121403569.jpg"
