Article Title,Article Link,Article Text,Article Summary,Article Image
"Woman throws slipper at doctor on duty, hospital staff shut down OPD services in protest",https://timesofindia.indiatimes.com/india/woman-throws-slipper-at-doctor-on-duty-hospital-staff-shut-down-opd-services-in-protest/articleshow/113235711.cms,"Doctors and staff at the Araluguppe Mallegowda District Hospital in Karnataka staged a protest by closing the outpatient department after a woman relative of a patient allegedly threw a footwear at the physician on Tuesday.According to officials, when Dr Venkatesh B S was treating an injured patient Irfan in the emergency unit , a group of the patient's relatives gathered and created a disturbance.When the doctor asked everyone except the patient to leave, an argument ensued. Taslim, one of the patient's relatives, allegedly removed her footwear, threw it at the doctor, and then grabbed him by the collar.In response to the incident, other doctors and staff at the hospital protested by shutting down the outpatient department. They assembled outside the district surgeon's office, demanding the immediate arrest of those involved in the assault.BJP MLC CT Ravi shared a video of the alleged incident on 'X' and called for the immediate arrest of those responsible for the ""despicable act."" He urged home minister G Parameshwara and DGP Alok Mohan to take action to protect the medical staff and create an environment where they can work with confidence in law and order.The District Surgeon formally reported the incident to the police, citing abuse, assault, and threats against the doctor’s life. He called for legal action against the assailants and requested increased security for hospital staff to ensure their safety while on duty. Additionally, he asked for security to be provided to doctors and staff at the hospital to ensure they can perform their duties safely.Chikkamagaluru SP, Vikram Amathe, confirmed to news agency PTI that an FIR has been registered and the woman has been arrested. He said, ""We have convinced the Doctors who were protesting about (demanding) registering a case and making the arrest, and they have subsequently withdrawn the protest.""",Doctors and staff at the Araluguppe Mallegowda District Hospital in Karnataka staged a protest by closing the outpatient department. A woman relative of a patient allegedly threw a footwear at the physician on Tuesday. Dr Venkatesh B S was treating an injured patient Irfan in the emergency unit when a group of the patient's relatives gathered.,"https://static.toiimg.com/thumb/msid-113235839,imgsize-1547169,width-400,resizemode-4/113235839.jpg"
IAF officer files rape complaint with cops against Wing Commander,https://timesofindia.indiatimes.com/india/iaf-officer-files-rape-complaint-with-cops-against-wing-commander/articleshow/113239077.cms,"NEW DELHI: An IAF officer has filed a police complaint against a senior, accusing him of rape, outraging her modesty and continuous mental harassment at the Srinagar Air Force station in J&K, while also claiming that the "" internal committee "" of the force dismissed her allegations without proper consideration.The woman, a Flying Officer , has alleged that the accused, a Wing Commander, called her to his room after a new year party at the officers' mess on Dec 31 last year on the pretext of her not having received the gift being distributed at the function.On entering the room, when she asked where the Wing Commander's wife and children were, he replied they were elsewhere. She alleged he then forced her into oral sex and molested her. ""I repeatedly asked him to stop and tried to resist it. Finally, I pushed him and ran away,"" she said, in the FIR lodged at the Budgam police station on Sept 8.IAF, on being contacted by TOI, said: ""We are aware the woman officer has lodged an FIR. Budgam Police have approached the air force station (Srinagar) authorities. IAF is fully cooperating in the investigation.""""I was afraid and didn't know what to do as there were instances before also wherein, I was discouraged to report. He (the accused) visited my office after this incident... He behaved as if nothing happened ,"" she said. ""I can't describe the mental agony of being an unmarried girl who had joined the forces and was treated in such a heinous manner,"" she said, adding she initially lacked the courage to report the incident.When she told two women officers about the incident, they told her to complain to the higher authorities in the station, following which an inquiry was ordered. But when she objected to the accused's presence during the recording of her statement on Jan 29-30, the investigation was ""closed to hide the mistakes of the administration"".The woman officer then filed a fresh application to the internal committee (IC) of the unit. The IC was assembled only after two months. ""The bias of the station authorities to aid the sexual offender was very heart breaking,"" she said, alleging that a medical examination was not done till she insisted multiple times.The IC said the evidence was ""inconclusive"" because there was no eyewitness and closed the probe on May 15. ""Isn't it common sense that someone would not do sexual assault in front of a witness?"" she said.""I am forced to socialise with these people and attend events with my abuser,"" she added.","An IAF officer has filed a police complaint against a senior, accusing him of rape, outraging her modesty and continuous mental harassment at the Srinagar Air Force station in J&K. The woman, a Flying Officer, has alleged that the accused, a Wing Commander, called her to his room after a new year party at the officers' mess on Dec 31 last year.","https://static.toiimg.com/thumb/msid-113239211,imgsize-1355553,width-400,resizemode-4/113239211.jpg"
"'Who are his real children?': Man claims to be 'secret son' of King Charles, demands 4-way paternity test",https://timesofindia.indiatimes.com/world/uk/who-are-his-real-children-man-claims-to-be-secret-son-of-king-charles-demands-4-way-paternity-test/articleshow/113200567.cms,"Simon Charles Dorante-Day , a man claiming to be the illegitimate child of King Charles and Queen Camilla has taken to Facebook, renewing his claim that he is the illegitimate son of King Charles III and Queen Camilla. In a recent post, he calls for a four-way paternity test to resolve what he describes as years of deception and corruption by the British monarchy.Dorante-Day's post highlights a photo comparison of himself, King Charles, and the King’s sons, Prince William and Prince Harry, as evidence supporting his demand for answers.“The left side of my face identically matches Charles, whilst neither William nor Harry’s does,” Dorante-Day wrote in his post, raising the question, “Just who are Charles’s real sons?” His demand for a paternity test stems from this comparison, which he claims shows an inconsistency in the physical features between him and the royal heirs.Dorante-Day and his wife, Dr Elvianna, are pushing for a paternity test involving King Charles, William, and Harry to finally reveal the truth. He claims that for 58 years, the monarchy, the government, and the establishment have hidden the truth, which he now seeks to expose. “The lies and corruption must be uncovered for what they are—criminal activity,” he wrote."" Awarding yourself and accepting a 50% pay rise doesn’t demonstrate much remorse for what has occurred. Nor does it demonstrate any intention to resolve this issue or change direction any time soon,"" his post said.In his Facebook bio, Dorante-Day describes himself as someone investigating his ""natural birth parents,"" who he claims are King Charles and Queen Camilla. He continues to assert that he deserves answers, asking, “How will you truly react when you hear the truth of what has occurred? Would you still want them on the throne?”He further alleged that these actions are part of a broader effort to suppress the truth, not only regarding his identity but also in relation to his family. “It’s not just what happened to me as a child, and what I remember from growing up in England,” he said, “but it’s also what’s happened since to myself, my wife, and my children in Australia that supports our argument.”Dorante-Day was born in Portsmouth in 1966 and adopted at eight months old. According to his claims, his adoptive mother, who worked for Queen Elizabeth II, confessed on her deathbed that he was the son of Charles and Camilla. At the time of his birth, Charles was 17 and Camilla 18, Daily Star reported.","Simon Charles Dorante-Day claims he is the illegitimate son of King Charles III and Queen Camilla. He calls for a four-way paternity test to resolve what he describes as years of deception and corruption by the British monarchy. He claims that for 58 years, the monarchy, the government, and the establishment have hidden the truth, which he now seeks to expose.","https://static.toiimg.com/thumb/msid-113200574,imgsize-908111,width-400,resizemode-4/113200574.jpg"
Haitian Immigrants: Haitian immigrants eating pet cats and ducks of residents in Ohio? Here's what happened,https://timesofindia.indiatimes.com/world/us/haitian-immigrants-eating-pet-cats-and-ducks-of-residents-in-ohio-heres-what-happened/articleshow/113200789.cms,"But what has actually happened?

No reports of any stealing of pets, clarifies police

Social media was up in arms Tuesday claiming that illegal Haitian immigrants in Ohio are eating pets of other residents including cats and ducks. Ohio senator JD Vance reacted to the reports and said he raised the issue of Haitian illegal immigrants earlier. ""Reports now show that people have had their pets abducted and eaten by people who shouldn't be in this country.Where is our border czar?"" Vance posted on X.Elon Musk also contributed to the debate as he wrote in a reply to an X post: ""Apparently, people's pet cats are being eaten.""Social media posts, made by right-wingers, claimed that residents of Springfield Ohio are saying that Haitians are eating the pets of other residents. One such incident did actually take place last month as reported by Fox News. An Ohio woman was arrested after she killed a cat and then began eating it in front of the neighbors. Allexis Telia Ferrell, 27, is charged with injuring animals, prohibitions concerning companion animals and disorderly conduct, the report said.The woman reportedly stomped in the cat's head to kill it before she ate it in front of a residential area in Ohio.But there was no evidence to prove whether she is a Haitian woman.The video of the incident went viral over the weekend and Kamala Harris was held responsible for immigrants eating cats in residential areas -- ahead of the big Kamala Harris - Donald Trump debate on September 10.Another photo of a 'Haitian man walking around with an entire goose' added to the online hatred.Republicans shared the video of Kamala Harris stating how her administration extended temporary protected status to over 100,000 Haitian migrants.""Less than three months ago, Kamala Harris and her Administration blocked 300k unvetted Haitian Migrants from being deported out of our country. Today, those unvetted migrants are sucking up precious resources and destroying Springfield, Ohio. Kamala Harris did this,"" Donald Trump Jr posted.The Springfield Police Division said Monday morning they have received no reports related to pets being stolen and eaten. Springfield Police said they were aware of the social media post but this was ""not something that’s on our radar right now"". The claims appeared to have originated from a commenter at a local city meeting, who said migrants were grabbing ducks from the park to kill and eat, and from local crime-watch Facebook groups. They were then shared on other social media platforms with Republicans amplifying them.""It’s all coming to your city if Kamala Harris is elected in November. It doesn’t have to be this way. Beginning on day one, President Trump will begin the largest mass deportation operation in US history – because he’ll always put America, and Americans, FIRST,"" the Trump campaign sent out an email targeting Harris campaign over the Haitian immigrants issue.","Social media posts, made by right-wingers, claimed that residents of Springfield Ohio are saying that Haitians are eating the pets of other residents. One such incident did actually take place last month as reported by Fox News. An Ohio woman was arrested after she killed a cat and then began eating it in front of the neighbors.","https://static.toiimg.com/thumb/msid-113200789,imgsize-987237,width-400,resizemode-4/113200789.jpg"
"Harris Vs Trump Debate: Kamala Harris' facial expressions take center stage in debate drama with Trump, netizens react to 'eye rolls and exaggerated smiles'",https://timesofindia.indiatimes.com/world/us/kamala-harris-facial-expressions-take-center-stage-in-debate-drama-with-trump-netizens-react-to-eye-rolls-and-exaggerated-smiles/articleshow/113245630.cms,"Trump-Harris Full ABC Debate: Fiery Attacks & Personal Jibes | Putin | Israel-Hamas War

Vice President Kamala Harris found herself under a social media microscope following her appearance in Tuesday’s ABC News Presidential Debate against former President Trump . The spotlight shifted from policy to performance as Harris' animated facial expressions were broadcasted on split screens, capturing the attention—and criticism—of viewers and commentators alike.Throughout Trump's responses, Harris was caught on camera rolling her eyes, furrowing her brow, and showcasing exaggerated smiles.With both candidates’ microphones muted during the other's speaking time—a rule Harris' campaign had unsuccessfully challenged—her only outlet for reaction was through these vivid facial gestures.Social media erupted with mixed reactions. Critics slammed her expressions as rehearsed and lacking authenticity. “Kamala Harris is doing obviously rehearsed routines instead of answering questions. Then she does rehearsed and exaggerated facial expressions when Trump talks. She comes across as fake and weak,” tweeted New York Post columnist Miranda Devine .Pollster Frank Luntz commented, “On content, Harris is winning. Visually, she's hurting herself. #Debate2024,” while conservative writer Carmine Sabia noted, “Kamala Harris has been way over coached on doing facial expressions because of the muted mics. It is uncomfortable and weird.”Others, like Fox News correspondent Aisha Hasnie, questioned the impact of her expressions: “So far... HARRIS is making faces way more than TRUMP on this split screen. DK how that's going to resonate with voters.”Critics even drew comparisons to past debates. “Harris displayed many of the same expressions that went viral during the 2020 vice presidential debate where she faced off against Mike Pence ,” noted journalist Ian Miles Cheong.","Kamala Harris' animated facial expressions captured the attention of viewers and commentators alike. Critics slammed her expressions as rehearsed and lacking authenticity. Pollster Frank Luntz commented, “On content, Harris is winning. Visually, she's hurting herself.”","https://static.toiimg.com/thumb/msid-113246298,imgsize-1041413,width-400,resizemode-4/113246298.jpg"
Elon Musk Responds to Taylor Swift's 2024 Endorsement of Kamala Harris,https://timesofindia.indiatimes.com/world/us/elon-musk-concedes-in-viral-banter-fine-taylor-you-win-after-swift-endorses-kamala-harris-in-us-presidential-elections/articleshow/113247233.cms,"Elon Musk recently found himself in the spotlight after Taylor Swift publicly endorsed Vice President Kamala Harris for the 2024 presidential election. Following Swift's high-profile support for Harris, Musk playfully responded on X (formerly Twitter) with the comment, ""Fine Taylor … you win … I will give you a child and guard your cats with my life.""The remark quickly went viral, drawing attention to both Swift's political stance and Musk's lighthearted acknowledgment of her cultural influence.Swift's endorsement of Harris aligns with her history of backing Democratic candidates and progressive causes. Meanwhile, Musk, who frequently engages in political discourse on X, seemed to humorously concede to Swift's powerful influence, particularly among her passionate fanbase known as ""Swifties."" Musk’s comment appeared to recognize the sway Swift holds, especially with younger generations, in shaping public opinion.Swift's endorsement came shortly after the US presidential debate, with the singer posting on Instagram, ""I will be casting my vote for Kamala Harris and Tim Walz in the 2024 Presidential Election."" She shared her reaction to the debate with her 283 million followers, stating, ""I'm voting for @kamalaharris because she fights for the rights and causes I believe need a warrior to champion them.""This endorsement follows a controversy involving AI-generated images falsely portraying Swift and her fans as Trump supporters. Swift took the opportunity to address the dangers of misinformation, especially fueled by artificial intelligence. ""It really conjured up my fears around AI, and the dangers of spreading misinformation,"" she noted, explaining her decision to publicly declare her political stance.Swift also encouraged her followers to do their own research on the candidates' positions. “I watched the debate and urge you to do your own research on the stances these candidates take on the topics that matter most to you,” she advised.In a witty parting note, Swift signed off her endorsement with ""Childless cat lady,"" a jab at a derogatory comment made by Republican vice-presidential candidate JD Vance in 2021. Vance had referred to senior Democrats as “a bunch of childless cat ladies” in an interview with Tucker Carlson, a remark Swift addressed directly in her closing statement.","Elon Musk responded to Taylor Swift's endorsement of Kamala Harris for the 2024 US presidential election. Musk playfully responded, ""Fine Taylor … you win … I will give you a child and guard your cats with my life"" The remark quickly went viral, drawing attention to both Swift's political stance and Musk's lighthearted acknowledgment of her cultural influence.","https://static.toiimg.com/thumb/msid-113247371,imgsize-993596,width-400,resizemode-4/113247371.jpg"
Police registered 10 cases against Ganapati mandals for using laser beam lights,https://timesofindia.indiatimes.com/city/pune/police-registered-10-cases-against-ganapati-mandals-for-using-laser-beam-lights/articleshow/113268039.cms,"File photo

PUNE: The Pune city police have banned the use of laser beam lights during the Ganapati festival in the city. However, many Ganapati mandals defied the orders and were found using laser beam lights in their pandals. In the last two days, the Pune city police have registered 10 cases against the mandals for using these lights.Police registered four cases against mandals in the Lonikand area, five in the Hadapsar area, and one in the Sahakarnagar area .""We have seized the laser beam machines from these mandals to prevent further use. We have also issued warnings to these mandals, asking them to refrain from using such lights,"" said Deputy Commissioner of Police (Special Branch) G. Shreedhar.In August this year, Pune police commissioner Amitesh Kumar announced a ban on the use of laser beams during the Ganapati festival in the city, following incidents of eye injuries caused by these lights in previous years.Two days ago in Kolhapur , two people, including an on-duty police constable, suffered eye injuries due to laser beams used by different Ganapati mandals during their processions. Besides the constable, the other victim was a youth waiting for the procession to pass by.Last year, a youngster from Dhayari in Pune sustained eye injuries due to laser beam lights during the Ganapati immersion procession.Kumar and other senior police officers held several rounds of meetings with the office bearers of the Ganapati mandals, asking them to refrain from using laser beam lights. Following these meetings, Kumar issued written directives on the matter.","The Pune city police have banned the use of laser beam lights during the Ganapati festival in the city. In the last two days, the police have registered 10 cases against the mandals for using these lights. Two people, including an on-duty police constable, suffered eye injuries due to laser beams in Kolhapur.","https://static.toiimg.com/thumb/msid-113268044,imgsize-315042,width-400,height-225,resizemode-72/113268044.jpg"
"Clashes break out amid Ganpati Visarjan in Karnataka, section 144 imposed",https://timesofindia.indiatimes.com/india/clashes-break-out-amid-ganpati-visarjan-in-karnataka-section-144-imposed/articleshow/113269925.cms,"This is a developing copy

NEW DELHI: Nagamangala , a town in Karnataka's Mandya district, witnessed heightened tensions late Wednesday night as clashes broke out between two groups during the Ganpati Visarjan procession.The clashes were triggered when stones were hurled at the procession, news agency PTI reported.In response to the unrest, authorities have enforced Section 144 in the affected area to maintain law and order, which prohibits the assembly of four or more people in public places.The situation is being closely monitored, further details awaited.","Nagamangala, a town in Karnataka's Mandya district, witnessed heightened tensions late Wednesday night. Clashes broke out between two groups during the Ganpati Visarjan procession. Authorities have enforced Section 144 in the affected area to maintain law and order.","https://static.toiimg.com/thumb/msid-113269960,imgsize-531755,width-400,resizemode-4/113269960.jpg"
"Mpox: Mpox kills two, six other confirmed cases in Cameroon: Government",https://timesofindia.indiatimes.com/world/rest-of-world/mpox-kills-two-six-other-confirmed-cases-in-cameroon-government/articleshow/113268958.cms,"YAOUNDE: Cases of the mpox virus have killed two people in Cameroon since April with six further and 40 other suspected cases, the health ministry said Wednesday.""Since the resurgence of this disease in April 2024, the country has recorded 46 suspected cases of mpox, six of which are confirmed, with two deaths reported,"" Health Minister Malachie Manaouda said.However, the epidemic is ""not linked to the new, more virulent strain ( Clade 1b)"", the ministry said.The World Health Organization declared an international emergency over mpox four weeks ago after a surge in cases of the Clade 1b strain in DR Congo which spread to neighbouring countries.Since then, ""Cameroonian authorities have strengthened surveillance, vaccination and awareness measures to prevent a possible local outbreak,"" the ministry said.At the end of last month mpox was recorded as present in 14 African countries.Mpox is caused by a virus transmitted to humans by infected animals but can also be passed from human to human through close physical contact. It causes fever, muscular aches and large boil-like skin lesions, and can in some cases be deadly.So far, 796 cases have been logged in Burundi, 162 in Congo-Brazzaville and 45 in the Central African Republic, according to the Africa Centres for Disease Control and Prevention ( CDC ).The Democratic Republic of Congo is considered the epicentre of the epidemic.According to the latest Congolese Public Health Institute figures, there have been nearly 22,000 cases and 716 deaths linked to the virus recorded since January.Some 3.6 million vaccines in total for African countries have been secured, according to the CDC, and first batches are being distributed.","Cases of the mpox virus have killed two people in Cameroon since April with six further and 40 other suspected cases. The epidemic is ""not linked to the new, more virulent strain ( Clade 1b),"" the ministry said. At the end of last month mpox was recorded as present in 14 African countries.","https://static.toiimg.com/thumb/msid-113268966,imgsize-1925130,width-400,resizemode-4/113268966.jpg"
