Article Title,Article Link,Article Text,Article Summary,Article Image
Israel-Iran attacks show India needs greater thrust on multi-layered air & missile defence systems,https://timesofindia.indiatimes.com/india/israel-iran-attacks-show-india-needs-stronger-air-and-missile-defence-systems/articleshow/109448246.cms,"NEW DELHI: Missile defence is technically complex and very expensive. It’s virtually like firing a bullet to stop an incoming bullet. But with the sheer operational criticality of air and missile defence systems being reinforced by the tit-for-tat attacks between Israel and Iran, India needs to majorly crank up efforts to make its airspace as impregnable as possible.India has taken some strides in the arena but much more clearly needs to be done for an effective multi-layered integrated air and missile defence shield, with an overlapping network of early-warning and tracking sensors, reliable command and control posts, land and sea-based batteries of advanced interceptor missiles.Unlike India, Israel of course has only a small territory to defend. And it did so effectively on April 13, thwarting Iran’s mass missile and kamikaze drone attack with its wide array of defence systems, from the short-range Iron Dome to long-range Arrow, as well as help from some others like the US.India’s air defence systems are geared towards protecting only some vital areas and installations. “India is simply too vast to be effectively protected from all kinds of aerial threats. But yes, apart from buying bullets, we need to invest much more in bulletproof jackets as well. Missile defence is now an overwhelming tactical necessity rather than a strategic one,” a senior officer said.For one, India needs to get cracking on operationally deploying its indigenous two-tier ballistic missile defence (BMD), which as per DRDO is designed to track and destroy nuclear and other ballistic missiles both inside (endo) and outside (exo) the earth's atmosphere at altitudes from 15-25 km to 80-100 km for “a higher kill probability”.After “successfully completing” a series of tests for Phase-1 of the land-based BMD system quite a while ago, the DRDO also conducted the maiden flight-trial of a sea-based interceptor missile in April last year.The government, however, has so far not sanctioned full-scale deployment of the BMD system at any vital location. This could be due to the exorbitant costs involved or a few technological gaps, or even strategic calculations that it may provoke Pakistan to go in for a larger nuclear arsenal and countermeasures to defeat the BMD system, as reported by TOI earlier.IAF, of course, now has three squadrons of Russian S-400 Triumf surface-to-air missile systems, which can detect, track and destroy incoming strategic bombers, jets, spy planes, drones and even some intermediate-range ballistic missiles at a range of 380-km. They are deployed in north-west and east India to cater for both China and Pakistan.Delivery of the remaining two S-400 squadrons, under the $5.43 billion contract inked in 2018, has been delayed to 2025-26 due to the ongoing Russia-Ukraine war.Parallelly, India is developing its own long-range surface-to-air missile (LR-SAM) system under the ambitious Project Kusha. With an interception range of around 350-km, this air defence system should be ready by 2028-29.Then, there is the Barak-8 medium range surface-to-air missile (MR-SAM) systems, with an over 70-km range, jointly developed with Israel. After the Navy and IAF, Army in Feb last year operationalized its first `Abhra’ MR-SAM regiment in the 33 Corps, which defends the frontier with China in Sikkim and the Siliguri Corridor.Army and IAF have also inducted the indigenous Akash air defence missile systems, with an interception range of 25-km, while a new-generation sleeker version is also now ready for user trials.The armed forces also have a variety of shorter range air defence weapons. These range from the older Russian Igla-1M (5-km), OSA-AK-M (10-km) and Pechora missiles and upgraded L-70 anti-aircraft guns (3.5-km) to the newer Israeli low-level Spyder quick-reaction anti-aircraft missiles (15-km range) and Russian man-portable Igla-S (6-km) systems. DRDO is also testing the indigenous very short-range air defence system (VSHORADS) missiles, which has a range of up to 6-km.","India needs to majorly crank up efforts to make its airspace as impregnable as possible. India’s air defence systems are geared towards protecting only some vital areas and installations. “India is simply too vast to be effectively protected from all kinds of aerial threats,” a senior officer said.","https://static.toiimg.com/thumb/msid-109459156,imgsize-580962,width-400,resizemode-4/109459156.jpg"
"111-year-old grandma defies heat, boycott calls to cast ballot",https://timesofindia.indiatimes.com/india/111-yr-old-grandma-defies-heat-boycott-calls-to-cast-ballot-/articleshow/109467363.cms,"Fulamati, 111, had the option of a home vote, but chose to trudge to the booth in Gadchiroli

MULCHERA (GADCHIROLI): As poll officials and paramilitary troopers battled blistering heat a little after Friday noon at Mulchera's Govindpur booth in Maoist-infested Gadchiroli, 111-year-old Fulamati Binod Sarkar turned up, taking everyone by surprise. Though there was an option of home voting for the elderly, Fulamati preferred to trudge 300m to the booth from home with grandson Haridas (45).Fulamati is probably one of India's seniormost citizens who voted in the first phase, defying the heat and Maoist boycott calls in this remote village, 240km off Nagpur.Born on Jan 1, 1913 - as mentioned on her Aadhaar card - Fulamati migrated from Bangladesh's Khulna and settled in Gadchiroli in the sixties. Having lost her husband six decades ago, Fulamati raised her two daughters on her own in Gadchiroli. Though Haridas doesn't recall much about her early days, he said his granny was a fighter all through life. While one daughter died young, Haridas was born to the second, who currently looks after her.This LS election has seen several citizens above 85 vote from home and Fulamati, too, thought someone would approach her. But when no official came, she decided to head to the booth herself. ""It feels wonderful to press the EVM button. I have voted in the past, too,"" an elated Fulamati said, adding she has no medical complications.According to Haridas, poll officials ensured Fulamati didn't have to queue up. ""Our family believes every vote counts and my grandma signified citizen's empowerment through voting,"" said Haridas. ""My grandmother votes in every election,"" said Haridas.He recalled her grandmother's struggle with Bangladeshi refugees, who were first moved to a camp in Chandrapur in 1968 and then to Gadchiroli two years later.","Fulamati Binod Sarkar, 111, voted in Gadchiroli, a Maoist-infested village. She had the option of home voting, but chose to trudge 300m to the booth. Born on Jan 1, 1913, Fulamati migrated from Bangladesh's Khulna in the sixties.","https://static.toiimg.com/thumb/msid-109467797,imgsize-1323540,width-400,resizemode-4/109467797.jpg"
"8 IEDs, 2 wireless sets seized from terrorist hideout in Jammu and Kashmir's Rajouri",https://timesofindia.indiatimes.com/india/8-ieds-2-wireless-sets-seized-from-terrorist-hideout-in-jammu-and-kashmirs-rajouri/articleshow/109476597.cms,"NEW DELHI: Security forces in Jammu and Kashmir 's Rajouri district discovered a terrorist hideout on Sunday, officials reported. The hideout yielded eight Improvised Explosive Devices ( IEDs ), two wireless sets , and ammunition.The recovered items were in a deteriorated state, indicating they had been there since before the area was cleared of militants over two decades ago.The operation, led by police with support from the Army, took place in Azmatabad village , Thannamandi area, about 30 kilometers from Rajouri town.The discovered IEDs included one weighing 1 kg and seven weighing half a kg each.Additionally, three AK-47 rifle magazines, 102 rounds of ammunition, one charger, and two wireless sets were seized during the search.","Security forces in Jammu and Kashmir's Rajouri district discovered a terrorist hideout on Sunday. The hideout yielded eight Improvised Explosive Devices ( IEDs ), two wireless sets, and ammunition. The recovered items were in a deteriorated state, indicating they had been there since before the area was cleared of militants over two decades ago.","https://static.toiimg.com/thumb/msid-109476702,imgsize-16316,width-400,resizemode-4/109476702.jpg"
Bondi beach candlelight memorial honors victims of shopping mall knife attack,https://timesofindia.indiatimes.com/world/rest-of-world/bondi-beach-candlelight-memorial-honors-victims-of-shopping-mall-knife-attack/articleshow/109475226.cms,"NEW DELHI: A candlelight memorial was held at Sydney 's famous Bondi Beach on Sunday to honor the six people who lost their lives in a knife attack at the nearby Westfield Bondi Junction shopping complex.The victims included five women and a male security guard. The attack left many Australians in shock, as they are not accustomed to such violent crimes.Daniela Pontidas, a 56-year-old local cafe owner, expressed her grief and told AFP, ""When I heard this I cried.Because it is new to us. We don't have this happen often. It's a shock.""Paul Inggall, 50, who had been at Bondi Junction hours before the attack also talked to AFP and said, ""these things don't happen often in Australia but when they do I think they have a profound impact.""The mentally ill knifeman, 40-year-old Joel Cauchi, was tracked down, shot, and killed by police inspector Amy Scott, who attended the memorial service. As the sun set, a choir sang ""Keep Your Loving Arms Around Me,"" and an Indigenous didgeridoo was played as people lit candles. New South Wales Premier Chris Minns emphasized the strength and resilience of the Bondi community.Prime Minister Anthony Albanese offered the nation's condolences for the six lives ""snatched away on that hardest of Saturday afternoons."" Cauchi's parents revealed that he had been diagnosed withschizophrenia at 17 but had stopped taking medication and dropped out of treatment.The shopping mall reopened on Friday with a somber atmosphere, as floral tributes were piled up inside and shoppers signed a book of condolence. Australian leaders praised the ""heroes"" of the Bondi attack, including the police, emergency responders, and individuals like Frenchman Damien Guerot, who fended off the attacker with a bollard. The government has granted Guerot permanent citizenship and is expected to do the same for the wounded Pakistani security guard, Muhammad Taha.Just two days after the mall attack, an Assyrian Christian bishop was brutally stabbed during a livestreamed service in western Sydney. The bishop is recovering in hospital, and a 16-year-old suspect has been charged with committing ""a terrorist act.""","A candlelight memorial was held at Sydney's famous Bondi Beach on Sunday to honor the six people who lost their lives in a knife attack. The victims included five women and a male security guard. The mentally ill knifeman, 40-year-old Joel Cauchi, was tracked down, shot, and killed by police inspector Amy Scott.","https://static.toiimg.com/thumb/msid-109478161,imgsize-1076917,width-400,resizemode-4/109478161.jpg"
"Massive river flooding expected in China's Guangdong, threatening millions",https://timesofindia.indiatimes.com/world/china/massive-river-flooding-expected-in-chinas-guangdong-threatening-millions/articleshow/109477862.cms,"(With inputs from agencies)

NEW DELHI: Severe flooding threats loom over China's Guangdong province as major rivers and waterways reach alarming levels, prompting the government to implement emergency measures to safeguard the lives of over 127 million residents . Local weather authorities have described the situation as dire, noting that certain sections of rivers and tributaries in the Xijiang and Beijiang river basins are experiencing rare water level spikes with a one-in-50-year likelihood, as reported by state broadcaster CCTV news on Sunday.The Ministry of Water Resources in China issued an emergency advisory in response to the escalating situation.Guangdong officials have called for urgent action across all localities and municipalities to prepare for potential natural disasters , ensuring prompt distribution of relief funds and resources to provide essential provisions such as food, clothing, water, and shelter to those affected. The province, known for its significant economic activities and trade, has been battered by heavy rainfall and strong winds for several days, impacting various parts of China. A continuous downpour lasting 12 hours from Saturday night onwards has particularly affected central and northern areas of Guangdong, including cities like Zhaoqing, Shaoguan, Qingyuan, and Jiangmen, leading to rescue operations being launched in these regions.The ongoing adverse weather conditions have resulted in the evacuation of over 45,000 individuals in Qingyuan, with reports of damaged power facilities in Zhaoqing causing power outages in certain areas. State-backed media revealed that approximately 1.16 million households in Guangdong have lost electricity due to the torrential rains. As a result, 1,103 schools in Zhaoqing, Shaoguan, and Qingyuan have decided to suspend classes on Monday to ensure the safety of students and staff.Residents have taken to social media platforms like Weibo to share their experiences, with one user highlighting the challenges faced by communities in Huaiji county, which has been inundated with floodwaters. Videos circulating online depict the impact of the heavy rainfall, including vehicles being swept away in Zhaoqing and rescuers assisting individuals stranded in floodwaters. Authorities in Qingyuan and Shaoguan have restricted ship movements on several rivers, deploying emergency response teams to manage the situation.Hydrological stations throughout Guangdong are witnessing rising water levels, with Guangzhou, the provincial capital with a population of 18 million, announcing that reservoirs have reached flood capacity. Similarly, neighboring Guangxi has been hit by violent winds, causing destruction and flooding in various areas. Weather forecasts predict continued heavy rainfall in Guangxi, Guangdong, Fujian, and Zhejiang provinces until Monday, raising concerns about the potential impact of the ongoing extreme weather conditions.","Severe flooding threats loom over China's Guangdong province as major rivers and waterways reach alarming levels. Local weather authorities have described the situation as dire, noting that certain sections of rivers and tributaries are experiencing rare water level spikes. The province, known for its significant economic activities and trade, has been battered by heavy rainfall and strong winds for several days.","https://static.toiimg.com/thumb/msid-109477981,imgsize-412167,width-400,resizemode-4/109477981.jpg"
"2 Japanese navy helicopters crash in the Pacific Ocean during training, leaving 1 dead and 7 missing",https://timesofindia.indiatimes.com/world/rest-of-world/2-japanese-navy-helicopters-crash-in-the-pacific-ocean-during-training-leaving-1-dead-and-7-missing/articleshow/109477081.cms,"TOKYO: Two Japanese navy helicopters carrying eight crew members crashed in the Pacific Ocean south of Tokyo during nighttime training in a possible collision, leaving one dead while rescuers on Sunday searched for seven others missing, the defense minister said.The two SH-60K choppers from the Maritime Self-Defense Force were carrying four crew each and lost contact late Saturday near Torishima island, about 600 kilometers (370 miles) south of Tokyo, Defense Minister Minoru Kihara told reporters.The cause of the crash was not immediately known, but officials believe the two helicopters ""highly likely"" collided before crashing into the water, Kihara said.The navy chief of staff, Adm. Ryo Sakai, said training involving the SH-60s will be suspended until the cause of the crash is determined and preventive measures are adopted.Rescuers recovered a flight data recorder, a blade from each helicopter, and fragments believed to be from both choppers in the same area, signs that the two SH-60Ks were flying close to each other, Kihara said.Search and rescue efforts for the missing crew were expanded Sunday with the deployment of 12 warships and seven aircraft. Japan coast guard patrol boats and planes also joined the operation.US Ambassador to Japan Rahm Emanuel offered his country's to help with the search and rescue.""We will stand together, side by side, with our friend and ally, Japan. My thoughts are with the crew members, and their families and friends during this challenging time,"" he wrote on the social platform X.The twin-engine, multi-mission helicopters developed by Sikorsky and known as Seahawks were modified and produced in Japan by Mitsubishi Heavy Industries. They were on nighttime anti-submarine training, Kihara said. One lost contact at 10:38 p.m. and sent an automatic emergency signal a minute later.Only one distress signal, called an emergency locator transmitter, was heard - another sign the helicopters were near the same place, because their signals use the same frequency and could not be differentiated, Kihara said.One helicopter belonged to an air base in Nagasaki, and the other to a base in Tokushima prefecture. Officials were interviewing the pilot of a third aircraft that also participated in Saturday's training, Kihara said.The SH-60K aircraft is usually deployed on destroyers for anti-submarine warfare, but is also used for search and rescue and other missions. Japan has about 70 of the modified helicopters.Saturday's training only involved the Japanese navy and was not part of a multinational exercise, defense officials said.Japan, under its 2022 security strategy, has been accelerating its military buildup and fortifying deterrence in the southwestern Japanese islands in the Pacific and East China Sea to counter threats from China's increasingly assertive military activities. Japan in recent years has conducted its own extensive naval exercises as well as joint drills with its ally the United States and other partners.Saturday's training was part of routine drills involving warships, submarines and Seahawk helicopters, the Japanese navy chief of staff said. During training, a number of helicopters hover together as they lower sonars into the water to detect submarines.In 2017, a Japanese navy SH-60J, an earlier generation Seahawk, crashed during nighttime training due to human error, killing three crew. In July 2021, two SH-60s had a minor collision off the southern island of Amamioshima, both suffering blade damage, but causing no injuries.Following the 2021 collision, the navy introduced a set of preventive measures to ensure enough distance between aircraft. Sakai said Saturday's crash could have been prevented if all safety measures were adequately followed.In the US, the fatal crash of a MH-60S Seahawk during training off California in 2021 was attributed to mechanical failure from unsuspected damage during maintenance, according to the Navy.The crash in Japan also comes a year after a Ground Self-Defense Force UH-60 Blackhawk crashed off the southwestern island of Miyako due to an engine output problem known as ""rollback,"" leaving all 10 crew members dead.Japan's NHK public television said no weather advisories were issued in the area at the time of Saturday's crash.","The two SH-60K choppers from the Maritime Self-Defense Force were carrying four crew each. The cause of the crash was not immediately known, but officials believe the two helicopters ""highly likely"" collided before crashing. Search and rescue efforts for the missing crew were expanded Sunday with the deployment of 12 warships and seven aircraft.","https://static.toiimg.com/thumb/msid-109477099,imgsize-1154453,width-400,resizemode-4/109477099.jpg"
"ISIS-K, Baloch separatists and ‘3 evils’: China's nightmare in Pakistan",https://timesofindia.indiatimes.com/world/pakistan/isis-k-baloch-separatists-and-3-evils-chinas-nightmare-in-pakistan/articleshow/109475982.cms,"NEW DELHI: The Shanghai Cooperation Organization ( SCO ), originally established to ease border tensions and combat the ""three evils"" of terrorism, separatism, and extremism, is refocusing its counterterrorism efforts in light of recent deadly attacks in member states, including Russia and Pakistan. These incidents have ignited a fierce determination among member countries to strengthen their joint anti-terrorism strategies.The most recent and severe of these attacks occurred at Crocus City Hall in Moscow, where gunmen killed at least 140 people, marking the deadliest assault in Russia in two decades.Islamic State Khorasan ( ISIS-K ), an Afghanistan-based affiliate of the militant group Islamic State, claimed responsibility for this attack.Days later, a suicide bomber killed five Chinese workers in northwest Pakistan, an attack that appeared to target Chinese interests, though no group has claimed responsibility. Separatist ethnic Baloch insurgent groups in the mineral-rich region have been fighting for decades against the state, saying it denies them their share of regional resources. Beijing has invested heavily in regional development projects as part of its $65 billion pledge under the China-Pakistan Economic Corridor.According to a South China Morning Post, the recent violence has prompted suggestions within the SCO to intensify cooperation through joint training exercises, enhanced intelligence sharing, and coordinated actions against armed groups like ISIS-K. However, amid these ambitions, Ian Hall from Griffith University expressed skepticism about China and Russia’s willingness to engage in risky interventions in regions like Afghanistan or Pakistan, where the threat from militant groups is profound.David Arase, a resident professor of international politics, noted, “ISIS-K epitomizes China’s nightmare, the ‘three evils’ of terrorism, separatism and religious extremism because [it] seeks an Islamic state under radical theocratic rule.”“The SCO already has a regional anti-terrorism structure for information sharing, and resources had been activated in response to the Moscow attacks,” said Thomas Wilkins, an associate professor at the University of Sydney, highlighting the organization's readiness to respond to such threats.Moreover, in the backdrop of these terror attacks, there is a growing concern among SCO members about external influences destabilizing their regions, with Chinese President Xi Jinping urging vigilance against the West's potential to incite disturbances, the SCMP report said.The SCO’s evolving focus reflects a geopolitical shift where Moscow and Beijing are keen on maintaining security and stability while keeping Western influences at bay, especially in their Central Asian sphere of influence.(With inputs from agencies)","Shanghai Cooperation Organization (SCO) is refocusing its counterterrorism efforts. Recent deadly attacks in member states, including Russia and Pakistan, have ignited a fierce determination among member countries to strengthen their joint anti-terrorism strategies. The most recent and severe of these attacks occurred at Crocus City Hall in Moscow, where gunmen killed at least 140 people.","https://static.toiimg.com/thumb/msid-109476103,imgsize-672927,width-400,resizemode-4/109476103.jpg"
Iran president Ebrahim Raisi to begin 3-day visit to Pakistan from April 22,https://timesofindia.indiatimes.com/world/pakistan/iran-president-ebrahim-raisi-to-begin-3-day-visit-to-pakistan-from-april-22/articleshow/109475827.cms,"NEW DELHI: Iran's president Ebrahim Raisi is set to visit Pakistan this week, as per an announcement made by Islamabad on Sunday. This visit comes as both Muslim countries aim to improve relations following recent tensions, including missile strikes exchanged in January.Initially in doubt due to rising tensions in the Middle East, especially after Iran's attack on Israel and an alleged Israeli strike on central Iran, Raisi's visit was confirmed by Pakistan's ministry of foreign affairs.Pakistan had indicated Raisi's visit since January, with the prime minister stating last week that it would happen ""very soon.""Tehran downplayed the recent events and showed no intention of retaliation, seemingly to prevent the Israel-Gaza conflict from spreading further.During his visit, Raisi will meet with Pakistan's president, prime minister, and other key figures. They will discuss regional and global developments, bilateral cooperation against terrorism, and trade ties . Raisi plans to visit cities like Lahore and Karachi to focus on enhancing bilateral relations .Pakistan has urged all parties in the Middle East to exercise restraint and de-escalate tensions. While Iran and Pakistan have a history of strained relations, the missile strikes in January marked a significant escalation. However, both sides swiftly worked to ease tensions and pledged to expand security cooperation while respecting each other's sovereignty and territorial integrity.","Iran's president Ebrahim Raisi is set to visit Pakistan this week. Raisi will meet with Pakistan's president, prime minister, and other key figures. They will discuss regional and global developments, bilateral cooperation against terrorism, and trade ties.","https://static.toiimg.com/thumb/msid-109476041,imgsize-8920,width-400,resizemode-4/109476041.jpg"
