Article Title,Article Link,Article Text,Article Summary,Article Image
An Ohio city reshaped by Haitian immigrants lands in an unwelcome spotlight,https://timesofindia.indiatimes.com/world/us/an-ohio-city-reshaped-by-haitian-immigrants-lands-in-an-unwelcome-spotlight/articleshow/113274741.cms,"SPRINGFIELD: Many cities have been reshaped by immigrants in the last few years without attracting much notice. Not Springfield , Ohio.Its story of economic renewal and related growing pains has been thrust into the national conversation in a presidential election year - and maliciously distorted by false rumors that Haitian immigrants are eating their neighbors' pets.Donald Trump amplified those lies during Tuesday's nationally televised debate, exacerbating some residents' fears about growing divisiveness in the predominantly white, blue-collar city of about 60,000.At the city's Haitian Community Help and Support Center on Wednesday, Rose-Thamar Joseph said many of the roughly 15,000 immigrants who arrived in the past few years were drawn by good jobs and the city's relative affordability. But a rising sense of unease has crept in as longtime residents increasingly bristle at newcomers taking jobs at factories, driving up housing costs, worsening traffic and straining city services.""Some of them are talking about living in fear. Some of them are scared for their life,"" Joseph said.A ""Welcome To Our City"" sign hangs from a parking garage downtown, where a coffee shop, bakery and boutique line Springfield's main drag, North Fountain Street. A flag advertising ""CultureFest,"" the city's annual celebration of unity through diversity, waves from a pole nearby.Melanie Flax Wilt , a Republican commissioner in the county where Springfield is located, said she has been pushing for community and political leaders to ""stop feeding the fear.""""After the election and everybody's done using Springfield, Ohio, as a talking point for immigration reform, we are going to be the ones here still living through the challenges and coming up with the solutions,"" she said.Ariel Dominique, executive director of the Haitian American Foundation for Democracy, said she laughed at first at the absurdity of the false claims. But seeing the comments repeated on national television by the former president was painful.""It is so unfair and unjust and completely contrary to what we have contributed to the world, what we have contributed to this nation for so long,"" Dominique said.The falsehoods about Springfield's Haitian immigrants were spread online by Trump's running mate, JD Vance , on the eve of Tuesday's debate between Trump and Vice President Kamala Harris . It's part of a timeworn American political tradition of casting immigrants as outsiders.""This is what's happening in our country. And it's a shame,"" Trump said at the debate after repeating the falsehoods. When challenged by ABC News moderator David Muir over the false claims, Trump held firm, saying ""people on television"" said their dogs were eaten, but he offered no evidence.Officials in Springfield have tried to tamp down the misinformation by saying there have been no credible or detailed reports of any pets being abducted or eaten. State leaders are trying to help address some of the real challenges facing the city.Ohio Gov. Mike DeWine , a Republican, said Tuesday he would add more law enforcement and health care resources to an aid package the state has already provided to Springfield.Many Haitians have come to the US to flee poverty and violence. They have embraced President Joe Biden 's new and expanded legal pathways to enter, and have shunned illegal crossings, accounting for only 92 border arrests out of more than 56,000 in July, the latest data available.The Biden administration recently announced an estimated 300,000 Haitians in the US could remain in the country at least through February 2026, with eligibility for work authorization, under a law called Temporary Protected Status. The goal is to spare people from being deported to countries in turmoil.Springfield, about 45 miles from the state capital of Columbus, suffered a steep decline in its manufacturing sector toward the end of the last century, and its population shrank as a result. But its downtown has been revitalized in recent years as more Haitians arrived and helped meet the rising demand for labor as the economy emerged from the pandemic. Officials say Haitians now account for about 15% of the population.The city was shaken last year when a minivan slammed into a school bus, killing an 11-year-old boy. The driver was a Haitian man who recently settled in the area and was driving without a valid license. During a city commission meeting on Tuesday, the boy's parents condemned politicians' use of their son's death to stoke hatred.Last week, a post on the social media platform X shared what looked like a screengrab of a social media post apparently out of Springfield. The post claimed without evidence that the person's ""neighbor's daughter's friend"" saw a cat hanging from a tree to be butchered and eaten, outside a house where it claimed Haitians lived. It was accompanied by a photo of a Black man carrying what appeared to be a goose by its feet.On Monday, Vance posted on X: ""Reports now show that people have had their pets abducted and eaten by people who shouldn't be in this country."" The next day, he posted again, saying his office had received inquiries from Springfield residents who said ""their neighbors' pets or local wildlife were abducted by Haitian migrants.""Long-time Springfield resident Chris Hazel, who knows the park and neighborhood where the pet and goose abductions were purported to have happened, called the claims ""preposterous.""""It reminds me of when people used to accuse others and outsiders as cannibals. It's dehumanizing a community,"" he said of the accusations against the city's Haitian residents.Sophia Pierrilus , the daughter of a former Haitian diplomat who moved to the Ohio capital of Columbus 15 years ago and is now an immigrant advocate, agreed, calling it all political.""My view is that's their way to use Haitians as a scapegoat to bring some kind of chaos in America,"" she said.With its rising population of immigrants, Springfield is hardly an outlier. So far this decade, immigration has accounted for almost three-quarters of US population growth, with 2.5 million immigrants arriving in the United States between 2020 and 2023, according to the US Census Bureau. Population growth is an important driver of economic growth.""The Haitian immigrants who started moving to Springfield the last few years are the reason why the economy and the labor force has been revitalized there,"" said Guerline Jozef, executive director of the Haitian Bridge Alliance, which provides legal and social services to immigrants across the USNow, she said, Haitians in Springfield have told her that, out of fear, they are considering leaving the city.","Haitians in Springfield, Ohio, account for about 15% of the city's population. Many of the roughly 15,000 immigrants who arrived in the past few years were drawn by good jobs. But a rising sense of unease has crept in as longtime residents increasingly bristle at newcomers.","https://static.toiimg.com/thumb/msid-113274769,imgsize-1150340,width-400,resizemode-4/113274769.jpg"
Peru's former president Alberto Fujimori passes away after battle with cancer,https://timesofindia.indiatimes.com/world/rest-of-world/who-was-alberto-fujimori-perus-former-president-convicted-for-human-rights-abuses-passes-away-cancer/articleshow/113274057.cms,"Early life

Political career

Sentenced to prison for 25 years

2026 presidential election

Alberto Fujimori , the former president of Peru , has died at the age of 86 after a prolonged battle with cancer, according to his daughter's post on X.""After a long battle with cancer, our father, Alberto Fujimori , has just departed to meet the Lord. We ask those who loved him to accompany us with a prayer for the eternal rest of his soul. Thanks for so much dad! Keiko, Hiro, Sachie and Kenji Fujimori ,"" daughter Keiko Fujimori said.He was born July 28, 1938, coinciding with Peruvian Independence Day, and his immigrant parents picked cotton until they could open a tailor’s shop in downtown Lima, AP News agency reported.He earned a degree in agricultural engineering in 1956, and then studied in France and the United States, where he received a graduate degree in mathematics from the University of Wisconsin in 1972.In 1984 he became rector of the Agricultural University in Lima, and six years later, he ran for president without ever having held political office, billing himself as a clean alternative to Peru’s corrupt, discredited political class.Fujimori's presidency, spanning from 1990 to 2000, was marked by significant events. He inherited a country plagued by hyperinflation and guerrilla violence, which he addressed through bold economic reforms and the defeat of the Shining Path rebels.However, his government collapsed in 2000 due to a corruption scandal involving his spy chief, Vladimiro Montesinos . Fujimori sought exile in Japan, his parents' country of origin, and later faced arrest in Chile and extradition to Peru.In 2009, Fujimori was sentenced to 25 years in prison for human rights crimes, becoming the first democratically elected Latin American president to be convicted of such offenses in his own country, Reuters reported.The charges stemmed from his role in ordering military death squads to carry out two massacres that claimed 25 lives during his presidency, amidst the conflict with communist guerrillas that resulted in nearly 70,000 deaths over two decades in Peru.He had been pardoned in December. Despite his conviction, Fujimori's daughter announced in July that he planned to run for Peru's presidency for the fourth time in 2026.“My father and I have talked and decided together that he will be the presidential candidate,” Keiko Fujimori, leader of the right-wing Fuerza Popular party, said on social networks, as per AP news agency.However, Peruvian law prohibits individuals found guilty of corruption from running for the office of president or vice president.","Alberto Fujimori, the former president of Peru, has died at the age of 86 after a prolonged battle with cancer. He was the first democratically elected Latin American president to be convicted of such offenses in his own country. Despite his conviction, he planned to run for Peru's presidency for the fourth time in 2026.","https://static.toiimg.com/thumb/msid-113274146,imgsize-51702,width-400,resizemode-4/113274146.jpg"
Taylor Swift News: Taylor Swift endorses Kamala Harris for US president after Trump debate,https://timesofindia.indiatimes.com/world/us/taylor-swift-to-vote-for-kamala-harris-im-voting-for-a-warrior-singer-endorses-vp-post-presidential-debate-with-trump/articleshow/113244315.cms,Taylor Swift has publicly endorsed Kamala Harris for President in the 2024 election through an Instagram post. She praised Harris's advocacy for important rights and causes. Swift also addressed concerns over AI-generated misinformation and encouraged her followers to research candidates' positions on significant issues before casting their votes., Swift also addressed concerns over AI-generated misinformation and encouraged her followers to research candidates' positions on significant issues. She praised Harris's advocacy for important rights and causes. Swift has publicly endorsed Kamala Harris for President in the 2024 election through an Instagram post.,"https://static.toiimg.com/thumb/msid-113244784,imgsize-1191757,width-400,resizemode-4/113244784.jpg"
Donald Trump and Kamala Harris shake hands as they meet for first time on debate stage: Watch the 'awkward' moment,https://timesofindia.indiatimes.com/world/us/donald-trump-and-kamala-harris-shake-hands-as-they-meet-for-first-time-on-debate-stage-watch-the-awkward-moment/articleshow/113242448.cms,"Harris and Trump clash in high-stakes debate

AI image generated by Grok-2

In a notable moment during Tuesday night’s presidential debate, Vice President Kamala Harris and former President Donald Trump shared a handshake, marking their first face-to-face meeting in the campaign.As the debate began, both candidates took the stage for what was their initial direct encounter. Initially, Trump seemed to head towards his podium without acknowledging Harris, who was approaching the center of the stage.In a gesture of politeness, Harris altered her path to meet Trump at his podium, extending her hand.“Kamala Harris. How are you?” Harris greeted.“Nice to see you, I'm fine,” Trump responded as he shook her hand.“Let’s have a good debate,” Harris replied.The handshake signified the end of an eight-year period without handshakes on the presidential debate stage. Although there are no formal rules or stipulations requiring such gestures, this exchange added a touch of civility to the high-stakes political confrontation.Kamala Harris and Donald Trump faced off for the first time in what might be their only debate before the November presidential election, offering a dramatic glimpse into their contrasting visions for the country. The debate came after a tumultuous summer for both candidates and presented a critical opportunity to sway undecided voters.The encounter provided Americans with their clearest view yet of a campaign that has shifted significantly since the last debate in June, which saw President Joe Biden withdraw from the race. Harris immediately targeted Trump, linking him to the conservative Project 2025 agenda and GOP efforts to restrict abortion access, while also criticizing his inflammatory rhetoric.Trump countered by questioning Harris’s effectiveness as vice president and attacking her handling of illegal migration. He made several contentious claims about migrants, including an assertion that they are “taking jobs” from African Americans and Hispanics. Harris, seemingly unfazed, responded with a smirk when Trump repeated baseless accusations about immigrants.The debate took place in a small, blue-lit amphitheater turned television studio, devoid of a live audience, which minimized the typical noise of applause or jeers. The close proximity of the candidates’ lecterns highlighted the intensity of the debate.Following the June 27 debate, which led to Biden’s exit from the race, Trump survived an assassination attempt, and both sides finalized their running mates. This debate, hosted by ABC News, represents a rare instance of sustained questioning for Harris, who has given only one formal interview in the past six weeks.Early ballots for the presidential race are set to be distributed just hours after the debate, with absentee ballots beginning to go out in Alabama on Wednesday.",Kamala Harris and Donald Trump faced off for the first time in what might be their only debate before the November presidential election. The encounter provided Americans with their clearest view yet of a campaign that has shifted significantly since the last debate in June.,"https://static.toiimg.com/thumb/msid-113243151,imgsize-1335679,width-400,resizemode-4/113243151.jpg"
REAIM Summit 2024: China refuses to sign agreement to ban AI from controlling nuclear weapons,https://timesofindia.indiatimes.com/world/china/china-refuses-to-sign-agreement-to-ban-ai-from-controlling-nuclear-weapons/articleshow/113235217.cms,"China opted out of the 'Blueprint for Action' agreement which seeks to ban artificial intelligence from controlling nuclear weapons. The agreement was adopted at the Responsible AI in the Military Domain ( REAIM ) summit in Seoul on Tuesday where over 100 countries including the US were present.The agreement is not legally binding and it seeks to ""maintain human control and involvement for all actions...concerning nuclear weapons employment.""""AI applications should be ethical and human-centric,"" it said.Calling the AI a ""double-edged sword,"" South Korean defence minister Kim Yong-Hyun said, ""As AI is applied to the military domain, the military's operational capabilities are dramatically improved. However it is like a double-edged sword, as it can cause damage from abuse.""The declaration from the summit did not specify sanctions or penalties for violations.It acknowledged that significant progress is needed for states to keep up with advancements in military AI, emphasizing the need for further discussions to establish clear policies and procedures.The Seoul summit, co-hosted by Britain, the Netherlands, Singapore, and Kenya, builds on the inaugural event held in The Hague in February last year. It positions itself as the ""most comprehensive and inclusive platform for addressing AI in the military domain.""Russia was excluded from the summit due to its ongoing invasion of Ukraine .",China opted out of the 'Blueprint for Action' agreement which seeks to ban artificial intelligence from controlling nuclear weapons. The agreement was adopted at the Responsible AI in the Military Domain ( REAIM ) summit in Seoul on Tuesday. Over 100 countries including the US were present.,"https://static.toiimg.com/thumb/msid-113235418,imgsize-757894,width-400,resizemode-4/113235418.jpg"
Allexis Telia Ferell: Who is Allexis Telia Ferrell? Ohio woman behind viral animal cruelty case,https://timesofindia.indiatimes.com/world/us/haitians-eating-pets-row-who-is-allexis-telia-ferrell-ohio-woman-behind-viral-animal-cruelty-case/articleshow/113214514.cms,"The incident:

Public reaction and political ramifications:

Political responses:

Current status:

Allexis Telia Ferrell , a 27-year-old from Canton, Ohio , has become a controversial figure following her recent arrest for allegedly killing and consuming a cat. The disturbing case has not only sparked outrage but also fueled an unusual online trend involving Donald Trump memes.Ferrell was arrested on September 6, 2024, after witnesses reported that she stomped on a cat’s head before eating it in front of residents.Charged with animal cruelty , including injuring animals, prohibitions concerning companion animals, and disorderly conduct, Ferrell’s bond was set at $100,000.The case has generated significant media attention and public outcry. Right-wing social media accounts have bizarrely linked Ferrell's actions to unfounded claims about illegal Haitian migrants consuming pets and wild birds in Springfield, Ohio. This connection has led to the creation of AI-generated memes depicting Donald Trump holding cats and ducks, reflecting the surreal nature of the situation.In response to the controversy, Trump’s campaign issued a statement that read, “President Trump will deport migrants who eat pets. Kamala Harris will send them to your town next. Make your choice, America.” This statement highlights the campaign’s use of sensationalist narratives to rally support.JD Vance , Trump’s running mate and Ohio Senator, also reacted to the situation. “Months ago, I raised the issue of Haitian illegal immigrants draining social services and generally causing chaos all over Springfield, Ohio,” Vance tweeted. He continued, “Reports now show that people have had their pets abducted and eaten by people who shouldn’t be in this country.”Ferrell remains in custody as her case progresses through the legal system. The unusual combination of a disturbing criminal case and viral political memes continues to draw significant attention and debate.","Allexis Telia Ferrell, 27, was arrested for allegedly killing and consuming a cat. The disturbing case has sparked outrage and fueled an unusual online trend involving Donald Trump memes. Right-wing social media accounts have bizarrely linked Ferrell's actions to unfounded claims about illegal Haitian migrants consuming pets and wild birds.","https://static.toiimg.com/thumb/msid-113218218,imgsize-1093269,width-400,resizemode-4/113218218.jpg"
"Drunk driver crashes into Arizona social club, injuring 30; watch video",https://timesofindia.indiatimes.com/world/us/drunk-driver-crashes-into-arizona-social-club-injuring-30-watch-video/articleshow/113274470.cms,"In a shocking incident, at least 30 individuals sustained injuries when a suspected drunk driver crashed his truck into an Arizona social club . The frightening moment was captured on surveillance camera, showing the vehicle plowing into Elks Lodge and throwing patrons around.The driver, identified as 73-year-old Thomas Edward Kain, drove into the building while attempting to leave.He was subsequently arrested, with police stating that alcohol ""was a contributing factor"" in the incident, New York Post reported.The video footage depicts the truck violently crashing into the crowded building, barreling over a row of occupied tables, and splashing drinks onto the vehicle's windshield. Despite the harrowing nature of the incident, everyone miraculously survived.According to police, ten people were transported to local hospitals, while 15 patrons received treatment at the scene, and five others self-transported to hospitals.Kain faces a total of 12 charges of aggravated assault, 17 charges of endangerment, and a charge of driving under the influence to the slightest degree. In Arizona, a DUI charge to the slightest degree implies that the driver appeared intoxicated enough to warrant a DUI, even if their blood alcohol content is below .08%.The Apache Junction Elks Lodge released a statement expressing their ""heartfelt sympathy and support for all those impacted"" by the unfortunate incident. They acknowledged the efforts of the first responders who provided assistance and emphasized their thoughts being with the victims and their families.Jail records indicate that Kain is currently in custody in Pinal County. He did not immediately respond to a phone call, and court records were not accessible online on Sunday.The city reminded everyone that ""drunk driving can have serious consequences, not just for the driver but for everyone around them,"" underscoring the importance of responsible behavior behind the wheel, as per NBC news.","The driver, identified as 73-year-old Thomas Edward Kain, drove into the building while attempting to leave. Kain faces a total of 12 charges of aggravated assault, 17 charges of endangerment, and a charge of driving under the influence to the slightest degree. Despite the harrowing nature of the incident, everyone miraculously survived.","https://static.toiimg.com/thumb/msid-113274673,imgsize-38342,width-400,resizemode-4/113274673.jpg"
American footballer Patrick Mahomes refuses to endorse any Presidential candidate after Donald Trump praised wife Britanny,https://timesofindia.indiatimes.com/world/us/american-footballer-patrick-mahomes-refuses-to-endorse-any-presidential-candidate-after-donald-trump-praised-wife-britanny-taylor-swift-travis-kelce/articleshow/113274377.cms,"American football team Kansas city Chiefs superstar quarterback Patrick Mahomes announced that he will not endorse any candidate in the upcoming presidential election “I don’t want my place and my platform to be used to endorse a candidate or do whatever, either way,"" Mahomes said, as quoted by CNN.This announcement came after US former President Donald Trump publicly praised his wife, Brittany Mahomes and told the morning Fox and friends show that Brittany is a fan of him.“I actually like Mrs. Mahomes much better, if you want to know the truth. She’s a big Trump fan,” Trump said and added “I like Brittany. I think Brittany’s great. She’s a big, she’s a big MAGA fan. Much better than Taylor Swift.”“I think my place is to inform people to get registered to vote. It is to inform people to do their own research and then make their best decision for them and their family. Every time I’m on this stage and I get asked these questions, I’m going to refer back to that because I think that’s what makes America so great,” Mahomes said.He spent his Sunday at the US Open with his wife Brittany, teammate Travis Kelce, and singer Taylor Swift. Swift recently endorsed Vice President Kamala Harris for president on social media.When asked about President Trump discussing his wife, Mahomes responded, ""No. I think at the end of the day, it's about me and my family and how we treat other people."" He emphasized the community work that he and his wife Brittany engage in, helping people use their voices and providing opportunities.Mahomes stated that he cannot let political comments affect how he goes about his daily life and business, striving to live to the best of his ability. He acknowledged that people might use various topics during political times but maintained his focus on his personal and professional life.Following Tuesday night's heated debate, Taylor Swift, who is in a relationship with Chiefs tight end Travis Kelce, publicly endorsed Kamala Harris and her running mate Tim Walz for the 2024 Presidential Election, reported CNN.In an Instagram post, Swift wrote, ""I will be casting my vote for Kamala Harris and Tim Walz in the 2024 Presidential Election,"" expressing her belief that Harris is a warrior who champions the rights and causes she supports.","Kansas City Chiefs quarterback Patrick Mahomes announced that he will not endorse any candidate in the upcoming presidential election. “I don’t want my place and my platform to be used to endorse a candidate or do whatever, either way,"" Mahomes said. This announcement came after US former President Donald Trump publicly praised his wife, Brittany Mahomes.","https://static.toiimg.com/thumb/msid-113274448,imgsize-54028,width-400,resizemode-4/113274448.jpg"
