Article Title,Article Link,Article Text,Article Summary,Article Image
'Wouldn't have given birth': Gaza mother struggles to provide for newborns amid conflict,https://timesofindia.indiatimes.com/world/middle-east/wouldnt-have-given-birth-gaza-mother-struggles-to-provide-for-newborns-amid-conflict/articleshow/113997656.cms,"Wouldn't have gotten pregnant

20,000 infants born in Gaza

How can I carry...

Anniversary of the deadly Hamas

The October 7, 2023, deadly Hamas -led attack which prompted Israel’s devastating counteroffensive in the Gaza Strip, has intensified over the past year, spreading to new fronts. It has resulted in the displacement of 2.3 million Gazans, according to Gaza’s health ministry.According to Reuters, among the displaced is Rana Salah, a Gazan mother who cradles her one-month-old daughter Milana in a sweltering tent at a camp in Deir al-Balah, central Gaza.She expresses the deep guilt she feels for bringing her child into a world ravaged by war and suffering.""If it were up to me, I wouldn't have gotten pregnant or given birth during the war because life is completely different; we've never lived this life before,"" she told Reuters.Reflecting on her past experiences, Rana recalls, ""I gave birth twice before, and life was better and easier for me and the child. Now, I feel like I've wronged both myself and the child because we deserve to live better than this.""Milana was born via a cesarean section in a hospital tent, as complications arose during Salah's pregnancy. The ongoing conflict has prevented the family from returning to their home, forcing them to relocate from one tent to another.According to Unicef data, Milana is among the approximately 20,000 infants born in Gaza over the past year. ""Instead of returning to our house, we keep moving from one tent to another... where diseases are widespread and the water is contaminated,"" Rana said.The World Health Organization (WHO) has reported a significant decrease in postnatal services in Gaza, limiting access to necessary care for women who have complications and have less access to the care they need, as do their babies.According to Rick Brennan, the WHO's Eastern Mediterranean Regional emergency director, newborns face the threat of malnutrition, especially if their mothers are unable to breastfeed due to the lack of access to breast milk substitutes.He mentioned that constant movement and displacement can be highly disruptive for a newborn, increasing their risk of infection.Manar Abu Jarad, who is currently staying in a school shelter run by the UN Palestinian refugee agency ( UNRWA ), gave birth to her youngest daughter Sahar on September 4th via cesarean section, her husband was killed in the war.Upon learning that she would require a cesarean for the birth, Abu Jarad was concerned about how she would manage to care for her other children while recovering from the surgery. ""I already have three girls. I started shouting... How can I carry (water) buckets? How can I bathe my daughters? How can I help them and my husband is not with me, he was martyred,"" Abu told Reuters.""I've reached the point where I cannot carry the responsibility for this girl ... Thank God I found some help here,"" she said. She has borrowed what she could from family and is forced to use just one diaper a day for the baby, adding that, ""I don't have the money to provide diapers or milk for her.""Abu yearns for the war to end and hopes to return home, even if it means living in a tent beside what was once her house. ""The important thing is to go home. Enough of all the exhaustion we are experiencing here, enough carrying buckets, enough of the dirt in the bathrooms. It's really, really hard and really tiring for us. Diseases are everywhere,"" she added.As the anniversary of the deadly Hamas-led assault on southern Israel approaches, the nation braces for a tense week marked by both mourning and continued fighting.With the security situation unstable, shifting restrictions on public gatherings in Israel have cast uncertainty over memorials planned for the victims of the assault, deepening the anguish as the region remains in turmoil.The current war, a particularly deadly episode in the decades-old Israeli-Palestinian conflict , was triggered on October 7, 2023, when Hamas militants attacked Israel, killing 1,200 people and taking about 250 hostages, according to Israeli tallies.In response, Israeli air and artillery strikes have reduced much of the Palestinian enclave to rubble, and the Gaza health ministry reports that more than 41,500 Palestinians have lost their lives in the Israeli assault.","The October 7, 2023, deadly Hamas -led attack which prompted Israel’s devastating counteroffensive in the Gaza Strip, has intensified over the past year. It has resulted in the displacement of 2.3 million Gazans, according to Gaza's health ministry.","https://static.toiimg.com/thumb/msid-113998993,imgsize-1808945,width-400,resizemode-4/113998993.jpg"
Kamala Harris Kicks off media blitz with ‘Call Her Daddy’,https://timesofindia.indiatimes.com/world/us/kamala-harris-kicks-off-media-blitz-with-call-her-daddy/articleshow/113998128.cms,"Harris said the US won’t stop pressure on Israel and “Arab leaders” for a ceasefire deal.

Vice President Kamala Harris is making a push to reach key voters ahead of the November 5 election with a media blitz of television and podcast appearances, including on Call Her Daddy and The Late Show With Stephen Colbert.Plans include a visit to New York on Tuesday for appearances on ABC’s The View, The Howard Stern Show and Colbert’s show on CBS, a senior campaign official said.On the Call Her Daddy episode, released Sunday, Harris underscored her support for abortion rights and pledged to “continue to fight for student debt relief.” Her appearance on the podcast reflects the importance of connecting with younger audiences who will be key to the election outcome, according to her campaign.Call Her Daddy and The View have large female audiences, a voter bloc that favors Harris over former President Donald Trump in polls ahead of the presidential election.Harris was viewed very or somewhat favorably by 51% of female likely voters in the latest Bloomberg/Morning Consult swing-state poll, while 44% held those views about Trump.Harris’s media campaign follows needling by Republicans, including presidential nominee Trump and running mate JD Vance, that the vice president has shied away from interviews.In a preview from an interview with CBS’s 60 Minutes airing Monday, Harris said the US won’t stop pressure on Israel and “Arab leaders” for a cease-fire deal that also frees hostages taken by Hamas in the group’s October 7, 2023, attack on Israel.CBS has said that Trump’s campaign backed out of a 60 Minutes sitdown after both candidates initially agreed to interviews with the network.Democratic vice presidential candidate Tim Walz kicked off a media push on Sunday with a Fox News interview that included questions about his history of misspeaking and flubbed statements on the campaign trail that Republicans have capitalized on.Walz redirected criticism about his comments backing access to in vitro fertilization — his wife said she received intrauterine insemination, not IVF — to Trump.“I don’t think people care whether I used IUI or IVF when we talk about this,” Walz said on Fox News Sunday. “What they understand is Donald Trump would resist those things.”During last week’s vice presidential debate with Vance, Walz said he “misspoke” when saying he was in Hong Kong during the 1989 Tiananmen Square protests in Beijing — and added he’s “a knucklehead at times.”“I will own up when I misspeak,” Walz, who’s in his second term as governor of Minnesota, said Sunday. “I will own up when I make a mistake.”On Monday, Walz is scheduled to appear on ABC’s Jimmy Kimmel Live. A senior campaign official said he’ll also appear on a major US podcast, but didn’t specify which.Harris and Walz will visit critical Sun Belt states later in the week. Harris is participating in a Univision town hall on October 10 in Nevada, an attempt to court the Latino voting bloc that the campaign has struggled to grasp as firmly as previous Democratic candidates.Both will visit swing state Arizona, where early voting begins October 9.","Vice President Kamala Harris is making a push to reach key voters ahead of the November 5 election with a media blitz of television and podcast appearances. Harris’s media campaign follows needling by Republicans, including presidential nominee Donald Trump and running mate JD Vance, that the vice president has shied away from interviews.","https://static.toiimg.com/thumb/msid-113998082,imgsize-73778,width-400,resizemode-4/113998082.jpg"
"After the deluge, the lies: Top conspiracy theories about Hurricane Helene",https://timesofindia.indiatimes.com/world/us/florida-braces-for-milton-hurricane-helene-conspiracy-theories/articleshow/113997910.cms,"FEMA

faces false claims of fund misappropriation

Weather control conspiracy: Targeting republicans?

Dam and body disposal hoaxes spread fear

Efforts to debunk the misinformation

Political misinformation clouding recovery efforts

(With inputs from agencies)

As Florida braces for the arrival of Hurricane Milton , the aftermath of Hurricane Helene is being further complicated by a torrent of conspiracy theories and misinformation . These baseless claims have worsened the challenges for recovery teams trying to provide aid to devastated communities, making an already dire situation even more complex.Hurricane Helene, which struck on September 26, left over 225 people dead across multiple states, from Florida to North Carolina.Yet, as federal and local relief efforts ramp up, misinformation has emerged online, further muddying the recovery process. Among the most persistent conspiracy theories is a claim that FEMA misappropriated disaster relief funds to support undocumented immigrants.This claim, pushed most prominently by former President Donald Trump , has been widely debunked. Trump has asserted, without evidence, that ""Biden and Harris had used federal emergency funds on people that should not be in our country."" Deanne Criswell, head of FEMA, firmly denied this, saying, ""This kind of rhetoric is not helpful to people."" Independent fact-checkers and FEMA officials explained that disaster recovery funds are separate from programs aimed at aiding migrants.Another troubling theory making waves suggests that the US government can control the weather, and that Hurricane Helene was deliberately steered toward Republican-voting areas to influence the upcoming presidential election. This baseless idea, amplified by far-right figures like Rep Marjorie Taylor Greene, has gained traction on social media platforms, particularly on X (formerly Twitter).“Yes, they can control the weather,” Greene posted, further fueling the false narrative. The claim, which echoes similar theories from past natural disasters, suggests that Democrats, led by President Biden and Vice President Kamala Harris, used Helene as a political weapon to harm Republican voters.Other conspiracy theories have spread panic in the hardest-hit areas. In North Carolina, one false claim suggested a dam was about to burst, leading to unnecessary evacuations. Another rumor, widely circulated online, alleged that FEMA was planning to bulldoze bodies under the rubble in some towns. These stories, despite being false, have added to the chaos and distrust in the recovery process.Criswell warned that such baseless claims create fear and prevent residents from seeking much-needed aid. ""It has a tremendous impact on the comfort level of our own employees to be able to go out there,"" she said, noting that the disinformation has even led to threats against FEMA workers.Authorities have taken steps to debunk the most dangerous falsehoods. FEMA has launched a rumor control page to counteract the conspiracy theories and provide accurate information to the public. Local leaders from both parties have also stepped in to calm tensions. Glenn Jacobs, Republican mayor of Knox County, Tennessee, urged citizens to ""put aside the hate for a bit and pitch in to help.""Yet, despite efforts to curb the spread of misinformation, conspiracy theories continue to flourish, especially on platforms like X, which has become a hub for right-wing disinformation since being acquired by Elon Musk. Some of the most viral posts, including those claiming federal authorities are withholding aid from Republican areas, have garnered millions of views.As federal and state officials work tirelessly to restore devastated communities, the political atmosphere surrounding Hurricane Helene continues to escalate. President Biden has emphasized that his administration ""will continue working hand-in-hand with local and state leaders – regardless of political party."" However, the spread of false information has led to a growing distrust in government efforts, particularly in Republican-leaning areas.With Hurricane Milton now expected to make landfall later this week, officials worry that the disinformation surrounding Helene could further erode trust in disaster relief efforts, making it harder to protect vulnerable communities from future storms.","Hurricane Helene left over 225 people dead across multiple states, from Florida to North Carolina. Among the most persistent conspiracy theories is a claim that FEMA misappropriated disaster relief funds to support undocumented immigrants. Another troubling theory suggests that the US government can control the weather, and that Hurricane Helene was deliberately steered toward Republican- voting areas.","https://static.toiimg.com/thumb/msid-113997914,imgsize-1499037,width-400,resizemode-4/113997914.jpg"
'Not 1950s anymore': Kamala Harris responds to 'doesn’t have children keeping her humble' remark,https://timesofindia.indiatimes.com/world/us/not-1950s-anymore-kamala-harris-responds-to-doesnt-have-children-keeping-her-humble-remark/articleshow/113997230.cms,"60

US vice president Kamala Harris has responded to Arkansas governor Sarah Huckabee Sanders ’s recent criticism, which suggested Harris lacks humility because she doesn’t have biological children. Speaking during an appearance on the Call Her Daddy podcast, Harris challenged the outdated notion, celebrating her “modern family” and highlighting the evolving definition of family in today’s society.With her remarks, Harris pushed back against traditional views, reminding listeners that family comes in many forms and that women shouldn’t be defined by whether or not they have children.The controversy began when Sanders, during a town hall moderated for Republican candidate Donald Trump in Michigan, implied that Harris wasn’t grounded because she didn’t have children of her own. ""My kids keep me humble,"" Sanders remarked. ""Harris doesn’t have anything keeping her humble.""Harris, speaking on the popular podcast hosted by Alex Cooper, addressed the “outdated view”. “I don’t think she understands that there are a whole lot of women out here who, one, are not aspiring to be humble,” Harris said. “Two, a whole lot of women out here who have a lot of love in their life, family in their life, and children in their life.”Harris, who is married to Doug Emhoff, shared insights into her own life, highlighting her “modern family” that includes Emhoff’s children from his first marriage, Cole and Ella, whom she affectionately calls her own. “We have our family by blood, and then we have our family by love, and I have both. I consider it a real blessing. Cole and Ella call me ‘Momala.’ We have a very modern family, and I’m also friends with my husband’s ex-wife,” Harris saidHarris’s comments come as part of a broader conversation about family and the changing roles of women. The vice president took the opportunity to underscore that today’s families no longer fit into rigid molds of the past. ""This is not the 1950s anymore. Families come in all kinds of shapes and forms, and they’re family nonetheless,"" she added, drawing a clear line between traditional and contemporary notions of family.Harris also touched upon derogatory remarks made by Trump’s running mate, JD Vance, who had previously expressed disdain for what he called “childless cat ladies” running the country. Harris dismissed these comments as ""mean-spirited"" but took the opportunity to steer the conversation in a positive direction. She emphasized the importance of women uplifting one another, saying, “I think it’s really important for women to lift each other up.”Her appearance on the podcast comes as Harris ramps up media outreach in the final month of her campaign against Donald Trump. The vice president’s campaign has been criticized for limited media appearances, but in the coming days, Harris is set to feature on a variety of high-profile programs, including CBS'Minutes, ABC's The View, The Late Show with Stephen Colbert, and The Howard Stern Show.While on the Call Her Daddy podcast, Harris and Cooper also delved into topics such as reproductive rights and Harris’s career as a prosecutor focusing on violence against women. Cooper, known for centering conversations around women’s empowerment, noted how crucial it was to discuss issues impacting women directly with the vice president, whose campaign has increasingly focused on reproductive rights and gender equality.","Kamala Harris responded to Sarah Huckabee Sanders' criticism that she lacks humility because she doesn't have children. The vice president spoke during an appearance on the Call Her Daddy podcast. She highlighted her ""modern family"" that includes her husband's ex-wife and their children.","https://static.toiimg.com/thumb/msid-113997318,imgsize-779055,width-400,resizemode-4/113997318.jpg"
"PTI member 'invites' Jaishankar to join protest, party distances itself",https://timesofindia.indiatimes.com/world/pakistan/pti-member-invites-jaishankar-to-join-protest-party-distances-itself/articleshow/113996387.cms,"30 PTI backers held in Lahore

PESHAWAR: Jailed ex-PM Imran Khan 's PTI has distanced itself from a party member's invitation to India's external affairs minister S Jaishankar to join its protest, asserting that no foreign country has a role in its political struggle.Party chairman Gohar Ali Khan said Saturday that remarks by Muhammad Ali Saif, an adviser on information to the CM of the PTI-governed Khyber Pakhtunkhwa , were taken out of context.Saif said the party plans to ""invite"" Jaishankar to join its protests in Peshawar, attracting backlash from the governing coalition.Khan said: ""No foreign dignitary, including from India, has been given an invitation to PTI to attend the protest. No foreign dignitary is allowed to make any comment on our internal matter."" Jaishankar will attend SCO-CHG meeting in Pakistan on Oct 15 and 16.Despite curfew-like situation in Lahore, around 30 supporters of Imran Khan's PTI, including lawyers, were arrested after they managed to reach historic Minar-e-Pakistan premises demanding release of the former prime minister. Lahore police said it also booked over 200 PTI leaders and workers, including Imran, under terrorism charges.","Party chairman Gohar Ali Khan said remarks by Muhammad Ali Saif, an adviser on information to the CM of the PTI-governed Khyber Pakhtunkhwa, were taken out of context. Saif said the party plans to ""invite"" Jaishankar to join its protests, attracting backlash from the governing coalition.","https://static.toiimg.com/thumb/msid-113996398,imgsize-275762,width-400,resizemode-4/113996398.jpg"
Royal Family News: King Charles misses 'darling boy' Harry but it is William who...,https://timesofindia.indiatimes.com/world/uk/king-charles-misses-darling-boy-harry-but-it-is-william-who-/articleshow/113916806.cms,"""With Prince Harry, it’s all an issue of trust,"" said Fordwich. ""Prince William is the most unlikely royal to ever forgive Harry for all his despicable indiscretions. He is now very much seen and accepted as the family enforcer, taking on the hard-line ruler role of his grandfather, Prince Philip. In this capacity, it’s widely known within the family that Prince William has laid down an absolute ban on Harry returning in any way, shape or form to his former royal family fold,"" Fordwich said.","""With Prince Harry, it’s all an issue of trust,"" said Fordwich. ""Prince William is the most unlikely royal to ever forgive Harry for all his despicable indiscretions,"" he said. ""He is now very much seen and accepted as the family enforcer,"" Fordwich said.","https://static.toiimg.com/thumb/msid-113916852,imgsize-963810,width-400,resizemode-4/113916852.jpg"
Will Kamala Harris's lead hold? US poll 'Nostradamus' says October surprise will ...,https://timesofindia.indiatimes.com/world/us/will-kamala-harriss-lead-hold-us-poll-nostradamus-says-october-surprise-will-/articleshow/113997881.cms,"In a razor-thin election race, political analyst Allan Lichtman , renowned for his accurate predictions, has asserted that the upcoming polls for the 2024 Presidential election will remain unaffected by the so-called "" October surprise .""Lichtman, co-founder of the ""13 Keys to the White House"" system, said, “One of the greatest myths of American politics is the October surprise.I have never changed my prediction in response to such events because the keys gauge the big picture of the incumbent government’s strength and don’t sway by campaign happenings.”Lichtman, who has forecasted the outcomes of nearly every US presidential election over the past fifty years— except the controversial 2000 election between George W. Bush and Al Gore—has confidently predicted that Kamala Harris will emerge victorious in 2024.Lichtman holds a Ph.D. from Harvard University, focusing on modern American history and quantitative methods. He is a distinguished professor at the American University in Washington, DC, and has authored 13 books alongside numerous academic articles.Since joining the race in late July, Harris has consistently led national polling averages against former President Donald Trump . Following a highly publicised debate in Pennsylvania on September 10, which attracted over 67 million viewers, Harris’s lead increased from 2.5 percentage points on the day of the debate to 3.3 points a week later. This gain was accompanied by a slight decline in Trump’s polling average, which fell by half a percentage point.While national polls can provide insights into candidate popularity, they may not be definitive indicators of election outcomes due to the US electoral college system. With 538 electoral votes up for grabs—requiring 270 for victory—most states tend to vote predictably along party lines, leaving only a handful of battleground states to ultimately decide the election.","Political analyst Allan Lichtman has asserted that the upcoming polls for the 2024 Presidential election will remain unaffected by the so-called "" October surprise.""Lichtman, who has forecasted the outcomes of nearly every US presidential election over the past fifty years, has confidently predicted that Kamala Harris will emerge victorious in 2024.","https://static.toiimg.com/thumb/msid-113998322,imgsize-58684,width-400,resizemode-4/113998322.jpg"
